사투리,표준어
취미 나는 좋아하는 게 사실 그렇게 즐기는 거는 많이 없거든.,취미 나는 좋아하는 게 사실 그렇게 즐기는 거는 많이 없거든.
근데 그나마 즐기는 거는 영화보는 거랑 뭐~ 여행 가는 거 그 정도고.,근데 그나마 즐기는 거는 영화보는 거랑 뭐~ 여행 가는 거 그 정도고.
뭐~ 일단 내 이야기 하기 전에 너는 어떤 취미 좋아해?,뭐~ 일단 내 이야기 하기 전에 너는 어떤 취미 좋아해?
일단 취미를 말한다면은 대표적으로 말할 수 있는 게 저는 크로스핏이에요 진짜.,일단 취미를 말한다면은 대표적으로 말할 수 있는 게 저는 크로스핏이에요 진짜.
살을 빼겠다고 시작하게 된 그~ 운동이 저한테는 되게 너무 약간 운명같은 만남이었어요 진짜 그~ 역동적이고 약간 제가 헬스를 되게 싫어해서,살을 빼겠다고 시작하게 된 그~ 운동이 저한테는 되게 너무 약간 운명같은 만남이었어요 진짜 그~ 역동적이고 약간 제가 헬스를 되게 싫어해서
헬스 빼고 뭐가 있지 하다 크로스핏을 선택하게 된 거란 말이에요 했는데 아~ 그게 너무 내 스타일인 거야 단기간에 팍 쉬고 빡 쉬고 빡 쉬고 이러니까 너무,헬스 빼고 뭐가 있지 하다 크로스핏을 선택하게 된 거란 말이에요 했는데 아~ 그게 너무 내 스타일인 거야 단기간에 팍 쉬고 빡 쉬고 빡 쉬고 이러니까 너무
그 시간만 이 악물고 끝나면 되는 거야 근데 살은 너무 잘 빠져 땀도 잘 흘리고 쾌감이 쩔어  오기도 생기고 자부심도 생기고,그 시간만 이 악물고 끝나면 되는 거야 근데 살은 너무 잘 빠져 땀도 잘 흘리고 쾌감이 쩔어  오기도 생기고 자부심도 생기고
그래서 약간 대표적으로 한다면 크로스핏이랑 그 다음에 이제 유산소 운동 되게 많이 좋아해요 뛰는 거 되게 좋아하거든요.,그래서 약간 대표적으로 한다면 크로스핏이랑 그 다음에 이제 유산소 운동 되게 많이 좋아해요 뛰는 거 되게 좋아하거든요.
그~ 대표적인 거 딱 두 가지고요 형은 취미 어떤 거 있어요?,그~ 대표적인 거 딱 두 가지고요 형은 취미 어떤 거 있어요?
나는 운동은 별로 안 좋아해 가지고 사실 운동을 그렇게 막 열심히 해 본 적은 없거든 운동 뭐~ 근데 스포츠를 하는 건,나는 운동은 별로 안 좋아해 가지고 사실 운동을 그렇게 막 열심히 해 본 적은 없거든 운동 뭐~ 근데 스포츠를 하는 건
예를 들어 내가 축구는 잘 못해 가지고 농구는 군대에서 많이 해 가지고 농구하는 거는 좋아하고.,예를 들어 내가 축구는 잘 못해 가지고 농구는 군대에서 많이 해 가지고 농구하는 거는 좋아하고.
배드민턴 이런 것도 배드민턴은 좀 좋아하기도 하고 어느 정도 해서 군대에서도 막,배드민턴 이런 것도 배드민턴은 좀 좋아하기도 하고 어느 정도 해서 군대에서도 막
축하도 받고 했고 그런 편이고 운동은 사실 그런 편이고 나는 좋아하는 게 영화 보는 거 좋아하거든 그래가지고,축하도 받고 했고 그런 편이고 운동은 사실 그런 편이고 나는 좋아하는 게 영화 보는 거 좋아하거든 그래가지고
사실 여자 친구 없을 때에는 맨날 내가 그~ 학교 다닐 때 공강 시간에 있잖아 공강시간 생기면 맨날 두 시간 생기면,사실 여자 친구 없을 때에는 맨날 내가 그~ 학교 다닐 때 공강 시간에 있잖아 공강시간 생기면 맨날 두 시간 생기면
우리 학교가 좋은 게 연극영화과가 유명하잖아  동국대가 그래서 바로 그~ 충무로역 바로 옆에 대한극장이라고 있어 그래서,우리 학교가 좋은 게 연극영화과가 유명하잖아  동국대가 그래서 바로 그~ 충무로역 바로 옆에 대한극장이라고 있어 그래서
거기가 그~ 우리 학교 학생은 영화를 육천원으로 할인해준단 말야 그래가지구 진짜 시간 나면 영화 보러 가고.,거기가 그~ 우리 학교 학생은 영화를 육천원으로 할인해준단 말야 그래가지구 진짜 시간 나면 영화 보러 가고.
그래서 내가 어떤 때는 진짜 그냥 개봉하면 무조건 다 봤어 그게 재미가 있든 재미가 없든 평점이 낮든 높든 그냥,그래서 내가 어떤 때는 진짜 그냥 개봉하면 무조건 다 봤어 그게 재미가 있든 재미가 없든 평점이 낮든 높든 그냥
어떤 뭐~ 재미없어도 그냥 가서 누워서 쉬기도 하고 그냥 가만히 앉아서 보기도 하고 그냥 난 그냥 그런 시간이 좋더라고.,어떤 뭐~ 재미없어도 그냥 가서 누워서 쉬기도 하고 그냥 가만히 앉아서 보기도 하고 그냥 난 그냥 그런 시간이 좋더라고.
그래서 나는 주로 뭐~ 혼자 혼자 있는 걸 좋아해서 책 보는 것도 그렇게 책 보는 거를 막 진짜 자주 읽지 않는데,그래서 나는 주로 뭐~ 혼자 혼자 있는 걸 좋아해서 책 보는 것도 그렇게 책 보는 거를 막 진짜 자주 읽지 않는데
그냥 그~ 혼자 있는 시간을 좋아해가지구 괜히 그런 거 좋아해 내가 카페 창이 넓은 데 있잖아 창이 넓은 데고 바깥을 보면서,그냥 그~ 혼자 있는 시간을 좋아해가지구 괜히 그런 거 좋아해 내가 카페 창이 넓은 데 있잖아 창이 넓은 데고 바깥을 보면서
그냥 괜히 책 보면서 앉아있는 거 바깥구경 사 하면서 그냥 앉아있는 거 그런 걸 좋아해가지고.,그냥 괜히 책 보면서 앉아있는 거 바깥구경 사 하면서 그냥 앉아있는 거 그런 걸 좋아해가지고.
그런 거를 여자친구 생기기 전까진 되게 많이 했던 거 같 그게 근데 여자친구가 생기고 나서는 아무래도,그런 거를 여자친구 생기기 전까진 되게 많이 했던 거 같 그게 근데 여자친구가 생기고 나서는 아무래도
그럴  기회나 시간이나 많이 없으니까 좀 요즘에 많이 못한 것도 있고 또 내가 또 돌아다니는 거도 좋아해가지고 여행도 많이 다녔단 말이야.,그럴  기회나 시간이나 많이 없으니까 좀 요즘에 많이 못한 것도 있고 또 내가 또 돌아다니는 거도 좋아해가지고 여행도 많이 다녔단 말이야.
여행을 국 뭐냐 그~ 국내에서는 제주도는 많이 못 가봤는데 여기 경기도나 뭐~ 충청도 강원도 전라도 이런 데는 되게 많이 가봤고.,여행을 국 뭐냐 그~ 국내에서는 제주도는 많이 못 가봤는데 여기 경기도나 뭐~ 충청도 강원도 전라도 이런 데는 되게 많이 가봤고.
해외는 그때 내가 재수 끝나고 였나 그~ 유럽을 한번 갔다 왔어 친구들하고 그게 사실 그 친구들한테 고마웠던 게 내가 그~,해외는 그때 내가 재수 끝나고 였나 그~ 유럽을 한번 갔다 왔어 친구들하고 그게 사실 그 친구들한테 고마웠던 게 내가 그~
뭐~ 사수를 하면서 연락을 다 끊었었는데 그래서 고향을 삼 사 년 동안 연락이 안 됐었단 말이야.,뭐~ 사수를 하면서 연락을 다 끊었었는데 그래서 고향을 삼 사 년 동안 연락이 안 됐었단 말이야.
근데 걔들이 먼저 자기들 유럽여행 가는데 너도 이제 수능 끝났으니까 같이 가자 이래 가지고 유럽 여행을 가게 된 거였거든.,근데 걔들이 먼저 자기들 유럽여행 가는데 너도 이제 수능 끝났으니까 같이 가자 이래 가지고 유럽 여행을 가게 된 거였거든.
근데 그때 이제 공부 계속하다가 유럽 그때 어디 갔냐면 프랑스랑 독일이랑 영국 이탈리아 하나가 체코 이렇게 갔었거든 근데,근데 그때 이제 공부 계속하다가 유럽 그때 어디 갔냐면 프랑스랑 독일이랑 영국 이탈리아 하나가 체코 이렇게 갔었거든 근데
그때 처음 비행기를 타기도 했었고 그리고 그때 한 달 정도 갔다 왔단 말야 어~ 근데 진짜 좋더라고 그냥 뭐가 좋았냐면,그때 처음 비행기를 타기도 했었고 그리고 그때 한 달 정도 갔다 왔단 말야 어~ 근데 진짜 좋더라고 그냥 뭐가 좋았냐면
뭔가 맨날 그~ 그때는 고시원에 살았으니까 고시원에 맨날 틀어박혀 살다가 뭔가 그~ 넓은 세상에 나온 느낌?,뭔가 맨날 그~ 그때는 고시원에 살았으니까 고시원에 맨날 틀어박혀 살다가 뭔가 그~ 넓은 세상에 나온 느낌?
그런 게 너무 좋아가지고 그~ 유럽여행 이후로 일본도 갔다 오고 그 다음에,그런 게 너무 좋아가지고 그~ 유럽여행 이후로 일본도 갔다 오고 그 다음에
뭐~ 동남아권은 많이 못 갔는데 동남아는 별로 내가 그렇게 여행을 좋아하지 그 쪽은 별로 좋아하지 않아서 많이 못 갔고.,뭐~ 동남아권은 많이 못 갔는데 동남아는 별로 내가 그렇게 여행을 좋아하지 그 쪽은 별로 좋아하지 않아서 많이 못 갔고.
또 일본도 사실 일본 그~ 안 좋은 그런 게 생기기 전에는 생기기 전에 갔다 왔었거든 그것도 친구랑 갔다 왔었는데,또 일본도 사실 일본 그~ 안 좋은 그런 게 생기기 전에는 생기기 전에 갔다 왔었거든 그것도 친구랑 갔다 왔었는데
또 도쿄에 뭐~ 맛집 다니고 친구랑 그러고 볼거리 보러 다니고 나는 그냥 그러는 걸 좋아하는 것 같애 너는 뭐~ 따른 크로스핏 말고 좋아하는 거 있어?,또 도쿄에 뭐~ 맛집 다니고 친구랑 그리고 볼거리 보러 다니고 나는 그냥 그러는 걸 좋아하는 것 같애 너는 뭐~ 다른 크로스핏 말고 좋아하는 거 있어?
글쎄요 일단 제가 몸을 쓰는 걸 워낙 좋아해서 걔네들을 뺀다면은 이게 엄청 폭이 좁아질 거 같애요 솔직히 말해서.,글쎄요 일단 제가 몸을 쓰는 걸 워낙 좋아해서 걔네들을 뺀다면은 이게 엄청 폭이 좁아질 거 같애요 솔직히 말해서.
근데 있다 굳이 말한다면 되게 뜬금없 저는 저도 책 읽기를 좀 좋아하거든요 제가 올해 들어서 제일 많이 읽었어요 지금까지 아홉 권 읽었거든요?,근데 있다 굳이 말한다면 되게 뜬금없 저는 저도 책 읽기를 좀 좋아하거든요 제가 올해 들어서 제일 많이 읽었어요 지금까지 아홉 권 읽었거든요?
그전에는 거의 한 삼 년에 한 권 아~ 반 페이지도 안 읽었어요 그냥 그러다가 약간 심적으로 고생을 많이 하니까 그냥 책을 읽게 되더라구요 그냥 한번 읽어보자 이래서,그전에는 거의 한 삼 년에 한 권 아~ 반 페이지도 안 읽었어요 그냥 그러다가 약간 심적으로 고생을 많이 하니까 그냥 책을 읽게 되더라구요 그냥 한번 읽어보자 이래서
눈에 가는 거라도 읽어보자 그렇게 읽다가 이제 어느 순간 책을 좀 틈틈이 읽게 되더라고요 그 순간은 되게 약간 좀 해방된 느낌이 있었어요 그 순간만큼은.,눈에 가는 거라도 읽어보자 그렇게 읽다가 이제 어느 순간 책을 좀 틈틈이 읽게 되더라고요 그 순간은 되게 약간 좀 해방된 느낌이 있었어요 그 순간만큼은.
책읽기 그러니까 책 읽는 거랑 그 다음에 그런 다음에 아~ 야경 사진 찍기 되게 좋아해요 야경 진짜 좋아해요 야경 덕후예요 그냥.,책읽기 그러니까 책 읽는 거랑 그 다음에 그런 다음에 아~ 야경 사진 찍기 되게 좋아해요 야경 진짜 좋아해요 야경 덕후예요 그냥.
야경 사진만 봐도 여가 어디인지 알아요 그냥 아~ 이거 대구 수성구구나 이러면서 하니까 어~ 니 이거 어예 알았는데 이 건물이 수성구에 있잖아.,야경 사진만 봐도 여기가 어디인지 알아요 그냥 아~ 이거 대구 수성구구나 이러면서 하니까 어~ 너 이거 어떻게 알았는데 이 건물이 수성구에 있잖아.
이 맞네 찐이네 이러면서 그런 것들이 있고 이게 또 전공이 그림이다 보니까 가끔씩 이제 그림 그리는 거 이렇게 세 가지로 밖에 안 나와질 것 같애요.,이 맞네 찐이네 이러면서 그런 것들이 있고 이게 또 전공이 그림이다 보니까 가끔씩 이제 그림 그리는 거 이렇게 세 가지로 밖에 안 나와질 것 같애요.
그림 그리는 거 사실 좋아한다기보다는 그냥 그리워서 할 줄 알아서 그냥 가끔 생각날 때 하는거라 좀 취미라고 말이 힘들 것 같고.,그림 그리는 거 사실 좋아한다기보다는 그냥 그리워서 할 줄 알아서 그냥 가끔 생각날 때 하는거라 좀 취미라고 말이 힘들 것 같고.
그냥 있다면 책 읽고 그냥 야경 사진 찍기인 거 같아요 저도 돌아다니는 거 워낙 좋아해가지고.,그냥 있다면 책 읽고 그냥 야경 사진 찍기인 거 같아요 저도 돌아다니는 거 워낙 좋아해가지고.
근데 서울에 올라와서 좀 바쁘다 보니까 사실 가장 실천하지 못했던 게 방금 말한 야경 사진 찍긴 거 같애요.,근데 서울에 올라와서 좀 바쁘다 보니까 사실 가장 실천하지 못했던 게 방금 말한 야경 사진 찍긴 거 같애요.
난 서울 오면은 진짜 그럴 줄 알았거든요 돈 벌고 성우도 준비하고 이래가지고 어~,난 서울 오면은 진짜 그럴 줄 알았거든요 돈 벌고 성우도 준비하고 이래가지고 어~
밤마다 이제 시간 날 때마다 이제 사진 찍으러 다녀야지 와 그럴 시간이 진짜 일도 없어요.,밤마다 이제 시간 날 때마다 이제 사진 찍으러 다녀야지 와 그럴 시간이 진짜 일도 없어요.
여자친구가 호출해요 가야 돼요 가면 술 먹고 눈 뜨면 집이에요 없어요 일 년 반복되니까 벌써 순삭 뚝딱이에요 그냥.,여자친구가 호출해요 가야 돼요 가면 술 먹고 눈 뜨면 집이에요 없어요 일 년 반복되니까 벌써 순삭 뚝딱이에요 그냥.
그냥 좀 하고 싶은데 이것도 약간 여자친구랑 맞지 않는 게 여자친구 취미가 저랑 영 반대거든요 진짜 저는 역동적이고 활발한 거 저는 .,그냥 좀 하고 싶은데 이것도 약간 여자친구랑 맞지 않는 게 여자친구 취미가 저랑 영 반대거든요 진짜 저는 역동적이고 활발한 거 저는 .
그러니까 되게 활동적인 걸 되게 좋아한다면 여자친구는 그 반대예요 가만히 짱 박힌 거 진짜 좋아한단 말이에요.,그러니까 되게 활동적인 걸 되게 좋아한다면 여자친구는 그 반대예요 가만히 짱 박힌 거 진짜 좋아한단 말이에요.
가만히 짱 박혀서 뭐~ 메이플 한다라든지 아니면은 같이 책 읽 책 읽기까지는 공통되니까 해요 딱 어디 나가는 걸 별로 안 좋아해요.,가만히 짱 박혀서 뭐~ 메이플 한다라든지 아니면은 같이 책 읽 책 읽기까지는 공통되니까 해요 딱 어디 나가는 걸 별로 안 좋아해요.
그러니까 내가 취미 할려면 여자친구 두고 가야 돼 약간 이런 느낌이야 그래서 제가 하고 싶었던 취미를 거의 못 했어요.,그러니까 내가 취미 할려면 여자친구 두고 가야 돼 약간 이런 느낌이야 그래서 제가 하고 싶었던 취미를 거의 못 했어요.
또 서울에 올라가서 사실상 제가 약간 싹싹한 게 좀 어렸을 때 운동부를 해서 그런가 모르겠는데,또 서울에 올라가서 사실상 제가 약간 싹싹한 게 좀 어렸을 때 운동부를 해서 그런가 모르겠는데
이게 운동부로 생활을 많이 하다 보니까 윗사람들한테 되게 싹싹하게 되게 잘한단 말이에요.,이게 운동부로 생활을 많이 하다 보니까 윗사람들한테 되게 싹싹하게 되게 잘한단 말이에요.
또래들보다 더 편할 때도 있고 이제 그렇다보니까 이제 친구가 없어요 사실상 말하면.,또래들보다 더 편할 때도 있고 이제 그렇다보니까 이제 친구가 없어요 사실상 말하면.
같이 취미를 할 친구가 없으니까 더 외로운 느낌이 있어요.,같이 취미를 할 친구가 없으니까 더 외로운 느낌이 있어요.
그래서 약간 취미란 단어에 좀 생각이 좀 많아지는 것 같애요 그래도 이제 운동이면 그러니까,그래서 약간 취미란 단어에 좀 생각이 좀 많아지는 것 같애요 그래도 이제 운동이면 그러니까
같이 성우 공부하는 형들은 그래도 운동 다 좋아하고 다 부사관 출신이고 하니까 그때 이제 그나마 좀 할 수 있는 취미가 약간 크로스핏밖에 없어서,같이 성우 공부하는 형들은 그래도 운동 다 좋아하고 다 부사관 출신이고 하니까 그때 이제 그나마 좀 할 수 있는 취미가 약간 크로스핏밖에 없어서
이거 밖에 말 못할 것 같애요 솔직히 암튼 뭐~ 그렇습니다 취미라 빨리 하고 싶네요 요즘 코로나 때문에 지금.,이거 밖에 말 못할 것 같애요 솔직히 암튼 뭐~ 그렇습니다 취미라 빨리 하고 싶네요 요즘 코로나 때문에 지금.
다 문 닫아가지고 지금 뭐~ 할 수도 없고 밖에 나가서 뛰는 것도 눈치 보이고 솔직히 그죠 막 없어요.,다 문 닫아가지고 지금 뭐~ 할 수도 없고 밖에 나가서 뛰는 것도 눈치 보이고 솔직히 그죠 막 없어요.
지금 내가 할 수 있는 건 없어 차라리 형이 할 수 있는 게 더 많은 거 같.,지금 내가 할 수 있는 건 없어 차라리 형이 할 수 있는 게 더 많은 거 같.
그~ 영화 그러면 일단은 돌아다니고 영화 보는 걸 되게 좋아한다고 하셨잖아요 그러면 그게 취미가,그~ 영화 그러면 일단은 돌아다니고 영화 보는 걸 되게 좋아한다고 하셨잖아요 그러면 그게 취미가
된 거죠 어쩌다가 아니 그러니까 처음부터 취미였어요 아니면 그렇게 하다 보니까 취미가 된 거예요?,된 거죠 어쩌다가 아니 그러니까 처음부터 취미였어요 아니면 그렇게 하다 보니까 취미가 된 거예요?
영화를 이제 처음에는 나도 집에 있는 거를 좋아해 가지고 요즘에는 집에서 뭐~ 넷플릭스나 이런 거 많잖아?,영화를 이제 처음에는 나도 집에 있는 거를 좋아해 가지고 요즘에는 집에서 뭐~ 넷플릭스나 이런 거 많잖아?
그런 거를 보는 걸 좋아하다 보니 뭔가 어느 순간 지겨워진 거지 내가 왜 집에서 이러고 있나 있나?,그런 거를 보는 걸 좋아하다 보니 뭔가 어느 순간 지겨워진 거지 내가 왜 집에서 이러고 있나 있어?
어느 순간 그러니까 지겨워졌던 거 같애 그러다보니 나가게 됐고 근데 나가게 막상 나가보면 또 할 게 없거든 사실.,어느 순간 그러니까 지겨워졌던 거 같애 그러다보니 나가게 됐고 근데 나가게 막상 나가보면 또 할 게 없거든 사실.
혼자 나가서 할 수 있는 게 딱히 많이 없어 그래가지고 내가 그냥 찾다가 보니 영화를 보게 됐.,혼자 나가서 할 수 있는 게 딱히 많이 없어 그래가지고 내가 그냥 찾다가 보니 영화를 보게 됐.
사실 영화를 그때까 그전까지는 영화를 둘이서 볼 생각만 했지 혼자 볼 생각은 잘 못했단 말야 그래가지고,사실 영화를 그때까 그전까지는 영화를 둘이서 볼 생각만 했지 혼자 볼 생각은 잘 못했단 말야 그래가지고
그래서 잘 뭐~ 안 가다가 어느 날 영화 한번 보자 그래서 영화 혼자 봤는데 너무 편한 거야 혼자 보는 영화가 너무 편하더라고.,그래서 잘 뭐~ 안 가다가 어느 날 영화 한번 보자 그래서 영화 혼자 봤는데 너무 편한 거야 혼자 보는 영화가 너무 편하더라고.
그냥 내가 영화를 항상 혼자 볼 때는 맨 뒷자리를 잡아 맨 뒷자리를 잡아서,그냥 내가 영화를 항상 혼자 볼 때는 맨 뒷자리를 잡아 맨 뒷자리를 잡아서
그냥 휴대폰도 맨 뒷자리 휴대폰 내가 보고 싶을 때 봐도 상관없거든 뒤에 사람 뭐~ 또 불 비쳐도 상관 없으니까.,그냥 휴대폰도 맨 뒷자리 휴대폰 내가 보고 싶을 때 봐도 상관없거든 뒤에 사람 뭐~ 또 불 비쳐도 상관 없으니까.
그래서 혼자 영화 보고 뭐~ 재미없으면 그냥 휴대폰 보다가 그러고 또 거기에 또 혼자 나와서 하는 게,그래서 혼자 영화 보고 뭐~ 재미없으면 그냥 휴대폰 보다가 그리고 또 거기에 또 혼자 나와서 하는 게
항상 카페를 가서 책 한 권 들고 와서 아까 말했듯이 창 밖에 보면서 사람 구경하는.,항상 카페를 가서 책 한 권 들고 와서 아까 말했듯이 창 밖에 보면서 사람 구경하는.
나는 어느 순간부터 계속 하다보니까 그게 좋아진 거 같애.,나는 어느 순간부터 계속 하다보니까 그게 좋아진 거 같애.
그러고 뭐~ 내가 제일 뭐~ 여행했 하면서 제일 좋았던 거는 물론 뭐~ 해외여행도 좋았지만,그리고 뭐~ 내가 제일 뭐~ 여행했 하면서 제일 좋았던 거는 물론 뭐~ 해외여행도 좋았지만
내가 군대 만약에  군대 전역하기 그때가 한 달 전 쯤이었나 휴가 나와가지고 뭔가 전역하고 뭘 해야 될지가 되게 막막한 거야 그래가지구,내가 군대 만약에  군대 전역하기 그때가 한 달 전 쯤이었나 휴가 나와가지고 뭔가 전역하고 뭘 해야 될지가 되게 막막한 거야 그래가지구
여행을 갔는 게 저기 강원도에 절을 갔어 템플 스테이 그거를 그러고 내가 학교가 그~ 불교 학교여서 뭐~ 그런 것도 있었지만,여행을 갔는 게 저기 강원도에 절을 갔어 템플 스테이 그거를 그리고 내가 학교가 그~ 불교 학교여서 뭐~ 그런 것도 있었지만
사실 내가 종교가 무교거든 나는 불교를 딱히 믿는 건 아닌데 그냥 뭔가 혼자 조용한 데 있어  있어 보고 싶어가지고,사실 내가 종교가 무교거든 나는 불교를 딱히 믿는 건 아닌데 그냥 뭔가 혼자 조용한 데 있어  있어 보고 싶어가지고
그냥 혼자 템플 스테이를 한번 갔었어 근데 사실 별 생각없이 갔는 거였는데 그때 기억이 나는 진짜 좋았던 게,그냥 혼자 템플 스테이를 한번 갔었어 근데 사실 별 생각없이 갔는 거였는데 그때 기억이 나는 진짜 좋았던 게
그때도 진짜 아무것도 안 들고 가고 일 박 이 일이었는데 그냥 책 한 권 들고 가고 뭐~ 옷도 옷도 그냥 뭐~ 딱히 안 가져가고.,그때도 진짜 아무것도 안 들고 가고 일 박 이 일이었는데 그냥 책 한 권 들고 가고 뭐~ 옷도 옷도 그냥 뭐~ 딱히 안 가져가고.
가방 조그만 가방 하나에 책 하나 넣고 휴대폰만 들고 갔단 말야 그게 강원도 뭐~ 낙산사였는데,가방 조그만 가방 하나에 책 하나 넣고 휴대폰만 들고 갔단 말야 그게 강원도 뭐~ 낙산사였는데
진짜 휴대폰도 그때는 그~ 템플스테이에 가면 다 맡겨야 된단 말이야 그래서 맡기고 혼자 일 박 이 일동안 가만히 앉아서,진짜 휴대폰도 그때는 그~ 템플스테이에 가면 다 맡겨야 된단 말이야 그래서 맡기고 혼자 일 박 이 일동안 가만히 앉아서
조용한데 진짜 새 소리밖에 안 들리고 바람 소리밖에 안 들려 그런데 산책하면서 밤에는 무조건 아홉 시까지 자야 된단 말야.,조용한데 진짜 새 소리밖에 안 들리고 바람 소리밖에 안 들려 그런데 산책하면서 밤에는 무조건 아홉 시까지 자야 된단 말야.
사실 그~ 잠 안 오잖아 그래서 한두세 시간 동안 눈 뜨고 생각하고 다음에 뭐~ 아침에 새벽에 일어나가지고 한 바퀴 돌고,사실 그~ 잠 안 오잖아 그래서 한두세 시간 동안 눈 뜨고 생각하고 다음에 뭐~ 아침에 새벽에 일어나가지고 한 바퀴 돌고
그게 진짜 별 거 아니었는데 그~ 별 거 아닌 게 제일 기억에 남더라고 난 그래서 나는 그~ 여행이 난 제일 기억에 남는 것 같애.,그게 진짜 별 거 아니었는데 그~ 별 거 아닌 게 제일 기억에 남더라고 난 그래서 나는 그~ 여행이 난 제일 기억에 남는 것 같애.
혹시 여행에서 뭐~ 여행 가본 데 중에 좋은 뭐~ 기억에 남는 데 있어?,혹시 여행에서 뭐~ 여행 가본 데 중에 좋은 뭐~ 기억에 남는 데 있어?
글쎄요 일단 제가 취미가 여행이 아니다 보니까 여자 친구를,글쎄요 일단 제가 취미가 여행이 아니다 보니까 여자 친구를
그러니까 여자친구 만나고 여행을 처음 가봤단 말이야 솔직히 여행이라는 개념으로 간 건 처음이었는데,그러니까 여자친구 만나고 여행을 처음 가봤단 말이야 솔직히 여행이라는 개념으로 간 건 처음이었는데
사실 갈 때마다 다 인상 깊어요 솔직히 말해서 굳이 약간 두 개를 꼽아도 돼요 그러니까 좀 인상깊은 게 너무 많단 말이에요.,사실 갈 때마다 다 인상 깊어요 솔직히 말해서 굳이 약간 두 개를 꼽아도 돼요 그러니까 좀 인상깊은 게 너무 많단 말이에요.
