사투리,표준어
애들이 어~ 진짜 그런 거 보니까 아~ 회사 가서 애들이 참 고생하는구나 싶기도 하고,애들이 어~ 진짜 그런 거 보니까 아~ 회사 가서 애들이 참 고생하는구나 싶기도 하고
아휴 걱정이 되네 진짜 나는 이제 학교,아휴 걱정이 되네 진짜 나는 이제 학교
학교 얘기도 잠깐 하면 학교에서는 근데 막,학교 얘기도 잠깐 하면 학교에서는 근데 막
딱히 학 늦게 들어와 가지고 학교를,딱히 학 늦게 들어와 가지고 학교를
그렇게 학교생활을 잘 안 했단 말야 그래서 동기들하고도,그렇게 학교생활을 잘 안 했단 말야 그래서 동기들하고도
뭐~ 연락도 잘 안 하고 내가 학교를 워낙 늦게 들어가니까 처음에 뭐~ 엠티나 그런 거 하잖아.,뭐~ 연락도 잘 안 하고 내가 학교를 워낙 늦게 들어가니까 처음에 뭐~ 엠티나 그런 거 하잖아.
근데 그런 것도 괜히 내가 나이가 많다는 많고 뭔가,근데 그런 것도 괜히 내가 나이가 많다는 많고 뭔가
못 어울릴 것 같은 그런 느낌 때문에 처음에 어~ 참여를 안 했고 그리고,못 어울릴 것 같은 그런 느낌 때문에 처음에 어~ 참여를 안 했고 그리고
또 하필 그때가 그~ 여자친구 집착 심한 여자 친구가 있을 때여서 그것 때문에 못 간 이유도 있었고.,또 하필 그때가 그~ 여자친구 집착 심한 여자 친구가 있을 때여서 그것 때문에 못 간 이유도 있었고.
