사투리,표준어
근데 스케이트 막 타다가,근데 스케이트 막 타다가
땅 내려오면은,땅 내려오면은
느낌이 이상하지 않더나?,느낌이 이상하지 않았니?
되게 걷기 어려웠던 걸로 기억하는데 넌 어때?,되게 걷기 어려웠던 걸로 기억하는데 넌 어때?
나는 그걸 타는 게 꽤나 옛날에 타가지고,나는 그걸 타는 게 꽤나 옛날에 타가지고
그걸 탔을 때 막 그렇게 어려웠나 라는 생각이 솔직히 잘 안 난다.,그걸 탔을 때 막 그렇게 어려웠나 라는 생각이 솔직히 잘 안 난다.
그래서 설명해주기가 좀 그렇긴 하네.,그래서 설명해주기가 좀 그렇긴 하네.
그래도 아마도 니가 그렇게 느꼈다면 나도 그렇게 느끼지 않았을까 뭐~ 그런 생각이 드네.,그래도 아마도 너가 그렇게 느꼈다면 나도 그렇게 느끼지 않았을까 뭐~ 그런 생각이 드네.
우리 다음에 코로나가 끝나면,우리 다음에 코로나가 끝나면
같이 아이스 스케이트를 겨울에 타러 가볼래?,같이 아이스 스케이트를 겨울에 타러 가볼래?
나는 항상 그거를 겨울에,나는 항상 그거를 겨울에
한번 한번 타본 적이 없거든 항상 여름에 타봤지,한번 한번 타본 적이 없거든 항상 여름에 타봤지
뭔가 느낌은 겨울 스포츠인데,뭔가 느낌은 겨울 스포츠인데
여름에만 타니까,여름에만 타니까
좋기도 좋았는데,좋기도 좋았는데
좀 색다르게 이번에는 겨울도 한번 타보고 싶은 느낌이 든다.,좀 색다르게 이번에는 겨울도 한번 타보고 싶은 느낌이 든다.
다음에 같이 코로나가 끝나면 겨울 스포츠로 아이스 스케이트 한번 타러 가볼래?,다음에 같이 코로나가 끝나면 겨울 스포츠로 아이스 스케이트 한번 타러 가볼래?
아니면 같이,아니면 같이
스키를 타보러 가던가.,스키를 타보러 가던가.
나는 완전 좋지.,나는 완전 좋지.
안 그래도 그런 스키나 스케이트를 초등학생 때를 마지막으로,안 그래도 그런 스키나 스케이트를 초등학생 때를 마지막으로
나이 먹고 나서는 한번도 타본 적이 없어가지구,나이 먹고 나서는 한번도 타본 적이 없어가지구
다시 타보고 싶다라는 생각이 계속 있었는데,다시 타보고 싶다라는 생각이 계속 있었는데
코로나 끝나고 다시 안전해지면은,코로나 끝나고 다시 안전해지면은
가는 거 굳이 거절할 필요가 없지.,가는 거 굳이 거절할 필요가 없지.
나는 그리고,나는 그리고
여름에,여름에
퐁퐁.,퐁퐁.
타면은 야외 퐁퐁이 학교 근처에 있었거든?,타면은 야외 퐁퐁이 학교 근처에 있었거든?
그래서 야외니까 햇빛을 받잖아.,그래서 야외니까 햇빛을 받잖아.
그래서 그~ 뜨거워진 퐁퐁을 밟으면서 높이 뛰는 걸 되게 좋아 했어가지구,그래서 그~ 뜨거워진 퐁퐁을 밟으면서 높이 뛰는 걸 되게 좋아 했어가지구
다시 퐁퐁을 타고 싶은데,다시 퐁퐁을 타고 싶은데
이제는 퐁퐁 하는 데가 없어지기도 했고,이제는 퐁퐁 하는 데가 없어지기도 했고
어른은 안 받아 주니까 다시 못 타서 슬퍼.,어른은 안 받아 주니까 다시 못 타서 슬퍼.
나도 퐁퐁을 많이 탔었는데 그거는 다 어린 애들만 탈 수 있게 해놔서,나도 퐁퐁을 많이 탔었는데 그거는 다 어린 애들만 탈 수 있게 해놔서
나도 참 안타깝다는 생각이 많이 들었어.,나도 참 안타깝다는 생각이 많이 들었어.
그것도 참 추억이다 얘.,그것도 참 추억이다 얘.
참 이렇게 봄 여름 가을 겨울에 대해서 이야기해 보니까,참 이렇게 봄 여름 가을 겨울에 대해서 이야기해 보니까
평소에는 전혀 이야기 해보지 않았던 것에 대해서,평소에는 전혀 이야기 해보지 않았던 것에 대해서
이야기가 하게 되어서 참 좋은 거 같네.,이야기가 하게 되어서 참 좋은 거 같네.
너는 어떻게 생각해?,너는 어떻게 생각해?
확실히 계절을 테마로 잡고 얘기를 하니까,확실히 계절을 테마로 잡고 얘기를 하니까
평소에 안 했던 얘기들이,평소에 안 했던 얘기들이
처음 듣는 얘기들이 나오는 것 같아서 새롭고 좋네.,처음 듣는 얘기들이 나오는 것 같아서 새롭고 좋네.
맞지 우리가 보통 이야기 주제를 계절로는 하지 않잖아.,맞지 우리가 보통 이야기 주제를 계절로는 하지 않잖아.
근데 이렇게 계절에 대해서 이야기 해보니까,근데 이렇게 계절에 대해서 이야기 해보니까
우리의 이야기들을 좀 더 풍요롭게 할 수 있다는 점에서,우리의 이야기들을 좀 더 풍요롭게 할 수 있다는 점에서
나는 되게 재미있게 느껴진다.,나는 되게 재미있게 느껴진다.
@이름아 다음에도 이렇게 이런 이야기들을 할 수 있는 기회가 있으면,@이름아 다음에도 이렇게 이런 이야기들을 할 수 있는 기회가 있으면
참 좋을 것 같네.,참 좋을 것 같네.
너는 그런 생각이 안 드나?,너는 그런 생각이 안 드니?
나도,나도
그렇게 생각해.,그렇게 생각해.
맨날 하는 뻔한 이야기들 말고 색다른 주제를 잡아가지고,맨날 하는 뻔한 이야기들 말고 색다른 주제를 잡아가지고
얘기를 하니까 머리도 돌아가고,얘기를 하니까 머리도 돌아가고
재밌는 얘기가 나오고 좋은 거 같애.,재밌는 얘기가 나오고 좋은 거 같애.
맞제 나도 이렇게 원하지 않게 봄 여름 가을 겨울에 대해서 이야기 해대니까,맞지 나도 이렇게 원하지 않게 봄 여름 가을 겨울에 대해서 이야기 해대니까
참 즐거웠던 것 같네.,참 즐거웠던 것 같네.
참 이렇게 좋은 이야기들을 해대는 게,참 이렇게 좋은 이야기들을 해대는 게
난 참 행복이라 생각한다.,난 참 행복이라 생각한다.
우리 다음에도 이렇게 봄 여름 가을 겨울에 대해서 이야기 할수 있는 기회가 있으면 참 좋겠네.,우리 다음에도 이렇게 봄 여름 가을 겨울에 대해서 이야기 할수 있는 기회가 있으면 참 좋겠네.
기회야 우리가 만들면 되는 거고,기회야 우리가 만들면 되는 거고
언제든지 나는 어떤 주제든 환영이니까는,언제든지 나는 어떤 주제든 환영이니까는
편하게 얘기해줘.,편하게 얘기해줘.
그래.,그래.
그러면 너는 내년 봄에는 어떤 걸 할 생각이야?,그러면 너는 내년 봄에는 어떤 걸 할 생각이야?
내년 봄에 일단 우리가 대학을 들어가 있겠지?,내년 봄에 일단 우리가 대학을 들어가 있겠지?
나는 아직 내가 어떤 대학을 가게 될지 모르겠지만,나는 아직 내가 어떤 대학을 가게 될지 모르겠지만
우리가 다녔던 고등학교처럼,우리가 다녔던 고등학교처럼
봄에 벚꽃이 많이 피는 학교였으면 좋겠어.,봄에 벚꽃이 많이 피는 학교였으면 좋겠어.
나도 그랬으면 참 좋겠네.,나도 그랬으면 참 좋겠네.
