사투리,표준어
그래서 그때부터 쪼금,그래서 그때부터 쪼금
저도 진짜 약간 주도적으로 이렇게,저도 진짜 약간 주도적으로 이렇게
뭐~ 계획 같은 거 세워가지고 공부를 쫌 했던 거 같애요.,뭐~ 계획 같은 거 세워가지고 공부를 조금 했던 거 같애요.
어떠셨어요 공부하실 때 스타일이 어떤 스타일이세요?,어떠셨어요 공부하실 때 스타일이 어떤 스타일이세요?
노트 정리를 쫌 많이 하는 편이거든요 노트 정리 이렇게 쫌 예쁘게 하면,노트 정리를 조금 많이 하는 편이거든요 노트 정리 이렇게 조금 예쁘게 하면
뭔가 걍 더 하고 싶고 뭔가 쫌 더 열심히 하고 싶고 약간 그런 마음 들어가지 노트 정리하고,뭔가 그냥 더 하고 싶고 뭔가 조금 더 열심히 하고 싶고 약간 그런 마음 들어가지 노트 정리하고
이제 몇 회독 이런 거 할 때도,이제 몇 회독 이런 거 할 때도
다 노트 정리 기반으로 제가 한 노트정리 한 그거 기반으로 뭐~,다 노트 정리 기반으로 제가 한 노트정리 한 그거 기반으로 뭐~
이회독 삼회독 하면서 공부를 하거든요.,이회독 삼회독 하면서 공부를 하거든요.
노트 따로 정리하시면서.,노트 따로 정리하시면서.
아~ 근데 사람마다 스타일이 다른 게,아~ 근데 사람마다 스타일이 다른 게
노트 정리하기 싫어하고 계속 그냥 책보면서 외우고 하는 사람들은,노트 정리하기 싫어하고 계속 그냥 책보면서 외우고 하는 사람들은
노트 정리 이런 거 안 해도 잘하는 사람들도 많거든요.,노트 정리 이런 거 안 해도 잘하는 사람들도 많거든요.
그거는 그냥 진짜 자기 방법을 찾는 게 중요한 거 같애요.,그거는 그냥 진짜 자기 방법을 찾는 게 중요한 거 같애요.
하루에 공부 제일 오래 해 본 건 어느 정도 해보셨어요?,하루에 공부 제일 오래 해 본 건 어느 정도 해보셨어요?
글쎄요 한.,글쎄요 한.
몇 시간이요.,몇 시간이요.
스무 시간이요.,스무 시간이요.
시험 기간 때 제가 시험 기간 때는,시험 기간 때 제가 시험 기간 때는
계속 놀다가 한번 몰아서 한 적 있었단 말이에요.,계속 놀다가 한번 몰아서 한 적 있었단 말이에요.
그래가지고 그때 그~ 다음 날 바로 전공 시험인데,그래가지고 그때 그~ 다음 날 바로 전공 시험인데
그 전날부터 공부를 시작했어요.,그 전날부터 공부를 시작했어요.
그래서 그냥 어쩔 수 없었죠 그거는 방법이 없었죠 급하니까,그래서 그냥 어쩔 수 없었죠 그거는 방법이 없었죠 급하니까
그냥 스무 시간 정도 하게 되더라고 그래서 그때 밤 새서,그냥 스무 시간 정도 하게 되더라고 그래서 그때 밤 새서
다행히 그때 시험이 전공 시험이,다행히 그때 시험이 전공 시험이
오전 시험이라서 하고 그냥 바로 시험 치러 들어가서.,오전 시험이라서 하고 그냥 바로 시험 치러 들어가서.
스무 시간 그럼 하루하루 스무 시간 하신 거네요.,스무 시간 그럼 하루하루 스무 시간 하신 거네요.
그쵸 하루하루 동안.,그렇죠 하루하루 동안.
대단하시네요 근데.,대단하시네요 근데.
마음이 급하면 하게 되는 거 같애요.,마음이 급하면 하게 되는 거 같애요.
저도 저는 하루에 스무 시간까지는 안 해 본 거 같은데,저도 저는 하루에 스무 시간까지는 안 해 본 거 같은데
저는 까 쫌 길게,저는 까 조금 길게
길게라기보다 한 사 개월 오 개월 정도 해가지고 하루에,길게라기보다 한 사 개월 오 개월 정도 해가지고 하루에
열두시간씩 계속했거든요.,열두시간씩 계속했거든요.
그거 그게 진짜 정말 대단하신 거 같애요 저는 그렇게 못 하거든요.,그거 그게 진짜 정말 대단하신 거 같애요 저는 그렇게 못 하거든요.
사실 저도 못 하겠더라고요.,사실 저도 못 하겠더라고요.
그~ 진짜 다시는 안 한다고 생각하고,그~ 진짜 다시는 안 한다고 생각하고
억지로 억지로 하긴 했거든요.,억지로 억지로 하긴 했거든요.
근데 그~ 아침에 일어나서,근데 그~ 아침에 일어나서
공부하다가 자는 거죠 근데 그~ 그 생활을,공부하다가 자는 거죠 근데 그~ 그 생활을
고등학교 때도 뭐~ 많이 하잖아요.,고등학교 때도 뭐~ 많이 하잖아요.
근데 이게 또 어른 어른 돼가지고 하니까 또 확실히 느낌도,근데 이게 또 어른 어른 돼가지고 하니까 또 확실히 느낌도
느낌이 좀 다르긴 하더라고요.,느낌이 좀 다르긴 하더라고요.
근데 제가 잔 생각하기에 고등학교 때랑 다른 거는,근데 제가 잔 생각하기에 고등학교 때랑 다른 거는
고등학생 때는 이제,고등학생 때는 이제
부모님이 깨워주셔서 이제 학교 가서 거기서 선생님들이 이끌어주고,부모님이 깨워주셔서 이제 학교 가서 거기서 선생님들이 이끌어주고
이제 옆에 친구들도 같이하고 이제 친구들이랑,이제 옆에 친구들도 같이하고 이제 친구들이랑
가능한 건데 지금 같은 경우에는 제가 스스로 딱 일어나서,가능한 건데 지금 같은 경우에는 제가 스스로 딱 일어나서
책상에 앉고,책상에 앉고
딴 짓 이제 폰 옆에 할 수 있는데,다른 짓 이제 폰 옆에 할 수 있는데
꾹 참고 안 하고 공부를 해야 되는 거는 진짜 너무 힘든 거 같애요.,꾹 참고 안 하고 공부를 해야 되는 거는 진짜 너무 힘든 거 같애요.
그~ 그걸 진짜 정확하게 아시네요 근데.,그~ 그걸 진짜 정확하게 아시네요 근데.
그쵸 저도 준비.,그렇죠 저도 준비.
지금은 그면 공부 계속하시는 거에.,지금은 그러면 공부 계속하시는 거에.
네 저 원래는 계속 그거 공기업 준비하다가 이번에 코로나 터지면서,네 저 원래는 계속 그거 공기업 준비하다가 이번에 코로나 터지면서
뽑는 인원이 너무 확 쭐었거든요,뽑는 인원이 너무 확 줄었거든요
그래가지고 내년에 공기업 같이 하면서 이제 공무원도,그래가지고 내년에 공기업 같이 하면서 이제 공무원도
이제 시험 한번 쳐볼려고 공부는 하고 있긴 한데,이제 시험 한번 쳐볼려고 공부는 하고 있긴 한데
뭔가 준비했던 대로 계획했던 대로,뭔가 준비했던 대로 계획했던 대로
안 되니까 지치기도 하고 잡생각도 많이 하고,안 되니까 지치기도 하고 잡생각도 많이 하고
요즘 그렇게 되는 거 같애요.,요즘 그렇게 되는 거 같애요.
시간 다 됐거든요 끊었다 갈게요.,시간 다 됐거든요 끊었다 갈게요.
