사투리,표준어
있잖아 우리 여행 갔다 온 이야기 좀 해보자.,있잖아 우리 여행 갔다 온 이야기 좀 해보자.
그래.,그래.
최근의 여행 갔다 온 데 있어?,최근의 여행 갔다 온 데 있어?
아~ 최근에 작년  올해 겨울이네 올해 한 일 월쯤에 혼자서,아~ 최근에 작년  올해 겨울이네 올해 한 일 월쯤에 혼자서
보통 혼자서 여행을 잘 안 하는데 혼자서 온천여행,보통 혼자서 여행을 잘 안 하는데 혼자서 온천여행
음~ 온천 어디로 갔다 왔어?,음~ 온천 어디로 갔다 왔어?
아~ 내 전에 살던 집 근처에서 한 한 시간 정도 가는 건데,아~ 내 전에 살던 집 근처에서 한 한 시간 정도 가는 건데
삼대 온천이라는 게 있어 우리 집에서 가장 가까운 게,삼대 온천이라는 게 있어 우리 집에서 가장 가까운 게
그중 하나였는데 가격도 엄청 싸고,그중 하나였는데 가격도 엄청 싸고
그니까 되게 시골스러운 느낌 덜 관광지화 돼 있어가지고,그러니까 되게 시골스러운 느낌 덜 관광지화 돼 있어가지고
뭐~ 가격 같은 것도 싸고 그때 당시에도 근데,뭐~ 가격 같은 것도 싸고 그때 당시에도 근데
아마 이제 중국인 관광객들이 마이 끊긴 상태여서 엄청 사람들 되게 적은 편이고,아마 이제 중국인 관광객들이 많이 끊긴 상태여서 엄청 사람들 되게 적은 편이고
그랬구나 며칠 동안 갔다 왔어?,그랬구나 며칠 동안 갔다 왔어?
이박 삼일 갔다 왔는데 보통 온천은 다들 친구들끼리 많이 가니까,이박 삼일 갔다 왔는데 보통 온천은 다들 친구들끼리 많이 가니까
약간 혼자 가는 것도 괜찮을까 싶었는데,약간 혼자 가는 것도 괜찮을까 싶었는데
월 생각보다 그냥 혼자 조용히 밥도 먹고 돌아다니고 하기에 괜찮았던,월 생각보다 그냥 혼자 조용히 밥도 먹고 돌아다니고 하기에 괜찮았던
재밌었겠다 나름 혼자 힐링하는 시간이 됐겠네.,재밌었겠다 나름 혼자 힐링하는 시간이 됐겠네.
어 어 어 약간 그래도 같은 약간 부부나,어 어 어 약간 그래도 같은 약간 부부나
약간 그런 커플이나 가족 단위로 많이 여행 오니까,약간 그런 커플이나 가족 단위로 많이 여행 오니까
위축되지 않을까 걱정을 했는데 그렇진 않고 그냥 뭐~ 다들,위축되지 않을까 걱정을 했는데 그렇진 않고 그냥 뭐~ 다들
서로 신경 안 쓰고 잘 노는 분위기,서로 신경 안 쓰고 잘 노는 분위기
그냥 아무래도 그때 이제 잘 나지 않는 휴식이라고 생각하고,그냥 아무래도 그때 이제 잘 나지 않는 휴식이라고 생각하고
되게 큰맘 먹고 혼자 그렇게 간 거였는데,되게 큰맘 먹고 혼자 그렇게 간 거였는데
다행히 이제 코로나 전이라서,다행히 이제 코로나 전이라서
진짜 그때 잘 갔다 왔다 시간이 있어도 돈이 있어도 갈 수 없는데,진짜 그때 잘 갔다 왔다 시간이 있어도 돈이 있어도 갈 수 없는데
어~ 여행은 항상 타이밍인 거 같애.,어~ 여행은 항상 타이밍인 거 같애.
맞다 진짜 저 작년에 니가 내한테 안 왔으면은,맞다 진짜 저 작년에 너가 나한테 안 왔으면은
이제 그런 건 다신 하지 못하는,이제 그런 건 다신 하지 못하는
뭐~ 뭐~ 하지 할 수 있더라도 엄청난 비용과 시간을 들여야 되는,뭐~ 뭐~ 하지 할 수 있더라도 엄청난 비용과 시간을 들여야 되는
그래 진짜 그때 갔다 온 건 정말 신의 한 수였는 거 같다.,그래 진짜 그때 갔다 온 건 정말 신의 한 수였는 거 같다.
모든 것이 다 도와줘서 그랬는 것 같다.,모든 것이 다 도와줘서 그랬는 것 같다.
지금부터는 진짜 향후 오년 정도는 언제 갈 수 있을지 기약 없는 거 같애.,지금부터는 진짜 향후 오년 정도는 언제 갈 수 있을지 기약 없는 거 같애.
뭐~ 이렇게 될지야 몰랐는데 지금 생각해보면은,뭐~ 이렇게 될지야 몰랐는데 지금 생각해보면은
정말 싸게 알차게 할 거 다 하고 왔던 거 같애.,정말 싸게 알차게 할 거 다 하고 왔던 거 같애.
맞아 근데 일본을 갈 수 있는,맞아 근데 일본을 갈 수 있는
가능성이 이제 적어도 진짜 한 이천이십 년은 넘어가야 한다는 그런,가능성이 이제 적어도 진짜 한 이천이십 년은 넘어가야 한다는 그런
생각이 들고 그리고 최근에 이제,생각이 들고 그리고 최근에 이제
뭐~ 상황을 보니 뭐~ 이천이십이 년도 어렵지 않을까,뭐~ 상황을 보니 뭐~ 이천이십이 년도 어렵지 않을까
되게 재미있게 갈 수 있는 곳인데 가격도 싸고,되게 재미있게 갈 수 있는 곳인데 가격도 싸고
다들 국내여행을 하는 거보다는 국내여행도,다들 국내여행을 하는 거보다는 국내여행도
워낙 가격이 비싸니까,워낙 가격이 비싸니까
일본에 가는 게 더 쌌지.,일본에 가는 게 더 쌌지.
그렇지 그래 근데 나는 국내 여행도,그렇지 그래 근데 나는 국내 여행도
생각보다는 안 가봐서 몰랐는데 해보니까 괜찮았던 거 같애.,생각보다는 안 가봐서 몰랐는데 해보니까 괜찮았던 거 같애.
아~ 최근에 간 적 있나 어디 갔는데?,아~ 최근에 간 적 있니 어디 갔는데?
나는 작년에 우리 애들 데리고 남편이랑 처음으로 다 같이,나는 작년에 우리 애들 데리고 남편이랑 처음으로 다 같이
갔다 왔거든 일 주일 정도 갔다 왔는데,갔다 왔거든 일 주일 정도 갔다 왔는데
그때도 진짜 우리는 이렇게 갈 수 있는 시간이 또 안 올 수도 있다고 생각하면서,그때도 진짜 우리는 이렇게 갈 수 있는 시간이 또 안 올 수도 있다고 생각하면서
어~ 정말 우리 넷이서 그렇게 긴 여행을 어딘가로 멀리 가본 게 처음이었거든,어~ 정말 우리 넷이서 그렇게 긴 여행을 어딘가로 멀리 가본 게 처음이었거든
어~ 정말 좋아하고 돌아오고 싶지 않다고 얘기하고,어~ 정말 좋아하고 돌아오고 싶지 않다고 얘기하고
거기 살고 싶다고 그래 가지고 힘들었다.,거기 살고 싶다고 그래 가지고 힘들었다.
애들 비행기도 처음 타 봤겠네?,애들 비행기도 처음 타 봤겠네?
응 좋아하고 비행기 탈 때 그~ 소음을 무서워할 줄 알았는데,응 좋아하고 비행기 탈 때 그~ 소음을 무서워할 줄 알았는데
하나도 안 무서워하고 그때 우리 둘째가,하나도 안 무서워하고 그때 우리 둘째가
세 살이었나 그랬는데도,세 살이었나 그랬는데도
울지도 않고 비행기 출발하고 내리고 할 때 그~ 시끄럽거나 한 거를,울지도 않고 비행기 출발하고 내리고 할 때 그~ 시끄럽거나 한 거를
그냥 다 견디더라고 재미있어 하면서,그냥 다 견디더라고 재미있어 하면서
그래서 생각보다 애들이 많이 컸구나 그리고,그래서 생각보다 애들이 많이 컸구나 그리고
여행 엄청 하고 싶었구나 라고 느꼈어.,여행 엄청 하고 싶었구나 라고 느꼈어.
애들도 여행하는 거 되게 좋아하나보다.,애들도 여행하는 거 되게 좋아하나보다.
응~ 의외로 애들은 나가서,응~ 의외로 애들은 나가서
몸으로 만지고 느끼고 하는 걸 정말 좋아하는 거 같더라고.,몸으로 만지고 느끼고 하는 걸 정말 좋아하는 거 같더라고.
아~ 그~ 일주일 동안 되게 긴 시간인데 뭐 했어?,아~ 그~ 일주일 동안 되게 긴 시간인데 뭐 했어?
응~ 우리는 차 전기차 빌려서 일주일 동안 전기차로 이동했는데,응~ 우리는 차 전기차 빌려서 일주일 동안 전기차로 이동했는데
전기차가 제주도에서 진짜 좋은 게,전기차가 제주도에서 진짜 좋은 게
전기차를 하루에 빌릴 때,전기차를 하루에 빌릴 때
결재를 다 하고 나면,결재를 다 하고 나면
충전하는 카드를 주는데 그거를,충전하는 카드를 주는데 그거를
돈 더이상 안 내고 충전을 무제한으로,돈 더이상 안 내고 충전을 무제한으로
좋네 제주도만 그런 거가?,좋네 제주도만 그런 거가?
내가 알기로는 나는 따른 데는 여행을 안 가봐서 모르겠는데,내가 알기로는 나는 다른 데는 여행을 안 가봐서 모르겠는데
일단 제주도는 그런 것 같더라.,일단 제주도는 그런 것 같더라.
그 빌리는 돈 말고는 내는 돈 없나?,그 빌리는 돈 말고는 내는 돈 없나?
빌리는 거랑 그때 드는 보험료 말고,빌리는 거랑 그때 드는 보험료 말고
무제한으로 되는 거라서 이동 거리가 멀어도 부담이 없고,무제한으로 되는 거라서 이동 거리가 멀어도 부담이 없고
되게 좋았어 그리고 그~ 보험도,되게 좋았어 그리고 그~ 보험도
렌트카 하면은 보험들 때 이제 뭐~,렌트카 하면은 보험들 때 이제 뭐~
자기가 부담하는 금액이고 막 이런 것,자기가 부담하는 금액이고 막 이런 것
들이 보통 있는데 그런 게 없는 보험을 들었거든,들이 보통 있는데 그런 게 없는 보험을 들었거든
렌트카 회사에서 엄청 꼼꼼하게 체크를 하는데,렌트카 회사에서 엄청 꼼꼼하게 체크를 하는데
그 수준의 보험을 들면,그 수준의 보험을 들면
갖다줄 때 네 안녕히 가세요 하고 차를 그냥 아예 쳐다보지도 않고 키만 받고 보내주거든.,갖다줄 때 네 안녕히 가세요 하고 차를 그냥 아예 쳐다보지도 않고 키만 받고 보내주거든.
어~ 보험료 얼만데 그러면,어~ 보험료 얼만데 그러면
어~ 그래도 몇만 원이긴 하지만 전혀 아깝지 않았던 거 같애.,어~ 그래도 몇만 원이긴 하지만 전혀 아깝지 않았던 거 같애.
그럼 차 빌리는 비용은 더 안 비싸나 보통 기름 들어가는 차보다,그럼 차 빌리는 비용은 더 안 비싸니 보통 기름 들어가는 차보다
의외로 별로 비싸지 않아서,의외로 별로 비싸지 않아서
코나였어 응~ 그런데 우리 전체 일주일 예산이,코나였어 응~ 그런데 우리 전체 일주일 예산이
비행기값이랑 먹는 거랑 다 해서 한 이 백만원,비행기값이랑 먹는 거랑 다 해서 한 이 백만원
그래서 되게 나름 네 명이 움직인 것치고,그래서 되게 나름 네 명이 움직인 것치고
어~ 저렴하게 움직였고 게다가 비행기도 대한항공 탔거든,어~ 저렴하게 움직였고 게다가 비행기도 대한항공 탔거든
응~ 근데 네 명이 비행기값 왕복 이십 만 원인가밖에 안 했어,응~ 근데 네 명이 비행기값 왕복 이십 만 원인가밖에 안 했어
쪼끔 쌌지 하윤이도 미취학이었고 그러니까,쪼끔 쌌지 하윤이도 미취학이었고 그러니까
아~ 취학 전이면 싸?,아~ 취학 전이면 싸?
쪼끔 저렴한 것 같더라고 백프로 내진 않았어,쪼끔 저렴한 것 같더라고 백프로 내진 않았어
그래서 우리는 그때 진짜 많이 다녔거든 숙소도,그래서 우리는 그때 진짜 많이 다녔거든 숙소도
풀 인제 펜션인데 독채를 인제 거의 한 방이 이제,풀 인제 펜션인데 독채를 인제 거의 한 방이 이제
뭐지 이층으로 되어있는 복층인 펜션을 빌려가지고,뭐지 이층으로 되어있는 복층인 펜션을 빌려가지고
근데 그 방도 하루에 오만 원밖에 안 했고,근데 그 방도 하루에 오만 원밖에 안 했고
아침 조식을 네 명 다 먹는 비용 포함해서,아침 조식을 네 명 다 먹는 비용 포함해서
일 박에 네 명이 오 만원이었고 그래서,일 박에 네 명이 오 만원이었고 그래서
진짜 저렴하게 잘 먹고 우도도 갔다 왔고,진짜 저렴하게 잘 먹고 우도도 갔다 왔고
몇 명이 오만 원이라는 거는 그~ 일박이 전원 오만 원이라는 거야?,몇 명이 오만 원이라는 거는 그~ 일박이 전원 오만 원이라는 거야?
그렇지 우리 네 명이 한번 한 박에 오만 원밖에 안 줬어.,그렇지 우리 네 명이 한번 한 박에 오만 원밖에 안 줬어.
진짜 싸다 그러면,진짜 싸다 그러면
어~ 하루에 그 방이 그때 프로모션으로 약간 세일하는 기간에,어~ 하루에 그 방이 그때 프로모션으로 약간 세일하는 기간에
예약을 해서 오만 원밖에 안 하고,예약을 해서 오만 원밖에 안 하고
그리고 우리 돌고래 조련사 체험도 했거든 애들,그리고 우리 돌고래 조련사 체험도 했거든 애들
그래서 애들 돌고래 만나고 사진 찍고 만져보고,그래서 애들 돌고래 만나고 사진 찍고 만져보고
하는 것도 그것도 금액이 꽤 비싸더라고 시간대비,하는 것도 그것도 금액이 꽤 비싸더라고 시간대비
근데 체험을 엄청 많이 했어 우도 들어가는 배 타는 비용이랑 우도 안에서,근데 체험을 엄청 많이 했어 우도 들어가는 배 타는 비용이랑 우도 안에서
애들 말도 탔거든,애들 말도 탔거든
그런 비용도 다 포함해서 이백 정도면 진짜 알차게 갔다 왔다고,그런 비용도 다 포함해서 이백 정도면 진짜 알차게 갔다 왔다고
어~ 우리는 진짜 급하게 갑자기 결정된 여행이라,어~ 우리는 진짜 급하게 갑자기 결정된 여행이라
한 삼 일 알아보고 갔거든.,한 삼 일 알아보고 갔거든.
오 최고데이 그렇게 막 삼일 안에  운도 좋았네.,오 최고다 그렇게 막 삼일 안에  운도 좋았네.
응 진짜 타이밍이 좋았어 여행은 진짜 비행기랑 이런 거는,응 진짜 타이밍이 좋았어 여행은 진짜 비행기랑 이런 거는
진짜 타이밍인 거 같고,진짜 타이밍인 거 같고
근데 의외로 그래 많이 준비하지 않았는데,근데 의외로 그래 많이 준비하지 않았는데
꼼꼼하게 알아보는 것도 전혀 없었거든 그냥,꼼꼼하게 알아보는 것도 전혀 없었거든 그냥
그냥 가서 해보자 하면서 당일 날 알아보고 뭐~ 전날 밤에 알아보고,그냥 가서 해보자 하면서 당일 날 알아보고 뭐~ 전날 밤에 알아보고
심지어 그 일주일 동선도 전혀 계획 없이,심지어 그 일주일 동선도 전혀 계획 없이
우리 그냥 갔거든,우리 그냥 갔거든
그래서 가서 그냥 있는 대로 해 좋으면 바다에서 하루 종일 놀다 오자,그래서 가서 그냥 있는 대로 해 좋으면 바다에서 하루 종일 놀다 오자
따른 거 안 해도 된다 그랬는데 여름에 갔는데 추운 거야.,다른 거 안 해도 된다 그랬는데 여름에 갔는데 추운 거야.
어~ 수영은 할 수 있었나?,어~ 수영은 할 수 있었나?
수영 거의 못 했어 캐서 계획을 안 세울 수 있었던 건,수영 거의 못 했어 그래서 계획을 안 세울 수 있었던 건
더울 거기 때문에 수영만 해도 일주일 금방 간다였는데,더울 거기 때문에 수영만 해도 일주일 금방 간다였는데
갔는데 긴 팔 입어도 추운 거야,갔는데 긴 팔 입어도 추운 거야
그래서 바닷물에,그래서 바닷물에
발만 담구고 추워서 덜덜덜 떨면서,발만 담구고 추워서 덜덜덜 떨면서
어~ 애들은 계속 물에서 놀고 싶다고 쪼르고,어~ 애들은 계속 물에서 놀고 싶다고 조르고
어~ 나는 너희 지금 열나면 이제,어~ 나는 너희 지금 열나면 이제
일주일 동안 아무것도 못한다고 날씨 수영하자고 계속 설득하고,일주일 동안 아무것도 못한다고 날씨 수영하자고 계속 설득하고
그래 그랬던 거 같애 그래도,그래 그랬던 거 같애 그래도
그래 수영 못해서 엄청 멘붕이였는데,그래 수영 못해서 엄청 멘붕이였는데
그래도 다른 일정들을 그래도 그날그날 알아볼 때 감사하게,그래도 다른 일정들을 그래도 그날그날 알아볼 때 감사하게
어디 알아보는데 그냥 숙소나 그런 거는 다 어디 알아봐?,어디 알아보는데 그냥 숙소나 그런 거는 다 어디 알아봐?
제주도 관련 여행 카페가,제주도 관련 여행 카페가
어~ 그거 좋더라 그래서 거기서 숙소도,어~ 그거 좋더라 그래서 거기서 숙소도
그~ 펜션 지기가 자기네 숙소,그~ 펜션 지기가 자기네 숙소
뭐~ 할인한다고 이런 거 올렸던 걸 우연히 봐가지고,뭐~ 할인한다고 이런 거 올렸던 걸 우연히 봐가지고
물어봤는데 방이 심지어 랜덤지정이었거든,물어봤는데 방이 심지어 랜덤지정이었거든
그래서 원룸 짜리 방도 있고 다섯 개짜리 복층 방도 있고 이런데,그래서 원룸 짜리 방도 있고 다섯 개짜리 복층 방도 있고 이런데
그냥 랜덤으로 자기가 마음대로 준다는 거였어 인제 빈방으로,그냥 랜덤으로 자기가 마음대로 준다는 거였어 인제 빈방으로
근데 우리한테,근데 우리한테
심지어 다섯 개였거든,심지어 다섯 개였거든
어~ 복층의 침대 다섯 개고 세탁기랑 뭐~ 이런 거 다 있는 방을 주셔가지고,어~ 복층의 침대 다섯 개고 세탁기랑 뭐~ 이런 거 다 있는 방을 주셔가지고
어~ 애들 정말 여기서 살고 싶다고 계속 노래 계단이 있는 집으로 이사하고 싶다고 막 그랬다.,어~ 애들 정말 여기서 살고 싶다고 계속 노래 계단이 있는 집으로 이사하고 싶다고 막 그랬다.
야 나중에 나중에 애들크면 나한테도 놀러와라 다 같이 일주일 있자 우리 집에서,야 나중에 나중에 애들크면 나한테도 놀러와라 다 같이 일주일 있자 우리 집에서
어~ 너무 좋지 진짜 코로나 끝나고 그렇게 되면 너무 좋을 것 같,어~ 너무 좋지 진짜 코로나 끝나고 그렇게 되면 너무 좋을 것 같
안 그래도  여행 나도 이제,안 그래도  여행 나도 이제
멀리는 못 가니까 근데 다시 가게 되면,멀리는 못 가니까 근데 다시 가게 되면
오사카에 뭐가 있는지 찾아봤거든,오사카에 뭐가 있는지 찾아봤거든
생각보다 애들 데리고 갈만한 데 꽤 많더라 왜 여행을,생각보다 애들 데리고 갈만한 데 꽤 많더라 왜 여행을
오사카를 오는 많이 오는 줄 알 것 같다,오사카를 오는 많이 오는 줄 알 것 같다
일단 놀이공원이 젤 큰 게 하나 있고 유니버셜 스튜디오가 있더라고.,일단 놀이공원이 젤 큰 게 하나 있고 유니버셜 스튜디오가 있더라고.
아~ 그게 오사카에 있어?,아~ 그게 오사카에 있어?
어어어어 한 하루에 놀려고 보니까 한 칠만 원 정도 함 되더라고,어어어어 한 하루에 놀려고 보니까 한 칠만 원 정도 하면 되더라고
어~ 그 유니버셜 스튜디오에서 하루종일 노는데 일 인당 칠만 원?,어~ 그 유니버셜 스튜디오에서 하루종일 노는데 일 인당 칠만 원?
어어어 아~ 그리고 뭐고 내가 아마 연간 이용권을 끊을 것 같애.,어어어 아~ 그리고 뭐야 내가 아마 연간 이용권을 끊을 것 같애.
싸더라 한 이십만 원 하면은 일년 내내  약간 그런 건 있어 제한되는 구간,싸더라 한 이십만 원 하면은 일년 내내  약간 그런 건 있어 제한되는 구간
뭐~ 크리스마스 뭐~ 이렇게 완전 인기 있을 법한 구간에는 못 들어가는데,뭐~ 크리스마스 뭐~ 이렇게 완전 인기 있을 법한 구간에는 못 들어가는데
이십일만 원 정도 주고 하니까 일년 언제든지 매일 와도 상관없다는 거야.,이십일만 원 정도 주고 하니까 일년 언제든지 매일 와도 상관없다는 거야.
어~ 좋다 가까이 살고 하면,어~ 좋다 가까이 살고 하면
그리고 어디서라도 한,그리고 어디서라도 한
지하철로 한 삼십 분 뭐~ 정말 멀리 살아도 한 삼십 분이면 갈 수 있는 거리거든,지하철로 한 삼십 분 뭐~ 정말 멀리 살아도 한 삼십 분이면 갈 수 있는 거리거든
맞제 그리고 내가 그렇게 해서 하면은,맞지 그리고 내가 그렇게 해서 하면은
내가 데려오는 친구들이나 그런 사람들도 다 할인이 돼.,내가 데려오는 친구들이나 그런 사람들도 다 할인이 돼.
얼마나?,얼마나?
한 모르겠어 한 적어도 한 만 원 정도 할인을 했었던 것 같다,한 모르겠어 한 적어도 한 만 원 정도 할인을 했었던 것 같다
지금 정확하게 기억 안 난다 인원 제한 같이 오는 사람들이나 뭐~ 그런,지금 정확하게 기억 안 난다 인원 제한 같이 오는 사람들이나 뭐~ 그런
쫌 혜택이 있더라고 애들 오면 진짜 좋아할 것 같다 거기에 스누피도 있고 맞제?,조금 혜택이 있더라고 애들 오면 진짜 좋아할 것 같다 거기에 스누피도 있고 맞지?
어~ 좋겠다 애들 진짜 좋아하겠다.,어~ 좋겠다 애들 진짜 좋아하겠다.
응응 쫌 더 컸을 때 오면 맞제 자기 좋아하는 캐릭터도 생기고,응응 조금 더 컸을 때 오면 맞지 자기 좋아하는 캐릭터도 생기고
그래 그렇지 애들이 사실,그래 그렇지 애들이 사실
어릴 때 가면 기억이 안 나는데 우리 인제 큰 애는 초등학생이니까,어릴 때 가면 기억이 안 나는데 우리 인제 큰 애는 초등학생이니까
지금부터 가는 건 다 기억할 거 아니야.,지금부터 가는 건 다 기억할 거 아니야.
응 다 기억나지 영향,응 다 기억나지 영향
그런 거 어릴 때 본 것들 영향 되게 많이 받는다 아이가,그런 거 어릴 때 본 것들 영향 되게 많이 받지 않니
정말 그런 게 뭐~ 정말 직업이 되기도 하고 내가  어릴 때 워낙 뭔가 그런,정말 그런 게 뭐~ 정말 직업이 되기도 하고 내가  어릴 때 워낙 뭔가 그런
귀여운 거 너무 많이 봐가지고 나도 생각했던 것 같다.,귀여운 거 너무 많이 봐가지고 나도 생각했던 것 같다.
그래도 그래 그런 생각을 하게 된 것도 참 신기하다.,그래도 그래 그런 생각을 하게 된 것도 참 신기하다.
여행 같은 거 하는 거 되게 좋은 것 같애,여행 같은 거 하는 거 되게 좋은 것 같애
여러 가지 뭐~ 다양한,여러 가지 뭐~ 다양한
거를 보여주고 다양한 세계관도 있고,거를 보여주고 다양한 세계관도 있고
이제 뭐~ 생각을 넓히 넓혀준다는 말이 뭔지 알 것 같다,이제 뭐~ 생각을 넓히 넓혀준다는 말이 뭔지 알 것 같다
뭔가 처음에는 왜 여행 여행 다니다 보면 인제 사람들도 만나잖아,뭔가 처음에는 왜 여행 여행 다니다 보면 인제 사람들도 만나잖아
여행지에서 이제 이 사람은 이렇게 살고 있고 이 사람 뭐~ 어떤 뭐~,여행지에서 이제 이 사람은 이렇게 살고 있고 이 사람 뭐~ 어떤 뭐~
여행을 왔는지 왜 뭐~ 뭐~ 어떻게 사는지,여행을 왔는지 왜 뭐~ 뭐~ 어떻게 사는지
내가 평소에 만나지 못했던 사람들,내가 평소에 만나지 못했던 사람들
또 많이 만날 수 있고 그리고 내가 좋아하는 거,또 많이 만날 수 있고 그리고 내가 좋아하는 거
가 뭔지를 확실하게 알 수 있고,가 뭔지를 확실하게 알 수 있고
그리고 이제 여행을 다니다 보면,그리고 이제 여행을 다니다 보면
내가 뭐에 불편 제일 중요했던 게 내가,내가 뭐에 불편 제일 중요했던 게 내가
뭐를 좋아했고를 의외로 불편한 걸로 느끼는 거야.,뭐를 좋아했고를 의외로 불편한 걸로 느끼는 거야.
아~ 이거 너무 불편해서 싫어서 내가 이게 원래 좋아했던 거구나.,아~ 이거 너무 불편해서 싫어서 내가 이게 원래 좋아했던 거구나.
어~ 어~ 내 이게 없으면 안 되는구나,어~ 어~ 나 이게 없으면 안 되는구나
평소에 되게 뭐~ 물같이 내가 항상 그렇게 세팅을 해놓는다든지,평소에 되게 뭐~ 물같이 내가 항상 그렇게 세팅을 해놓는다든지
모든 환경이 그렇기 때문에,모든 환경이 그렇기 때문에
이거에 대해서 내가 뭐~ 무슨 고집 있다 내지는 뭐~,이거에 대해서 내가 뭐~ 무슨 고집 있다 내지는 뭐~
그렇게 생각 안 하고 그냥 아무래도 괜찮다라고 생각했었는데,그렇게 생각 안 하고 그냥 아무래도 괜찮다라고 생각했었는데
그~ 고집 있더라 내가 이거를 정말 싫어했구나,그~ 고집 있더라 내가 이거를 정말 싫어했구나
좋아했구나 이게 정말 나한테 필요하구나 그런게 있었던 것 같애.,좋아했구나 이게 정말 나한테 필요하구나 그런게 있었던 것 같애.
그렇구나 나는 한 번도 그렇게 못 느껴봤던 것 같다 나는,그렇구나 나는 한 번도 그렇게 못 느껴봤던 것 같다 나는
니에 비해서 여행을 많이 못 가봤잖아.,너에 비해서 여행을 많이 못 가봤잖아.
그래서 아~ 나는 뭐에 고집이 있고 난 이게 분명히 내한테 꼭 있어야 된다 이런 생각을,그래서 아~ 나는 뭐에 고집이 있고 난 이게 분명히 나한테 꼭 있어야 된다 이런 생각을
내가 뭘 그런 생각을 하고 있는지 잘 모르는 것 같다 아직도.,내가 뭘 그런 생각을 하고 있는지 잘 모르는 것 같다 아직도.
