사투리,표준어
엄태웅이랑 이예원이랑 선덕여왕이랑 김유신으로 나와서,엄태웅이랑 이예원이랑 선덕여왕이랑 김유신으로 나와서
그런 로멘스가 좀 있긴 했어 사극 치고는,그런 로멘스가 좀 있긴 했어 사극 치고는
엄태웅 이거 찍고 얼마 있다간가 한참 있다간가 성매매 인가 그걸로 구속 수사까진 아니고 여튼 수사 받은 적 있어,엄태웅 이거 찍고 얼마 있다간가 한참 있다간가 성매매 인가 그걸로 구속 수사까진 아니고 여하튼 수사 받은 적 있어
프로그램도 하차하고 했었거든,프로그램도 하차하고 했었거든
이때까지는 권정을 잘 몰랐거든 왜냐면 권정은 우리 때라기에는 옛날 드라마 나왔었으니까,이때까지는 권정을 잘 몰랐거든 왜냐하면 권정은 우리 때라기에는 옛날 드라마 나왔었으니까
일단 보고 너무너무 좋아서 이  디어 마이 프렌즈 아까 내가 말한 노희경 드라마 중에서,일단 보고 너무너무 좋아서 이  디어 마이 프렌즈 아까 내가 말한 노희경 드라마 중에서
주인공으로 나왔던 고연정이 그것도 봤었고 여왕의 교실 이것도 봤었고,주인공으로 나왔던 고연정이 그것도 봤었고 여왕의 교실 이것도 봤었고
선덕여왕 때문에 고연정을 좋아하게 된 줄 알았는데 아니었네 그 전에 히트,선덕여왕 때문에 고연정을 좋아하게 된 줄 알았는데 아니었네 그 전에 히트
봤었고 여우야 뭐하니 봤었고 봄날 봄날 조민성이랑 지진희랑 복귀작이었다 맞다 이때 이천오년부였는데 이때부터 좋아했네,봤었고 여우야 뭐하니 봤었고 봄날 봄날 조민성이랑 지진희랑 복귀작이었다 맞다 이때 이천오년부였는데 이때부터 좋아했네
오래된 드라마다 보니깐 기억이 되게 왜곡이 된다,오래된 드라마다 보니깐 기억이 되게 왜곡이 된다
이천 오년도에 중학교때 본 드라마가 넌 기억이 나니?,이천 오년도에 중학교때 본 드라마가 넌 기억이 나니?
파리의 연인 기억나지 근데 니가 나보다 드라마를 많이 봤잖아,파리의 연인 기억나지 근데 너가 나보다 드라마를 많이 봤잖아
그러면 드라마 본것중에서 기억에 나는 대사가 있어?,그러면 드라마 본것중에서 기억에 나는 대사가 있어?
대사는 기억을 못 하고 장면의 느낌?,대사는 기억을 못 하고 장면의 느낌?
전체적인 씬 그런 느낌은 기억나나?,전체적인 씬 그런 느낌은 기억나나?
오 근데 파리의 연인 뭐 애기야 가자 이정도는 기억을 하지 기억을 하고 파리의 연인 하니깐 또 생각이 났다,오 근데 파리의 연인 뭐 애기야 가자 이정도는 기억을 하지 기억을 하고 파리의 연인 하니깐 또 생각이 났다
파리의 연인 이동건 나오잖아 이동건,파리의 연인 이동건 나오잖아 이동건
또 내가 진짜 좋아했을 때가 있었는데 그때가 낭만 십팔세라고 내가 아마 이때부터,또 내가 진짜 좋아했을 때가 있었는데 그때가 낭만 십팔세라고 내가 아마 이때부터
덕질을 시작을 했어 이게 이천 사년도니까 이거 찍고 파리의 연인 찍었네 바로,덕질을 시작을 했어 이게 이천 사년도니까 이거 찍고 파리의 연인 찍었네 바로
한지혜랑 이동건이랑 이다혜랑 이렇게 나오는 건데,한지혜랑 이동건이랑 이다혜랑 이렇게 나오는 건데
한지혜가 고등학생이고 이동건이 검산데,한지혜가 고등학생이고 이동건이 검산데
한지혜가 그거 일진이지 공부 안하는 일진 근데 이 두 사람의,한지혜가 그거 일진이지 공부 안하는 일진 근데 이 두 사람의
부모님이 옛날에 할아버지들이 옛날에 정약 결혼을 맺어 놓은거야 그래서,부모님이 옛날에 할아버지들이 옛날에 정약 결혼을 맺어 놓은거야 그래서
아마 고등학교 졸업하자마자 결혼 하는건가 뭐 이런게 나와서 지금 생각하면,아마 고등학교 졸업하자마자 결혼 하는건가 뭐 이런게 나와서 지금 생각하면
이런 뉴스에 나올만한 얘기가 있노 라고 생각을 하지만 그때는 되게 어린 감성에 재밌게 봤던거 같애,이런 뉴스에 나올만한 얘기가 있어 라고 생각을 하지만 그때는 되게 어린 감성에 재밌게 봤던거 같애
집에 디비디도 아직 남아있고 이거 오에스티도 있었는데 엘범도 있었는데 그거는 지금 없는 거 같지만,집에 디비디도 아직 남아있고 이거 오에스티도 있었는데 엘범도 있었는데 그거는 지금 없는 거 같지만
내가 제일 처음으로 좋아했던 드라마가 이거였던거 같애 너는 처음으로 본 드라마 기억 나니?,내가 제일 처음으로 좋아했던 드라마가 이거였던거 같애 너는 처음으로 본 드라마 기억 나니?
기억 나지 나 처음으로 봤던게 쾌걸 춘향인거 같애,기억 나지 나 처음으로 봤던게 쾌걸 춘향인거 같애
케이비에스 이 티비에서 했던건데 이천오년도에 했었거든?,케이비에스 이 티비에서 했던건데 이천오년도에 했었거든?
칠부작이었던거 같은데 제희랑 한태형이 나와,칠부작이었던거 같은데 제희랑 한태형이 나와
엄태웅도 나오고 제희 알아?,엄태웅도 나오고 제희 알아?
한채영이 진짜 이뻤는데 완전 인형이었잖아,한채영이 진짜 이뻤는데 완전 인형이었잖아
엄태웅도 그때는 젊었고 그리고 나는 이거 보고 나가지고,엄태웅도 그때는 젊었고 그리고 나는 이거 보고 나가지고
그 다음에 봤던게 이제 현빈 나오는 내 이름은 김상순도 봤었는데 내가,그 다음에 봤던게 이제 현빈 나오는 내 이름은 김상순도 봤었는데 내가
근데 이때 나온 드라마들이 다 내용이 좀 그런거 같애 지금 보기에는 되게 좀,근데 이때 나온 드라마들이 다 내용이 좀 그런거 같애 지금 보기에는 되게 좀
케이비에스에 주말 저녁 드라마가 한창 유행했을 때가 있었잖아,케이비에스에 주말 저녁 드라마가 한창 유행했을 때가 있었잖아
그때가 거의 한 십년 전이었지,그때가 거의 한 십년 전이었지
아빠가 최근에 드라마를 보는데  아들들 그걸 보더라고,아빠가 최근에 드라마를 보는데  아들들 그걸 보더라고
근데 그게 아들 네명이 있는 엄청 큰 집이지,근데 그게 아들 네명이 있는 엄청 큰 집이지
큰 집에서 이제 결혼을 차곡차곡하는 그런 내용의 드라만데,큰 집에서 이제 결혼을 차곡차곡하는 그런 내용의 드라만데
지금 보고 있으면 뭐 옆에서 속이 터져 아니 저런데 왜 시집을 가냐 결혼을 해야되냐,지금 보고 있으면 뭐 옆에서 속이 터져 아니 저런데 왜 시집을 가냐 결혼을 해야되냐
첫째가 약국 약사인 아저씬데 나이가 되게 많거든,첫째가 약국 약사인 아저씬데 나이가 되게 많거든
그래서 아저씨랑 결혼을 하게 되는 사람이 그 맞은편 집에 변호사 여잔데,그래서 아저씨랑 결혼을 하게 되는 사람이 그 맞은편 집에 변호사 여잔데
나이 차이가 많이 나니까 처음에는 이웃사촌으로 만났으니까,나이 차이가 많이 나니까 처음에는 이웃사촌으로 만났으니까
아저씨 아저씨 이렇게 만난단 말이야 흡싸 도깨비,아저씨 아저씨 이렇게 만난단 말이야 흡싸 도깨비
초반에 문제가 됐던 그런 내용과 똑같이 나이 차이가 많이 나는 그런 커플이니까,초반에 문제가 됐던 그런 내용과 똑같이 나이 차이가 많이 나는 그런 커플이니까
그것도 그렇고 티비에서 방영이 됐다는 자체가 되게 좀 신기하고,그것도 그렇고 티비에서 방영이 됐다는 자체가 되게 좀 신기하고
제일 문제는 어른들이 아직 저거에 대해서 되게 저때가 좋았지 저때가 재밌어지 라는,제일 문제는 어른들이 아직 저거에 대해서 되게 저때가 좋았지 저때가 재밌어지 라는
생각을 한다는 자체가 되게 좀 불편했던거 같애,생각을 한다는 자체가 되게 좀 불편했던거 같애
아침 드라마가 막장이지,아침 드라마가 막장이지
아침 드라마는 보는거 있었나?,아침 드라마는 보는거 있었어?
그 제목이 되게 기억이 안나는데 좀 쇼킹 했던거 많았던거 같애,그 제목이 되게 기억이 안나는데 좀 쇼킹 했던거 많았던거 같애
말단내는 막장도 많았고 연출 중에서도 김치 가지고 싸대기 때리는 그런 것도 많아서,말단내는 막장도 많았고 연출 중에서도 김치 가지고 싸대기 때리는 그런 것도 많아서
중학교때 정도까진 아마 한 일곱시 여덟시 정도에 하던 드라마들도 챙겨 봤던거 같애,중학교때 정도까진 아마 한 일곱시 여덟시 정도에 하던 드라마들도 챙겨 봤던거 같애
아침 드라마까진 아니지만 어느정도에 막장성을 가지고,아침 드라마까진 아니지만 어느정도에 막장성을 가지고
지금도 하는지 모르겠는데 그때는 좀 챙겨 봤던거 같애,지금도 하는지 모르겠는데 그때는 좀 챙겨 봤던거 같애
열시 드라마는 늦기도 늦으니까 그리고 요새는 열시 드라마라고 하기도 애매한게 시간이 되게 뒤죽박죽이더라고,열시 드라마는 늦기도 늦으니까 그리고 요새는 열시 드라마라고 하기도 애매한게 시간이 되게 뒤죽박죽이더라고
원래는 아홉시 뉴스들 다 같이 하고 열시에 다같이 시작했는데 요새는,원래는 아홉시 뉴스들 다 같이 하고 열시에 다같이 시작했는데 요새는
여섯시에 뉴스 하는데도 있고 여덟시 반에 하는데도 있고,여섯시에 뉴스 하는데도 있고 여덟시 반에 하는데도 있고
공중파는 아직까지는 월화수목토일 이런식으로 나뉘어져 있는거 같은데,공중파는 아직까지는 월화수목토일 이런식으로 나뉘어져 있는거 같은데
종편에는 그런것도 잘 없고 금토 이렇게 하는것도 있고,종편에는 그런것도 잘 없고 금토 이렇게 하는것도 있고
금토 하니까 생각난다 응답하라 시리즈 너 본거 있니 재밌는거 기억나는거 있니?,금토 하니까 생각난다 응답하라 시리즈 너 본거 있니 재밌는거 기억나는거 있니?
나 응답하라도 간간히 봤었는데,나 응답하라도 간간히 봤었는데
나는 고아라 나올 때 봤었거든 고아라랑 성동일 나오고 니 그거 봤었제?,나는 고아라 나올 때 봤었거든 고아라랑 성동일 나오고 너 그거 봤었지?
나는 응답하라 시리즈 다 봤었고,나는 응답하라 시리즈 다 봤었고
얘기를 빠트렸네 응답하라 시리즈랑 슬기로운 시리즈,얘기를 빠트렸네 응답하라 시리즈랑 슬기로운 시리즈
감빵생활이랑 의사생활이랑 그 시리즈도 다 봤었거든,감빵생활이랑 의사생활이랑 그 시리즈도 다 봤었거든
연출이랑 작가가 같이 하지,연출이랑 작가가 같이 하지
이유정 작가 이유정 작가거가 내가 그 또 맞아,이유정 작가 이유정 작가거가 내가 그 또 맞아
응답하라 시리즈 이공공이 했으면 좋겠어 왜냐면 그때가 우리 초등학교때라서 나 되게 기억나는거 많거든,응답하라 시리즈 이공공이 했으면 좋겠어 왜냐하면 그때가 우리 초등학교때라서 나 되게 기억나는거 많거든
보고싶은 드라마는 시리즈물로 나오는 드라마는 많은데,보고싶은 드라마는 시리즈물로 나오는 드라마는 많은데
요새 보고 있는게 없어서 뭔가 아쉽기는 하다,요새 보고 있는게 없어서 뭔가 아쉽기는 하다
니가 갑자기 말하니까 나 슬기로운 의사생활도 봤었거든?,너가 갑자기 말하니까 나 슬기로운 의사생활도 봤었거든?
니 슬기로운 의사생활도 봤다 그랬잖아,너 슬기로운 의사생활도 봤다 그랬잖아
빨리 슬기로운 의사생활 투가 나와도 좋고 응답하라 이공공이가 나와도 좋고 얼른 나와서 재밌는 얘길 했으면 좋겠다.,빨리 슬기로운 의사생활 투가 나와도 좋고 응답하라 이공공이가 나와도 좋고 얼른 나와서 재밌는 얘길 했으면 좋겠다.
