사투리,표준어
이래서 그~ 친구한테 몇 명 권유를 해 줬더니만 애들도 회식 갔을 때 걔 인기가 많다 하더라구요 팁도 받고.,이래서 그~ 친구한테 몇 명 권유를 해 줬더니만 애들도 회식 갔을 때 걔 인기가 많다 하더라구요 팁도 받고.
생각 있음 나중에 한번 해봐요 나중에 어딜 가든 언젠가 한번 쓰이게 될 거예요 그런 성대모사 배우는 것도 재미있고.,생각 있음 나중에 한번 해봐요 나중에 어딜 가든 언젠가 한번 쓰이게 될 거예요 그런 성대모사 배우는 것도 재미있고.
해보면 되게 재미있게 돼요 이거는 그냥 해보는 것만 추천해 드려요 강요는 절대 아닙니다.,해보면 되게 재미있게 돼요 이거는 그냥 해보는 것만 추천해 드려요 강요는 절대 아닙니다.
근데 해 보면  재밌을 거 같긴 하다 뭔가 뭐~ 보통 회사 생활이나 뭐~ 어디가든 또 개인기는 하나 있음 좋잖아.,근데 해 보면  재밌을 거 같긴 하다 뭔가 뭐~ 보통 회사 생활이나 뭐~ 어디가든 또 개인기는 하나 있음 좋잖아.
좀 생각을 해봐야겠다 크로스핏은 진짜 진지하게 한번 생각을 해 봐야 될 거 같아.,좀 생각을 해봐야겠다 크로스핏은 진짜 진지하게 한번 생각을 해 봐야 될 거 같아.
뭐~ 다이어트도 그렇고 되면 요즘 나가는 게 힘들어가지고 뭔가 그런 것도 한번 해보면 좋을 거.,뭐~ 다이어트도 그렇고 되면 요즘 나가는 게 힘들어가지고 뭔가 그런 것도 한번 해보면 좋을 거.
