사투리,표준어
초등학교 시절부터 그럼 얘기를 니가 먼저 해 볼래?,초등학교 시절부터 그럼 얘기를 너가 먼저 해 볼래?
그래 나는 태어난 거는 부산에서 태어났지만,그래 나는 태어난 거는 부산에서 태어났지만
태어나자말자 양산으로 바로 이사를 가서 초등학교 일학년 때 까지는 양산에 살다가 왔어.,태어나자말자 양산으로 바로 이사를 가서 초등학교 일학년 때 까지는 양산에 살다가 왔어.
그래서 이사를 왔는데,그래서 이사를 왔는데
처음 전학을 왔을 때는 친구가 없어서,처음 전학을 왔을 때는 친구가 없어서
맨날 수업시간 말고 쉬는 시간에 종 치면 혼자 앉아서 막,맨날 수업시간 말고 쉬는 시간에 종 치면 혼자 앉아서 막
그냥 가만히 앉아있는 그런 학생이었는데.,그냥 가만히 앉아있는 그런 학생이었는데.
그때 어떤 애가 처음으로 나한테 말을 걸어주고 쉬는 시간에 같이 놀자고 해서,그때 어떤 애가 처음으로 나한테 말을 걸어주고 쉬는 시간에 같이 놀자고 해서
어~ 그때부터 친구가 생겨서,어~ 그때부터 친구가 생겨서
원활한 학창시절을 보냈던 거 같아.,원활한 학창시절을 보냈던 거 같아.
그리고 이학년 때부터 졸업할 때까지는 되게 외향적인 학생으로 변모해서,그리고 이학년 때부터 졸업할 때까지는 되게 외향적인 학생으로 변모해서
반장도 계속 하고.,반장도 계속 하고.
학교 활동 같은 것도 엄청 많이 참여하고 친구들이랑 막 패거리 같은 것도 만들어서,학교 활동 같은 것도 엄청 많이 참여하고 친구들이랑 막 패거리 같은 것도 만들어서
막 놀고 막 뛰고 그런 거를 엄청 많이 했던 것 같애 그래서 초등학교 시절을 뭔가 돌아보면,막 놀고 막 뛰고 그런 거를 엄청 많이 했던 것 같애 그래서 초등학교 시절을 뭔가 돌아보면
되게 활달하고 활동적이었던 기억이 좀 전반적으로 있는 거 같애 너는 어땠어?,되게 활달하고 활동적이었던 기억이 좀 전반적으로 있는 거 같애 너는 어땠어?
나는 쫌 반대로 조용한,나는 조금 반대로 조용한
스타일이었던 거 같고 전반적으로.,스타일이었던 거 같고 전반적으로.
그리고,그리고
나는 왠지는 모르겠는데,나는 왠지는 모르겠는데
유치원 때 나는 기억은 안 나는데 엄마가 내가 왕따를 한 번 당해서,유치원 때 나는 기억은 안 나는데 엄마가 내가 왕따를 한 번 당해서
전학같은 걸 갔었다고 했거든 그래서 그때 기억인 때문인진 모르겠는데,전학같은 걸 갔었다고 했거든 그래서 그때 기억인 때문인진 모르겠는데
친구를 그렇게 막 두루두루 사귀는 게 힘들었어.,친구를 그렇게 막 두루두루 사귀는 게 힘들었어.
대신에 한 세 명에서 네 명 정도.,대신에 한 세 명에서 네 명 정도.
약간 끼리끼리 모여서 놀았는데 그때 우리 초등학교 때는,약간 끼리끼리 모여서 놀았는데 그때 우리 초등학교 때는
일진 같은 무서운 친구들이 많아서,일진 같은 무서운 친구들이 많아서
선생님이 담배 피우는 데 몰래 가서 선생님 담배 훔쳐서 피우고,선생님이 담배 피우는 데 몰래 가서 선생님 담배 훔쳐서 피우고
막 애들도 때리고 이런 애들이 많았어 그래서,막 애들도 때리고 이런 애들이 많았어 그래서
초등학교 때는 뭔가 그런 애들 눈에 안 띄고,초등학교 때는 뭔가 그런 애들 눈에 안 띄고
조용히 학교를 다니려고 노력했던 거 같고.,조용히 학교를 다니려고 노력했던 거 같고.
책 읽는 걸 좋아해서 맨날 학교에 책 가져가서 읽고.,책 읽는 걸 좋아해서 맨날 학교에 책 가져가서 읽고.
내가 그때 라디오 듣는 것도 좋아해서,내가 그때 라디오 듣는 것도 좋아해서
타블로의 꿈꾸는 라디오를,타블로의 꿈꾸는 라디오를
매일 밤 들었던 기억이 나.,매일 밤 들었던 기억이 나.
그리고,그리고
영어 학원을 다녔었는데,영어 학원을 다녔었는데
그~ 영어학원 숙제하는 게 힘들어서 매일 학교 쉬는 시간에 숙제를 했던 기억이.,그~ 영어학원 숙제하는 게 힘들어서 매일 학교 쉬는 시간에 숙제를 했던 기억이.
너는 그럼 중학교 때는 어땠어?,너는 그럼 중학교 때는 어땠어?
나는 중학교 때는,나는 중학교 때는
뭔가 일학년 이학년 때는 딱 한창 사춘기가 왔던 시기여서.,뭔가 일학년 이학년 때는 딱 한창 사춘기가 왔던 시기여서.
물론 공부도 열심히,물론 공부도 열심히
약간 초등학교 때 공부를 내가,약간 초등학교 때 공부를 내가
좀 잘하는 학생,좀 잘하는 학생
축에 속했던지라 중학교에 올라와서도 공부를 뭔가 열심히 하려곤 했지만,축에 속했던지라 중학교에 올라와서도 공부를 뭔가 열심히 하려곤 했지만
동시에 사춘기가 와서,동시에 사춘기가 와서
뭔가 이성이나 이런 것 이성이나 아니면 나를 꾸미는 것에 관심이 굉장히 많아져서,뭔가 이성이나 이런 것 이성이나 아니면 나를 꾸미는 것에 관심이 굉장히 많아져서
그때 당시에 유행했던 화장품이라던가,그때 당시에 유행했던 화장품이라던가
아니면 유행했던 옷 같은 것도 엄청 많이 사려고 했었고.,아니면 유행했던 옷 같은 것도 엄청 많이 사려고 했었고.
어~ 막 남자애들이랑 밤늦게까지 놀러 다니면서 독서실 막 계단에서 떠들고 놀고 그런 거를 되게 많이 했던 기억이,어~ 막 남자애들이랑 밤늦게까지 놀러 다니면서 독서실 막 계단에서 떠들고 놀고 그런 거를 되게 많이 했던 기억이
있어 근데 중학교 삼학년 때는,있어 근데 중학교 삼학년 때는
정신을 갑자기 번쩍 차려가지고,정신을 갑자기 번쩍 차려가지고
그때,그때
막 한참 특목고 붐이 일었던지라 나도,막 한참 특목고 붐이 일었던지라 나도
외고에 가고 싶다는 생각을 든 들어서,외고에 가고 싶다는 생각을 든 들어서
그러려면 성적 관리를 쫌 해야 되니깐 정신을 바짝 차리고,그러려면 성적 관리를 조금 해야 되니깐 정신을 바짝 차리고
영어 공부를 열심히 했던 거 같아 그리고,영어 공부를 열심히 했던 거 같아 그리고
동시에 중학교 삼학년 때,동시에 중학교 삼학년 때
남자친구를 사겼었는데 걔가,남자친구를 사귀었었는데 걔가
되게 공부를 열심히 하는 애었던지라,되게 공부를 열심히 하는 애었던지라
그리고 걔네 담임 선생님이 내가 굉장히 좋아해서 그~ 선생님한테 잘 보이려고 그~ 남자친구랑 더,그리고 걔네 담임 선생님이 내가 굉장히 좋아해서 그~ 선생님한테 잘 보이려고 그~ 남자친구랑 더
애정 행각을 열심히 했었던 기억이 있어.,애정 행각을 열심히 했었던 기억이 있어.
그래서 중학교 때는 뭔가 이성 친구로,그래서 중학교 때는 뭔가 이성 친구로
생각이 많이 나는 그런 시절인 거 같애 너는 어땠어 중학교 때?,생각이 많이 나는 그런 시절인 거 같애 너는 어땠어 중학교 때?
내가 그때 아이돌을 좋아했었는데 그때 같이 아이돌을 좋아했었던 친구들이랑,내가 그때 아이돌을 좋아했었는데 그때 같이 아이돌을 좋아했었던 친구들이랑
재미있게 놀았던 기억이 나고,재미있게 놀았던 기억이 나고
그리고 나도 사춘기가 왔어서 엄마랑 마찰이 많았는데,그리고 나도 사춘기가 왔어서 엄마랑 마찰이 많았는데
그것 때문에 오히려 고등학교를 어떻게 해야 될지에 대한 고민이 컸던 거 같애.,그것 때문에 오히려 고등학교를 어떻게 해야 될지에 대한 고민이 컸던 거 같애.
뭔가 이대로 다른 애들이 가는 방향이랑 똑같이 인문계 고등학교에 진학하면,뭔가 이대로 다른 애들이 가는 방향이랑 똑같이 인문계 고등학교에 진학하면
어~ 우리 집에서 통학을 해야 되고 엄마랑 왠지 공부 때문에 더 다툼이 있을 것 같았고.,어~ 우리 집에서 통학을 해야 되고 엄마랑 왠지 공부 때문에 더 다툼이 있을 것 같았고.
오히려 아니면 특목고 쪽으로 가서 취직을 해볼까 생각을 했는데.,오히려 아니면 특목고 쪽으로 가서 취직을 해볼까 생각을 했는데.
그건 또 내 길이 아닌 거 같았어.,그건 또 내 길이 아닌 거 같았어.
나는 쫌 대학을 가서 공부를 더 많이 하고 싶었어서,나는 조금 대학을 가서 공부를 더 많이 하고 싶었어서
엄마가 그럼 외고는 어떻겠냐라고 물어봐서 나도 중학교 삼학년 때,엄마가 그럼 외고는 어떻겠냐라고 물어봐서 나도 중학교 삼학년 때
별 생각이 없었다가 외고 입시를 준비했던 거 같애.,별 생각이 없었다가 외고 입시를 준비했던 거 같애.
그래도 나는 영어를 공부하는 게 다른 과목들보다 더 재미있었고,그래도 나는 영어를 공부하는 게 다른 과목들보다 더 재미있었고
그래서 나름대로 내신이 괜찮았어서,그래서 나름대로 내신이 괜찮았어서
이거 그냥 중학교 삼학년 바짝 영어 공부하고 운이 좋게도,이거 그냥 중학교 삼학년 바짝 영어 공부하고 운이 좋게도
외고에 입학할 수 있었던 거 같애.,외고에 입학할 수 있었던 거 같애.
지금 생각해보면 중학교 시절은,지금 생각해보면 중학교 시절은
좀 도전 같은 것도 많이 했다고 해야 되나 아까 말했듯이 나는 친구를 그렇게 두루두루 사귀는 편이 아니었는데,좀 도전 같은 것도 많이 했다고 해야 되나 아까 말했듯이 나는 친구를 그렇게 두루두루 사귀는 편이 아니었는데
담임 선생님이 갑자기 전교회장 후보에 여자가 없다고,담임 선생님이 갑자기 전교회장 후보에 여자가 없다고
나한테 나가라고 하는 거야 근데 나는 거절했었는데,나한테 나가라고 하는 거야 근데 나는 거절했었는데
엄마가 내가 조퇴해서 집에서 자는 동안 갑자기 알겠다고 해버린 거야.,엄마가 내가 조퇴해서 집에서 자는 동안 갑자기 알겠다고 해버린 거야.
그래서 나도 모르게 도전 아닌 도전을 하게 됐던,그래서 나도 모르게 도전 아닌 도전을 하게 됐던
쫌 내 인생에 몇 안 되는 과감한 도전을 했던 시기였던 거 같애.,조금 내 인생에 몇 안 되는 과감한 도전을 했던 시기였던 거 같애.
그리고 우리가 고등학교를 또 같이 나왔는데,그리고 우리가 고등학교를 또 같이 나왔는데
너의 고등학교는 어땠니?,너의 고등학교는 어땠니?
일단은 나는 고등학교 일학년 때부터 찬찬히 우리 일년씩 생각을 쫌 해보자면.,일단은 나는 고등학교 일학년 때부터 찬찬히 우리 일년씩 생각을 조금 해보자면.
중학교 때 사실 학교에서,중학교 때 사실 학교에서
임원같은 것도 많이 했었고 그래도,임원같은 것도 많이 했었고 그래도
공부를 쫌 괜찮게 하고 또 이것저것 열심히 하는 학생으로,공부를 조금 괜찮게 하고 또 이것저것 열심히 하는 학생으로
학교 전반적으로 쫌 인정을 받는 학생이었는데 고등학교에 딱 입학하자마자 느낀 거는 그런,학교 전반적으로 조금 인정을 받는 학생이었는데 고등학교에 딱 입학하자마자 느낀 거는 그런
흔히 말하는 학교에서 쫌 날고 기는 애들이 다 한 자리에,흔히 말하는 학교에서 조금 날고 기는 애들이 다 한 자리에
모였다는 생각이 딱 먼저 드는 거야.,모였다는 생각이 딱 먼저 드는 거야.
그래서 지금까지는 학교에서 뭔가 나를 모르는 선생님이 없고,그래서 지금까지는 학교에서 뭔가 나를 모르는 선생님이 없고
그리고 내가 뭔가를 했을 때 그거에 대한 전폭적인 지지를 받는 것에 굉장히 익숙해져 있었는데,그리고 내가 뭔가를 했을 때 그거에 대한 전폭적인 지지를 받는 것에 굉장히 익숙해져 있었는데
고등학교에 딱 입학 하니깐 그게 아무 것도 없고,고등학교에 딱 입학 하니깐 그게 아무 것도 없고
내가 그런 것들을 뭔가 나의 자랑거리로 이야기하기에는 다들 그런 애들이 다 모여 있었던 거야 그래서,내가 그런 것들을 뭔가 나의 자랑거리로 이야기하기에는 다들 그런 애들이 다 모여 있었던 거야 그래서
사실 처음에는,사실 처음에는
어~ 그런 애들 사이에서 내가 어떻게 삼 년을 보내고 또,어~ 그런 애들 사이에서 내가 어떻게 삼 년을 보내고 또
우리나라 내신 등급 상 얘네 사이에서 경쟁을 해서,우리나라 내신 등급 상 얘네 사이에서 경쟁을 해서
그리고 그~ 순위를 매겨야 되는데 그거를 어떻게 해야 될지에 대한 고민이 진짜 많이 컸었는데,그리고 그~ 순위를 매겨야 되는데 그거를 어떻게 해야 될지에 대한 고민이 진짜 많이 컸었는데
근데 문제는 그게 고민에서 끝나지 않고 실천으로 이어져야 되는데 나는 고민만 했다 일학년 때는 그래서,근데 문제는 그게 고민에서 끝나지 않고 실천으로 이어져야 되는데 나는 고민만 했다 일학년 때는 그래서
첫 번째 일학년 때 일단 딱 들어가서 그런 생각에 쫌,첫 번째 일학년 때 일단 딱 들어가서 그런 생각에 조금
힘들기도 했는데 나보다 더 힘들어하는 애들이 너무 많아서 걔네를 보면서 뭔가,힘들기도 했는데 나보다 더 힘들어하는 애들이 너무 많아서 걔네를 보면서 뭔가
아~ 힘들지만,아~ 힘들지만
저렇게까지 힘들어야 되는 일인가 라는 생각이 쫌 많이 들었던 거 같애 그래서,저렇게까지 힘들어야 되는 일인가 라는 생각이 조금 많이 들었던 거 같애 그래서
입학을 하고,입학을 하고
쫌 그래도 일단은 뭔가 외고에 왔으니까 열심히 공부를 해보자는 생각이 들어서,조금 그래도 일단은 뭔가 외고에 왔으니까 열심히 공부를 해보자는 생각이 들어서
쫌 열심히 해 봤는데,조금 열심히 해 봤는데
내가 생각했던 것보다 성적이 너무 안 나오는 거야 그래서 쫌 깜짝 놀라고 얘네는 진짜 뭐하는 애들인가.,내가 생각했던 것보다 성적이 너무 안 나오는 거야 그래서 조금 깜짝 놀라고 얘네는 진짜 뭐하는 애들인가.
내가 공부를 하고 뭔가 노력을 하면 따라잡을 수 있을 거라고 생각했는데,내가 공부를 하고 뭔가 노력을 하면 따라잡을 수 있을 거라고 생각했는데
뭔가 진짜 똑똑한 애들이 있다는 게 딱 느껴지면서 내 한계를 좀 많이 느꼈던 게 일학년 시기였던 것 같아.,뭔가 진짜 똑똑한 애들이 있다는 게 딱 느껴지면서 내 한계를 좀 많이 느꼈던 게 일학년 시기였던 것 같아.
그리고 동시에 우리 학교가 쫌,그리고 동시에 우리 학교가 조금
그런 과 문화가 있었던 만큼,그런 과 문화가 있었던 만큼
그리고 우리 과가 약간 그런 단합심이나 그런 쫌 뭐라고 해야 될까 연대심 같은 거를 쫌 강조를 했던만큼,그리고 우리 과가 약간 그런 단합심이나 그런 조금 뭐라고 해야 될까 연대심 같은 거를 조금 강조를 했던만큼
쫌 다른 애들이랑 두루두루 친하게 지내야겠다는 생각에,조금 다른 애들이랑 두루두루 친하게 지내야겠다는 생각에
쫌 인간관계 구축에 노력을 쫌 많이 했었던 것 같은 기억이,조금 인간관계 구축에 노력을 조금 많이 했었던 것 같은 기억이
일학년 때는 아무래도 제일 큰 거 같애.,일학년 때는 아무래도 제일 큰 거 같애.
니 일학년 때는 쫌 어땠어?,너 일학년 때는 조금 어땠어?
일단 일학년 때는 너랑 다른 반이었고,일단 일학년 때는 너랑 다른 반이었고
우리가 그래도 같은 독일어과 출신인데,우리가 그래도 같은 독일어과 출신인데
독일어과는 반이 두 개밖에 없었잖아.,독일어과는 반이 두 개밖에 없었잖아.
근데 일단은 너랑 떨어지게 됐고 그때는 너의 존재에 대해서 그렇게 잘은 알지 못했던 것 같애.,근데 일단은 너랑 떨어지게 됐고 그때는 너의 존재에 대해서 그렇게 잘은 알지 못했던 것 같애.
일학년 때도 나도 마찬가지로 나는 중학교 때 그렇게 막 선생님들이,일학년 때도 나도 마찬가지로 나는 중학교 때 그렇게 막 선생님들이
너무 잘났다고 막 이렇게 추켜세워주진 않았지만 그래도 어느정도,너무 잘났다고 막 이렇게 추켜세워주진 않았지만 그래도 어느정도
공부도 뭐~ 쫌 잘 하고 글도 쫌 뭐~ 잘 쓰고.,공부도 뭐~ 조금 잘 하고 글도 조금 뭐~ 잘 쓰고.
영재원도 다녔었고 그래서 나름대로,영재원도 다녔었고 그래서 나름대로
내 자신에 대한 프라이드 같은 것이 있었는데,내 자신에 대한 프라이드 같은 것이 있었는데
고등학교에 들어오고 나니까,고등학교에 들어오고 나니까
뭔가 애매한 재능을 가질 바에는,뭔가 애매한 재능을 가질 바에는
안 가지는 게 낫다는 생각을 참 많이 했었던 거 같애 왜냐면,안 가지는 게 낫다는 생각을 참 많이 했었던 거 같애 왜냐면
일단 애매한 재능 정도의 재능은 우리 고등학교 입학생들이라면 다 가지고 있고 다 똑똑한 기본적으로 똑똑한 애들인데.,일단 애매한 재능 정도의 재능은 우리 고등학교 입학생들이라면 다 가지고 있고 다 똑똑한 기본적으로 똑똑한 애들인데.
그 사이에서도 정말 말도 안 되는 성실함이나 독기 같은 거 가진 애들이 참 많다고 느꼈거든.,그 사이에서도 정말 말도 안 되는 성실함이나 독기 같은 거 가진 애들이 참 많다고 느꼈거든.
나는 일단 성실한 거는 둘째 치고 그~,나는 일단 성실한 거는 둘째 치고 그~
한번 공부를 시작했으면 끝까지 할 때까지 놓지 않는 그런,한번 공부를 시작했으면 끝까지 할 때까지 놓지 않는 그런
애살 같은 게 정말 한 번도 있어본 적이 없고 지금도 그런 성격이 아니라고 생각해서,샘 같은 게 정말 한 번도 있어본 적이 없고 지금도 그런 성격이 아니라고 생각해서
고등학교를 적응하는 데에 쫌 힘들었던 거 같애 다른 애들이 다,고등학교를 적응하는 데에 조금 힘들었던 거 같애 다른 애들이 다
새벽 두 시 세 시까지 공부하고 아침에 여섯 시에 일어나서 학교 가고,새벽 두 시 세 시까지 공부하고 아침에 여섯 시에 일어나서 학교 가고
수업시간에도 열두 시까지 야자하고 그렇게 나는 매일매일 버티는 거 자체가 힘들었는데,수업시간에도 열두 시까지 야자하고 그렇게 나는 매일매일 버티는 거 자체가 힘들었는데
다른 친구들은 거기서 아~ 좀 더 해야 돼.,다른 친구들은 거기서 아~ 좀 더 해야 돼.
좀 더 해야 돼하고 본인을 약간 채찍질 하는 게,좀 더 해야 돼하고 본인을 약간 채찍질 하는 게
나는 적응하기 힘들었던 것 같고.,나는 적응하기 힘들었던 것 같고.
그래도 다행이었던 거는,그래도 다행이었던 거는
내가 중국어과나 일본어과가 아니라 독일어과라서,내가 중국어과나 일본어과가 아니라 독일어과라서
쫌 운이 좋았다고 말할 수 있을 있을 거 같애.,조금 운이 좋았다고 말할 수 있을 있을 거 같애.
왜냐면 쫌 중어과는 과마다 약간 분위기가 다른데 중어과는 공부를 진짜 완전 빡세게 하는 똑똑하고,왜냐면 조금 중어과는 과마다 약간 분위기가 다른데 중어과는 공부를 진짜 완전 빡세게 하는 똑똑하고
집안도 잘난 애들이 많아.,집안도 잘난 애들이 많아.
일본어과는 쫌 그런 그 정도까진 아니었지만 열심히 하는 애들 엄청 많았고.,일본어과는 조금 그런 그 정도까진 아니었지만 열심히 하는 애들 엄청 많았고.
근데 우리 과는 물론 뭐~ 다 열심히 했지만서도,근데 우리 과는 물론 뭐~ 다 열심히 했지만서도
쫌 즐기는 애들이 많았었던 거 같고.,조금 즐기는 애들이 많았었던 거 같고.
또 놀 노는 거를 좋아하는 애들이 많아서,또 놀 노는 거를 좋아하는 애들이 많아서
쫌 쉬는 시간에나 점심시간에나 어울려서 놀 수 있었던 그~ 잠깐이 쫌 행복했었던 거 같애.,조금 쉬는 시간에나 점심시간에나 어울려서 놀 수 있었던 그~ 잠깐이 조금 행복했었던 거 같애.
그때,그때
나는 일학년 하면 기억이 나는 게 명상의 시간이라고,나는 일학년 하면 기억이 나는 게 명상의 시간이라고
우리가 영어 듣기 끝나고 야자하기 전에,우리가 영어 듣기 끝나고 야자하기 전에
한 십 분 정도 방송부에서 명상 같은,한 십 분 정도 방송부에서 명상 같은
라디오 진행 같은 걸 해주면서 명상을 하는 시간이 있었는데,라디오 진행 같은 걸 해주면서 명상을 하는 시간이 있었는데
그때 우리가 학기 초라서 다 적응하기 힘들어하고,그때 우리가 학기 초라서 다 적응하기 힘들어하고
기숙사 생활을 처음 해보다보니까 엄마 아빠가 너무 보고 싶었던 거야.,기숙사 생활을 처음 해보다보니까 엄마 아빠가 너무 보고 싶었던 거야.
그래서 애들이 다 같이,그래서 애들이 다 같이
명상의 시간을  들으면서 울었던 기억이 있는데.,명상의 시간을  들으면서 울었던 기억이 있는데.
그때 참.,그때 참.
한 삼십 분만 차 타고 가면 엄마 아빠 다 볼 수 있었는데도 그때는,한 삼십 분만 차 타고 가면 엄마 아빠 다 볼 수 있었는데도 그때는
그게 참 혼자 동떨어진 것 같은 불안한 기분 때문에 우리가 다 같이 울었던 거 같애.,그게 참 혼자 동떨어진 것 같은 불안한 기분 때문에 우리가 다 같이 울었던 거 같애.
그리고 일학년 때 뉴질랜드에서 십 년 살다온  라는 친구가 있었는데,그리고 일학년 때 뉴질랜드에서 십 년 살다온  라는 친구가 있었는데
그 친구랑 나랑 같이 기숙사로 하교를 했거든?,그 친구랑 나랑 같이 기숙사로 하교를 했거든?
근데 걔가 하늘을 보면서 와 오늘은 별이 참 많다 이러는 거야.,근데 걔가 하늘을 보면서 와 오늘은 별이 참 많다 이러는 거야.
근데 내 생각에는 해운대에서 별이 보일 수가 없거든?,근데 내 생각에는 해운대에서 별이 보일 수가 없거든?
인공위성이란 말이야 그래서 나는 그때 또 고집이 셌어서 아니다 저거는 인공위성이다 라고 말했는데,인공위성이란 말이야 그래서 나는 그때 또 고집이 셌어서 아니다 저거는 인공위성이다 라고 말했는데
는 뉴질랜드에서 살다온 깨끗한 영혼이라서 계속 끝까지 아니다 그럴 리가 없다 저건 무조건 별일 것이다 라고 했어.,는 뉴질랜드에서 살다온 깨끗한 영혼이라서 계속 끝까지 아니다 그럴 리가 없다 저건 무조건 별일 것이다 라고 했어.
그래서 나도 약간 화가 났나 봐 인공위성인데.,그래서 나도 약간 화가 났나 봐 인공위성인데.
그래서 아니야 인공위성이야 이랬는데 가 갑자기 울음을 터뜨려서 내가 정말 당황했던,그래서 아니야 인공위성이야 이랬는데 가 갑자기 울음을 터뜨려서 내가 정말 당황했던
기억이 일학년 기억 중에 제일 강렬했던 기억인 것.,기억이 일학년 기억 중에 제일 강렬했던 기억인 것.
그리고 우리 이학년 때는 같은 반이 되었잖아 그거에 대해서 말을 해볼까?,그리고 우리 이학년 때는 같은 반이 되었잖아 그거에 대해서 말을 해볼까?
그래 좋아.,그래 좋아.
일학년 때는 뭔가 혼돈의 카오스를,일학년 때는 뭔가 혼돈의 카오스를
뭐~ 어떻게 지냈는지 나는 지금 돌아보면 정확하게 기억은 잘 안 나는데.,뭐~ 어떻게 지냈는지 나는 지금 돌아보면 정확하게 기억은 잘 안 나는데.
이제 본격적으로 뭔가,이제 본격적으로 뭔가
크게 이바지를 하고,크게 이바지를 하고
고등학교 시절에서 많은 기억을 차지했던 게 쫌 이학년 삼학년이라고 생각을 했었는데,고등학교 시절에서 많은 기억을 차지했던 게 조금 이학년 삼학년이라고 생각을 했었는데
일단,일단
일학년 때는 약간 그~ 독어과 내에서 나랑 쫌 잘 맞을 거 같은 사람이 누군지를 쫌 탐색하는 시기였다면,일학년 때는 약간 그~ 독어과 내에서 나랑 조금 잘 맞을 거 같은 사람이 누군지를 조금 탐색하는 시기였다면
