사투리,표준어
줄이 없어졌다고 이렇게  편해질 게 있을까 했는데 너무,줄이 없어졌다고 이렇게  편해질 게 있을까 했는데 너무
생활의 질이 쫌 올라가더라고요 이게 어떤,생활의 질이 조금 올라가더라고요 이게 어떤
아까 말씀드렸듯이 이제 지하철 탈 때도 막 걸리는 거 없고,아까 말씀드렸듯이 이제 지하철 탈 때도 막 걸리는 거 없고
확실히 폰에서 노래 들을 때 뭐~,확실히 폰에서 노래 들을 때 뭐~
폰을 쫌 멀리 놔 둘 수도 있고 이제 쫌 줄이 있으면 이제 제 몸과 폰이 연결돼 있는 부분인 거잖아요?,폰을 조금 멀리 놓아 둘 수도 있고 이제 조금 줄이 있으면 이제 제 몸과 폰이 연결돼 있는 부분인 거잖아요?
그러니까 손이라던지 가방이라던지 막 걸리는 게 많았었는데,그러니까 손이라던지 가방이라던지 막 걸리는 게 많았었는데
그런 거에서 되게 자유가 된다는 거에서 되게 뭐~ 메리트를 느꼈고요 그리고,그런 거에서 되게 자유가 된다는 거에서 되게 뭐~ 메리트를 느꼈고요 그리고
또 운동할 때도 너무 편했어요 이케 운동하면서,또 운동할 때도 너무 편했어요 이렇게 운동하면서
이제 줄이 이제 런닝을 하게 되면 줄이 이렇게 뭐라 해야 되지?,이제 줄이 이제 런닝을 하게 되면 줄이 이렇게 뭐라 해야 되지?
달랑달랑거린다 해야 되나 그런 식으로 이렇게 흔들리니까,달랑달랑거린다 해야 되나 그런 식으로 이렇게 흔들리니까
그게 쪼금 불편한 거까지는 못 느꼈었거든요 그 때 이거 사기 전까진,그게 쪼금 불편한 거까지는 못 느꼈었거든요 그 때 이거 사기 전까진
근데 이걸 사고 나니까 그게 진짜 불편한 거였구나라는 생각이 들었고,근데 이걸 사고 나니까 그게 진짜 불편한 거였구나라는 생각이 들었고
그러면서 저는 이런 이러면서 저도 이제 이제,그러면서 저는 이런 이러면서 저도 이제 이제
왜 사람들이 왜 무선 이어폰을 어~ 쓰게 되는지,왜 사람들이 왜 무선 이어폰을 어~ 쓰게 되는지
저도 이제 그런 걸 몸소 체험하면서 느끼면서,저도 이제 그런 걸 몸소 체험하면서 느끼면서
그래서 저는 이제 주변 사람들 이제는,그래서 저는 이제 주변 사람들 이제는
거의 없는 거 같아요 진짜 이어폰을 쓰는 사람들은 거의 없는 거 같고,거의 없는 거 같아요 진짜 이어폰을 쓰는 사람들은 거의 없는 거 같고
거의 무선으로 쓰는데 이제 그 때 저도 바꿔 갔을 때,거의 무선으로 쓰는데 이제 그 때 저도 바꿔 갔을 때
어~ 주변 사람들한테 다 추천을 했던 거 같애요 이게,어~ 주변 사람들한테 다 추천을 했던 거 같애요 이게
비싸지만 그래도 그만큼의 질이 올라간다는 거에,비싸지만 그래도 그만큼의 질이 올라간다는 거에
어~ 진짜 그런 업그레이드가 된다는 거에 되게,어~ 진짜 그런 업그레이드가 된다는 거에 되게
저는 되게 큰 어~ 메리트였던 거 같아요.,저는 되게 큰 어~ 메리트였던 거 같아요.
혹시 뭐~ 이런 이어폰 말고라도 뭐~ 아니면 그냥 이어폰이라도,혹시 뭐~ 이런 이어폰 말고라도 뭐~ 아니면 그냥 이어폰이라도
이제 쫌 잘,이제 조금 잘
어~ 이렇게 저한 저처럼 이걸 썼는데 너무 좋았다 추천하고 싶은 제품이 있으신가요?,어~ 이렇게 저한 저처럼 이걸 썼는데 너무 좋았다 추천하고 싶은 제품이 있으신가요?
제가 생각해 봤던 것 중에 가장 저는,제가 생각해 봤던 것 중에 가장 저는
제일 괜찮았던 제품은 애플의 에어팟 프로 제품인 거 같애요.,제일 괜찮았던 제품은 애플의 에어팟 프로 제품인 거 같애요.
