사투리,표준어
일단은 두 차 급이 달라가지고 뭐~,일단은 두 차 급이 달라가지고 뭐~
동급으로 비교하면은 고민이 되겠지만 아~ 아~,동급으로 비교하면은 고민이 되겠지만 아~ 아~
이건 이거는 아~ 이거는 동급을 떠나가지고 어~ 투싼과 싼타페는 급이 다르지만,이건 이거는 아~ 이거는 동급을 떠나가지고 어~ 투싼과 싼타페는 급이 다르지만
일단 디자인적으로 일단 투싼이 너무 끌려.,일단 디자인적으로 일단 투싼이 너무 끌려.
싼타페는 일단은 소위 말해서 못생겼어.,싼타페는 일단은 소위 말해서 못생겼어.
무슨 탐킨지처럼 생긴 차가 나와가지고 이~ 소비자의 마음을 어떻 돌릴라고 하는지는 모르겠는데,무슨 탐킨지처럼 생긴 차가 나와가지고 이~ 소비자의 마음을 어떻 돌릴라고 하는지는 모르겠는데
아~ 싼타페 이번에 나오는 페이스 리프트는 너무 못생겨가지고 마음이 일도 안 가고,아~ 싼타페 이번에 나오는 페이스 리프트는 너무 못생겨가지고 마음이 일도 안 가고
차라리 한 급이 낮은 그~ 현대 투싼이 난 더 나은 것 같더라고,차라리 한 급이 낮은 그~ 현대 투싼이 난 더 나은 것 같더라고
투싼은 진 현대가 이를 갈고 풀체인지를 해가지고,투싼은 진 현대가 이를 갈고 풀체인지를 해가지고
어~ 아까 말했던 실내부터 실외관 디자인까지,어~ 아까 말했던 실내부터 실외관 디자인까지
어~ 너무 그냥 딱 소비자가,어~ 너무 그냥 딱 소비자가
마음에 딱 끌리게 만들었더라고 그래서 이 두 차를 고민한다면,마음에 딱 끌리게 만들었더라고 그래서 이 두 차를 고민한다면
응~ 주저하지 않고 싼타페보다 급이 낮은 난 투싼을 선택할래.,응~ 주저하지 않고 싼타페보다 급이 낮은 난 투싼을 선택할래.
싼타페 그~ 요새 너무 못생기게 나와 가지고 어~ 실제로,싼타페 그~ 요새 너무 못생기게 나와 가지고 어~ 실제로
소렌토보다 짐 판매율이 짐 뒤지는 걸로 알고 있거든?,소렌토보다 짐 판매율이 짐 뒤지는 걸로 알고 있거든?
이번에 기아 쏘렌토도 너무 현 기아에서 이를 갈고 만들어 가지고 아~ 인기가 진짜로 많아.,이번에 기아 쏘렌토도 너무 현 기아에서 이를 갈고 만들어 가지고 아~ 인기가 진짜로 많아.
쏘렌토 디자인이 어~,쏘렌토 디자인이 어~
완 백팔십 도 바껴가지고 풀체인지가 됐는데 어~ 현대도,완 백팔십 도 바뀌어가지고 풀체인지가 됐는데 어~ 현대도
어~ 탁탁 완전 그~ 뭐랄까 딱 그~,어~ 탁탁 완전 그~ 뭐랄까 딱 그~
현대도 되게 실내가,현대도 되게 실내가
직선을 많이 사용하면서 되게 이쁘게 나왔고,직선을 많이 사용하면서 되게 이쁘게 나왔고
또 케이파이브에 어~ 실내 디자인 극찬을 받은 케이파이브 디자인을 쫌 계승하면서,또 케이파이브에 어~ 실내 디자인 극찬을 받은 케이파이브 디자인을 조금 계승하면서
만들어 가지고 또 기아  패밀리룩을 또 만들지 않았나 그렇게 생각도 해.,만들어 가지고 또 기아  패밀리룩을 또 만들지 않았나 그렇게 생각도 해.
일단은 셀 쏘렌토는,일단은 셀 쏘렌토는
그~ 실외를 흰색으로 했을 때 아~ 진짜,그~ 실외를 흰색으로 했을 때 아~ 진짜
이렇게 예쁜 차가 있을까 싶은 그런 차여서,이렇게 예쁜 차가 있을까 싶은 그런 차여서
어~ 솔직히 마음 같아서는 쏘렌토를 몰고 싶은 마음이 굴뚝 같지만,어~ 솔직히 마음 같아서는 쏘렌토를 몰고 싶은 마음이 굴뚝 같지만
이~ 사회 초년생의 입장으로서 그거는 그림의 떡이 아닐까.,이~ 사회 초년생의 입장으로서 그거는 그림의 떡이 아닐까.
어~ 내 분수에 맞게 어~ 기아 셀토스를 타 걍,어~ 내 분수에 맞게 어~ 기아 셀토스를 타 그냥
그런 생각을 하고 있네.,그런 생각을 하고 있네.
쏘렌토는 나중에 나도 가정이 생기면,쏘렌토는 나중에 나도 가정이 생기면
그런 쫌 큰 에스유브이를 쫌 만들어서 어~ 패밀리카로,그런 조금 큰 에스유브이를 조금 만들어서 어~ 패밀리카로
고렇게 한번 사보고 싶네.,고렇게 한번 사보고 싶네.
그리고 요새 최근에 나온 제니시스 어~ 지브이칠봉,그리고 요새 최근에 나온 제니시스 어~ 지브이칠봉
아~ 지브이칠공이 진짜로 예쁘게 나왔더라고,아~ 지브이칠공이 진짜로 예쁘게 나왔더라고
다만 가격에 비해서 실내가 쫌 좁은 것은 단점이지만,다만 가격에 비해서 실내가 조금 좁은 것은 단점이지만
그리고 옵션 장난도 쪼끔 심한데,그리고 옵션 장난도 쪼끔 심한데
이~ 아~ 컴패트한 에스유브이가 제이비 프 지브이 칠공이 아~ 너무 이쁘게 나와 가지고,이~ 아~ 컴패트한 에스유브이가 제이비 프 지브이 칠공이 아~ 너무 이쁘게 나와 가지고
아~ 그거를  한번 타보고는 싶네.,아~ 그거를  한번 타보고는 싶네.
그~ 지브이칠공 실내를 또 블랙과 베이지 조합으로 하면은,그~ 지브이칠공 실내를 또 블랙과 베이지 조합으로 하면은
어~ 이~ 감성은 너무 예쁜데  니가 한 번 찾아보길 바라고,어~ 이~ 감성은 너무 예쁜데  네가 한 번 찾아보길 바라고
반면에 이번에 지 칠공 페이스리프트는 아~ 너무 쫌 파리 같고 못생겼어.,반면에 이번에 지 칠공 페이스리프트는 아~ 너무 조금 파리 같고 못생겼어.
만약에 니가 지금 제니시스를 아~ 지금 니가 제니시스 짐 좋아하니까,만약에 네가 지금 제니시스를 아~ 지금 네가 제니시스 짐 좋아하니까
어~ 제니시스 차 중에서 지팔공을 제외한 지칠공과,어~ 제니시스 차 중에서 지팔공을 제외한 지칠공과
지브이칠공 니는 요 중에서 뭐를 더 선호하는데?,지브이칠공 너는 요 중에서 뭐를 더 선호하는데?
저는 솔직히 둘 다 선호하진 않지만 굳이 둘 중 하나를 사야 된다면은,저는 솔직히 둘 다 선호하진 않지만 굳이 둘 중 하나를 사야 된다면은
어~ 지칠공을 살 것 같은 게 왜냐하면은,어~ 지칠공을 살 것 같은 게 왜냐하면은
제가 쫌,제가 조금
세단을 좋아해요 에스유브이도 좋아하긴 하지만,세단을 좋아해요 에스유브이도 좋아하긴 하지만
나중에 정말,나중에 정말
돈만 있다면은 세단을 사고 싶어 하는 사람으로서 저 같으면은,돈만 있다면은 세단을 사고 싶어 하는 사람으로서 저 같으면은
같은 조건이면은 세단을 무조건 살 것 같애요.,같은 조건이면은 세단을 무조건 살 것 같애요.
그래서 지브이칠공이 요번에 약간 메기 같이 디자인이  안 이쁘게 나온 거는 인정 하나,그래서 지브이칠공이 요번에 약간 메기 같이 디자인이  안 이쁘게 나온 거는 인정 하나
그거는 지팔공이 너무 이쁘게 나와서 더욱더 부각된 것 같고,그거는 지팔공이 너무 이쁘게 나와서 더욱더 부각된 것 같고
저는 지칠공도 예전 지칠공에 비해서는 전,저는 지칠공도 예전 지칠공에 비해서는 전
괜찮다고 생각하 예전 지필공에 비해서는 그래서,괜찮다고 생각하 예전 지필공에 비해서는 그래서
굳이 산다면은 지칠공을 살 것 같애요 그리고 내부 같은 경우에도,굳이 산다면은 지칠공을 살 것 같애요 그리고 내부 같은 경우에도
제네시스는 세단이 훨씬 더,제네시스는 세단이 훨씬 더
안에 뭐~ 야 아기자기하게 많고 괜찮은 것 같애서,안에 뭐~ 야 아기자기하게 많고 괜찮은 것 같애서
지칠공 괜찮은 것 같애요 그리고 색깔 같은 경우도 지칠공이 회색?,지칠공 괜찮은 것 같애요 그리고 색깔 같은 경우도 지칠공이 회색?
계열로 뽑으면은 되게 이쁠 것 같다는 생각을 한 적이 있어서,계열로 뽑으면은 되게 이쁠 것 같다는 생각을 한 적이 있어서
막상 또 제 돈으로는 안 사겠지만 하늘에서 뚝 떨어진다면은,막상 또 제 돈으로는 안 사겠지만 하늘에서 뚝 떨어진다면은
만족하면서 타지 않을까 그렇게,만족하면서 타지 않을까 그렇게
그렇게 생각은 하고 있습니다.,그렇게 생각은 하고 있습니다.
