사투리,표준어
그리구 바뀐 척하는 거다.,그리고 바뀐 척하는 거다.
어~ 뉘우치는 척하는 거다.,어~ 뉘우치는 척하는 거다.
이런 말을 쫌 자주 하거든요.,이런 말을 조금 자주 하거든요.
그게 그 사람을 못 믿는다기보다는 그냥 인간의 본성 자체가 바뀌지 않는 거 같애요.,그게 그 사람을 못 믿는다기보다는 그냥 인간의 본성 자체가 바뀌지 않는 거 같애요.
바뀌는 게 힘들고 그래서 저는 제가 직접적으로 지금 뭐~,바뀌는 게 힘들고 그래서 저는 제가 직접적으로 지금 뭐~
당장 뭔가 경험한 건 없으나 저도 알게 모르게,당장 뭔가 경험한 건 없으나 저도 알게 모르게
많이 그런 걸 당했지 않았을까 하면서도,많이 그런 걸 당했지 않았을까 하면서도
어~ 저를 위해서든 타인을 위해서든 일상생활에서 이제,어~ 저를 위해서든 타인을 위해서든 일상생활에서 이제
녹음을 어~ 꼭 하는 음~ 편이구요.,녹음을 어~ 꼭 하는 음~ 편이구요.
그렇기 때문에,그렇기 때문에
우리가 지금 뭐~ 생겨난 법에서도 쫌 고쳐야 할 부분이라던지,우리가 지금 뭐~ 생겨난 법에서도 조금 고쳐야 할 부분이라던지
개정했으면 하는 거라던지,개정했으면 하는 거라던지
또 생겼으면 하는 또,또 생겼으면 하는 또
법률적인 면으로 혹시 있으신가요?,법률적인 면으로 혹시 있으신가요?
어~ 생겼으면 하는 법 이런 법률 이게,어~ 생겼으면 하는 법 이런 법률 이게
법이라는 게 참,법이라는 게 참
이제 가까이 일상생활에서 정말 법에 둘러싸여 있으면서도,이제 가까이 일상생활에서 정말 법에 둘러싸여 있으면서도
이게 내가 친하다고 생각을 못 하는 거 같애요.,이게 내가 친하다고 생각을 못 하는 거 같애요.
그래서 법을 쫌 잘 알아야지 훨씬 살기가 편한 거는 맞는데 어~ 뭘,그래서 법을 조금 잘 알아야지 훨씬 살기가 편한 거는 맞는데 어~ 뭘
쫌 워낙 수동적인 삶이다 보니,조금 워낙 수동적인 삶이다 보니
그냥 죄만 안 짓고 살자라고 생각을 하고 있는데,그냥 죄만 안 짓고 살자라고 생각을 하고 있는데
생겼으면 하는 법까지는 생각을 해 본 적은 없고,생겼으면 하는 법까지는 생각을 해 본 적은 없고
지금 생각나는 건 없구요 아~ 그냥 법은 아닌데 그냥 쪼금,지금 생각나는 건 없구요 아~ 그냥 법은 아닌데 그냥 쪼금
아~ 요즘에 또 이렇게 변화가 되는구나 생각했던 게,아~ 요즘에 또 이렇게 변화가 되는구나 생각했던 게
얼마 전에 이제 부동산 거래하면서 그~ 등기,얼마 전에 이제 부동산 거래하면서 그~ 등기
친다고 표현을 하는데 그거를 이제 부동산에,친다고 표현을 하는데 그거를 이제 부동산에
그~ 원 잔금 치고 등기 치면서 법무사,그~ 원 잔금 치고 등기 치면서 법무사
그~ 사무실에서 같이 동석을 하는데,그~ 사무실에서 같이 동석을 하는데
그~ 남편이 이제 나름 수수료가 쪼금 저렴한 곳을 알아봐 가지고,그~ 남편이 이제 나름 수수료가 쪼금 저렴한 곳을 알아봐 가지고
섭외를 한 거예요 근데 이제,섭외를 한 거예요 근데 이제
어~ 나는 당연히 법무사 사무실에서 나오셨겠거니 했는데 나중에 명함을 보니까,어~ 나는 당연히 법무사 사무실에서 나오셨겠거니 했는데 나중에 명함을 보니까
변호사 사무실이더라구요 그래서,변호사 사무실이더라구요 그래서
아~ 이런 걸 이제 법무사에서 안 하고,아~ 이런 걸 이제 법무사에서 안 하고
변호사 사무실에서도 요런 일거리를 잡아서,변호사 사무실에서도 요런 일거리를 잡아서
이렇게 수수료가 낮다고 광고도 하고,이렇게 수수료가 낮다고 광고도 하고
일을 이렇게 잡아서 하는구나.,일을 이렇게 잡아서 하는구나.
어~ 쫌 되게 변호사 사무실 그까 변호사 사무실의 명함은,어~ 조금 되게 변호사 사무실 그러니까 변호사 사무실의 명함은
또 처음 봤어가지고 그만큼 쫌,또 처음 봤어가지고 그만큼 조금
법이라는 게 이케 변호사가 쫌,법이라는 게 이렇게 변호사가 조금
특권 의식 어~ 이렇게 되게 나랑 거리가 먼 사람이 아니라,특권 의식 어~ 이렇게 되게 나랑 거리가 먼 사람이 아니라
이렇게 우리 실생활이 실생활에 많이 스며들 수 있게 되었구나.,이렇게 우리 실생활이 실생활에 많이 스며들 수 있게 되었구나.
그냥 어~ 이것도 쪼금 어~ 쪼금 시대가 변했네라고 한 번 또 생각하게 된,그냥 어~ 이것도 쪼금 어~ 쪼금 시대가 변했네라고 한 번 또 생각하게 된
계기가 있었구요.,계기가 있었구요.
그리구 법이 있어도 이거를,그리고 법이 있어도 이거를
쫌 뭐라고 해야 되지 어떻게 활용해야 되는지,조금 뭐라고 해야 되지 어떻게 활용해야 되는지
그니까 어떤 걸 할 때 만일 집을,그러니까 어떤 걸 할 때 만일 집을
살려고 한다던지 이럴 때 쪼금 일목요연하게,살려고 한다던지 이럴 때 쪼금 일목요연하게
관공서라든지 이런 데 들어가서 의외로,관공서라든지 이런 데 들어가서 의외로
뭐~ 부동산 사무실이라든지 부동산 까페 같은 데서 정보를,뭐~ 부동산 사무실이라든지 부동산 까페 같은 데서 정보를
카더라 정보가 더 귀에 들어오지 정확한 부동산,카더라 정보가 더 귀에 들어오지 정확한 부동산
아~ 정확한 법률 상식이 생각보다,아~ 정확한 법률 상식이 생각보다
어느 경로를 통해서 어떻게 알아봐야 되는지가 잘 모르겠더라구요 그래서,어느 경로를 통해서 어떻게 알아봐야 되는지가 잘 모르겠더라구요 그래서
동사무소라던지 이런 데에서 되게 가까운 주민자치센터에서부터,동사무소라던지 이런 데에서 되게 가까운 주민자치센터에서부터
되게 궁금증을 해결할 수 있는,되게 궁금증을 해결할 수 있는
그런 시스템이 되었으면 좋겠다는 생각을 하구 있구요.,그런 시스템이 되었으면 좋겠다는 생각을 하구 있구요.
요즘에 또 도로교통법 운전자들은 다 도로교통법 때문에,요즘에 또 도로교통법 운전자들은 다 도로교통법 때문에
쫌 신경을 요즘 많이 쓰고 있죠.,조금 신경을 요즘 많이 쓰고 있죠.
그~ 민식이법 때문에 남편이 맨날 저 운전할 때마다,그~ 민식이법 때문에 남편이 맨날 저 운전할 때마다
학교 근처 가거든 꼭 조심하라고,학교 근처 가거든 꼭 조심하라고
그렇게 강조를 하고 있고 그렇습니다.,그렇게 강조를 하고 있고 그렇습니다.
