사투리,표준어
일단 날씨라는 게 우리나라 이 지역이 되게 쫍지만 지역마다 날씨 특색이 다르잖아요.,일단 날씨라는 게 우리나라 이 지역이 되게 좁지만 지역마다 날씨 특색이 다르잖아요.
혹시  님은 부산에 사시는데 요즘 날씨가 어떤지 궁금하네요.,혹시  님은 부산에 사시는데 요즘 날씨가 어떤지 궁금하네요.
하우 날씨,하우 날씨
다른 지역 사람들이 얘기하면 웃는데 저는 너무 추워요 요기 진짜,다른 지역 사람들이 얘기하면 웃는데 저는 너무 추워요 요기 진짜
원래 이케 어쨌든 따뜻한 곳이라도,원래 이렇게 어쨌든 따뜻한 곳이라도
이게 격차가 있잖아요 그래가지고 따뜻하게 잘 지내다가,이게 격차가 있잖아요 그래가지고 따뜻하게 잘 지내다가
어~ 지지난 주부터 갑자기 추워지는 게 느껴져서 제가 춥다고 입에 달고 살거든요 추위를 되게 싫어해요.,어~ 지지난 주부터 갑자기 추워지는 게 느껴져서 제가 춥다고 입에 달고 살거든요 추위를 되게 싫어해요.
네 예전에 신종플루에 결려가지고 겨울에 엄청 고생한 기억이 있어가지고 진짜 싫어하는데 크루 얘기를 하면,네 예전에 신종플루에 결려가지고 겨울에 엄청 고생한 기억이 있어가지고 진짜 싫어하는데 크루 얘기를 하면
제가 이제 친구들이 서울에 많이 있는데 그 친구들은 되게,제가 이제 친구들이 서울에 많이 있는데 그 친구들은 되게
웃어요 근데 엄청 춥거든요 저는 진짜 그래서 저는 서울에서 못 살 거 같애요 그래서 따뜻한 부산이 너무 좋아요  님은 부산 날씨 어떻게 생각하세요?,웃어요 근데 엄청 춥거든요 저는 진짜 그래서 저는 서울에서 못 살 거 같애요 그래서 따뜻한 부산이 너무 좋아요  님은 부산 날씨 어떻게 생각하세요?
부산에 살 때는 저도 그랬어요 제가 부산에 살고 있을 때는 부산이,부산에 살 때는 저도 그랬어요 제가 부산에 살고 있을 때는 부산이
정말 추웠거든요 영상 삼사 도만 돼도,정말 추웠거든요 영상 삼사 도만 돼도
너무 춥고 옷을 막 껴입고 이렇게 다녔는데 지금 이제 제가 에~ 이사를 세종시로 이사를 했는데,너무 춥고 옷을 막 껴입고 이렇게 다녔는데 지금 이제 제가 에~ 이사를 세종시로 이사를 했는데
여기는 쪼끔 윗지방이고 그리고 충청도 지방이지만은 쫌 추운 지역에 속한다고 하네요 그러다 보니까,여기는 쪼끔 윗지방이고 그리고 충청도 지방이지만은 조금 추운 지역에 속한다고 하네요 그러다 보니까
여기는 눈도 많이 오고,여기는 눈도 많이 오고
어~ 날씨도 아~ 부산이나 경남지역보다는 한 오 도 정도 차이가 있더라고요.,어~ 날씨도 아~ 부산이나 경남지역보다는 한 오 도 정도 차이가 있더라고요.
너무 춥고 그래서 여기서 너무 추운데도 적응을 하도 하다 하다가,너무 춥고 그래서 여기서 너무 추운데도 적응을 하도 하다 하다가
부산에 내려가면 오히려 더 쫌 아 내가 이런 따뜻한 데서 살았구나,부산에 내려가면 오히려 더 조금 아 내가 이런 따뜻한 데서 살았구나
이렇게 따뜻한데 저 사람들은 저렇게 옷을 뚜껍게 입고 다니는구나 이런 것들을 쪼끔 느끼면서 살거든요 그래서 날씨라는 게 쪼끔 상대적인 게 아닌가 이케 제 친구들 중에서도 경기도는 훨씬 추운 이런,이렇게 따뜻한데 저 사람들은 저렇게 옷을 두껍게 입고 다니는구나 이런 것들을 쪼끔 느끼면서 살거든요 그래서 날씨라는 게 쪼끔 상대적인 게 아닌가 이렇게 제 친구들 중에서도 경기도는 훨씬 추운 이런
강원도나 이런 지인들 만나보면,강원도나 이런 지인들 만나보면
또 세종에나 충청도 이쪽에 날씨는 또 추운 것도 아니라고 말씀하시더라고요.,또 세종에나 충청도 이쪽에 날씨는 또 추운 것도 아니라고 말씀하시더라고요.
그래 보니까 아~ 날씨를 이~ 날씨라는 거는,그렇게 보니까 아~ 날씨를 이~ 날씨라는 거는
참 사람이 느끼기에 상대적인 거구나 그냥,참 사람이 느끼기에 상대적인 거구나 그냥
기본적으로 뭐~ 영하 몇 도 영상 몇 도 이렇게 딱딱 나눠지는 건 있지만 거기 대해서 얼마나 추위를 느끼고 얼마나 더위를 느끼는 거는,기본적으로 뭐~ 영하 몇 도 영상 몇 도 이렇게 딱딱 나눠지는 건 있지만 거기 대해서 얼마나 추위를 느끼고 얼마나 더위를 느끼는 거는
느끼느냐 이런 거는 사람들이 참 상대적으로 느끼는 뭐구나라는 걸 느끼거든요.,느끼느냐 이런 거는 사람들이 참 상대적으로 느끼는 뭐구나라는 걸 느끼거든요.
제가 예전에 대구에 살았을 때는,제가 예전에 대구에 살았을 때는
정말 더워서 정말 죽을 뻔했지만,정말 더워서 정말 죽을 뻔했지만
어~ 죽을뻔해서 이렇게 더 더운 곳에 살 수 있을까 이렇게 했는데,어~ 죽을뻔해서 이렇게 더 더운 곳에 살 수 있을까 이렇게 했는데
또 막상 다른 지역에 오다 보니까 다른 지역에서도 여름은 똑같이 덥더라고요.,또 막상 다른 지역에 오다 보니까 다른 지역에서도 여름은 똑같이 덥더라고요.
네 그래서 참 온도라는 거는 참 사람들이 느끼기에 상대적인 거구나라고 생각을 합니다.,네 그래서 참 온도라는 거는 참 사람들이 느끼기에 상대적인 거구나라고 생각을 합니다.
계절 중에 어떤 계절을 제일 좋아하세요?,계절 중에 어떤 계절을 제일 좋아하세요?
저는 이제 겨울에서 봄으로 넘어가는 따뜻해지는 그 순간이 너무 좋아요.,저는 이제 겨울에서 봄으로 넘어가는 따뜻해지는 그 순간이 너무 좋아요.
그 계절에 이제 꽃도 피고 하잖아요 그래서 따뜻해지니까 옷도 가벼워지고,그 계절에 이제 꽃도 피고 하잖아요 그래서 따뜻해지니까 옷도 가벼워지고
사실 겨울에는 이 무거운 옷들이 무거운지 모르고 있다가,사실 겨울에는 이 무거운 옷들이 무거운지 모르고 있다가
이제 봄이 되기 시작하면서 몸이 누거워짐을 느낄 때,이제 봄이 되기 시작하면서 몸이 누거워짐을 느낄 때
그때 그게 이제 아 봄이 왔구나 싶은 그 순간이 되게 좋더라고요  님은 어느 계절 좋아하세요?,그때 그게 이제 아 봄이 왔구나 싶은 그 순간이 되게 좋더라고요  님은 어느 계절 좋아하세요?
저는 마찬가지로,저는 마찬가지로
음~ 너무 춥거나 너무 덥거나 하지 않은 계절,음~ 너무 춥거나 너무 덥거나 하지 않은 계절
으 봄이랑 가을을 좋아하구요.,으 봄이랑 가을을 좋아하구요.
근데 또 가을보다는 아까 말씀하신 대로 봄이 더 좋은 거 같애요 그 추위를 벗어서 뭔가 새싹도 나고,근데 또 가을보다는 아까 말씀하신 대로 봄이 더 좋은 거 같애요 그 추위를 벗어서 뭔가 새싹도 나고
막 이렇게 아 한 해를 시작하는 이런 뭐랄까 쫌 신나는 그런 마음도 마음가짐도 가질 수 있고 하는 봄 계절을 제일 좋아하구요.,막 이렇게 아 한 해를 시작하는 이런 뭐랄까 조금 신나는 그런 마음도 마음가짐도 가질 수 있고 하는 봄 계절을 제일 좋아하구요.
그래서 뭐~ 봄에서는 또 그 추 추웠을 때 못했던 여러 가지 뭐~ 활동이라든지 이런 것들을 다시 시작할 수가 있으니까,그래서 뭐~ 봄에서는 또 그 추 추웠을 때 못했던 여러 가지 뭐~ 활동이라든지 이런 것들을 다시 시작할 수가 있으니까
그 계절이 봄이 참 좋은 거 같네요.,그 계절이 봄이 참 좋은 거 같네요.
그~ 세종시에 살면은,그~ 세종시에 살면은
그 장마철에 홍수 이런 걱정은 없겠네요.,그 장마철에 홍수 이런 걱정은 없겠네요.
비교적 최 신설,비교적 최 신설
그런 수로를 만들어져 있고 그럴 테니까,그런 수로를 만들어져 있고 그럴 테니까
장마철에 고생하시진 않죠 거기는?,장마철에 고생하시진 않죠 거기는?
일단은 뭐~ 아까 말씀하신 대로 뭐~ 물 빠짐 배수라든지 이런 것들을 신경을 많이 써서 만들었더라고요 그래서 뭐~ 장마철을 겪는다든지 그래서 뭐~ 장마 때문에 홍수가 나서 범람을 한다든지,일단은 뭐~ 아까 말씀하신 대로 뭐~ 물 빠짐 배수라든지 이런 것들을 신경을 많이 써서 만들었더라고요 그래서 뭐~ 장마철을 겪는다든지 그래서 뭐~ 장마 때문에 홍수가 나서 범람을 한다든지
이런 경우는,이런 경우는
거의 없어요 제가 김해 살 때,거의 없어요 제가 김해 살 때
태풍이 불거나 그래서 김 저기 장마가 와서 물이 많이 차올랐을 때 그때 정말 사람들이 많이 이렇게 피해를 입고,태풍이 불거나 그래서 김 저기 장마가 와서 물이 많이 차올랐을 때 그때 정말 사람들이 많이 이렇게 피해를 입고
많이 재산적이라든지 이런 그런 물질적 피해를 입는 사람들 보면서 되게 안타까웠거든요.,많이 재산적이라든지 이런 그런 물질적 피해를 입는 사람들 보면서 되게 안타까웠거든요.
근데 일단 세종시에 살면서 그런 거는 경우를 딱히 이렇게 크게 본 적은 없는 거 같애요 그리고,근데 일단 세종시에 살면서 그런 거는 경우를 딱히 이렇게 크게 본 적은 없는 거 같애요 그리고
여름에 뭐~ 할 수 있는 일들이 많잖아요 혹시 여름에 혹시 뭐~ 하는 뭐~,여름에 뭐~ 할 수 있는 일들이 많잖아요 혹시 여름에 혹시 뭐~ 하는 뭐~
계절에 어울리는 뭐~ 그런 스포츠라든지 활동이라든지 혹시 이런 거 있으세요?,계절에 어울리는 뭐~ 그런 스포츠라든지 활동이라든지 혹시 이런 거 있으세요?
어~ 저는 여름에 그냥 물놀이 하는 거 좋아하고요 어~ 장마 세종시는 별걱정이 없어서 다행이네요.,어~ 저는 여름에 그냥 물놀이 하는 거 좋아하고요 어~ 장마 세종시는 별걱정이 없어서 다행이네요.
부산에서는 올해 장마가 피해가 극심해가지고 인명 피해도 있었거든요.,부산에서는 올해 장마가 피해가 극심해가지고 인명 피해도 있었거든요.
그래가지고,그래가지고
어~ 그게 그냥 장마 얘기를 하다가 생각났는데 혹시,어~ 그게 그냥 장마 얘기를 하다가 생각났는데 혹시
십육 년이었나 십오 년도에,십육 년이었나 십오 년도에
시월 사 일인가 오 일쯤에 태풍왔을 때 마린시티라고 아세요 그 마린시티 물에 잠긴 사건 기억나세요?,시월 사 일인가 오 일쯤에 태풍왔을 때 마린시티라고 아세요 그 마린시티 물에 잠긴 사건 기억나세요?
그런 것도 기억나고 이 올해는 그 초량에 지하터널에서 이제 물에 잠겨가지고 돌아가신 분 생각도 나고 해가지고 부산은,그런 것도 기억나고 이 올해는 그 초량에 지하터널에서 이제 물에 잠겨가지고 돌아가신 분 생각도 나고 해가지고 부산은
에~ 물 배수만 좀 괜찮으면 좋을 거 같애요 이게,에~ 물 배수만 좀 괜찮으면 좋을 거 같애요 이게
바닷가랑 연결이 돼 있어가지고 바다에 만조 시간이랑,바닷가랑 연결이 돼 있어가지고 바다에 만조 시간이랑
겹치면 이제 답이 안 나오더라고요.,겹치면 이제 답이 안 나오더라고요.
그래가지고 장마에 대한 얘기를 쪼끔 더 드리고 싶었고,그래가지고 장마에 대한 얘기를 쪼끔 더 드리고 싶었고
저한테 하셨던 질문이 뭐였죠?,저한테 하셨던 질문이 뭐였죠?
여름에 아 활동하는 거 좋아하시는 거 그까 물놀이 좋아한다고 말씀을 하셨던 거 같애요.,여름에 아 활동하는 거 좋아하시는 거 그러니까 물놀이 좋아한다고 말씀을 하셨던 거 같애요.
혹시 물놀이 좋아하시면은 그 김해에 롯데 워터파크에 가보셨어요?,혹시 물놀이 좋아하시면은 그 김해에 롯데 워터파크에 가보셨어요?
하 저는 워터파크보다는 이제 계곡 쪽을 좋아해가지고 계곡,하 저는 워터파크보다는 이제 계곡 쪽을 좋아해가지고 계곡
배내골 밀양 이런 데를 좋아합니다  님이 김해 사셨으면은 김해 워터파크 많이 가셨어요?,배내골 밀양 이런 데를 좋아합니다  님이 김해 사셨으면은 김해 워터파크 많이 가셨어요?
몇 번 가봤는데 말씀하신 대로,몇 번 가봤는데 말씀하신 대로
어릴 때는 그렇게 가면 막 너무 신이 나고 재밌어가지고 하루 종일 놀아도 피곤한지 몰랐는데,어릴 때는 그렇게 가면 막 너무 신이 나고 재밌어가지고 하루 종일 놀아도 피곤한지 몰랐는데
나이 들어서 왜 가족이 생기면 챙겨야 될 사람들이 많잖아요 내 몸뚱아리 챙기기도 바쁜데,나이 들어서 왜 가족이 생기면 챙겨야 될 사람들이 많잖아요 내 몸뚱아리 챙기기도 바쁜데
음~ 누구도 챙겨 누구도 챙겨 누구도 챙겨 이렇게 챙기다 보니까,음~ 누구도 챙겨 누구도 챙겨 누구도 챙겨 이렇게 챙기다 보니까
가다 보니까 결국에 힘만 들고 재미가 없더라고요.,가다 보니까 결국에 힘만 들고 재미가 없더라고요.
어~ 순수히 나를 위한 시간 투자라든지 나를 위한 즐거움 찾는 게 사실은 좀 가족을 이루고 난 쪼끔 어려운 점 점들이 많은 거 같애요.,어~ 순수히 나를 위한 시간 투자라든지 나를 위한 즐거움 찾는 게 사실은 좀 가족을 이루고 난 쪼끔 어려운 점 점들이 많은 거 같애요.
그래서 워터파크 어릴 때 되게 재밌었는데 지금 가니까 별로 재미없는 거 같애요.,그래서 워터파크 어릴 때 되게 재밌었는데 지금 가니까 별로 재미없는 거 같애요.
그래서 그렇고 쫌,그래서 그렇고 조금
이색적인 얘기라고 하자면 인제 계절이 반대인 경우 나라들이 있잖아요.,이색적인 얘기라고 하자면 인제 계절이 반대인 경우 나라들이 있잖아요.
그까 호주라든지 이렇게 남방구 쪽에 이제 나라들은,그러니까 호주라든지 이렇게 남방구 쪽에 이제 나라들은
우리가 지금 여기 한겨울이면 거긴 한여름이거든요 계절이 반대여서,우리가 지금 여기 한겨울이면 거긴 한여름이거든요 계절이 반대여서
이 제가 인제 대학교를 졸업하자마자 바로 인제 공구처에서 쪼금 유학 생활을 오래 했는데 그때,이 제가 인제 대학교를 졸업하자마자 바로 인제 공구처에서 쪼금 유학 생활을 오래 했는데 그때
느낀 거는 어~ 우리가 지금 십이월 크리스마스를 겪을 때 여기는 한겨울이어서 산타클로스가 막 눈도 있고 어~ 크리스마스트리에 이렇게 막 하는 모습들이 거기는 한여름이다 보니까,느낀 거는 어~ 우리가 지금 십이월 크리스마스를 겪을 때 여기는 한겨울이어서 산타클로스가 막 눈도 있고 어~ 크리스마스트리에 이렇게 막 하는 모습들이 거기는 한여름이다 보니까
산타클로스 할아버지가 확 여름에 막 비키니를 입고 막 이게 수영복만 입고 서핑을 한다든지 막 그런 좀 이색적인 모습,산타클로스 할아버지가 확 여름에 막 비키니를 입고 막 이게 수영복만 입고 서핑을 한다든지 막 그런 좀 이색적인 모습
날씨가 반대일 때 그런 이색적인 그런 쫌,날씨가 반대일 때 그런 이색적인 그런 조금
문화적 차이가 있었거든요 그래서 그런 것들도 이케 재밌었던 거 같고,문화적 차이가 있었거든요 그래서 그런 것들도 이렇게 재밌었던 거 같고
그래서 혹시라도 나중에 이제 코로나가 인제,그래서 혹시라도 나중에 이제 코로나가 인제
앞으로 인제 없어지고 하늘길이 열리게 되면,앞으로 인제 없어지고 하늘길이 열리게 되면
호주라는 곳을 꼭 한 번 가보셨으면 좋겠어요 쪼금 날씨와는 관계없는 얘기지만 호주라는 곳을 꼭 가보셔서 여행이든 뭐든지 한 번 가보셔가지고,호주라는 곳을 꼭 한 번 가보셨으면 좋겠어요 쪼금 날씨와는 관계없는 얘기지만 호주라는 곳을 꼭 가보셔서 여행이든 뭐든지 한 번 가보셔가지고
거기에 대한 날씨 계절에 대한 차이라든지,거기에 대한 날씨 계절에 대한 차이라든지
뭐~ 자연환경 그다음 사람 이런 것들을 한 번 만나보면서 이렇게 한 번 겪어보셨으면 좋겠어요 제가 함 꼭 추천드릴게요.,뭐~ 자연환경 그다음 사람 이런 것들을 한 번 만나보면서 이렇게 한 번 겪어보셨으면 좋겠어요 제가 한 번 꼭 추천드릴게요.
호주 다녀오신 분들이 다들 호주를 추천하더라고요.,호주 다녀오신 분들이 다들 호주를 추천하더라고요.
그때 크리마스 때 사람들이 이제 수영복 입고 있다고 막 그런 얘기도 들은 거 같고 거기 환경이나,그때 크리마스 때 사람들이 이제 수영복 입고 있다고 막 그런 얘기도 들은 거 같고 거기 환경이나
네 사람들에 대한 얘기를 많이 들은 거 같은데 좋은 추천 감사합니다.,네 사람들에 대한 얘기를 많이 들은 거 같은데 좋은 추천 감사합니다.
그리고 저희 지금,그리고 저희 지금
아~ 세종시는 어떤지 되게 궁금해요 미세먼지가 어떤지,아~ 세종시는 어떤지 되게 궁금해요 미세먼지가 어떤지
부 제가 서울은 자주 왔다 갔다 하는데 서울이랑 부산 왔다 갔다 하면 공기가 다른 걸 느끼거든요.,부 제가 서울은 자주 왔다 갔다 하는데 서울이랑 부산 왔다 갔다 하면 공기가 다른 걸 느끼거든요.
혹시 세종시는 미세먼지 어때요?,혹시 세종시는 미세먼지 어때요?
제가 봤을 때는 미세먼지가 중국 사람들은 미세먼지가 중국에선 안 날라온다고 끝까지 얘기를 하는데,제가 봤을 때는 미세먼지가 중국 사람들은 미세먼지가 중국에선 안 날라온다고 끝까지 얘기를 하는데
제가 봤을 때는 미세먼지는 중국에서 오는 게 맞는 거 같애요.,제가 봤을 때는 미세먼지는 중국에서 오는 게 맞는 거 같애요.
한국 사람들 거의 다 그렇게 생각하겠죠 왜 그러냐면,한국 사람들 거의 다 그렇게 생각하겠죠 왜 그러냐면
서쪽이랑 그니까 이제 지구상으로 봤을 때,서쪽이랑 그러니까 이제 지구상으로 봤을 때
지형상으로 봤을 때 저희는 서쪽이잖아요 충청도니까,지형상으로 봤을 때 저희는 서쪽이잖아요 충청도니까
그리고 부산 쪽은 이 부산 대구는 동쪽이잖아요.,그리고 부산 쪽은 이 부산 대구는 동쪽이잖아요.
확실하게 미세먼지 차이량이 많아요.,확실하게 미세먼지 차이량이 많아요.
여기는 미세먼지가 많이 부는 날 그리고 뭐~ 그 황사라든지 그런 것들이 부산이나 대구에 살 때보다 확시 확실하게 더 양이 많은 거 같애요.,여기는 미세먼지가 많이 부는 날 그리고 뭐~ 그 황사라든지 그런 것들이 부산이나 대구에 살 때보다 확시 확실하게 더 양이 많은 거 같애요.
그까 공기가 쪼끔 공기 질이 떨어지고 그나마 세종시가 타지역에 비해서 쪼끔 이제 산림률이라든지 이런 게 좋다 보니까,그러니까 공기가 쪼끔 공기 질이 떨어지고 그나마 세종시가 타지역에 비해서 쪼끔 이제 산림률이라든지 이런 게 좋다 보니까
그나마 타지역에 도심 한가운데보다는 쪼끔 그 자체적으로 개발 그 발생하는 미세먼지나 이런 것들이 쫌 적은 편이라서 그나마 좀 나은데,그나마 타지역에 도심 한가운데보다는 쪼끔 그 자체적으로 개발 그 발생하는 미세먼지나 이런 것들이 조금 적은 편이라서 그나마 좀 나은데
아마 서울이나 뭐~ 인천,아마 서울이나 뭐~ 인천
그다음에 경기도 이런 지역에서는 아마 제가 봤을 때는 정말 미세먼지가  심각할 거예요.,그다음에 경기도 이런 지역에서는 아마 제가 봤을 때는 정말 미세먼지가  심각할 거예요.
너무 힘들어요 미세먼지 이런 것들이,너무 힘들어요 미세먼지 이런 것들이
그래서 아 쪼끔 이 좋은 공기 좋은 환경에서,그래서 아 쪼끔 이 좋은 공기 좋은 환경에서
이기서 점점점 나아져야 되는데 미세먼지며 코로나며 이런 것들을 보니까 자꾸 인간들에게 자꾸 이런 만들어내는 것들에 의해서 자꾸 이렇게 더 괴로워지잖아요.,여기서 점점점 나아져야 되는데 미세먼지며 코로나며 이런 것들을 보니까 자꾸 인간들에게 자꾸 이런 만들어내는 것들에 의해서 자꾸 이렇게 더 괴로워지잖아요.
그런 것들이 쪼끔 빨리 더 좋은 방향으로,그런 것들이 쪼끔 빨리 더 좋은 방향으로
해결책을 찾든 이렇게 해서 쫌 좋은 방향으로 쫌 갔으면 좋겠어요.,해결책을 찾든 이렇게 해서 조금 좋은 방향으로 조금 갔으면 좋겠어요.
지금 부산은 눈이 한 번 왔다 하면은 완전 그냥 마비잖아요 그냥 도로도 아무런 제설 대비도 안 돼 있고,지금 부산은 눈이 한 번 왔다 하면은 완전 그냥 마비잖아요 그냥 도로도 아무런 제설 대비도 안 돼 있고
그런 상황에서 그냥 눈이 안 오니까 안 오는구나 하고 살아가는데,그런 상황에서 그냥 눈이 안 오니까 안 오는구나 하고 살아가는데
혹시 세종시는 눈이 얼마나 오는지 오면은 그런 제설에 대한 대비는 잘 되어 있는지 그런 게 쫌 궁금해가지고 여쭤보고 싶었어요.,혹시 세종시는 눈이 얼마나 오는지 오면은 그런 제설에 대한 대비는 잘 되어 있는지 그런 게 조금 궁금해가지고 여쭤보고 싶었어요.
제설요 몰라요 제설이 제일 잘 되는 도시 중 하나라곤 하더라고요 눈이 오면 눈이 없어져요 빨리 도로에 인제 이런 것들 왜냐면은 인제,제설요 몰라요 제설이 제일 잘 되는 도시 중 하나라곤 하더라고요 눈이 오면 눈이 없어져요 빨리 도로에 인제 이런 것들 왜냐면은 인제
그 여기는 이제 거의 공무원들이 살다 보니까 공무원들 출퇴근 시간이나 이런 것들에 마비가 없어야 되니까,그 여기는 이제 거의 공무원들이 살다 보니까 공무원들 출퇴근 시간이나 이런 것들에 마비가 없어야 되니까
그 제설작업을 빨리하는 편이고 도로 정비나 이런 것들이 좀 약간 신도시라서 이렇게 쫌 그런 부분들은 잘 되어는 있어요.,그 제설작업을 빨리하는 편이고 도로 정비나 이런 것들이 좀 약간 신도시라서 이렇게 조금 그런 부분들은 잘 되어는 있어요.
근데 눈이 정말 많이는 와요 한 삼사 년 전까지만 해도 눈이 한 번 오면 거의 일월 달까지 눈이 녹지 않고 계속 길에 방치가 돼 있었고,근데 눈이 정말 많이는 와요 한 삼사 년 전까지만 해도 눈이 한 번 오면 거의 일월 달까지 눈이 녹지 않고 계속 길에 방치가 돼 있었고
그~ 왜 보도나 이런 데 산 이런 그 화단이나 이런 데 계속 눈이 녹지 않고 계속 있었거든요.,그~ 왜 보도나 이런 데 산 이런 그 화단이나 이런 데 계속 눈이 녹지 않고 계속 있었거든요.
그리고 이렇게 뭐~ 부츠를 신고 가면은,그리고 이렇게 뭐~ 부츠를 신고 가면은
거의 발목 위에서 한 뭐 한 이삼십 센치까지 푹 잠길 만큼 눈이 왔었는데,거의 발목 위에서 한 뭐 한 이삼십 센치까지 푹 잠길 만큼 눈이 왔었는데
요즘 들어서,요즘 들어서
한 이 스 이 년 삼 년 된 거 같애요 눈이 거의 안 오고 와도,한 이 스 이 년 삼 년 된 거 같애요 눈이 거의 안 오고 와도
부산에서 와 눈이다 하면 쫌 있으면 그치는 약간 요 정도 오는 거 같고요.,부산에서 와 눈이다 하면 조금 있으면 그치는 약간 요 정도 오는 거 같고요.
저도 부산에서 있을 때 눈이 오면 그렇게 신이 나고 좋아서 눈싸움도 하고 밖에 나가서 눈 구경도 하고 되게 설레는 마음 있었는데,저도 부산에서 있을 때 눈이 오면 그렇게 신이 나고 좋아서 눈싸움도 하고 밖에 나가서 눈 구경도 하고 되게 설레는 마음 있었는데
몇 년 새 그래도 눈이 안 오긴 하지만 그리고 그전에 눈이 많이 와서 눈 오면 춥고,몇 년 새 그래도 눈이 안 오긴 하지만 그리고 그전에 눈이 많이 와서 눈 오면 춥고
길 지저분하고 걸어 다닐 때마다 조심해서 걸어야 되고 미끄러지니까,길 지저분하고 걸어 다닐 때마다 조심해서 걸어야 되고 미끄러지니까
