사투리,표준어
며칠 전에 대구에서 이제 드론 택시라는 제도가 한 번 시험에 들어갔다고 하더라고 근데 너는 드론 택시라는 거에서 들어봤어?,며칠 전에 대구에서 이제 드론 택시라는 제도가 한 번 시험에 들어갔다고 하더라고 근데 너는 드론 택시라는 거에서 들어봤어?
어~ 나는 드론에 대해서는 영화나 이런 데서 많이 나오잖아 요즘 드론이 뜨고 있다 보니까 영화에서도 많이 나오고 사람들이 길에서도 많이 하고 있더라고,어~ 나는 드론에 대해서는 영화나 이런 데서 많이 나오잖아 요즘 드론이 뜨고 있다 보니까 영화에서도 많이 나오고 사람들이 길에서도 많이 하고 있더라고
그래가지고 드론 택시에 대해서 저번에 기사를 봤는데 이십 분만에 막 오십 키로,그래가지고 드론 택시에 대해서 저번에 기사를 봤는데 이십 분만에 막 오십 키로
이상 날아갔다고 그러고 곧 있으면 또 상용화될 거 같긴 한데 영화에서만 보던 그런 게 실제로 그런 날아다니는 택시를 사람들이 직접 보니깐,이상 날아갔다고 그러고 곧 있으면 또 상용화될 거 같긴 한데 영화에서만 보던 그런 게 실제로 그런 날아다니는 택시를 사람들이 직접 보니깐
현실화됐다는 점에서 약간 미래에 대한 더 기대감이 많이 생겼다고 하더라고 그래가지구 나도 관심 있게 찾아보고 있긴 한데,현실화됐다는 점에서 약간 미래에 대한 더 기대감이 많이 생겼다고 하더라고 그래가지구 나도 관심 있게 찾아보고 있긴 한데
너는 뭐가 관심 있었어 보면서?,너는 뭐가 관심 있었어 보면서?
나는 드론 택시 그 대구에 떴다는 거를 보고 또 어떤 한 기사를 봤거든,나는 드론 택시 그 대구에 떴다는 거를 보고 또 어떤 한 기사를 봤거든
근데 그 제주도 바다 한가운데서 어~ 사람도 구조를 했다고 하더라고 어~ 그때,근데 그 제주도 바다 한가운데서 어~ 사람도 구조를 했다고 하더라고 어~ 그때
막 거기 드론 택시 안에,막 거기 드론 택시 안에
막 소방 응급 키트 이런 거랑,막 소방 응급 키트 이런 거랑
심장 그~ 재새동기,심장 그~ 재새동기
같은 구조 장비를 싣고 비행을 이케 했다고 하더라고,같은 구조 장비를 싣고 비행을 이렇게 했다고 하더라고
근데 그게 아무래도 구급차는 구급차랑 해양경찰 이런 거가,근데 그게 아무래도 구급차는 구급차랑 해양경찰 이런 거가
사람을 구조한다고 해도 물 안에 직접 들어가서 그렇게 할려면 시간이 엄청나게 소요되잖아.,사람을 구조한다고 해도 물 안에 직접 들어가서 그렇게 할려면 시간이 엄청나게 소요되잖아.
그래서 드론 택시로 엄청나게 빠르게 접근을 할 수 있는 거에 대해서 나는 좋다고 생각하는데 너는,그래서 드론 택시로 엄청나게 빠르게 접근을 할 수 있는 거에 대해서 나는 좋다고 생각하는데 너는
인공지능이 인간 세상에 어떤 작용을 한다고 생각해?,인공지능이 인간 세상에 어떤 작용을 한다고 생각해?
인공지능이 요즘 막 직업 사람들이 하는 직업을 많이 대체한다고 하잖아.,인공지능이 요즘 막 직업 사람들이 하는 직업을 많이 대체한다고 하잖아.
그럼 새로 생겨날 직업도 있지만 지금 있는 직업들이 대부분 사라질 게 많은 거 같다고 생각하거든 솔직히 요즘 의료기기 이런 것도 다 기술이 하거나 기계가 다 하고,그럼 새로 생겨날 직업도 있지만 지금 있는 직업들이 대부분 사라질 게 많은 거 같다고 생각하거든 솔직히 요즘 의료기기 이런 것도 다 기술이 하거나 기계가 다 하고
병원이나 식당 요즘,병원이나 식당 요즘
울대에만 나가다 나가봐도 로봇이 막,울대에만 나가다 나가봐도 로봇이 막
써빙을 대신한다라는 말이 있을 정도로 많이 대체되고 있는 거 같은데 근데 그렇게 대체 되버리면,써빙을 대신한다라는 말이 있을 정도로 많이 대체되고 있는 거 같은데 근데 그렇게 대체 되버리면
사람들이 있어야 할 직업이 별로 없단 말이야 아까 마음으로 일하는 직업 약간 그런 거만 살아남지 돌아다니면서 막 그런,사람들이 있어야 할 직업이 별로 없단 말이야 아까 마음으로 일하는 직업 약간 그런 거만 살아남지 돌아다니면서 막 그런
돌아다니면서 막 음식을 써빙해주거나 그런 거할 때는 사람이 필요 없다고 생각해 그래서 인공지능이 지금 자꾸 생겨나는데,돌아다니면서 막 음식을 써빙해주거나 그런 거할 때는 사람이 필요 없다고 생각해 그래서 인공지능이 지금 자꾸 생겨나는데
내가 간호사가 되고 싶지만 그런 미래를 보면 간호사가 대체될 수도 있다고 하더라고 뭐~ 사람과 뭐~ 마음을 통하는 직업이긴 하지만,내가 간호사가 되고 싶지만 그런 미래를 보면 간호사가 대체될 수도 있다고 하더라고 뭐~ 사람과 뭐~ 마음을 통하는 직업이긴 하지만
요즘 찾아보면 의료 기술이 다 하고 수술도 기계가 직접 해야 뭐~ 더 정교하고 그런 기사를 많이 본단 말이야 그래가지고 나는 쫌 딱히 그닥 좋게 반응하지는 않는 거 같은데 너는 어떻게 생각해?,요즘 찾아보면 의료 기술이 다 하고 수술도 기계가 직접 해야 뭐~ 더 정교하고 그런 기사를 많이 본단 말이야 그래가지고 나는 조금 딱히 그닥 좋게 반응하지는 않는 거 같은데 너는 어떻게 생각해?
내가,내가
어~ 며칠 전에 &company-name1&이라는 샤브샤브 집에 갔거든 근데 거기에서도 로봇이 직접 써빙을 해주는 거야.,어~ 며칠 전에 &company-name1&이라는 샤브샤브 집에 갔거든 근데 거기에서도 로봇이 직접 써빙을 해주는 거야.
어~ 그니까 거기는 샐러드 바가 있고 이케 고기를 시키면 고기를 로봇이 직접 써빙을 해주는데,어~ 그러니까 거기는 샐러드 바가 있고 이렇게 고기를 시키면 고기를 로봇이 직접 써빙을 해주는데
근데 그게 내가 지켜보니까 안 좋은 점도 한 가지 있더라고 왜냐면,근데 그게 내가 지켜보니까 안 좋은 점도 한 가지 있더라고 왜냐면
이 번호 지정된 번호로 써빙을 해달라라고 거기서 명령을 내려서 그게 작동이 할 거 아니야 근데 갔는데,이 번호 지정된 번호로 써빙을 해달라라고 거기서 명령을 내려서 그게 작동이 할 거 아니야 근데 갔는데
그거를 놓을 수 있는 시스템은 안 돼 있더라고 그래서 만약에 그 자리에 사람이 없으면 그거는 그 로봇은 계속 그냥 기다리기만 해야 되는 거야 그래서 내가 그 점을 보고 아직까지는,그거를 놓을 수 있는 시스템은 안 돼 있더라고 그래서 만약에 그 자리에 사람이 없으면 그거는 그 로봇은 계속 그냥 기다리기만 해야 되는 거야 그래서 내가 그 점을 보고 아직까지는
음~ 쫌 완성이 되진 않았다 생각하는데 너는 로봇이 인간을 대체할 수 있다고 생각해?,음~ 조금 완성이 되진 않았다 생각하는데 너는 로봇이 인간을 대체할 수 있다고 생각해?
로봇이 인간을 대체할 수 있는 일이 더 많아지고 있긴 사실인데 요즘 시국도 좀 사람들이 다 집에만 있고 그러다 보니까 배달 시켜 먹고,로봇이 인간을 대체할 수 있는 일이 더 많아지고 있긴 사실인데 요즘 시국도 좀 사람들이 다 집에만 있고 그러다 보니까 배달 시켜 먹고
그러니까 당연히 뭐~ 인공지능 그런 게 더 발달할 수 있긴 한데 나는,그러니까 당연히 뭐~ 인공지능 그런 게 더 발달할 수 있긴 한데 나는
약간 인공지능이 지금은 아직 별로 상용화 안 돼가지고 불편한 일이 더 많잖아 그래갖고 아직 인공지능에 대해 좋지 않은 거 같애.,약간 인공지능이 지금은 아직 별로 상용화 안 돼가지고 불편한 일이 더 많잖아 그래갖고 아직 인공지능에 대해 좋지 않은 거 같애.
요즘 대학교에,요즘 대학교에
어~ 에이아이랑 드론 관련 과들도 엄청나게 생겼더라고 그래서 내가 한 번 찾아봤거든 근데 거기에 가면은 실습에서 드론 비행이라는 거를 실습으로 한다는 거야 근데 솔직히 얘기해서,어~ 에이아이랑 드론 관련 과들도 엄청나게 생겼더라고 그래서 내가 한 번 찾아봤거든 근데 거기에 가면은 실습에서 드론 비행이라는 거를 실습으로 한다는 거야 근데 솔직히 얘기해서
며칠 전에 내가 기사를 봤는데 드론으로 인한 약간 사생활 침해가 있었다는 기사를 봤거든 내가,며칠 전에 내가 기사를 봤는데 드론으로 인한 약간 사생활 침해가 있었다는 기사를 봤거든 내가
어떤 사람이 드론을 이제 조정을 하는데 부산 바다에서,어떤 사람이 드론을 이제 조정을 하는데 부산 바다에서
근데 그게 너무 높이 올라가가지고 아파트 단지 안으로 들어간 거야 드론이,근데 그게 너무 높이 올라가가지고 아파트 단지 안으로 들어간 거야 드론이
근데 거기에 카메라가 달려 있었거든 근데 그게 이제 그 집 안을 찍어가지고,근데 거기에 카메라가 달려 있었거든 근데 그게 이제 그 집 안을 찍어가지고
사생활 침해가 됐다는 기사를 봤거든 너는 그런 면에 대해선 드론의 단점이 뭐가 있다고 생각해?,사생활 침해가 됐다는 기사를 봤거든 너는 그런 면에 대해선 드론의 단점이 뭐가 있다고 생각해?
나도 약간 드론이 일상생활을 침해한다는 그런 기사를 봤는데  드론 사용이 일상화되고 있어서 약간 드론이 공황 활주에 침입하거나,나도 약간 드론이 일상생활을 침해한다는 그런 기사를 봤는데  드론 사용이 일상화되고 있어서 약간 드론이 공황 활주에 침입하거나
국가 보안 시설을 막 촬영하는 일도 있다고 내가 봤단 말이야 그까 개인이 사용할 수 있는 드론이 어~ 많아지다 보니까 조용히 드론을 날려가지고 막 남의 집 안방을 도촬하거나  초소형 드론은 거의 소리가 나지 않아가지고 근접하게 촬영이 가능하잖아 그래서 흔적을 남기지 않고 촬영을 할 수 있다는 거야 고 요즘 많은 사람들이 길에 나가보면 한 명씩 드론을 날리는 사람들이 많더라고 영화에서도 그~ 조정식 나오는 그~ 영화에서도 드론 때문에 막,국가 보안 시설을 막 촬영하는 일도 있다고 내가 봤단 말이야 그까 개인이 사용할 수 있는 드론이 어~ 많아지다 보니까 조용히 드론을 날려가지고 막 남의 집 안방을 도촬하거나  초소형 드론은 거의 소리가 나지 않아가지고 근접하게 촬영이 가능하잖아 그래서 흔적을 남기지 않고 촬영을 할 수 있다는 거야 고 요즘 많은 사람들이 길에 나가보면 한 명씩 드론을 날리는 사람들이 많더라고 영화에서도 그~ 조정식 나오는 그~ 영화에서도 드론 때문에 막
그까 나라를 구하는 그런 내용이었잖아 그래서 그런 데는 좋은 거 같긴 한데 드론 때문에 안 좋은 점이 더 많아지고 있다고 생각한단 말이야 그래가지고 드론도 약간,그까 나라를 구하는 그런 내용이었잖아 그래서 그런 데는 좋은 거 같긴 한데 드론 때문에 안 좋은 점이 더 많아지고 있다고 생각한단 말이야 그래가지고 드론도 약간
법이 있어야 된다고 생각한단 말이야 요즘 많이 생겨나고 있어가지구 너는 드론에 드론을 사고 싶니?,법이 있어야 된다고 생각한단 말이야 요즘 많이 생겨나고 있어가지구 너는 드론에 드론을 사고 싶니?
어~ 나는 솔직히 얘기해서 나만의 드론이 하나 있었으면 좋겠는데 왜냐면 택배 같은 걸 시키잖아.,어~ 나는 솔직히 얘기해서 나만의 드론이 하나 있었으면 좋겠는데 왜냐면 택배 같은 걸 시키잖아.
근까 드론이 배송을 대신해 주는 걸 나는 좀 기대하고 있단 말이야 왜냐면 택배를 시키면,그러니까 드론이 배송을 대신해 주는 걸 나는 좀 기대하고 있단 말이야 왜냐면 택배를 시키면
그 동네에 오는 택배 기사님이 한 분밖에 안 계신다면 그거는 약간 번지수를 이렇게 거쳐 가면서 순서대로 진행이 돼가지고 만약에 내가 진짜 급해서 그날 오전에 받아야 되는데,그 동네에 오는 택배 기사님이 한 분밖에 안 계신다면 그거는 약간 번지수를 이렇게 거쳐 가면서 순서대로 진행이 돼가지고 만약에 내가 진짜 급해서 그날 오전에 받아야 되는데
미뤄져가지고 다음 날 오전이나 그날 늦은 밤에 이렇게 배달이 되면 쫌 안 좋을 수도 있으니까,미뤄져가지고 다음 날 오전이나 그날 늦은 밤에 이렇게 배달이 되면 조금 안 좋을 수도 있으니까
나는 내 드론으로 해가지고 이제 그게,나는 내 드론으로 해가지고 이제 그게
거기다 에이아이를 넣어서 그~ 터미널,거기다 에이아이를 넣어서 그~ 터미널
배송 터미널로 가서 직접 내 택배를 가져왔음 좋겠거든 너는 드론 배송 사업에 대해선 어떻게 생각해?,배송 터미널로 가서 직접 내 택배를 가져왔음 좋겠거든 너는 드론 배송 사업에 대해선 어떻게 생각해?
근데 요즘 기사 보면 택배 파업 이런 거 많잖아 막 택배를 약간 쿠팡처럼 빨리 배송해야 한다는 그런 압박감 때문에 사람들이,근데 요즘 기사 보면 택배 파업 이런 거 많잖아 막 택배를 약간 쿠팡처럼 빨리 배송해야 한다는 그런 압박감 때문에 사람들이
새벽 내내 배송을 하기도 하고 택배 기사로 일하다가 약간 힘들어서 많이 사망하시는 분이 많더라고 그런 거 보면 로봇이나,새벽 내내 배송을 하기도 하고 택배 기사로 일하다가 약간 힘들어서 많이 사망하시는 분이 많더라고 그런 거 보면 로봇이나
그런 게 대체해 주면 좋다고 생각한단 말이야 솔직히 사람이 하는 일보다 기계가 하면 더 빨리,그런 게 대체해 주면 좋다고 생각한단 말이야 솔직히 사람이 하는 일보다 기계가 하면 더 빨리
집에 도착할 수 있고 심지어 로봇 분야가 성장하고 있으니까 택배도 로봇이 배달해 주고 약간 아까 자율 주행 자동차가 있는 거처럼 자율로,집에 도착할 수 있고 심지어 로봇 분야가 성장하고 있으니까 택배도 로봇이 배달해 주고 약간 아까 자율 주행 자동차가 있는 거처럼 자율로
그까 그 지역에 배송해가지고 로봇이,그러니까 그 지역에 배송해가지고 로봇이
로봇이 운전까진 할 수 없을 거란 말이지 로봇이 그 차에 타고 있다가 대신 이렇게 그 사람 집에 갖다 주는 것도 나쁘지 않다고 생각한단 말이야 로봇이,로봇이 운전까진 할 수 없을 거란 말이지 로봇이 그 차에 타고 있다가 대신 이렇게 그 사람 집에 갖다 주는 것도 나쁘지 않다고 생각한단 말이야 로봇이
집까지 배송을 하고 자율 주행차가,집까지 배송을 하고 자율 주행차가
이렇게 운전을 하는 거지 솔직히 그런 거 생각하면 로봇이 약간 물류 그런 택배 사업에 대체되면 나는 좋다고 생각해.,이렇게 운전을 하는 거지 솔직히 그런 거 생각하면 로봇이 약간 물류 그런 택배 사업에 대체되면 나는 좋다고 생각해.
근데 만약에 울산에 드론 택시나 드론 버스 드론 버스 같은 게 너는 이게 상용화가 된다면 한 번 꼭 탈 의향이 있어?,근데 만약에 울산에 드론 택시나 드론 버스 드론 버스 같은 게 너는 이게 상용화가 된다면 한 번 꼭 탈 의향이 있어?
그게 새로 생겨나면 많은 사람들이 탈 거 같긴 한데  약간 초반에 시작한 그런 기계는 약간 위험성?,그게 새로 생겨나면 많은 사람들이 탈 거 같긴 한데  약간 초반에 시작한 그런 기계는 약간 위험성?
약간 안 좋은 점도 발칵 되고 사고도 많이 날 거 같단 말이야.,약간 안 좋은 점도 발칵 되고 사고도 많이 날 거 같단 말이야.
그래가지고 나는 약간 쫌 더 많이 업그레이드 돼가지고 사람들에게 이렇게 상용화되면 좋겠다고 생각하는데 너는 로봇 산업이 어디까지 발전했으면 좋겠어?,그래가지고 나는 약간 조금 더 많이 업그레이드 돼가지고 사람들에게 이렇게 상용화되면 좋겠다고 생각하는데 너는 로봇 산업이 어디까지 발전했으면 좋겠어?
나는 어~ 솔직히 얘기해서 만약에 내가 의류 산업을 얘기를 해봐도 어~ 의류,나는 어~ 솔직히 얘기해서 만약에 내가 의류 산업을 얘기를 해봐도 어~ 의류
의류를 만드는 데는 소재를 파악해야 되는 그런 부분도 있단 말이야 근데 나는 그거는 오로지 인간만이 느낄 수 있는 촉감으로밖에 선택을 못 한다고 생각해서,의류를 만드는 데는 소재를 파악해야 되는 그런 부분도 있단 말이야 근데 나는 그거는 오로지 인간만이 느낄 수 있는 촉감으로밖에 선택을 못 한다고 생각해서
아직까지는 로봇이 인간 세상을 지배할 수는 없다고 생각하는데 만약에,아직까지는 로봇이 인간 세상을 지배할 수는 없다고 생각하는데 만약에
너가 원하는 장래 희망이 간호사잖아 근데 간호 그게 로봇이 대체할 수도 있다고 한다면 만약에,너가 원하는 장래 희망이 간호사잖아 근데 간호 그게 로봇이 대체할 수도 있다고 한다면 만약에
진짜 세밀한 약간 세포 이런 거랑 주사를 놓는 거는 로봇이 대체할 수 있다고 봐?,진짜 세밀한 약간 세포 이런 거랑 주사를 놓는 거는 로봇이 대체할 수 있다고 봐?
나는 약간 의료 쪽에 관심이 많다 보니까 그런 기사를 많이 본단 말이야 근데 보면,나는 약간 의료 쪽에 관심이 많다 보니까 그런 기사를 많이 본단 말이야 근데 보면
약간 엑스레이 그런 거만 찍어도 사람 뼈가 다 나오는 거처럼 약간 요즘 기계로 하면 약간 사람 눈에는 안 보이는 그런 병들이,약간 엑스레이 그런 거만 찍어도 사람 뼈가 다 나오는 거처럼 약간 요즘 기계로 하면 약간 사람 눈에는 안 보이는 그런 병들이
기계로 하니까 한 방에 이렇게 쏙쏙 나온다는 그런 기사도 많이 봤단 말이야 솔직히 사람이 직접 이렇게 진단해가지고 하면,기계로 하니까 한 방에 이렇게 쏙쏙 나온다는 그런 기사도 많이 봤단 말이야 솔직히 사람이 직접 이렇게 진단해가지고 하면
암 이런 거 못 잡아낼 수도 있잖아 근데 기계로 하니까 금방금방 나오더라고 아까 말했듯이 그 물류 창고 거기서도,암 이런 거 못 잡아낼 수도 있잖아 근데 기계로 하니까 금방금방 나오더라고 아까 말했듯이 그 물류 창고 거기서도
아~ 그 영국에서는 이미 하고 있다고 들었거든 근데 그런 거 보면 진짜 한 번에 이렇게 오십 건의 주문을 막 오 분도 안 걸릴 정도로 빨리 이렇게 하는 거 보고 그런,아~ 그 영국에서는 이미 하고 있다고 들었거든 근데 그런 거 보면 진짜 한 번에 이렇게 오십 건의 주문을 막 오 분도 안 걸릴 정도로 빨리 이렇게 하는 거 보고 그런
에이아이 이런 드론이나 로봇 산업이 빨리 발전해가지고 사람들이 더 편하게 편하게 일하고 약간 더 편하게 생활을 했으면 좋겠다는 생각이 들어.,에이아이 이런 드론이나 로봇 산업이 빨리 발전해가지고 사람들이 더 편하게 편하게 일하고 약간 더 편하게 생활을 했으면 좋겠다는 생각이 들어.
근데 만약에 그 오십 건의 주문을 오 분 안에 이케 한다고 하잖아 그러면 만약에 거기 그,근데 만약에 그 오십 건의 주문을 오 분 안에 이렇게 한다고 하잖아 그러면 만약에 거기 그
시스템에 오류가 나가지고 다른 집으로 배달이 됐을 때는 어떤 책임을 물 수 있을 거 같애?,시스템에 오류가 나가지고 다른 집으로 배달이 됐을 때는 어떤 책임을 물 수 있을 거 같애?
사람이 하는 일이 아니다 보니까 로봇이 하면 더 빠른 건 맞지만 정교함 이런 게 더 떨어질 거라고 생각한단 말이야 그래가지고,사람이 하는 일이 아니다 보니까 로봇이 하면 더 빠른 건 맞지만 정교함 이런 게 더 떨어질 거라고 생각한단 말이야 그래가지고
모든 일을 다 로봇이 하는 거보다는 약간 무거운 거 이렇게 택배 그 상하차 보면 막 무거운 짐도 사람들이 다 오르락내리락 해야 된단 말이야 그런 힘든,모든 일을 다 로봇이 하는 거보다는 약간 무거운 거 이렇게 택배 그 상하차 보면 막 무거운 짐도 사람들이 다 오르락내리락 해야 된단 말이야 그런 힘든
거는 로봇이 이르케  띠띠띠 해가지고 옮기 옮기고 약간 사람은 약간 배송지 입력 아니면 정확하게 가도록 안내까지 약간 사람이랑 로봇이 내 생각에 협업해가지고,거는 로봇이 이렇게  띠띠띠 해가지고 옮기 옮기고 약간 사람은 약간 배송지 입력 아니면 정확하게 가도록 안내까지 약간 사람이랑 로봇이 내 생각에 협업해가지고
살아가야 된다고 생각한단 말이야 너는 로봇이랑 사람이랑 같이 일하는 거 어떻게 생각해?,살아가야 된다고 생각한단 말이야 너는 로봇이랑 사람이랑 같이 일하는 거 어떻게 생각해?
어~ 나는 그런 일은 없다고 생각해 왜냐면 로봇이 이제 보급화가 되면은 사람들의 일자리는,어~ 나는 그런 일은 없다고 생각해 왜냐면 로봇이 이제 보급화가 되면은 사람들의 일자리는
잃기 마련이란 말이야 그래서 솔직히 얘기해서 뭐~ 데이터 전문가나 로봇 관련 업계에 일하는 사람들 빼고는 다 일자리를 잃을 텐데,잃기 마련이란 말이야 그래서 솔직히 얘기해서 뭐~ 데이터 전문가나 로봇 관련 업계에 일하는 사람들 빼고는 다 일자리를 잃을 텐데
그거는 로봇이 인간 세상을 지배하는 거잖아 너는 로봇이 만약에 니 너가 일하고 있던 그 자리를 대체한다면 기분이 어떨 거 같애?,그거는 로봇이 인간 세상을 지배하는 거잖아 너는 로봇이 만약에 니 너가 일하고 있던 그 자리를 대체한다면 기분이 어떨 거 같애?
나는 로봇 산업이 발달하면 사라질 직업이 엄청 많단 말이야 뭐~ 내 직업도 사라질 수 있고,나는 로봇 산업이 발달하면 사라질 직업이 엄청 많단 말이야 뭐~ 내 직업도 사라질 수 있고
니 직업도 사라질 수 있을 거 같긴 한데 나는 약간 사람이 있어야 되는 직업이란 말이야 그까 로봇이 사람의 마음까지 읽을 순 없잖아 간병을 해주거나 약간 요양 병원 같이 그런 데는 로봇보다는 약간 사람과 이렇게 대화를 주고,너 직업도 사라질 수 있을 거 같긴 한데 나는 약간 사람이 있어야 되는 직업이란 말이야 그까 로봇이 사람의 마음까지 읽을 순 없잖아 간병을 해주거나 약간 요양 병원 같이 그런 데는 로봇보다는 약간 사람과 이렇게 대화를 주고
받으면서 병원에서도 그렇고 사람이 해야 할 일도 더 많고 로봇이 엄청나게 빠른 것도 아니고,받으면서 병원에서도 그렇고 사람이 해야 할 일도 더 많고 로봇이 엄청나게 빠른 것도 아니고
긴급 상황에서 로봇이 느그적 느그적 기어갈 텐데 그거는 솔직히 사람이 대체할 수 없잖아 그니까 나는 사람이랑 로봇이랑 같이 협업을 해가지고 일을 하면 우리 일자리도,긴급 상황에서 로봇이 느그적 느그적 기어갈 텐데 그거는 솔직히 사람이 대체할 수 없잖아 그러니까 나는 사람이랑 로봇이랑 같이 협업을 해가지고 일을 하면 우리 일자리도
쭐긴 쭐겠지만 더 빨리 더 편하고 야근 이런 것도 없어질 거라 생각한단 말이야  약간 근무 이런 거 그래가지고 나는 사람이랑 로봇이랑 같이 일을 해야 더 빨이 사회가 발전할 수 있겠다고 생각해.,줄긴 줄겠지만 더 빨리 더 편하고 야근 이런 것도 없어질 거라 생각한단 말이야  약간 근무 이런 거 그래가지고 나는 사람이랑 로봇이랑 같이 일을 해야 더 빨이 사회가 발전할 수 있겠다고 생각해.
