사투리,표준어
저는 뭐~ 가수보다 인제 우리 딸내미가 서프라이즈 하는 식으로 인제 엄마랑 아빠랑,저는 뭐~ 가수보다 인제 우리 딸내미가 서프라이즈 하는 식으로 인제 엄마랑 아빠랑
한 번 이케 연극이나 뭐~ 이런 거,한 번 이렇게 연극이나 뭐~ 이런 거
음~ 공연 그런 거 인제 이케 지가 서프라이즈 하는 편이에요 보니까,음~ 공연 그런 거 인제 이렇게 지가 서프라이즈 하는 편이에요 보니까
그래서 쫌 기쁘드라고요 딸내미가 이렇게 엄마 아빠를 챙겨주는 모습을 보니까 너무 고맙고 대견하고,그래서 조금 기쁘드라고요 딸내미가 이렇게 엄마 아빠를 챙겨주는 모습을 보니까 너무 고맙고 대견하고
그렇더라고요 참 딸내미 잘 낳았다 싶더라고요.,그렇더라고요 참 딸내미 잘 낳았다 싶더라고요.
혹시 이문세 저기 콘서트 가고 싶은데 엄마랑 아빠랑,혹시 이문세 저기 콘서트 가고 싶은데 엄마랑 아빠랑
아~  이문세 콘서트 엄마랑 아빠랑 혹시 가본 적이 있으신가요?,아~  이문세 콘서트 엄마랑 아빠랑 혹시 가본 적이 있으신가요?
저희 부모님은 저랑 음악 취향이 맞지 않아서,저희 부모님은 저랑 음악 취향이 맞지 않아서
저는 조용필이나 이쪽 가수면은 이선희 씨라던지,저는 조용필이나 이쪽 가수면은 이선희 씨라던지
그런 분들을 좋아하는데 저희 어머니랑 쫌 취향이 안 맞더라고요.,그런 분들을 좋아하는데 저희 어머니랑 조금 취향이 안 맞더라고요.
그래서 딱히 갈 생각도 없었고 그리고 그분들은 표 구하는 것도 어렵고 해서 딱히 가본 적이 없어요.,그래서 딱히 갈 생각도 없었고 그리고 그분들은 표 구하는 것도 어렵고 해서 딱히 가본 적이 없어요.
저는  트로트를 썩을 좋아하는 편도 아니라서 그 미스터 트롯 그것도,저는  트로트를 썩을 좋아하는 편도 아니라서 그 미스터 트롯 그것도
웬만하면 같이 갈려고 했지만 애석하게도 표도 못 뚫었고,웬만하면 같이 갈려고 했지만 애석하게도 표도 못 뚫었고
해서 같이 가본 적이 없네요 부모님이랑 같이 간다고 치면은,해서 같이 가본 적이 없네요 부모님이랑 같이 간다고 치면은
아무래도 아직까지 부모님 세대에 아직까지 활동을 하는 가수분들 같은 경우는,아무래도 아직까지 부모님 세대에 아직까지 활동을 하는 가수분들 같은 경우는
아무래도 표를 얻기가 굉장히 힘들다 보니까 그만큼,아무래도 표를 얻기가 굉장히 힘들다 보니까 그만큼
표를 얻기도 어렵기도 하고 그분 그 점에 대해서는 따님분이 굉장하신 거 같네요.,표를 얻기도 어렵기도 하고 그분 그 점에 대해서는 따님분이 굉장하신 거 같네요.
그래서 같이 가본 적은 없는 거 같아요.,그래서 같이 가본 적은 없는 거 같아요.
그러면은  님께서는 따님분이랑 같이 공연을 보러 간다고 치면은,그러면은  님께서는 따님분이랑 같이 공연을 보러 간다고 치면은
어떤 가수분의 공연을 보러 가고 싶으신가요?,어떤 가수분의 공연을 보러 가고 싶으신가요?
저는 저도 조용필 씨 좋아하고 전영록 씨 좋아하는데,저는 저도 조용필 씨 좋아하고 전영록 씨 좋아하는데
어~ 그분들 조용필 씨 콘서트가 있다면은,어~ 그분들 조용필 씨 콘서트가 있다면은
우리 딸내미하고 같이 한번 가보고 싶거든요.,우리 딸내미하고 같이 한번 가보고 싶거든요.
혹시  님은 뭐~ 이선희 씨하고 뭐~ 그분들 좋아한다고 하셨잖아요.,혹시  님은 뭐~ 이선희 씨하고 뭐~ 그분들 좋아한다고 하셨잖아요.
제일 혹시 뭐~ 좋아하는 뭐~ 가수분 있나요?,제일 혹시 뭐~ 좋아하는 뭐~ 가수분 있나요?
저는 아까 전에도 말했듯이 아이유라는 가수를 전 데뷔 전부터 알고 있어서,저는 아까 전에도 말했듯이 아이유라는 가수를 전 데뷔 전부터 알고 있어서
전 콘서트도 보러 가고 되게 초기 팬클럽 회원이라서,전 콘서트도 보러 가고 되게 초기 팬클럽 회원이라서
초기부터 굉장히 좋아하던 가수였어요 그래서,초기부터 굉장히 좋아하던 가수였어요 그래서
앞으로도 활동 열심히 하고 공연도 열심히 보러다닐 생각이에요.,앞으로도 활동 열심히 하고 공연도 열심히 보러다닐 생각이에요.
