사투리,표준어
요즘 갑자기 겨울 된 것처럼 추워 졌다 아이가 난 가을을 느껴 본 적이 없는데,요즘 갑자기 겨울 된 것처럼 추워 졌지 않아 난 가을을 느껴 본 적이 없는데
근데 내가 가을 진짜 좋아하거든 근데 금방 가 겨울이 돼가지고 너무 속상하다.,근데 내가 가을 진짜 좋아하거든 근데 금방 가 겨울이 돼가지고 너무 속상하다.
니는 원래 무슨 계절 좋아했노?,너는 원래 무슨 계절 좋아했어?
와 언니야도 가을 좋아하나 나도 가을 진짜 좋아하는데,와 언니도 가을 좋아하나 나도 가을 진짜 좋아하는데
가을 되면 약간 그런 거 있다 아이가 막 등산 가면 막 알록달록한 낙엽,가을 되면 약간 그런 거 있지 않아 막 등산 가면 막 알록달록한 낙엽
보는 재미도 있고 밟는 재미도 있고 바스락바스락 거리는 소리,보는 재미도 있고 밟는 재미도 있고 바스락바스락 거리는 소리
그리고 막 봄 되면은 막 벚꽃 구경 간다 이러는데 난 봄보다는 가을에 막 깔롱지기고,그리고 막 봄 되면은 막 벚꽃 구경 간다 이러는데 난 봄보다는 가을에 막 멋 내고
막 어~ 단풍 구경가고 막 그런 거 진짜 좋아하는데 요즘 코로나 때문에 못 가서 우짜노,막 어~ 단풍 구경가고 막 그런 거 진짜 좋아하는데 요즘 코로나 때문에 못 가서 어쩌지
아니 근데 이번에 부산에 단풍이 졌나?,아니 근데 이번에 부산에 단풍이 졌나?
내가 봤을 때 단풍 한 번도 못 본 거 같거든 근데 위에서 단풍놀이한다라고 티비에 나오는 나오는 거라,내가 봤을 때 단풍 한 번도 못 본 거 같거든 근데 위에서 단풍놀이한다라고 티비에 나오는 나오는 거야
그래서 부산도 이제 곧 단풍이 들겠구나 이렇게 했는데 어느날 친구한테 물어봤어,그래서 부산도 이제 곧 단풍이 들겠구나 이렇게 했는데 어느날 친구한테 물어봤어
야 우리 단풍이 졌나 노랗고 빨갛지가 않다 저 산 보니까 야 단풍 이미 다 떨어졌다아가,야 우리 단풍이 졌나 노랗고 빨갛지가 않다 저 산 보니까 야 단풍 이미 다 떨어졌잖아
이렇게 얘기하는 거라 근데 날씨도 갑자기 추워져가지고,이렇게 얘기하는 거야 근데 날씨도 갑자기 추워져가지고
내가 사실 닉네임이 가을 여자거든 여렸을 때부터 가을을 너무 좋아해가지고,내가 사실 닉네임이 가을 여자거든 여렸을 때부터 가을을 너무 좋아해가지고
근데 요즘은 가을이 진짜 눈코 뜰 새 없이 지나가니까 그~ 닉네임을 내가 활용을 못 하고 있어가지고 너무 속상하다 진짜,근데 요즘은 가을이 진짜 눈코 뜰 새 없이 지나가니까 그~ 닉네임을 내가 활용을 못 하고 있어가지고 너무 속상하다 진짜
한번 니랑도 등산 가기로 했었는데 말만 하다가 이렇게 겨울에 등산가는 건 좀 힘들다 아이가.,한번 너랑도 등산 가기로 했었는데 말만 하다가 이렇게 겨울에 등산가는 건 좀 힘들지 않아.
등산도 못 가고 이~ 가을이 없어져 버렸네.,등산도 못 가고 이~ 가을이 없어져 버렸네.
아~ 언니야 내 발목 다쳐서 그런 거 등산 안 갈 끼다 난 못 간다,아~ 언니 나 발목 다쳐서 그런 거 등산 안 갈 거다 난 못 간다
그리고 나 그리고 뭐~ 남사시롭꼬로 뭐~ 가을 여자가 뭔데 진짜,그리고 나 그리고 뭐~ 남사시럽게 뭐~ 가을 여자가 뭔데 진짜
아니 진짜 좀 옛날 옛날 느낌 물씬 나는데 와 언니 그래도,아니 진짜 좀 옛날 옛날 느낌 물씬 나는데 와 언니 그래도
가을을 좋아하는 건 그래도 나랑 똑같네 그것만큼은 맘에 드네.,가을을 좋아하는 건 그래도 나랑 똑같네 그것만큼은 맘에 드네.
다행이네 니 맘에 들라고 지은 건 아닌데 그~ 가을 여자 너무 무시하지 마라 가을 여자 오래된 닉네임이다.,다행이네 너 맘에 들라고 지은 건 아닌데 그~ 가을 여자 너무 무시하지 마라 가을 여자 오래된 닉네임이다.
아직도 바꾸지 않고 있다 가을 여자라 하기 그래서 가을 뇨자로 해놨거든,아직도 바꾸지 않고 있다 가을 여자라 하기 그래서 가을 뇨자로 해놓았거든
그래서 이 닉네임은 계속 유지할 거기 때문에 알겠제?,그래서 이 닉네임은 계속 유지할 거기 때문에 알겠지?
언니야 그러면 언니야 남자친구 닉네임은 가을 남자야?,언니 그러면 언니 남자친구 닉네임은 가을 남자야?
그래도 가을 여자 그래 뭐~ 티비에서도 그런 단어를 들으면,그래도 가을 여자 그래 뭐~ 티비에서도 그런 단어를 들으면
언니야가 생각날 것 같네 뭐한다고 그런 뭐~ 옛날스러운 닉네임을 계속 쓰노?,언니가 생각날 것 같네 뭐한다고 그런 뭐~ 옛날스러운 닉네임을 계속 써?
그래서 니가 남자친구의 닉네임을 물어본 거는 좀 실수했다 아이가.,그래서 네가 남자친구의 닉네임을 물어본 거는 좀 실수했지 않아.
그~ 닉네임을 유지하는 건 그냥 바꾸기 귀찮아서다 다른 이유가 없다 알겠제?,그~ 닉네임을 유지하는 건 그냥 바꾸기 귀찮아서다 다른 이유가 없다 알겠지?
하긴 뭐~ 닉네임에 뭐~ 정해진 게 있나 나도 뭐~,하긴 뭐~ 닉네임에 뭐~ 정해진 게 있나 나도 뭐~
아무 닉네임 갖다 쓰는데 뭐~,아무 닉네임 갖다 쓰는데 뭐~
언니야 그러면 가을을 제일 좋아하고 그다음 그러면 제일 싫어하는 계절은 뭐야?,언니 그러면 가을을 제일 좋아하고 그다음 그러면 제일 싫어하는 계절은 뭐야?
싫어하는 계절은 없다고 생각했는데 나이를 먹으니까 생기데,싫어하는 계절은 없다고 생각했는데 나이를 먹으니까 생기데
여름이 너무 싫고 근데 내가 추위를 안 탄다 생각했거든 근데 겨울에 너무 추운 거라 작년에,여름이 너무 싫고 근데 내가 추위를 안 탄다 생각했거든 근데 겨울에 너무 추운 거야 작년에
그래서 아~ 추위를 타는 사람이었구나 이렇게 생각을 했고 여름 자체는 뭐~ 햇빛 쨍쨍하고 이런 건 좋은데,그래서 아~ 추위를 타는 사람이었구나 이렇게 생각을 했고 여름 자체는 뭐~ 햇빛 쨍쨍하고 이런 건 좋은데
근데 내가 피부가 좀 예민하단 말이야 그래서 이게 땀을 많이 흘리고 하면 막 얼굴이랑 피부가 너무 간지럽고 이래,근데 내가 피부가 좀 예민하단 말이야 그래서 이게 땀을 많이 흘리고 하면 막 얼굴이랑 피부가 너무 간지럽고 이래
따갑고 그래서 좀 화장을 또 맨날 해야 된데 예민한 거지 그래서 예전에 직장 다닐 때는 아침에 출근하면,따갑고 그래서 좀 화장을 또 맨날 해야 된데 예민한 거지 그래서 예전에 직장 다닐 때는 아침에 출근하면
이~ 계단을 오르고 나면 간단한 계단을 오르면 계속 거기에 난방과 뭐~ 에어컨이 계절에 상관없이,이~ 계단을 오르고 나면 간단한 계단을 오르면 계속 거기에 난방과 뭐~ 에어컨이 계절에 상관없이
너무 시원하게 따뜻하게 켜지니까 이 계절을 모르고 지냈어 그리고 뭐~,너무 시원하게 따뜻하게 켜지니까 이 계절을 모르고 지냈어 그리고 뭐~
피부가 안 좋거나 이런 생각도 한 번도 한 적이 없는데,피부가 안 좋거나 이런 생각도 한 번도 한 적이 없는데
그러고 나서 그다음 해를 맞았을 때는 이젠 그 일이 좀 없어지고 내가 다른 일 하다 보니까,그러고 나서 그다음 해를 맞았을 때는 이젠 그 일이 좀 없어지고 내가 다른 일 하다 보니까
계속 이동하니까 땀을 너무 많이 흘리는 거야 그래서 얼굴 막 두드러기 일어나고 알레 알레르기 생기고 이러니까,계속 이동하니까 땀을 너무 많이 흘리는 거야 그래서 얼굴 막 두드러기 일어나고 알레 알레르기 생기고 이러니까
와 여름은 내가 견딜 수 없겠구나 이제 시원한 곳을 빨리 찾자 이 더위는 빨리 갔으면 좋겠다.,와 여름은 내가 견딜 수 없겠구나 이제 시원한 곳을 빨리 찾자 이 더위는 빨리 갔으면 좋겠다.
쫌 이런 생각해서 여름이 예전보다는 지금은 쫌 그래도 이~ 네 개의 겨 그~ 계절 중에서는 좀 싫어하는 축이 된 것 같고,조금 이런 생각해서 여름이 예전보다는 지금은 조금 그래도 이~ 네 개의 겨 그~ 계절 중에서는 좀 싫어하는 축이 된 것 같고
겨울 같은 경우에 춥긴 추운데 그래도 약간 겨울에 이미지가 하면 나는 눈이 쫌 떠오르고 해서,겨울 같은 경우에 춥긴 추운데 그래도 약간 겨울에 이미지가 하면 나는 눈이 조금 떠오르고 해서
눈에 대한 추억은 그래도 좋거든 그래서 부산은 사실 눈이 너무 안와가지고 이건 쫌 아니다라는 생각을 내가 했는데,눈에 대한 추억은 그래도 좋거든 그래서 부산은 사실 눈이 너무 안와가지고 이건 조금 아니다라는 생각을 내가 했는데
근데 눈 때문에라도 아니면 크리스마스 약간 그런 분위기 연말 그리고 연초 이런 분위기 때문에 겨울은 그래도,근데 눈 때문에라도 아니면 크리스마스 약간 그런 분위기 연말 그리고 연초 이런 분위기 때문에 겨울은 그래도
좀 힘을 내면서 버틸 수 있는 것 같은데 여름 하필 중간에 끼어가지고 장마에 태풍에 너무 힘들다.,좀 힘을 내면서 버틸 수 있는 것 같은데 여름 하필 중간에 끼어가지고 장마에 태풍에 너무 힘들다.
생각만 해도 머리 아프다 니는 어떻노?,생각만 해도 머리 아프다 너는 어때?
아~ 언니야 우째 내랑 이래 똑같노 나도,아~ 언니 어떻게 나랑 이래 똑같아 나도
여름이 너무 싫다 나는 진짜 어렸을 때부터 여름 그~ 뜨거운 햇빛이 너무 싫었고,여름이 너무 싫다 나는 진짜 어렸을 때부터 여름 그~ 뜨거운 햇빛이 너무 싫었고
나는 나도 이제 피부 쪽으로 쫌 예민하기 때문에 쪼끔만 열 받아도 막 벌게지고 그러니까,나는 나도 이제 피부 쪽으로 조금 예민하기 때문에 쪼끔만 열 받아도 막 벌게지고 그러니까
어~ 특히나 그 여름 때 왜 학교 다니면 체력 검증 체력 단련 막 그런 것도 했었는데,어~ 특히나 그 여름 때 왜 학교 다니면 체력 검증 체력 단련 막 그런 것도 했었는데
어~ 오래 뛰니까 얼굴이 너무 빨개지더라고 그래서 진짜 심각해질 정도로 빨개졌는데 나 그래서 여름이 너무 싫고,어~ 오래 뛰니까 얼굴이 너무 빨개지더라고 그래서 진짜 심각해질 정도로 빨개졌는데 나 그래서 여름이 너무 싫고
땀 흘리는 것도 나도 와 너무 쪼끔만 걸어가도 막 화장 다 무너져 내리고,땀 흘리는 것도 나도 와 너무 쪼끔만 걸어가도 막 화장 다 무너져 내리고
그리고 또다시 하면 또 답답하고 빨리 시원한 데 찾고 싶고 그래서 막 여름에 은행이 되게 인기 많다 아이가,그리고 또다시 하면 또 답답하고 빨리 시원한 데 찾고 싶고 그래서 막 여름에 은행이 되게 인기 많지 않아
예전에는 은행이 인기 많았는데 아까 말한 영화관도 사람 진짜 많이 오고,예전에는 은행이 인기 많았는데 아까 말한 영화관도 사람 진짜 많이 오고
그랬던 것 같고 나도 겨울 되면 이제 눈 어렸을 때는 그래도 좀 많이 온 편이라서,그랬던 것 같고 나도 겨울 되면 이제 눈 어렸을 때는 그래도 좀 많이 온 편이라서
눈 엄청 많이 내리면 이제 아빠가 그~ 쌀 포대기 다 뜯어가지고 막 뒷산 올라가가지고 동생이랑 같이,눈 엄청 많이 내리면 이제 아빠가 그~ 쌀 포대기 다 뜯어가지고 막 뒷산 올라가가지고 동생이랑 같이
이제 내려가라 이러면서 이렇게 밀어주고 했는데 아~ 그것도 진짜 재밌었던 것 같고,이제 내려가라 이러면서 이렇게 밀어주고 했는데 아~ 그것도 진짜 재밌었던 것 같고
근데 예전에는 진짜 눈하면 그렇게 좋은 기억이 떠오르는데 요즘에 눈 하면 막 신발 다 젖고 막 추적추적하고,근데 예전에는 진짜 눈하면 그렇게 좋은 기억이 떠오르는데 요즘에 눈 하면 막 신발 다 젖고 막 추적추적하고
약간 그런 거 생각이 나는 거 보면 나도 쫌 나이를 먹었구나 요즘에 그런 생각든다 왜,약간 그런 거 생각이 나는 거 보면 나도 조금 나이를 먹었구나 요즘에 그런 생각든다 왜
어렸을 때 눈 떠올리면은 막 되게 기분 좋고 그런 거 떠오르면 동심이 살아있는,어렸을 때 눈 떠올리면은 막 되게 기분 좋고 그런 거 떠오르면 동심이 살아있는
약간 젊은 축이라 한다면은 약간 나처럼 이런 생각하는 사람은 쫌 나이가 든 편이라고 하데 언니야는 어때?,약간 젊은 축이라 한다면은 약간 나처럼 이런 생각하는 사람은 조금 나이가 든 편이라고 하데 언니는 어때?
내가 니보다 동심인 것 같다 눈 하면 더 추억이 더 많이 떠오르네.,내가 너보다 동심인 것 같다 눈 하면 더 추억이 더 많이 떠오르네.
어~ 예전에 그~ 근데 진짜 나이 먹으면 땀구멍이 더 열릴 수도 있디 니 조심해래이,어~ 예전에 그~ 근데 진짜 나이 먹으면 땀구멍이 더 열릴 수도 있다 너 조심해라
예전에는 나 땀을 진짜 안 흘렸거든 근데 어느 순간부터 이~ 땀구멍이 열리기 시작하더니,예전에는 나 땀을 진짜 안 흘렸거든 근데 어느 순간부터 이~ 땀구멍이 열리기 시작하더니
이제 땀이 줄줄줄줄 흐르는 거야 막 시도 때도 없이 더우면,이제 땀이 줄줄줄줄 흐르는 거야 막 시도 때도 없이 더우면
그래서 아~ 이게 체력과 나이 때문인가 하는 생각하긴 했는데 진짜 조심해야 된다.,그래서 아~ 이게 체력과 나이 때문인가 하는 생각하긴 했는데 진짜 조심해야 된다.
그리고 부산은 사실 진짜 눈이 안 와가지고 예전에 한 칠팔 년 전인가 그때 눈이 온 적이 있어 부산에,그리고 부산은 사실 진짜 눈이 안 와가지고 예전에 한 칠팔 년 전인가 그때 눈이 온 적이 있어 부산에
그래서 진짜 니가 얘기한 것처럼 발목 정도로 눈이 좀 쌓였거든.,그래서 진짜 네가 얘기한 것처럼 발목 정도로 눈이 좀 쌓였거든.
그래서 내가 예전에 살던 이제 고향에서는 그 정도는 뭐~ 지나다닐 수 있고 차도 다닐 수 있고 아무렇지 않은 눈 이였기 때문에,그래서 내가 예전에 살던 이제 고향에서는 그 정도는 뭐~ 지나다닐 수 있고 차도 다닐 수 있고 아무렇지 않은 눈 이였기 때문에
걱정을 안 하는데 부산은 보니까 산에 있는 그~ 아파트나 이런 동네가 많다 아이가.,걱정을 안 하는데 부산은 보니까 산에 있는 그~ 아파트나 이런 동네가 많지 않아.
그니까 눈이 오면 여긴 재앙인 거지 그래서 그 한 발목까지 쌓인 눈을 내가,그러니까 눈이 오면 여긴 재앙인 거지 그래서 그 한 발목까지 쌓인 눈을 내가
그때 버스를 타고 어디 갈 일이 있었는데 버스 타면 한 십 분 거리였어 근데 그 거리를,그때 버스를 타고 어디 갈 일이 있었는데 버스 타면 한 십 분 거리였어 근데 그 거리를
한 한 시간 동안 차가 안 움직이는 거야 그~ 발목까지 쌓인 눈 때문에 이게 정리가 안 돼가지고,한 한 시간 동안 차가 안 움직이는 거야 그~ 발목까지 쌓인 눈 때문에 이게 정리가 안 돼가지고
그면 눈 녹으면 막 아까 얘기한 것처럼 엄청 막 더럽기도 하고 까맣게 돼가지고 질퍽질퍽 하다 아이가,그면 눈 녹으면 막 아까 얘기한 것처럼 엄청 막 더럽기도 하고 까맣게 돼가지고 질퍽질퍽 하지 않아
발 다 젖고 이게 그런 상태에서 막 힘들게 그 시간을 지나는데 내가 생각했을 때 별거 아닌데 어떻게 보면 이 눈 금방 치울 수 있는 눈인데 준비만 돼 있으면,발 다 젖고 이게 그런 상태에서 막 힘들게 그 시간을 지나는데 내가 생각했을 때 별거 아닌데 어떻게 보면 이 눈 금방 치울 수 있는 눈인데 준비만 돼 있으면
근데 부산은 하도 눈이 안 오다 보니까 이게 좀 대비하는 게 잘 안 돼 있구나 싶어가지고,근데 부산은 하도 눈이 안 오다 보니까 이게 좀 대비하는 게 잘 안 돼 있구나 싶어가지고
좀 그때 아쉬웠고 좀 눈이 한 번에 좀 펑펑 내려가지고,좀 그때 아쉬웠고 좀 눈이 한 번에 좀 펑펑 내려가지고
부산에서도 눈을 좀 예쁘게 볼 수 있을 때가 언제쯤 올까 이런 생각을 좀 하면서 기다리고 있지.,부산에서도 눈을 좀 예쁘게 볼 수 있을 때가 언제쯤 올까 이런 생각을 좀 하면서 기다리고 있지.
이번 크리스마스 때 어~ 이번 크리스마스 때 화이트 크리스마스가 될 확률이 크다라고 기상청에서 얘기를 하대,이번 크리스마스 때 어~ 이번 크리스마스 때 화이트 크리스마스가 될 확률이 크다라고 기상청에서 얘기를 하대
근데 난 기상청을 믿진 않거든 그래도 쪼끔의 기대를 해 보게 된다.,근데 난 기상청을 믿진 않거든 그래도 쪼끔의 기대를 해 보게 된다.
언니야 그런 기대 하지 마라 난 기상청 절대로 안 믿는다 막 태풍 온다 해가지고 오만 준비를 다 했는데도 막 태풍 안 오기도 하고,언니 그런 기대 하지 마라 난 기상청 절대로 안 믿는다 막 태풍 온다 해가지고 오만 준비를 다 했는데도 막 태풍 안 오기도 하고
나도 막 작년에 뭐~ 나도 뭐~ 화이트 크리스마스 될 거라는 뭐~ 그런 기사를 본 적 있었는데,나도 막 작년에 뭐~ 나도 뭐~ 화이트 크리스마스 될 거라는 뭐~ 그런 기사를 본 적 있었는데
화이트는 무슨 그냥 되게 맑더라고 역시 하늘은 어~ 크리스마스 따윈 신경 쓰지 않는,화이트는 무슨 그냥 되게 맑더라고 역시 하늘은 어~ 크리스마스 따윈 신경 쓰지 않는
그런 날씨를 음~ 그런 생각도 했었고 그래도 화이트 크리스마스 되면 이번에 어~ 눈 올 때 잠시는 이쁘겠네.,그런 날씨를 음~ 그런 생각도 했었고 그래도 화이트 크리스마스 되면 이번에 어~ 눈 올 때 잠시는 이쁘겠네.
그래도 나는 나가기 싫다 너무 추적추적할 것 같다.,그래도 나는 나가기 싫다 너무 추적추적할 것 같다.
비는 그래도 이제 내리면는 끝이지만 눈은 남아 있다 아이가 그~ 잔재가,비는 그래도 이제 내리면는 끝이지만 눈은 남아 있지 않아 그~ 잔재가
그믄 그거 계속 막 밟고 다녀야 되고 나는 늙었나봐.,그믄 그거 계속 막 밟고 다녀야 되고 나는 늙었나봐.
근데 사실 부산에서는 눈이 펑펑 와도 금방 녹아버릴 거라서 니가 얘기한 것처럼,근데 사실 부산에서는 눈이 펑펑 와도 금방 녹아버릴 거라서 네가 얘기한 것처럼
그냥 창을 통해가지고 눈 내리는 거 구경만 하고 인증샷 하나 찍고 그러고 끝나지 않을까 싶긴 하다.,그냥 창을 통해가지고 눈 내리는 거 구경만 하고 인증샷 하나 찍고 그러고 끝나지 않을까 싶긴 하다.
근데 실제로 부산 보니까 여긴 우박 같은 것도 막 잘 안 온다 아이가 그니까 눈이 안 오는 게,근데 실제로 부산 보니까 여긴 우박 같은 것도 막 잘 안 오지 않아 그러니까 눈이 안 오는 게
눈이 될려다가 얘네가 막 물처럼 되서 비로 쏟아진다 아이가 그래서 비 맞을 때는 더 많고,눈이 될려다가 얘네가 막 물처럼 되서 비로 쏟아지지 않아 그래서 비 맞을 때는 더 많고
근데 내가 최근에 광안리에 살다 보니까 바닷가 옆이잖아 장난 아니 거든 비 오고 나면 바람까지 불면 이거는 진짜 매일이 태풍 같은 삶을 살고 있다.,근데 내가 최근에 광안리에 살다 보니까 바닷가 옆이잖아 장난 아니 거든 비 오고 나면 바람까지 불면 이거는 진짜 매일이 태풍 같은 삶을 살고 있다.
그래서 어~ 진짜 눈이 차라리 눈이 그냥 예쁘게 한번 포슬포슬 내리고 짧아도,그래서 어~ 진짜 눈이 차라리 눈이 그냥 예쁘게 한번 포슬포슬 내리고 짧아도
이번에는 짧게라도 좀 그렇게 내리고 그냥 눈요기라도 좀 하고 인증샷 한번 찍고 하얗게,이번에는 짧게라도 좀 그렇게 내리고 그냥 눈요기라도 좀 하고 인증샷 한번 찍고 하얗게
그래서 어~ 화이트 크리스마스인 것 같네요 이렇게 보낼 수 있을 정도로만 왔으면 좋겠다는,그래서 어~ 화이트 크리스마스인 것 같네요 이렇게 보낼 수 있을 정도로만 왔으면 좋겠다는
좀 소망을 가져보는 근데 사실 크리스마스가 별 의미가 없지 나도 뭐 집에서 방콕할 것 같긴 한데,좀 소망을 가져보는 근데 사실 크리스마스가 별 의미가 없지 나도 뭐 집에서 방콕할 것 같긴 한데
의미는 없지만 그래도 마음은 훈훈해지기를 그렇게 생각해본다.,의미는 없지만 그래도 마음은 훈훈해지기를 그렇게 생각해본다.
역시 화이트 크리스마스나 비 오는 날이나 태풍은 집 안에 있는 게 최고지.,역시 화이트 크리스마스나 비 오는 날이나 태풍은 집 안에 있는 게 최고지.
그러고 언니 그러면 바다 근처에 살면은 여름에 모기 진짜 장난 아니겠네.,그러고 언니 그러면 바다 근처에 살면은 여름에 모기 진짜 장난 아니겠네.
진짜 바다 모기가 더 크고 막 피도 더 많이 빨아 먹는다고 해가지고 난 모기를 진짜 싫어하거든 도대체 모기는 왜 있을까라는 생각을 해 볼 정도로,진짜 바다 모기가 더 크고 막 피도 더 많이 빨아 먹는다고 해가지고 난 모기를 진짜 싫어하거든 도대체 모기는 왜 있을까라는 생각을 해 볼 정도로
모기가 너무 싫은데 예전에 살던 집에서는 어~ 모기가 봄 늦봄부터 있어서,모기가 너무 싫은데 예전에 살던 집에서는 어~ 모기가 봄 늦봄부터 있어서
초봄까지 거의 일 년 내내 계속 나왔는데 그거 때문에 너무 스트레스받고 노이로제 걸릴 것 같애가지고,초봄까지 거의 일 년 내내 계속 나왔는데 그거 때문에 너무 스트레스받고 노이로제 걸릴 것 같애가지고
모기가 그 정도로 싫은데 언니야 동네는 어때?,모기가 그 정도로 싫은데 언니 동네는 어때?
광안리가 바다가 맞긴 한데 그렇게 직접적으로 모기가,광안리가 바다가 맞긴 한데 그렇게 직접적으로 모기가
바다 모기가 생성이 되는 건가 어~ 거기에 대해서 처음 듣는 사실이여가지고,바다 모기가 생성이 되는 건가 어~ 거기에 대해서 처음 듣는 사실이여가지고
근데 최근에 여름에도 모기가 많긴 많다 그래서 밤에 맨날 잘려고 하면 안다 아이가,근데 최근에 여름에도 모기가 많긴 많다 그래서 밤에 맨날 잘려고 하면 알지 않아
모기 윙윙대가지고 귀에서 진짜 잡고 싶은데 불 켜면 안 보이고 도망가고,모기 윙윙대가지고 귀에서 진짜 잡고 싶은데 불 켜면 안 보이고 도망가고
또 누워서 불 끄면 윙윙대고 인마를 어떻게 할까 진짜 생각하면서 그냥 잠들다가,또 누워서 불 끄면 윙윙대고 인마를 어떻게 할까 진짜 생각하면서 그냥 잠들다가
다음날 다 물려가지고 난리나 있고 이런 적이 있긴 한데 어~ 모기는 내가 바다 모기라는 생각 한 번도 해 본 적이 없네.,다음날 다 물려가지고 난리나 있고 이런 적이 있긴 한데 어~ 모기는 내가 바다 모기라는 생각 한 번도 해 본 적이 없네.
근데 산 모기는 생각해봤지 뭐~ 등산가거나 놀러 가면은 까만 모기 있다 아이가.,근데 산 모기는 생각해봤지 뭐~ 등산가거나 놀러 가면은 까만 모기 있지 않아.
엄청 크고 아~ 이런 애들은 물리면 사망하겠다 이런 생각들 정도의 모기들,엄청 크고 아~ 이런 애들은 물리면 사망하겠다 이런 생각들 정도의 모기들
근데 다행히 아직 그런 모기를 발견하지는 않았는데 그래도 지금은 겨울이라서 모기는 따로 없는 것 같고 근데 한 번씩,근데 다행히 아직 그런 모기를 발견하지는 않았는데 그래도 지금은 겨울이라서 모기는 따로 없는 것 같고 근데 한 번씩
애들 등장할 때가 있다 어디서 등장하는지 모르겠어 니가 말한 것처럼 광안리 바닷가에서부터 우리 집까지 왔을 수도 있긴 한데,애들 등장할 때가 있다 어디서 등장하는지 모르겠어 네가 말한 것처럼 광안리 바닷가에서부터 우리 집까지 왔을 수도 있긴 한데
