사투리,표준어
카면서 되게 재밌게 봤던 기억이 있어 아~ 니는 뭐~ 드라마 보면서,하면서 되게 재밌게 봤던 기억이 있어 아~ 너는 뭐~ 드라마 보면서
약간 와 감동이다 아니면  어떻게 이런 장면이 나오지?,약간 와 감동이다 아니면  어떻게 이런 장면이 나오지?
뭐~ 이런 아니면 엄청 깔깔댄다거나 그렇게 감명 깊게 봤던 장면이 있나?,뭐~ 이런 아니면 엄청 깔깔댄다거나 그렇게 감명 깊게 봤던 장면이 있어?
어~ 나는 개인적으로 스카이 캐슬이 쫌 많이 그랬던 거 같애 왜냐면,어~ 나는 개인적으로 스카이 캐슬이 조금 많이 그랬던 거 같애 왜냐면
어~ 내가 말했던 따른 그~ 두 드라마는,어~ 내가 말했던 다른 그~ 두 드라마는
쫌 나한테 일어나기 힘든 일이기도 하고 그~ 구미호 나온다거나 아니면,조금 나한테 일어나기 힘든 일이기도 하고 그~ 구미호 나온다거나 아니면
그~ 이태원 클라쓰 같은 경우에는 뭐~ 청년 창업 인생 성공기  그런 느낌인데,그~ 이태원 클라쓰 같은 경우에는 뭐~ 청년 창업 인생 성공기  그런 느낌인데
그런 거는 창업을 안 하면 쫌 공감대가 떨어지겠지만 스카이 캐슬,그런 거는 창업을 안 하면 조금 공감대가 떨어지겠지만 스카이 캐슬
엄청 떴던 이유 중에 하나는 어~ 솔직히,엄청 떴던 이유 중에 하나는 어~ 솔직히
많은 우리나라 고등학생 중학생 애들이 공부 진짜 죽어라 하잖아  그런 거에 대한,많은 우리나라 고등학생 중학생 애들이 공부 진짜 죽어라 하잖아  그런 거에 대한
동감이 엄청 공감이 엄청 커서 그 드라마가,동감이 엄청 공감이 엄청 커서 그 드라마가
되게 난 떴다고 생각을 하거든 물론 각본도 좋고 노래도 좋았지만,되게 난 떴다고 생각을 하거든 물론 각본도 좋고 노래도 좋았지만
그 장면을 보면서 처음에 거의거의 초반에 기억나는 거는 쫌,그 장면을 보면서 처음에 거의거의 초반에 기억나는 거는 조금
절망적이었던 건데 그게 애 엄마가 하나 죽어 근데 죽는 이유가,절망적이었던 건데 그게 애 엄마가 하나 죽어 근데 죽는 이유가
지금 자세히는 기억이 안 나는데 그~ 엄마가 죽는데 그~ 어떻게 죽냐면,지금 자세히는 기억이 안 나는데 그~ 엄마가 죽는데 그~ 어떻게 죽냐면
아~ 기억났다 그~ 아들이 원래 엄청 공부 잘하는 아들이 그~ 뭐지?,아~ 기억났다 그~ 아들이 원래 엄청 공부 잘하는 아들이 그~ 뭐지?
어디 좋은 대학을 들어갔나 이렇게 됐는데 이제 학교,어디 좋은 대학을 들어갔나 이렇게 됐는데 이제 학교
개강하기 전에 유럽 여행 갔다 올게요 카면서 고 길로 고대로 도망쳐버려  엄마가,개강하기 전에 유럽 여행 갔다 올게요 하면서 고 길로 고대로 도망쳐버려  엄마가
엄마가 또 극성 헬리콥터 엄마란 말이야 그 사람이 그~ 막,엄마가 또 극성 헬리콥터 엄마란 말이야 그 사람이 그~ 막
열받아가지구 아들한테 배신감도 느끼고 그래가지고,열받아가지구 아들한테 배신감도 느끼고 그래가지고
이~ 뭐~ 뭐~ 어떻게 주체가 안 되나 봐 그래서 남편하고 얘기를 하는데 남편이 뭐~,이~ 뭐~ 뭐~ 어떻게 주체가 안 되나 봐 그래서 남편하고 얘기를 하는데 남편이 뭐~
엄마인 니가 뭐~ 잘했어야지 카면서 니 땜에 애들이 애가 나간 거 아니야 카면서 엄청 윽박질러,엄마인 네가 뭐~ 잘했어야지 하면서 너 땜에 애들이 애가 나간 거 아니야 하면서 엄청 윽박질러
그래서 어무이도 힘드셨겠지 당연히 평생 믿고 온 아들한테 배신당한 거하고,그래서 어머니도 힘드셨겠지 당연히 평생 믿고 온 아들한테 배신당한 거하고
내 어디 하나 의지할 거 없는 그런 좌절감 때문에 갑자기 드라마에서 그게 암만 시간대가 늦었다 하지만,내 어디 하나 의지할 거 없는 그런 좌절감 때문에 갑자기 드라마에서 그게 암만 시간대가 늦었다 하지만
강가에  띠나가가지구  목구멍에 총 쏴 놓고  하면서 끝난단 말이야,강가에  뛰어나가가지고  목구멍에 총 쏴 놓고  하면서 끝난단 말이야
난 그게 너무 충격이었어 그리고 약간 그런,난 그게 너무 충격이었어 그리고 약간 그런
어떻게 보면 쫌 자극적이지 그런 장면으로 인해서 점점 이제 공감이 가서 보는데,어떻게 보면 조금 자극적이지 그런 장면으로 인해서 점점 이제 공감이 가서 보는데
내가 물론 거기에 있는 애들처럼 공부를 나의,내가 물론 거기에 있는 애들처럼 공부를 나의
공부는 나의 목숨이다 나는 뭐~  최상위권 성적도 물론 아니었고,공부는 나의 목숨이다 나는 뭐~  최상위권 성적도 물론 아니었고
그렇게 공부를 열정적이게 하는 것도 아니었어 근데 그 밑에,그렇게 공부를 열정적이게 하는 것도 아니었어 근데 그 밑에
그~ 진짜 성적이었지 근데  게네들을 보면서,그~ 진짜 성적이었지 근데  게네들을 보면서
아~ 그래도 얘네들이 드라마를 통해서 하는 말이,아~ 그래도 얘네들이 드라마를 통해서 하는 말이
뭐~ 성적이 다가 아니다 성적보다,뭐~ 성적이 다가 아니다 성적보다
더 중요한 게 우리 학창 시절에는 분명히 있고,더 중요한 게 우리 학창 시절에는 분명히 있고
그렇게 성적에 집착하지는 말자 그런 모습이었거든 근데 그 드라마에서 보면,그렇게 성적에 집착하지는 말자 그런 모습이었거든 근데 그 드라마에서 보면
그~ 과외 과외 쌤이 어떻게 보면 주인공이잖아?,그~ 과외 과외 쌤이 어떻게 보면 주인공이잖아?
그 사람이 이제 주가 돼서 뭐~ 애들을 공부시키는데 그 사람이,그 사람이 이제 주가 돼서 뭐~ 애들을 공부시키는데 그 사람이
어~ 약간 그~ 철학 같은 게 어떻게든 성적만 나오면,어~ 약간 그~ 철학 같은 게 어떻게든 성적만 나오면
뭐~ 수단 방법 가리지 않겠다 카면서 딴 애들 막 엿 멕이고 부모 딴 애들 뭐~,뭐~ 수단 방법 가리지 않겠다 하면서 딴 애들 막 엿 먹이고 부모 딴 애들 뭐~
부모 뒤통수 때리고 인자 수단 방법 안 가리면서,부모 뒤통수 때리고 이제 수단 방법 안 가리면서
이렇게 막 하는 하는 거였는데 알고 보니까 그 사람이 자기 자식은,이렇게 막 하는 하는 거였는데 알고 보니까 그 사람이 자기 자식은
어릴 때 엄청 영재였대 근데 어떤 가정의 불화로 인해서 얘가,어릴 때 엄청 영재였대 근데 어떤 가정의 불화로 인해서 얘가
완전 자폐아가 돼버린 거야 그래서 그런 애기들을 델꼬 있는 와 있는 와중에도,완전 자폐아가 돼버린 거야 그래서 그런 애기들을 데리고 있는 와 있는 와중에도
그렇게 공부 땜에 스트레스를 받아서 얘가 못 견뎌서 잘못했음에도 불구하고,그렇게 공부 땜에 스트레스를 받아서 얘가 못 견뎌서 잘못했음에도 불구하고
자기가 과외 하는 학생들은 엄청 큰 스트레스와 강박으로,자기가 과외 하는 학생들은 엄청 큰 스트레스와 강박으로
그렇게 성적을 끌어올리고 그런 모습을 보면서,그렇게 성적을 끌어올리고 그런 모습을 보면서
와 지 애한테 못 했던 걸 남 애한테 시키네 이런 거를 보고 약간 게네 드라마에서 하는,와 자기 애한테 못 했던 걸 남 애한테 시키네 이런 거를 보고 약간 게네 드라마에서 하는
말이 나한테 쫌 와닿았어 우리가 뉴스에서  보더라도 막 성적 비관 자살 뭐~ 아니면,말이 나한테 조금 와닿았어 우리가 뉴스에서  보더라도 막 성적 비관 자살 뭐~ 아니면
어~ 왕따 이런 것도 있고 공부 못 하면 애들이 쫌 무시하고 이런 것도 있었는데 그런 점을 이케 다 꼬집으면서,어~ 왕따 이런 것도 있고 공부 못 하면 애들이 조금 무시하고 이런 것도 있었는데 그런 점을 이렇게 다 꼬집으면서
내용도 재밌게 이끌어가고 그때 배우들도 되게,내용도 재밌게 이끌어가고 그때 배우들도 되게
처음에 유명한 사람도 많이 나왔지만 이제 아역을 했던 사람들은 크게 유명하지 않은 애들이었는데도,처음에 유명한 사람도 많이 나왔지만 이제 아역을 했던 사람들은 크게 유명하지 않은 애들이었는데도
연기를 되게 잘하고 난 그런 모습이 되게 좋았어 큰 제작비가 없이,연기를 되게 잘하고 난 그런 모습이 되게 좋았어 큰 제작비가 없이
드라마가 하는 얘기를 제대로 보여주고,드라마가 하는 얘기를 제대로 보여주고
어~ 배우들도 그렇게 네임드 있는 배우들도 아니었는데 연기를 되게 잘하면서 그래서,어~ 배우들도 그렇게 네임드 있는 배우들도 아니었는데 연기를 되게 잘하면서 그래서
어느 드라마의 한 장면이 막 깔깔 깔깔 웃으면서 보는 거는 또 아니었고,어느 드라마의 한 장면이 막 깔깔 깔깔 웃으면서 보는 거는 또 아니었고
눈물 날만큼은 아니었는데,눈물 날만큼은 아니었는데
충격적인 장면으로 하나로 막 몰입이 되고 그렇게 쭉 이끌어가는 스토리가,충격적인 장면으로 하나로 막 몰입이 되고 그렇게 쭉 이끌어가는 스토리가
나는 그래서 그  드라마가 되게 어~ 좋았던 거 같애.,나는 그래서 그  드라마가 되게 어~ 좋았던 거 같애.
그래서 너는 여러 장르의 드라마를 봤잖아?,그래서 너는 여러 장르의 드라마를 봤잖아?
그래서 어떤 드라마의 장르가 가장 너한테 재밌어?,그래서 어떤 드라마의 장르가 가장 너한테 재밌어?
어~ 나는 너무 러브 라인도 어느 정도는 있어야 재밌거든,어~ 나는 너무 러브 라인도 어느 정도는 있어야 재밌거든
왜냐하면 그~ 보면서 약간 간질간질한 느낌도 있으니까 근데 너무 막 오글거리게,왜냐하면 그~ 보면서 약간 간질간질한 느낌도 있으니까 근데 너무 막 오글거리게
정말 말도 안 되게 그런 거는 나도 보면 질린단 말이야 그래서 쫌 그래도,정말 말도 안 되게 그런 거는 나도 보면 질린단 말이야 그래서 조금 그래도
쫌 재밌게 봤던 게 슬기로운 의사생활?,조금 재밌게 봤던 게 슬기로운 의사생활?
그것도 뭐~ 주인공마다 러브 라인 있기는 한데 그게 막 대놓고 막,그것도 뭐~ 주인공마다 러브 라인 있기는 한데 그게 막 대놓고 막
오글거리고 막 그렇진 않단 말이야 되게 재밌게 봤었고,오글거리고 막 그렇진 않단 말이야 되게 재밌게 봤었고
그리고 그런 거 스카이 캐슬 그거를 장르를 뭐라고 해야 될지 모르겠는데 스릴러라 해야 되나?,그리고 그런 거 스카이 캐슬 그거를 장르를 뭐라고 해야 될지 모르겠는데 스릴러라 해야 되나?
그런 것도 아닌 거 같고 가족 드라마라 하기에도 또 그렇고,그런 것도 아닌 거 같고 가족 드라마라 하기에도 또 그렇고
어쨌든 뭐~ 그런 류의 드라마 아니면 아까 얘기했듯이 그런 거 보안관?,어쨌든 뭐~ 그런 류의 드라마 아니면 아까 얘기했듯이 그런 거 보안관?
그런 드라마도 재밌게 봤었고 약간 너무 그런 주인공들의,그런 드라마도 재밌게 봤었고 약간 너무 그런 주인공들의
그런 막  사랑 막 이런 거만 막 강조하기보다는 정리하자면  교훈도 줄 수 있고,그런 막  사랑 막 이런 거만 막 강조하기보다는 정리하자면  교훈도 줄 수 있고
또 그 영화의 작가가 전달할려는 그 심오한 내용이 근데,또 그 영화의 작가가 전달할려는 그 심오한 내용이 근데
떡밥을 떤져 놓고는 난 잘 회수를 하는 걸 좋아 좋아해,떡밥을 던져 놓고는 난 잘 회수를 하는 걸 좋아 좋아해
떡밥 떤져 놓고 이~ 뭐지 이러면서 기냥 끝나는 경우도 있거든 억지스러운 그런 해설을 해가지고,떡밥 던져 놓고 이~ 뭐지 이러면서 그냥 끝나는 경우도 있거든 억지스러운 그런 해설을 해가지고
딱 끝나는 그런 것도 있고 그리고 나 스카이 캐슬에 아까 애기했던 거 중에,딱 끝나는 그런 것도 있고 그리고 나 스카이 캐슬에 아까 애기했던 거 중에
한 가지 생각나는 거 중에 내가 쫌 모순이라 생각했던 거는 그것이 우주 엄마 그~ 작가하는 사람 있거든,한 가지 생각나는 거 중에 내가 조금 모순이라 생각했던 거는 그것이 우주 엄마 그~ 작가하는 사람 있거든
그 사람 기억나는지 모르겠는데 근데 결국에는 뭐~ 이건 내 해석일 수도 있는데,그 사람 기억나는지 모르겠는데 근데 결국에는 뭐~ 이건 내 해석일 수도 있는데
결국에는 그~ 스카이 캐슬이라는 내용 자체가 그~ 우주 엄마가 쓴 소설이잖아 실제를 가지고,결국에는 그~ 스카이 캐슬이라는 내용 자체가 그~ 우주 엄마가 쓴 소설이잖아 실제를 가지고
나는 그렇게 봤었거든,나는 그렇게 봤었거든
그 소설 왜냐면 스카이 캐슬 자체가 진짜 실제로 있었던 일이다 어디 사건이 있었다 이런 말도 있더라고,그 소설 왜냐면 스카이 캐슬 자체가 진짜 실제로 있었던 일이다 어디 사건이 있었다 이런 말도 있더라고
그~ 작가 가져온 내용이 근데 결국에 그~ 스카이 캐슬 그 내용을 그~ 이제,그~ 작가 가져온 내용이 근데 결국에 그~ 스카이 캐슬 그 내용을 그~ 이제
약간 멀리서 봤을 때 우주 엄마가 그 안에 내용이 소설이다 이런 내용이 있었는데,약간 멀리서 봤을 때 우주 엄마가 그 안에 내용이 소설이다 이런 내용이 있었는데
근데 그 아줌마도 결국에는 남의 비극을 가지고 자기가 돈 벌려고 소설 쓴 거 같단 말이야,근데 그 아줌마도 결국에는 남의 비극을 가지고 자기가 돈 벌려고 소설 쓴 거 같단 말이야
약간 애들 좋은 방향으로 이끈다 이런 것처럼 그래서 뭐~ 드라마에도,약간 애들 좋은 방향으로 이끈다 이런 것처럼 그래서 뭐~ 드라마에도
모든 작품이 그렇지만 개개인마다 그런 다른 견해를 가질 수,모든 작품이 그렇지만 개개인마다 그런 다른 견해를 가질 수
가지면서 보면 더 재밌는 거 같애.,가지면서 보면 더 재밌는 거 같애.
