사투리,표준어
님은 아르바이트를 언제 처음 시작하셨어요?,님은 아르바이트를 언제 처음 시작하셨어요?
저 같은 경우에는 처음 시작한 거는 십사 년도,저 같은 경우에는 처음 시작한 거는 십사 년도
스무 살 때 네 시작했구요.,스무 살 때 네 시작했구요.
그때 처음 집 앞에 바로 집 앞에 편의점이 하나 있어서,그때 처음 집 앞에 바로 집 앞에 편의점이 하나 있어서
거기 공고 나오자마자,거기 공고 나오자마자
바로 처음 지원하면서 시작하게 됐어요.,바로 처음 지원하면서 시작하게 됐어요.
혹시  씨는 처음 아르바이트 언제 하셨어요?,혹시  씨는 처음 아르바이트 언제 하셨어요?
저도  십사 년도에 스무 살이라서 그때,저도  십사 년도에 스무 살이라서 그때
학교 골프장 알바를 했거든요.,학교 골프장 알바를 했거든요.
근데 골프장 아르바이트 중에 인제,근데 골프장 아르바이트 중에 인제
근로 학생으로 하다 보니까,근로 학생으로 하다 보니까
어~ 분야가 있었는데 저는 야외 말고 안에 프런트에서 앉아서 인제,어~ 분야가 있었는데 저는 야외 말고 안에 프런트에서 앉아서 인제
회원 등록해주고 회원 관리하는 프로그램,회원 등록해주고 회원 관리하는 프로그램
알바를 했고요.,알바를 했고요.
그거 하고 주말에는 인제 아는 이모 가게에,그거 하고 주말에는 인제 아는 이모 가게에
호프집이었는데,호프집이었는데
서빙 알바했거든요.,서빙 알바했거든요.
그러면 편의점 말고 다른 알바하신 적 있으세요?,그러면 편의점 말고 다른 알바하신 적 있으세요?
어~ 저는 지금 알바 한 개 하고 있는데,어~ 저는 지금 알바 한 개 하고 있는데
그~ 시내에 보드게임 알바라고 보드게임,그~ 시내에 보드게임 알바라고 보드게임
보드게임 하는 데에서 커피 만들고,보드게임 하는 데에서 커피 만들고
그리고 보드게임 설명해 주고,그리고 보드게임 설명해 주고
손님 응대하는 거 하고 있고요.,손님 응대하는 거 하고 있고요.
그전에는 뭐~ 방 탈출 알바도 해봤구요 아니면은,그전에는 뭐~ 방 탈출 알바도 해봤구요 아니면은
발레파킹도 한 번 해봤었어요 그~ 잠깐 해봤고,발레파킹도 한 번 해봤었어요 그~ 잠깐 해봤고
그리고 &company-name1& 에서 요리도 쪼끔 해봤구요.,그리고 &company-name1& 에서 요리도 쪼끔 해봤구요.
그 요리 때문에 시내에서 소바,그 요리 때문에 시내에서 소바
그~ 마제소바라고 마제소바 파는 집에서,그~ 마제소바라고 마제소바 파는 집에서
요리 알바해봤구요.,요리 알바해봤구요.
혹시  씨는 재밌었던 알바한 적 있으세요?,혹시  씨는 재밌었던 알바한 적 있으세요?
아~ 지금,아~ 지금
고등학교 특목,고등학교 특목
특성화 고등학교 위주로 친구가 진로 강사를 하고 있어서 보조 강사로 들어가고 있는데,특성화 고등학교 위주로 친구가 진로 강사를 하고 있어서 보조 강사로 들어가고 있는데
아무래도 젊은,아무래도 젊은
학생들 만나다 보니까 에너지가 넘쳐서 같이 놀고 인제 도와주고,학생들 만나다 보니까 에너지가 넘쳐서 같이 놀고 인제 도와주고
그래서 쉴 틈이 없어서 재밌는 거 같애요.,그래서 쉴 틈이 없어서 재밌는 거 같애요.
그리고 또 애들이랑 얘기해다 보니까 뭐~,그리고 또 애들이랑 얘기해다 보니까 뭐~
외부 강사다 보니까 새로운 사람,외부 강사다 보니까 새로운 사람
아이들은 새로운 강사를  만나서 인제 다가와서 뭐~ 쌤 뭐~ 어때요 하고 자기들 얘기를 해주는데,아이들은 새로운 강사를  만나서 인제 다가와서 뭐~ 선생님 뭐~ 어때요 하고 자기들 얘기를 해주는데
그냥 귀엽고,그냥 귀엽고
애들 보니까 에너지가 넘쳐서 재밌는 거 같애요.,애들 보니까 에너지가 넘쳐서 재밌는 거 같애요.
혹시 학생들 상대로 한 아르바이트 있나요?,혹시 학생들 상대로 한 아르바이트 있나요?
음~ 저는 학생들 상대로 하는 알바는,음~ 저는 학생들 상대로 하는 알바는
한 번도 없었던 거 같애요 그냥,한 번도 없었던 거 같애요 그냥
약간 응대하고 이런 느낌으로 한 적은 쫌 많아서,약간 응대하고 이런 느낌으로 한 적은 조금 많아서
그러 가르치고 그런 적은 한 번도 없었던 거 같애요.,그러 가르치고 그런 적은 한 번도 없었던 거 같애요.
혹시  씨는 그러면 학생들 이래 가르치는 쪽이,혹시  씨는 그러면 학생들 이렇게 가르치는 쪽이
본인의 인제 적성에 완전 딱 맞으시는 건가요?,본인의 인제 적성에 완전 딱 맞으시는 건가요?
지금 보조 강사가 말은 보조 강사인데 그냥 인제 수업 뒤에 들어가서,지금 보조 강사가 말은 보조 강사인데 그냥 인제 수업 뒤에 들어가서
애들 따라 오는지 확인하고 같이 응원해 주고 그런 거라서,애들 따라 오는지 확인하고 같이 응원해 주고 그런 거라서
제가 전공은 그쪽이 아니라서 그냥 그래도 이것도 괜찮다고 느꼈고,제가 전공은 그쪽이 아니라서 그냥 그래도 이것도 괜찮다고 느꼈고
지금 또 주말에 하고 있는 게 예도 알바라고,지금 또 주말에 하고 있는 게 예도 알바라고
결혼식장에 신랑 신부 측 앞에서 인제 예도 드리는 거 알바하고 있어서,결혼식장에 신랑 신부 측 앞에서 인제 예도 드리는 거 알바하고 있어서
그쪽을 하는데 인제,그쪽을 하는데 인제
예도 알바하다 보니까,예도 알바하다 보니까
그다음에 인제 결혼식을 보는 거라 사실,그다음에 인제 결혼식을 보는 거라 사실
쫌 재밌고,조금 재밌고
아~ 가끔씩 보면 아~ 나도 웨딩드레스 입고 싶다 막 그런 생각할 수 있어서,아~ 가끔씩 보면 아~ 나도 웨딩드레스 입고 싶다 막 그런 생각할 수 있어서
그리고 또 신랑 신부들이 준비하신 축가나 아니면 친구분들이 준비하신 축가 보면서,그리고 또 신랑 신부들이 준비하신 축가나 아니면 친구분들이 준비하신 축가 보면서
쫌 일에 재미를 느끼는 거 같애요.,조금 일에 재미를 느끼는 거 같애요.
혹시 진상 고객이나 아니면,혹시 진상 고객이나 아니면
쫌 재밌는 스토리 있으신가요 그거 하시면서,조금 재밌는 스토리 있으신가요 그거 하시면서
방 탈출 알바 할 때 진상을 봤는데,방 탈출 알바 할 때 진상을 봤는데
보통 자기들이 늦으면 인제 죄송하다고 해야 되는데 그게 아니고 오히려,보통 자기들이 늦으면 인제 죄송하다고 해야 되는데 그게 아니고 오히려
쪼끔 더 기다려줄 수도 있지 이러면서 썽을 내기도 하구요 아니면은,쪼끔 더 기다려줄 수도 있지 이러면서 성을 내기도 하구요 아니면은
그~ 방 탈출을 하게 되면,그~ 방 탈출을 하게 되면
안에 막 단서들이나,안에 막 단서들이나
아니면 뭐~ 증거들 뭐~ 이런 게 있는데 그거를,아니면 뭐~ 증거들 뭐~ 이런 게 있는데 그거를
한곳에 모으는 손님도 있구요.,한곳에 모으는 손님도 있구요.
한곳에 모으면 또 문제점이 뭐냐면,한곳에 모으면 또 문제점이 뭐냐면
방방마다 인제 다 기억을 해서 놔둬야 되는 문제점도 있고,방방마다 인제 다 기억을 해서 놔둬야 되는 문제점도 있고
아니면은 일부러 숨기는 사람도 있어요.,아니면은 일부러 숨기는 사람도 있어요.
그러면 진짜 혼자,그러면 진짜 혼자
그~ 손님들이 끝나고 나오면,그~ 손님들이 끝나고 나오면
약간 저 혼자 인제 보물찾기를 또 해야 되거든요.,약간 저 혼자 인제 보물찾기를 또 해야 되거든요.
그래 그것도 엄청나게 힘들고,그래 그것도 엄청나게 힘들고
제가 쫌 약간 인상이 쫌 무섭게 생겨서,제가 조금 약간 인상이 조금 무섭게 생겨서
진상이 쫌 별로 없었던 거 같애요 아니 제 느낌이나 아니면 사람들이 좋아서 그런 건진 몰라도,진상이 조금 별로 없었던 거 같애요 아니 제 느낌이나 아니면 사람들이 좋아서 그런 건진 몰라도
혹시 그럼  씨는 진상 같은 거 경험해보신 적 있으세요?,혹시 그럼  씨는 진상 같은 거 경험해보신 적 있으세요?
저도 딱히 진상 고객님은 없었구요 그냥,저도 딱히 진상 고객님은 없었구요 그냥
쫌 잘 웃는 편이라서 웃어서 같이 웃어주시거나,조금 잘 웃는 편이라서 웃어서 같이 웃어주시거나
아니면 한 번 진상이라고는 할 수 있는데 인제,아니면 한 번 진상이라고는 할 수 있는데 인제
결제할 때 카드를,결제할 때 카드를
돌려드렸는데 자기는 안 받았다고 우기시면서 씨씨티비 보여 달라,돌려드렸는데 자기는 안 받았다고 우기시면서 씨씨티비 보여 달라
하신 분도 있었는데,하신 분도 있었는데
찾아보니까 인제 부인 부인이 가지고 계셔갖고 그냥,찾아보니까 인제 부인 부인이 가지고 계셔갖고 그냥
끝에는 죄송하다고 하시더라구요.,끝에는 죄송하다고 하시더라구요.
뭐~ 그거 말고는 딱히 진상은 만난 적 없었고요.,뭐~ 그거 말고는 딱히 진상은 만난 적 없었고요.
아~  씨는 원하시는 혹시 원하시는 아르바이트나 아니면 하고 싶은 아르바이트 있으세요?,아~  씨는 원하시는 혹시 원하시는 아르바이트나 아니면 하고 싶은 아르바이트 있으세요?
저 같은 경우에는,저 같은 경우에는
게임하는 거나 아니면 스포츠 하는 거 야구하는 걸 좋아해서,게임하는 거나 아니면 스포츠 하는 거 야구하는 걸 좋아해서
그~ 야구장 알바가 있더라구요 야구장 알바를 실제로 해보고 싶어요 그~,그~ 야구장 알바가 있더라구요 야구장 알바를 실제로 해보고 싶어요 그~
야구장 좌측이랑 우측에,야구장 좌측이랑 우측에
앉아서 공 주워주는 거 볼 보이라고 하죠 볼 보이도 되게 해보고 싶은데 그거는,앉아서 공 주워주는 거 볼 보이라고 하죠 볼 보이도 되게 해보고 싶은데 그거는
약간 야구장 빽이 있어야 된다고 하더라고요 그래서,약간 야구장 빽이 있어야 된다고 하더라고요 그래서
한번 기회만 있으면 실제로 가서 해보고 싶어요 실제로,한번 기회만 있으면 실제로 가서 해보고 싶어요 실제로
선수들을 제일 가까이서 볼 수 있는 자리기도 하고,선수들을 제일 가까이서 볼 수 있는 자리기도 하고
아니면은 그~ 현장 분위기를 직접 코로나지만 체험할 수 있는 느낌도 있구요.,아니면은 그~ 현장 분위기를 직접 코로나지만 체험할 수 있는 느낌도 있구요.
그~  씨께서는 직접 하고 싶었던,그~  씨께서는 직접 하고 싶었던
지금도 하고 싶었던 일인가요 아니면은 하고 싶은 일이 따로  있으신가요?,지금도 하고 싶었던 일인가요 아니면은 하고 싶은 일이 따로  있으신가요?
제가 지금 공무원 준비 중이라서 인제 구월 달에 구월 말에 시험이 끝나서,제가 지금 공무원 준비 중이라서 인제 구월 달에 구월 말에 시험이 끝나서
한 달 두 달 지금 쉴까 해서 쉬면서 알바하는 중이라서,한 달 두 달 지금 쉴까 해서 쉬면서 알바하는 중이라서
제일 하고 싶은,제일 하고 싶은
동사무소나 아니면 뭐~,동사무소나 아니면 뭐~
그냥 공단 같은 데 가서 열 체크해주고 쫌 쉬운 거?,그냥 공단 같은 데 가서 열 체크해주고 조금 쉬운 거?
코로나 때문에 인제 방문기록 작성이나,코로나 때문에 인제 방문기록 작성이나
열 체크 아니면은,열 체크 아니면은
접수 받는 알바하고 싶어요.,접수 받는 알바하고 싶어요.
또 놀이공원 알바도 한번 해보고 싶은데 놀이공원에 태워주는 거 말고,또 놀이공원 알바도 한번 해보고 싶은데 놀이공원에 태워주는 거 말고
인형 탈 쓰고 막 퍼레이드 같은 것도 한번 해보고 싶고요.,인형 탈 쓰고 막 퍼레이드 같은 것도 한번 해보고 싶고요.
아니면 콘서트 알바도 한번 그냥 인제 요원처럼 인제 옆에 서 있고,아니면 콘서트 알바도 한번 그냥 인제 요원처럼 인제 옆에 서 있고
걍 관람할 수 있어서,그냥 관람할 수 있어서
기회가 된다면 해보고 싶어요.,기회가 된다면 해보고 싶어요.
아~ 저 같은 경우에는 그~,아~ 저 같은 경우에는 그~
스무 살 때 인제,스무 살 때 인제
발렛 알바를 한 번 해봤었는데,발렛 알바를 한 번 해봤었는데
그때 한 번 사고를 쪼끔 그니까 비싼 차를 한 번 긁은 적 있어서,그때 한 번 사고를 쪼끔 그러니까 비싼 차를 한 번 긁은 적 있어서
그때 되게 차주분께서 괜찮다고,그때 되게 차주분께서 괜찮다고
하셔서 되게 감동을 쪼 감동이라고 보기에는 정말,하셔서 되게 감동을 쪼 감동이라고 보기에는 정말
그렇고 쫌 고맙다고 해야 되나 엄청 감사했죠 그런 경험은 있었고요 안 그러면은,그렇고 조금 고맙다고 해야 되나 엄청 감사했죠 그런 경험은 있었고요 안 그러면은
방 탈출을 하는데,방 탈출을 하는데
애기들 두 명이랑 아버님께서 오신 거예요.,애기들 두 명이랑 아버님께서 오신 거예요.
근데 그거 보면서 약간,근데 그거 보면서 약간
저도 자식이 있었으면 좋은 느낌이 있을 거 같아서,저도 자식이 있었으면 좋은 느낌이 있을 거 같아서
그런 좋은 기분을 느낀 적은,그런 좋은 기분을 느낀 적은
쫌 많았던 거 같애요.,조금 많았던 거 같애요.
지금 해보고 싶었던 일 중에서 놀이공원이라고 하셨는데,지금 해보고 싶었던 일 중에서 놀이공원이라고 하셨는데
퍼레이드 이런 거는 보통,퍼레이드 이런 거는 보통
여기 대구에는 없고 쫌 올라가야지 있잖아요 그런 거는 그럼 실제로 기회가 된다면,여기 대구에는 없고 조금 올라가야지 있잖아요 그런 거는 그럼 실제로 기회가 된다면
직접 올라가서 하실 수 있을 거 같으세요?,직접 올라가서 하실 수 있을 거 같으세요?
아니요 그냥 해보고는 싶은데,아니요 그냥 해보고는 싶은데
일일 알바?,일일 알바?
그냥 제일 가까운 이월드 가서 그냥,그냥 제일 가까운 이월드 가서 그냥
하루 그냥 경험해보고 싶은 거고 막 꾸준히 할 생각은 없는 거 같애요.,하루 그냥 경험해보고 싶은 거고 막 꾸준히 할 생각은 없는 거 같애요.
놀이공원이나,놀이공원이나
아니면 그냥 키즈카페에서도 애기들을 좋아해서 애기들이랑 인제 놀면서,아니면 그냥 키즈카페에서도 애기들을 좋아해서 애기들이랑 인제 놀면서
쫌 보호해주는 것도 해보고 싶구요.,조금 보호해주는 것도 해보고 싶구요.
추천해주실 수 있는 알바 있으세요?,추천해주실 수 있는 알바 있으세요?
저는 추천해드리면,저는 추천해드리면
방 탈출 알바를 한번 해보셨으면 좋은데,방 탈출 알바를 한번 해보셨으면 좋은데
방 탈출을 한 번도 안 해보셨으면 처음에는 쪼끔 힘들 수가 있어요 왜냐면,방 탈출을 한 번도 안 해보셨으면 처음에는 쪼끔 힘들 수가 있어요 왜냐면
직접 해보고,직접 해보고
그 답을 다 외워서 나중에 인제 역순으로,그 답을 다 외워서 나중에 인제 역순으로
정리를 해야 되기 때문에 쪼끔 힘들 순 있는데 인제 한번 적응되고 나면은 되게 재밌는 사람들도 많이 오고,정리를 해야 되기 때문에 쪼끔 힘들 순 있는데 인제 한번 적응되고 나면은 되게 재밌는 사람들도 많이 오고
그~ 푸는 모습을 직접 볼 수도 있어서 그니까,그~ 푸는 모습을 직접 볼 수도 있어서 그러니까
씨씨티비로 원래는,씨씨티비로 원래는
안전상으로 된 씨씨티비지만,안전상으로 된 씨씨티비지만
푸는 걸 보면 또 재밌거든요 되게,푸는 걸 보면 또 재밌거든요 되게
공포나 이런 테마가 있으면,공포나 이런 테마가 있으면
그분들이 놀래고 하면,그분들이 놀래고 하면
그걸 또 보는 것도 쫌 시간이 잘 가고 해서,그걸 또 보는 것도 조금 시간이 잘 가고 해서
한 번쯤은 추천을 해드리고 싶어요.,한 번쯤은 추천을 해드리고 싶어요.
씨는 저한테 추천해 주고 싶은,씨는 저한테 추천해 주고 싶은
경험해봤던 알바 중에서 추천해 주고 싶은 거 있나요?,경험해봤던 알바 중에서 추천해 주고 싶은 거 있나요?
어~ 저는 예도 알바 추천해드리고 싶은데,어~ 저는 예도 알바 추천해드리고 싶은데
아~ 인제,아~ 인제
예도 하면은 예 기 남의 결혼식이지만 가끔씩 감정이입이 될 때 있거든요 막 영상 같은 거 보고,예도 하면은 예 기 남의 결혼식이지만 가끔씩 감정이입이 될 때 있거든요 막 영상 같은 거 보고
인제 신랑 신부 입장하고 하면 아무래도 인제 미래에 우리가,인제 신랑 신부 입장하고 하면 아무래도 인제 미래에 우리가
결혼을 할 때에 보는 모습을 상상할 수도 있고 아니면 경험할 수도 있는 거라서 쫌 추천드리고 싶어요.,결혼을 할 때에 보는 모습을 상상할 수도 있고 아니면 경험할 수도 있는 거라서 조금 추천드리고 싶어요.
혹시 친구분들과 같이 알바한 적 있으세요?,혹시 친구분들과 같이 알바한 적 있으세요?
아니요 저는 친구들이랑 같이 알바를 한 적은 없구요.,아니요 저는 친구들이랑 같이 알바를 한 적은 없구요.
알바한다면 제가,알바한다면 제가
시내 쪽에서 살아서,시내 쪽에서 살아서
보통 알바하면은 저 혼자 하고 친구들은 근처에서 하고,보통 알바하면은 저 혼자 하고 친구들은 근처에서 하고
제 친구들 한 반절이 거의 다 지금 서울 쪽에 있어서,제 친구들 한 반절이 거의 다 지금 서울 쪽에 있어서
같이 알바를 한 적은 없었던 거 같애요 아쉽게도,같이 알바를 한 적은 없었던 거 같애요 아쉽게도
혹시  씨는 그러면 친구랑 같이 알바해본 적 있으세요?,혹시  씨는 그러면 친구랑 같이 알바해본 적 있으세요?
저는 시내 노보텔에서,저는 시내 노보텔에서
그때 잠깐 친구들이랑 그~ 웨딩 알바 한 번 했었구요.,그때 잠깐 친구들이랑 그~ 웨딩 알바 한 번 했었구요.
아니면 다 같이 쿠팡,아니면 다 같이 쿠팡
스무 살 때 쿠팡 주말에 한 번 갔었고,스무 살 때 쿠팡 주말에 한 번 갔었고
그리고 또 애들이랑 같이 하다 보니까 덜 힘들고 쉬는 시간에 만날 때,그리고 또 애들이랑 같이 하다 보니까 덜 힘들고 쉬는 시간에 만날 때
그게 잠깐 만난 거라도,그게 잠깐 만난 거라도
너무 기쁘더라구요 혼자 하는 거보다는 인제,너무 기쁘더라구요 혼자 하는 거보다는 인제
쉴 때 만날 수 있다는 생각이 있고 그리고 또 같이 가는 지원군이라 캐야 되나?,쉴 때 만날 수 있다는 생각이 있고 그리고 또 같이 가는 지원군이라 해야 되나?
쫌 아무래도 같이 가니까 갈 때도 이동 시간에도 같이 얘기할 수 있고,조금 아무래도 같이 가니까 갈 때도 이동 시간에도 같이 얘기할 수 있고
가서 차 타도 뭐~ 휴대폰 만져도,가서 차 타도 뭐~ 휴대폰 만져도
쫌 좋더라구요 같이 하면,조금 좋더라구요 같이 하면
그리고 점심 먹을 때도,그리고 점심 먹을 때도
혼자 있으면 어색한데,혼자 있으면 어색한데
같이 있으니까 같이 밥 먹고 얘기하고,같이 있으니까 같이 밥 먹고 얘기하고
또 어쩔 때는 같은 분야 일하게 되면은,또 어쩔 때는 같은 분야 일하게 되면은
아무래도 쫌 더 재밌고 시간이 빨리 간다 해야 되나?,아무래도 조금 더 재밌고 시간이 빨리 간다 해야 되나?
그래서 친구들이랑 같이 알바할 수 있는 기회 있으면 같이 하는 거 추천드리고 싶네요.,그래서 친구들이랑 같이 알바할 수 있는 기회 있으면 같이 하는 거 추천드리고 싶네요.
씨는 나중에라도 해보고 싶은 아르바이트 있으세요?,씨는 나중에라도 해보고 싶은 아르바이트 있으세요?
저도  씨가 얘기했던 것처럼,저도  씨가 얘기했던 것처럼
그~ 퍼레이드는 아니더라도 놀이공원에서,그~ 퍼레이드는 아니더라도 놀이공원에서
그~ 마이크 대고,그~ 마이크 대고
놀이공원 입장 태워주는 그런 거는 해보고 싶구요.,놀이공원 입장 태워주는 그런 거는 해보고 싶구요.
아니면은 일단 사람이랑 쪼끔 말하는 걸 좋아해서,아니면은 일단 사람이랑 쪼끔 말하는 걸 좋아해서
쫌 상대를 하는 그런 쪽?,조금 상대를 하는 그런 쪽?
그런 걸로 한 번 알바를 더 해보고 싶긴 해요 그~ 놀이공원,그런 걸로 한 번 알바를 더 해보고 싶긴 해요 그~ 놀이공원
예를 들어서 놀이공원 같은,예를 들어서 놀이공원 같은
그러면  씨는 재택 알바는 해보신 적 있으세요 지금 코로나 땜에 다 처음에는 힘들었는데,그러면  씨는 재택 알바는 해보신 적 있으세요 지금 코로나 때문에 다 처음에는 힘들었는데
아니요 취업은 한 건 없고 그냥,아니요 취업은 한 건 없고 그냥
취업한 게 없어서 재택 알바는 안 해봤고 지금 이번에 하는 게 처음인 거 같애요.,취업한 게 없어서 재택 알바는 안 해봤고 지금 이번에 하는 게 처음인 거 같애요.
씨는 재택 알바 한 적 있으세요?,씨는 재택 알바 한 적 있으세요?
저도 이게 거의 처음이고요.,저도 이게 거의 처음이고요.
아니면은,아니면은
어~ 재택 알바 자체는 처음인 거 같애요.,어~ 재택 알바 자체는 처음인 거 같애요.
이게 지금 이 녹음이 처음인 거 같애요.,이게 지금 이 녹음이 처음인 거 같애요.
집에서 할 수 있는 기회가 보통 없고 거의 다 밖에서 하다 보니까,집에서 할 수 있는 기회가 보통 없고 거의 다 밖에서 하다 보니까
아니면 쫌 했던 것 중에서,아니면 조금 했던 것 중에서
제일 고소득이었던 알바 있으실까요?,제일 고소득이었던 알바 있으실까요?
응~ 고소득이라기보다는 그래도,응~ 고소득이라기보다는 그래도
지금 시급이 팔천 오백 구십 원인가 그런데,지금 시급이 팔천 오백 구십 원인가 그런데
스무 살 때 근로  장학생으로 일하면은 시급이 그때,스무 살 때 근로  장학생으로 일하면은 시급이 그때
시급이 오천 얼마였는데 거의 구천 원에서 만 원 정도 받았으니까 그게 제일 저한테는 고소득이었거든요.,시급이 오천 얼마였는데 거의 구천 원에서 만 원 정도 받았으니까 그게 제일 저한테는 고소득이었거든요.
씨는 고소득 알바 하신 적 있으세요?,씨는 고소득 알바 하신 적 있으세요?
저는 예전에 약간 큰 건 아니더라도,저는 예전에 약간 큰 건 아니더라도
더빙 같은 걸 해본 적 있었는데,더빙 같은 걸 해본 적 있었는데
그때 한 세 시간 정도 해서 십오만 원 받았던 거가 그나마 제일 컸던 거 같앴어요.,그때 한 세 시간 정도 해서 십오만 원 받았던 거가 그나마 제일 컸던 거 같앴어요.
그거 말고는 딱히 그냥 다 평범하게 시급 받고,그거 말고는 딱히 그냥 다 평범하게 시급 받고
아니면은 주휴수당 받고,아니면은 주휴수당 받고
뭐~ 이런 식이어서 그거 빼고는 거의 다 보통이었던 거 같애요.,뭐~ 이런 식이어서 그거 빼고는 거의 다 보통이었던 거 같애요.
그럼 혹시  씨께서는 친구들이랑 뭐~ 웨딩 쪽으로도 해보셨고 했는데,그럼 혹시  씨께서는 친구들이랑 뭐~ 웨딩 쪽으로도 해보셨고 했는데
그~ 웨딩 가시면 혹시 밥도 그~ 같이 막 뷔페들 먹고 그러고 그러나요?,그~ 웨딩 가시면 혹시 밥도 그~ 같이 막 뷔페들 먹고 그러고 그러나요?
네 주말에 토 일 가는데 아침에 자는 거보다 그냥 이~,네 주말에 토 일 가는데 아침에 자는 거보다 그냥 이~
돈 버는 게 낫다고 생각해서 시작했는데,돈 버는 게 낫다고 생각해서 시작했는데
인제 일하고 끝날 때는 인제 식당 가서,인제 일하고 끝날 때는 인제 식당 가서
그~ 하객들이 드시는 뷔페 예도를 하고 들어가서 먹으면 되거든요.,그~ 하객들이 드시는 뷔페 예도를 하고 들어가서 먹으면 되거든요.
