사투리,표준어
자기를 좋아해 주는 팬이 한 명은 있을 거잖아,자기를 좋아해 주는 팬이 한 명은 있을 거잖아
근데 그 팬 생각은 하나도 하지 않고 길거리에서 그렇게 공인이,근데 그 팬 생각은 하나도 하지 않고 길거리에서 그렇게 공인이
감히 공인이 길거리에서 담배를 피우고 침을 뱉고,감히 공인이 길거리에서 담배를 피우고 침을 뱉고
그런 상식에서 벗어난 행동을 한다는 게 난 진짜 싫거든,그런 상식에서 벗어난 행동을 한다는 게 난 진짜 싫거든
솔직히 그냥 길에서 담배 피우는 사람들이 너무 싫어,솔직히 그냥 길에서 담배 피우는 사람들이 너무 싫어
근데 걔는 아이돌이니까 그만큼 더 욕을 먹는 거겠지,근데 걔는 아이돌이니까 그만큼 더 욕을 먹는 거겠지
근데 아이돌을 욕하기 전에 일단 길거리에서 담배 피우는 그 사람들부터 어떻게 처리해 줬으면 좋겠는데,근데 아이돌을 욕하기 전에 일단 길거리에서 담배 피우는 그 사람들부터 어떻게 처리해 줬으면 좋겠는데
너는 길거리에서 담배 피우는 사람들 어떻게 생각해?,너는 길거리에서 담배 피우는 사람들 어떻게 생각해?
진짜 길 가다가 막 행복하게 길 가고 있는데,진짜 길 가다가 막 행복하게 길 가고 있는데
담배 피는 사람 보이고 담배 피는 담배 냄새나면은 진짜 기분 안 좋거든?,담배 피는 사람 보이고 담배 피는 담배 냄새나면은 진짜 기분 안 좋거든?
진짜 가끔 가다가,진짜 가끔 가다가
좀 들리게 담배 냄새난다고 말할 때도 있고,좀 들리게 담배 냄새난다고 말할 때도 있고
그래서 솔직히 담배를 피는 건 자기 마음이잖아 근데,그래서 솔직히 담배를 피는 건 자기 마음이잖아 근데
막 굳이 사람 많은 곳에서 피는 것도 이해가 안 되고 금연구역이 따로 있고 흡연구역이 따로 있는데,막 굳이 사람 많은 곳에서 피는 것도 이해가 안 되고 금연구역이 따로 있고 흡연구역이 따로 있는데
굳이 굳이 금연 구역에서 피는 이유가 너무 궁금해,굳이 굳이 금연 구역에서 피는 이유가 너무 궁금해
맞아 담배를 피우는 건 자기 마음인데 간접흡연 때문에 나는 원하지 않았는데 흡연을 하게 된 거잖아,맞아 담배를 피우는 건 자기 마음인데 간접흡연 때문에 나는 원하지 않았는데 흡연을 하게 된 거잖아
그리고 금연구역에서는 금연을 해야 된다고 생각하는데 왜 흡연구역이 아니라,그리고 금연구역에서는 금연을 해야 된다고 생각하는데 왜 흡연구역이 아니라
금연구역에서,금연구역에서
담배를 피우는지 난 진짜 이해할 수가 없어,담배를 피우는지 난 진짜 이해할 수가 없어
그리고 아이돌들 중에서 담배를 피우는 사람도 많잖아,그리고 아이돌들 중에서 담배를 피우는 사람도 많잖아
근데 그런 사람들이 이때까지 논란이 된 거는,근데 그런 사람들이 이때까지 논란이 된 거는
담배를 피운다는 그 행위 자체가 논란이 된 거지,담배를 피운다는 그 행위 자체가 논란이 된 거지
길거리에서 담배를 피우고 침을 뱉고 그런 행위를 해서 논란이 된 적은 이번이 처음인 거 같거든 내 생각에는,길거리에서 담배를 피우고 침을 뱉고 그런 행위를 해서 논란이 된 적은 이번이 처음인 거 같거든 내 생각에는
그래서 나는 아이돌들이 담배를 피우는 피우든 말든 딱히 상관은 없는데,그래서 나는 아이돌들이 담배를 피우는 피우든 말든 딱히 상관은 없는데
그런 식으로 이제 팬들의 얼굴에 먹칠을 하지 않았으면 좋겠어,그런 식으로 이제 팬들의 얼굴에 먹칠을 하지 않았으면 좋겠어
진짜 팬들은 자기들을 위해서 막,진짜 팬들은 자기들을 위해서 막
몇 만원 몇십만 원 몇억씩 쓰는 팬들도 있는데,몇 만원 몇십만 원 몇억씩 쓰는 팬들도 있는데
굳이 그렇게,굳이 그렇게
길거리를 담배를 피우는 이유도 궁금하고,길거리를 담배를 피우는 이유도 궁금하고
냄새가 별로 나지 않는 전자담배 뭐 그런 것도 있잖아,냄새가 별로 나지 않는 전자담배 뭐 그런 것도 있잖아
솔직히 그런 거에 대해서 잘 알지는 못하지만,솔직히 그런 거에 대해서 잘 알지는 못하지만
그런 거를 피면서도,그런 거를 피면서도
주변 사람에 대해 배려를 좀 해줬으면 좋겠어,주변 사람에 대해 배려를 좀 해줬으면 좋겠어
사람이 살면서 제일 중요한 게 배려라고 생각하는데,사람이 살면서 제일 중요한 게 배려라고 생각하는데
배려를 단 하나도 하지 않았다는 거는,배려를 단 하나도 하지 않았다는 거는
이제 예의가 없는 거잖아,이제 예의가 없는 거잖아
이런 유교국가에서 예의를 차리지 예의를 갖추지 않는 다는 건 진짜 큰 문제인 거 같거든,이런 유교국가에서 예의를 차리지 예의를 갖추지 않는 다는 건 진짜 큰 문제인 거 같거든
그리고 그런 담배뿐만 아니라 막,그리고 그런 담배뿐만 아니라 막
춤 연습 이런 연습도 다 같은 그룹에서 하는 거잖아,춤 연습 이런 연습도 다 같은 그룹에서 하는 거잖아
그룹을 분명 좋아하고 응원하는 팬들이 있을 텐데도,그룹을 분명 좋아하고 응원하는 팬들이 있을 텐데도
그렇게 자기 생각만 하고 이기적으로 행동을 하면,그렇게 자기 생각만 하고 이기적으로 행동을 하면
당연히 팬들은 그 모습을 보고 실망을 하게 되고,당연히 팬들은 그 모습을 보고 실망을 하게 되고
그 사람에게만 실망을 해서,그 사람에게만 실망을 해서
팬이 이제 안 좋아하지 않는 게 아니라 그 그룹 전체에,팬이 이제 안 좋아하지 않는 게 아니라 그 그룹 전체에
피해가 가잖아,피해가 가잖아
그러면 자기가 행동을 똑바로 해야 되는데,그러면 자기가 행동을 똑바로 해야 되는데
해야 되는데 왜 그런 식으로 행동을 하는 건지,해야 되는데 왜 그런 식으로 행동을 하는 건지
나는 진짜 이해를 하나도 할 수가 없거든,나는 진짜 이해를 하나도 할 수가 없거든
내가 아이돌이었다면 솔직히 나를 좋아해 주는 사람들이 있으니까 그 사람들을,내가 아이돌이었다면 솔직히 나를 좋아해 주는 사람들이 있으니까 그 사람들을
기분 좋게 하기 위해서 조금이라도,기분 좋게 하기 위해서 조금이라도
아무리 힘들겠지만 조금이라도 뭐라도 하나 더 해보려고 할 텐데,아무리 힘들겠지만 조금이라도 뭐라도 하나 더 해보려고 할 텐데
니가 아이돌이면 뭐 할 거야?,네가 아이돌이면 뭐 할 거야?
우선 내가 아이돌 되면은,우선 내가 아이돌 되면은
절대 이렇게 길바닥에서 담배 피면서 팬들한테,절대 이렇게 길바닥에서 담배 피면서 팬들한테
이케 쪽팔림을 주진 않을 거 같애,이렇게 쪽팔림을 주진 않을 거 같애
솔직히 내가 그렇게 막 열심히 사는 편은 아니지만,솔직히 내가 그렇게 막 열심히 사는 편은 아니지만
그래도 내가 아이돌이 되면은,그래도 내가 아이돌이 되면은
기본 사람이 지켜야 할 기본 예의는 지킬 거 같고,기본 사람이 지켜야 할 기본 예의는 지킬 거 같고
물론 지금 아이돌들이 그렇게,물론 지금 아이돌들이 그렇게
모든 아이돌들이 그렇게 예의 없고 버릇없는 건 아니겠지만 그래도 그런,모든 아이돌들이 그렇게 예의 없고 버릇없는 건 아니겠지만 그래도 그런
연예인들 보면은 왜 그런지 잘 모르겠어.,연예인들 보면은 왜 그런지 잘 모르겠어.
맞아 모든 사람이 다 그러는 건 아닌데 그러는 사람들 때문에 이렇게 전체를,맞아 모든 사람이 다 그러는 건 아닌데 그러는 사람들 때문에 이렇게 전체를
싸잡아서 욕을 하 욕을 먹게 되고,싸잡아서 욕을 하 욕을 먹게 되고
그러다 보면은 점점 팬들도 그런 걸 이제,그러다 보면은 점점 팬들도 그런 걸 이제
신경을 쓰는 게 너무 힘들어지는 거지 한두 번도 아니고,신경을 쓰는 게 너무 힘들어지는 거지 한두 번도 아니고
그래서,그래서
