사투리,표준어
족욕을 하다 보니까 일주일에 한 두세 번,족욕을 하다 보니까 일주일에 한 두세 번
진짜 뭐라고 해야 되나 너무,진짜 뭐라고 해야 되나 너무
기분이 깨운하고 그~ 가볍고 이런 생각들이 많이 들어서,기분이 개운하고 그~ 가볍고 이런 생각들이 많이 들어서
제 개인적으로는,제 개인적으로는
겨울철에 할 수 있는,겨울철에 할 수 있는
그냥 간단한 운동도 아니지만은,그냥 간단한 운동도 아니지만은
또 하고 나면 쫌 깨운한 그런 느낌 드는 족욕을 쪼끔 권장드리고 싶습니다.,또 하고 나면 조금 개운한 그런 느낌 드는 족욕을 쪼끔 권장드리고 싶습니다.
님은 뭐~ 겨울철에 할 수 있는 운동 중에서,님은 뭐~ 겨울철에 할 수 있는 운동 중에서
쪼끔 괜찮은 운동이 있다면은 어떤 거를 추천해 주고 싶으시나요?,쪼끔 괜찮은 운동이 있다면은 어떤 거를 추천해 주고 싶으시나요?
전 운동을 많이 해본 건 아닌데,전 운동을 많이 해본 건 아닌데
겨울 스포츠 얼마 전에,겨울 스포츠 얼마 전에
올해 초에 보드를 한번 타봤거든요.,올해 초에 보드를 한번 타봤거든요.
근데 보드는 생각보다 쫌,근데 보드는 생각보다 조금
다리에 힘을 많이 줘야 돼가지고 무릎에 쫌 무리가 가는 것 같아서,다리에 힘을 많이 줘야 돼가지고 무릎에 조금 무리가 가는 것 같아서
별로 추천하는 운동은 아니고,별로 추천하는 운동은 아니고
꼭 겨울에 한정되기보다는,꼭 겨울에 한정되기보다는
사계절 스포츠 뭐~,사계절 스포츠 뭐~
수영은 진짜 괜찮은 것 같애 저도 할 때 막 나이에 상관없이 아주머니 아저씨들도 많이 오시고,수영은 진짜 괜찮은 것 같애 저도 할 때 막 나이에 상관없이 아주머니 아저씨들도 많이 오시고
다 차근차근 잘 따라와 가시고 해가지고,다 차근차근 잘 따라와 가시고 해가지고
수영이 쫌,수영이 조금
그런 나이에 구애받지도 않고,그런 나이에 구애받지도 않고
건강도 챙길 수 있고,건강도 챙길 수 있고
계절에도 구애받지 않고,계절에도 구애받지 않고
괜찮은 운동인 것 같아요 요즘에 코로나 때문에 쫌 못해가지고,괜찮은 운동인 것 같아요 요즘에 코로나 때문에 조금 못해가지고
문제긴 한데 만약에,문제긴 한데 만약에
운동을 할 거다 하면 수영이 괜찮은 것 같애요.,운동을 할 거다 하면 수영이 괜찮은 것 같애요.
님은,님은
요즘 등산을 많이 사람들이 등산을 많이 다니는데,요즘 등산을 많이 사람들이 등산을 많이 다니는데
님도,님도
등산 가보신 적 있으신가요?,등산 가보신 적 있으신가요?
저는 인제 한동안 한 오 년,저는 인제 한동안 한 오 년
전만 해도 남편하고 인제,전만 해도 남편하고 인제
어~ 한라산도 갔다 오고 쫌 유명한 산은 많이 갔던 편이거든요 워낙 저질 체력이라 정상까지 올라가 본 적은 별로 없지만은 그래도 한 중간 정도는 갔다 이렇게 생각 드는데,어~ 한라산도 갔다 오고 조금 유명한 산은 많이 갔던 편이거든요 워낙 저질 체력이라 정상까지 올라가 본 적은 별로 없지만은 그래도 한 중간 정도는 갔다 이렇게 생각 드는데
요즘은 이제 동네 둘레길이 참 잘 돼 있잖아요  해가지고,요즘은 이제 동네 둘레길이 참 잘 돼 있잖아요  해가지고
그래서 굳이 뭐~ 등산 갈려면은 등산복도 있어야 되고 뭐~,그래서 굳이 뭐~ 등산 갈려면은 등산복도 있어야 되고 뭐~
간식도 챙겨야 되고 개인 운전해서 가기 힘들면은 또 버스도 버스를 타고 가야 되고 이런 것들이 많아서,간식도 챙겨야 되고 개인 운전해서 가기 힘들면은 또 버스도 버스를 타고 가야 되고 이런 것들이 많아서
그냥 가볍게,그냥 가볍게
산책보다는 쪼끔 무게 있는 그런 둘레길을,산책보다는 쪼끔 무게 있는 그런 둘레길을
걷는 거를 참 좋아하거든요.,걷는 거를 참 좋아하거든요.
걸으면서,걸으면서
조금 이런저런 생각도 많이 하게 되고,조금 이런저런 생각도 많이 하게 되고
그런 것들이 참 좋았고  님 같은 경우에는,그런 것들이 참 좋았고  님 같은 경우에는
내가 뭐~ 골프를 치면은 골프복도 필요하고,내가 뭐~ 골프를 치면은 골프복도 필요하고
또 등산을 가면은 또 등산복도 필요하고 또 필라테스나 요가 같은 경우에도 그런 전문 복장들이 다 필요한데 그런 것 없이도 그런 걸 위해 진짜 꼭 사야 하는지,또 등산을 가면은 또 등산복도 필요하고 또 필라테스나 요가 같은 경우에도 그런 전문 복장들이 다 필요한데 그런 것 없이도 그런 걸 위해 진짜 꼭 사야 하는지
안 그러면은 그냥 집에 있는 바지나 면티 입고 해도 되는지,안 그러면은 그냥 집에 있는 바지나 면티 입고 해도 되는지
어~ 그런 것들이 참 궁금합니다.,어~ 그런 것들이 참 궁금합니다.
님이 말씀하셨던 것처럼 쫌,님이 말씀하셨던 것처럼 조금
기구 욕심이나 그런 게 있는 편인데,기구 욕심이나 그런 게 있는 편인데
편이라서,편이라서
수영할 때는,수영할 때는
다 되게 사고 싶은 게 많아가지구,다 되게 사고 싶은 게 많아가지구
여러 개 후보에 두고 겨우겨우 골랐고 근데 등산 저도 등산을 몇 번 가봤는데,여러 개 후보에 두고 겨우겨우 골랐고 근데 등산 저도 등산을 몇 번 가봤는데
등산 갈 때는,등산 갈 때는
이~ 제가 청바지 같은 것밖에 없어가지고,이~ 제가 청바지 같은 것밖에 없어가지고
등산 갈 때 입을 바지가 없어서 그냥 하나 트레이닝복 하나 산 정도,등산 갈 때 입을 바지가 없어서 그냥 하나 트레이닝복 하나 산 정도
그래서 위에는 그냥,그래서 위에는 그냥
집에 있던 맨투맨이랑,집에 있던 맨투맨이랑
걸친 옷 들고 가고,걸친 옷 들고 가고
딱히 옷에는 신경을 별로 안 쓴 것 같애요 근데,딱히 옷에는 신경을 별로 안 쓴 것 같애요 근데
내려올 때 쫌 무릎 아팠어가지고,내려올 때 조금 무릎 아팠어가지고
등산 스틱 같은,등산 스틱 같은
장비는 쫌,장비는 조금
갖출 필요가 있다고 생각이,갖출 필요가 있다고 생각이
들었습니다 옷은 뭐~ 그냥,들었습니다 옷은 뭐~ 그냥
내가 그 운동을 하는데 불편하지만 않으면은 별로 상관없다고 생각합니다.,내가 그 운동을 하는데 불편하지만 않으면은 별로 상관없다고 생각합니다.
님은,님은
몸에 근육이 쫌 있으신 편인가요?,몸에 근육이 조금 있으신 편인가요?
아니면 그냥 아예 근육이 없는,아니면 그냥 아예 근육이 없는
편이신가요?,편이신가요?
저는 근육은 없고 체지방이 많은 상태입니다.,저는 근육은 없고 체지방이 많은 상태입니다.
그래서 건강 검진 이런 거 하면은 쪼끔,그래서 건강 검진 이런 거 하면은 쪼끔
안 좋게 나와요 체지방 너무 많다.,안 좋게 나와요 체지방 너무 많다.
이런 것들이 많은데 체지방을,이런 것들이 많은데 체지방을
집에서는 참 줄이기가 힘들더라구요 제가 안 먹는 방법 말곤 없으니까,집에서는 참 줄이기가 힘들더라구요 제가 안 먹는 방법 말곤 없으니까
딱히 어떤 운동을 해야 되는지도 모르고 어~ 그래서 이제는 나이가 있으니까 쪼끔 건강하게 이~ 예쁘게 늙을려면은,딱히 어떤 운동을 해야 되는지도 모르고 어~ 그래서 이제는 나이가 있으니까 쪼끔 건강하게 이~ 예쁘게 늙을려면은
요런 몸에 안 좋은 이런 체지방들 이런 거를 쪼끔,요런 몸에 안 좋은 이런 체지방들 이런 거를 쪼끔
정리할 필요가 있다 싶어서 제가 인제,정리할 필요가 있다 싶어서 제가 인제
지금은 인제 뭐~ 헬스장 이런 것들이 인제 오픈을 잘 안 하니까 코로나 끝나고 나면 개인적으로 가서,지금은 인제 뭐~ 헬스장 이런 것들이 인제 오픈을 잘 안 하니까 코로나 끝나고 나면 개인적으로 가서
이런 묵었던 체지방 같은 거를 쫌 빼고 몸도 빼고,이런 묵었던 체지방 같은 거를 조금 빼고 몸도 빼고
몸에 있는 살도 빼고 또,몸에 있는 살도 빼고 또
생활 속에 있는 이런,생활 속에 있는 이런
불필요한 이런 소비 이런 것도 쪼끔 줄이고 그러면서 몸과 마음이,불필요한 이런 소비 이런 것도 쪼끔 줄이고 그러면서 몸과 마음이
건강한 이제 그런 사람으로,건강한 이제 그런 사람으로
살아가야겠다 그런 생각들을 많이 가지고 있습니다.,살아가야겠다 그런 생각들을 많이 가지고 있습니다.
님은 코로나가 끝나면은 도전해보고 싶은 그런 운동들이 있나요?,님은 코로나가 끝나면은 도전해보고 싶은 그런 운동들이 있나요?
전 일단 수영을 제일 기다리고 있긴 한데,전 일단 수영을 제일 기다리고 있긴 한데
코로나가 끝나면은,코로나가 끝나면은
해보고 싶은 운동 개인적으로,해보고 싶은 운동 개인적으로
탁구를 한번 배워보고 싶습니다.,탁구를 한번 배워보고 싶습니다.
