사투리,표준어
죽지 않았고 뭐 항생제도 필요 없었고 그냥 지금도 잘 살고 있고,죽지 않았고 뭐 항생제도 필요 없었고 그냥 지금도 잘 살고 있고
가끔 지나가면 밥 달라고 하길래 밥 주고 그러고 지내고 있어.,가끔 지나가면 밥 달라고 하길래 밥 주고 그러고 지내고 있어.
언니 이런 경험 없어?,언니 이런 경험 없어?
동네 고양이들한테 밥 주거나 사료 주거나 하잖아.,동네 고양이들한테 밥 주거나 사료 주거나 하잖아.
내가 사료 준 적은 없고,내가 사료 준 적은 없고
우리 아파트 앞에 약간 길고양이 급식소?,우리 아파트 앞에 약간 길고양이 급식소?
이런 거 있어가지고 거기서 맨날 누가 사료를 주더라고.,이런 거 있어가지고 거기서 맨날 누가 사료를 주더라고.
아마 우리 아파트 주민인 거 같더라.,아마 우리 아파트 주민인 거 같더라.
참 대단해 나는 우리 집고양이 하나도 너무 벅차서,참 대단해 나는 우리 집고양이 하나도 너무 벅차서
다른 고양이는 도저히 못 거둘 거 같은데 대단하다.,다른 고양이는 도저히 못 거둘 거 같은데 대단하다.
전에 지나다니는데 그~ 밥 주는 아저씨를 봤단 말이야?,전에 지나다니는데 그~ 밥 주는 아저씨를 봤단 말이야?
근데 막 똑같은 시간마다 나와가지고 밥을 맨날 주셔 물이랑,근데 막 똑같은 시간마다 나와가지고 밥을 맨날 주셔 물이랑
그래서 그~ 아저씨한테 들은 말로는 그 당시 때 그~ 캠,그래서 그~ 아저씨한테 들은 말로는 그 당시 때 그~ 캠
밥 주는 사람을 캣맘이라고 하나?,밥 주는 사람을 캣맘이라고 하나?
어쨌든 그거에 뭐 초등학생이 그~ 마음에 안 들어가지고,어쨌든 그거에 뭐 초등학생이 그~ 마음에 안 들어가지고
벽돌 던져가지고 캣맘을 죽인 막 사건이 있었잖아.,벽돌 던져가지고 캣맘을 죽인 막 사건이 있었잖아.
그거 그거에 대해서 그거 막 밥 주는 사람들이,그거 그거에 대해서 그거 막 밥 주는 사람들이
막 밥을 줘가지고 고양이들이 너무 번식된다고 뭐라고 하는데,막 밥을 줘가지고 고양이들이 너무 번식된다고 뭐라고 하는데
그거 번식이 안 되게끔 그런 사람들이 돈을 들여가지고,그거 번식이 안 되게끔 그런 사람들이 돈을 들여가지고
중성화 수술 하잖아 중성화 수술 시킨 다음에 티를 내게 할려고 귀를 쪼금 잘라 놓고,중성화 수술 하잖아 중성화 수술 시킨 다음에 티를 내게 할려고 귀를 쪼금 잘라 놓고
그래갖고 그냥 한 생명만 계속 살아가게끔 하는 건데 참,그래가지고 그냥 한 생명만 계속 살아가게끔 하는 건데 참
뭐 피해도 안 끼치고 그래도 배부르면 쓰레기통도 안 뒤질 거 아니야 번식도 안 시키고,뭐 피해도 안 끼치고 그래도 배부르면 쓰레기통도 안 뒤질 거 아니야 번식도 안 시키고
좋은 일 하는데 괜히 나도 같이 옆에 있다가,좋은 일 하는데 괜히 나도 같이 옆에 있다가
그 아저씨 옆 사료 주는데 옆에 있다가 지나가는 아저씨가 엄청 욕하더라고.,그 아저씨 옆 사료 주는데 옆에 있다가 지나가는 아저씨가 엄청 욕하더라고.
나도 같 나한테도 같이 그래서 너무,나도 같 나한테도 같이 그래서 너무
좀 좋은 일 하는데도 욕을 엄청 많이 들어먹는구나.,좀 좋은 일 하는데도 욕을 엄청 많이 들어먹는구나.
그~ 사룟값도 너무 사료 저렴한 거 주면 고양이들 아프니까,그~ 사룟값도 너무 사료 저렴한 거 주면 고양이들 아프니까
아저씨가 쫌 돈도 쫌 많이 쓰더라고.,아저씨가 조금 돈도 조금 많이 쓰더라고.
그래서 그~ 아~ 그리고 알고 보니까 구역별로,그래서 그~ 아~ 그리고 알고 보니까 구역별로
그니까 고양이 카페에서 구역별로 나눠서 캣맘을 한다대?,그러니까 고양이 카페에서 구역별로 나눠서 캣맘을 한다더라?
다 할 수가 없으니까 그래서 나름 체계적이더라고 동물 병원도 어디 수습해가지고,다 할 수가 없으니까 그래서 나름 체계적이더라고 동물 병원도 어디 수습해가지고
거기서 쪼금 싸게 애들 중성화를 돌아가면서 시키고,거기서 쪼금 싸게 애들 중성화를 돌아가면서 시키고
되게 체계적이더라 나도 나중에 돈 벌게 되면 같이 참여하고 싶더라.,되게 체계적이더라 나도 나중에 돈 벌게 되면 같이 참여하고 싶더라.
대단하다.,대단하다.
