사투리,표준어
조금 더 이십 대 삼십 대에 서점에 가면은,조금 더 이십 대 삼십 대에 서점에 가면은
어~ 선생님 말씀처럼 자기 계발 책들이 대세였습니다.,어~ 선생님 말씀처럼 자기 계발 책들이 대세였습니다.
그래서 굉장히 꿈을 가져야 된다.,그래서 굉장히 꿈을 가져야 된다.
꿈을 이루려면은 어떻게 해야 된다 이런,꿈을 이루려면은 어떻게 해야 된다 이런
스타일의 책들이 그때 베스트셀러를 차지했고 그런 것들이 또 저한테 자극을 많이 주고,스타일의 책들이 그때 베스트셀러를 차지했고 그런 것들이 또 저한테 자극을 많이 주고
저를 어~,저를 어~
응원 스스로 응원할 수  있는 또 이런 계기가 되긴 했었습니다 근데 요즘,응원 스스로 응원할 수  있는 또 이런 계기가 되긴 했었습니다 근데 요즘
서점에 가면은 베스트셀러를 차지 하고 있는 것들이,서점에 가면은 베스트셀러를 차지 하고 있는 것들이
모두 좀 이렇게 아까도 말씀드렸듯이 당신이 옳다라든지,모두 좀 이렇게 아까도 말씀드렸듯이 당신이 옳다라든지
뭐~ 이~ 힐링 에세이 같은 것들이 굉장히 많거든요.,뭐~ 이~ 힐링 에세이 같은 것들이 굉장히 많거든요.
그래서 심지어는,그래서 심지어는
죽 뭐~ 들어보셨는지 모르겠지만은 뭐~,죽 뭐~ 들어보셨는지 모르겠지만은 뭐~
죽고 싶지만 떡볶이는 먹고 싶어 뭐~ 혼자 있고 싶지만 뭐~,죽고 싶지만 떡볶이는 먹고 싶어 뭐~ 혼자 있고 싶지만 뭐~
제목이 사실은 생각이 잘 돼요.,제목이 사실은 생각이 잘 돼요.
혼자 있기는 싫지만 혼자 혼자 있고 싶지만,혼자 있기는 싫지만 혼자 혼자 있고 싶지만
혼자 있기 싫어.,혼자 있기 싫어.
뭐~ 이런 시리즈 이런 이런 시리즈들의 생각 그리고 뭐~,뭐~ 이런 시리즈 이런 이런 시리즈들의 생각 그리고 뭐~
뭐~ 마음 상처받지 않는,뭐~ 마음 상처받지 않는
뭐~ 이런 것들이 굉장히 지금 베스트셀러를 다 차지하고 있거든요 이만큼 지금,뭐~ 이런 것들이 굉장히 지금 베스트셀러를 다 차지하고 있거든요 이만큼 지금
어~ 마 사람들이 많이 지금 지쳐있는 상황인 거 같더라고요 그~,어~ 마 사람들이 많이 지금 지쳐있는 상황인 거 같더라고요 그~
그런 것을 봤 보아 하더라도,그런 것을 봤 보아 하더라도
그리고 특히 이십 대 청춘들이,그리고 특히 이십 대 청춘들이
어~ 굉장히 밝고 어~,어~ 굉장히 밝고 어~
좋은 나이인 거 같지만은 그~ 지금 이십 대 아이들이 어~,좋은 나이인 거 같지만은 그~ 지금 이십 대 아이들이 어~
경제적으로 힘들고 또 여러 가지,경제적으로 힘들고 또 여러 가지
상황에서,상황에서
많이 힘들어하고 있고,많이 힘들어하고 있고
교육도 많이 이제 많이  받아와서 스트레스가 많은 상황에서,교육도 많이 이제 많이  받아와서 스트레스가 많은 상황에서
준비되지 않은 채 정서적으로 성숙한 지 못한 채 이십 대가 되다 보니,준비되지 않은 채 정서적으로 성숙한 지 못한 채 이십 대가 되다 보니
지금 이십 대에 사람들이 굉장히 힘들어 한다라는 것을 많이 느꼈습니다.,지금 이십 대에 사람들이 굉장히 힘들어 한다라는 것을 많이 느꼈습니다.
그래서 굉장히 지금 안타까운 생각이 많이 들고 우리나라를,그래서 굉장히 지금 안타까운 생각이 많이 들고 우리나라를
짊어지고 갈 청춘들이 어~,짊어지고 갈 청춘들이 어~
사실은 정신과 치료도 굉장히 많이 받고 있고 마음이 아픈 친구들이 굉장히 많거든요.,사실은 정신과 치료도 굉장히 많이 받고 있고 마음이 아픈 친구들이 굉장히 많거든요.
어~ 그래서 서점에 가면은 그런 책들이,어~ 그래서 서점에 가면은 그런 책들이
음~ 또 그들을 대변하는 것 같다 그래서 음~ 많이,음~ 또 그들을 대변하는 것 같다 그래서 음~ 많이
또 책들을 읽고 그~,또 책들을 읽고 그~
또 회복이 됐으면 좋겠다는 바램도 있더라고요 저 또한,또 회복이 됐으면 좋겠다는 바램도 있더라고요 저 또한
또 이렇게 뭐~,또 이렇게 뭐~
경제적으로 힘든 상황이고,경제적으로 힘든 상황이고
코로나도 이렇게 하고 있으니 그런 에세이 같은 것을 자주 읽게 되더라고요.,코로나도 이렇게 하고 있으니 그런 에세이 같은 것을 자주 읽게 되더라고요.
특히 요즘 저는 책을 요즘은,특히 요즘 저는 책을 요즘은
완독하지 않고 좀 챕터별로 좀 골라서 읽는 편인데,완독하지 않고 좀 챕터별로 좀 골라서 읽는 편인데
음~ 박진영 그~ 연예인이 내신 또 책이 있더라고요.,음~ 박진영 그~ 연예인이 내신 또 책이 있더라고요.
근데 그분이 하신 말씀이 어~,근데 그분이 하신 말씀이 어~
아주 힘든 시간 속에,아주 힘든 시간 속에
재밌는 일을 뭐~ 하 자꾸 해라 뭐~,재밌는 일을 뭐~ 하 자꾸 해라 뭐~
꿈이 있는 걸 하라고 요즘에 많이 강요하고 있지만은,꿈이 있는 걸 하라고 요즘에 많이 강요하고 있지만은
재미없는 일을 해야지,재미없는 일을 해야지
그~ 순간이 발달하는 시간이라고 하는 말,그~ 순간이 발달하는 시간이라고 하는 말
말이 굉장히 가슴 깊이 좀 와 닿았습니다.,말이 굉장히 가슴 깊이 좀 와 닿았습니다.
저가 살다 보니 재미있고 가슴 뛰는 일만 할 수 없더라고요.,저가 살다 보니 재미있고 가슴 뛰는 일만 할 수 없더라고요.
반복되는 일과 재미없는 일을 하는,반복되는 일과 재미없는 일을 하는
그런 과정에서 어떤 또,그런 과정에서 어떤 또
의미를 찾아야 한다는 것을 많이  느꼈는데 마,의미를 찾아야 한다는 것을 많이  느꼈는데 마
침 그분이 그런 메시지를 전해 주셔서 굉장히 어~,침 그분이 그런 메시지를 전해 주셔서 굉장히 어~
음~ 많은 도움이 되었다고 생각합니다.,음~ 많은 도움이 되었다고 생각합니다.
어~,어~
혹시 뭐~ 추천해 주실,혹시 뭐~ 추천해 주실
작품이라든가 뭐~ 시라든가 수필 같은 건 있으신지요?,작품이라든가 뭐~ 시라든가 수필 같은 건 있으신지요?
네 제가 그런 힐링 에세이를 아직 많이 접해보지는 못했는데 인제 접해보려고 저도 찜해 놓은 책이 있는데,네 제가 그런 힐링 에세이를 아직 많이 접해보지는 못했는데 인제 접해보려고 저도 찜해 놓은 책이 있는데
김미경 강사의 이 한마디가 나를 살렸다라는 책이 있어요.,김미경 강사의 이 한마디가 나를 살렸다라는 책이 있어요.
도서관에 그 책을 대여해 보려다가 인제,도서관에 그 책을 대여해 보려다가 인제
다른 분이 대여해 가지고 지금 기다리고 있는 상황인데,다른 분이 대여해 가지고 지금 기다리고 있는 상황인데
마음의 힐링을 얻는 방법이 여러 가지가 있겠지만 활자를 읽음으로써,마음의 힐링을 얻는 방법이 여러 가지가 있겠지만 활자를 읽음으로써
또 이북이 아니라 종이책을 읽음으로써,또 이북이 아니라 종이책을 읽음으로써
마음의 힐링을 받게 되고 그~ 활자의 힘을 경험하게 되는 게,마음의 힐링을 받게 되고 그~ 활자의 힘을 경험하게 되는 게
굉장히 큰 것 같고 그 영향력이 앞으로도 변하지 않을 거라는 생각이 들어요 그래서 아마,굉장히 큰 것 같고 그 영향력이 앞으로도 변하지 않을 거라는 생각이 들어요 그래서 아마
서점 랭킹 상위 판매 랭킹에도 힐링 에세이가,서점 랭킹 상위 판매 랭킹에도 힐링 에세이가
자주 등장하고 또 빠지지 않는 거 같아요.,자주 등장하고 또 빠지지 않는 거 같아요.
그래서 유튜브나 다른 영상들 시청각 자료들로 인해서,그래서 유튜브나 다른 영상들 시청각 자료들로 인해서
마음의 힐링을 잠깐 얻을 수 있겠지만,마음의 힐링을 잠깐 얻을 수 있겠지만
또 마음에 두고두고 그 내용을 곱씹으면서 머리로 이해하고,또 마음에 두고두고 그 내용을 곱씹으면서 머리로 이해하고
또 머리로 새겨서 정말 평안을 얻는 방법 중에는,또 머리로 새겨서 정말 평안을 얻는 방법 중에는
사실 종이책을 읽으면서 그 시간을,사실 종이책을 읽으면서 그 시간을
또 그 활자를 고스란히 내 것으로 만드는 것이,또 그 활자를 고스란히 내 것으로 만드는 것이
큰 영향력을 차지하는 것 같습니다.,큰 영향력을 차지하는 것 같습니다.
