사투리,표준어
최근에 사차 산업 혁명이,최근에 사차 산업 혁명이
정말 정말로 빠른 속도로 우리의 삶에,정말 정말로 빠른 속도로 우리의 삶에
다가서고 있는 거 같은데 그러 사실 기술력의 속도로만 따지면은,다가서고 있는 거 같은데 그러 사실 기술력의 속도로만 따지면은
그 속도가 무지하게 빨라가지고 되려 국가적인 차원에서,그 속도가 무지하게 빨라가지고 되려 국가적인 차원에서
법률로써 계속 규제를 해가지고 사람들과 사람들 사이에,법률로써 계속 규제를 해가지고 사람들과 사람들 사이에
충돌이 일어나거나 어떤 권리에 침해가 일어나지 않도록 계속,충돌이 일어나거나 어떤 권리에 침해가 일어나지 않도록 계속
되려 어떻게 보면 기술에 적용을 늦추고 있는 거 같은데,되려 어떻게 보면 기술에 적용을 늦추고 있는 거 같은데
특히 드론 같은 경우는 발달하는 속도에 비해서 국가에서,특히 드론 같은 경우는 발달하는 속도에 비해서 국가에서
계속적으로 규제를 해가지고 우리가 제대로 도입을,계속적으로 규제를 해가지고 우리가 제대로 도입을
못 했었거든요 그런 식으로 보면은 우리가 어~ 기술을 계속적으로,못 했었거든요 그런 식으로 보면은 우리가 어~ 기술을 계속적으로
빠르게 개발하고 그거를 적용시킬 수 있도록 해야 하는지 아니면은,빠르게 개발하고 그거를 적용시킬 수 있도록 해야 하는지 아니면은
적용하는 것은 항상 숙고하면서 느리게,적용하는 것은 항상 숙고하면서 느리게
받아들여야 하는지 그 부분에 대해서 제가 쫌 얘기를 하고 싶거든요.,받아들여야 하는지 그 부분에 대해서 제가 조금 얘기를 하고 싶거든요.
굳이 드론의 얘기뿐만이 아니라 뭐~ 에이아이가 됐든 여러 개가 됐든,굳이 드론의 얘기뿐만이 아니라 뭐~ 에이아이가 됐든 여러 개가 됐든
그런 것들을 빠르게 도입하는 게 좋은지 아니면은,그런 것들을 빠르게 도입하는 게 좋은지 아니면은
쪼금씩 느리더도록 급한 변화 없이,쪼금씩 느리더도록 급한 변화 없이
바꾸는 게 나은지 그쪽에 생각을 좀 듣고 싶어요.,바꾸는 게 나은지 그쪽에 생각을 좀 듣고 싶어요.
사차 산업 혁명이 발달함에 따라서,사차 산업 혁명이 발달함에 따라서
그냥 쫌 점진적으로,그냥 조금 점진적으로
들어왔으면 좋겠는데 훅 들어오는 것보다는 천천히,들어왔으면 좋겠는데 훅 들어오는 것보다는 천천히
들어와야 저희도 어느 정도 준비를 하지 않을까요?,들어와야 저희도 어느 정도 준비를 하지 않을까요?
뭔가 사차 산업 산업이 발달함에 따라서,뭔가 사차 산업 산업이 발달함에 따라서
뭐~ 저희 직업 같은 거 없어지는 것도 뭐~  많아진다고 하잖아요 뭐~ 어떻게,뭐~ 저희 직업 같은 거 없어지는 것도 뭐~  많아진다고 하잖아요 뭐~ 어떻게
얼마나 더 발달할지는 모르겠지만 뭐~,얼마나 더 발달할지는 모르겠지만 뭐~
아까 뭐~ 마트 같은 경우도 보시면은 캐셔도 뭐~,아까 뭐~ 마트 같은 경우도 보시면은 캐셔도 뭐~
없어지고 뭐~ 셀프 계산대 요즘 추세잖아요.,없어지고 뭐~ 셀프 계산대 요즘 추세잖아요.
이제 점점 사람이 할 수 있는 일 쭐어들고,이제 점점 사람이 할 수 있는 일 줄어들고
로봇이 다 한다고는 하는데 얼마 전에 봤는데,로봇이 다 한다고는 하는데 얼마 전에 봤는데
치킨도 로봇이 튀겨준다고 하더라고요 로봇이,치킨도 로봇이 튀겨준다고 하더라고요 로봇이
튀겨주는 치킨 이렇게 광고를 하던데,튀겨주는 치킨 이렇게 광고를 하던데
로봇이 일정한 온도에 뭐~ 몇 도씨가 되면은 몇 분에,로봇이 일정한 온도에 뭐~ 몇 도씨가 되면은 몇 분에
일정하게 튀겨줘서 뭐~ 맛있는 치킨,일정하게 튀겨줘서 뭐~ 맛있는 치킨
이렇게 광고를 하는데 사람보다 튀 사람이 튀긴 것보다 더 맛있다,이렇게 광고를 하는데 사람보다 튀 사람이 튀긴 것보다 더 맛있다
뭐~ 이렇게 광고를 하는데 이런 식으로 되면은,뭐~ 이렇게 광고를 하는데 이런 식으로 되면은
과연 앞으로 사람이 설 수 있는 일자리는 얼마나 될 수 있을까,과연 앞으로 사람이 설 수 있는 일자리는 얼마나 될 수 있을까
그리고 사람이 대처할 수 없는 일자리는 또 얼마나 될 것인가,그리고 사람이 대처할 수 없는 일자리는 또 얼마나 될 것인가
약간 이런 것들에 대한 생각도 많이 해 봐야 될 거 같애요.,약간 이런 것들에 대한 생각도 많이 해 봐야 될 거 같애요.
그래서 점진적으로 받아들이면서 저희도 앞으로 생각을 할 수 있게끔,그래서 점진적으로 받아들이면서 저희도 앞으로 생각을 할 수 있게끔
당연히 이런 것들이 발달이 되면은 뭐~ 기술적으로 편리해지고 좋기야 하겠지만,당연히 이런 것들이 발달이 되면은 뭐~ 기술적으로 편리해지고 좋기야 하겠지만
너무 빨리 훅 들어오면은 힘들 거 같애요.,너무 빨리 훅 들어오면은 힘들 거 같애요.
자율 주행차 이런 것도 뭐~ 편리하고 좋다고는 하는데,자율 주행차 이런 것도 뭐~ 편리하고 좋다고는 하는데
뭐~ 문제점도 많다고 하더라고요 뭐~ 백 퍼센트,뭐~ 문제점도 많다고 하더라고요 뭐~ 백 퍼센트
솔직히 저는 못 믿겠어요 어떻게 믿고 맡겨 근데,솔직히 저는 못 믿겠어요 어떻게 믿고 맡겨 근데
기계가 사람보다 더 정확할 수 있기야 하겠죠 가끔씩 내비게이션 보면,기계가 사람보다 더 정확할 수 있기야 하겠죠 가끔씩 내비게이션 보면
당연히 내비게이션 정확하게 길 알려주죠 근데,당연히 내비게이션 정확하게 길 알려주죠 근데
어때요 삥삥삥삥 돌아가면서 사람이 갈 수 있는 길보다,어때요 삥삥삥삥 돌아가면서 사람이 갈 수 있는 길보다
우회해서 알려주는 경우도 있고 뭐~ 잘 진짜 모른 때는,우회해서 알려주는 경우도 있고 뭐~ 잘 진짜 모른 때는
잘 알려줄 때도 있고 그냥 가끔씩,잘 알려줄 때도 있고 그냥 가끔씩
다 장단점은 있는 것 같아요.,다 장단점은 있는 것 같아요.
아~ 얼마 전에 은행에 통장 개설하러 갔는데,아~ 얼마 전에 은행에 통장 개설하러 갔는데
뭐~ 통장이라던지 카드 없이도 돈 뽑을 수 있다고,뭐~ 통장이라던지 카드 없이도 돈 뽑을 수 있다고
지문을 등록하라고 하는 거예요.,지문을 등록하라고 하는 거예요.
어~ 엄청 신기했어요 막 지문을 하나하나씩 다 찍어가지고는,어~ 엄청 신기했어요 막 지문을 하나하나씩 다 찍어가지고는
뭐~ 급하게 나와서 카드도 안 가지고 나오고 통장도 없는데 그냥,뭐~ 급하게 나와서 카드도 안 가지고 나오고 통장도 없는데 그냥
내 손에 있는 지문 하나만으로도 내 통장에 있는 돈을 뽑아서 쓸 수 있다,내 손에 있는 지문 하나만으로도 내 통장에 있는 돈을 뽑아서 쓸 수 있다
뭐~ 이렇게 얘기해가지고 뭐~ 지문 등록을 했기는 했는데,뭐~ 이렇게 얘기해가지고 뭐~ 지문 등록을 했기는 했는데
이런 것들 보면은 엄청 편리하기는 편리하죠.,이런 것들 보면은 엄청 편리하기는 편리하죠.
근데 장단점이 있는 거 같애요.,근데 장단점이 있는 거 같애요.
따로 좋게 생각하는 거 뭐~ 있으세요?,따로 좋게 생각하는 거 뭐~ 있으세요?
사실 뭐~,사실 뭐~
에이아이든 뭐가 됐든 간에 좋기는 좋죠 좋기는 좋은데,에이아이든 뭐가 됐든 간에 좋기는 좋죠 좋기는 좋은데
근데 그에 반해서 쫌 안 좋은 점도 있을 수가 있는 것이,근데 그에 반해서 조금 안 좋은 점도 있을 수가 있는 것이
뭐~ 사실을 차를 몬다는 게,뭐~ 사실을 차를 몬다는 게
여러 가지 의미가 있을 수도 있겠지만은 특히 드라이브 같은 거를 좋아하고 뭐~ 그런 사람들은,여러 가지 의미가 있을 수도 있겠지만은 특히 드라이브 같은 거를 좋아하고 뭐~ 그런 사람들은
차를 몬다는 것 자체를 좋아하는 사람도 있거든요.,차를 몬다는 것 자체를 좋아하는 사람도 있거든요.
그래서 일부러 어떤 분들 보면은 그 수동 기어가 있는 차를 살라고 일부로,그래서 일부러 어떤 분들 보면은 그 수동 기어가 있는 차를 살라고 일부로
수동 중고차를 구하시는 분들도 가끔씩 보이고,수동 중고차를 구하시는 분들도 가끔씩 보이고
그런 것들을 보면은 계속 편하고 빠르고를,그런 것들을 보면은 계속 편하고 빠르고를
원하다 보니까 어느 순간 쫌 그~ 순간 자체를 즐긴다는,원하다 보니까 어느 순간 조금 그~ 순간 자체를 즐긴다는
것에 대해서 쫌 의미가 쫌 많이 옅어지고 있지 않나,것에 대해서 조금 의미가 조금 많이 옅어지고 있지 않나
그런 생각도 쫌 근데 뭐~ 좋은 점이라고 한다면은 뭐~,그런 생각도 조금 근데 뭐~ 좋은 점이라고 한다면은 뭐~
요즘에 뭐~ 식당에 주문할 때,요즘에 뭐~ 식당에 주문할 때
다 이제 종업원이 하는 게 아니라 어~ 무인,다 이제 종업원이 하는 게 아니라 어~ 무인
결제 시스템을 다 이용하고 이~ 심지어는 보니까 서빙도,결제 시스템을 다 이용하고 이~ 심지어는 보니까 서빙도
이제 몇몇 가게에서는 다 기계가 서빙을 해 주고 그러는 거 같던데,이제 몇몇 가게에서는 다 기계가 서빙을 해 주고 그러는 거 같던데
그런 부분 보면은 확실히 편리한 점도 있겠죠 뭐~ 화내 봤자 뭐~ 기계한테 화낼 수 없으니까,그런 부분 보면은 확실히 편리한 점도 있겠죠 뭐~ 화내 봤자 뭐~ 기계한테 화낼 수 없으니까
뭐~ 그런 부분도 그렇고 뭐~ 여러모로 좋은 점도 있기는 한데,뭐~ 그런 부분도 그렇고 뭐~ 여러모로 좋은 점도 있기는 한데
쫌 한편으로는 예 차라던지 뭐~,조금 한편으로는 예 차라던지 뭐~
굳이 따른 예를 들자면 사차 산업 혁명이랑은 좀 거리가 멀기는 하지만 뭐~ 캠핑 같은,굳이 다른 예를 들자면 사차 산업 혁명이랑은 좀 거리가 멀기는 하지만 뭐~ 캠핑 같은
그런 그 순간 자체를 즐긴다는 의미는 쫌 많이 옅어지게 되는 게 아닌가,그런 그 순간 자체를 즐긴다는 의미는 조금 많이 옅어지게 되는 게 아닌가
하는 단점도 쫌 있는 거 같애요 혹시 사차 산업 혁명 중에서,하는 단점도 조금 있는 거 같애요 혹시 사차 산업 혁명 중에서
쫌 많이 와닿게 느끼고 있다던가,조금 많이 와닿게 느끼고 있다던가
아니면 그런 걸로 쫌 섬찟했던 적 있나요?,아니면 그런 걸로 조금 섬찟했던 적 있나요?
무슨 영화인지 기억은 잘 안 나는데 그~ 로봇이,무슨 영화인지 기억은 잘 안 나는데 그~ 로봇이
이제 막 감정도 가지게 된 거예요 뭐~ 감정도 가지게 돼서,이제 막 감정도 가지게 된 거예요 뭐~ 감정도 가지게 돼서
사람보다 더 사람 같아진 거죠 그서 로봇이,사람보다 더 사람 같아진 거죠 그래서 로봇이
인간 세계를 지배하게 되는 로봇이 원체 똑똑하잖아요.,인간 세계를 지배하게 되는 로봇이 원체 똑똑하잖아요.
약간 그런 영화였는데 영화 제목은 생각 안 나 아무튼 그런 내용이였는데,약간 그런 영화였는데 영화 제목은 생각 안 나 아무튼 그런 내용이였는데
이게 진짜 앞으로에 미래가 될 수 있겠다 약간 이런 생각이 들더라고요.,이게 진짜 앞으로에 미래가 될 수 있겠다 약간 이런 생각이 들더라고요.
그러면서 진짜 섬찟했었는데 머지않아 올 것 같애요 이런,그러면서 진짜 섬찟했었는데 머지않아 올 것 같애요 이런
카카오 미니 뭐~ 기가 지니 뭐~ 이런 그런 기계랑도 뭐~,카카오 미니 뭐~ 기가 지니 뭐~ 이런 그런 기계랑도 뭐~
심심하면 대화하는 이런 세상인데 얘기하면은,심심하면 대화하는 이런 세상인데 얘기하면은
엄청 똑똑하잖아요 막 물어보면은 대답해 주고 뭐 해달라 하면 다 해 주고,엄청 똑똑하잖아요 막 물어보면은 대답해 주고 뭐 해달라 하면 다 해 주고
맨날 초등학교 때 뭐~ 과학 상상 그리기 뭐~,맨날 초등학교 때 뭐~ 과학 상상 그리기 뭐~
상상의 날인가 뭐~ 과학의 날인가 그런 거 하면은,상상의 날인가 뭐~ 과학의 날인가 그런 거 하면은
그런 거 했었어요 글짓기 시간 뭐~ 그런 거 할 때 뭐~,그런 거 했었어요 글짓기 시간 뭐~ 그런 거 할 때 뭐~
영상 통화를 한다,영상 통화를 한다
이거는 뭐~ 상상도 못 했었죠 그때 그 나이대 근데 지금 뭐~ 핸드폰으로 영상 전화하는 거는,이거는 뭐~ 상상도 못 했었죠 그때 그 나이대 근데 지금 뭐~ 핸드폰으로 영상 전화하는 거는
기본이고 뭐~ 화상 통화 뭐~ 집에서,기본이고 뭐~ 화상 통화 뭐~ 집에서
교육 듣는 동영상으로 교육 듣기 집에서 뭐~,교육 듣는 동영상으로 교육 듣기 집에서 뭐~
쿠팡 배송 마트 안 가고 뭐~ 배송하는 거 뭐~ 택배로 하는 거 다 그냥 요즘 그냥 실생활이잖아요 이제는,쿠팡 배송 마트 안 가고 뭐~ 배송하는 거 뭐~ 택배로 하는 거 다 그냥 요즘 그냥 실생활이잖아요 이제는
그때 뭐~ 상상이나 했겠어요 이런 세계가 올 거라고는,그때 뭐~ 상상이나 했겠어요 이런 세계가 올 거라고는
근데 또 앞으로의 미래는 또 더 하겠죠.,근데 또 앞으로의 미래는 또 더 하겠죠.
그니까 로봇이 얼마나 더 똑똑해져서 또 인간 세배를 저희가 지배당할까 봐 저는 그게 쫌 무서운 거예요.,그러니까 로봇이 얼마나 더 똑똑해져서 또 인간 세배를 저희가 지배당할까 봐 저는 그게 조금 무서운 거예요.
그렇지 않을까요?,그렇지 않을까요?
얼마나 더 똑똑한 로봇이 탄생해서,얼마나 더 똑똑한 로봇이 탄생해서
로봇한테 저희가 지배당하는 그런 세상에서 사는,로봇한테 저희가 지배당하는 그런 세상에서 사는
그런 일들이 일어날까 봐 쫌 약간 있을 법한 이야기인 거 같기는 해요.,그런 일들이 일어날까 봐 조금 약간 있을 법한 이야기인 거 같기는 해요.
그게 사실 그렇게 걱정하는 사람들이 있다는 것만으로도,그게 사실 그렇게 걱정하는 사람들이 있다는 것만으로도
그렇게 되지 않을 것이다라는,그렇게 되지 않을 것이다라는
의미에 대한 좀 증거가 될 수가 있지 않나 생각하는데,의미에 대한 좀 증거가 될 수가 있지 않나 생각하는데
사실 아까 말씀하셨다시피 그런 점진적인,사실 아까 말씀하셨다시피 그런 점진적인
발전과 도입을 원하는 사람들이 있다 보니까 그리고,발전과 도입을 원하는 사람들이 있다 보니까 그리고
특히 한국 같은 경우는 그러 그런 식으로 계속,특히 한국 같은 경우는 그러 그런 식으로 계속
흘러가고 있다 보니까 법률이 그렇다 보니까,흘러가고 있다 보니까 법률이 그렇다 보니까
지금 사실 뭐~ 에이아이가 발전하는 속도로 따지자면은 머지않아 그렇게,지금 사실 뭐~ 에이아이가 발전하는 속도로 따지자면은 머지않아 그렇게
만들고 싶다면 만들 수도 있겠지만은 그런 식으로,만들고 싶다면 만들 수도 있겠지만은 그런 식으로
우리가 원하는 방향과 오류가 원하는 방향에 비해서 쫌 오류가 있다면은,우리가 원하는 방향과 오류가 원하는 방향에 비해서 조금 오류가 있다면은
그때마다 중단하면서 여러 가지,그때마다 중단하면서 여러 가지
오류도 쫌 확인을 하고 또 다시금 만들어 보고,오류도 조금 확인을 하고 또 다시금 만들어 보고
그런 식으로 가지지 않을까 싶어요 그렇게 따지면은,그런 식으로 가지지 않을까 싶어요 그렇게 따지면은
백 년 전이었나 백 년 전에 그게 독일이었는지 어디 가 어디였는지 잘 기억이 안 나는데,백 년 전이었나 백 년 전에 그게 독일이었는지 어디 가 어디였는지 잘 기억이 안 나는데
네 한 백 년인가 한 오십 년인가 그 쯤 전에,네 한 백 년인가 한 오십 년인가 그 쯤 전에
오시 백 년 뒤에 사람들이 어떻게,오시 백 년 뒤에 사람들이 어떻게
살고 있을 거 같냐 하는 거를 가지고 애들한테 그려보라고 했었나 그랬는데,살고 있을 거 같냐 하는 거를 가지고 애들한테 그려보라고 했었나 그랬는데
그게 거 그중에 하나가 뭐였냐 면은,그게 거 그중에 하나가 뭐였냐 면은
사람들이 이제 더 이상 공부를 하지 않고 그냥 어떤 헬멧 같은 거를 써가지고 그냥,사람들이 이제 더 이상 공부를 하지 않고 그냥 어떤 헬멧 같은 거를 써가지고 그냥
이제 지식을 그대로 흡수한다고 해야 되나,이제 지식을 그대로 흡수한다고 해야 되나
공부가 필요 없어지는 거죠 노력이 필요 없어지고 그냥 가만히 있으면 알아서 떠먹여주는,공부가 필요 없어지는 거죠 노력이 필요 없어지고 그냥 가만히 있으면 알아서 떠먹여주는
지식을 떠먹여주는 그런 게 있었는데 뭐~ 그런 게,지식을 떠먹여주는 그런 게 있었는데 뭐~ 그런 게
가능할지 지금은 모르겠지만은 뭐~ 그런 것도 있드라고요 뭐~ 나중에,가능할지 지금은 모르겠지만은 뭐~ 그런 것도 있드라고요 뭐~ 나중에
사이보그라고 해야 되나 인간이 기계와 좀 결합되는,사이보그라고 해야 되나 인간이 기계와 좀 결합되는
인간의 몸 안에 좀 칩을 심고 뭐~ 그런 시대가 나왔을 때쯤에,인간의 몸 안에 좀 칩을 심고 뭐~ 그런 시대가 나왔을 때쯤에
뇌에다가 어떤 칩을 심어가지고 그 칩 하나만으로 언어를,뇌에다가 어떤 칩을 심어가지고 그 칩 하나만으로 언어를
외국어를 자유롭게 구사할 수 있게 된다고는 하는데 아무튼 좀 우리가,외국어를 자유롭게 구사할 수 있게 된다고는 하는데 아무튼 좀 우리가
지금 생각하는 것과는 쫌 다르게 흘러가지 않을까 싶어요 뭐~ 예를 들어서,지금 생각하는 것과는 조금 다르게 흘러가지 않을까 싶어요 뭐~ 예를 들어서
옛날에 청소 로봇이 어떻게 생겼을 거 같냐 했을 때,옛날에 청소 로봇이 어떻게 생겼을 거 같냐 했을 때
사람들이 인간의 형상에 청소를 하고 있는 로봇을 상상했다면은 지금 사실,사람들이 인간의 형상에 청소를 하고 있는 로봇을 상상했다면은 지금 사실
청소 로봇이라고 한다면은 밑에 뭐~ 바퀴벌레처럼 생긴,청소 로봇이라고 한다면은 밑에 뭐~ 바퀴벌레처럼 생긴
커다란 놈이 그냥 기어 다니는 식으로 청소를 하고 있는데 그런 식으로 쫌,커다란 놈이 그냥 기어 다니는 식으로 청소를 하고 있는데 그런 식으로 조금
우리가 상상하는 바와는 약간씩 다른 형태로,우리가 상상하는 바와는 약간씩 다른 형태로
동일한 기능을 수행하는 시대가 오지 않을까 그런 생각이 쫌 듭니다.,동일한 기능을 수행하는 시대가 오지 않을까 그런 생각이 조금 듭니다.
그런 그렇게 생각을 하다 보니까 저 같은 경우에는 뭐~ 이케,그런 그렇게 생각을 하다 보니까 저 같은 경우에는 뭐~ 이렇게
섬찟하거나 그랬던 적도 그렇게 많았던 거 같지는 않고,섬찟하거나 그랬던 적도 그렇게 많았던 거 같지는 않고
섬찟하더라도 그냥 아~ 이건 뭐~ 어차피 뭐~,섬찟하더라도 그냥 아~ 이건 뭐~ 어차피 뭐~
그렇게까지 되겠어 싶은 어떻게 보면 뭐~ 안전 불감일 수도 있겠지만은,그렇게까지 되겠어 싶은 어떻게 보면 뭐~ 안전 불감일 수도 있겠지만은
저는 좀 그런 생각이 좀 많이 들드라고요 그리고 또,저는 좀 그런 생각이 좀 많이 들드라고요 그리고 또
사실 에이아이가 많이 그니까 에이아이를 접목시키다 보니까,사실 에이아이가 많이 그러니까 에이아이를 접목시키다 보니까
연구라던지 어떤 생명 공학이라던지 그런 부분에서 이~ 개발 속도가 어마어마하게,연구라던지 어떤 생명 공학이라던지 그런 부분에서 이~ 개발 속도가 어마어마하게
빠르다고 하드라고요 나중에는 지금은 그렇지 않지만은 나중에는 인간보다,빠르다고 하드라고요 나중에는 지금은 그렇지 않지만은 나중에는 인간보다
기계가 개발하는 속도가 더 빨라가지고 인간이 그~,기계가 개발하는 속도가 더 빨라가지고 인간이 그~
과정을 이해하기도 전에 그냥 그니까 시험으로 따지자면은,과정을 이해하기도 전에 그냥 그러니까 시험으로 따지자면은
이게 계산 과정은 모르겠는데 일단 답만 적고,이게 계산 과정은 모르겠는데 일단 답만 적고
정답지를 제출하는 그냥 정답지를 보고 베끼는,정답지를 제출하는 그냥 정답지를 보고 베끼는
느낌으로 갈 거라고 하는데 특히 뭐~ 수명에 관해가지고,느낌으로 갈 거라고 하는데 특히 뭐~ 수명에 관해가지고
우리가 지금 태어난 사람들이 한 백삼십 살까지 살 거다,우리가 지금 태어난 사람들이 한 백삼십 살까지 살 거다
백오십 살까지 살 거다 이렇게 생각해 보면 잘 안 믿기죠.,백오십 살까지 살 거다 이렇게 생각해 보면 잘 안 믿기죠.
혹시 뭐~ 실제로 지금 태어나는 혹은 지금 한,혹시 뭐~ 실제로 지금 태어나는 혹은 지금 한
이십 대 십 대 삼십 대까지 되시는 분들이,이십 대 십 대 삼십 대까지 되시는 분들이
실제로 그렇게 오래 연장된 수명으로 이렇게 살 거 같다고 생각하시나요?,실제로 그렇게 오래 연장된 수명으로 이렇게 살 거 같다고 생각하시나요?
아무래도,아무래도
옛날보다 의료 기술이 발달함에 따라서,옛날보다 의료 기술이 발달함에 따라서
오래 살지 않을까요?,오래 살지 않을까요?
