사투리,표준어
가격이 좀 오르니까 이제 집이 있는 입장이 되니 사실 또 집값이 조금 오른 게 아무래도 집값 실 거주 목적이긴 하지만 집값을 내렸을 때보다는 더 기분이 좋긴하죠.,가격이 좀 오르니까 이제 집이 있는 입장이 되니 사실 또 집값이 조금 오른 게 아무래도 집값 실 거주 목적이긴 하지만 집값을 내렸을 때보다는 더 기분이 좋긴하죠.
어~ 근데 이렇게 실제로 집이 필요한 사람들이,어~ 근데 이렇게 실제로 집이 필요한 사람들이
살 수 있게끔 그래 돼야 되는데  님 말씀하신 거처럼 여러 투자자들이 들어오면서 오히려 가격만 부풀리고 실제로 집을 필요로 하는 사람들이 집을 구하기가 많이 어려운 상황이 된 거 같아서 또 많이 안타깝게 생각합니다.,살 수 있게끔 그렇게 돼야 되는데  님 말씀하신 거처럼 여러 투자자들이 들어오면서 오히려 가격만 부풀리고 실제로 집을 필요로 하는 사람들이 집을 구하기가 많이 어려운 상황이 된 거 같아서 또 많이 안타깝게 생각합니다.
근데 저희 세입자분 같은 경우에는,근데 저희 세입자분 같은 경우에는
이미 본인에 집이 또 있으세요 비어 있는 집이 있고 그래서 갈 곳이 없다기보다는 그~ 그분 아버님이 또 인근에서 부동산을 운영하신다 하더라고요 이제 저희 친한 부동산 소장님이랑 이제 알아서,이미 본인에 집이 또 있으세요 비어 있는 집이 있고 그래서 갈 곳이 없다기보다는 그~ 그분 아버님이 또 인근에서 부동산을 운영하신다 하더라고요 이제 저희 친한 부동산 소장님이랑 이제 알아서
아는 분인데도 어~ 쉽게 원만하게 쫌 해결을 해주시지는 않고 있는 상황이거든요.,아는 분인데도 어~ 쉽게 원만하게 조금 해결을 해주시지는 않고 있는 상황이거든요.
이 지금 바뀐 이 임대차 보호법이 아무래도 집주인보다는 세입자에 편에서 만들어진 법이다 보니,이 지금 바뀐 이 임대차 보호법이 아무래도 집주인보다는 세입자에 편에서 만들어진 법이다 보니
물론 법이라는 게 사실 해석하기 나름이겠지만 쫌 세입자에게 많이 유리하게끔 되어있더라고요 법에 되게 애매하게 명시되어있는 게,물론 법이라는 게 사실 해석하기 나름이겠지만 조금 세입자에게 많이 유리하게끔 되어있더라고요 법에 되게 애매하게 명시되어있는 게
어~ 세입자가 요구를 한다면 어~ 원만하게 합의를 해줘라라는 식으로,어~ 세입자가 요구를 한다면 어~ 원만하게 합의를 해줘라라는 식으로
그렇게 쫌 애매한 문구가 적혀 있더라고요 그래서 세입자가 이제 그 법을 잘 아는 사람이라면,그렇게 조금 애매한 문구가 적혀 있더라고요 그래서 세입자가 이제 그 법을 잘 아는 사람이라면
어~ 이사비를 요구하거나 청구할 수 있게끔 애매하게 그렇게 법 조항이 만들어져 있더라고요 그래서 이제 그분에 아버님이,어~ 이사비를 요구하거나 청구할 수 있게끔 애매하게 그렇게 법 조항이 만들어져 있더라고요 그래서 이제 그분에 아버님이
그 부동산에서 일을 하시다 보니 그런 부분을 잘 알고 계시고,그 부동산에서 일을 하시다 보니 그런 부분을 잘 알고 계시고
그래서 조금 그 부분을 악용하고 있는 상황이라고 이제 저희는 생각하고 있거든요 그래서 지금 당장 이사를 가려면 갈 수 있는 상황이고,그래서 조금 그 부분을 악용하고 있는 상황이라고 이제 저희는 생각하고 있거든요 그래서 지금 당장 이사를 가려면 갈 수 있는 상황이고
어~ 사실 그 임대차 보호법이 이번이 바뀐 지 얼마 안 됐고 저희가 이제 계약하기 직전에 바로 바꼈는데 그 법이 갑자기 그렇게 생기지 않았다면 사실은 이제 이 년만 계약을 하고 나가는 나가야 되는 상황이었잖아요 근데 이제 그 법을 무기로,어~ 사실 그 임대차 보호법이 이번이 바뀐 지 얼마 안 됐고 저희가 이제 계약하기 직전에 바로 바뀌었는데 그 법이 갑자기 그렇게 생기지 않았다면 사실은 이제 이 년만 계약을 하고 나가는 나가야 되는 상황이었잖아요 근데 이제 그 법을 무기로
지금 이제 저희한테 이제 돈을 요구하고 있는 상황이죠 사실은 근데,지금 이제 저희한테 이제 돈을 요구하고 있는 상황이죠 사실은 근데
어~ 저희는 집을 이제 사기 전에 이미 나간다라는 식에 이제 통화를 하고,어~ 저희는 집을 이제 사기 전에 이미 나간다라는 식에 이제 통화를 하고
뭐~ 문자도 서로 주고받았고 집을 사러 가서도 그분 이제 와이프분이랑 아내분이랑 아내분께 이제 이사를 나갈 거라는 얘기를 계속 몇 번 확답을 들었었거든요 그런데 이제 이렇게 말씀을 하시면서,뭐~ 문자도 서로 주고받았고 집을 사러 가서도 그분 이제 와이프분이랑 아내분이랑 아내분께 이제 이사를 나갈 거라는 얘기를 계속 몇 번 확답을 들었었거든요 그런데 이제 이렇게 말씀을 하시면서
이사 비용을 넌지시 요구를 하시더라구요 그래서 저희 입장에서는 난감한 거죠 그래서 이 법이,이사 비용을 넌지시 요구를 하시더라구요 그래서 저희 입장에서는 난감한 거죠 그래서 이 법이
물론 세입자가 약자라는 전제하에서,물론 세입자가 약자라는 전제하에서
세입자에게 많은 권리를 주기 위해서 만들어진 법이라고 하지만,세입자에게 많은 권리를 주기 위해서 만들어진 법이라고 하지만
사실 저희가 지금 더 약자인 상황인 거 같은데 저희는 지금 이제 그 아파트에 들어가기 위해서 월세를 내면서 작은 집에 살고 있거든요 그래서 그분들이 지금,사실 저희가 지금 더 약자인 상황인 거 같은데 저희는 지금 이제 그 아파트에 들어가기 위해서 월세를 내면서 작은 집에 살고 있거든요 그래서 그분들이 지금
어~ 우리는 못 나간다 배 째라 뭐~ 소송까지도 우리는 불사르겠다 이렇게 하니까 저희는 계약 날짜에 맞춰서 못 들어가고 어~ 계속해서 월세가 나가 나가야 되는 상황인 거죠 그래서,어~ 우리는 못 나간다 배 째라 뭐~ 소송까지도 우리는 불사르겠다 이렇게 하니까 저희는 계약 날짜에 맞춰서 못 들어가고 어~ 계속해서 월세가 나가 나가야 되는 상황인 거죠 그래서
소송이 한 번에 바로 끝난다 하더라도 적어도 육 개월은 걸린다 하더라고요 그러면 이제 저희는 또 계속해서 월세가 나가야 되고,소송이 한 번에 바로 끝난다 하더라도 적어도 육 개월은 걸린다 하더라고요 그러면 이제 저희는 또 계속해서 월세가 나가야 되고
아~ 그래서 경제적인 부분에서만 봤을 때,아~ 그래서 경제적인 부분에서만 봤을 때
차라리 이 사람들한테 이사비용을 뭐~ 한 이삼백 주고 마는 게 낫나 나으려나 하는 생각도 들고 있는 상황이에요 저희가 이런 상황을 아니까 그쪽에서 오히려 더,차라리 이 사람들한테 이사비용을 뭐~ 한 이삼백 주고 마는 게 낫나 나으려나 하는 생각도 들고 있는 상황이에요 저희가 이런 상황을 아니까 그쪽에서 오히려 더
이걸 악용해서 좀 더 완강하게 나오는 상황인가 싶어서 사실 지금 쫌 고민이 되고 있는 상황입니다 근데  님은 또 집을 일찌감치 사셨다고 하시니까 저희 같이 골치 아픈 일은 없으시길 바라고 또 관심이 많으시는 만큼,이걸 악용해서 좀 더 완강하게 나오는 상황인가 싶어서 사실 지금 조금 고민이 되고 있는 상황입니다 근데  님은 또 집을 일찌감치 사셨다고 하시니까 저희 같이 골치 아픈 일은 없으시길 바라고 또 관심이 많으시는 만큼
또 법이라던가 관련 내용들을 잘 숙지하셔서,또 법이라던가 관련 내용들을 잘 숙지하셔서
저희 때문에 막 일주일도 안 되는 이런 며칠 가지고 그 법의 테두리 안에서 보호받지 못하는 이런 일이 없으셨으면 어~ 진심으로 바랍니다 아~ 그리고,저희 때문에 막 일주일도 안 되는 이런 며칠 가지고 그 법의 테두리 안에서 보호받지 못하는 이런 일이 없으셨으면 어~ 진심으로 바랍니다 아~ 그리고
뭐~  님은 뭐~ 이런 부분 아니라도 혹시 재테크 관련해서 또 관심 있는 분야가 혹시 있으실까요?,뭐~  님은 뭐~ 이런 부분 아니라도 혹시 재테크 관련해서 또 관심 있는 분야가 혹시 있으실까요?
저는,저는
재테크 관련해서 뭐~ 관심 있는 분야는 거의 부동산인 거 같애요.,재테크 관련해서 뭐~ 관심 있는 분야는 거의 부동산인 거 같애요.
주식도 저도 이제 주식은 또 워낙 언론에서 티비에서 주식 때문에,주식도 저도 이제 주식은 또 워낙 언론에서 티비에서 주식 때문에
어~ 망한다는 그런 것들을 많이 봐가지고,어~ 망한다는 그런 것들을 많이 봐가지고
예 그래서 저는 주식은 또 잘 못 하고,예 그래서 저는 주식은 또 잘 못 하고
그나마 제일 제가 관심 있는 거는 부동산이라고 생각합니다.,그나마 제일 제가 관심 있는 거는 부동산이라고 생각합니다.
