사투리,표준어
여운을 남기고 끝을 맺거든요.,여운을 남기고 끝을 맺거든요.
저는 그 드라마를 정말 감명 깊게 봤었어요.,저는 그 드라마를 정말 감명 깊게 봤었어요.
어~ 그럼 저처럼 이게 인생 드라마 또 하나 있으신가요?,어~ 그럼 저처럼 이게 인생 드라마 또 하나 있으신가요?
어~ 저도 마찬가지로 그~ 미스터 선샤인 요즘에 유튜브 스트리밍하길래 보는데,어~ 저도 마찬가지로 그~ 미스터 선샤인 요즘에 유튜브 스트리밍하길래 보는데
약간 흐름이 계속 끊겨서 하이라이트 모음집이어가지고,약간 흐름이 계속 끊겨서 하이라이트 모음집이어가지고
뭐~ 그~ 옆에 사람들 거의 진짜 미스터 선샤인 진짜 많이 봤는지,뭐~ 그~ 옆에 사람들 거의 진짜 미스터 선샤인 진짜 많이 봤는지
어~ 대사 나오기 전에 막 다음 대사 막 쳐고 이러고 하길래 채팅창 가리고 보긴 하는데,어~ 대사 나오기 전에 막 다음 대사 막 쳐고 이러고 하길래 채팅창 가리고 보긴 하는데
미스터 선샤인도 진짜 재밌게 봤고 근데 저는,미스터 선샤인도 진짜 재밌게 봤고 근데 저는
어쨌든 의병 생활하고 그런 감동 뭉클 포인트들 진짜 재밌게 잘 봤어요 근데,어쨌든 의병 생활하고 그런 감동 뭉클 포인트들 진짜 재밌게 잘 봤어요 근데
그~ 러브 모드 끝난 이후로 한 팔 화 구 화부터는 약간,그~ 러브 모드 끝난 이후로 한 팔 화 구 화부터는 약간
아 약간 쓸데없이 약간 늘어지는 듯한 느낌이 있어가지고,아 약간 쓸데없이 약간 늘어지는 듯한 느낌이 있어가지고
약간 의리로 봤거든요 십삼 화부터는,약간 의리로 봤거든요 십삼 화부터는
그래 십칠 화부터 의리로 봤을까 암튼 십삼 화쯤부터 항상,그래 십칠 화부터 의리로 봤을까 암튼 십삼 화쯤부터 항상
모든 드라마를 의리로 보는 편이긴 한데,모든 드라마를 의리로 보는 편이긴 한데
음~ 미스터 선샤인 좋고  작가님 작품 좋아하는 편이고,음~ 미스터 선샤인 좋고  작가님 작품 좋아하는 편이고
저의 인생작은 커피 프린스입니다 뭐~ 커피 프린스 이후로,저의 인생작은 커피 프린스입니다 뭐~ 커피 프린스 이후로
아 내가 로맨스 코미디 뭐~ 이런 장르를 좋아하는구나 근데 이제 영화에서는 이제 로맨틱,아 내가 로맨스 코미디 뭐~ 이런 장르를 좋아하는구나 근데 이제 영화에서는 이제 로맨틱
장르를 잘 안 쓰니까 드라마를 통해서 약간 드라마는 약간 쫌 밝으면 좋겠다 라는,장르를 잘 안 쓰니까 드라마를 통해서 약간 드라마는 약간 조금 밝으면 좋겠다 라는
약간 예전에 풀하우스처럼 약간 통통 튀는,약간 예전에 풀하우스처럼 약간 통통 튀는
뭔가 가족끼리 막 고민 없고 약간 쫌 유쾌하기만 한 그런 내용을 약간 전반적으로 쫌 좋아하는 것 같긴 해요.,뭔가 가족끼리 막 고민 없고 약간 조금 유쾌하기만 한 그런 내용을 약간 전반적으로 조금 좋아하는 것 같긴 해요.
근데 또 잘 만들어진 심오한 그런 드라마 같은 경우에는,근데 또 잘 만들어진 심오한 그런 드라마 같은 경우에는
예전에 조승우랑 이보영 나왔던 거였나 신의 선물 이런 미스테리,예전에 조승우랑 이보영 나왔던 거였나 신의 선물 이런 미스테리
미스테리였나 미스테리는 아니겠다 약간,미스테리였나 미스테리는 아니겠다 약간
어~ 서스펜스 같은 장르도 재밌는 것 같고,어~ 서스펜스 같은 장르도 재밌는 것 같고
또 부부의 세계 같은 경우에 굉장히 공감됐어요 저희 저희 집도 약간 재혼가정이고,또 부부의 세계 같은 경우에 굉장히 공감됐어요 저희 저희 집도 약간 재혼가정이고
이혼하셨다 보니까,이혼하셨다 보니까
뭔가 김희애 입장도 이해가 되고,뭔가 김희애 입장도 이해가 되고
그리고 남편 역할 분도 이해가 되고 한소희도 이해가 되고 그리고,그리고 남편 역할 분도 이해가 되고 한소희도 이해가 되고 그리고
아들 역할에도 약간 제가 어렸을 때 몰입이 되면서 보더 보게 되더라고요.,아들 역할에도 약간 제가 어렸을 때 몰입이 되면서 보더 보게 되더라고요.
그래서 진짜 어느 사람으로서도 다,그래서 진짜 어느 사람으로서도 다
어떤 치우치지 않고 만들어진 역할 배분의 어떤 연기력이었지 않나.,어떤 치우치지 않고 만들어진 역할 배분의 어떤 연기력이었지 않나.
그래서 약간 작품이 재밌었던 것 같고,그래서 약간 작품이 재밌었던 것 같고
저는 이제 인생 작품 하면 역시 커피 프린스랑,저는 이제 인생 작품 하면 역시 커피 프린스랑
뭐~ 풀하우스 밝은 류로 하면,뭐~ 풀하우스 밝은 류로 하면
그리고 아까 말씀하셨던 도깨비 미스터 선샤인,그리고 아까 말씀하셨던 도깨비 미스터 선샤인
또 와도 재밌고 그냥 봐도 재밌고,또 와도 재밌고 그냥 봐도 재밌고
중간중간에 계속 웃겨 주는 거 너무 좋고,중간중간에 계속 웃겨 주는 거 너무 좋고
그리고 그런 감초 역할들이 주는 어떤,그리고 그런 감초 역할들이 주는 어떤
메인의 어떤 정서도 갖고 가는데 감초들이 막 웃기면서 포인트 해 주니까,메인의 어떤 정서도 갖고 가는데 감초들이 막 웃기면서 포인트 해 주니까
그걸 잘 녹여내는 연출이 좋은 작품들이 좋아하는 것 같아요.,그걸 잘 녹여내는 연출이 좋은 작품들이 좋아하는 것 같아요.
혹은 이제 인생 작품 인생 뭐~ 드라마 있으실까요?,혹은 이제 인생 작품 인생 뭐~ 드라마 있으실까요?
어~ 인생 드라마가 드라마를 좋아해서,어~ 인생 드라마가 드라마를 좋아해서
어~ 저녁 시간에 퇴근 후에 종종 많이 보는데,어~ 저녁 시간에 퇴근 후에 종종 많이 보는데
생각이 안 나네요.,생각이 안 나네요.
어~ 제가 그리고 또 아까 겨우 서른에서 말씀드리고 있는데,어~ 제가 그리고 또 아까 겨우 서른에서 말씀드리고 있는데
이게 약간 중국판 부부의 세계랑 비슷하거든요.,이게 약간 중국판 부부의 세계랑 비슷하거든요.
스포가 될 수도 있으니까 뭐~ 줄거리는 크게 뭐~,스포가 될 수도 있으니까 뭐~ 줄거리는 크게 뭐~
재밌는 부분은 말을 안 하겠는데,재밌는 부분은 말을 안 하겠는데
저도 지금 약간 비혼 쪽으로 생각을 하고 있어서,저도 지금 약간 비혼 쪽으로 생각을 하고 있어서
그 드라마를 보면 공감되는 게 되게 많아요.,그 드라마를 보면 공감되는 게 되게 많아요.
어~ 결혼을 한다고 행복한 건 아니고,어~ 결혼을 한다고 행복한 건 아니고
그냥 결혼했다는 거에 대한,그냥 결혼했다는 거에 대한
뭔가 만족감 안정감이 그거는 있을 거라고 생각을 해요.,뭔가 만족감 안정감이 그거는 있을 거라고 생각을 해요.
근데 그게 과연 정말 나를 위한 행복인지 아니면,근데 그게 과연 정말 나를 위한 행복인지 아니면
사회 제도에 맞춰서 나를 끼워 넣어서,사회 제도에 맞춰서 나를 끼워 넣어서
그렇게 살아가야 하는 건지 그거에 대한,그렇게 살아가야 하는 건지 그거에 대한
생각을 계속 그 드라마를 보면서 공유를 할 수 있거든요.,생각을 계속 그 드라마를 보면서 공유를 할 수 있거든요.
그 저는 겨우 서른 이거 너무 재밌게 보고 있고,그 저는 겨우 서른 이거 너무 재밌게 보고 있고
어~ 또 다른 드라마 제가 좋아하는 것보다는,어~ 또 다른 드라마 제가 좋아하는 것보다는
쫌 별로 선호하지 않는 드라마를  말해 볼게요.,조금 별로 선호하지 않는 드라마를  말해 볼게요.
이거는 미드는 막 그렇게 선호하진 않는데 이게,이거는 미드는 막 그렇게 선호하진 않는데 이게
내용은 정말 뭐~,내용은 정말 뭐~
한국 드라마에서 상상하기 어려운 그런 주제를 다뤄서,한국 드라마에서 상상하기 어려운 그런 주제를 다뤄서
정말 실감 나고 생동감 있게 풀어나가지마는,정말 실감 나고 생동감 있게 풀어나가지마는
그걸 보고 있으면은 미드는 항상,그걸 보고 있으면은 미드는 항상
너무 보고 나면 초췌해지는 거예요 그게,너무 보고 나면 초췌해지는 거예요 그게
여러 작품이 있다 보니까 시즌도,여러 작품이 있다 보니까 시즌도
정말 시즌 하나로 끝나는 게 아니 계속 시리즈가 여러 가지 나오니까,정말 시즌 하나로 끝나는 게 아니 계속 시리즈가 여러 가지 나오니까
미드를 보고 있으면,미드를 보고 있으면
정말 드라마 속으로 아무 생각 없이 멍하게 빨려 들어가는 것 같애가지고,정말 드라마 속으로 아무 생각 없이 멍하게 빨려 들어가는 것 같애가지고
일단은 미드는 아예 애초에 시작을 안 할려고 해요.,일단은 미드는 아예 애초에 시작을 안 할려고 해요.
그래도 제가 본 게 있는데 워킹 데드라든지 로스트 이런 거를 봤는데,그래도 제가 본 게 있는데 워킹 데드라든지 로스트 이런 거를 봤는데
안 보고 싶은데 이게 보고 나면은 정말 남는 게 없지만,안 보고 싶은데 이게 보고 나면은 정말 남는 게 없지만
계속 이게 뭔가 중독이 돼서 저는,계속 이게 뭔가 중독이 돼서 저는
미드는 별로 선호하지 않아요.,미드는 별로 선호하지 않아요.
