사투리,표준어
있기는 있네 나는 아예 그냥 그런 거는 상관없는 사람이라 생각했는데,있기는 있네 나는 아예 그냥 그런 거는 상관없는 사람이라 생각했는데
얘기하다 보니까 생각나네.,얘기하다 보니까 생각나네.
강아지 말고 따른 거는 또 키웠거나 뭐~,강아지 말고 다른 거는 또 키웠거나 뭐~
집에 들였던 적 없어 왜 어릴 때 병아리도 키우고 그러잖아.,집에 들였던 적 없어 왜 어릴 때 병아리도 키우고 그러잖아.
병아리 키운 기억은 없는데,병아리 키운 기억은 없는데
언니는 그~ 동물원 가본 적 있어?,언니는 그~ 동물원 가본 적 있어?
나 어릴 때 부산 안 살았어 가지고 인제,나 어릴 때 부산 안 살았어 가지고 인제
부산에 큰이모 집에 놀러 와 가지고 어린이 대공원 집 간 적 있거든?,부산에 큰이모 집에 놀러 와 가지고 어린이 대공원 집 간 적 있거든?
그때 동물원 갔던 기억이 나는데,그때 동물원 갔던 기억이 나는데
그때 내게 되게 기억에 많이 남는 게,그때 내게 되게 기억에 많이 남는 게
어미 원숭이가 새끼 원숭이를 다리에 이렇게 베 가지고 이를 잡아주고 있는 거야.,어미 원숭이가 새끼 원숭이를 다리에 이렇게 베 가지고 이를 잡아주고 있는 거야.
어릴 때 그게 되게  충격적이고 신선하다 그래야 되나?,어릴 때 그게 되게  충격적이고 신선하다 그래야 되나?
그래 가지고 그게 아직도 생생하게 기억이 난다.,그래 가지고 그게 아직도 생생하게 기억이 난다.
닌 동물원 같은 데 많이 가 봤나?,넌 동물원 같은 데 많이 가 봤니?
가본 적은 있는데,가본 적은 있는데
부산에 지금 동물원 있나 동물원 없지 않나?,부산에 지금 동물원 있어 동물원 없지 않아?
그~ 어린이 대공원에 삼정더파크라고 생겼었는데 지금은 운영 안 한다 하더라고,그~ 어린이 대공원에 삼정더파크라고 생겼었는데 지금은 운영 안 한다 하더라고
내 친구들이 유치원 쌤이나 이런 애들이 많아 갖고,내 친구들이 유치원 쌤이나 이런 애들이 많아 갖고
거기 자주 왔었다대 근데 지금은 없어졌다고 들었다.,거기 자주 왔었다대 근데 지금은 없어졌다고 들었다.
근처에 그런 거 있으면 좋을 텐데 우리 시골에는 토끼 농장이랑 이런 거는 있다.,근처에 그런 거 있으면 좋을 텐데 우리 시골에는 토끼 농장이랑 이런 거는 있다.
부산에 내가 모르는 데 또 있을라나 니 아는 데는 따른 데 없나?,부산에 내가 모르는 데 또 있을라나 너 아는 데는 다른 데 없니?
부산은 없는 걸로 알고 있는데,부산은 없는 걸로 알고 있는데
서울 쪽엔 그 동물원 막 크고 막,서울 쪽엔 그 동물원 막 크고 막
사자 같은 것도 있지 않나?,사자 같은 것도 있지 않아?
에버랜드 사파리 이런 거 말하나 나 거기,에버랜드 사파리 이런 거 말하니 나 거기
가 진짜 가보고 싶은데 에버랜드 가본 지 너무 오래됐네.,가 진짜 가보고 싶은데 에버랜드 가본 지 너무 오래됐네.
동물 보러 진짜 가보고 싶다 사자랑 호랑이 같은 거 좋아해서,동물 보러 진짜 가보고 싶다 사자랑 호랑이 같은 거 좋아해서
니는 그런 거는 안 무서워?,너는 그런 거는 안 무서워?
나는 요즘 친구 애기들이 동물 책을 많이 보니까,나는 요즘 친구 애기들이 동물 책을 많이 보니까
사자랑 호랑이랑 뭐~ 상어 이런 것도 많이 접하고 사슴벌레 막,사자랑 호랑이랑 뭐~ 상어 이런 것도 많이 접하고 사슴벌레 막
아~ 그러고 보니까 사슴벌레나 이런 애들도 많이 키우잖아 장수풍뎅이 같은 거,아~ 그러고 보니까 사슴벌레나 이런 애들도 많이 키우잖아 장수풍뎅이 같은 거
그런 것도 요즘에는 농장이 있더라고 애들이 체험할 수 있는데,그런 것도 요즘에는 농장이 있더라고 애들이 체험할 수 있는데
우리 어릴 때는 흔하게 봤던 거 같기도 한데,우리 어릴 때는 흔하게 봤던 거 같기도 한데
쫌 이제는 잘 못 봐서 그런가 애들 그렇게 체험해 주는 데도 있더라고,조금 이제는 잘 못 봐서 그런가 애들 그렇게 체험해 주는 데도 있더라고
주 그~ &company-name2& 이런 것도 있는 것처럼,주 그~ &company-name2& 이런 것도 있는 것처럼
