사투리,표준어
두 달 동안 요가를 다니면서 여름에,두 달 동안 요가를 다니면서 여름에
보일러 이케 다 이케 뜨겁게 켜놓고,보일러 이렇게 다 이렇게 뜨겁게 켜놓고
그~ 위에서 요가를 해 가지고 땀이 진짜 많이 났거든요?,그~ 위에서 요가를 해 가지고 땀이 진짜 많이 났거든요?
땀이 진짜 많이 나고 집에 가서도 그~ 유튜버 요즘 되게 잘 나오잖아요.,땀이 진짜 많이 나고 집에 가서도 그~ 유튜버 요즘 되게 잘 나오잖아요.
다이어트 영상 같은 거 홈 트레이닝,다이어트 영상 같은 거 홈 트레이닝
집에 가서 그것도 쫌 하고 그때 별로 쫌 안 먹었던 거 같애요.,집에 가서 그것도 조금 하고 그때 별로 조금 안 먹었던 거 같애요.
그래서 쪼끔 의지가 쪼끔 부족해 가지고 먹으면서 이케 뺐는데,그래서 쪼끔 의지가 쪼끔 부족해 가지고 먹으면서 이렇게 뺐는데
두 달 동안 한 달 반 동안 이케 뺐는데 그때,두 달 동안 한 달 반 동안 이렇게 뺐는데 그때
개강하고 나니깐 이제 또다시 학교 가야 되잖아요 맨날 배달 음식 시켜 먹고 그러니깐 천천히,개강하고 나니깐 이제 또다시 학교 가야 되잖아요 맨날 배달 음식 시켜 먹고 그러니깐 천천히
살이 이케 붙더라구요.,살이 이렇게 붙더라구요.
그래가지고 저는 그거 한번 해보고 싶어요 디톡스 다이어트,그래가지고 저는 그거 한번 해보고 싶어요 디톡스 다이어트
음~,음~
요즘에 디톡스 집에서 만들어 먹는 거 말고 인터넷에,요즘에 디톡스 집에서 만들어 먹는 거 말고 인터넷에
일주일 용량 아님 삼 인 삼 일 용량 이렇게 해 가지고 페트병에,일주일 용량 아님 삼 인 삼 일 용량 이렇게 해 가지고 페트병에
맛 여러 가지 맛 이케 담아 가지고,맛 여러 가지 맛 이렇게 담아 가지고
배달 오는 게 있는데,배달 오는 게 있는데
어~ 한 삼 일 오 일?,어~ 한 삼 일 오 일?
기간을 이케 정해 두고 먹더라구요 연예인들도 그렇게 먹고 디톡스 주스를 먹으면은,기간을 이렇게 정해 두고 먹더라구요 연예인들도 그렇게 먹고 디톡스 주스를 먹으면은
음~ 몸에 있는,음~ 몸에 있는
쌓여있는 그런 지방 이런 게 쫌 분해되면서 그런 게 다 내려오나 봐요 근데 그 디톡스 먹는 기간에는 그~ 주스로만,쌓여있는 그런 지방 이런 게 조금 분해되면서 그런 게 다 내려오나 봐요 근데 그 디톡스 먹는 기간에는 그~ 주스로만
하루 이르케 시작하고 끝내고 딴 거는 먹으면 안 되고,하루 이렇게 시작하고 끝내고 딴 거는 먹으면 안 되고
그렇대요 그래가지고 그거는 아무 일정이 없는 날 집에 하루종일 있는 날만,그렇대요 그래가지고 그거는 아무 일정이 없는 날 집에 하루종일 있는 날만
그거를 한번 도전해 보고 싶은데 요즘에 맨날 학교 가고,그거를 한번 도전해 보고 싶은데 요즘에 맨날 학교 가고
아르바이트 가고 그래가지고,아르바이트 가고 그래가지고
집에 있 집에 콕 박혀 있는 시간이 없어 가지고 그것도 해보고 싶은데,집에 있 집에 콕 박혀 있는 시간이 없어 가지고 그것도 해보고 싶은데
음~,음~
그게 안 나요 그리구 하루 날 잡아 가지고 관장약?,그게 안 나요 그리구 하루 날 잡아 가지고 관장약?
그런 거 한번 먹어 보고 싶은데 용기가 안 난다고 해야 되나?,그런 거 한번 먹어 보고 싶은데 용기가 안 난다고 해야 되나?
쫌 음~ 몸에 있는 이거를 다 한번 정리해보고 싶어요.,조금 음~ 몸에 있는 이거를 다 한번 정리해보고 싶어요.
세상에 무슨 관장까지 할라 그러노?,세상에 무슨 관장까지 하려 그러니?
그~  몸에 그~ 뺄 게 뭐가  있다고 관장까지 해 가지고   그렇게 하지 마.,그~  몸에 그~ 뺄 게 뭐가  있다고 관장까지 해 가지고   그렇게 하지 마.
금 나중에 몸 다 상한다?,금 나중에 몸 다 상한다?
그~ 운동은  아줌마가 차라리 먹지를 마라 쫌 줄이면서 운동을 하는 게 제일 좋은 거지.,그~ 운동은  아줌마가 차라리 먹지를 마라 조금 줄이면서 운동을 하는 게 제일 좋은 거지.
관장까지 하면서 하는 거는 아닌 거 같애.,관장까지 하면서 하는 거는 아닌 거 같애.
