사투리,표준어
아~ 근데 진짜 맛이 없더라고요.,아~ 근데 진짜 맛이 없더라고요.
그래서 아~ 약간 저희가 &company-name2& 치즈볼 막 이런 거를 먹었다고 하면,그래서 아~ 약간 저희가 &company-name2& 치즈볼 막 이런 거를 먹었다고 하면
아~ 이거는 진짜 맛없는 치즈볼이구나 하고 느낄 실 거 같고,아~ 이거는 진짜 맛없는 치즈볼이구나 하고 느낄 실 거 같고
음~ 저는 그냥 가게 된다면,음~ 저는 그냥 가게 된다면
거의 팝콘을 주로 반반으로 해 가지고 달콤이랑 어니언 이렇게 해서 먹거든요.,거의 팝콘을 주로 반반으로 해 가지고 달콤이랑 어니언 이렇게 해서 먹거든요.
그냥 팝콘은 그냥 기본 맛을 좋아하시는 편이에요?,그냥 팝콘은 그냥 기본 맛을 좋아하시는 편이에요?
저는 캐러멜 팝콘을 사실 제일 좋아하긴 하는데,저는 캐러멜 팝콘을 사실 제일 좋아하긴 하는데
보통 남자 친구랑 영화관을 가니까,보통 남자 친구랑 영화관을 가니까
그런데 남자 친구는 단 거를 굉장히 싫어해서,그런데 남자 친구는 단 거를 굉장히 싫어해서
캐러멜 팝콘은 절대 안 먹는다고 하더라고요.,캐러멜 팝콘은 절대 안 먹는다고 하더라고요.
그래서 어쩔 수 없이 쪼끔 짭짤한 팝콘이랑,그래서 어쩔 수 없이 쪼끔 짭짤한 팝콘이랑
다른 한 가지는 제가 좋아하는 거를 먹는 편이에요.,다른 한 가지는 제가 좋아하는 거를 먹는 편이에요.
그러면 혹시 무서운 영화도 잘 보세요?,그러면 혹시 무서운 영화도 잘 보세요?
제가 무서운 영화 보고 정말 안 좋은 기억이 있는데,제가 무서운 영화 보고 정말 안 좋은 기억이 있는데
어릴 때 초등학교 때는 무서운 걸 봐도,어릴 때 초등학교 때는 무서운 걸 봐도
저거 어차피 다 가짜니깐,저거 어차피 다 가짜니깐
저거 분장한 건데 뭐가 무섭냐 이런 식으로 겁 없이,저거 분장한 건데 뭐가 무섭냐 이런 식으로 겁 없이
자기 전에도 보고 전설의 고향도 막 재미있게 보고,자기 전에도 보고 전설의 고향도 막 재미있게 보고
막 구미호 보고 웃기다면서 막 꺄르륵 거리면서 웃기다고 그랬는데,막 구미호 보고 웃기다면서 막 꺄르륵 거리면서 웃기다고 그랬는데
크다 보니까  자기 전에 무서웠던 장면들이 자꾸 생각이 나더라고요.,크다 보니까  자기 전에 무서웠던 장면들이 자꾸 생각이 나더라고요.
그래서 안 보게 됐는데,그래서 안 보게 됐는데
어~ 한 몇 년 전에 곡성이라는 영화가 재미있다고 소문이 나서,어~ 한 몇 년 전에 곡성이라는 영화가 재미있다고 소문이 나서
볼까 말까 하다가 봤거든요?,볼까 말까 하다가 봤거든요?
그런데 그 영화를 보고 한 달 동안 거의 잠을 제대로 못 잔 거 같애요.,그런데 그 영화를 보고 한 달 동안 거의 잠을 제대로 못 잔 거 같애요.
기가 약해진 건지 모르겠지만,기가 약해진 건지 모르겠지만
그~ 무당이 굿하는 장면이랑,그~ 무당이 굿하는 장면이랑
닭 닭으로 주술을 막 하는 그런 장면들이 계속 계속 뇌리에 남아 가지고,닭 닭으로 주술을 막 하는 그런 장면들이 계속 계속 뇌리에 남아 가지고
그 이후로는 공포 영화 근처에도 안 가고 있고,그 이후로는 공포 영화 근처에도 안 가고 있고
저랑 안 맞는 거 같애 가지고 안 보고 있어요.,저랑 안 맞는 거 같애 가지고 안 보고 있어요.
