사투리,표준어
나는 휴대폰 아이폰 엑스알 쓰고 있는데 니는 휴대폰 뭐 써?,나는 휴대폰 아이폰 엑스알 쓰고 있는데 너는 휴대폰 뭐 써?
나는 원래 고등학교 때까지는 갤럭시 폴더를 썼거든.,나는 원래 고등학교 때까지는 갤럭시 폴더를 썼거든.
폴드 말고 폴더 그거 되게,폴드 말고 폴더 그거 되게
약간 폴더폰처럼 생긴 건데 액정만 스마트폰이란 말이야.,약간 폴더폰처럼 생긴 건데 액정만 스마트폰이란 말이야.
그래서 솔직히 왜 나온 건지 모르겠는데,그래서 솔직히 왜 나온 건지 모르겠는데
이걸로 바꿨어 뭐~ 쪼금이라도 불편하면은 쫌,이걸로 바꿨어 뭐~ 쪼금이라도 불편하면은 조금
폰을 덜 쓰게 되지 않을까 해가지고,폰을 덜 쓰게 되지 않을까 해가지고
그렇게 하다 보니까 진짜 폰 시간도 쫌 줄더라고,그렇게 하다 보니까 진짜 폰 시간도 조금 줄더라고
그랬는데 수능 끝나고 나서는 갤럭시 노트 텐 플러스로 바꿨어.,그랬는데 수능 끝나고 나서는 갤럭시 노트 텐 플러스로 바꿨어.
화면도 크고 카메라도 엄청 좋고 일단,화면도 크고 카메라도 엄청 좋고 일단
내가 전에 쓴 거는 용량이 되게 짝았거든.,내가 전에 쓴 거는 용량이 되게 작았거든.
한 이삼 기가였나 그래서 어플을 한 세 개 깔면은 막,한 이삼 기가였나 그래서 어플을 한 세 개 깔면은 막
제발 지워달라고 알림이 뜨던데 얘는,제발 지워달라고 알림이 뜨던데 얘는
백 기가 깔아도 엄청 많아가지고 그런 점이 좋드라고 너는 왜,백 기가 깔아도 엄청 많아가지고 그런 점이 좋드라고 너는 왜
갤럭시랑 아이폰 중에 아이폰 써?,갤럭시랑 아이폰 중에 아이폰 써?
나도 원래는 그거 안드로이드 쪽 거 썼었는데,나도 원래는 그거 안드로이드 쪽 거 썼었는데
엘지 거 썼었단 말이야 근데,엘지 거 썼었단 말이야 근데
아이폰이 예쁘잖아 뭔가,아이폰이 예쁘잖아 뭔가
디자인이 나는 되게 마음에 든단 말이야 심플하고,디자인이 나는 되게 마음에 든단 말이야 심플하고
그래가지고 그거 때문에,그래가지고 그거 때문에
애플을 선택하게 됐는데 요새,애플을 선택하게 됐는데 요새
애플 뭔가 카메라도 여러 개 달리고,애플 뭔가 카메라도 여러 개 달리고
막 카메라 달리고 여러 개 달리 막 이런 거 예뻐서 좋은데,막 카메라 달리고 여러 개 달리 막 이런 거 예뻐서 좋은데
뭔가 쫌 단가가 너무 비싸졌다 해야 되나,뭔가 조금 단가가 너무 비싸졌다 해야 되나
휴대폰 가격들이 너무 비싸져가지고 쪼금 요새는 쫌 부담스러운 그런 게 있단 말이야.,휴대폰 가격들이 너무 비싸져가지고 쪼금 요새는 조금 부담스러운 그런 게 있단 말이야.
막 에어팟 막 이런 무선 이어폰 같은 것도 나오는데,막 에어팟 막 이런 무선 이어폰 같은 것도 나오는데
갖고 싶은데 막상 돈이 생겨도 뭔가 이거 사기에는 뭔가 쫌 아까운 그런 게 있단 말이야.,갖고 싶은데 막상 돈이 생겨도 뭔가 이거 사기에는 뭔가 조금 아까운 그런 게 있단 말이야.
그렇게 고민하게 되는 가격이라서 뭔가,그렇게 고민하게 되는 가격이라서 뭔가
니는 그런 거 있나 뭔가 사고 싶은 기계 같은 게 있는데,너는 그런 거 있나 뭔가 사고 싶은 기계 같은 게 있는데
뭔가 가격이 비싸서 못 샀다거나,뭔가 가격이 비싸서 못 샀다거나
나는 아이패드를 되게 사고 싶거든.,나는 아이패드를 되게 사고 싶거든.
대학생이 되기 전까지는 관심이 없었는데,대학생이 되기 전까지는 관심이 없었는데
되고 나니까 주변에 아이패드를 쓰는 사람들이 이제 눈에 들어오는 거야.,되고 나니까 주변에 아이패드를 쓰는 사람들이 이제 눈에 들어오는 거야.
유튜브에 브이로그만 봐도 전부 아이패드로 공부하고 있고 굿노트로 막,유튜브에 브이로그만 봐도 전부 아이패드로 공부하고 있고 굿노트로 막
과제 제출하고 이러니까,과제 제출하고 이러니까
그리고 인강들을 때도 편하고 걔는 장점이 많잖아.,그리고 인강들을 때도 편하고 걔는 장점이 많잖아.
일단 종이가 없어도 되고,일단 종이가 없어도 되고
어~ 활용도도 좋고 그래서 아이패드에 아이,어~ 활용도도 좋고 그래서 아이패드에 아이
애플 펜슬을 사가지고 쓰고 싶더라고 나는 그림 그리는 것도 쪼금 좋아하거든.,애플 펜슬을 사가지고 쓰고 싶더라고 나는 그림 그리는 것도 쪼금 좋아하거든.
근데 아이패드 가격을 찾아봤는데,근데 아이패드 가격을 찾아봤는데
쪼금 쓴 것도 한 오륙십만 원 막 이렇게 파니까,쪼금 쓴 것도 한 오륙십만 원 막 이렇게 파니까
학생 입장에서는 되게 부담스럽다 아이가.,학생 입장에서는 되게 부담스럽지 않아.
그래서 함부로 손을 못 대겠더라고,그래서 함부로 손을 못 대겠더라고
아까 부속 기기 중에서 무선 이어폰 얘기했잖아.,아까 부속 기기 중에서 무선 이어폰 얘기했잖아.
그래서 나는 갤럭시 버즈를 쓰고 있거든.,그래서 나는 갤럭시 버즈를 쓰고 있거든.
너는 그럼 부속 기기 쓰는 거 있어?,너는 그럼 부속 기기 쓰는 거 있어?
나는 원래 에어팟 투가 있었는데 그게,나는 원래 에어팟 투가 있었는데 그게
귀에 끼우면은 자주 떨어진단 말이야 고무마개 같은 게 없어가지고,귀에 끼우면은 자주 떨어진단 말이야 고무마개 같은 게 없어가지고
그래가지고 아 프로 사고 싶다 막 이러고 돈 모아야겠네 이러고 있었는데,그래가지고 아 프로 사고 싶다 막 이러고 돈 모아야겠네 이러고 있었는데
돈을 모으는 과정 중에 버스에서 자고 있다가 일어나 보니까,돈을 모으는 과정 중에 버스에서 자고 있다가 일어나 보니까
그냥 급하게 내렸는데,그냥 급하게 내렸는데
내 에어팟이 없는 거야.,내 에어팟이 없는 거야.
그래가지고 그거 때문에 잊어버려서,그래가지고 그거 때문에 잊어버려서
지금은 줄 유선 이어폰 쓰고 있어.,지금은 줄 유선 이어폰 쓰고 있어.
그래가꼬 나중에 돈 모으면은 에어팟 프로 살라고,그래가꼬 나중에 돈 모으면은 에어팟 프로 살라고
니는 막 그런 거 있나.,너는 막 그런 거 있나.
부속 기기 중에 막 그런 게 있잖아.,부속 기기 중에 막 그런 게 있잖아.
막 애플 워치 막 이런 거,막 애플 워치 막 이런 거
이런 거 중에서 갖고 싶은 거 있어?,이런 거 중에서 갖고 싶은 거 있어?
일단 갖고 싶은 거는 얼마 전까지는 애플 워치였는데 갤럭시 워치로 바꼈어.,일단 갖고 싶은 거는 얼마 전까지는 애플 워치였는데 갤럭시 워치로 바꼈어.
왜 그렇냐면 나는 갤럭시 유저잖아.,왜 그렇냐면 나는 갤럭시 유저잖아.
그러니까 아무래도 갤럭시 워치가 쫌 더 호환성이 좋잖아.,그러니까 아무래도 갤럭시 워치가 조금 더 호환성이 좋잖아.
애플 워치를 쓰는 이유는 애플 막 페이나 그런 거나,애플 워치를 쓰는 이유는 애플 막 페이나 그런 거나
뭐~ 멤버십 그런 것도 되고 일단 아이폰이랑 호환성이 좋아서 그런 건데,뭐~ 멤버십 그런 것도 되고 일단 아이폰이랑 호환성이 좋아서 그런 건데
내가 쓰면은 그거에 한 칠십 퍼,내가 쓰면은 그거에 한 칠십 퍼
한 그 정도 밖에 못 쓸 것 같거든 다 쓴다고 해도,한 그 정도 밖에 못 쓸 것 같거든 다 쓴다고 해도
근데 어~ 갤럭시 워치는 일단 솔직히,근데 어~ 갤럭시 워치는 일단 솔직히
생긴 게 쫌 내 마음에 들어 나는,생긴 게 조금 내 마음에 들어 나는
개인적으로 애플 워치 디자인을  쫌 안 좋아하거든 사람들은 좋아하는데,개인적으로 애플 워치 디자인을  조금 안 좋아하거든 사람들은 좋아하는데
그래가지고 그 똥그란 것도 마음에 들고 주변에 보니까,그래가지고 그 똥그란 것도 마음에 들고 주변에 보니까
걔 폰 없이 걔만 들고 나가도 음악들을 수 있고,걔 폰 없이 걔만 들고 나가도 음악들을 수 있고
어~ 되게 편리한 게 많은 거야 그리고 삼성 페이도 바로바로 되고 나는,어~ 되게 편리한 게 많은 거야 그리고 삼성 페이도 바로바로 되고 나는
편의점 같은 데에서 삼성 페이를 되게 많이 쓰거든 그래서,편의점 같은 데에서 삼성 페이를 되게 많이 쓰거든 그래서
갤럭시 워치를 갖고 싶어.,갤럭시 워치를 갖고 싶어.
그리고 내가 써 본 거는 갤럭시 핏을 사서 써 봤거든.,그리고 내가 써 본 거는 갤럭시 핏을 사서 써 봤거든.
그거는 운동할 때 쓰는 건데 운동할 때 핸드폰 들고 가면 되게 무겁잖아 거추장스럽고,그거는 운동할 때 쓰는 건데 운동할 때 핸드폰 들고 가면 되게 무겁잖아 거추장스럽고
그래가지고 손목에 차고 있으면 좋다해가지고 사실,그래가지고 손목에 차고 있으면 좋다해가지고 사실
이 폰을 사면서 수능 이벤트로,이 폰을 사면서 수능 이벤트로
배송비만 내면 준다고 해서 산 거였단 말이야.,배송비만 내면 준다고 해서 산 거였단 말이야.
근데 써 보니까 걸음수도 혼자 재주고 내가,근데 써 보니까 걸음수도 혼자 재주고 내가
수면시간이랑 그런 것도 다 측정해주고,수면시간이랑 그런 것도 다 측정해주고
스트레스 지수도 측정을 해주는 거야 되게 놀랬거든 내가 쫌,스트레스 지수도 측정을 해주는 거야 되게 놀랬거든 내가 조금
화나 있었는데 딱 누르니까 스트레스 만땅으로 나오고,화나 있었는데 딱 누르니까 스트레스 만땅으로 나오고
심박수 같은 것도 나오고 음 그래가지고,심박수 같은 것도 나오고 음 그래가지고
근데 이걸 써 봤는데,근데 이걸 써 봤는데
굳이 워치까지 써야 되나 막 이런 생각이 약간 들드라고.,굳이 워치까지 써야 되나 막 이런 생각이 약간 들드라고.
음 그래가지고 나는 핸드폰이랑 그것만 있어도,음 그래가지고 나는 핸드폰이랑 그것만 있어도
충분하다 생각하거든 솔직히 말하면 핸드폰만 있어도 되는 것 같애.,충분하다 생각하거든 솔직히 말하면 핸드폰만 있어도 되는 것 같애.
그래서 하튼 갤럭시 핏을 써가꼬,그래서 하튼 갤럭시 핏을 써가꼬
음~ 전자기기 브랜드 중에 샤오미 유명하잖아.,음~ 전자기기 브랜드 중에 샤오미 유명하잖아.
샤오미 꺼 중에 생각나는 거 있어?,샤오미 꺼 중에 생각나는 거 있어?
샤오미 하면은 뭐~ 다들 배터리 막 이런 거 생각하긴 하는데,샤오미 하면은 뭐~ 다들 배터리 막 이런 거 생각하긴 하는데
샤오미가 은근 기술력이 좋드라고.,샤오미가 은근 기술력이 좋드라고.
그래가지고 막 보면은,그래가지고 막 보면은
휴대폰도 있고 뭐~ 들어보면은 패드,휴대폰도 있고 뭐~ 들어보면은 패드
이런 것도 샤오미께 나름 괜찮다는 거야.,이런 것도 샤오미께 나름 괜찮다는 거야.
샤오미가 은근 뭔가 여러 가지를 할려고 하는 거야.,샤오미가 은근 뭔가 여러 가지를 할려고 하는 거야.
뭔가 쫌 뻬껴서 하는 건 있겠지만은,뭔가 조금 베껴서 하는 건 있겠지만은
그래가지고 뭔가,그래가지고 뭔가
아 중국도 기술력이 만만치가 않구나 라는 걸,아 중국도 기술력이 만만치가 않구나 라는 걸
샤오미 때문에 약간 쫌 많이 느낀 게 있어가꼬,샤오미 때문에 약간 조금 많이 느낀 게 있어가꼬
아 기술력이라고 하니까 그냥,아 기술력이라고 하니까 그냥
나 약간 그런 게 있단 말이야.,나 약간 그런 게 있단 말이야.
뭔가 왜 애플 워치나 이런 걸 사고 싶어 하냐면,뭔가 왜 애플 워치나 이런 걸 사고 싶어 하냐면
디자인도 디자인이지만 기술력 이런 거 때문에 있는데,디자인도 디자인이지만 기술력 이런 거 때문에 있는데
막 심박수나 이런 거 재준다 했었잖아.,막 심박수나 이런 거 재준다 했었잖아.
옛날에 뉴스에서 이런 사례를 봤는데,옛날에 뉴스에서 이런 사례를 봤는데
애플 워치가 사람 심장 멈추어가지고,애플 워치가 사람 심장 멈추어가지고
외국에서 그걸로 일일구를 일일구를 자동으로 불러서 막,외국에서 그걸로 일일구를 일일구를 자동으로 불러서 막
살렸다 막 이런 사례가 있는 거야 그래가지고 와 진짜 기술력,살렸다 막 이런 사례가 있는 거야 그래가지고 와 진짜 기술력
장난 아니구나 싶었지.,장난 아니구나 싶었지.
그래가지고 뭐~ 이런 기능이야 뭐~ 삼성이나,그래가지고 뭐~ 이런 기능이야 뭐~ 삼성이나
뭐~ 샤오미 이런 것도 뭐~ 있을 수 있겠지만은 그래도 뭔가,뭐~ 샤오미 이런 것도 뭐~ 있을 수 있겠지만은 그래도 뭔가
디자인 이런 게 쫌 많이 빠졌던 것 같애.,디자인 이런 게 조금 많이 빠졌던 것 같애.
샤오미는 약간 기술력은 좋은데 뭔가,샤오미는 약간 기술력은 좋은데 뭔가
옛날부터 사람 인식이라는 게 있잖아 뭔가 중국산이다 막,옛날부터 사람 인식이라는 게 있잖아 뭔가 중국산이다 막
안 좋다 막 분명 뭔가 마이너스 되는 게 있다 이래가지고,안 좋다 막 분명 뭔가 마이너스 되는 게 있다 이래가지고
괜히 중국산 제품 쓰면은 뭔가,괜히 중국산 제품 쓰면은 뭔가
별로인 느낌 이런 게 있어가지고,별로인 느낌 이런 게 있어가지고
너는 막 싫어하는 브랜드 걍 딱히 선호하지 않는 브랜드 이런 거 있어?,너는 막 싫어하는 브랜드 걍 딱히 선호하지 않는 브랜드 이런 거 있어?
내가 아까 아이패드를 사고 싶다 하긴 했는데 쫌 모순적으로 애플 별로 안 좋아하거든.,내가 아까 아이패드를 사고 싶다 하긴 했는데 조금 모순적으로 애플 별로 안 좋아하거든.
왜 그렇냐면 최근에 애플 서비스 센터에 사건이 하나 있었단 말이야.,왜 그렇냐면 최근에 애플 서비스 센터에 사건이 하나 있었단 말이야.
맥북을 들고 갔는데 그~,맥북을 들고 갔는데 그~
업데이트 오에스를 깔라고 했거든.,업데이트 오에스를 깔라고 했거든.
근데 그걸 설치하고 나니까 애가 벽돌이 된 거야.,근데 그걸 설치하고 나니까 애가 벽돌이 된 거야.
그래가지고  때문인데 에이에스가 안 되냐 이런 식으로 했는데 무조건,그래가지고  때문인데 에이에스가 안 되냐 이런 식으로 했는데 무조건
고객이 돈을 내야 된다 이런 식으로 한 거야.,고객이 돈을 내야 된다 이런 식으로 한 거야.
근데 그~ 애플 회사에서는 계속 그~,근데 그~ 애플 회사에서는 계속 그~
업데이트를 하라고 엄청 강요를 했단 말이야.,업데이트를 하라고 엄청 강요를 했단 말이야.
그러면 소비자는 어쩔 수 없이 뜨니까 하게 된 거다 아이가.,그러면 소비자는 어쩔 수 없이 뜨니까 하게 된 거지 않아.
그런데 아무 책임도 안 지고 계속 앵무새처럼 자기는,그런데 아무 책임도 안 지고 계속 앵무새처럼 자기는
케어해 줄 수가 없다 이런 식으로 대답하니까,케어해 줄 수가 없다 이런 식으로 대답하니까
아 쫌 인식이 되게 안 좋아지더라고,아 조금 인식이 되게 안 좋아지더라고
그리고 아이폰이 좋기는 한데,그리고 아이폰이 좋기는 한데
추울 때 배터리 반 방전 현상 이런 것도 있고,추울 때 배터리 반 방전 현상 이런 것도 있고
그래서 나는 개인적으로 요즘 삼성도,그래서 나는 개인적으로 요즘 삼성도
되게 기술력이 좋다고 생각한단 말이야 그래서,되게 기술력이 좋다고 생각한단 말이야 그래서
싫어한다까지는 아닌데,싫어한다까지는 아닌데
쪼금 요새 애플을 안 좋게 보고 있는 것 같기는 해.,쪼금 요새 애플을 안 좋게 보고 있는 것 같기는 해.
너는 무선 이어폰이랑 줄 이어폰 중에 뭐가 더 좋아?,너는 무선 이어폰이랑 줄 이어폰 중에 뭐가 더 좋아?
나는 실용성으로 따지면 확실히 무선이 좋긴 한데,나는 실용성으로 따지면 확실히 무선이 좋긴 한데
뭔가 음악 같은 거 이런 거 들을 때 막,뭔가 음악 같은 거 이런 거 들을 때 막
보통 사람들은 신경 안 쓰겠지마는,보통 사람들은 신경 안 쓰겠지마는
난 음악을 하다 보니까 뭔가 세세한 소리도 뭔가 집중해서 잘 들어야 된단 말이야.,난 음악을 하다 보니까 뭔가 세세한 소리도 뭔가 집중해서 잘 들어야 된단 말이야.
아까 전에 뭐~ 얘기하는 것도 막 들었을 수도 있겠지만 난 집중을 하면은 진짜,아까 전에 뭐~ 얘기하는 것도 막 들었을 수도 있겠지만 난 집중을 하면은 진짜
한 가지만 집중을 해가지고 뭔가 또,한 가지만 집중을 해가지고 뭔가 또
그게 잘 된단 말이야 한 가지 집중하면은,그게 잘 된단 말이야 한 가지 집중하면은
그래서 소리를 은근 잘 들어.,그래서 소리를 은근 잘 들어.
근데 무선 이어폰을 쓰면은 약간 뭐~,근데 무선 이어폰을 쓰면은 약간 뭐~
사람들이 이게 뭔 차이냐 싶겠지마는 진짜 미세하게 차이가 있단 말이야.,사람들이 이게 뭔 차이냐 싶겠지마는 진짜 미세하게 차이가 있단 말이야.
그래가지고 실용성 따지면은 아마 줄 풀고 이런 게 싫어가지고,그래가지고 실용성 따지면은 아마 줄 풀고 이런 게 싫어가지고
무선이 더 낫긴 한데,무선이 더 낫긴 한데
근데 나 같이 그냥 음악하고 뭔가 소리 잘 들어야 되는 사람한테 그래도 유선이 쫌더낫지 않나,근데 나 같이 그냥 음악하고 뭔가 소리 잘 들어야 되는 사람한테 그래도 유선이 쫌더낫지 않나
싶은 마음이 있어.,싶은 마음이 있어.
닌 나중에 폰 바꾸게 되면은 막,넌 나중에 폰 바꾸게 되면은 막
어떤 휴대폰으로 바꾸고 싶어 그냥 원하는 거,어떤 휴대폰으로 바꾸고 싶어 그냥 원하는 거
음~ 나는 아무래도 갤럭시를 쫌 좋아해서 이 회사 꺼를 계속 쓰지 않을까 하는데,음~ 나는 아무래도 갤럭시를 조금 좋아해서 이 회사 꺼를 계속 쓰지 않을까 하는데
노트 종류가 되게 편한 것 같애 이번에 폴더가 나왔잖아 근데,노트 종류가 되게 편한 것 같애 이번에 폴더가 나왔잖아 근데
친구가 옆에서 쓰는 걸 봤는데,친구가 옆에서 쓰는 걸 봤는데
뭐가 좋은지 잘 모르겠더라고 화면을 여러 개로 분할할 수 있는 것도 좋고 막,뭐가 좋은지 잘 모르겠더라고 화면을 여러 개로 분할할 수 있는 것도 좋고 막
게임할 때도 편하고 하기는 한데,게임할 때도 편하고 하기는 한데
근데 그게 그렇게까지 실용성 있나 하는 생각도 들고,근데 그게 그렇게까지 실용성 있나 하는 생각도 들고
그리고 화면 접히니까 나중에  디스플레이 깨짐 현상 이런 것도 생기고,그리고 화면 접히니까 나중에  디스플레이 깨짐 현상 이런 것도 생기고
그래가지고 그런 류보다는,그래가지고 그런 류보다는
노트가 노트류로 사고 싶어 노트를 지금 쓰고 있는데,노트가 노트류로 사고 싶어 노트를 지금 쓰고 있는데
꺼진 화면 메모 기능이란 게 있단 말이야 펜 뽑으면은,꺼진 화면 메모 기능이란 게 있단 말이야 펜 뽑으면은
그면은 급하게 막 휘갈겨 쓸 때도 편하고 나는,그면은 급하게 막 휘갈겨 쓸 때도 편하고 나는
쫌 깜빡깜빡해가지고 폰 메모장을 잘 쓴단 말이야.,조금 깜빡깜빡해가지고 폰 메모장을 잘 쓴단 말이야.
그러면 노트로 해가꼬 그 폰 메모장에 약간 형광펜 치면서,그러면 노트로 해가꼬 그 폰 메모장에 약간 형광펜 치면서
꾸미는 것도 괜찮고 아까 말한 것처럼 그림 그리는 것도 좋아하거든.,꾸미는 것도 괜찮고 아까 말한 것처럼 그림 그리는 것도 좋아하거든.
근데 그런 걸 손으로 하긴 불편하잖아 그럴 때 노트로 하면 편하드라고.,근데 그런 걸 손으로 하긴 불편하잖아 그럴 때 노트로 하면 편하드라고.
그래가지고 갤럭시에서 또 새로운 노트 시리즈 내면,그래가지고 갤럭시에서 또 새로운 노트 시리즈 내면
사고 싶은 욕심은 있어.,사고 싶은 욕심은 있어.
근데 지금 약정이나 이런 게 쫌 남아있어가지고 쉽게 바꾸지는 못하겠지.,근데 지금 약정이나 이런 게 조금 남아있어가지고 쉽게 바꾸지는 못하겠지.
너는 갤럭시가 디자인이 예쁘게 나와도 계속 애플 쓸 거야?,너는 갤럭시가 디자인이 예쁘게 나와도 계속 애플 쓸 거야?
요즘에 보면은 확실히,요즘에 보면은 확실히
니 말대로 뭔가 기술력이 진짜 장난 아니잖아.,너 말대로 뭔가 기술력이 진짜 장난 아니잖아.
난 또 기술력 보면은 뭔가,난 또 기술력 보면은 뭔가
삼성이 요새는 더 낫지 않나 이런 이런 느낌이긴 해 그래가지고,삼성이 요새는 더 낫지 않나 이런 이런 느낌이긴 해 그래가지고
삼성으로 언젠가 갈아탈까 싶기도 한데,삼성으로 언젠가 갈아탈까 싶기도 한데
그래도 난 나중에 애플 쓸 것 같애.,그래도 난 나중에 애플 쓸 것 같애.
뭔가 약간 뭔가 허세긴 하지만 약간 감성이란 게 있잖아.,뭔가 약간 뭔가 허세긴 하지만 약간 감성이란 게 있잖아.
그래가지고 난 쫌 감성충이라서 그런 거 쫌 많이 따져가꼬,그래가지고 난 조금 감성충이라서 그런 거 조금 많이 따져가꼬
뭐~ 사게 될 것 같애 애플,뭐~ 사게 될 것 같애 애플
막 기술력 하니까,막 기술력 하니까
저번에 친구 노트북을 봤는데,저번에 친구 노트북을 봤는데
삼성 새로 나온 노트북인 거야.,삼성 새로 나온 노트북인 거야.
근데 그거 보니까 막,근데 그거 보니까 막
접혀가지고 패드로도 쓸 수 있고,접혀가지고 패드로도 쓸 수 있고
옆 노트북에 펜도 들어있고,옆 노트북에 펜도 들어있고
막 이런 거 보니까 니가 막 좋아할 것 같은데 막,막 이런 거 보니까 너가 막 좋아할 것 같은데 막
컴퓨터 막 노트북 이런 것도 사고 싶은 거 어떤 거 있어?,컴퓨터 막 노트북 이런 것도 사고 싶은 거 어떤 거 있어?
노트북 그램이 엄청 사고 싶어.,노트북 그램이 엄청 사고 싶어.
그게 되게 가벼운 게 장점이잖아.,그게 되게 가벼운 게 장점이잖아.
나는 옛날에 보부상처럼 가방에  쫌 뭘 많이 넣고 다녀가지고,나는 옛날에 보부상처럼 가방에  조금 뭘 많이 넣고 다녀가지고
그런 중요성을 못 느꼈는데,그런 중요성을 못 느꼈는데
요새는 쫌 어깨가 아프더라고 백팩을 매도,요새는 조금 어깨가 아프더라고 백팩을 매도
그래서 내가 기숙사생이란 말이야.,그래서 내가 기숙사생이란 말이야.
그러면은 집이랑 왔다 갔다 해야 될 거 아니야 그럴 때 노트북을 들고 가는데,그러면은 집이랑 왔다 갔다 해야 될 거 아니야 그럴 때 노트북을 들고 가는데
지금 엘지 구형 껄 쓰고 있거든.,지금 엘지 구형 껄 쓰고 있거든.
그니까 너무 무거워가지고,그니까 너무 무거워가지고
이게 또 가방 부피도 많이 차지하는 거야.,이게 또 가방 부피도 많이 차지하는 거야.
그리고 엘지 그램 정도면은 웬만한 프로그램은 다 돌아가니까 문서 작업할 때도 편할 것 같고,그리고 엘지 그램 정도면은 웬만한 프로그램은 다 돌아가니까 문서 작업할 때도 편할 것 같고
영상 편집 이런 거까지는 쫌,영상 편집 이런 거까지는 조금
안 될 것 같애도 그래도,안 될 것 같애도 그래도
원활하게 쓸 수 있으니까 그래서 엘지 그램을 사고 싶어.,원활하게 쓸 수 있으니까 그래서 엘지 그램을 사고 싶어.
요새 보면은 특이한 전자 기기 많다 아이가.,요새 보면은 특이한 전자 기기 많지 않아.
난 얼마 전에 알리 돌아다니다가 그걸 봤거든.,난 얼마 전에 알리 돌아다니다가 그걸 봤거든.
아이패드에 쓰는 건데 커버야 근데,아이패드에 쓰는 건데 커버야 근데
커버에 키보드가 같이 붙어있는 거야 그래가지고 걔만 있으면,커버에 키보드가 같이 붙어있는 거야 그래가지고 걔만 있으면
