사투리,표준어
키우고 있는 동물 있어?,키우고 있는 동물 있어?
나는 고양이 키우고 두 마리 키워.,나는 고양이 키우고 두 마리 키워.
한 명은 쁘니라고 하고 한 명은 레옹이라고 해.,한 명은 쁘니라고 하고 한 명은 레옹이라고 해.
레옹이는 남자애고 수컷이고 쁘니는 암컷이야.,레옹이는 남자애고 수컷이고 쁘니는 암컷이야.
너는 있어?,너는 있어?
나도 고양이 한 마리 키우는데 물고기도 키워.,나도 고양이 한 마리 키우는데 물고기도 키워.
물고기는 내 방엔 한 다섯 마리?,물고기는 내 방엔 한 다섯 마리?
거실에는 여러 마리 있는데 몇 마린지 모르겠어.,거실에는 여러 마리 있는데 몇 마린지 모르겠어.
이번에 새끼 낳아가지고 엄청 많긴 많아.,이번에 새끼 낳아가지고 엄청 많긴 많아.
고양이는 이름이 뭐고 어떤데?,고양이는 이름이 뭐고 어떤데?
걘 보리라고 하는데 수컷이고 엄청 활발해.,걘 보리라고 하는데 수컷이고 엄청 활발해.
감당이 안 돼 너무 힘들어.,감당이 안 돼 너무 힘들어.
우리 집 옹이도 엄청나게 활발한데,우리 집 옹이도 엄청나게 활발한데
오늘 또 나오기 전에 양말 가지고 거실을 활개치고 다닌다고,오늘 또 나오기 전에 양말 가지고 거실을 활개치고 다닌다고
양말이랑 쇼파랑 피아노랑 다 뜯어놨어.,양말이랑 쇼파랑 피아노랑 다 뜯어놨어.
진짜 활발하다.,진짜 활발하다.
우리 보리는 나오기 전에 잠만 자고 있더라 부럽더라.,우리 보리는 나오기 전에 잠만 자고 있더라 부럽더라.
그 나머지 한 마린,그 나머지 한 마린
암컷 고양이 쁘니는 엄청 얌전해가지고,암컷 고양이 쁘니는 엄청 얌전해가지고
좋은데 좀 성격이 공주 같애가지고,좋은데 좀 성격이 공주 같애가지고
좀 시키는 대로 해줘야 돼서 엄청 피곤하고,좀 시키는 대로 해줘야 돼서 엄청 피곤하고
옹이를 너무 못살게 굴어서,옹이를 너무 못살게 굴어서
옹이가 스트레스 받아가지고 병원을 다녀야 돼서 좀 힘들어.,옹이가 스트레스 받아가지고 병원을 다녀야 돼서 좀 힘들어.
각자 장단점이 있는 거 같애.,각자 장단점이 있는 거 같애.
너네 집고양이 두 마리랑 우리 집고양이랑 만나게 해주고 싶다.,너네 집고양이 두 마리랑 우리 집고양이랑 만나게 해주고 싶다.
정말?,정말?
만나면 난리 날 거 같아.,만나면 난리 날 거 같아.
그런 일은 만들지 말자.,그런 일은 만들지 말자.
그래 꼭 그러자.,그래 꼭 그러자.
물고기들 이름 있어?,물고기들 이름 있어?
아니 그런 건 없어.,아니 그런 건 없어.
예전에 아빠가 어디서 회사에서 줬나 봐 그래서 몇 마리 데꼬 왔는데,예전에 아빠가 어디서 회사에서 줬나 봐 그래서 몇 마리 데리고 왔는데
아~ 진짜 계속 불어나는 거야.,아~ 진짜 계속 불어나는 거야.
암수를 그래서 분리를 해뒀는데 그냥 계속 불어나 끝이 없어.,암수를 그래서 분리를 해뒀는데 그냥 계속 불어나 끝이 없어.
그래서 친구한테도 몇 마리 줬단 말이야.,그래서 친구한테도 몇 마리 줬단 말이야.
근데 그 집에서 계속 불어나 걔네들을 어떻게 해야 될까?,근데 그 집에서 계속 불어나 걔네들을 어떻게 해야 될까?
왜 나는 안 줘?,왜 나는 안 줘?
주려고 했는데 그러게 줄껄.,주려고 했는데 그러게 줄껄.
나도 주기로 했었는데,나도 주기로 했었는데
니가 어항을 사 그럼 내가 꼭 줄게.,니가 어항을 사 그럼 내가 꼭 줄게.
근데 물고기 아무리 빨리 죽는다고 이름도 안 지어주는 건 너무 하지 않아?,근데 물고기 아무리 빨리 죽는다고 이름도 안 지어주는 건 너무 하지 않아?
너무 많다니까.,너무 많다니까.
혹시 보리 건강에 문제가 있니?,혹시 보리 건강에 문제가 있니?
어~ 보리는 약간 예전에 오줌 누는 걸 힘들어해서,어~ 보리는 약간 예전에 오줌 누는 걸 힘들어해서
요로결석이지 그게 걸렸었는데 병원에 가가 지고 한 몇 십만 원 깨졌어.,요로결석이지 그게 걸렸었는데 병원에 가가 지고 한 몇 십만 원 깨졌어.
옹이는 괜찮아?,옹이는 괜찮아?
옹이는 쁘니 때문에 너무 스트레스를 받아가지고,옹이는 쁘니 때문에 너무 스트레스를 받아가지고
맨 처음에 쁘니를 데꼬 왔을 때,맨 처음에 쁘니를 데리고 왔을 때
그 양말이랑 이불이라던 담요를 너무 뜯어먹는 거야.,그 양말이랑 이불이라던 담요를 너무 뜯어먹는 거야.
근데 먹고 그냥 끝나는 게 아니라,근데 먹고 그냥 끝나는 게 아니라
그거를 토를 하니까 내 생각엔 그거 때문에,그거를 토를 하니까 내 생각엔 그거 때문에
그 탈장이 일어나기 시작한 거 같애.,그 탈장이 일어나기 시작한 거 같애.
그 애가 너무 토를 많이 하고 밥 먹을 때마다 토하고,그 애가 너무 토를 많이 하고 밥 먹을 때마다 토하고
그리고 털도 너무 많이 빠져가지고,그리고 털도 너무 많이 빠져가지고
처음에 알레르기 검사를 해서 알레 알레르기 약을 처방을 받았었는데,처음에 알레르기 검사를 해서 알레 알레르기 약을 처방을 받았었는데
그래도 뭐 사료를 써 봐도 그렇고 효과가 없길래,그래도 뭐 사료를 써 봐도 그렇고 효과가 없길래
그래서 결국 비싼 돈 주고 사십만 원어치 건강검진을 받았지.,그래서 결국 비싼 돈 주고 사십만 원어치 건강검진을 받았지.
알고 보니까 탈장이라는 거야.,알고 보니까 탈장이라는 거야.
내 생각에는 그 탈장이 일어난 게 그 담요 먹고 양말 먹고 해서,내 생각에는 그 탈장이 일어난 게 그 담요 먹고 양말 먹고 해서
스트레스성도 있고 나는 내가 쪼금,스트레스성도 있고 나는 내가 쪼금
뭐 반인륜적으로 때린 게 아니라,뭐 반인륜적으로 때린 게 아니라
코를 때려도 바로 돌아서서,코를 때려도 바로 돌아서서
하지 말라는 짓을 하길래 그냥 몸통을 몇 대 때렸는데,하지 말라는 짓을 하길래 그냥 몸통을 몇 대 때렸는데
설마 그걸로 탈장이 걸릴까?,설마 그걸로 탈장이 걸릴까?
에~ 내가 반인륜적인지 않다는 거는,에~ 내가 반인륜적인지 않다는 거는
옹이가 나한테 얼마나 좋아 나를 얼마나 좋아하고 나한테 얼마나 매달리는지 보면 알 수 있잖아?,옹이가 나한테 얼마나 좋아 나를 얼마나 좋아하고 나한테 얼마나 매달리는지 보면 알 수 있잖아?
그래 그래서,그래 그래서
옹이는 처음에 내가 때려서,옹이는 처음에 내가 때려서
아니 때린 적도 몇 번 없지만 혼을 내서 그렇게 탈장이 걸렸나 생각했는데,아니 때린 적도 몇 번 없지만 혼을 내서 그렇게 탈장이 걸렸나 생각했는데
생각해보니까 그 담요 먹고 이런 거 때문에 토를 너무 많이 해가지고 탈장이 걸린 거 같애.,생각해보니까 그 담요 먹고 이런 거 때문에 토를 너무 많이 해가지고 탈장이 걸린 거 같애.
그래서 너무 마음이 아프네.,그래서 너무 마음이 아프네.
지금도 내가 얘가 너무 배고파 하니까 나도 모르게 사료를 쫌 많이 주게 되잖아.,지금도 내가 얘가 너무 배고파 하니까 나도 모르게 사료를 조금 많이 주게 되잖아.
사료를 쪼금이라도 쫌 초과를 하면 애가 토를 하는 거야.,사료를 쪼금이라도 조금 초과를 하면 애가 토를 하는 거야.
아~ 그거 볼 때마다 솔직히 너무,아~ 그거 볼 때마다 솔직히 너무
마음이 아프고 괴롭다.,마음이 아프고 괴롭다.
보리는 사료하니까 생각나는데 요즘 살이 너무 쪄가지고,보리는 사료하니까 생각나는데 요즘 살이 너무 쪄가지고
쫌 사료 조절을 해주고 있는데 너무 많이 계속 달라는 거야 밥을,조금 사료 조절을 해주고 있는데 너무 많이 계속 달라는 거야 밥을
그래서 시도 때도 없이 달라 그래.,그래서 시도 때도 없이 달라 그래.
그래서 내가 방에만 들어가면은 자기 밥주는 줄 알고 따라 들어와.,그래서 내가 방에만 들어가면은 자기 밥주는 줄 알고 따라 들어와.
근데 나는 밥 주는 게 아니잖아.,근데 나는 밥 주는 게 아니잖아.
그면 돌아서서 가.,그러면 돌아서서 가.
그게 쫌 너무 미안하더라고.,그게 조금 너무 미안하더라고.
근데 지가 그면 살이 찌찌 말던가.,근데 지가 그러면 살이 찌찌 말던가.
근데 확실하게 그~ 탈장 때문에 요즘 애들 사료를 쫌 나눠준단 말이야?,근데 확실하게 그~ 탈장 때문에 요즘 애들 사료를 조금 나눠준단 말이야?
병원에서 그렇게 나눠주라고 해서,병원에서 그렇게 나눠주라고 해서
근데 나눠주고 나니까,근데 나눠주고 나니까
그~ 한 번에 많이 줄 때는 애들이 살이,그~ 한 번에 많이 줄 때는 애들이 살이
솔직히 걔네들 하루 종일 집에만 있으니까,솔직히 걔네들 하루 종일 집에만 있으니까
뭐 적정량을 먹는데도 그렇게 살이 찌는 거야.,뭐 적정량을 먹는데도 그렇게 살이 찌는 거야.
그래서 병원에서 당뇨병 걸린다고 이제 나이도 많이 들었으니까 살을 빼라고 하대?,그래서 병원에서 당뇨병 걸린다고 이제 나이도 많이 들었으니까 살을 빼라고 하더라?
근데 나눠서 주니까 예전보다 더 많이 먹는데도 살이 계속 빠져가지고,근데 나눠서 주니까 예전보다 더 많이 먹는데도 살이 계속 빠져가지고
요즘 뱃살도 없어졌어.,요즘 뱃살도 없어졌어.
나눠 준 효과 있는 거 같다.,나눠 준 효과 있는 거 같다.
옹이는 어쩔 수 없이 계속 토를 하니까 쪼금씩 나눠서 많이 줄 수밖에,옹이는 어쩔 수 없이 계속 토를 하니까 쪼금씩 나눠서 많이 줄 수밖에
내가 피곤한 행동을 할 수밖에 없지만,내가 피곤한 행동을 할 수밖에 없지만
그 대신 다이어트에는 쫌 효과 있는 거 같애.,그 대신 다이어트에는 조금 효과 있는 거 같애.
걔네들 그러면 아예 밥을 다른 방에서 줘?,걔네들 그러면 아예 밥을 다른 방에서 줘?
옹이랑,옹이랑
쁘니 다른 방에서 주진 않고 그거 쁘니가 다 먹고 나서,쁘니 다른 방에서 주진 않고 그거 쁘니가 다 먹고 나서
항상 옹이 껄 뺏어 먹으러 가는데,항상 옹이 껄 뺏어 먹으러 가는데
근데 어차피 옹이는 토를 하니까,근데 어차피 옹이는 토를 하니까
그렇게 많이 먹길 원하지 않기 때문에 그냥 뺏어 먹게 냅둔다.,그렇게 많이 먹길 원하지 않기 때문에 그냥 뺏어 먹게 내버려둔다.
쁘니가 뺏어 먹는다고?,쁘니가 뺏어 먹는다고?
못 된 아이네.,못 된 아이네.
응 그냥 그렇게 뺏어 먹는 걸 냅둬.,응 그냥 그렇게 뺏어 먹는 걸 내버려둬.
옹이가 너무 많이 먹으면 안 되니까.,옹이가 너무 많이 먹으면 안 되니까.
니가 뺏어 먹어보지.,너가 뺏어 먹어보지.
그전에는 고양이나 뭐 다른 동물들 키워본 적 있나?,그전에는 고양이나 뭐 다른 동물들 키워본 적 있어?
나 동물 되게 많이 키웠지.,나 동물 되게 많이 키웠지.
예전에 강아지를 키웠는데,예전에 강아지를 키웠는데
그때 할머니 댁에 살 때였단 말이야.,그때 할머니 댁에 살 때였단 말이야.
할머니가 그때 강아지를 키우는데도 불구하고 할머니가,할머니가 그때 강아지를 키우는데도 불구하고 할머니가
뭐 이상한 국을 들고 왔어.,뭐 이상한 국을 들고 왔어.
근데 난 뭔가 느낌이 쌔한거야 기름기가 너무 많이 떠있길래,근데 난 뭔가 느낌이 쌔한거야 기름기가 너무 많이 떠있길래
그래서 난 못 먹겠다고 했는데 동생이랑 아빠는 할머니가 계속 꼬시니까 맛있다고 꼬시니까 먹었어.,그래서 난 못 먹겠다고 했는데 동생이랑 아빠는 할머니가 계속 꼬시니까 맛있다고 꼬시니까 먹었어.
근데 동생이 한 입 먹더니 너무 맛있다고,근데 동생이 한 입 먹더니 너무 맛있다고
근데 할머니가 솔직하게 개고기라고 말했는데도 동생이 맛있어서 계속 먹은 거야.,근데 할머니가 솔직하게 개고기라고 말했는데도 동생이 맛있어서 계속 먹은 거야.
그렇게 맛있나 보더라고.,그렇게 맛있나 보더라고.
개고기 나도 옛날에 엄마가 개고기 줘서 되게 많이 먹었었데.,개고기 나도 옛날에 엄마가 개고기 줘서 되게 많이 먹었었데.
근데 지금은 뭐 도저히 못 먹겠고,근데 지금은 뭐 도저히 못 먹겠고
나도 옛날에 강아지 주택 살 때 키웠었단 말이야.,나도 옛날에 강아지 주택 살 때 키웠었단 말이야.
근데 걔가 예전에 그냥 풀어놓고 키웠어 마당에 사는데,근데 걔가 예전에 그냥 풀어놓고 키웠어 마당에 사는데
그래서 아침에 자기 혼자 나갔다가 산책하고 들어와.,그래서 아침에 자기 혼자 나갔다가 산책하고 들어와.
근데 그~ 쫌 옛날에는 집 근처에 큰 개가 엄청 많았었거든?,근데 그~ 조금 옛날에는 집 근처에 큰 개가 엄청 많았었거든?
떠돌이 개들이,떠돌이 개들이
근데 걔가 하루는 들어와야 될 시간인데 안 들어오는 거야.,근데 걔가 하루는 들어와야 될 시간인데 안 들어오는 거야.
그래서 아~ 얘가 왜 안 오지 이랬는데,그래서 아~ 얘가 왜 안 오지 이랬는데
막 할머니가 막 아~ 막 강아지가 죽었다면서 그러는 거야.,막 할머니가 막 아~ 막 강아지가 죽었다면서 그러는 거야.
그래서 아~ 왜요?,그래서 아~ 왜요?
이러니까 그~ 강아지 떠돌이 개들이 그냥 그~ 개 우리 집 강아지를 물었데.,이러니까 그~ 강아지 떠돌이 개들이 그냥 그~ 개 우리 집 강아지를 물었데.
그래서 그냥 그렇게 갔지.,그래서 그냥 그렇게 갔지.
진짜 슬프네?,진짜 슬프네?
그 이후로는 그래서 강아지 좀 잘 못 키우겠더라고.,그 이후로는 그래서 강아지 좀 잘 못 키우겠더라고.
그래서 아직도 강아지는 안 키우고 고양이만 키우고 있지 물고기랑,그래서 아직도 강아지는 안 키우고 고양이만 키우고 있지 물고기랑
나 그 뒤로도 키운 거 있어 거북일 키웠는데,나 그 뒤로도 키운 거 있어 거북일 키웠는데
거북이 키울 때 토끼도 같이 키웠어.,거북이 키울 때 토끼도 같이 키웠어.
경주를 시켜봤는데 거북이가 더 빠르더라고.,경주를 시켜봤는데 거북이가 더 빠르더라고.
아니 근데 토끼 있잖아 내 친구가 키우는 거 봤거든?,아니 근데 토끼 있잖아 내 친구가 키우는 거 봤거든?
걔가 똥을 진짜 많이 싸던데 그냥 먹고 싸고 먹고 싸고 이러던데?,걔가 똥을 진짜 많이 싸던데 그냥 먹고 싸고 먹고 싸고 이러던데?
아~ 맞아 토끼는 똥을 계속 먹어야 된다고 하더라고.,아~ 맞아 토끼는 똥을 계속 먹어야 된다고 하더라고.
그래서 아~ 한 번은 학교에서 책을 펼쳤는데 토끼똥이,그래서 아~ 한 번은 학교에서 책을 펼쳤는데 토끼똥이
그~ 그~ 책 가운데 이렇게 따다다닥 있는 거야.,그~ 그~ 책 가운데 이렇게 따다다닥 있는 거야.
그래서 놀래가지고 책상 밑으로 털어냈는데 친구가 구슬인 줄 알고,그래서 놀래가지고 책상 밑으로 털어냈는데 친구가 구슬인 줄 알고
구슬치기를 하는 거야  그랬어.,구슬치기를 하는 거야  그랬어.
토끼가 근데 막 머리카락도 다 먹던데?,토끼가 근데 막 머리카락도 다 먹던데?
아~ 우리 집 토끼는 그러지 않았고 그냥 자기 똥을 엄청 많이 먹었어.,아~ 우리 집 토끼는 그러지 않았고 그냥 자기 똥을 엄청 많이 먹었어.
걔는 베란다에서 따로 키웠어 아니면 그냥 집에서 풀어 두고 키웠어?,걔는 베란다에서 따로 키웠어 아니면 그냥 집에서 풀어 두고 키웠어?
처음에 풀어두고 키웠었는데 얘가 진짜 그~ 오줌이랑 똥을,처음에 풀어두고 키웠었는데 얘가 진짜 그~ 오줌이랑 똥을
전혀 못 가린단 말이야 혼을 내도?,전혀 못 가린단 말이야 혼을 내도?
그래가지고 난 너무 어렸으니까 엄마 아빠가 감당이 안 됐나 봐.,그래가지고 난 너무 어렸으니까 엄마 아빠가 감당이 안 됐나 봐.
그래서 거북이도 감당이 안 돼서 강에 풀어주고,그래서 거북이도 감당이 안 돼서 강에 풀어주고
토끼는 정원에 키우는 엄마 제자한테,토끼는 정원에 키우는 엄마 제자한테
줘버렸어.,줘버렸어.
거북이 하니까 생각나는데 그~ 파충류?,거북이 하니까 생각나는데 그~ 파충류?
걔네들 내가 키우고 싶단 말이야.,걔네들 내가 키우고 싶단 말이야.
근데 걔네들 키우려면 돈이 진짜 많이 든다는 거야.,근데 걔네들 키우려면 돈이 진짜 많이 든다는 거야.
특히 그~ 전기세가 많이 든데.,특히 그~ 전기세가 많이 든데.
계속 햇빛을 쐬어줘야 되고 같은 온도에서 냅두고 습도도 계속 맞춰줘야 되고,계속 햇빛을 쐬어줘야 되고 같은 온도에서 내버려 두고 습도도 계속 맞춰줘야 되고
나도 뱀 키우고 싶은데 밥으로 냉동제를 줘야 된다길래,나도 뱀 키우고 싶은데 밥으로 냉동제를 줘야 된다길래
뱀은 뱀이라든가 파충류는 쫌 못 키울 것 같고,뱀은 뱀이라든가 파충류는 조금 못 키울 것 같고
너구리도 키우고 싶다 너구리나 사막 여우라든가 아니면 미어캣이라든가.,너구리도 키우고 싶다 너구리나 사막 여우라든가 아니면 미어캣이라든가.
근데 사막 여우랑 미어캣은,근데 사막 여우랑 미어캣은
그~ 사람이 키우면 엄청 스트레스를 많이 받는다더라고.,그~ 사람이 키우면 엄청 스트레스를 많이 받는다더라고.
근데 너구리는 미국에서 고양이보다 더 많이 기를 정도로 완전 애완동물로,근데 너구리는 미국에서 고양이보다 더 많이 기를 정도로 완전 애완동물로
그니까 미국식 너구리라고 라쿤이라고 있더라고.,그러니까 미국식 너구리라고 라쿤이라고 있더라고.
걔는,걔는
평범하게 많이 키우길래 나도 라쿤을 키우고 싶어.,평범하게 많이 키우길래 나도 라쿤을 키우고 싶어.
그~ 미어캣 최근에 펫 페어라고 갔다 왔단 말이야 벡스코에서 하는 거,그~ 미어캣 최근에 펫 페어라고 갔다 왔단 말이야 벡스코에서 하는 거
그거 가니까 누가 미어캣을 그냥 데꼬 있는 거야.,그거 가니까 누가 미어캣을 그냥 데리고 있는 거야.
그래서 봤는데 진짜 쪼그마낳고 귀엽더라.,그래서 봤는데 진짜 쪼그맣고 귀엽더라.
그래서 친구랑 계속 아~ 쟤 키우고 싶다 만져보고 싶다 했는데,그래서 친구랑 계속 아~ 쟤 키우고 싶다 만져보고 싶다 했는데
뭐 주인 있는 동물을 아무나 가가 지고 만지면 안 되겠지?,뭐 주인 있는 동물을 아무나 가가 지고 만지면 안 되겠지?
한 번 물어보지 한 번만 만져도 되냐고.,한 번 물어보지 한 번만 만져도 되냐고.
그러고 싶었는데 사람이 너무 많았어.,그러고 싶었는데 사람이 너무 많았어.
최근에 펫 페어 친구랑 갔다 왔는데,최근에 펫 페어 친구랑 갔다 왔는데
나는 그냥 간식 쪼금 샀거든.,나는 그냥 간식 쪼금 샀거든.
근데 걔는 십만 원어치를 사는 거야.,근데 걔는 십만 원어치를 사는 거야.
그러면서 자기는 조금 사는 거래.,그러면서 자기는 조금 사는 거래.
너무,너무
많이 사는 거 아닌가.,많이 사는 거 아닌가.
그 친구는 십만 원어치를 뭘 산 거야?,그 친구는 십만 원어치를 뭘 산 거야?
사료만 사진 않았을 거 아니야.,사료만 사진 않았을 거 아니야.
사료는 안 사고,사료는 안 사고
간식만 십만 원어치를 샀어 장난감이랑,간식만 십만 원어치를 샀어 장난감이랑
아~ 근데 장 강아지 장난감 중에 진짜 신기한 게 있는데,아~ 근데 장 강아지 장난감 중에 진짜 신기한 게 있는데
약간 그~ 강아지 코 그거 있잖아.,약간 그~ 강아지 코 그거 있잖아.
막 냄새 맡아가지고 간식 빼먹는 거?,막 냄새 맡아가지고 간식 빼먹는 거?
그 장난감인데 진짜 신기하게 생겨가지고 훌훌훌훌 이렇게 나와.,그 장난감인데 진짜 신기하게 생겨가지고 훌훌훌훌 이렇게 나와.
그~ 안에서 천이 그래서 개가 빼먹을 수 있단 말이야 진짜 신기하더라.,그~ 안에서 천이 그래서 개가 빼먹을 수 있단 말이야 진짜 신기하더라.
고양이 장난감은 그런 게 없을까?,고양이 장난감은 그런 게 없을까?
고양이 장난감 그~ 계란 그~ 박스 있잖아,고양이 장난감 그~ 계란 그~ 박스 있잖아
계란 다 먹고 삼십 구 박스에,계란 다 먹고 삼십 구 박스에
사료를 하나씩 떨어뜨려 놓으면 애기가 쫌 배고픈 상태여야 돼.,사료를 하나씩 떨어뜨려 놓으면 애기가 조금 배고픈 상태여야 돼.
그러면 그~ 빼먹으려고 손으로 계속 그거 하는데 쉽게 안 빠진단 말이야.,그러면 그~ 빼먹으려고 손으로 계속 그거 하는데 쉽게 안 빠진단 말이야.
이거 뭐지 그~ 고부해 고양이를 부탁해 그~ 야옹신?,이거 뭐지 그~ 고부해 고양이를 부탁해 그~ 야옹신?
그 사람이 알려준 건데 야옹 신 맞나?,그 사람이 알려준 건데 야옹 신 맞나?
다른 한 명인진 모르겠는데,다른 한 명인진 모르겠는데
그래서 이거를 그런 식으로 해가지고,그래서 이거를 그런 식으로 해가지고
사료로 장난감을 할 수 있다더라고.,사료로 장난감을 할 수 있다더라고.
그래서 난 그거를 가끔 쁘니한테 해.,그래서 난 그거를 가끔 쁘니한테 해.
언니도 해봐.,언니도 해봐.
근데 그~ 계란 판?,근데 그~ 계란 판?
그거 진짜 더럽다는데 깨끗이 씻어서 해야 되는데.,그거 진짜 더럽다는데 깨끗이 씻어서 해야 되는데.
계란 판을 어떻게 씻어 종인데.,계란 판을 어떻게 씻어 종인데.
거기 똥 엄청 많이 묻고 더럽다니까?,거기 똥 엄청 많이 묻고 더럽다니까?
알겠어.,알겠어.
고양이랑 추억 있어?,고양이랑 추억 있어?
맨날 집에만 있는데 추억 없는데?,맨날 집에만 있는데 추억 없는데?
밖에 데꼬 나간 적 없어?,밖에 데리고 나간 적 없어?
고양이는 밖에 데리고 나가면 죽어.,고양이는 밖에 데리고 나가면 죽어.
그래도 한 번쯤 도 없어?,그래도 한 번쯤 도 없어?
난 최근에 야생 고양이가 그~ 살덩어리가,난 최근에 야생 고양이가 그~ 살덩어리가
진짜 주먹보다 쪼금 작게?,진짜 주먹보다 쪼금 작게?
완전 뜯겨져 있는 거야 그래서 그걸 그냥 둘 수가 없잖아.,완전 뜯겨져 있는 거야 그래서 그걸 그냥 둘 수가 없잖아.
그래가지고 막 동물 병원들에 전화를 했는데 기본 육십부터 시작을 한다는 거야.,그래가지고 막 동물 병원들에 전화를 했는데 기본 육십부터 시작을 한다는 거야.
근데 그걸 내가 감당을 할 수가 없잖아.,근데 그걸 내가 감당을 할 수가 없잖아.
이게 뭐 돈 있는 사람이라고 해도 감당하기 좀 벅찰 거 같애.,이게 뭐 돈 있는 사람이라고 해도 감당하기 좀 벅찰 거 같애.
무튼 그래서 이걸 어떻게 해야 될지 몰라가지고,무튼 그래서 이걸 어떻게 해야 될지 몰라가지고
그~ 집 근처에 어떤 카페가 있는데 그 카페 사장님이,그~ 집 근처에 어떤 카페가 있는데 그 카페 사장님이
고양이를 스무 마리나 기달 기들 기른단 말이야?,고양이를 스무 마리나 기달 기들 기른단 말이야?
그래서 그~ 사장님한테 가가 지고 어떻게 해야 되냐고 물어봤더니,그래서 그~ 사장님한테 가가 지고 어떻게 해야 되냐고 물어봤더니
고양이들은 싸우면 자주 살갗이 많이 뜯기는데,고양이들은 싸우면 자주 살갗이 많이 뜯기는데
그냥 내버려 두면 그~ 커다란 살갗 뜯긴 게 아서 아문다는 거야.,그냥 내버려 두면 그~ 커다란 살갗 뜯긴 게 알아서 아문다는 거야.
근데 신기하게 며칠 지나니까 진짜 살이 다 새 살이 돋아나있더라고.,근데 신기하게 며칠 지나니까 진짜 살이 다 새 살이 돋아나있더라고.
그래서 수술했으면 진짜 돈만 날릴 뻔했다 이런 생각이 들더라.,그래서 수술했으면 진짜 돈만 날릴 뻔했다 이런 생각이 들더라.
