사투리,표준어
너 근데 자율 주행 자동차가 요즘 또 많이 보급되고 있잖아 근데 그게 고속도로 같은 쫌 빠른 시속이 백 키로 정도 되는 돼서도 자율 주행이 되다가,너 근데 자율 주행 자동차가 요즘 또 많이 보급되고 있잖아 근데 그게 고속도로 같은 조금 빠른 시속이 백 키로 정도 되는 돼서도 자율 주행이 되다가
만약에 그게 오류가 나서 차선을 이탈을 한다면 엄청나게 큰 사고가 일어날 거 같은데 너는 고속도로 이런 데에서도 자율 주행이 꼭 필요하다고 봐?,만약에 그게 오류가 나서 차선을 이탈을 한다면 엄청나게 큰 사고가 일어날 거 같은데 너는 고속도로 이런 데에서도 자율 주행이 꼭 필요하다고 봐?
근데 자율 주행을 한다는 게 그 좌석에 그 사람이 없이 운전을 하는 걸 텐데 고속도로에만 다시 사람이 앉아가지고 속도를 밟고 하는 게,근데 자율 주행을 한다는 게 그 좌석에 그 사람이 없이 운전을 하는 걸 텐데 고속도로에만 다시 사람이 앉아가지고 속도를 밟고 하는 게
될진 잘 모르겠거든 그리고 로봇이 막 자율 주행을 할 때 막 이 도로에서는 막 몇 키로를 달렸다 저 도로에서 또 몇 키로를 달렸다 이런 건 또 안 될 거 같단 말이야 내가 아직,될진 잘 모르겠거든 그리고 로봇이 막 자율 주행을 할 때 막 이 도로에서는 막 몇 키로를 달렸다 저 도로에서 또 몇 키로를 달렸다 이런 건 또 안 될 거 같단 말이야 내가 아직
자동차에 관심이 없다 보니까 막 고속도로에서는 약간 백 키로 이상 달려야 되잖아 진짜 그 자율 주행 자동차가 상용화되면 진짜,자동차에 관심이 없다 보니까 막 고속도로에서는 약간 백 키로 이상 달려야 되잖아 진짜 그 자율 주행 자동차가 상용화되면 진짜
고속도로에서 백 키로 달리고 뭐~ 하이패스 거기 지나갈 때는 쫌 낮췄다가 뭐~ 이렇게 속도를 자유자제로 제한을 할 수 있냐가 난 잘 모르겠거든 넌 어떻게 생각해?,고속도로에서 백 키로 달리고 뭐~ 하이패스 거기 지나갈 때는 조금 낮췄다가 뭐~ 이렇게 속도를 자유자제로 제한을 할 수 있냐가 난 잘 모르겠거든 넌 어떻게 생각해?
나도 완전한 자율 주행 자동차는 솔직히 얘기하면,나도 완전한 자율 주행 자동차는 솔직히 얘기하면
만들어질 수 없다고 보거든 왜냐면 하이패스를 예로 들면은 고속도로 백 키로를 달리다가 하이패스에서 약간 멈춰야 되는 구간이 있는데 거기서는 이제 어떻게 그거를 속도를 조절할 거냐며 이제 또 그냥,만들어질 수 없다고 보거든 왜냐면 하이패스를 예로 들면은 고속도로 백 키로를 달리다가 하이패스에서 약간 멈춰야 되는 구간이 있는데 거기서는 이제 어떻게 그거를 속도를 조절할 거냐며 이제 또 그냥
그냥 시내를 달릴 때는 사람도 많이 다닐 거고 주변에 그리고 뭐~ 장애물도 엄청 많을 거기 때문에 그 약간 운전을,그냥 시내를 달릴 때는 사람도 많이 다닐 거고 주변에 그리고 뭐~ 장애물도 엄청 많을 거기 때문에 그 약간 운전을
자세하게 약간 좀 세밀 세심하게 할 필요가 있다고 생각해서 아무래도 반자율 주행 자동차까지 보급화되는 게 가장 나을 거 같은데 어~ 만약에,자세하게 약간 좀 세밀 세심하게 할 필요가 있다고 생각해서 아무래도 반자율 주행 자동차까지 보급화되는 게 가장 나을 거 같은데 어~ 만약에
너가 원하는 벤츠에서 자율 주행차가 나온다고 하면은 살 의향이 있어?,너가 원하는 벤츠에서 자율 주행차가 나온다고 하면은 살 의향이 있어?
나는 약간 아직 운전을 안 해봐선 잘 모르겠지만,나는 약간 아직 운전을 안 해봐선 잘 모르겠지만
내가 직접 운전을 해가지고 어디에 약간 도착하고 약간 장거리 운전하면 몇 시간 이렇게 운전해가지고  가는 그런 힘듬이 있잖아 그까 운전을 안 해봐서 잘 모르겠지만 자율 주행 자동차가 생겨도 나는 거의 내가 운전을 하고 어디를 갈 거 같고,내가 직접 운전을 해가지고 어디에 약간 도착하고 약간 장거리 운전하면 몇 시간 이렇게 운전해가지고  가는 그런 힘듬이 있잖아 그까 운전을 안 해봐서 잘 모르겠지만 자율 주행 자동차가 생겨도 나는 거의 내가 운전을 하고 어디를 갈 거 같고
막 자율 주행차가 생긴다면 그냥 버스나 지하철 택시 타고 다니는 게,막 자율 주행차가 생긴다면 그냥 버스나 지하철 택시 타고 다니는 게
더 낫지 뭐 하러 굳이 운전도 안 할 거면서 자동차를 타고 다니나란 생각이 든단 말이야 차라리 차 살 돈으로 그냥 택시 지하철,더 낫지 뭐 하러 굳이 운전도 안 할 거면서 자동차를 타고 다니나란 생각이 든단 말이야 차라리 차 살 돈으로 그냥 택시 지하철
택시비가 비싸잖아 요즘 차라리 그 돈으로 택시를 더 타고 다니는 게 낫지 않나 싶기도 하고 그런 생각이 들어서 자율 주행 자동차가 나와도,택시비가 비싸잖아 요즘 차라리 그 돈으로 택시를 더 타고 다니는 게 낫지 않나 싶기도 하고 그런 생각이 들어서 자율 주행 자동차가 나와도
딱히 사고 싶은 생각이 없을 거 같애 너는 그런 차를 살 의향이 있나 봐?,딱히 사고 싶은 생각이 없을 거 같애 너는 그런 차를 살 의향이 있나 봐?
어~ 만약에 옵션이 다 적용되지 않은 자율 주행차가,어~ 만약에 옵션이 다 적용되지 않은 자율 주행차가
삼천만 원대는 적당한 거 같은데 오천만 원대부터는 약간 쓸모가 없지 않나 싶어,삼천만 원대는 적당한 거 같은데 오천만 원대부터는 약간 쓸모가 없지 않나 싶어
왜냐면 아무래도 사람을 편하게 해주는 거는 자율 주행뿐만 아니라 옵션들일 건데 만약어 예를 들어서,왜냐면 아무래도 사람을 편하게 해주는 거는 자율 주행뿐만 아니라 옵션들일 건데 만약어 예를 들어서
어~ 우리가 휴대폰을 충전을 한다거나 뭐~ 그런 식으로 이제 에이아이,어~ 우리가 휴대폰을 충전을 한다거나 뭐~ 그런 식으로 이제 에이아이
그런 빅스비 같은 그게 들어 있는 옵션이 없고 오로지 그낭 자율 주행만 된다고 치면,그런 빅스비 같은 그게 들어 있는 옵션이 없고 오로지 그낭 자율 주행만 된다고 치면
그건 솔직히 필요가 없다고 보거든 너는,그건 솔직히 필요가 없다고 보거든 너는
어느 정도 가격에 선에서 자율 주행차를 일케 나오는 게 중요하다고 생각해?,어느 정도 가격에 선에서 자율 주행차를 이렇게 나오는 게 중요하다고 생각해?
근데 나는 자율 주행 자동차가 나오면 일단 가격이 싸진 않을 거 같단 말이야.,근데 나는 자율 주행 자동차가 나오면 일단 가격이 싸진 않을 거 같단 말이야.
근데 내가 기사에서 봤는데 자율 주행 자동차가 오 단계까지가 되면 운전석이 아예 사라진다고 들었거든 그러면 니가 아까 말한 거처럼 뭐~ 고속도로에서는 다시 사람이 뭐~ 밟아가지고 속도를 더 내 거나 쭐이거나 한다는 게 불가능해지고,근데 내가 기사에서 봤는데 자율 주행 자동차가 오 단계까지가 되면 운전석이 아예 사라진다고 들었거든 그러면 너가 아까 말한 거처럼 뭐~ 고속도로에서는 다시 사람이 뭐~ 밟아가지고 속도를 더 내 거나 줄이거나 한다는 게 불가능해지고
뭐~ 운전석이 없다 보니깐 사람이 약간 그 공간을 더 활용할 수 있을 거란 말이야 그런 장점이 있긴 한데,뭐~ 운전석이 없다 보니깐 사람이 약간 그 공간을 더 활용할 수 있을 거란 말이야 그런 장점이 있긴 한데
우리가 만약에 자율 주행차가 된다면 오 단계부터 나올 거 아니야 무인 자동차로 그러면 운전석까지 없게 되니까 누구는 자율 주행 자동차 누구는 운전석 이렇게 하면 솔직히 쫌,우리가 만약에 자율 주행차가 된다면 오 단계부터 나올 거 아니야 무인 자동차로 그러면 운전석까지 없게 되니까 누구는 자율 주행 자동차 누구는 운전석 이렇게 하면 솔직히 조금
불편할 거 같단 말이야 누구 차에는 사람이 없어 앞에 또 누구 차에는 사람이 있어 그러면 또 쫌 아니잖아 그니까 모두가 탈 거면 다 자율 주행 자동차로 바껴야 한다고 생각하거든 넌 어떻게 생각해?,불편할 거 같단 말이야 누구 차에는 사람이 없어 앞에 또 누구 차에는 사람이 있어 그러면 또 조금 아니잖아 그러니까 모두가 탈 거면 다 자율 주행 자동차로 바뀌어야 한다고 생각하거든 넌 어떻게 생각해?
나도 어~ 양쪽 모두가 다 자율 주행이어야 된다고 생각하는 게 왜냐면 기계랑 사람의 생각은 같을 수가 없단 말이야 그래가지고,나도 어~ 양쪽 모두가 다 자율 주행이어야 된다고 생각하는 게 왜냐면 기계랑 사람의 생각은 같을 수가 없단 말이야 그래가지고
기계가 행동하는 그거랑,기계가 행동하는 그거랑
사람이 행동하는 거는 아예 완전히 다르기 때문에 기계랑 기계는 만나야 된다고 생각하는데 근데 그게 주차도 돼?,사람이 행동하는 거는 아예 완전히 다르기 때문에 기계랑 기계는 만나야 된다고 생각하는데 근데 그게 주차도 돼?
