사투리,표준어
님은,님은
지금 자라오시면서 혹시 부모님으로부터 어떤 가훈이나 많이 영향받은 가치관 있으신가요?,지금 자라오시면서 혹시 부모님으로부터 어떤 가훈이나 많이 영향받은 가치관 있으신가요?
어~ 저 같은 경우는 집에 가훈이라던가 이런 건 딱히 없고,어~ 저 같은 경우는 집에 가훈이라던가 이런 건 딱히 없고
부모님한테도 딱히 영향받은 그런 명언이나 이런 건 딱히 없는 거 같고,부모님한테도 딱히 영향받은 그런 명언이나 이런 건 딱히 없는 거 같고
최근에 느낀 가훈 가훈은 아니고 명언 명언이라고 하기엔 너무 과격한 단어긴 한데 요새 쫌,최근에 느낀 가훈 가훈은 아니고 명언 명언이라고 하기엔 너무 과격한 단어긴 한데 요새 조금
매우 와닿는 그런 말이 있거든요 예 이게 정말 진자 과격하긴 한데,매우 와닿는 그런 말이 있거든요 예 이게 정말 진자 과격하긴 한데
마이클 타이슨이라는 사람이 했던 말 중에 누구나 그럴싸한 계획을 갖고 있다.,마이클 타이슨이라는 사람이 했던 말 중에 누구나 그럴싸한 계획을 갖고 있다.
그분이 복서시거든요 누구나 그럴싸한 계획을 갖고 있다 나한테 맞기 전까지는 이런 말을 한 사람인데,그분이 복서시거든요 누구나 그럴싸한 계획을 갖고 있다 나한테 맞기 전까지는 이런 말을 한 사람인데
그거에 대해서 제가 요새 진짜 많이 하거든요 사람들이 뭐든,그거에 대해서 제가 요새 진짜 많이 하거든요 사람들이 뭐든
그~ 뭐 공부를 하든 뭐~ 계획을 세우든 아니면 새로 인간관계를 맺든 이러기 전에 대충 아 오늘 나는 대충 이렇게 이렇게 해야겠다라고 생각을 하잖아요.,그~ 뭐 공부를 하든 뭐~ 계획을 세우든 아니면 새로 인간관계를 맺든 이러기 전에 대충 아 오늘 나는 대충 이렇게 이렇게 해야겠다라고 생각을 하잖아요.
그런데 막상,그런데 막상
그 사 상황,그 사 상황
그~ 문제에 직면하게 되면 진짜,그~ 문제에 직면하게 되면 진짜
그냥 자기가 생각하던 거보다 전혀 다르게만 흘러가거든요 그래가지고 저는,그냥 자기가 생각하던 거보다 전혀 다르게만 흘러가거든요 그래가지고 저는
저한테 가장 뭐랄까 영향 있거나 요새 느끼는 거는 진짜 아까 말했던,저한테 가장 뭐랄까 영향 있거나 요새 느끼는 거는 진짜 아까 말했던
그~,그~
명언이 명언이라고 해야 하나 했던 말이 저한테 요새 너무,명언이 명언이라고 해야 하나 했던 말이 저한테 요새 너무
크게 다가와요 그래서 그럼,크게 다가와요 그래서 그럼
음~  씨는 혹시 요새 가치관이나 이런 거에 영향을 줄 정도로 했던 명언이나 아니면 뭐~ 유명인들의 말이 따로 있나요?,음~  씨는 혹시 요새 가치관이나 이런 거에 영향을 줄 정도로 했던 명언이나 아니면 뭐~ 유명인들의 말이 따로 있나요?
저는 명언이나 유명인들이라기보다는,저는 명언이나 유명인들이라기보다는
지금 상황이 저한테 영향을 쫌 많이 준 거 같애요 지금 사실 코로나 때문에 다 힘들잖아요.,지금 상황이 저한테 영향을 조금 많이 준 거 같애요 지금 사실 코로나 때문에 다 힘들잖아요.
저는 올해가 이렇게 발목 잡히는 한 해가 될지 정말 몰랐거든요.,저는 올해가 이렇게 발목 잡히는 한 해가 될지 정말 몰랐거든요.
뭔가 계획을 아무리 세웠어도 실행할 수 있는 환경이 안 되면,뭔가 계획을 아무리 세웠어도 실행할 수 있는 환경이 안 되면
안 되는 거구나 이걸 되게 많이 깨달았어요 그래서 저는,안 되는 거구나 이걸 되게 많이 깨달았어요 그래서 저는
현재를 즐기는 거를,현재를 즐기는 거를
제 인생에서 처음으로 생각하게 됐거든요.,제 인생에서 처음으로 생각하게 됐거든요.
저는 원래 항상 약간 미래에 대한 고민이나,저는 원래 항상 약간 미래에 대한 고민이나
과거에 대한 후회나 이런 거를 더 많이 생각하는 사람이고,과거에 대한 후회나 이런 거를 더 많이 생각하는 사람이고
미래에 대한 계획을 더 많이 세우는 사람이었는데,미래에 대한 계획을 더 많이 세우는 사람이었는데
올해는 계획대로 된 게 하나도 없어요.,올해는 계획대로 된 게 하나도 없어요.
휴가도 제대로 못 갔고 해외여행도 못 갔고,휴가도 제대로 못 갔고 해외여행도 못 갔고
어~ 회사 같은 경우도 너무 분위기가 많이 바꼈고,어~ 회사 같은 경우도 너무 분위기가 많이 바뀌었고
제가 생각한 대로 흘러간 게 하나도 없더라고요.,제가 생각한 대로 흘러간 게 하나도 없더라고요.
그래서 저는 일단 코로나가 끝나면 여행부터 갈 거예요 왜냐면,그래서 저는 일단 코로나가 끝나면 여행부터 갈 거예요 왜냐면
정말 계획하고,정말 계획하고
간절히 바랬는데 하지 못했고 또 그거를 내년이 막상 왔을 때 아 다음에 뭐~ 비행기값 떨어지면 가야지.,간절히 바랬는데 하지 못했고 또 그거를 내년이 막상 왔을 때 아 다음에 뭐~ 비행기값 떨어지면 가야지.
아 다음에 돈 더 모이면 가야지 그 호텔이 뭐~ 되면 가야지.,아 다음에 돈 더 모이면 가야지 그 호텔이 뭐~ 되면 가야지.
이런 생각을 더 이상 하지 않고 현재를 즐겨서 그때 바로바로 실행하는 게,이런 생각을 더 이상 하지 않고 현재를 즐겨서 그때 바로바로 실행하는 게
생각보다 중요한 거구나 약간 이런 생각을 많이 하게 됐어요.,생각보다 중요한 거구나 약간 이런 생각을 많이 하게 됐어요.
그리고 제가 요새 쫌 제 전체 인생 적으로 약간,그리고 제가 요새 조금 제 전체 인생 적으로 약간
변화고 있는 거는 원래 저는 되게 제 중심적인 삶을 많이 살았었는데 근데,변화고 있는 거는 원래 저는 되게 제 중심적인 삶을 많이 살았었는데 근데
나이가 들면서 올해 이제 결혼 아 결혼한 지 한 이삼 년 됐는데 결혼하고 나서 생긴 게,나이가 들면서 올해 이제 결혼 아 결혼한 지 한 이삼 년 됐는데 결혼하고 나서 생긴 게
아 내가 남을 약간 위해서 사는 게 오히려 내가 더 행복한 삶일 수 있겠다 이런 생각을 쫌 많이 했거든요.,아 내가 남을 약간 위해서 사는 게 오히려 내가 더 행복한 삶일 수 있겠다 이런 생각을 조금 많이 했거든요.
제가 행복 이런 거에 되게 집착하는 타입인데,제가 행복 이런 거에 되게 집착하는 타입인데
내가 행복할라고 하니까는 그 행복이 저한테 굴러들어오지는 않더라고요 근데,내가 행복할라고 하니까는 그 행복이 저한테 굴러들어오지는 않더라고요 근데
제가 언제 기분이 좋냐 이렇게 생각했는데 어~ 집들이를 한다던지 친구한테 선물을 한다던지 이랬을 때 오히려 제가 더 기분이 좋은 걸 좀 깨달았고,제가 언제 기분이 좋냐 이렇게 생각했는데 어~ 집들이를 한다던지 친구한테 선물을 한다던지 이랬을 때 오히려 제가 더 기분이 좋은 걸 좀 깨달았고
남편이랑도 그런 부분이 쫌 많이 맞아서,남편이랑도 그런 부분이 조금 많이 맞아서
아 우리가 나중에 애를 키우거나 혹은 지금부터 우리의 삶은 쫌 나 중심이 아니라 약간,아 우리가 나중에 애를 키우거나 혹은 지금부터 우리의 삶은 조금 나 중심이 아니라 약간
현자 같기도 하지만 남한테 더,현자 같기도 하지만 남한테 더
남들이 더 행복하게 해주는 삶을 사는 게 나도 행복하고 남도 행복한 삶이 될 수 있겠다 이런 생각을 쫌 많이 하고 있어요.,남들이 더 행복하게 해주는 삶을 사는 게 나도 행복하고 남도 행복한 삶이 될 수 있겠다 이런 생각을 조금 많이 하고 있어요.
혹시  님은,혹시  님은
지금 살아오시면서,지금 살아오시면서
이렇게 이것만은 내가 꼭 지켜야지 하는 고집스러운 가치관이랑,이렇게 이것만은 내가 꼭 지켜야지 하는 고집스러운 가치관이랑
혹시 앞으로도,혹시 앞으로도
내가 이렇게 앞으로 이렇게 살고 싶어 하는 그런 목표나 가치관이 있으신가요?,내가 이렇게 앞으로 이렇게 살고 싶어 하는 그런 목표나 가치관이 있으신가요?
어~ 저 같은 경우는 아직 솔직하게 말해서 제 스스로도,어~ 저 같은 경우는 아직 솔직하게 말해서 제 스스로도
막 기차관이 이렇게 확 적립이 됐다고 생각 안 하거든요 전 일단 지금 학스 지금 대학생이긴 한데,막 기차관이 이렇게 확 적립이 됐다고 생각 안 하거든요 전 일단 지금 학스 지금 대학생이긴 한데
어~ 저도 요새 요새는 뭐~ 하도 좋은 이야기든 뭐~ 이런 것도 유튜브나 이런 거를 통해서 정말 많이 받아들일 수 있잖아요 그래가지고,어~ 저도 요새 요새는 뭐~ 너무 좋은 이야기든 뭐~ 이런 것도 유튜브나 이런 거를 통해서 정말 많이 받아들일 수 있잖아요 그래가지고
그런 생각을 정말 많이 하거든요 어 이 이~,그런 생각을 정말 많이 하거든요 어 이 이~
분명히 성향이 다른 두 사람에 강의를 들어도 어 이 사람 말을 들으면은 어 이 사람 말 두 두 분 다 뭐~ 명사시니까 말을 잘하고 이쪽 성향 분도 말을 잘하시니까,분명히 성향이 다른 두 사람에 강의를 들어도 어 이 사람 말을 들으면은 어 이 사람 말 두 두 분 다 뭐~ 명사시니까 말을 잘하고 이쪽 성향 분도 말을 잘하시니까
어 이 사람 말도 맞는 거 같고 이 사람 말도 맞는 거 같고,어 이 사람 말도 맞는 거 같고 이 사람 말도 맞는 거 같고
전혀 성향이 다른데 이런 걸 듣다 보니까 제가 어느 순간 이런 생각이 드는 거예요 어 이거는 그냥 저분들이 말을 잘해가지고 내가 저걸 공감하는지 아니면 내가 진짜로,전혀 성향이 다른데 이런 걸 듣다 보니까 제가 어느 순간 이런 생각이 드는 거예요 어 이거는 그냥 저분들이 말을 잘해가지고 내가 저걸 공감하는지 아니면 내가 진짜로
저 사람들 말을 공감하는지 이게 헷갈리게 되는 거예요.,저 사람들 말을 공감하는지 이게 헷갈리게 되는 거예요.
그래가지고 저는 솔직히 말해서 제 주관이랄까 이게 아직 뚜렸하다고 생각은 안 하거든요 근데 그거 하나는 있는 거 같애요 뭔가 진짜,그래가지고 저는 솔직히 말해서 제 주관이랄까 이게 아직 뚜렸하다고 생각은 안 하거든요 근데 그거 하나는 있는 거 같애요 뭔가 진짜
이거는 제가 못 해가지고 그런 건데,이거는 제가 못 해가지고 그런 건데
제가 말이 정말 많거든요 근데,제가 말이 정말 많거든요 근데
말이 많아서 듣는 소리 중에 제발 모르는데 아는 척하지 말라던가 어 이런 소리를 많이 들었어요 그래서 진짜,말이 많아서 듣는 소리 중에 제발 모르는데 아는 척하지 말라던가 어 이런 소리를 많이 들었어요 그래서 진짜
아는 것만 사람들이 모르는 것도 근데 주변에서 이야기하고 있으면 막 이야기 끼고 싶기도 하고 어 그거 뭔가 한 번 들어본 거 같은데 하면서 말하고 싶잖아요 그래서 걍,아는 것만 사람들이 모르는 것도 근데 주변에서 이야기하고 있으면 막 이야기 끼고 싶기도 하고 어 그거 뭔가 한 번 들어본 거 같은데 하면서 말하고 싶잖아요 그래서 그냥
그거에 대해서 모르는 거에 대해서 말을 쫌 아끼고 자신이 아는 것에 대해서만 이렇게 이야기,그거에 대해서 모르는 거에 대해서 말을 조금 아끼고 자신이 아는 것에 대해서만 이렇게 이야기
할려고 노력을 하는데 솔직히 아직도,할려고 노력을 하는데 솔직히 아직도
말하는 거 좋아하기도 해서 잘 이게 고쳐지진 정말 않는 거 같애요 진짜 아직도 하다가 어~ 저거 어디서 들어본 거 같은데 이런 소리 들으면 뭔가 가서,말하는 거 좋아하기도 해서 잘 이게 고쳐지진 정말 않는 거 같애요 진짜 아직도 하다가 어~ 저거 어디서 들어본 거 같은데 이런 소리 들으면 뭔가 가서
같이 이야기하고 싶고 이런 생각이 너무 많이 들어가지고 어~,같이 이야기하고 싶고 이런 생각이 너무 많이 들어가지고 어~
근데 앞으로 살아가면서 진짜 그거는,근데 앞으로 살아가면서 진짜 그거는
꼭 해야 할 거 같애요 자기 모르는 거에 대해서는 진짜 말 최대한 안 하고 그래야 뭐랄까,꼭 해야 할 거 같애요 자기 모르는 거에 대해서는 진짜 말 최대한 안 하고 그래야 뭐랄까
망신도 안 당할 거 같고 뭔가 진짜 진짜 알면서 조용히 하고 있는 사람들이 들으면 뭔가,망신도 안 당할 거 같고 뭔가 진짜 진짜 알면서 조용히 하고 있는 사람들이 들으면 뭔가
같잖아할 수도 있잖아요 그래가지고 그런 거에 대해서 진짜 조심히 할 생각이에요.,같잖아할 수도 있잖아요 그래가지고 그런 거에 대해서 진짜 조심히 할 생각이에요.
어~ 저는 아직 학생이라서 그런데 그~  씨 이제,어~ 저는 아직 학생이라서 그런데 그~  씨 이제
결혼하셨다고 했잖아요 그래가지고 삶에 태도적인 측면에서 아까 대충,결혼하셨다고 했잖아요 그래가지고 삶에 태도적인 측면에서 아까 대충
이야기하신 거 보니까 현재를 살짝 즐기고 이렇게 베푸는 거 하니까 삶에 태도가 살짝 뭐랄까,이야기하신 거 보니까 현재를 살짝 즐기고 이렇게 베푸는 거 하니까 삶에 태도가 살짝 뭐랄까
어~ 흔히 요새 어~,어~ 흔히 요새 어~
워라밸이 워라밸 맞나 아무튼 그 일과,워라밸이 워라밸 맞나 아무튼 그 일과
그~ 자기의 행복 그~ 사이에서 적당한,그~ 자기의 행복 그~ 사이에서 적당한
그 밸런스를 갖춰야 한다고 하잖요 근데 엄청 근데,그 밸런스를 갖춰야 한다고 하잖요 근데 엄청 근데
사람이 언제 한 번쯤은 삶을 진짜 완전 몰입해가지고 내가 이 일이 진짜 막 일에 미칠 정도로 해서 그런 집중적인 시기가 필요하잖요.,사람이 언제 한 번쯤은 삶을 진짜 완전 몰입해가지고 내가 이 일이 진짜 막 일에 미칠 정도로 해서 그런 집중적인 시기가 필요하잖요.
그런 시기가,그런 시기가
언제 해야 할까요 솔직하게 나중에 그렇게 하면은 진짜 그렇게 달리고 달리기만 하면 진짜 사람이 지치고 힘들 거 아니에요.,언제 해야 할까요 솔직하게 나중에 그렇게 하면은 진짜 그렇게 달리고 달리기만 하면 진짜 사람이 지치고 힘들 거 아니에요.
근데 결혼하셨으니까 나이도 어느 정도 있을 거 같고 저는 학생이고 아직 딱히 삶의 태도를 벌써부터 살짝,근데 결혼하셨으니까 나이도 어느 정도 있을 거 같고 저는 학생이고 아직 딱히 삶의 태도를 벌써부터 살짝
이렇게 뭐~ 그까 아 쫌 여유롭게 살고 싶은데 이러면은 저는 아직,이렇게 뭐~ 그러니까 아 조금 여유롭게 살고 싶은데 이러면은 저는 아직
안 될 거 같은데 그걸 원하긴 하거든요 앞으로도 더 이렇게,안 될 거 같은데 그걸 원하긴 하거든요 앞으로도 더 이렇게
빡세게 해야 하나 이런 생각 들고 그래서,빡세게 해야 하나 이런 생각 들고 그래서
지금 이렇게 빡세게 살아야 할까요 이런 거에 대해서,지금 이렇게 빡세게 살아야 할까요 이런 거에 대해서
묻고 싶어요.,묻고 싶어요.
어~ 저는 일단은 아직 학생이시면 취업하고 나서를 제일 열심히 사셔야 된다고 생각을 해요.,어~ 저는 일단은 아직 학생이시면 취업하고 나서를 제일 열심히 사셔야 된다고 생각을 해요.
저도 결혼하긴 했지만 나이가 아직 엄청 많진 않거든요.,저도 결혼하긴 했지만 나이가 아직 엄청 많진 않거든요.
그리고 저랑 저희 남편은 집에서 있을 때나,그리고 저랑 저희 남편은 집에서 있을 때나
이제 일과 분리가 됐을 때는 아까 말씀드렸듯이 베푸는 삶이나 즐기는 삶을 살고자 하지만,이제 일과 분리가 됐을 때는 아까 말씀드렸듯이 베푸는 삶이나 즐기는 삶을 살고자 하지만
저는 일할 때는 사실 워라밸을 별로,저는 일할 때는 사실 워라밸을 별로
못 지키는 타입이기도 하구요.,못 지키는 타입이기도 하구요.
일을 잘할려면 일에 몰두를 해야 된다고 생각해요.,일을 잘할려면 일에 몰두를 해야 된다고 생각해요.
사실 물론 워라밸 너무 중요하고 자기 삶도 있어야 되는 거 맞긴 한데,사실 물론 워라밸 너무 중요하고 자기 삶도 있어야 되는 거 맞긴 한데
회사를 처음 들어온 사람이 그런 워라밸을 지킬려고 하면은,회사를 처음 들어온 사람이 그런 워라밸을 지킬려고 하면은
너무 힘들 거 같애요.,너무 힘들 거 같애요.
왜냐면 나는 아직 이 회사에서 도움이 되거나 보탬이 되는 사람이 아니고,왜냐면 나는 아직 이 회사에서 도움이 되거나 보탬이 되는 사람이 아니고
회사는 학교가 아니잖아요 회사는 뭔갈 도,회사는 학교가 아니잖아요 회사는 뭔갈 도
배 가르켜 주는 곳이 아니란 말이에요 나도 회사에 가치 창출에 도움이 돼야 되고 그 댓가에 대해서 회사가 저한테 보상을 해주는 거라고 전 생각을 하는데,배 가르켜 주는 곳이 아니란 말이에요 나도 회사에 가치 창출에 도움이 돼야 되고 그 댓가에 대해서 회사가 저한테 보상을 해주는 거라고 전 생각을 하는데
처음부터 저도 어~ 매일 칼퇴할 거야 난 딱 출근 시간 땡하고 들어 올 거야 이렇게,처음부터 저도 어~ 매일 칼퇴할 거야 난 딱 출근 시간 땡하고 들어 올 거야 이렇게
저는 입사 초기 때 그렇게 한 적이 있었어요 근데,저는 입사 초기 때 그렇게 한 적이 있었어요 근데
그렇게 하니까 저한테 손해인 게 제가 힘들어요.,그렇게 하니까 저한테 손해인 게 제가 힘들어요.
왜냐면 뭐 하나라도 더 챙길려고 생각을 하다 보니까,왜냐면 뭐 하나라도 더 챙길려고 생각을 하다 보니까
제가 더 힘들더라고요 차라리 뭐~ 아 그래 내 좀 일찍 와서 차 한 잔 묵자 어~ 뭐 오늘 하던 거까지만 하고 가자 이렇게 생각하는 게 저한테도 좋은데,제가 더 힘들더라고요 차라리 뭐~ 아 그래 내 좀 일찍 와서 차 한 잔 먹자 어~ 뭐 오늘 하던 거까지만 하고 가자 이렇게 생각하는 게 저한테도 좋은데
아 땡 땡 언제 하지 땡 하면 가야 되는데,아 땡 땡 언제 하지 땡 하면 가야 되는데
이 생각을 하니까 저가 너무 힘들더라고요 제가 힘들더라고요.,이 생각을 하니까 저가 너무 힘들더라고요 제가 힘들더라고요.
그래서 저는 첫 번째 회사 때 제 모습을 돌아보면 쪼끔,그래서 저는 첫 번째 회사 때 제 모습을 돌아보면 쪼끔
아 너무 별로였다 이렇게 생각을 할 때도 있구요.,아 너무 별로였다 이렇게 생각을 할 때도 있구요.
근데 저는 그 이후로 회사 쪽에서 제가 좀 많이 들은 게,근데 저는 그 이후로 회사 쪽에서 제가 좀 많이 들은 게
제가 약간 주인의식이 있는 편이에요 제가 하는 일에 대해서는,제가 약간 주인의식이 있는 편이에요 제가 하는 일에 대해서는
제가 모르는 게 없어야 된다고 생각을 하거든요 그래서,제가 모르는 게 없어야 된다고 생각을 하거든요 그래서
진짜 엄청 열심히 하고 그 대신,진짜 엄청 열심히 하고 그 대신
사장님한테도 그러니까 오히려 요구를 할 수 있는 거예요 나 이 일 하고 싶은데 이렇게 이렇게 해달라.,사장님한테도 그러니까 오히려 요구를 할 수 있는 거예요 나 이 일 하고 싶은데 이렇게 이렇게 해달라.
나 이 일 진행하고 싶다 진행해봐도 되겠냐 이런 거를 하면서 오히려 성취감을 정말 많이 얻었었거든요.,나 이 일 진행하고 싶다 진행해봐도 되겠냐 이런 거를 하면서 오히려 성취감을 정말 많이 얻었었거든요.
그래서 저는  님이 언제 열심히 살아야 되냐라고 한다면 이십 대 후반 사회 초년생에서,그래서 저는  님이 언제 열심히 살아야 되냐라고 한다면 이십 대 후반 사회 초년생에서
사실 평생을 열심히 살긴 해야 되지만 특히 사회 초년생 때는 워라밸보다는,사실 평생을 열심히 살긴 해야 되지만 특히 사회 초년생 때는 워라밸보다는
어~ 내가 내 일에 주인의식을 가지고 그 일을 정말 사실 취업 준비하는 거 너무 힘들잖아요 그러니까 그 일을,어~ 내가 내 일에 주인의식을 가지고 그 일을 정말 사실 취업 준비하는 거 너무 힘들잖아요 그러니까 그 일을
이렇게 힘들었던 만큼 내가 진짜 잘해보리라 열심히 해보리라 약가 요런 마음으로 하면은,이렇게 힘들었던 만큼 내가 진짜 잘해보리라 열심히 해보리라 약가 요런 마음으로 하면은
아마 스스로도 행복하지 않을까라고 저는 생각을 해요.,아마 스스로도 행복하지 않을까라고 저는 생각을 해요.
그래서 그게 일을 약간 대하는 마음이 어떠냐에 따라서 일이 정말 싫어질 수도 있고 일이 정말 좋아질 수도 있는 거 같다고 생각을 하거든요.,그래서 그게 일을 약간 대하는 마음이 어떠냐에 따라서 일이 정말 싫어질 수도 있고 일이 정말 좋아질 수도 있는 거 같다고 생각을 하거든요.
어~ 근데 혹시  님은 아직 대학생이라고 하셨는데,어~ 근데 혹시  님은 아직 대학생이라고 하셨는데
아~ 이 사람 진짜 멋있다라던지 아니면 뭐~ 아버지든 아니면 주위 친구들이든 아 내가,아~ 이 사람 진짜 멋있다라던지 아니면 뭐~ 아버지든 아니면 주위 친구들이든 아 내가
고민도 털어놓을 수 있다 나의 내 멘토다 롤모델이다 하는 사람 혹시 있으신가요?,고민도 털어놓을 수 있다 나의 내 멘토다 롤모델이다 하는 사람 혹시 있으신가요?
어~ 제 주변에서 저는 아직,어~ 제 주변에서 저는 아직
제 또래 친 또래밖에 인간관계를 맺지 않았거든요 가족을 가족이나 친인척을 제외하고는 그래가지고,제 또래 친 또래밖에 인간관계를 맺지 않았거든요 가족을 가족이나 친인척을 제외하고는 그래가지고
어~ 친구들 중에서 뭐~ 딱히 아직 성공 어~ 뭐~ 학생이기도 해서 뭐~ 딱히 성공 사회적으로 성공한 사람은 없지만 저는 개인적으로,어~ 친구들 중에서 뭐~ 딱히 아직 성공 어~ 뭐~ 학생이기도 해서 뭐~ 딱히 성공 사회적으로 성공한 사람은 없지만 저는 개인적으로
어 걍 와 걍 주변에서 밝은 에너지 뿜어내는 애 있잖아요 그냥 같이 있으면 편하고 얘랑 있으면 이야기 쫌 더 잘하게 되고 이런 애들 보면은 와,어 그냥 와 그냥 주변에서 밝은 에너지 뿜어내는 애 있잖아요 그냥 같이 있으면 편하고 얘랑 있으면 이야기 조금 더 잘하게 되고 이런 애들 보면은 와
걍 사회적인 성공이 제가 아직 와 안 와닿아서 그런 걸 수도 있는데 아 쟤 보면 와 진짜,그냥 사회적인 성공이 제가 아직 와 안 와닿아서 그런 걸 수도 있는데 아 쟤 보면 와 진짜
내가 쟤랑 있으니까 편하고 뭔가 나도 기분 좋아지니까 아 저렇게 돼야겠다 이런 생각이 드니까 오히려 그렇게 막 밝고,내가 쟤랑 있으니까 편하고 뭔가 나도 기분 좋아지니까 아 저렇게 돼야겠다 이런 생각이 드니까 오히려 그렇게 막 밝고
뭔가 열심히 살고 이런 애들 보면은 어~ 뭔가 어~ 진짜 리스펙한다 이런 생각 들어가지고,뭔가 열심히 살고 이런 애들 보면은 어~ 뭔가 어~ 진짜 리스펙한다 이런 생각 들어가지고
오히려 그런 걍,오히려 그런 그냥
뭔가 걍 열심히 살고 밝은 에너지 뿜어내는 애 그~ 게네들 보면 그냥 아~ 저렇게 되고 싶다니까 게네들이 아마,뭔가 그냥 열심히 살고 밝은 에너지 뿜어내는 애 그~ 게네들 보면 그냥 아~ 저렇게 되고 싶다니까 게네들이 아마
제가 롤모 롤모델까진 아닌데 그냥 되고 싶다고 생각하지 않나 그렇게 생각하는 거 같애요.,제가 롤모 롤모델까진 아닌데 그냥 되고 싶다고 생각하지 않나 그렇게 생각하는 거 같애요.
어~ 그러면은 어~ 전 아직,어~ 그러면은 어~ 전 아직
