사투리,표준어
이제 그래서 보통 힘들게 운행하는 애들이 밖에 나가면,이제 그래서 보통 힘들게 운행하는 애들이 밖에 나가면
이제 어차피,이제 어차피
밖으로 부대가 없는 운행을 하면,밖으로 부대가 없는 운행을 하면
그~ 시에서도 많이 지원을 해줘가지고,그~ 시에서도 많이 지원을 해줘가지고
막 어,막 어
장애인분들 태우고 어디에 가는 그런 업무도 있었거든 왜냐면 시에서 시에서 부탁해서 부대에,장애인분들 태우고 어디에 가는 그런 업무도 있었거든 왜냐면 시에서 시에서 부탁해서 부대에
버스를 대절해야 되는데 그렇지 못하는 데는,버스를 대절해야 되는데 그렇지 못하는 데는
이제 그런 식으로 운행을 가면은,이제 그런 식으로 운행을 가면은
이제 밖에서 밥을 먹는데 이제 그런 경우가 꽤나 있었지 버스 운전병이다 보니까,이제 밖에서 밥을 먹는데 이제 그런 경우가 꽤나 있었지 버스 운전병이다 보니까
그래서 딱히 머,그래서 딱히 뭐
다른 걸 먹고 싶어서 막 그렇게 꼼수를 부렸던 적은 딱히 없는 거 같애.,다른 걸 먹고 싶어서 막 그렇게 꼼수를 부렸던 적은 딱히 없는 거 같애.
운전병은 다른 보직들보다 밖에 나가서 식사하는 경우가,운전병은 다른 보직들보다 밖에 나가서 식사하는 경우가
간혹가다 있으니까 한 달에 몇 번씩은 있으니까,간혹가다 있으니까 한 달에 몇 번씩은 있으니까
어~ 그리고 머,어~ 그리고 뭐
내 하루 일과를 말하기 전에 니 하루 일과를 한번 물어보고 싶은데,내 하루 일과를 말하기 전에 네 하루 일과를 한번 물어보고 싶은데
보통 일어나면 통신병은 하루 일과가 어떻게 되지?,보통 일어나면 통신병은 하루 일과가 어떻게 되지?
나는 이제 통신병이 아니라 이제 거의,나는 이제 통신병이 아니라 이제 거의
행정병이라서,행정병이라서
걍 이제 원래 군대처럼 일어나서 점호하고,그냥 이제 원래 군대처럼 일어나서 점호하고
다시 들어와서,다시 들어와서
이제 아침 이제 식집 이제 식사 집합이라고 해가지고 식집하고,이제 아침 이제 식집 이제 식사 집합이라고 해가지고 식집하고
이제 밥 먹으러 가잖아.,이제 밥 먹으러 가잖아.
근데 우리는 식집이란 것도 솔직히 따로 없었거든,근데 우리는 식집이란 것도 솔직히 따로 없었거든
이게 식집이라해도 그냥 빼고,이게 식집이라해도 그냥 빼고
그냥 인원수 얼추 걍 맞춰가지고 걍 보내고 이래가지고 식집 걍 안 하고,그냥 인원수 얼추 그냥 맞춰가지고 그냥 보내고 이래가지고 식집 그냥 안 하고
그리고 이제 일과 집합이라고,그리고 이제 일과 집합이라고
이제 일과에서 일과 집합 해라 하면 이제 소대별로 일렬로 다 슨단 말이야.,이제 일과에서 일과 집합 해라 하면 이제 소대별로 일렬로 다 슨단 말이야.
이제 그러는데,이제 그러는데
이제 따른 애들은 이제 머 잡업무 머,이제 다른 애들은 이제 뭐 잡업무 뭐
이런 거하다가 나는 그냥 유유히 그냥 행정반 들어가서,이런 거하다가 나는 그냥 유유히 그냥 행정반 들어가서
행보관님 커피 타주고,행보관님 커피 타주고
이제 그냥,이제 그냥
책상에 앉아가지고,책상에 앉아가지고
이제,이제
그~ 인트라넷 들어가가지고 이제 위문 열차,그~ 인트라넷 들어가가지고 이제 위문 열차
이제 최선 이제 최신화라 하지 업데이트된 거 이제 한 번씩 봐주고,이제 최선 이제 최신화라 하지 업데이트된 거 이제 한 번씩 봐주고
이제 국임 그~ 국가 그거 머 국임체 해가지고,이제 국임 그~ 국가 그거 뭐 국임체 해가지고
사람 이름 치면은 나오잖아 누구 나오는지,사람 이름 치면은 나오잖아 누구 나오는지
이제 누구나 이제 친구들 한 번씩 이제 잘 있나 확인 한 번 해주고,이제 누구나 이제 친구들 한 번씩 이제 잘 있나 확인 한 번 해주고
이제 내가 해야 될 그날 머  총기탄 일 일 결산 이런 것들 이제 바짝 해주고 그러면 오전 하면은,이제 내가 해야 될 그날 뭐  총기탄 일 일 결산 이런 것들 이제 바짝 해주고 그러면 오전 하면은
일이 다 끝난단 말이야.,일이 다 끝난단 말이야.
웬만함 일이 다 끝나고,웬만함 일이 다 끝나고
아니면은 감사 이런 거 안 오면은 딱히 긴장할 필요도 없어가지고,아니면은 감사 이런 거 안 오면은 딱히 긴장할 필요도 없어가지고
그러고 오후에 또 점심 먹고,그러고 오후에 또 점심 먹고
일과 집합 또 하고,일과 집합 또 하고
이제 행정반 가서 또 행보관님 커피 타드리고,이제 행정반 가서 또 행보관님 커피 타드리고
이제 행보관님한테 이제 재롱잔치 한 번 해드리고,이제 행보관님한테 이제 재롱잔치 한 번 해드리고
이제,이제
다시 저녁 먹고 끝 나는 딱히,다시 저녁 먹고 끝 나는 딱히
그렇게 막,그렇게 막
막 빡빡한 삶을  살진 않아가지고,막 빡빡한 삶을  살진 않아가지고
인 어떤 일과를 보냈는데?,인 어떤 일과를 보냈는데?
나는 쪼끔 빡빡했지.,나는 쪼끔 빡빡했지.
이게 모든 부대마다 다르고 모든 보직마다 다르겠지만,이게 모든 부대마다 다르고 모든 보직마다 다르겠지만
몸이 힘든 부대가 있고 정신이 힘든 부대가 있고 안 힘든 부대가 있잖아.,몸이 힘든 부대가 있고 정신이 힘든 부대가 있고 안 힘든 부대가 있잖아.
근데 내가 볼 때 니는 안 힘든 부대 같고,근데 내가 볼 때 너는 안 힘든 부대 같고
근데 나는 이제,근데 나는 이제
우리 부대도 마찬가지야 사실 계원들은,우리 부대도 마찬가지야 사실 계원들은
이제 행정하고 이런 애들은 몸이 안 힘들고 정신도 괜찮아.,이제 행정하고 이런 애들은 몸이 안 힘들고 정신도 괜찮아.
보급관이나 중대장님만 잘 만난다면 스트레스를 안 받기만 한다면,보급관이나 중대장님만 잘 만난다면 스트레스를 안 받기만 한다면
근데 이제 나는 버스를 탔으니까 난 처음에 버스를 탈 때도,근데 이제 나는 버스를 탔으니까 난 처음에 버스를 탈 때도
밖에서 누가 버스를 운전해봤겠어 나이 스물두 살에 스물한두 살에,밖에서 누가 버스를 운전해봤겠어 나이 스물두 살에 스물한두 살에
그래가지고 처음 버스 탈 때 너무 무서웠고 뒤에 사십한 명을 태우고,그래가지고 처음 버스 탈 때 너무 무서웠고 뒤에 사십한 명을 태우고
장거리 운행을 해야 된다라는 거 자체도 굉장한 부담이어,장거리 운행을 해야 된다라는 거 자체도 굉장한 부담이어
혹시나 사고가 나면,혹시나 사고가 나면
그 모든 책임이 운전병한테 있어.,그 모든 책임이 운전병한테 있어.
그래서 굉장히 부담이 됐는데,그래서 굉장히 부담이 됐는데
걍 처음에는 하기 싫다고 말을 하고 싶었,그냥 처음에는 하기 싫다고 말을 하고 싶었
선임이 시키면 어쩔 수 없이 해야 되는 게 군대잖아.,선임이 시키면 어쩔 수 없이 해야 되는 게 군대잖아.
그래서 난 선임이 시켜서 어쩔 수 없이,그래서 난 선임이 시켜서 어쩔 수 없이
이를 악물고 아득바득 연습을 해서,이를 악물고 아득바득 연습을 해서
운행을 나가게 됐지.,운행을 나가게 됐지.
그렇게 해서 운행을 시작하면 이제,그렇게 해서 운행을 시작하면 이제
보통 버스 같은 경우에는 장거리 운행을 많이 가.,보통 버스 같은 경우에는 장거리 운행을 많이 가.
이제 나는 외진 버스라고 해서,이제 나는 외진 버스라고 해서
아픈 병사들 병이 있는 병사들을 태우고,아픈 병사들 병이 있는 병사들을 태우고
고양병원이랑 의무대를 가려는,고양병원이랑 의무대를 가려는
그런 운행을 주로 했는데 이제 그런 운행 같은 경우에는 우리 연대에서 출발해서,그런 운행을 주로 했는데 이제 그런 운행 같은 경우에는 우리 연대에서 출발해서
일이삼 대대를 거쳐서 사단 의무대에 내려주고,일이삼 대대를 거쳐서 사단 의무대에 내려주고
그다음 고양병원에 가서,그다음 고양병원에 가서
다시 연대를 복귀해서 점심을 먹고,다시 연대를 복귀해서 점심을 먹고
이제 졸음운전 방지 차원에서 한 시간 낮잠을 자.,이제 졸음운전 방지 차원에서 한 시간 낮잠을 자.
한 시간 낮잠을 자고 바로 다시 출발을 해.,한 시간 낮잠을 자고 바로 다시 출발을 해.
출발을 해서 이제 역순으로,출발을 해서 이제 역순으로
사단장님 부대 태우고 고양병원 태우고,사단장님 부대 태우고 고양병원 태우고
삼이일 내려주고 연대 복귀를 하면은 저녁 아홉 시 아 저녁 한 여섯 시 정도 되거든?,삼이일 내려주고 연대 복귀를 하면은 저녁 아홉 시 아 저녁 한 여섯 시 정도 되거든?
이제 그때 되면 이제 밥이 다 식어있어.,이제 그때 되면 이제 밥이 다 식어있어.
근데 그렇게 찬밥을 먹는 게 일주일에 두 번씩 외진은 일주일에 두 번씩 나가.,근데 그렇게 찬밥을 먹는 게 일주일에 두 번씩 외진은 일주일에 두 번씩 나가.
가끔씩 짧은 운행 나가면 이제 훈련 운행해가지고,가끔씩 짧은 운행 나가면 이제 훈련 운행해가지고
그~ 부대 주변에서 두돈반을 타고 훈련을 가다가,그~ 부대 주변에서 두돈반을 타고 훈련을 가다가
떨어져서 다치는 사고가 있었어 그래서 이제,떨어져서 다치는 사고가 있었어 그래서 이제
사단장 명령으로 버스를 많이 사용해라 해서 내 운행량이 많아졌지.,사단장 명령으로 버스를 많이 사용해라 해서 내 운행량이 많아졌지.
지금 생각해보면 화나지만 그때도 화났었고,지금 생각해보면 화나지만 그때도 화났었고
그래서 그런 짧은 운행도 있었지만 긴 운행 같은 경우 약간,그래서 그런 짧은 운행도 있었지만 긴 운행 같은 경우 약간
외진 같은 경우에는 정확하게 기억나는데 백칠십팔 키로가 걸려.,외진 같은 경우에는 정확하게 기억나는데 백칠십팔 키로가 걸려.
근데 이게 사회에서 사실 고속도로로 달리면 그렇게 긴 거리가 아니야 한 두시간이면 그냥 갈 거리인데,근데 이게 사회에서 사실 고속도로로 달리면 그렇게 긴 거리가 아니야 한 두시간이면 그냥 갈 거리인데
이제,이제
부대의 특성상 산에 있는 부대고 산길을 타야 되고 무조건 일 차선은 산길이야 고양병원을 가는 길은 빼고,부대의 특성상 산에 있는 부대고 산길을 타야 되고 무조건 일 차선은 산길이야 고양병원을 가는 길은 빼고
길도 굉장히 꼬불꼬불하고,길도 굉장히 꼬불꼬불하고
군대에 에서 모든 차량의 제한속도는 육십 키로지.,군대에 에서 모든 차량의 제한속도는 육십 키로지.
그리고 위수지역으로 가면 제한속도는 사십 키로,그리고 위수지역으로 가면 제한속도는 사십 키로
이제 그렇게 해서,이제 그렇게 해서
하루에 일곱시간 반 정도 운행을 하고,하루에 일곱시간 반 정도 운행을 하고
일곱시간 반에서 여덟 시간 정도 운전만 하고,일곱시간 반에서 여덟 시간 정도 운전만 하고
짐 머 용인이나 다른 지역으로 넘어갈 때는 머 여덟시간,짐 뭐 용인이나 다른 지역으로 넘어갈 때는 뭐 여덟시간
심할 때는 불침번을 서고 새벽에 일어나서 운행을 하고,심할 때는 불침번을 서고 새벽에 일어나서 운행을 하고
저녁 늦게 들어오는 경우도 있었지.,저녁 늦게 들어오는 경우도 있었지.
그래서 그냥 이거는 내가 군인인 건지,그래서 그냥 이거는 내가 군인인 건지
진짜 군인들 실어주는 버스기사로 온 건지 헷갈릴 정도로,진짜 군인들 실어주는 버스기사로 온 건지 헷갈릴 정도로
쫌 그렇게,조금 그렇게
한 달에 월급은 한 삼십만 원 받으면서,한 달에 월급은 한 삼십만 원 받으면서
버스 기사 뺨치게 운전한 기억이 있어서,버스 기사 뺨치게 운전한 기억이 있어서
딱히 좋은 기억이라고 해야 될지 안 좋은 기억이라고 해야 될지 잘 모르겠어 그냥,딱히 좋은 기억이라고 해야 될지 안 좋은 기억이라고 해야 될지 잘 모르겠어 그냥
국가의 부름을 받고 갔는데,국가의 부름을 받고 갔는데
약간 노동력으로 싼값에 노동력으로 쓰인 그런 취급밖에 못 받는 꼴이다 약간 이렇게 생각이 돼고,약간 노동력으로 싼값에 노동력으로 쓰인 그런 취급밖에 못 받는 꼴이다 약간 이렇게 생각이 돼고
그렇게 됐지 너는,그렇게 됐지 너는
혹시 전역할 때 생각나는 선임이나 그런 사람이 있었어?,혹시 전역할 때 생각나는 선임이나 그런 사람이 있었어?
난 솔직히 생각나는 선임이라면은,난 솔직히 생각나는 선임이라면은
걍 우리는 이제 행정병은 행정병끼리 친하니까 이제 인사 담당하는,그냥 우리는 이제 행정병은 행정병끼리 친하니까 이제 인사 담당하는
이제 같은 소대였거든 그것도,이제 같은 소대였거든 그것도
같은 소대여가지고 디게 인사 담당하는 분이,같은 소대여가지고 되게 인사 담당하는 분이
이제 그 형이 지금은 형이지 형이 이제,이제 그 형이 지금은 형이지 형이 이제
경계 작전  명령서라고 이제 경작서 이제 근무 들어가는 거 짜는 데 이제 그거를,경계 작전  명령서라고 이제 경작서 이제 근무 들어가는 거 짜는 데 이제 그거를
쫌 많이 쫌,조금 많이 조금
이제 순화 시켜가지고 해 준 그 선임이 제일 기억에 남네.,이제 순화 시켜가지고 해 준 그 선임이 제일 기억에 남네.
