사투리,표준어
어~ 그 아파트에 살고 있는데 집이 이제 저희 집이 칠 층이에요 그래서,어~ 그 아파트에 살고 있는데 집이 이제 저희 집이 칠 층이에요 그래서
일단,일단
아 계단을 걸어가는 게 운동이 된다고 해서 그,아 계단을 걸어가는 게 운동이 된다고 해서 그
되도록이면 아 되도록은 아니고,되도록이면 아 되도록은 아니고
어~ 백 퍼센트 계단을 통해서 엘리베이터를 타지 않고 집에 들어오고 나가고 있구요.,어~ 백 퍼센트 계단을 통해서 엘리베이터를 타지 않고 집에 들어오고 나가고 있구요.
다음에 집에 올 때는 걸어서 이제 자주,다음에 집에 올 때는 걸어서 이제 자주
걷기 운동으로 하는 편이고 집 안에서는,걷기 운동으로 하는 편이고 집 안에서는
네 말씀하신 거처럼 요새 유튜브나 뭐~ 티비나 뭐 매체를 통해서,네 말씀하신 거처럼 요새 유튜브나 뭐~ 티비나 뭐 매체를 통해서
운동 집에서 홈트 혼 혼자서 운동하시는 분들,운동 집에서 홈트 혼 혼자서 운동하시는 분들
동영상을 보면서,동영상을 보면서
요가 영상이나 아니면 스트레칭 영상을 보고 했어는데,요가 영상이나 아니면 스트레칭 영상을 보고 했어는데
어~ 생각보다 효과도 괜찮고 혼자 하는 것보다 이케 티비나 핸드폰을 켜놓고,어~ 생각보다 효과도 괜찮고 혼자 하는 것보다 이렇게 티비나 핸드폰을 켜놓고
하면 같이 하는 느낌도 들고 해서,하면 같이 하는 느낌도 들고 해서
예 고런 유튜 유튜브나 이제 다른 사람한,예 고런 유튜 유튜브나 이제 다른 사람한
영상을 보고 운동을 집에서,영상을 보고 운동을 집에서
같이 하니까,같이 하니까
어~ 효과가 있어서 저도 잘 보고 하게 되던데 저도 시 처음에 시작이 어려웠는데,어~ 효과가 있어서 저도 잘 보고 하게 되던데 저도 시 처음에 시작이 어려웠는데
한 번 하고 나니까 그게 두 번 세 번 네 번 이렇게 계속할 수 있고 그런 영상들은,한 번 하고 나니까 그게 두 번 세 번 네 번 이렇게 계속할 수 있고 그런 영상들은
일회성으로 올라오는 영상보다는 계속 추가적으로 영상이 많이 올라와서,일회성으로 올라오는 영상보다는 계속 추가적으로 영상이 많이 올라와서
새로운 영양을 계속적으로 보면서 운동을 예 하고 있습니다.,새로운 영양을 계속적으로 보면서 운동을 예 하고 있습니다.
