사투리,표준어
그런 애들이 하는 거 보면은 제 친구 한 명은 인제 그냥 길 가고 있다가,그런 애들이 하는 거 보면은 제 친구 한 명은 인제 그냥 길 가고 있다가
여자애가 막 번호를 달라고 해가지고,여자애가 막 번호를 달라고 해가지고
연락을 하더니 막 처음 한두 번은 막 데이트처럼 뭐~ 이렇게 만나더니 이제,연락을 하더니 막 처음 한두 번은 막 데이트처럼 뭐~ 이렇게 만나더니 이제
쪼금 쪼금씩 지나갈 때 쪼금 쪼금씩 이제 한 두세 번 만나고 나면은,쪼금 쪼금씩 지나갈 때 쪼금 쪼금씩 이제 한 두세 번 만나고 나면은
이제 갑자기 종교 얘기를 꺼내면서 자기가 어~ 그~ 기독교 다니는데,이제 갑자기 종교 얘기를 꺼내면서 자기가 어~ 그~ 기독교 다니는데
그~ 아는 교회 다니는 아는 형이나 아는 누나가 뭐 했다더라.,그~ 아는 교회 다니는 아는 형이나 아는 누나가 뭐 했다더라.
한 번 같이 만나 보는 게 어떻겠냐 이런 식으로 시작해가지고,한 번 같이 만나 보는 게 어떻겠냐 이런 식으로 시작해가지고
막 이케 해서 끌고 갈려는 거를 제가 봤었거든요.,막 이렇게 해서 끌고 갈려는 거를 제가 봤었거든요.
그래가지고 굉장히 쫌 굉장히 신기했고 그리고 막 또 따른 이야기 보면은,그래가지고 굉장히 조금 굉장히 신기했고 그리고 막 또 다른 이야기 보면은
막 쫌 이거는 진짜 있는지 모르겠지만 일부러 막 교통사고를 내고,막 조금 이거는 진짜 있는지 모르겠지만 일부러 막 교통사고를 내고
그런 식으로 해서 포섭한다 하더라  굉장히 신기했고,그런 식으로 해서 포섭한다 하더라  굉장히 신기했고
불교에 있어서는 사실 잘 그게 없었던 거 같애요 관심이 잘 없는 거 같 제 주변에는,불교에 있어서는 사실 잘 그게 없었던 거 같애요 관심이 잘 없는 거 같 제 주변에는
어~ 무교 아니면은 기독교 천주교였던 거 같고 막 절을 찾아간다던가,어~ 무교 아니면은 기독교 천주교였던 거 같고 막 절을 찾아간다던가
이제 뭐~ 등을 달러 간다던가 막 그렇게 하시는 분들은 한 번도 못 본 거 같애요.,이제 뭐~ 등을 달러 간다던가 막 그렇게 하시는 분들은 한 번도 못 본 거 같애요.
티비에서 보면은 막 백팔 배 한다 이러거나 아니면은,티비에서 보면은 막 백팔 배 한다 이러거나 아니면은
이제 그~ 갓바위 이런 데 올라가가지고 고등학교 고등학교 삼 학 고삼 이제,이제 그~ 갓바위 이런 데 올라가가지고 고등학교 고등학교 삼 학 고삼 이제
자녀두고 계신 분들 보면 그런 데 다니시면서 절하는 거 보면은 진짜 신기하더라고요.,자녀두고 계신 분들 보면 그런 데 다니시면서 절하는 거 보면은 진짜 신기하더라고요.
그런 굉장히 재밌었고 그냥 신기했어요 저는 이제 아버지랑 가끔씩 이제,그런 굉장히 재밌었고 그냥 신기했어요 저는 이제 아버지랑 가끔씩 이제
그런 데 산 올라가서 경치 구경하는 걸로 해서 올라가서 보면은,그런 데 산 올라가서 경치 구경하는 걸로 해서 올라가서 보면은
막 그 위에서 이제 막 이런 그냥 몸만 올라가서 하는 것도 아니고 막 사과라던가 이런 걸 들고 가서,막 그 위에서 이제 막 이런 그냥 몸만 올라가서 하는 것도 아니고 막 사과라던가 이런 걸 들고 가서
하더라고 막 보니까 굉장히 신기했고 그리고 약간 쫌,하더라고 막 보니까 굉장히 신기했고 그리고 약간 조금
사찰 이런 것들도 보면은 이게 요근래에 있는 사찰 말고 이제,사찰 이런 것들도 보면은 이게 요근래에 있는 사찰 말고 이제
쫌 해인사라던가 그런 것들 가서 보면은,조금 해인사라던가 그런 것들 가서 보면은
굉장히 자연과 잘 어우러져 있는 그런 것을 보면은 굉장히 저는,굉장히 자연과 잘 어우러져 있는 그런 것을 보면은 굉장히 저는
그~ 불교에 대해서 굉장히 괜찮게 생각했던 거 같애요.,그~ 불교에 대해서 굉장히 괜찮게 생각했던 거 같애요.
불교에 대한 기본 이념도 어~ 저도 자세하게 알진 못하지만 이제 들어보면은,불교에 대한 기본 이념도 어~ 저도 자세하게 알진 못하지만 이제 들어보면은
이제 기독교 같은 경우에는 어~ 구원을 받아야 된다.,이제 기독교 같은 경우에는 어~ 구원을 받아야 된다.
그렇기 땜에 막 선행을 해서 선행을 베풀고 뭐~ 따른 사람들을 같이 해서,그렇기 땜에 막 선행을 해서 선행을 베풀고 뭐~ 다른 사람들을 같이 해서
뭐~ 구원을 받아야 된다 그러면서 말을 하는데 그런 걸 불교 같은 경우에는,뭐~ 구원을 받아야 된다 그러면서 말을 하는데 그런 걸 불교 같은 경우에는
이제 자기가 자기 자신이 이제 선을 행해서 선을 쌓으면은,이제 자기가 자기 자신이 이제 선을 행해서 선을 쌓으면은
이제 미륵이 될 수 있다 약간 뭐~ 이런 것들 들어보면은 약간 쫌 저는 오히려,이제 미륵이 될 수 있다 약간 뭐~ 이런 것들 들어보면은 약간 조금 저는 오히려
기독교나 천주교보다는 불교가 더 맞지 않을까 그런 생각을 했어요.,기독교나 천주교보다는 불교가 더 맞지 않을까 그런 생각을 했어요.
그~ 그런 따른 종교도 가보셨다 하셨는데,그~ 그런 다른 종교도 가보셨다 하셨는데
그러면서 어떤 느낌이 드셨는지 궁금해요.,그러면서 어떤 느낌이 드셨는지 궁금해요.
굉장히 기독교나 성당은 쫌 이질적이다 하는 느낌이 굉장히 강했어요.,굉장히 기독교나 성당은 조금 이질적이다 하는 느낌이 굉장히 강했어요.
그까 내가 내가 여기에 다니기에는,그러니까 내가 내가 여기에 다니기에는
그니까 성격이 그렇게 적극적인 성격이 아니었는데 기독교나 성당에 갔을 때,그러니까 성격이 그렇게 적극적인 성격이 아니었는데 기독교나 성당에 갔을 때
그기 계신 신도분 그러 이 그~ 너무 적극적인 어떤,거기 계신 신도분 그러 이 그~ 너무 적극적인 어떤
그~ 친밀감이라고 말씀을 드려야 됩니까 어떤 그런 것들이,그~ 친밀감이라고 말씀을 드려야 됩니까 어떤 그런 것들이
굉장히 부담스럽더라고요 저는 쫌 천천히 시작하고 천천히 다가가고 싶은데,굉장히 부담스럽더라고요 저는 조금 천천히 시작하고 천천히 다가가고 싶은데
너무 이케 빨리 이케 다가오시니깐,너무 이렇게 빨리 이렇게 다가오시니깐
그리고 그~ 기독교나 이케 천주교에서 물론 제가 음악을 했기 때문에,그리고 그~ 기독교나 이렇게 천주교에서 물론 제가 음악을 했기 때문에
그~ 뭐~ 성가대도 하고 했지만 이케 다른 사람들 앞에서 뭐~ 이야기하게 하고 발표하게 하고 자기의 어떤 이런 것들이,그~ 뭐~ 성가대도 하고 했지만 이렇게 다른 사람들 앞에서 뭐~ 이야기하게 하고 발표하게 하고 자기의 어떤 이런 것들이
어~ 굉장히 소극적인 저한테는 굉장히 이질적인 문화 같은 느낌,어~ 굉장히 소극적인 저한테는 굉장히 이질적인 문화 같은 느낌
뭐~ 그랬든 거 같애요 그래서 쪼금,뭐~ 그랬든 거 같애요 그래서 쪼금
저 종교는 나하고는 쫌 맞지 않을 거 같다라는 생각이 많이 들었든 거 같습니다.,저 종교는 나하고는 조금 맞지 않을 거 같다라는 생각이 많이 들었든 거 같습니다.
