사투리,표준어
재밌는 건 알겠는데 뭐 어떤 반전을 내가 다 알고 그런데 이거를 과연 재밌게 볼 수 있을까라는 생각 들어서,재밌는 건 알겠는데 뭐 어떤 반전을 내가 다 알고 그런데 이거를 과연 재밌게 볼 수 있을까라는 생각 들어서
저는 쫌 재밌다고 하면은 막 잠깐잠깐이나,저는 조금 재밌다고 하면은 막 잠깐잠깐이나
아니면은 막 뭐지 한 번에 몰아서 볼 수 있는 날 생기면은 결제해서 본단 말이에요.,아니면은 막 뭐지 한 번에 몰아서 볼 수 있는 날 생기면은 결제해서 본단 말이에요.
근데 걔는 너무 많은 걸 알아버려서 처음 시작부터,근데 걔는 너무 많은 걸 알아버려서 처음 시작부터
그~ 이준기가 그 안에서 무슨 역할을 했고 어떤 게 있고 둘이 뭐 어떻니 마네 이런 거 다 알아서,그~ 이준기가 그 안에서 무슨 역할을 했고 어떤 게 있고 둘이 뭐 어떻니 마네 이런 거 다 알아서
아마 안 볼 것 같애요.,아마 안 볼 것 같애요.
너무 그래서 드라마는 쫌 그런 거 있는 약간 영화는,너무 그래서 드라마는 조금 그런 거 있는 약간 영화는
한번 딱 하고 개봉 끝날 때까지 사람들이 웬만하면,한번 딱 하고 개봉 끝날 때까지 사람들이 웬만하면
스포 주의하면서 하잖아요 근데 드라마는 그냥 난 가만히 있는데,스포 주의하면서 하잖아요 근데 드라마는 그냥 난 가만히 있는데
뭐 인터넷에도 뭐 페북이든 뭘 들어가면은,뭐 인터넷에도 뭐 페북이든 뭘 들어가면은
아~ 오늘 이랬다.,아~ 오늘 이랬다.
이러면 드라마 걍 일주일에 한 번씩 그 내용을 누군가 계속 보게 하 만드니까,이러면 드라마 그냥 일주일에 한 번씩 그 내용을 누군가 계속 보게 하 만드니까
그거는 좀 문제 있는 것 같애요.,그거는 좀 문제 있는 것 같애요.
어~ 그거 맞아요.,어~ 그거 맞아요.
기사 제목부터가 아예 그냥 반전을 말해 버리니까,기사 제목부터가 아예 그냥 반전을 말해 버리니까
저도 그래서 안 본 게 아까 말씀드렸다시피 사랑의 불시착도 그래서 안 보고 현빈이 언 몇 화에,저도 그래서 안 본 게 아까 말씀드렸다시피 사랑의 불시착도 그래서 안 보고 현빈이 언 몇 화에
남한으로 내려가네 뭐 거기서 손예진이 뭐 이렇게 하네,남한으로 내려가네 뭐 거기서 손예진이 뭐 이렇게 하네
이건 아니다 어차피 다 얘 아는데 왜 보냐 싶어서 안 봤었어요.,이건 아니다 어차피 다 얘 아는데 왜 보냐 싶어서 안 봤었어요.
근데 스포 당해도,근데 스포 당해도
그냥 계속 봤던 건 하나 있는데 현빈 나왔던 시크릿 가든,그냥 계속 봤던 건 하나 있는데 현빈 나왔던 시크릿 가든
그거는,그거는
지금 생각하면 되게 뭔가 좀 유치한데 왜 그렇게 재밌게 봤는지 잘 모르겠네요.,지금 생각하면 되게 뭔가 좀 유치한데 왜 그렇게 재밌게 봤는지 잘 모르겠네요.
근데 약간 그 왜 있잖아요 막,근데 약간 그 왜 있잖아요 막
꽃보다 남자처럼 뭔가,꽃보다 남자처럼 뭔가
지금 생각하면은 이상한데 전 국민이 미쳐서 봤던 그런 드라마,지금 생각하면은 이상한데 전 국민이 미쳐서 봤던 그런 드라마
저 약간 지금 다시 보라 하면 못 볼 것 같은 게,저 약간 지금 다시 보라 하면 못 볼 것 같은 게
약간 김은숙 작가 거 다 안 맞는 것 같애요 저는,약간 김은숙 작가 거 다 안 맞는 것 같애요 저는
꽃남은 그냥 그 어릴 때 봤으니까 그렇다 치고,꽃남은 그냥 그 어릴 때 봤으니까 그렇다 치고
막 신사의 품격 지금 보라 하면 못 보겠고,막 신사의 품격 지금 보라 하면 못 보겠고
시크릿 가든도 못 보겠고 저는 상속자들도,시크릿 가든도 못 보겠고 저는 상속자들도
뭐~ 나 너 좋아하냐 막 이런 대사 있다는 걸 알고 다 끝나고 나서 보는데 막,뭐~ 나 너 좋아하냐 막 이런 대사 있다는 걸 알고 다 끝나고 나서 보는데 막
박신혜랑 이민호랑 연애하는 거 별로 관심 없어서 다 넘기고 크리스탈이랑 막 그~,박신혜랑 이민호랑 연애하는 거 별로 관심 없어서 다 넘기고 크리스탈이랑 막 그~
암튼 크리스탈 남자친구 역할 맡은 배우분 해가지고 둘이서 막 장난치고 그런 부분만,암튼 크리스탈 남자친구 역할 맡은 배우분 해가지고 둘이서 막 장난치고 그런 부분만
요약으로 다 땡겨서 보고,요약으로 다 당겨서 보고
만약에 막 연애한다 뭔가 진중하다 무슨 집안에 뭐 이런 거 나오면은 바로 다 넘겨서 보고 가벼운 장면만 보고 그랬었어요.,만약에 막 연애한다 뭔가 진중하다 무슨 집안에 뭐 이런 거 나오면은 바로 다 넘겨서 보고 가벼운 장면만 보고 그랬었어요.
저도 아까 왜 저도 아까 말씀 주신,저도 아까 왜 저도 아까 말씀 주신
꽃남 상속자들 신사의 품격 지금 보라면 절대 못 보고,꽃남 상속자들 신사의 품격 지금 보라면 절대 못 보고
시크릿 가든도,시크릿 가든도
그때는 왜 그런 츄리닝 입고 빤짝이 츄리닝 입은 남자가 너무 멋있다 생각했는지,그때는 왜 그런 츄리닝 입고 빤짝이 츄리닝 입은 남자가 너무 멋있다 생각했는지
아직도 이해가 안 되네요.,아직도 이해가 안 되네요.
근데 옛날 건데도,근데 옛날 건데도
그렇게 옛날은 아니지만 지금 봐도 재밌는 것도 몇 개는 있는 것 같애요.,그렇게 옛날은 아니지만 지금 봐도 재밌는 것도 몇 개는 있는 것 같애요.
그렇게 옛날은 아니지만,그렇게 옛날은 아니지만
말씀주신 시그널도 계속 봐도 재밌고,말씀주신 시그널도 계속 봐도 재밌고
저는 몇 번씩 재탕했던 드라마 몇 개 있거든요.,저는 몇 번씩 재탕했던 드라마 몇 개 있거든요.
몇 번씩 다시 보신 드라마 있으신가요?,몇 번씩 다시 보신 드라마 있으신가요?
저는 응답하라,저는 응답하라
몇 번씩 다시 봤었어요 근데 약간 다 다르잖아요 막 일구구칠 일구구사 일구팔팔 해서 다 다른데 저는,몇 번씩 다시 봤었어요 근데 약간 다 다르잖아요 막 일구구칠 일구구사 일구팔팔 해서 다 다른데 저는
일구구칠 제일 좋아했거든요 뭔가 일구팔팔은,일구구칠 제일 좋아했거든요 뭔가 일구팔팔은
좋은데 너무 나랑은 연대가 안 맞는 느낌이고,좋은데 너무 나랑은 연대가 안 맞는 느낌이고
일구구사는 뭔가,일구구사는 뭔가
원래 약간 사실 그~ 메인 캐릭터랑 서브 캐릭터를 그렇게 좋아하는 편이 아니어서 재탕은 하지만 그게,원래 약간 사실 그~ 메인 캐릭터랑 서브 캐릭터를 그렇게 좋아하는 편이 아니어서 재탕은 하지만 그게
그게 좋아서라기보다는,그게 좋아서라기보다는
그냥 그 드라마 시리즈 하나를 재탕하다 보면 얘도 재탕해야지 이런 느낌이었고,그냥 그 드라마 시리즈 하나를 재탕하다 보면 얘도 재탕해야지 이런 느낌이었고
그리고 일구구칠은 한 세 번 정도 본 것 같애요.,그리고 일구구칠은 한 세 번 정도 본 것 같애요.
그럼 재탕하셨던 것 혹시 어떤 건지 알 수 있을까요?,그럼 재탕하셨던 것 혹시 어떤 건지 알 수 있을까요?
저는 라이프 온 마스랑 그 정경호랑 박성웅 나왔던 거,저는 라이프 온 마스랑 그 정경호랑 박성웅 나왔던 거
라이프 온 마스랑 되게 옛날 드라마인데 내 마음이 들리니,라이프 온 마스랑 되게 옛날 드라마인데 내 마음이 들리니
그~ 황정음 나왔던 드라마 그렇게 두 개는 좀 몇 번씩 봤던 것 같애요.,그~ 황정음 나왔던 드라마 그렇게 두 개는 좀 몇 번씩 봤던 것 같애요.
둘 다,둘 다
내 마음이 들리니는 뭔가,내 마음이 들리니는 뭔가
따뜻한 느낌이 들어가지고,따뜻한 느낌이 들어가지고
원래 그런 로맨스류를 막 엄청 좋아하진 않은데 다시 볼 정도로 봤던 거 같고,원래 그런 로맨스류를 막 엄청 좋아하진 않은데 다시 볼 정도로 봤던 거 같고
라이프 온 마스는 그냥 그~,라이프 온 마스는 그냥 그~
연기도 좋고 뭔가,연기도 좋고 뭔가
긴박하게 따다다다닥 전개되는 게 좋아서 몇 번씩 봤고,긴박하게 따다다다닥 전개되는 게 좋아서 몇 번씩 봤고
그 외에 계속 봤던 거는 시트콤 거침없이 하이킥,그 외에 계속 봤던 거는 시트콤 거침없이 하이킥
그거는 진짜 가볍게 볼 수 있어가지고 봤던 거 같애요.,그거는 진짜 가볍게 볼 수 있어가지고 봤던 거 같애요.
시트콤은 안 좋아하세요?,시트콤은 안 좋아하세요?
저도 시트콤 좋아하는데 요새 유난히 그런 거 많잖아요 막,저도 시트콤 좋아하는데 요새 유난히 그런 거 많잖아요 막
유튜브 워낙 잘돼 있으니까,유튜브 워낙 잘돼 있으니까
완전 클립 느낌 진짜 뭐 오 분 정도로 요약해서 잠깐잠깐 보여주고 그러잖아요.,완전 클립 느낌 진짜 뭐 오 분 정도로 요약해서 잠깐잠깐 보여주고 그러잖아요.
근데 그 거침없이 시리즈 맨날 끝날 때,근데 그 거침없이 시리즈 맨날 끝날 때
시트콤인데 분명히 끝날 때는 드라마고 되게 애잔하게 끝내잖 끝내가지고 저는 아직도 그거 기억해요.,시트콤인데 분명히 끝날 때는 드라마고 되게 애잔하게 끝내잖 끝내가지고 저는 아직도 그거 기억해요.
생방으로 신세경 사고 나는 것하고 끝나는 거.,생방으로 신세경 사고 나는 것하고 끝나는 거.
그 &company-name1& 배너 올라오면서 최다니엘 아~ 최다니엘 맞나?,그 &company-name1& 배너 올라오면서 최다니엘 아~ 최다니엘 맞나?
맞아요.,맞아요.
어~ 최다니엘이랑 하는 거 저도 그거는 좀 인상 너무 어이없어서 기억이 나요.,어~ 최다니엘이랑 하는 거 저도 그거는 좀 인상 너무 어이없어서 기억이 나요.
그거 빼고는 그냥 웃긴 장면만 돌려서 보는 편이어서 저는,그거 빼고는 그냥 웃긴 장면만 돌려서 보는 편이어서 저는
옛날 거 하이 특히 하이킥,옛날 거 하이 특히 하이킥
그 이순재 나오는 부분만 좀 많이 본 것 같아요 연기를 너무 잘하셔가지고.,그 이순재 나오는 부분만 좀 많이 본 것 같아요 연기를 너무 잘하셔가지고.
