사투리,표준어
저 같은 경우는 저도 진짜 노래방 가는 걸 좋아하기 때문에,저 같은 경우는 저도 진짜 노래방 가는 걸 좋아하기 때문에
거의 혼자서도 가 본 적 있고 빈도로만 따지면 거의 한 주에 한 두세 번은 기본으로 가는 것 같애요.,거의 혼자서도 가 본 적 있고 빈도로만 따지면 거의 한 주에 한 두세 번은 기본으로 가는 것 같애요.
그렇다고 이제 혼자 갈 때는 막 학 시간씩 넣고 이러진 않고,그렇다고 이제 혼자 갈 때는 막 학 시간씩 넣고 이러진 않고
이제 애들끼리 가면 이제 기본적으로 한 삼십 분에서 한 시간 정도 있고,이제 애들끼리 가면 이제 기본적으로 한 삼십 분에서 한 시간 정도 있고
또 이제 각 잡고 놀려면 이제 진짜 한 시간,또 이제 각 잡고 놀려면 이제 진짜 한 시간
서비스받고 이러면 두 시간 정도까지,서비스받고 이러면 두 시간 정도까지
저는 그렇게 했던 것 같애요.,저는 그렇게 했던 것 같애요.
저 같은 경우에 이제 고등학교 삼 학년 때 수능 공부를,저 같은 경우에 이제 고등학교 삼 학년 때 수능 공부를
해야 되는 시점에서도 이제 놀 노래방을 자주 갔었던,해야 되는 시점에서도 이제 놀 노래방을 자주 갔었던
그런 전과가 있기 때문에,그런 전과가 있기 때문에
굉장히 노래방하고 친숙하다고 저는 생각을 해요.,굉장히 노래방하고 친숙하다고 저는 생각을 해요.
음~ 혹시 노래방에서 최대 몇 시간까지 있어 보셨어요?,음~ 혹시 노래방에서 최대 몇 시간까지 있어 보셨어요?
그때 인원이 한 일곱 명 여덟 명 됐어가지고,그때 인원이 한 일곱 명 여덟 명 됐어가지고
쫌 인원이 많긴 했지만 네 시간 있어 본 적 있어요.,조금 인원이 많긴 했지만 네 시간 있어 본 적 있어요.
네 시간 동안 진짜 목 터질 뻔했고,네 시간 동안 진짜 목 터질 뻔했고
혹시 최대 몇 시간 있어 보셨나요?,혹시 최대 몇 시간 있어 보셨나요?
저는 세 시간 채울려고 했는 의도,저는 세 시간 채울려고 했는 의도
저는 채울 수 있었는데 주변 애들이 도저히 힘들다고,저는 채울 수 있었는데 주변 애들이 도저히 힘들다고
이제 만류를 하길래 이제 한 두 시간 한 반 정도까지는 있어 봤던 것 같애요.,이제 만류를 하길래 이제 한 두 시간 한 반 정도까지는 있어 봤던 것 같애요.
세 시간 아쉽게도 못 채웠습니다.,세 시간 아쉽게도 못 채웠습니다.
기본적으로 한 시간 항상 넘게 있었던 것 같애요 기본적으로,기본적으로 한 시간 항상 넘게 있었던 것 같애요 기본적으로
그러면 어~,그러면 어~
혹시 준비하고자 하는 이제 취준생이라 하셨잖아요.,혹시 준비하고자 하는 이제 취준생이라 하셨잖아요.
이제 어떤 쪽으로 이제 꿈을 가지고 계신지,이제 어떤 쪽으로 이제 꿈을 가지고 계신지
물어봐도 될까요?,물어봐도 될까요?
저 아까 자격증 준비하는 것들 중에서,저 아까 자격증 준비하는 것들 중에서
무역 영어도 하나 준비하고 있거든요.,무역 영어도 하나 준비하고 있거든요.
그~ 최근에 시험을 쳤었는데 그~ 무역 영어를,그~ 최근에 시험을 쳤었는데 그~ 무역 영어를
그거를 자격증이 붙으면,그거를 자격증이 붙으면
무역 쪽으로 나갈 생각입니다.,무역 쪽으로 나갈 생각입니다.
