사투리,표준어
제가 요즘 성격 조사 많이 하잖아요.,제가 요즘 성격 조사 많이 하잖아요.
엠비티아이도 있고 그~ 최근에는,엠비티아이도 있고 그~ 최근에는
뭐~ 흑우 호구 테스트였나,뭐~ 흑우 호구 테스트였나
그거를 해봤는데 저는 사실 친구들 사이에서도 약간,그거를 해봤는데 저는 사실 친구들 사이에서도 약간
많이 퍼준다 약간 이런 식이었는데,많이 퍼준다 약간 이런 식이었는데
그~ 결과를 보니까 최고로 안 퍼주는 호구에서 정 반대되는 사람이더라고요.,그~ 결과를 보니까 최고로 안 퍼주는 호구에서 정 반대되는 사람이더라고요.
이런 약간 엠비티아이난 흑우 조사 이거 해보셨나요?,이런 약간 엠비티아이난 흑우 조사 이거 해보셨나요?
그 이게 엠비티아이 같은 경우에는 정식으로 이제 사이트에서 배포하는 거 말고 약간 파생되는 약간 이제,그 이게 엠비티아이 같은 경우에는 정식으로 이제 사이트에서 배포하는 거 말고 약간 파생되는 약간 이제
그~ 찌라시적인 거 있잖아요 그걸로 해봤는데,그~ 찌라시적인 거 있잖아요 그걸로 해봤는데
저 성격에는 이제 약간 그런 거 쫌 잘 믿거든요 그거 보면 어 난가 이러는 것도 많고 해서 쫌 잘 맞는 거 같애요 그래서,저 성격에는 이제 약간 그런 거 조금 잘 믿거든요 그거 보면 어 난가 이러는 것도 많고 해서 조금 잘 맞는 거 같애요 그래서
저 같은 경우에는 약간 성격이 일단은,저 같은 경우에는 약간 성격이 일단은
장점이면 장점이고 단점이 되면 아주 단점인 게 한 가지에 엄청 몰두해서 파고들거든요 그게,장점이면 장점이고 단점이 되면 아주 단점인 게 한 가지에 엄청 몰두해서 파고들거든요 그게
어케 어떻게 보면 이제,어떻게 어떻게 보면 이제
장점일 때는 뭔가,장점일 때는 뭔가
내가 하고 싶은 거 할 때 정말 그것만 몰두해서 하거든요 누가 말려도 안 들리고 그냥 그거에만 몰두를 해요 근데 이게,내가 하고 싶은 거 할 때 정말 그것만 몰두해서 하거든요 누가 말려도 안 들리고 그냥 그거에만 몰두를 해요 근데 이게
단점으로 바래 그거 발현이 됐을 때는 이제 어떻게 보면,단점으로 바래 그거 발현이 됐을 때는 이제 어떻게 보면
이제 나쁜 거를 진짜 어떻게든 내가 기분 나쁘에 들은 거는 그걸 끝까지 집중해서 그 계속 그것만 파고들거든요 그래서 어떻게 보면 이게,이제 나쁜 거를 진짜 어떻게든 내가 기분 나쁘에 들은 거는 그걸 끝까지 집중해서 그 계속 그것만 파고들거든요 그래서 어떻게 보면 이게
양날의 검 같은 건데 이게 좋을 때 쓰이면 정말 좋은 성격인데,양날의 검 같은 건데 이게 좋을 때 쓰이면 정말 좋은 성격인데
이게 나쁠 때 쓰이니까 정말,이게 나쁠 때 쓰이니까 정말
진짜 사람이 밑도 끝도 없는 약간 쫌생이가 되더라고요 그래서,진짜 사람이 밑도 끝도 없는 약간 쫌생이가 되더라고요 그래서
그런 점이 있는데 혹시 그거,그런 점이 있는데 혹시 그거
그~ 본인은 약간 그런 이제 뭐~,그~ 본인은 약간 그런 이제 뭐~
그런 뭐라 해야 되지 뭔가 실수라든지 따른 사람들에게 안 좋은 부정적인 영향을,그런 뭐라 해야 되지 뭔가 실수라든지 다른 사람들에게 안 좋은 부정적인 영향을
자신이 받잖아요 그랬을 때 약간 어떻게 대처하세요 약간 훌훌 털어버리세요 아님 약간 꿍해져 있는 그런 스타일이세요?,자신이 받잖아요 그랬을 때 약간 어떻게 대처하세요 약간 훌훌 털어버리세요 아님 약간 꿍해져 있는 그런 스타일이세요?
예전에는 제가,예전에는 제가
지금에도 지금도 약간 예민한 편이긴 한데,지금에도 지금도 약간 예민한 편이긴 한데
예전에는 쫌 많이 예민했었거든요.,예전에는 조금 많이 예민했었거든요.
그래서 사람들이 뭐라 하면은 뭐라 하면 약간 그 생각을 쫌 많이 한 거 같애요.,그래서 사람들이 뭐라 하면은 뭐라 하면 약간 그 생각을 조금 많이 한 거 같애요.
그래서 약간 생각을 하다 보면은 좀,그래서 약간 생각을 하다 보면은 좀
아 이게 나 나한테 시비를 건 건가 약간 그런 생각도 하고,아 이게 나 나한테 시비를 건 건가 약간 그런 생각도 하고
다음에 약간 또 뭐라 해야지 약간,다음에 약간 또 뭐라 해야지 약간
그거를 쫌 담아두는 편이었는데,그거를 조금 담아두는 편이었는데
한 이삼 년 아 한 이 년 전부터는,한 이삼 년 아 한 이 년 전부터는
쪼금 그런 거에 신경을 안 쓰는 편이더라고요.,쪼금 그런 거에 신경을 안 쓰는 편이더라고요.
그냥 누가 약간 싫은 소리를 이제 시작하면은 이제 딴소 딴생각을 해가지고,그냥 누가 약간 싫은 소리를 이제 시작하면은 이제 딴소 딴생각을 해가지고
아예 흘려버리고 이제 내 할 말만 하는,아예 흘려버리고 이제 내 할 말만 하는
약간 그렇게 되니까 약간 일반 일방통행적인 말이 되긴 하는데,약간 그렇게 되니까 약간 일반 일방통행적인 말이 되긴 하는데
저는 이게 의외로 그 스트레스에서 벗어날 수 있는 좋은 방법이라고 생각하는 편이거든요.,저는 이게 의외로 그 스트레스에서 벗어날 수 있는 좋은 방법이라고 생각하는 편이거든요.
나름 최근에는 스트레스를 많이 안 받고 있는데,나름 최근에는 스트레스를 많이 안 받고 있는데
제가 원래는 예민하다 했으니까 스트레스를,제가 원래는 예민하다 했으니까 스트레스를
금방 받고 잘 안 풀리는 경향이  있더라고요 혹시 스트레스는 자주 받으시는가요?,금방 받고 잘 안 풀리는 경향이  있더라고요 혹시 스트레스는 자주 받으시는가요?
또 저는 굉장히 스트레스를 쪼끔 자주 받는 편이거든요 근데 그게,또 저는 굉장히 스트레스를 쪼끔 자주 받는 편이거든요 근데 그게
어떻게 보면은 성격이 저는,어떻게 보면은 성격이 저는
어렸을 때 성격이랑 이제 크고 나서 성격이 되게 많이 달라졌어요 거의 백팔십 도 달라졌는데,어렸을 때 성격이랑 이제 크고 나서 성격이 되게 많이 달라졌어요 거의 백팔십 도 달라졌는데
어렸을 때 성격은 정말 정말 내성적이고 진짜 약간,어렸을 때 성격은 정말 정말 내성적이고 진짜 약간
주변에 끌려다니는 그런 친구였거든요 그러니깐,주변에 끌려다니는 그런 친구였거든요 그러니깐
자기주장은 절대 못 펼치고 약간 어떻게 하면 얘가 이렇게 받아들이면 어떻게 하지 이런 식으로 했었는데,자기주장은 절대 못 펼치고 약간 어떻게 하면 얘가 이렇게 받아들이면 어떻게 하지 이런 식으로 했었는데
이게 성인이 되고 이제 군대에서 약간 쪼끔 사회화가 제가 많이 진행이 됐거든요 근데,이게 성인이 되고 이제 군대에서 약간 쪼끔 사회화가 제가 많이 진행이 됐거든요 근데
그때 보면은 이제,그때 보면은 이제
약간 군대식으로 하면 선조치 후보고 식으로 된 게 이제 한 번 저지르고 나서 이제,약간 군대식으로 하면 선조치 후보고 식으로 된 게 이제 한 번 저지르고 나서 이제
후회하는 스타일이 됐어요 그래서 어떻게 됐냐면 이제,후회하는 스타일이 됐어요 그래서 어떻게 됐냐면 이제
약간 뭔가 지르는 거에 대해서는 뭔가 꺼리낌이 없어졌거든요 근데 이제 지르고 났었을 때 이제 후폭풍이 있잖아요 그때 이제 막 이불 많이 차고 아 이거,약간 뭔가 지르는 거에 대해서는 뭔가 꺼리낌이 없어졌거든요 근데 이제 지르고 났었을 때 이제 후폭풍이 있잖아요 그때 이제 막 이불 많이 차고 아 이거
아 이렇게 했었으면 안 됐었는데 이런 약간 후회도 많이 하고 그러니깐,아 이렇게 했었으면 안 됐었는데 이런 약간 후회도 많이 하고 그러니깐
약간 실수가 쪼끔 많이 잦아진 거 같애요 요새는 그래도 그거를 최소화하고 간소화하기 위해 서,약간 실수가 쪼끔 많이 잦아진 거 같애요 요새는 그래도 그거를 최소화하고 간소화하기 위해 서
이제 뭔가 사람들이랑 말하거나 할 때 뭔가 사람들마다 이제 뭔가 자기,이제 뭔가 사람들이랑 말하거나 할 때 뭔가 사람들마다 이제 뭔가 자기
약간 아킬레스건이 각자 다 다르잖아요 그니까 철없었을 때는,약간 아킬레스건이 각자 다 다르잖아요 그러니까 철없었을 때는
그게 어떤 건지 모르고 나는 이렇게 말해도 괜찮을 거야라고 생각했는데 그 친구는 아니었던 경우가 참 많았었거든요 그래서 요새는 그런 걸,그게 어떤 건지 모르고 나는 이렇게 말해도 괜찮을 거야라고 생각했는데 그 친구는 아니었던 경우가 참 많았었거든요 그래서 요새는 그런 걸
조심하는 부분이 있지만 그거를 이제 지나고 나서 이제 제가 혼자 이제,조심하는 부분이 있지만 그거를 이제 지나고 나서 이제 제가 혼자 이제
이제 약간 자기 전에 누울 때 그런 생각을 제일 많이 하잖아요 그러면,이제 약간 자기 전에 누울 때 그런 생각을 제일 많이 하잖아요 그러면
아 이거는 내가 쫌 날 말이 말에 약간 날카롭게 서 있다고 받아들일 수도 있겠다 상대방이 이런 식으로 약간,아 이거는 내가 조금 날 말이 말에 약간 날카롭게 서 있다고 받아들일 수도 있겠다 상대방이 이런 식으로 약간
어떻게 보면 걔는 이제 뭐~ 다음에 얘기했었을 때 별로 그런 게 없었지만 그래도 뭔가 제 마음이 찜찜함이 남아 있어서 약간 신경도 신경을 쪼끔 덜 써도 되는 스트레스를 쫌 많이 받거든요 그래서,어떻게 보면 걔는 이제 뭐~ 다음에 얘기했었을 때 별로 그런 게 없었지만 그래도 뭔가 제 마음이 찜찜함이 남아 있어서 약간 신경도 신경을 쪼끔 덜 써도 되는 스트레스를 조금 많이 받거든요 그래서
네 그런 게 있고 이제 뭐~,네 그런 게 있고 이제 뭐~
어~ 또 이제 약간,어~ 또 이제 약간
성격을 이제 얘기를 하니까 보면은,성격을 이제 얘기를 하니까 보면은
뭔가 다혈질적인 부분이 있거든요 그러니깐,뭔가 다혈질적인 부분이 있거든요 그러니깐
살짝 화를 안 내도 될 부분인데 그 그때 약간 순간 약간 아 이런 식으로 소리를 지른다든지 이런 식으로 할 때가 있는데,살짝 화를 안 내도 될 부분인데 그 그때 약간 순간 약간 아 이런 식으로 소리를 지른다든지 이런 식으로 할 때가 있는데
혹시 약간 쪼금 그런 거 성격에 대해서 쫌 잔잔한 편이세요 아니면은 쪼끔 그때 감정 기복에 따라서 쪼끔 많이 달라지시나요?,혹시 약간 쪼금 그런 거 성격에 대해서 조금 잔잔한 편이세요 아니면은 쪼끔 그때 감정 기복에 따라서 쪼끔 많이 달라지시나요?
저는,저는
잔잔 사실 쫌 화났을 때는 저도 뭐라 하는 편인데,잔잔 사실 조금 화났을 때는 저도 뭐라 하는 편인데
최근에는 계속 화나는 일이 없다 보니까 누가 뭐라 해도,최근에는 계속 화나는 일이 없다 보니까 누가 뭐라 해도
그냥 한 귀로 듣고 아 아예 한 귀로 듣지도 않고 그냥  딴생각하면서,그냥 한 귀로 듣고 아 아예 한 귀로 듣지도 않고 그냥  딴생각하면서
그냥 제 할 말을 하고,그냥 제 할 말을 하고
약간 싸울 때도 말싸움을 하더라도,약간 싸울 때도 말싸움을 하더라도
이제 걔는 분명히 화가 나서 나한테 뭐라 하는데,이제 걔는 분명히 화가 나서 나한테 뭐라 하는데
이제 딴생각을 하서 이제 내 할 말만 하자 약간,이제 딴생각을 하서 이제 내 할 말만 하자 약간
그런 식으로 그냥 받아들이니까,그런 식으로 그냥 받아들이니까
이게 의외로 스트레스도 안 받고 그 친구는 스트레스를 엄청 받는데,이게 의외로 스트레스도 안 받고 그 친구는 스트레스를 엄청 받는데
뭐~ 다음에 만나면은 또 풀어져 있고 쫌 시간이 약인 거 같더라고요 저는,뭐~ 다음에 만나면은 또 풀어져 있고 조금 시간이 약인 거 같더라고요 저는
그래서,그래서
이게 쫌 제 약간 저 위주로 대화가 돌아가긴 하는데,이게 조금 제 약간 저 위주로 대화가 돌아가긴 하는데
이게 저한테는 너무 이게 편한 방식이라고 생각되니까 이걸 계속 쓰게 되더라고요.,이게 저한테는 너무 이게 편한 방식이라고 생각되니까 이걸 계속 쓰게 되더라고요.
이게 원래 스트레스를 많이 받는 편인데 누가 한,이게 원래 스트레스를 많이 받는 편인데 누가 한
누가 또 지적을 하거나 이런 걸 되게 신경을 많이 썼거든요.,누가 또 지적을 하거나 이런 걸 되게 신경을 많이 썼거든요.
근데 딱 지적을 할라하면은 이제 딴생각을 해가지고 최대한 안 들을려고 하니까,근데 딱 지적을 할라하면은 이제 딴생각을 해가지고 최대한 안 들을려고 하니까
그~ 지적한 거에 대해 약간,그~ 지적한 거에 대해 약간
그 지적에 고치지는 못하더라도 내가 그거를 통해서 스트레스를 안 받으니까,그 지적에 고치지는 못하더라도 내가 그거를 통해서 스트레스를 안 받으니까
그게 쫌 좋더라고요.,그게 조금 좋더라고요.
따로 저는 스트레스받는 거는 별로 없어가지고 음~,따로 저는 스트레스받는 거는 별로 없어가지고 음~
제가 저도 성격이 예전과 진짜 많이 바꼈거든요.,제가 저도 성격이 예전과 진짜 많이 바뀌었거든요.
예전엔 이렇게 혼자 뭐~ 따른 거 아르바이트하러 오거나 약간 그런 것도 못 했고,예전엔 이렇게 혼자 뭐~ 다른 거 아르바이트하러 오거나 약간 그런 것도 못 했고
혼자 밥도 잘 못 먹어가지고,혼자 밥도 잘 못 먹어가지고
밖에서는 아예 밥도 못 먹었고 그랬는데,밖에서는 아예 밥도 못 먹었고 그랬는데
아~ 최근 들어서는 혼자 먹는 게 더 편한 거 같기도 하고,아~ 최근 들어서는 혼자 먹는 게 더 편한 거 같기도 하고
이제 밥 먹으면서 누가 옆에 있으면 계속 말을 해야 되니까,이제 밥 먹으면서 누가 옆에 있으면 계속 말을 해야 되니까
밥 먹으면서 저는 생각을 많이 하는 편이라서,밥 먹으면서 저는 생각을 많이 하는 편이라서
내가 자유롭게 생각도 할 수 있고 그게 좋더라고요.,내가 자유롭게 생각도 할 수 있고 그게 좋더라고요.
그리고 어릴 때는 이런 사람들 만나는 것도 쫌,그리고 어릴 때는 이런 사람들 만나는 것도 조금
사람들 만나서 이 어색함 이런 것도 좀,사람들 만나서 이 어색함 이런 것도 좀
거부해가지고 별로 만나지도 않고 그랬는데,거부해가지고 별로 만나지도 않고 그랬는데
최근에는,최근에는
사람들도 많이 만나고,사람들도 많이 만나고
그러고 있는 편이거든요.,그러고 있는 편이거든요.
그래서 이래 사람들 많이 만나니까 사람을 통해 받는 스트레스가 쫌 있는 편이었는데,그래서 이렇게 사람들 많이 만나니까 사람을 통해 받는 스트레스가 조금 있는 편이었는데
약간 한 귀로 듣고 한 귀로 듣지도 않고 흘러보내고,약간 한 귀로 듣고 한 귀로 듣지도 않고 흘러보내고
팅겨내 버리고 하니까 사람들 많이 만나더라도 그냥,팅겨내 버리고 하니까 사람들 많이 만나더라도 그냥
스트레스도 없이 지내고 있는 거 같애요.,스트레스도 없이 지내고 있는 거 같애요.
그리고,그리고
최근에 그~ 유행하는 엠비티아이 제가 이엔에프제이라고 계획적인 유형이라고 나왔는데,최근에 그~ 유행하는 엠비티아이 제가 이엔에프제이라고 계획적인 유형이라고 나왔는데
저는 제이가 계획 피가 그냥,저는 제이가 계획 피가 그냥
아무 계획 없는 무계획이라 해야 되나 아무튼 그런 건데,아무 계획 없는 무계획이라 해야 되나 아무튼 그런 건데
친구들은 저를,친구들은 저를
제이라고 안 보더라고요.,제이라고 안 보더라고요.
보면은 저는 나 머리에 속에 계획을 항상 하고,보면은 저는 나 머리에 속에 계획을 항상 하고
움직이는 편인데,움직이는 편인데
말을 하더라도 약간,말을 하더라도 약간
이게 계획이 안 된 거 아닌가 약간 그런 식으로 말을 해가지고,이게 계획이 안 된 거 아닌가 약간 그런 식으로 말을 해가지고
아~ 나는 일단은 만 하루 전부터 계획을 어떻게 할지 딱 정하고 오는 편인데,아~ 나는 일단은 만 하루 전부터 계획을 어떻게 할지 딱 정하고 오는 편인데
이걸 내보고 제이라 아니라 제이가 아니라 하다니 약간,이걸 내보고 제이라 아니라 제이가 아니라 하다니 약간
쫌 의아하기도 하고,조금 의아하기도 하고
저도 그 엠비티아이 결과를 보고 이 결과가 맞는 거 같기도 한데,저도 그 엠비티아이 결과를 보고 이 결과가 맞는 거 같기도 한데
사람들은 아니라고 하니까 함 다시 봤는데 또 같은 결과가 나오더라고요 그래서,사람들은 아니라고 하니까 함 다시 봤는데 또 같은 결과가 나오더라고요 그래서
이게 내 성격 파악하기도 근데 쫌 어려운 거 같애요.,이게 내 성격 파악하기도 근데 조금 어려운 거 같애요.
사실 어떨 때는 그~ 계획은 항상 하는데 그 계획을 실행시키기가 너무 어려운 거잖아요.,사실 어떨 때는 그~ 계획은 항상 하는데 그 계획을 실행시키기가 너무 어려운 거잖아요.
그~ 아마 계획은 하는데 실행시키기가 어려워서 그 성격에서,그~ 아마 계획은 하는데 실행시키기가 어려워서 그 성격에서
아닌 거 같다 약간 그런 얘기가 많이 나온 거 같애요.,아닌 거 같다 약간 그런 얘기가 많이 나온 거 같애요.
혹시 그~ 엠비티아이 유형은 어떻게 되시는지 아시나요?,혹시 그~ 엠비티아이 유형은 어떻게 되시는지 아시나요?
저는 아까 말씀드린 것처럼 그~ 뭐였지 정식 홈페이지에서 한 게 아니라 약간 찌라시적인 거로 해서,저는 아까 말씀드린 것처럼 그~ 뭐였지 정식 홈페이지에서 한 게 아니라 약간 찌라시적인 거로 해서
그~ 알파벳은 생각 안 나는데 그기 부가적으로 발랄할 활동가인가 그걸로 나왔었는되에,그~ 알파벳은 생각 안 나는데 거기 부가적으로 발랄할 활동가인가 그걸로 나왔었는되에
이제 그 성격이 약간 쫌 저랑 많이 맞더라고요 근데 지금 또 생각할라니까 기억이 잘 안 나는데,이제 그 성격이 약간 조금 저랑 많이 맞더라고요 근데 지금 또 생각할라니까 기억이 잘 안 나는데
그냥 그~ 성격이 저였어요 그래서,그냥 그~ 성격이 저였어요 그래서
약간 뭔가 사람들이랑 다니는 것도 좋아하고 그다음에 뭔가,약간 뭔가 사람들이랑 다니는 것도 좋아하고 그다음에 뭔가
뭐라고 해야 되지 약간 그룹에 있었을 때 저 같은 경우에는 뭔가 먼저 말하거나 이런 식으로 하는 거보다는 주변 의견에 같이 약간 동화돼서 이렇게,뭐라고 해야 되지 약간 그룹에 있었을 때 저 같은 경우에는 뭔가 먼저 말하거나 이런 식으로 하는 거보다는 주변 의견에 같이 약간 동화돼서 이렇게
갈려고 하는 경향이 크거든요.,갈려고 하는 경향이 크거든요.
어 어떻게 보면은 이제 말씀하신 거처럼 이제,어 어떻게 보면은 이제 말씀하신 거처럼 이제
혼자 이제 어떻게 하고 정리를 하는 게 편하신 거처럼 저 같은 경우에는 이제 따른 사람들한테 그걸 이제 선택권을 주어졌을 때 그기에서 오는 편안함이 더 컸던 거 같애요 그래서,혼자 이제 어떻게 하고 정리를 하는 게 편하신 거처럼 저 같은 경우에는 이제 다른 사람들한테 그걸 이제 선택권을 주어졌을 때 거기에서 오는 편안함이 더 컸던 거 같애요 그래서
저는 이제 뭔가 모임이라든지 이런 거 있었을 때 뭐~ 물론 제가 얘기하고 싶었던 것도 얘기를 하지만,저는 이제 뭔가 모임이라든지 이런 거 있었을 때 뭐~ 물론 제가 얘기하고 싶었던 것도 얘기를 하지만
그렇지만 이제 주,그렇지만 이제 주
보통 이제 그 그룹에 이제 다수결이든 뭔가 한쪽으로 쪼끔 치우치잖아요 그러면 그 의견을 최대한 따라가는 그런 입장이거든요 그래서,보통 이제 그 그룹에 이제 다수결이든 뭔가 한쪽으로 쪼끔 치우치잖아요 그러면 그 의견을 최대한 따라가는 그런 입장이거든요 그래서
근데 이제 최근에는 쪼끔 그게 한 번 제 성격이 한 번,근데 이제 최근에는 쪼끔 그게 한 번 제 성격이 한 번
삐끄덕 한 번 할 뻔했었던 게 약간 제가,삐끄덕 한 번 할 뻔했었던 게 약간 제가
약간 추구하는 사상이 그~ 제 약간 좌우명이 그럴 수도 있다 이건 데 그리고,약간 추구하는 사상이 그~ 제 약간 좌우명이 그럴 수도 있다 이건 데 그리고
그~ 뭔가 이 문제 좋은 점을 생각하는 거에 대해서 생각을 많이 하는데,그~ 뭔가 이 문제 좋은 점을 생각하는 거에 대해서 생각을 많이 하는데
요번에 제가 대학교 졸업,요번에 제가 대학교 졸업
그거  졸업 졸전이라고 졸업 전시를 한 번 했었거든요 근데,그거  졸업 졸전이라고 졸업 전시를 한 번 했었거든요 근데
거기서 졸준이라고 이제 졸업을 준비하는 이제 인원을 몇 명 뽑아서 같이 하는 게 있는데 그게 저랑 이제 나머지 뭐~ 파트별로 애들 뽑아서 했었는데,거기서 졸준이라고 이제 졸업을 준비하는 이제 인원을 몇 명 뽑아서 같이 하는 게 있는데 그게 저랑 이제 나머지 뭐~ 파트별로 애들 뽑아서 했었는데
거기에서 약간 성격이 굉장히 쫌 예민해지고,거기에서 약간 성격이 굉장히 조금 예민해지고
조금 신경질적으로 많이 하고 이제 욕도 좀 많이 했 했었거든요 그러니깐 이제,조금 신경질적으로 많이 하고 이제 욕도 좀 많이 했 했었거든요 그러니깐 이제
애들도 이제 뭐~ 나중에 이제 듀 이제 또 따로 뭐~ 애들이랑 놀러 가서 얘기했을 때,애들도 이제 뭐~ 나중에 이제 듀 이제 또 따로 뭐~ 애들이랑 놀러 가서 얘기했을 때
뭔가 그때 형이 지금 뭔가 졸준 이 전후로 성격이 쫌 많이 바꼈다 많이 사람이 날타로워졌다 이런 얘기를 많이,뭔가 그때 형이 지금 뭔가 졸준 이 전후로 성격이 조금 많이 바뀌었다 많이 사람이 날타로워졌다 이런 얘기를 많이
들었고 저도 그걸 느끼고 있었었어요 굉장히 사람이 예민해져가지고 평소 같으면 그냥 웃어넘길 건데 뭔가,들었고 저도 그걸 느끼고 있었었어요 굉장히 사람이 예민해져가지고 평소 같으면 그냥 웃어넘길 건데 뭔가
항상 쫌 날이 서 있어가지고 말도 그냥,항상 조금 날이 서 있어가지고 말도 그냥
뭐~ 그냥 넘어가도 되는 건데 한 마디 괜히 툭 덕 더 던지고 이런 식으로 했어가지고,뭐~ 그냥 넘어가도 되는 건데 한 마디 괜히 툭 덕 더 던지고 이런 식으로 했어가지고
근데 그거는 이제 요새는 시간이 쪼끔 흐름에 따라서 다시 유해지고 있는 과정을 지나고 있는데,근데 그거는 이제 요새는 시간이 쪼끔 흐름에 따라서 다시 유해지고 있는 과정을 지나고 있는데
이제 그때 이제 쫌 깨달았던 거는 저는 항상 그게 있었거든요 그~ 아까도,이제 그때 이제 조금 깨달았던 거는 저는 항상 그게 있었거든요 그~ 아까도
뭔가 한가운데 빠지면 그거에만 생각을 한다 했잖아요 그래서,뭔가 한가운데 빠지면 그거에만 생각을 한다 했잖아요 그래서
되게 사람 따른 사람에 말에 대해서 엄청 예민하게 반응을 했었어요 그래가지고,되게 사람 다른 사람에 말에 대해서 엄청 예민하게 반응을 했었어요 그래가지고
아 저 애는 왜 이 얘기를 나한테 했을 건가 이거에 대해서 괭장히 의문을 많이 품었었는데,아 저 애는 왜 이 얘기를 나한테 했을 건가 이거에 대해서 괭장히 의문을 많이 품었었는데
그게 이번에 졸준이 하면서 느꼈는데 그게,그게 이번에 졸준이 하면서 느꼈는데 그게
