사투리,표준어
혹시  님은 제일 기억에 남는 콘서트가 있으신가요?,혹시  님은 제일 기억에 남는 콘서트가 있으신가요?
아~ 저 같은 경우는 콘서트 다니는 걸 좋아하는데 쫌 장르 안 가리고 보긴 하는데,아~ 저 같은 경우는 콘서트 다니는 걸 좋아하는데 조금 장르 안 가리고 보긴 하는데
그~ 제가 옛날에 아이돌 가수를 좋아해가지고 그~,그~ 제가 옛날에 아이돌 가수를 좋아해가지고 그~
젝스키스하고 오랜만에 이제 다시 뭉쳐서 콘서트를 했을 때 제가 서울 가서 본 적이 있거든요 그게 제일 기억에 남아요 혹시  님은,젝스키스하고 오랜만에 이제 다시 뭉쳐서 콘서트를 했을 때 제가 서울 가서 본 적이 있거든요 그게 제일 기억에 남아요 혹시  님은
기억에 남는 공연 같은 게 있나요?,기억에 남는 공연 같은 게 있나요?
저는 스무 살 초반에 서울 대학로에서 연극 공포 연극을 본 적이 있거든요.,저는 스무 살 초반에 서울 대학로에서 연극 공포 연극을 본 적이 있거든요.
그때 처음 연극을 봤었는데 되게,그때 처음 연극을 봤었는데 되게
배우들이 활동감 있게 느껴지더라고요.,배우들이 활동감 있게 느껴지더라고요.
별로 기대 안 하고 봤었는데,별로 기대 안 하고 봤었는데
아~ 사람들이 왜 배우를  지망하고,아~ 사람들이 왜 배우를  지망하고
왜 연기를 하고 싶었하는지 알겠다고 생각이 들 정도로,왜 연기를 하고 싶었하는지 알겠다고 생각이 들 정도로
되게 그 역할에 대해 심취해있다고 생각했고,되게 그 역할에 대해 심취해있다고 생각했고
되게 관객들의 보기에도 정말 잘한다고 생각이 들었거든요.,되게 관객들의 보기에도 정말 잘한다고 생각이 들었거든요.
혹시  님은 연극은 보신 적 있으신가요?,혹시  님은 연극은 보신 적 있으신가요?
네 전 초반에 옛날 이십 대 초반에 연극을 봤을 때는 쫌,네 전 초반에 옛날 이십 대 초반에 연극을 봤을 때는 조금
너무 기대를 해서 그런지 약간 너무 어설프고 이래서 실망을 해서 한동안 안 보다가,너무 기대를 해서 그런지 약간 너무 어설프고 이래서 실망을 해서 한동안 안 보다가
최근 들어서 한 작년쯤부터,최근 들어서 한 작년쯤부터
다시 보기 시작을 했는데 확실히 예전에 봤을 때랑은,다시 보기 시작을 했는데 확실히 예전에 봤을 때랑은
다르게  님이 말씀하신 것처럼 쫌 생동감도 느껴졌고,다르게  님이 말씀하신 것처럼 조금 생동감도 느껴졌고
그다음에 직접 가서 보다 보니까 또 생동감도 느껴지고 약간,그다음에 직접 가서 보다 보니까 또 생동감도 느껴지고 약간
집에서 그냥 화면에서 보는 그런 공연이랑은 많이 다르더라고요.,집에서 그냥 화면에서 보는 그런 공연이랑은 많이 다르더라고요.
근데 이제 부산 같은 경우는 볼 수 있는 곳이,근데 이제 부산 같은 경우는 볼 수 있는 곳이
너무 한정적이니까 참 많이 못 보는 게 쫌 아쉬워요.,너무 한정적이니까 참 많이 못 보는 게 조금 아쉬워요.
님 같은 경우는 그럼 연극 주로 어디서 보세요?,님 같은 경우는 그럼 연극 주로 어디서 보세요?
아~ 저는 연극 본 건 그거 한 번뿐이고요 따로 저도 부산에 살다 보니까,아~ 저는 연극 본 건 그거 한 번뿐이고요 따로 저도 부산에 살다 보니까
부산에 연극을 하는 곳은 있겠지만 찾아서,부산에 연극을 하는 곳은 있겠지만 찾아서
본다 보지는 못 했던 것 같아요.,본다 보지는 못 했던 것 같아요.
아~ 그리고 대학 때 대학에 있으면서 대학생들끼리 연극을 하는 게 있었거든요.,아~ 그리고 대학 때 대학에 있으면서 대학생들끼리 연극을 하는 게 있었거든요.
그때가 봤을 때는 그~ 수정 하  님이 말씀하셨다시피,그때가 봤을 때는 그~ 수정 하  님이 말씀하셨다시피
약간 어설픈 게 있어서 그 연극은 그렇게,약간 어설픈 게 있어서 그 연극은 그렇게
재밌다고는 생각 안 했어요 그리고 제 친구가 부산에서 끼리 프로젝트라고,재밌다고는 생각 안 했어요 그리고 제 친구가 부산에서 끼리 프로젝트라고
뮤지컬을 한 적이 있거든요 그때도,뮤지컬을 한 적이 있거든요 그때도
그때 봤을 때도 되게 재밌어 보였었거든요.,그때 봤을 때도 되게 재밌어 보였었거든요.
혹시  님은 뮤지컬을 보신 적이 있거나 혹시 뮤지컬 하신 적이 있나요?,혹시  님은 뮤지컬을 보신 적이 있거나 혹시 뮤지컬 하신 적이 있나요?
아~ 저는 뮤지컬은 아직까지 본 적이 없구요.,아~ 저는 뮤지컬은 아직까지 본 적이 없구요.
아무래도 부산에서 뮤지컬 보기가 힘드니까 근데 최근에,아무래도 부산에서 뮤지컬 보기가 힘드니까 근데 최근에
이제 부산에도 크게 생겨서 기대를 했는데,이제 부산에도 크게 생겨서 기대를 했는데
코로나 땜에 보기가 쫌 겁이 나서 못 보고 있구요.,코로나 때문에 보기가 조금 겁이 나서 못 보고 있구요.
저는 사실 뮤지컬보다는 쫌 콘서트를 좋아하는 편이라서,저는 사실 뮤지컬보다는 조금 콘서트를 좋아하는 편이라서
어~ 콘서트 같은 경우는,어~ 콘서트 같은 경우는
쫌 장르 안 가리고 잘 보거든요  님 같은 경우는 뭐~ 쫌 인상 깊었던 콘서트는 없으세요?,조금 장르 안 가리고 잘 보거든요  님 같은 경우는 뭐~ 조금 인상 깊었던 콘서트는 없으세요?
저는 부산에서 열리는 록 페스티벌을 몇 번 가봤거든요 최근에는 유료로 바껴서 거의 안 가 안 갔었는데,저는 부산에서 열리는 록 페스티벌을 몇 번 가봤거든요 최근에는 유료로 바뀌어서 거의 안 가 안 갔었는데
그~ 이천  십 년대 초반 그쯤은,그~ 이천  십 년대 초반 그쯤은
무료라서 되게 다양한 팀들이 와서 공연을 했던 기억이 남고,무료라서 되게 다양한 팀들이 와서 공연을 했던 기억이 남고
제가 좋아하는 뭐~ 윤도현 밴드도 처음으로 실제로 봤던 게 록 페스티벌이었구요 그리고,제가 좋아하는 뭐~ 윤도현 밴드도 처음으로 실제로 봤던 게 록 페스티벌이었구요 그리고
최근에 유명해진 잔나비라고,최근에 유명해진 잔나비라고
그 밴드도 그~ 우연찮게 보게 됐는데,그 밴드도 그~ 우연찮게 보게 됐는데
되게 라이브를 잘하더라고요.,되게 라이브를 잘하더라고요.
그래서 그때도 되게 좋았는데 아~ 뜰 것 같다고 생각했었는데,그래서 그때도 되게 좋았는데 아~ 뜰 것 같다고 생각했었는데
진짜 뜨더라고요 잔나비라는 밴드가,진짜 뜨더라고요 잔나비라는 밴드가
혹시  님은,혹시  님은
콘서트 굿즈 같은 거 사보신 적 있으세요?,콘서트 굿즈 같은 거 사보신 적 있으세요?
아~ 저는 이제 아이돌 좋아했었다 보니까,아~ 저는 이제 아이돌 좋아했었다 보니까
응원봉 정도까지는,응원봉 정도까지는
이제 공연 보면서 즐기는 용으로는 사긴 했는데,이제 공연 보면서 즐기는 용으로는 사긴 했는데
나머지 요즘 디기 종류 많이 나오잖아요 그런 게 생각보다 가격이 많이 비싸더라고요,나머지 요즘 되게 종류 많이 나오잖아요 그런 게 생각보다 가격이 많이 비싸더라고요
사실 공연 티켓도 그렇게 저렴한 편이 아니라고 생각을 하니까,사실 공연 티켓도 그렇게 저렴한 편이 아니라고 생각을 하니까
굿즈까지는 못 사고 딱 응원봉 정도까지,굿즈까지는 못 사고 딱 응원봉 정도까지
그것도 이제 제가 좋아하는 가수 것만 사고 이제 다른 가수들 거는 사실 응원봉조차도 쫌 잘 안 사는 것 같긴 해요.,그것도 이제 제가 좋아하는 가수 것만 사고 이제 다른 가수들 거는 사실 응원봉조차도 조금 잘 안 사는 것 같긴 해요.
저도 그~ 옛날에 부산 그~ 삼락 록 페스티벌,저도 그~ 옛날에 부산 그~ 삼락 록 페스티벌
보러 갔었는데 그~ 참,보러 갔었는데 그~ 참
유료가 돼서 아쉽더라고요 근데 거기서 저는 약간 록에 매력을 쪼끔 느꼈었거든요 처음에 모르고 갔다가,유료가 돼서 아쉽더라고요 근데 거기서 저는 약간 록에 매력을 쪼끔 느꼈었거든요 처음에 모르고 갔다가
거기서 막 장미여관 이런 사람들도 알게 되고 로맨틱펀치 이런 사람들도 알게 돼가지고,거기서 막 장미여관 이런 사람들도 알게 되고 로맨틱펀치 이런 사람들도 알게 돼가지고
참 좋은데 아쉽게 생각을 해요.,참 좋은데 아쉽게 생각을 해요.
혹시  님은 뭐~ 공연장 가서 뭐~ 특별한 에피소드 같은 게 있으세요?,혹시  님은 뭐~ 공연장 가서 뭐~ 특별한 에피소드 같은 게 있으세요?
제가 대학교 때 밴드 했다고 했는데 저 경북 영주에 가서 꼬물이라고 외부 공연을 한 적이 있거든요.,제가 대학교 때 밴드 했다고 했는데 저 경북 영주에 가서 꼬물이라고 외부 공연을 한 적이 있거든요.
그때 대학생 밴드들끼리,그때 대학생 밴드들끼리
타지역 밴드들끼리 모여서 공연하는 거였는데,타지역 밴드들끼리 모여서 공연하는 거였는데
되게 실수를 많이 했어요 그때 기억이 제일 많이 남고,되게 실수를 많이 했어요 그때 기억이 제일 많이 남고
시간도 촉박하고 저녁도 늦게까지 해서 되게 피곤했던 기억이 있어요.,시간도 촉박하고 저녁도 늦게까지 해서 되게 피곤했던 기억이 있어요.
혹시  님은 공연장 에피소드 같은 거 있으신가요?,혹시  님은 공연장 에피소드 같은 거 있으신가요?
아~ 저는,아~ 저는
그~ 록 페스티벌 갔다 온 이후로 약간 록 밴드에 살짝 빠져서 소극장 공연 같은 데를 몇 번 갔었거든요.,그~ 록 페스티벌 갔다 온 이후로 약간 록 밴드에 살짝 빠져서 소극장 공연 같은 데를 몇 번 갔었거든요.
근데 이제 거기는 워낙 뭐라 해야 되지 그~ 가수분이랑 가깝게 있으니까,근데 이제 거기는 워낙 뭐라 해야 되지 그~ 가수분이랑 가깝게 있으니까
참여도도 높고 막 쫌 열심히 쫌 이케 반응을 하고 이랬더니 막 맥주  쿠폰 같은 것도 직접 주시고 가수분이,참여도도 높고 막 조금 열심히 조금 이렇게 반응을 하고 이랬더니 막 맥주  쿠폰 같은 것도 직접 주시고 가수분이
그랬던 적이 있고요.,그랬던 적이 있고요.
나머지는 다른 공연 같은 경우는 쫌 워낙 멀다 보니까,나머지는 다른 공연 같은 경우는 조금 워낙 멀다 보니까
음~ 이게 참여도가 쪼끔 걍 낮았다 해야 되나 쫌 멀리서 지켜보고?,음~ 이게 참여도가 쪼끔 그냥 낮았다 해야 되나 조금 멀리서 지켜보고?
약간 오히려 공연장 가서 본 것보다는 이제 공연,약간 오히려 공연장 가서 본 것보다는 이제 공연
보러 가기 전까지 티켓팅하는데 쫌 에피소드가 좀 있어요 아무래도,보러 가기 전까지 티켓팅하는데 조금 에피소드가 좀 있어요 아무래도
이제 사람들이 많이 모이는 공연이다 보니까,이제 사람들이 많이 모이는 공연이다 보니까
이게 저 혼자만으로는 도저히 살 수가 없더라고요 그래서 막 주변 친구들한테도 부탁하고 막 다 같이 들어가가지고 막 해도 겨우 막 자리 하나 잡고 두 개 잡고,이게 저 혼자만으로는 도저히 살 수가 없더라고요 그래서 막 주변 친구들한테도 부탁하고 막 다 같이 들어가가지고 막 해도 겨우 막 자리 하나 잡고 두 개 잡고
그렇게 해서 겨우 갔다 오고 그랬거든요 근데 또 요즘에는 그~ 나훈아 님 콘서트가 효자 콘서트로 난리잖아요.,그렇게 해서 겨우 갔다 오고 그랬거든요 근데 또 요즘에는 그~ 나훈아 님 콘서트가 효자 콘서트로 난리잖아요.
그래서 이번에도 막,그래서 이번에도 막
어머님하고 보내드려 볼 거라고 막 온 친구들이 다 같이 막 해,어머님하고 보내드려 볼 거라고 막 온 친구들이 다 같이 막 해
보는데도 안 되더라고요 혹시 뭐~ 티켓팅 이런 거는 한 번 해보셨어요?,보는데도 안 되더라고요 혹시 뭐~ 티켓팅 이런 거는 한 번 해보셨어요?
저는 공연 보면 거의 다 무료 공연 같은 걸 보고 티켓팅이 빡센 데는,저는 공연 보면 거의 다 무료 공연 같은 걸 보고 티켓팅이 힘든 데는
잘 안 들어가는 것 같아요 성격 자체가 그런 거를 하는 거 자체가 되게 귀 되게 귀찮다고 생각하고 굳이,잘 안 들어가는 것 같아요 성격 자체가 그런 거를 하는 거 자체가 되게 귀 되게 귀찮다고 생각하고 굳이
어~ 티켓팅을  하면서,어~ 티켓팅을  하면서
볼 필요까지는 없고 솔직히 무료 공연도 찾아보다 보면,볼 필요까지는 없고 솔직히 무료 공연도 찾아보다 보면
되게 괜찮은 공연이 많다고 생각해요.,되게 괜찮은 공연이 많다고 생각해요.
그래서 따로 티켓팅에 대해 에피소드는 없고요 저는 광안리나 해운대,그래서 따로 티켓팅에 대해 에피소드는 없고요 저는 광안리나 해운대
가끔씩,가끔씩
우울해질 때 바다보러 가는 거 되게 좋아하는데 그때 버스킹하는 사람들이 되게 많이 있는 거예요.,우울해질 때 바다보러 가는 거 되게 좋아하는데 그때 버스킹하는 사람들이 되게 많이 있는 거예요.
거기서 노래하는 사람들도 있고 뭐~ 마술 여러 가지 있었는데,거기서 노래하는 사람들도 있고 뭐~ 마술 여러 가지 있었는데
마술하는 버스킹이 재미없을 거라고 생각했는데,마술하는 버스킹이 재미없을 거라고 생각했는데
노래하는 버스킹보다 오히려 더 재밌더라고요.,노래하는 버스킹보다 오히려 더 재밌더라고요.
혹시  님은 이색적인 버스킹이나 이색적인 공연 같은 거 본 적 있으세요?,혹시  님은 이색적인 버스킹이나 이색적인 공연 같은 거 본 적 있으세요?
이색적인 버스킹은 본 적이 없는 것 같아요 외국여행가서 약간,이색적인 버스킹은 본 적이 없는 것 같아요 외국여행가서 약간
뭐라 그래야 되지 이렇게 조각 인형 같은 걸로 하는 거 그게 최대인 것 같구요 그냥,뭐라 그래야 되지 이렇게 조각 인형 같은 걸로 하는 거 그게 최대인 것 같구요 그냥
저 제가 여태 본 버스킹은,저 제가 여태 본 버스킹은
님이 말씀하신 대로 광안리에서 본 거라던가 아니면 뭐~ 남포동 길가에서,님이 말씀하신 대로 광안리에서 본 거라던가 아니면 뭐~ 남포동 길가에서
노래 부르시는 거 그런 거 본 게 다인 것 같애요 근데 이제 그~,노래 부르시는 거 그런 거 본 게 다인 것 같애요 근데 이제 그~
예전에 서울로 놀러 갔을 때 대학로 거리에서 막,예전에 서울로 놀러 갔을 때 대학로 거리에서 막
춤 추고 이러는 거를 보는데,춤 추고 이러는 거를 보는데
거기는 쫌 그렇게 버스킹을 디게 많이 하더라고요.,거기는 조금 그렇게 버스킹을 되게 많이 하더라고요.
꼭 내가 좋아하는 장르가 아니더라도 게 쫌 많이 볼 수 있는 게,꼭 내가 좋아하는 장르가 아니더라도 게 조금 많이 볼 수 있는 게
쫌 다양하고 이래서 재미도 있었던 것 같애요.,조금 다양하고 이래서 재미도 있었던 것 같애요.
근데 아무래도 부산에서는 쫌 뭔가 문화생활을 즐기기가,근데 아무래도 부산에서는 조금 뭔가 문화생활을 즐기기가
힘든 것 같기는 한데 혹시,힘든 것 같기는 한데 혹시
님 같은 경우는 이제 좋아하시는 뭐~ 록 밴드 이런 거 말고는 조금 관심 있는 장르 같은 건 없으세요?,님 같은 경우는 이제 좋아하시는 뭐~ 록 밴드 이런 거 말고는 조금 관심 있는 장르 같은 건 없으세요?
장르 가리지 않고 다 좋아하긴 하는데,장르 가리지 않고 다 좋아하긴 하는데
딱히 공연을 보러 간다 뭐~ 공연을 보러 가고 싶다라고,딱히 공연을 보러 간다 뭐~ 공연을 보러 가고 싶다라고
생각이 든 적은 없고요 그래서 걍 듣는 걸 자주 듣고,생각이 든 적은 없고요 그래서 그냥 듣는 걸 자주 듣고
아~ 그리고,아~ 그리고
제가 베트남 놀러 갔을 때 그~ 맥주 마시러 들어갔는데 그때 재즈,제가 베트남 놀러 갔을 때 그~ 맥주 마시러 들어갔는데 그때 재즈
노래를 자기 마음대로 잼 형식으로 하는,노래를 자기 마음대로 잼 형식으로 하는
잼 형식으로 연주를 하는 걸 들은 적이 있거든요.,잼 형식으로 연주를 하는 걸 들은 적이 있거든요.
그~ 버스 그것도 버스킹이라 버스킹일 것 같은데 그~,그~ 버스 그것도 버스킹이라 버스킹일 것 같은데 그~
그 공연도 되게 재밌게 봤고요 되게 그~ 드럼?,그 공연도 되게 재밌게 봤고요 되게 그~ 드럼?
이랑 현악기 두 개 였었는 현악기 하나랑 관악기 하나,이랑 현악기 두 개 였었는 현악기 하나랑 관악기 하나
이렇게 했었는데 그걸로 되게 다양한,이렇게 했었는데 그걸로 되게 다양한
음 아~ 다양한 뭐라 해야 되지 멜로디?,음 아~ 다양한 뭐라 해야 되지 멜로디?
리듬 이런 걸 내는 게 되게 재밌게 느껴졌거든요.,리듬 이런 걸 내는 게 되게 재밌게 느껴졌거든요.
혹시  님은 아이돌 좋아한다고 하셨는데,혹시  님은 아이돌 좋아한다고 하셨는데
젝스키스 말고 혹시 다른 아이돌 공연을 보러 간 적은 있나요?,젝스키스 말고 혹시 다른 아이돌 공연을 보러 간 적은 있나요?
그~ 옛날에 그~ 부산에서 이제 콘서트 하는 걸 갔었는데,그~ 옛날에 그~ 부산에서 이제 콘서트 하는 걸 갔었는데
아이돌은 아니고 제가 싸이 콘서트를 갔다 왔었거든요.,아이돌은 아니고 제가 싸이 콘서트를 갔다 왔었거든요.
아이돌은 아니지만 가꼬 그~,아이돌은 아니지만 그래가지고 그~
싸이 콘서트를 갔었는데 여름에 이제 막 물 나오는 거 갔다 왔더니 너무 좋더라고요 너무 즐겁고 열정도 넘치고 그리고,싸이 콘서트를 갔었는데 여름에 이제 막 물 나오는 거 갔다 왔더니 너무 좋더라고요 너무 즐겁고 열정도 넘치고 그리고
이제 여태 갔던 공연과는 다르게 약간,이제 여태 갔던 공연과는 다르게 약간
다양한 연령,다양한 연령
층이 이제 와서 즐기는 모습 보니까 너무 에너지 받는 것도 좋아가지고 막 겨울 공연도 가고 그랬었거든요.,층이 이제 와서 즐기는 모습 보니까 너무 에너지 받는 것도 좋아가지고 막 겨울 공연도 가고 그랬었거든요.
그게 쫌 제일 아이돌 콘서트 말고는 그게 쫌 제일 인상이 깊었던 것 같애요.,그게 조금 제일 아이돌 콘서트 말고는 그게 조금 제일 인상이 깊었던 것 같애요.
님 같은 경우는 그~ 공연에 이제,님 같은 경우는 그~ 공연에 이제
쫌 무료 공연이 많다고 좋은 공연이 많다고 하셨는데 혹시 그런 건 어디서 찾으세요?,조금 무료 공연이 많다고 좋은 공연이 많다고 하셨는데 혹시 그런 건 어디서 찾으세요?
딱히 찾는 건 없고요 걍  라는 생각을 갖고 있고요.,딱히 찾는 건 없고요 그냥  라는 생각을 갖고 있고요.
그~ 저는 솔직히 공연을 보는 것보다 공연을,그~ 저는 솔직히 공연을 보는 것보다 공연을
한 경우가 많아 가지고요 제가 밴드를 했다고 말했,한 경우가 많아 가지고요 제가 밴드를 했다고 말했
말했는데 밴드 자체가 일 년에 두 번 정도 정기공연을 하고,말했는데 밴드 자체가 일 년에 두 번 정도 정기공연을 하고
정기공연을 하면 돈을,정기공연을 하면 돈을
써서 해야 되거든요 돈을 따로 받아서 하는 게 아니라 그거를 벌려면 또 다른 데 외부공연을 하고 그래야 돼서 솔직히 공연을 본 기억보다 한 기억이 많은데 공연을 하면서 제일 크게 드는 생각은,써서 해야 되거든요 돈을 따로 받아서 하는 게 아니라 그거를 벌려면 또 다른 데 외부공연을 하고 그래야 돼서 솔직히 공연을 본 기억보다 한 기억이 많은데 공연을 하면서 제일 크게 드는 생각은
실수를 안 할 수가  없거든요 실수를 안 할 수가 없는데,실수를 안 할 수가  없거든요 실수를 안 할 수가 없는데
걍 실수를 해도 물 흐르듯이 넘어간다고 생각해야 되고,그냥 실수를 해도 물 흐르듯이 넘어간다고 생각해야 되고
그런 것도 보면서 프로가수들?,그런 것도 보면서 프로가수들?
밴드들이 공연할 때 실수를,밴드들이 공연할 때 실수를
안 하고 하는 모습이 되게 대단하다고 생각하고,안 하고 하는 모습이 되게 대단하다고 생각하고
그 사람들이 공연을 하기 위해서 얼마나 많이 노력을 많이 했을까라는 생각도 들고요.,그 사람들이 공연을 하기 위해서 얼마나 많이 노력을 많이 했을까라는 생각도 들고요.
혹시  님은 공연을 볼 때,혹시  님은 공연을 볼 때
어떤 점을 되게 주의 깊게 보시나요?,어떤 점을 되게 주의 깊게 보시나요?
어~ 저는 일단 공연을 가면은 이게 단독공연인지 아니면 이제,어~ 저는 일단 공연을 가면은 이게 단독공연인지 아니면 이제
여러 가수가 나와서 하는지 따라서 약간 기준이 달라지는데요 이~,여러 가수가 나와서 하는지 따라서 약간 기준이 달라지는데요 이~
아무래도 여러 가수들이 나와서 이렇게 짧게 짧게 공연하는 경우는 히트곡을 부를 수밖에 없잖아요 그래서 사실 그런 공연은 쫌 잘 안 가게,아무래도 여러 가수들이 나와서 이렇게 짧게 짧게 공연하는 경우는 히트곡을 부를 수밖에 없잖아요 그래서 사실 그런 공연은 조금 잘 안 가게
되고 아무래도 이제,되고 아무래도 이제
방송에 이나 유명한 노래가 아닌 쫌 숨은 노래들,방송에 이나 유명한 노래가 아닌 조금 숨은 노래들
이런 것들을 쫌 라이브로 듣고 싶어서 콘서트를 간다라고 생각을 하기 때문에,이런 것들을 조금 라이브로 듣고 싶어서 콘서트를 간다라고 생각을 하기 때문에
이제 그런 걸 들으러 가는데,이제 그런 걸 들으러 가는데
단독 공연임에도 불구하고 너무 히트곡만 부르면 사실 쫌 돈 아깝다라는 생각을 많이 하고요.,단독 공연임에도 불구하고 너무 히트곡만 부르면 사실 조금 돈 아깝다라는 생각을 많이 하고요.
그러고 이제 갔는데 히트곡보다는 이제 쫌 숨어있던 곡이라든가 아니면 그~ 가수가 본인이 좋아하는 노래를 쫌,그러고 이제 갔는데 히트곡보다는 이제 조금 숨어있던 곡이라든가 아니면 그~ 가수가 본인이 좋아하는 노래를 조금
게 바꿔서 불러본다든가 이런 걸 쪼끔,게 바꿔서 불러본다든가 이런 걸 쪼끔
중점으로 보기는 해요 근데 이제 그런 이야기를 하면 이제 친구들이랑 약간 호불호가 갈리더라고요 인제 다른 의견의 친구들은,중점으로 보기는 해요 근데 이제 그런 이야기를 하면 이제 친구들이랑 약간 호불호가 갈리더라고요 인제 다른 의견의 친구들은
유명한 노래를 듣고 싶어서 가는 건데 왜 모르는 노래를 부르지?,유명한 노래를 듣고 싶어서 가는 건데 왜 모르는 노래를 부르지?
약간 이런 경우도 제법 많더라고요.,약간 이런 경우도 제법 많더라고요.
그런 거에 비중을 두고 또,그런 거에 비중을 두고 또
큰 공연장이냐 작은 공연장이냐에 따라서도 다른 것 같은데,큰 공연장이냐 작은 공연장이냐에 따라서도 다른 것 같은데
아무래도 큰 공연장인데 뭐~ 생각보다 쫌 효과가 별로 없다 그러면 어~ 이렇게 큰 곳을 빌려놓고 왜 이것밖에 못하지 약간 이런 생각도,아무래도 큰 공연장인데 뭐~ 생각보다 조금 효과가 별로 없다 그러면 어~ 이렇게 큰 곳을 빌려놓고 왜 이것밖에 못하지 약간 이런 생각도
들어요 막 약간 쫌 음~ 비싼 돈 주고 왔는데 볼 게 이거밖에 없나 약간 이런 생각도 들고,들어요 막 약간 조금 음~ 비싼 돈 주고 왔는데 볼 게 이거밖에 없나 약간 이런 생각도 들고
작은 공연임에도 불구하고 정말 최대치로 내는 걸 보면은 아~ 이~ 능력치가 엄청나다.,작은 공연임에도 불구하고 정말 최대치로 내는 걸 보면은 아~ 이~ 능력치가 엄청나다.
