사투리,표준어
어~ 그런 부분은 법이 쫌 더 많이 바꼈으면 좋겠다 그런 생각을 많이 했어요.,어~ 그런 부분은 법이 조금 더 많이 바뀌었으면 좋겠다 그런 생각을 많이 했어요.
근데 뭐~ 저 혼자서 생각해서 되는 거는 아니니까 네 그래요.,근데 뭐~ 저 혼자서 생각해서 되는 거는 아니니까 네 그래요.
혹시 그러면 뭐~ 자녀나 아니면 혹시 주변에,혹시 그러면 뭐~ 자녀나 아니면 혹시 주변에
뭐~ 어린 뭐~ 조카라던지 그런 아이들 보면  아마 분명 계실 텐데,뭐~ 어린 뭐~ 조카라던지 그런 아이들 보면  아마 분명 계실 텐데
그런 친구들 보면은 나영이 사건을 생각해 보면은,그런 친구들 보면은 나영이 사건을 생각해 보면은
법이 많이 바껴야 된다고 어~ 본인도 똑같이 생각하시는 부분 아닌가요?,법이 많이 바뀌어야 된다고 어~ 본인도 똑같이 생각하시는 부분 아닌가요?
당연히 그렇게 생각하고 있는데 근데 그런,당연히 그렇게 생각하고 있는데 근데 그런
부분으로 인해가지고 또 사형 제도라도 것도 다시,부분으로 인해가지고 또 사형 제도라도 것도 다시
했으면 좋겠다 이런 마음이 심적으로 울컥하면서 들기도 하는데,했으면 좋겠다 이런 마음이 심적으로 울컥하면서 들기도 하는데
법이 왜 존재하나 싶기도 하고,법이 왜 존재하나 싶기도 하고
이런 사람을 위해서 사형 제도가 존재해야지 왜,이런 사람을 위해서 사형 제도가 존재해야지 왜
풀려나가지고 왜 선의,풀려나가지고 왜 선의
아무런 죄가 없는 국민들을 불안에 떨게 하는가 싶기도 하고,아무런 죄가 없는 국민들을 불안에 떨게 하는가 싶기도 하고
또 요즘 스쿨존 주변에 뭐~ 그거,또 요즘 스쿨존 주변에 뭐~ 그거
뭐지 뭐~ 속도 그거 뭐라 하죠?,뭐지 뭐~ 속도 그거 뭐라 하죠?
속도 낮춰가지고 달려라고 하는 거 삼십으로 달리는 거,속도 낮춰가지고 달려라고 하는 거 삼십으로 달리는 거
이제 어린이 보호 구역 스쿨존 속도위반 민식이법,이제 어린이 보호 구역 스쿨존 속도위반 민식이법
민식이법 강화하는 것도 요즘 핫이슈 되고 있잖아요.,민식이법 강화하는 것도 요즘 핫이슈 되고 있잖아요.
이런 부분 교통안전 강화법에 대해서도 좀 강화되고 있고 한데,이런 부분 교통안전 강화법에 대해서도 좀 강화되고 있고 한데
또 요즘 애들이 쫌 영악해가지고 그런 것들을,또 요즘 애들이 조금 영악해가지고 그런 것들을
악용하는 사례가 있다고도 얘기를 들었거든요.,악용하는 사례가 있다고도 얘기를 들었거든요.
음~ 민식이법으로 인해서 더 주의해야 된다고 생각은 하지만,음~ 민식이법으로 인해서 더 주의해야 된다고 생각은 하지만
요즘 아이들이 이런 거를 악용하기 때문에 또 이런 것들로 인해가지고 억울하게,요즘 아이들이 이런 거를 악용하기 때문에 또 이런 것들로 인해가지고 억울하게
피해입는 사람들도 많다고 뉴스에서 봤는데,피해입는 사람들도 많다고 뉴스에서 봤는데
이런 것들도 있고 또 신호 위반 강화 범칙금이랑,이런 것들도 있고 또 신호 위반 강화 범칙금이랑
또 요즘에 소화전 주변에 차 주차하면은 범칙금 내는 거 국민 청원 신고,또 요즘에 소화전 주변에 차 주차하면은 범칙금 내는 거 국민 청원 신고
센터인가 그 어플로 신고하면은 모든 일반 국민들도,센터인가 그 어플로 신고하면은 모든 일반 국민들도
바로 보면 신고할 수 있게 하는 안전 신문고 그거 어플 설치해서,바로 보면 신고할 수 있게 하는 안전 신문고 그거 어플 설치해서
바로 신고할 수 있는 그런 제도도 있는 거 제가 봤거든요?,바로 신고할 수 있는 그런 제도도 있는 거 제가 봤거든요?
그래서 저도 몇 번 저희 동네에 누가  소화전 주변에 자꾸 주차하길래,그래서 저도 몇 번 저희 동네에 누가  소화전 주변에 자꾸 주차하길래
그쪽에 뭐~ 사 미터인가 사 미터 이내에 주차하면 안 되는데,그쪽에 뭐~ 사 미터인가 사 미터 이내에 주차하면 안 되는데
솔직히 주차난도 심각하기는 심각한데 그쪽에는,솔직히 주차난도 심각하기는 심각한데 그쪽에는
혹시나 뭐~ 불이 나거나 뭐~ 그런 일들이 있을 수도 있는데,혹시나 뭐~ 불이 나거나 뭐~ 그런 일들이 있을 수도 있는데
주차해서 피해될 수도 있는 거고 해서,주차해서 피해될 수도 있는 거고 해서
신고하면 뭐~ 범칙금 벌금이 뭐~ 팔만 원 육만 원,신고하면 뭐~ 범칙금 벌금이 뭐~ 팔만 원 육만 원
뭐~ 그렇게 뭐~ 때린다고 들었는데 그럼,뭐~ 그렇게 뭐~ 때린다고 들었는데 그럼
법들도 있는 거 같고 그냥 요즘에는 다 뭐~ 에스엔에스,법들도 있는 거 같고 그냥 요즘에는 다 뭐~ 에스엔에스
어플 이런 것들 요즘 이슈되는 것들로 새로운 법들도 많이 생겨나는 거 같고,어플 이런 것들 요즘 이슈되는 것들로 새로운 법들도 많이 생겨나는 거 같고
또 한참 이슈됐었는 게,또 한참 이슈됐었는 게
그~ 미투 운동 그런 것도 했었잖아요 그래서 여자들 뭐~,그~ 미투 운동 그런 것도 했었잖아요 그래서 여자들 뭐~
성희롱 관련해가지고 직장 내에서,성희롱 관련해가지고 직장 내에서
성희롱하는 그런 법들 같은 것도 뭐~ 더 더 생겨났는지 뭐~ 어떻게 됐는지는 모르겠는데,성희롱하는 그런 법들 같은 것도 뭐~ 더 더 생겨났는지 뭐~ 어떻게 됐는지는 모르겠는데
장자연 사건도 유명해 유명했었는 거 같은데,장자연 사건도 유명해 유명했었는 거 같은데
근데 그런 부분에 대해서는 아직까지 해결이 안 되고 있는 거 같은데,근데 그런 부분에 대해서는 아직까지 해결이 안 되고 있는 거 같은데
장자연 사건 혹시 들어보셨어요?,장자연 사건 혹시 들어보셨어요?
어~ 네 그때 막 이슈되고 뭐~,어~ 네 그때 막 이슈되고 뭐~
뭐~ 자살할 때 썼던 뭐~ 유서 뭐~ 그런 거 계속 뉴스에 나오고,뭐~ 자살할 때 썼던 뭐~ 유서 뭐~ 그런 거 계속 뉴스에 나오고
뭐~ 기 그~ 이후로도 지금 몇십 몇 십년까지는 아니지만 몇 년이 흘렀는데도 계속 뭐~ 이야기가 되고 있고,뭐~ 기 그~ 이후로도 지금 몇십 몇 십년까지는 아니지만 몇 년이 흘렀는데도 계속 뭐~ 이야기가 되고 있고
뭐~ 그 사건에 관련된 분 뭐~ 실명이나 뭐~ 다니시는 회사나 뭐~ 직함이나,뭐~ 그 사건에 관련된 분 뭐~ 실명이나 뭐~ 다니시는 회사나 뭐~ 직함이나
그런 것도 뭐~ 다 공개가 됐는 걸로 알고 있어요 근데도,그런 것도 뭐~ 다 공개가 됐는 걸로 알고 있어요 근데도
말씀하신 것처럼 뭐~ 해결된 부분이 없고,말씀하신 것처럼 뭐~ 해결된 부분이 없고
그냥 계속 그런 이야기만 돌고 있고 뭐~ 그런 거 같애요 그런 거 보면은,그냥 계속 그런 이야기만 돌고 있고 뭐~ 그런 거 같애요 그런 거 보면은
어~ 안타깝기는 해요 저도 같은 여자니까 뭐~ 그분,어~ 안타깝기는 해요 저도 같은 여자니까 뭐~ 그분
유서랑 이런 거를 보니까 대충 뭐~ 제가 그분의 삶은 다 알 순 없지만 백 프로,유서랑 이런 거를 보니까 대충 뭐~ 제가 그분의 삶은 다 알 순 없지만 백 프로
뭐~ 대충 일단 여자 연예인인 인이고 그리고 뭐~ 그런 부분에 이용이 됐고 뭐~ 그런 거를 보니까,뭐~ 대충 일단 여자 연예인인 인이고 그리고 뭐~ 그런 부분에 이용이 됐고 뭐~ 그런 거를 보니까
되게 안타깝기는 하더라고요 그런데 이제 거기에 관련된 분들이 다 쫌,되게 안타깝기는 하더라고요 그런데 이제 거기에 관련된 분들이 다 조금
뭐~ 정치 뭐~ 이런 우리나라적으로 다 힘이 있고,뭐~ 정치 뭐~ 이런 우리나라적으로 다 힘이 있고
뭐~ 그런 사람이라서 뭐~ 건드릴 수 없고 그거 영화로도 왜 제조 제작이 되고 막,뭐~ 그런 사람이라서 뭐~ 건드릴 수 없고 그거 영화로도 왜 제조 제작이 되고 막
그랬었거든요 그래서 그 영화도 제가 봤었는데 어~ 되게 쫌 와닿고,그랬었거든요 그래서 그 영화도 제가 봤었는데 어~ 되게 조금 와닿고
그렇더라고요.,그렇더라고요.
