사투리,표준어
이런 거에 있어서 되게 아직도 극복을 못 하고 있는 거 같고,이런 거에 있어서 되게 아직도 극복을 못 하고 있는 거 같고
쫌 제 이렇게 말을 하면서도 머릿속으로 정리가,조금 제 이렇게 말을 하면서도 머릿속으로 정리가
잘 안 되는 느낌이어가지고 이런 거에 대해서 쫌,잘 안 되는 느낌이어가지고 이런 거에 대해서 조금
콤플렉스가 있습니다 뭐~ 쫌 준비를 열심히 하면,콤플렉스가 있습니다 뭐~ 조금 준비를 열심히 하면
이런 게 쫌 극복이 되는 부분은 있는 거 같애요 뭐~ 남들 한 번 할 거 한 세네 번씩 해서,이런 게 조금 극복이 되는 부분은 있는 거 같애요 뭐~ 남들 한 번 할 거 한 세네 번씩 해서
아예 외워서 아예 그 긴장 상황을,아예 외워서 아예 그 긴장 상황을
좀 누그러트리면 이런 콤플렉스가 쫌 들어가는 거 같긴 한데,좀 누그러트리면 이런 콤플렉스가 조금 들어가는 거 같긴 한데
이런 거에 대해서 쫌 콤플렉스가 있는 거 같습니다.,이런 거에 대해서 조금 콤플렉스가 있는 거 같습니다.
또 다른 콤플렉스 계속 여쭤봐서  죄송한데 다른 콤플렉스나 뭐~ 제가 했던 얘기 중에서 혹시 뭐~,또 다른 콤플렉스 계속 여쭈어봐서  죄송한데 다른 콤플렉스나 뭐~ 제가 했던 얘기 중에서 혹시 뭐~
또 추가적으로 할 말씀이 있으시면 주시면,또 추가적으로 할 말씀이 있으시면 주시면
저도,저도
공감하거든요 대중 앞에서 말하는 거에 대한 공포증이 저도 있어요.,공감하거든요 대중 앞에서 말하는 거에 대한 공포증이 저도 있어요.
저도 남들 앞에서 이렇게 서 있으면 남들이 나에게 주목을 하잖아요 주목을 했을 때,저도 남들 앞에서 이렇게 서 있으면 남들이 나에게 주목을 하잖아요 주목을 했을 때
얼굴이 바로 빨개지거든요 완전히 빨개져서 거의,얼굴이 바로 빨개지거든요 완전히 빨개져서 거의
터져버릴 정도로 빨개져서 또 그 얼굴을 보여주는 게 또 부끄러워가지고 또,터져버릴 정도로 빨개져서 또 그 얼굴을 보여주는 게 또 부끄러워가지고 또
의기소침해지는 경우가 있어요.,의기소침해지는 경우가 있어요.
그리고,그리고
아까 말씀하셨듯이 머리가 백지상태가 돼가지고 저도 이거 처음에 할 때는,아까 말씀하셨듯이 머리가 백지상태가 돼가지고 저도 이거 처음에 할 때는
제가 무슨 말을 하는지 내가 지금 무슨 말을 하고 있는지,제가 무슨 말을 하는지 내가 지금 무슨 말을 하고 있는지
하나도 기억이 안 지금도 솔직히,하나도 기억이 안 지금도 솔직히
대화하는 게 되게 낯설고 너무 어색해가지고 내가,대화하는 게 되게 낯설고 너무 어색해가지고 내가
무슨 말을 하고 있는지  나중에 또 기억해보면 생각이 아무것도 안 날 거 같애요 저도 대중 앞에서,무슨 말을 하고 있는지  나중에 또 기억해보면 생각이 아무것도 안 날 거 같애요 저도 대중 앞에서
말하는 거는 쪼끔 있는데 이거는 진짜로 말씀하셨듯이 연습이나 아니면,말하는 거는 쪼끔 있는데 이거는 진짜로 말씀하셨듯이 연습이나 아니면
그~ 계속 반복된 훈련이 있어야지 쫌 나아질 거 같은데,그~ 계속 반복된 훈련이 있어야지 조금 나아질 거 같은데
저는 그런 훈련을 하질 않아가지고,저는 그런 훈련을 하질 않아가지고
나아질 기미가 안 보이네요 근데,나아질 기미가 안 보이네요 근데
또 그거랑은 반대로 또 모르는 사람들이랑 어울려가지고 노는 거는 또 좋아하거든요.,또 그거랑은 반대로 또 모르는 사람들이랑 어울려가지고 노는 거는 또 좋아하거든요.
어떻게 이렇게 발표하는 거 말고 그거 말고 이제,어떻게 이렇게 발표하는 거 말고 그거 말고 이제
아예 어떤 여행지에 가가지고 처음 보는 사람인데,아예 어떤 여행지에 가가지고 처음 보는 사람인데
그런 사람들한테 또 말도 잘 걸고 크게 낯설어하지 않아요.,그런 사람들한테 또 말도 잘 걸고 크게 낯설어하지 않아요.
이게,이게
주목을 여러 사람한테 받는 것과,주목을 여러 사람한테 받는 것과
그~ 한두 명한테 받는 거에 차이라고 생각하는데,그~ 한두 명한테 받는 거에 차이라고 생각하는데
그러면 그~ 뭐지  님은,그러면 그~ 뭐지  님은
뭐~ 따른 어떤 그런 공포증이나,뭐~ 다른 어떤 그런 공포증이나
뭐~ 이런 게 또 있으신가요 이게,뭐~ 이런 게 또 있으신가요 이게
네 저도 똑같은 거 같습니다 그~,네 저도 똑같은 거 같습니다 그~
생각보다 저희가 비슷한 게 많네요 그~ 저도 그~,생각보다 저희가 비슷한 게 많네요 그~ 저도 그~
새로운 사람 만나는 거 이런 거는 좋아해서 뭐~ 여행지 가거나 뭐~,새로운 사람 만나는 거 이런 거는 좋아해서 뭐~ 여행지 가거나 뭐~
이렇게 사회생활 하면서 새로운 사람을 만나게 되면 먼저 오히려 말을 붙이거나,이렇게 사회생활 하면서 새로운 사람을 만나게 되면 먼저 오히려 말을 붙이거나
그런 쪽으로 쫌 친해질려고 하는데 이게,그런 쪽으로 조금 친해질려고 하는데 이게
공식적인 자리가 되거나 남들 앞에서 뭔가 나의 것을 얘기를 해야 되는데 어떤,공식적인 자리가 되거나 남들 앞에서 뭔가 나의 것을 얘기를 해야 되는데 어떤
면접을 본다거나 이런 상황이 되면,면접을 본다거나 이런 상황이 되면
아~ 너무 그 상황이 주는 압박감 때문인지 너무 떨려가지고,아~ 너무 그 상황이 주는 압박감 때문인지 너무 떨려가지고
사람들이 막,사람들이 막
쳐다보기 시작하면 이제 저는 이제 멘붕에 빠지는 게,쳐다보기 시작하면 이제 저는 이제 멘붕에 빠지는 게
워낙 그~ 피부랑도 예전에 피부 자체도,워낙 그~ 피부랑도 예전에 피부 자체도
피부 콤플렉스랑도 연결돼서 이렇게 막 쳐다보면,피부 콤플렉스랑도 연결돼서 이렇게 막 쳐다보면
제가,제가
되게 부끄러워했었거든요 그런 게 막,되게 부끄러워했었거든요 그런 게 막
오버랩 되기도 하고 하는데 이제 뭐~ 사람들이랑 지내는 거는 그런,오버랩 되기도 하고 하는데 이제 뭐~ 사람들이랑 지내는 거는 그런
부담이나 어떤 긴장감이 없는 거니까,부담이나 어떤 긴장감이 없는 거니까
오히려 그런 쪽에서는 쫌,오히려 그런 쪽에서는 조금
어~ 쫌 편한 편한 거 같애요.,어~ 조금 편한 편한 거 같애요.
그런데 요즘 사람들 만나는 거 좋아하신다고 하셨는데,그런데 요즘 사람들 만나는 거 좋아하신다고 하셨는데
뭐~ 음주가무 하시고 하셔야 되는데 요즘 아무 때도 못 나가시지 않나요?,뭐~ 음주가무 하시고 하셔야 되는데 요즘 아무 때도 못 나가시지 않나요?
지금은 아무 때도 안 나가고 집에서 마시죠.,지금은 아무 때도 안 나가고 집에서 마시죠.
집으로 뭐~ 그냥 친구 한두 명 불러서 마시거나 아니면,집으로 뭐~ 그냥 친구 한두 명 불러서 마시거나 아니면
혼술하거나 그렇게 하고 있죠 왜냐면,혼술하거나 그렇게 하고 있죠 왜냐하면
코로나가 너무 무서워가지고 나가질 못하겠어요.,코로나가 너무 무서워가지고 나가질 못하겠어요.
지금,지금
그러면 그 스트레스를 어떻게 그걸로 푸셔야 되는데,그러면 그 스트레스를 어떻게 그걸로 푸셔야 되는데
요즘 뭐~ 어떻게 푸시는 거예요?,요즘 뭐~ 어떻게 푸시는 거예요?
아~ 요즘은 열심히 게임을 하고 있습니다.,아~ 요즘은 열심히 게임을 하고 있습니다.
