사투리,표준어
니 지금 폰 뭐 쓰고 있지?,너 지금 폰 뭐 쓰고 있지?
기종이 뭐지?,기종이 뭐지?
나 지금 아이폰 엑스알 화이트.,나 지금 아이폰 엑스알 화이트.
나 팔 쓰고 있는데,나 팔 쓰고 있는데
지금 이게 한 삼 년 넘었단 말이야 그래서 새로 나온 그 십일을 사야 될까 말아야 될까,지금 이게 한 삼 년 넘었단 말이야 그래서 새로 나온 그 십일을 사야 될까 말아야 될까
고민하고 있기는 한데,고민하고 있기는 한데
니는 어때 그~ 요번에 새로 나온 디자인이,너는 어때 그~ 요번에 새로 나온 디자인이
디자인은 그냥 괜찮은 거 같은데,디자인은 그냥 괜찮은 거 같은데
그 옆면이 유광인 거야.,그 옆면이 유광인 거야.
그래서 난 유광을 별로 안 좋아하기도 하는데,그래서 난 유광을 별로 안 좋아하기도 하는데
또 그 아이폰 매장 &company-name1& 매장 가서 보면,또 그 아이폰 매장 &company-name1& 매장 가서 보면
사람들이 하도 많이 만져서 그 유광 테두리 부분이 벗겨져 있대.,사람들이 하도 많이 만져서 그 유광 테두리 부분이 벗겨져 있대.
그래서 그거 보니까 어~ 굳이,그래서 그거 보니까 어~ 굳이
쪼끔 바꿔야 되나 싶기도 하고,쪼끔 바꿔야 되나 싶기도 하고
그리고 이번에 아이폰 십이로 바뀌면서 카메라 색감이 쪼끔 달라졌대.,그리고 이번에 아이폰 십이로 바뀌면서 카메라 색감이 쪼끔 달라졌대.
그래서 나는 쫌 그~ 비교한 사진이 올라왔는데 아이폰 십이가 훨씬 선명해졌는데,그래서 나는 조금 그~ 비교한 사진이 올라왔는데 아이폰 십이가 훨씬 선명해졌는데
쪼끔 색감이 다른 거야.,쪼끔 색감이 다른 거야.
근데 나는 그 원래 아이폰 색감 카메라 색감이 쫌 더 좋은 거 같아가지고,근데 나는 그 원래 아이폰 색감 카메라 색감이 조금 더 좋은 거 같아가지고
나는 모르겠다 사진을 진짜 많이 찍는 거 아니면,나는 모르겠다 사진을 진짜 많이 찍는 거 아니면
아이폰 에스로 바꾸는 게 쪼끔 더 낫지 않을까 왜냐면 십이가 너무 비싼 거야,아이폰 에스로 바꾸는 게 쪼끔 더 낫지 않을까 왜냐면 십이가 너무 비싼 거야
그리고,그리고
어떻게 생각해?,어떻게 생각해?
그~ 아이폰 나는 지금 십이가 그~,그~ 아이폰 나는 지금 십이가 그~
예전 거보다는 가격이 괜찮다라고 생각을 했던 게,예전 거보다는 가격이 괜찮다라고 생각을 했던 게
내가 아이폰 팔 주고 샀을 때가  백만 원이 넘었었단 말이야 근데 그 십이가 지금 구십몇만 원이더라고?,내가 아이폰 팔 주고 샀을 때가  백만 원이 넘었었단 말이야 근데 그 십이가 지금 구십몇만 원이더라고?
그러면 괜찮은 거 아닌가?,그러면 괜찮은 거 아닌가?
그~ 그냥 십이 미니랑 뭐 프로?,그~ 그냥 십이 미니랑 뭐 프로?
걔네들이 쫌 비싸긴 하더라고.,걔네들이 조금 비싸긴 하더라고.
근데 용량이 십 젤 낮은 가격이면 되게 적은 거 아니야?,근데 용량이 십 제일 낮은 가격이면 되게 적은 거 아니야?
우리 한 번 사면 거의 그래도 니도 핸드폰 진짜 오래 쓰고,우리 한 번 사면 거의 그래도 너도 핸드폰 진짜 오래 쓰고
나도 웬만큼 고장 나지 않는 한은 계속 한 저번 핸드폰도 삼 년 넘게 썼단 말이야?,나도 웬만큼 고장 나지 않는 한은 계속 한 저번 핸드폰도 삼 년 넘게 썼단 말이야?
근데 용량이 작으면 계속 정리해야 되니까,근데 용량이 작으면 계속 정리해야 되니까
근데 또 용량 큰 거 사면 가격이 비싸고.,근데 또 용량 큰 거 사면 가격이 비싸고.
아~ 그러면 그냥 작은 용량에 그~ 싸 그 가격이면은,아~ 그러면 그냥 작은 용량에 그~ 싸 그 가격이면은
니가 말한 거처럼 싼 거는 아니겠네?,너가 말한 거처럼 싼 거는 아니겠네?
그래서 나는 항상 사진 저장을 많이 하고 막,그래서 나는 항상 사진 저장을 많이 하고 막
사진은 또 많이 찍기도 하는데 그러니깐 항상 모자란 거야 핸드폰 용량이,사진은 또 많이 찍기도 하는데 그러니깐 항상 모자란 거야 핸드폰 용량이
그래서 이번에는 저번 재작년에 폰 바꿀 때는 진짜 큰 거 샀거든?,그래서 이번에는 저번 재작년에 폰 바꿀 때는 진짜 큰 거 샀거든?
그러니까 아직까지 쫌 널널해.,그러니까 아직까지 조금 널널해.
그건 나도 그런 거 같다 왜냐면 나도 지금 이백오십육인가,그건 나도 그런 거 같다 왜냐면 나도 지금 이백오십육인가
제일 높은 거 쓰는데 삼 년 쓰니까 한 구십몇 기가 썼더라고 내가 최대한 안 쓴다 해도,제일 높은 거 쓰는데 삼 년 쓰니까 한 구십몇 기가 썼더라고 내가 최대한 안 쓴다 해도
그렇게 치면은 내가 이번에 십이 사면 또,그렇게 치면은 내가 이번에 십이 사면 또
높은 용량 사야 되니까 가격이 올라가긴 할 거 같고.,높은 용량 사야 되니까 가격이 올라가긴 할 거 같고.
나도 그거 아이폰 사람들 써 본다고 해서,나도 그거 아이폰 사람들 써 본다고 해서
뭐~ 사 일 정도 사 일 정도만 꺼내 놨는데 옆에 다 까진 거야 그래서 그거 보고 아~ 살까 말까 고민되긴 했었는데,뭐~ 사 일 정도 사 일 정도만 꺼내 놨는데 옆에 다 까진 거야 그래서 그거 보고 아~ 살까 말까 고민되긴 했었는데
또 어차피 아이폰은 사면은 케이스 끼고 다녀야 되니깐 괜찮지 않을까?,또 어차피 아이폰은 사면은 케이스 끼고 다녀야 되니깐 괜찮지 않을까?
이런 생각도 들고.,이런 생각도 들고.
케이스 낀다고 생각하면 괜찮겠다.,케이스 낀다고 생각하면 괜찮겠다.
근데 나는,근데 나는
아~ 만약에 이번에 바꾸면 나는 그냥 에스이 쪼그만한 걸로 바꾸고 싶어서,아~ 만약에 이번에 바꾸면 나는 그냥 에스이 쪼그만한 걸로 바꾸고 싶어서
핸드폰 지금 엑스알 쓰는데 너무 무겁기도 하고,핸드폰 지금 엑스알 쓰는데 너무 무겁기도 하고
내 손에 약간 크단 말이야 난 손이 작은 편도 아닌데,내 손에 약간 크단 말이야 난 손이 작은 편도 아닌데
그래서 예전에 그냥 식스나 쓸 때가 딱 그때 내 손에 탁 잡 잘 감겨가지고,그래서 예전에 그냥 식스나 쓸 때가 딱 그때 내 손에 탁 잡 잘 감겨가지고
나는 이번에 십이는 잘 안 땡기더라.,나는 이번에 십이는 잘 안 당기더라.
그래 그럼 어떻게 해야 될지 고민이다 왜냐면 십이 새 거가 나오긴 했는데,그래 그럼 어떻게 해야 될지 고민이다 왜냐면 십이 새 거가 나오긴 했는데
새 거가 나왔는데 그 밑에 거를 사는 게,새 거가 나왔는데 그 밑에 거를 사는 게
왜냐면 내가 아이폰 팔만 계속 썼었으니까,왜냐면 내가 아이폰 팔만 계속 썼었으니까
어케 해야 될지 고민이긴 한데,어떻게 해야 될지 고민이긴 한데
근데 에스이랑 아이폰 십이 미니랑 사이즈 같은 데도 니는 에스이가 더 좋은 거야?,근데 에스이랑 아이폰 십이 미니랑 사이즈 같은 데도 너는 에스이가 더 좋은 거야?
음~ 지금 그냥 가격적인 면에서 에스이가 엄청 낮잖아.,음~ 지금 그냥 가격적인 면에서 에스이가 엄청 낮잖아.
근데 아~ 근데 나는 아이패드 사고 나서,근데 아~ 근데 나는 아이패드 사고 나서
폰보다는 패드를 훨씬 많이 봐서 더 그런 거 같긴 해.,폰보다는 패드를 훨씬 많이 봐서 더 그런 거 같긴 해.
아~ 아이패드 있으면 애들 막 폰에 대해서 엄청 뭐~ 좋은 거 사야겠다 이런 거 적어지긴 하더라고 아이패드로 할 수 있는 것도 진짜 많아지고,아~ 아이패드 있으면 애들 막 폰에 대해서 엄청 뭐~ 좋은 거 사야겠다 이런 거 적어지긴 하더라고 아이패드로 할 수 있는 것도 진짜 많아지고
노트북보다는 들고 다니기도 편하고 하니까,노트북보다는 들고 다니기도 편하고 하니까
아이패드 사고 싶긴 한데 그것도 솔직히 돈도 돈이고,아이패드 사고 싶긴 한데 그것도 솔직히 돈도 돈이고
짐 노트북 쓰고 있으니깐 사야 될까 약간 이런 생각 들더라고,지금 노트북 쓰고 있으니깐 사야 될까 약간 이런 생각 들더라고
닌 그럼 아이패드로 주로 뭐해?,넌 그럼 아이패드로 주로 뭐해?
어~ 뭐~ 노트 정리하는 거,어~ 뭐~ 노트 정리하는 거
내가 원래는 펜이랑 노트랑 항상 들고 다녔는데 이제는 거의 안 들고 다니고,내가 원래는 펜이랑 노트랑 항상 들고 다녔는데 이제는 거의 안 들고 다니고
뭐~ 노트 정리하는 거 다 아이패드로 하고 뭐~ 공부하는 거 있으면 다 아이패드로 하고,뭐~ 노트 정리하는 거 다 아이패드로 하고 뭐~ 공부하는 거 있으면 다 아이패드로 하고
포트폴리오 정리도 다 아이패드로 하고,포트폴리오 정리도 다 아이패드로 하고
뭐~ 가끔씩 그~ 뭐~ 그림 그려야 되는 거나 그런 거 디자인해 줘야 되는 것도,뭐~ 가끔씩 그~ 뭐~ 그림 그려야 되는 거나 그런 거 디자인해 줘야 되는 것도
거의 다 아이패드로 하고 그냥 마무리만 컴퓨터로 하고,거의 다 아이패드로 하고 그냥 마무리만 컴퓨터로 하고
그래가지고 나는 지금 거의 아이패드가 없는 삶을 상상할 수가 없을 정도가 된,그래가지고 나는 지금 거의 아이패드가 없는 삶을 상상할 수가 없을 정도가 된
그냥 있으면은 그게 편하니까,그냥 있으면은 그게 편하니까
근데 또 편한 거를 이제 찾다 보면 내가,근데 또 편한 거를 이제 찾다 보면 내가
뭘 다 못 할 거 같은 거야 집에 있는 컴퓨터도 안 쓰게 될 거 같고 노트북도 안 쓰게 될 거 같고,뭘 다 못 할 거 같은 거야 집에 있는 컴퓨터도 안 쓰게 될 거 같고 노트북도 안 쓰게 될 거 같고
근데 아이패드 쓰는 뭐~ 니나 다른 애들이 너무 편하다고 하니까,근데 아이패드 쓰는 뭐~ 너나 다른 애들이 너무 편하다고 하니까
들고 다니면서 여행하기도 편하고 무거운 것도 없고,들고 다니면서 여행하기도 편하고 무거운 것도 없고
요즘은 그걸로 그림 그리는 애들 진짜 많더라고?,요즘은 그걸로 그림 그리는 애들 진짜 많더라고?
그~ 자기 사진 위에다가 그림 그리는 거 뭔지 아나?,그~ 자기 사진 위에다가 그림 그리는 거 뭔지 알아?
응 사람들 그거 할려고  아이패드 사는 사람들도 진짜 많더라.,응 사람들 그거 할려고  아이패드 사는 사람들도 진짜 많더라.
그게 아이패드로만 되는 거야?,그게 아이패드로만 되는 거야?
아니 그냥 갤럭시 패드도 그냥 패드,아니 그냥 갤럭시 패드도 그냥 패드
펜 있어서 위에 끄적일 수 있는 거면 사실 다 될 걸,펜 있어서 위에 끄적일 수 있는 거면 사실 다 될 걸
갤럭시는 핸드폰에도 펜 있으니까,갤럭시는 핸드폰에도 펜 있으니까
갤럭시는 폰으로도 될 걸?,갤럭시는 폰으로도 될 걸?
그거 보고 하는 거 보고 잠깐 흔들렸는데,그거 보고 하는 거 보고 잠깐 흔들렸는데
지금 그냥 내 아이폰 팔 쓰는 거에 만족하고 있거든?,지금 그냥 내 아이폰 팔 쓰는 거에 만족하고 있거든?
근데 지금 아이폰 팔 내가 쪼끔 느린 거 말고는 뭐~ 괜찮긴 한데 니 같으면 뭐~ 바꿀 거야?,근데 지금 아이폰 팔 내가 쪼끔 느린 거 말고는 뭐~ 괜찮긴 한데 너 같으면 뭐~ 바꿀 거야?
왜냐면 내가 삼 년 썼으니까.,왜냐면 내가 삼 년 썼으니까.
음~ 나는 고장 난 거 아니면 사실 굳이,음~ 나는 고장 난 거 아니면 사실 굳이
바꿔야 될 필요성은 못 느끼는 거 같애.,바꿔야 될 필요성은 못 느끼는 거 같애.
지난번 핸드폰도 계속 꺼지고,지난번 핸드폰도 계속 꺼지고
그런 상황에서 쪼끔 더 버티다가,그런 상황에서 쪼끔 더 버티다가
핸드폰 앞에 액정이 다 깨져가지고 그냥 바꿨었거든.,핸드폰 앞에 액정이 다 깨져가지고 그냥 바꿨었거든.
근데 막 엄청 급하게 바꿔야 될 이유가 없으면 꼭 안 바꿔도 되지 않을까 싶긴 한데,근데 막 엄청 급하게 바꿔야 될 이유가 없으면 꼭 안 바꿔도 되지 않을까 싶긴 한데
그리고 지금 아이폰 십이 보고 있는데 아이폰 십이 미니?,그리고 지금 아이폰 십이 보고 있는데 아이폰 십이 미니?
그거 화이트로 해서 백이십팔 기가 하니까 백만 원 쪼끔 넘네?,그거 화이트로 해서 백이십팔 기가 하니까 백만 원 쪼끔 넘네?
백만 원 쪼끔 그러면 괜찮은 거 아닐까?,백만 원 쪼끔 그러면 괜찮은 거 아닐까?
지금 솔직히 폰을 바꾸고 싶기는 하단 말이야 왜냐면 화질이,지금 솔직히 폰을 바꾸고 싶기는 하단 말이야 왜냐면 화질이
이게 팔이다 보니까는 지금 나온 거에 거의 네 단계 낮은 버전이라서 선명도가 너무 떨어져가지고,이게 팔이다 보니까는 지금 나온 거에 거의 네 단계 낮은 버전이라서 선명도가 너무 떨어져가지고
근데 니 말대로 고장 난 거 없는데,근데 너 말대로 고장 난 거 없는데
바꿔야 되나 싶기도 하고,바꿔야 되나 싶기도 하고
내가 폰에 대해서 막 딴 애들처럼 바꾸고 싶다 이렇게 마음이 큰 것도 아니고,내가 폰에 대해서 막 딴 애들처럼 바꾸고 싶다 이렇게 마음이 큰 것도 아니고
이어폰도 내 무선 쓰잖 무선 안 쓰고 유선으로 쓰잖아.,이어폰도 나 무선 쓰잖 무선 안 쓰고 유선으로 쓰잖아.
딴 애들은 다 에어팟 쓰는데,딴 애들은 다 에어팟 쓰는데
그래서 괜한 돈 들이나 이런 생각도 들고,그래서 괜한 돈 들이나 이런 생각도 들고
응 나는 고장 난 거 아니면 막 막 굳이 안 바꿔도 되지 않을까라는 생각이 더 크긴 한데,응 나는 고장 난 거 아니면 막 막 굳이 안 바꿔도 되지 않을까라는 생각이 더 크긴 한데
가격이 십이이면 엄청 비싸진 않네.,가격이 십이이면 엄청 비싸진 않네.
딴 예전 그런 나왔던 거에 비해서,딴 예전 그런 나왔던 거에 비해서
프로가 진짜 비싸고 그냥 아이폰 십이는 가격이 생각보다 예전에 나왔던 아이폰들이랑,프로가 진짜 비싸고 그냥 아이폰 십이는 가격이 생각보다 예전에 나왔던 아이폰들이랑
그거보다 더 싸게 나온 거 같긴 하다.,그거보다 더 싸게 나온 거 같긴 하다.
그니까 아이폰 팔이랑 이거 다음에 나왔던 애들이랑 그거 너무 다 비싸가지고 그래서 나는 에어팟도 살까 하다가,그러니까 아이폰 팔이랑 이거 다음에 나왔던 애들이랑 그거 너무 다 비싸가지고 그래서 나는 에어팟도 살까 하다가
가격이 너무 비싸져서 안 샀었단 말이야?,가격이 너무 비싸져서 안 샀었단 말이야?
그까 두 개 같이 사면 비싸니까,그러니까 두 개 같이 사면 비싸니까
근데 니 지금 에어팟 쓴 거 아니야?,근데 너 지금 에어팟 쓴 거 아니야?
어 나 지금 에어팟 나는 근데 에어팟,어 나 지금 에어팟 나는 근데 에어팟
투 나왔을 때,투 나왔을 때
원을 엄청 할인해서 약간 떨이 팔이처럼 할 때 그때 사서 엄청 싸게,원을 엄청 할인해서 약간 떨이 팔이처럼 할 때 그때 사서 엄청 싸게
어 그 원래 가격보다는 되게 싸게 샀어.,어 그 원래 가격보다는 되게 싸게 샀어.
그믄 써 보니깐 어때 유선 그~ 쓰는 것보다?,그러면 써 보니깐 어때 유선 그~ 쓰는 것보다?
운동할 때 진짜 충격적으로 유선보다는 훨씬 편하고,운동할 때 진짜 충격적으로 유선보다는 훨씬 편하고
그리고 뭐~ 노래 들을 때도 편하고,그리고 뭐~ 노래 들을 때도 편하고
왜 핸드폰 줄이랑 이제 연결돼 있으면 핸드폰이랑 이어폰이랑 막 걸리적거리잖아 쫌,왜 핸드폰 줄이랑 이제 연결돼 있으면 핸드폰이랑 이어폰이랑 막 걸리적거리잖아 조금
이제 그런 게 하나도 없고 사실 편한 건 진짜 진짜 너무 편한데,이제 그런 게 하나도 없고 사실 편한 건 진짜 진짜 너무 편한데
가끔씩 블루투스 연결이 제대로 안 될 때가 있어.,가끔씩 블루투스 연결이 제대로 안 될 때가 있어.
그리고 지금 이렇게 오래 통화할 때 배터리 문제도 약간 있고,그리고 지금 이렇게 오래 통화할 때 배터리 문제도 약간 있고
근데 나는 일이라서,근데 나는 일이라서
쪼끔 더 그렇긴 한데 나 지금 이어폰 배터리 거의 이십 퍼센트 쪼끔밖에 안 남았거든 완충해서 이거 지금 하고 있는데도,쪼끔 더 그렇긴 한데 나 지금 이어폰 배터리 거의 이십 퍼센트 쪼끔밖에 안 남았거든 완충해서 이거 지금 하고 있는데도
근데 사면 편하긴 한 거 같애.,근데 사면 편하긴 한 거 같애.
이게 뭐~ 스마트 기기 이런 게 편해질수록 우리도,이게 뭐~ 스마트 기기 이런 게 편해질수록 우리도
근까 더 좋은 거 쓸수록 편해지긴 하는데,그러니까 더 좋은 거 쓸수록 편해지긴 하는데
아무래도 돈적으로 부담이 있기도 하고?,아무래도 돈적으로 부담이 있기도 하고?
근데 에어팟 쓰는 애들 보니까 나 혼자 유선,근데 에어팟 쓰는 애들 보니까 나 혼자 유선
이어폰 쓰더라고 그래서 나는 요기에 대한 불편함을 지금 못 느끼고 있었는데,이어폰 쓰더라고 그래서 나는 요기에 대한 불편함을 지금 못 느끼고 있었는데
뭐~ 전화하면서 내가 집안일을 한다거나 이럴 때 생각해보면은,뭐~ 전화하면서 내가 집안일을 한다거나 이럴 때 생각해보면은
유선이 진짜 불편하긴 하더라고 줄 때문에,유선이 진짜 불편하긴 하더라고 줄 때문에
내가 그 휴대폰을 들고 다니거나,내가 그 휴대폰을 들고 다니거나
아니면 휴대폰을 스피커 폰 해놓고 통화한다거나 근데 그렇게 되니까 내 목소리도,아니면 휴대폰을 스피커 폰 해놓고 통화한다거나 근데 그렇게 되니까 내 목소리도
저절로 커지고 이러니까,저절로 커지고 이러니까
불편하긴 한데,불편하긴 한데
에어폰도 계속 새로 나오는 것처럼 에어팟도 더 좋은 버전 나오지 않을까?,에어폰도 계속 새로 나오는 것처럼 에어팟도 더 좋은 버전 나오지 않을까?
음~ 에어팟,음~ 에어팟
에어팟은 그래도 한 이 년 일이 년 더 있어야 될 거 같긴 한데,에어팟은 그래도 한 이 년 일이 년 더 있어야 될 거 같긴 한데
프로가 워낙 좀 그전,프로가 워낙 좀 그전
에어팟 원이랑 투 많은 걸 보완해서 나와가지고,에어팟 원이랑 투 많은 걸 보완해서 나와가지고
근데 사실 있으면 좋은 거 같긴 한데 없어도 뭐~ 크게,근데 사실 있으면 좋은 거 같긴 한데 없어도 뭐~ 크게
불편할 거 같지는 않기도 하고.,불편할 거 같지는 않기도 하고.
그치 나는 그냥 아날로그 이런 게 좋아서 유선을 썼었는데,그렇지 나는 그냥 아날로그 이런 게 좋아서 유선을 썼었는데
써 본 사람 이야기 들으면 편할 거 같고 나도 편할 거 같은데,써 본 사람 이야기 들으면 편할 거 같고 나도 편할 거 같은데
그~  쓰면은 편한 거에 너무 익숙해져가지고 옛 거를 안 찾을 거 같은 느낌이 드는 거야.,그~  쓰면은 편한 거에 너무 익숙해져가지고 옛 거를 안 찾을 거 같은 느낌이 드는 거야.
그래서 휴대폰 지금 사전 예약하면 뭐~ 에어팟 공짜 이런 거 있어가지고 약간 흔들리기도 하긴 하는데,그래서 휴대폰 지금 사전 예약하면 뭐~ 에어팟 공짜 이런 거 있어가지고 약간 흔들리기도 하긴 하는데
음~ 근데,음~ 근데
몰라 나는 사실 써 보니까 좋긴 좋더라 편하긴 편하더라,몰라 나는 사실 써 보니까 좋긴 좋더라 편하긴 편하더라
가끔씩 줄 이어폰 쓰고 싶을 때가 있긴 한데 그~,가끔씩 줄 이어폰 쓰고 싶을 때가 있긴 한데 그~
이거 연결이 가끔 내가 최근 몇 달 전에,이거 연결이 가끔 내가 최근 몇 달 전에
최근에 연결이 가끔씩 계속 잘 안 될 때가 있었는데 그럴 땐 좀 스트레스받긴 해.,최근에 연결이 가끔씩 계속 잘 안 될 때가 있었는데 그럴 땐 좀 스트레스받긴 해.
계속 껐다가 켰다가 연결 시켰다가,계속 껐다가 켰다가 연결 시켰다가
근데 뭐~,근데 뭐~
유선에 비하면 편한 거 같기는 해.,유선에 비하면 편한 거 같기는 해.
그러면 내가 우리가 쓰는 게 지금 아이폰이니까,그러면 내가 우리가 쓰는 게 지금 아이폰이니까
에어팟을 사는 게 낫다 생각해 아니면 그냥 기본,에어팟을 사는 게 낫다 생각해 아니면 그냥 기본
아무 브랜드 없는 거나 저가 브랜드에서 나오는 에어팟  있잖아?,아무 브랜드 없는 거나 저가 브랜드에서 나오는 에어팟  있잖아?
그런 거는 어때?,그런 거는 어때?
그냥 가격 대비 괜찮은 정도일까?,그냥 가격 대비 괜찮은 정도일까?
근데 내가,근데 내가
나는 근데 한 번도 안 써 봤거든 안 들어봤어 들어보지도 않고 써 보지도 않았는데,나는 근데 한 번도 안 써 봤거든 안 들어봤어 들어보지도 않고 써 보지도 않았는데
막 왜 유튜브 보면 협찬받아서,막 왜 유튜브 보면 협찬받아서
그~ 무선 이어폰 다른 브랜드 거 쓰는 유튜버들 있잖아.,그~ 무선 이어폰 다른 브랜드 거 쓰는 유튜버들 있잖아.
근데 그 사람들도 결국 아이폰 쓰는데 결국 에어팟을 사서 샀다고 막 그렇게 영상에도 보이고,근데 그 사람들도 결국 아이폰 쓰는데 결국 에어팟을 사서 샀다고 막 그렇게 영상에도 보이고
자기 인스타에도 에어팟 샀다고 올라오는 거야.,자기 인스타에도 에어팟 샀다고 올라오는 거야.
그런 거 보니까 아~ 결국,그런 거 보니까 아~ 결국
그냥 아이폰 쓰면 에어팟을 사게 되겠거니 이렇게 되더라.,그냥 아이폰 쓰면 에어팟을 사게 되겠거니 이렇게 되더라.
갤럭시 폰 쓰면 갤럭시 버즈 쓰는 거처럼 똑같은 거네 그러면,갤럭시 폰 쓰면 갤럭시 버즈 쓰는 거처럼 똑같은 거네 그러면
어 안 그래도 친구 안 친구도,어 안 그래도 친구 안 친구도
갤럭시에 에어팟 했는데 뭔가 이르게,갤럭시에 에어팟 했는데 뭔가 이르게
연결이 아이폰처럼 잘 안 맞대.,연결이 아이폰처럼 잘 안 맞대.
그래가지고 그 친구도 다시 버즈 샀는 걸로 알고 있어.,그래가지고 그 친구도 다시 버즈 샀는 걸로 알고 있어.
오빠도 에어팟 그까 폰은 에어팟이,오빠도 에어팟 그러니까 폰은 에어팟이
그니까 갤럭시 건데 에어팟을 쓴단 말이야 전에 썼던 게 아이폰이라서,그러니까 갤럭시 건데 에어팟을 쓴단 말이야 전에 썼던 게 아이폰이라서
그러다가 결국에 최근에 갤럭시 버즈를 사더라고 왜냐면 같은 폰 기종이니까,그러다가 결국에 최근에 갤럭시 버즈를 사더라고 왜냐면 같은 폰 기종이니까
그렇게 하니까 연결하는 것도 쪼끔 더 끊기는 것도 적고 그렇게 하긴 하더라 그래서,그렇게 하니까 연결하는 것도 쪼끔 더 끊기는 것도 적고 그렇게 하긴 하더라 그래서
나는 지금 오빠랑 통화를 제일 많이 하니깐 오빠가 그게 편하다는 거를 이야기를 하니까,나는 지금 오빠랑 통화를 제일 많이 하니깐 오빠가 그게 편하다는 거를 이야기를 하니까
생각 없던 내가 아~ 사야 되나 약간 이란 생각이 들더라고.,생각 없던 내가 아~ 사야 되나 약간 이런 생각이 들더라고.
그게 편하기는 진짜 편해.,그게 편하기는 진짜 편해.
그리고 나 요즘 또 애플 워치도 너무 사고 싶어가지고,그리고 나 요즘 또 애플 워치도 너무 사고 싶어가지고
애플 워치 지금은 달리기 못 하는데,애플 워치 지금은 달리기 못 하는데
이제 운동할 때 애플 워치 있으면 그냥,이제 운동할 때 애플 워치 있으면 그냥
핸드폰 놨두고 시계만 차고 나가면,핸드폰 놨두고 시계만 차고 나가면
뭐~ 노래도 들을 수 있고 기록이 다 되니까,뭐~ 노래도 들을 수 있고 기록이 다 되니까
애플 워치를 사고 싶더라고.,애플 워치를 사고 싶더라고.
금 애플 워치랑 에어팟을 챙겨서 그걸로 통화를 하는 거야 휴대폰은 집에 놔두고,그럼 애플 워치랑 에어팟을 챙겨서 그걸로 통화를 하는 거야 휴대폰은 집에 놔두고
