사투리,표준어
학생이니까 솔직하게 크게 하고 크게 막 와닿는 것도 별로 없거든요 왜냐하면은 말씀해 주 막 어른들이나 이런 거 말씀해 주시는 거는 다 너무,학생이니까 솔직하게 크게 하고 크게 막 와닿는 것도 별로 없거든요 왜냐하면은 말씀해 주 막 어른들이나 이런 거 말씀해 주시는 거는 다 너무
저에겐 쫌 먼 이야기가 많고 그래가지고,저에겐 조금 먼 이야기가 많고 그래가지고
근데 그래 그럼에도,근데 그렇게 그럼에도
딱 이렇게 뭔가 어느 순간 지나고 나면은 딱 와닿는 게 있긴 있거든요 그래서 혹시,딱 이렇게 뭔가 어느 순간 지나고 나면은 딱 와닿는 게 있긴 있거든요 그래서 혹시
씨께서 저에게 뭐~ 전해줄 수 전해 줄 만한 교훈이나 팁 인생 팁 같은 게 혹시 있는지 궁금합니다.,씨께서 저에게 뭐~ 전해줄 수 전해 줄 만한 교훈이나 팁 인생 팁 같은 게 혹시 있는지 궁금합니다.
어~ 저도 나이가 그렇게 안 많아서 그런 얘기를 하기 쪼끔 민망하긴 한데,어~ 저도 나이가 그렇게 안 많아서 그런 얘기를 하기 쪼끔 민망하긴 한데
저는 이거는 힘들 때 생각을 하셨으면 좋겠는 게 진짜 다 지나간다는 거는 말해 주고 싶어요.,저는 이거는 힘들 때 생각을 하셨으면 좋겠는 게 진짜 다 지나간다는 거는 말해 주고 싶어요.
진짜 너무 힘들고 막 눈물이 나고 우울증 오고 이런 상황들이 분명히 오거든요 삶에,진짜 너무 힘들고 막 눈물이 나고 우울증 오고 이런 상황들이 분명히 오거든요 삶에
삶은 절대로 언제나 행복할 수는 없더라고요.,삶은 절대로 언제나 행복할 수는 없더라고요.
제가 몇 년 안 살아봤지만 그 가운데서도 쫌 많이 느꼈거든요 저는 취업 준비도 너무 힘들었었고,제가 몇 년 안 살아봤지만 그 가운데서도 조금 많이 느꼈거든요 저는 취업 준비도 너무 힘들었었고
그리고 저는 첫 회사 갔을 때 제 상사가 우리 회사가 에서 다 모두가 다 알아주는 또라이였어요 그래서,그리고 저는 첫 회사 갔을 때 제 상사가 우리 회사가 에서 다 모두가 다 알아주는 또라이였어요 그래서
진짜로 여자 상사였는데도 쌍욕을 들으면서 일을 하고,진짜로 여자 상사였는데도 쌍욕을 들으면서 일을 하고
그냥 기 진짜 회사 상사들이 그래요 기분 안 좋으면 그냥 아무거나 가지고 혼내고,그냥 기 진짜 회사 상사들이 그래요 기분 안 좋으면 그냥 아무거나 가지고 혼내고
그럴 때도 있고 또 집안 적으로도 항상 행복하지도 않았던 거 같애요.,그럴 때도 있고 또 집안 적으로도 항상 행복하지도 않았던 거 같애요.
분명히,분명히
진짜 저는 그렇게 생각하거든요 영화에 나오는 스토리들이,진짜 저는 그렇게 생각하거든요 영화에 나오는 스토리들이
절대 영화라고 더 세게 과장한 게 아니다 현실이 더 심하다 오히려 그걸 미화한 게 영화라고 생각을 해요 그 정도로,절대 영화라고 더 세게 과장한 게 아니다 현실이 더 심하다 오히려 그걸 미화한 게 영화라고 생각을 해요 그 정도로
사람들의 현실에는 너무너무 힘든 순간들이 많은 거예요 많아요 근데,사람들의 현실에는 너무너무 힘든 순간들이 많은 거예요 많아요 근데
진짜 신기한 게 정말 안 지나갈 거 같고,진짜 신기한 게 정말 안 지나갈 거 같고
내가 이 기간이 길어지면 길어질수록 내 삶이 무너지는 거 같지만 지나가더라고요 그리고 내가 어디에,내가 이 기간이 길어지면 길어질수록 내 삶이 무너지는 거 같지만 지나가더라고요 그리고 내가 어디에
가치를 두냐에 따라서도 그 삶의 무게가 굉장히 다르다고 생각을 하거든요.,가치를 두냐에 따라서도 그 삶의 무게가 굉장히 다르다고 생각을 하거든요.
사실 지금 저도 집이 집에서 살고 있지만 이 집도 우리 집게 아니고,사실 지금 저도 집이 집에서 살고 있지만 이 집도 우리 집게 아니고
근데 이 집에 있는 대출마저도,근데 이 집에 있는 대출마저도
어~ 은행이 다 준 거예요 그래서 제집도 아니고 제 돈도 아니에요.,어~ 은행이 다 준 거예요 그래서 제집도 아니고 제 돈도 아니에요.
그러면 만약에 제가 돈에 대해서 가치를 너무 크게 두고 있는 사람이었다면,그러면 만약에 제가 돈에 대해서 가치를 너무 크게 두고 있는 사람이었다면
이게 너무 힘들잖아요 아 나 평생 집 한 채 못 가지나 이렇게 생각할 수 있지만,이게 너무 힘들잖아요 아 나 평생 집 한 채 못 가지나 이렇게 생각할 수 있지만
또 내가 그거 말고도 우리 가정에 행복이나 나 자신에 더 집중한다면,또 내가 그거 말고도 우리 가정에 행복이나 나 자신에 더 집중한다면
이게 별로 이렇게 불행한 게 아닌 거죠 그냥 과정 중에 하나인 거죠.,이게 별로 이렇게 불행한 게 아닌 거죠 그냥 과정 중에 하나인 거죠.
그렇게 생각하고 살면은 쪼금 더 인생이 쪼끔,그렇게 생각하고 살면은 쪼금 더 인생이 쪼끔
행복하지 않을까 약간 이런 생각을 합니다.,행복하지 않을까 약간 이런 생각을 합니다.
음~ 그러면  씨가 아직 막 인생을 막 아직 많이 안 살아서 잘 모르겠다 이렇게 하셨는데,음~ 그러면  씨가 아직 막 인생을 막 아직 많이 안 살아서 잘 모르겠다 이렇게 하셨는데
어~ 그러면  씨가 꿈꾸는 약간 먼 미래는,어~ 그러면  씨가 꿈꾸는 약간 먼 미래는
어~ 어떻게 어떤 목표를 이루고 싶으시 세요 어떤 모든 어떤 모든 모든 방향에서 목표 중에서 꼭 이루고 싶다 하는 목표 있으세요?,어~ 어떻게 어떤 목표를 이루고 싶으시 세요 어떤 모든 어떤 모든 모든 방향에서 목표 중에서 꼭 이루고 싶다 하는 목표 있으세요?
어~ 저 같은 경우는,어~ 저 같은 경우는
어~ 가야 제가 가족관계가 아 가족관계라기보단 저희 가족 자체가 이렇게 뭔가 딱히 화목하거나 그런 생각은 안 하거든요 근데 전,어~ 가야 제가 가족관계가 아 가족관계라기보단 저희 가족 자체가 이렇게 뭔가 딱히 화목하거나 그런 생각은 안 하거든요 근데 전
사회적인 성공 이런 것도 물론 되면 좋긴 한데 일단 단 가족이 진짜,사회적인 성공 이런 것도 물론 되면 좋긴 한데 일단 단 가족이 진짜
화목하고 그랬으면 좋겠어요 뭔가 가족이 진짜 어~ 전 아직 결혼 결혼도 안 했지만 뭐~,화목하고 그랬으면 좋겠어요 뭔가 가족이 진짜 어~ 전 아직 결혼 결혼도 안 했지만 뭐~
그냥 와이프랑도 뭔가 엄청 서로 유대가 깊고 끈끈하고 믿을 수 있고 이러고 만약에 아들딸 낳는다고 하면 아들딸도 아들이 아빠 정말로 좋아하고 이러고 막,그냥 와이프랑도 뭔가 엄청 서로 유대가 깊고 끈끈하고 믿을 수 있고 이러고 만약에 아들딸 낳는다고 하면 아들딸도 아들이 아빠 정말로 좋아하고 이러고 막
아빠도 막 아들이랑 뭐~ 딸에게 관심 많이 가져주고 그냥 뭐~ 아들딸 힘들면 위로해 줄 수 있고 그럴만한 뭔가,아빠도 막 아들이랑 뭐~ 딸에게 관심 많이 가져주고 그냥 뭐~ 아들딸 힘들면 위로해 줄 수 있고 그럴만한 뭔가
그냥 진짜 말 그대로 튼튼한 가정 그런 거가 쫌 있으면 그냥,그냥 진짜 말 그대로 튼튼한 가정 그런 거가 조금 있으면 그냥
그게 제일,그게 제일
좋은 거 같애요 근데 뭐~ 그거 할려면은 뭐~ 당연히 뭐~ 경제 상황이나 이런 것도 좋아야 하니까 뭐~ 사회적인 성공 이런 것도 당연히 필요하긴 하겠지만,좋은 거 같애요 근데 뭐~ 그거 할려면은 뭐~ 당연히 뭐~ 경제 상황이나 이런 것도 좋아야 하니까 뭐~ 사회적인 성공 이런 것도 당연히 필요하긴 하겠지만
걍 걍 뭔가,그냥 그냥 뭔가
그냥 진짜 누가 봐도 아 화목한 가정이다 이렇게 느끼는 게 가장 좋을 거 같애요 그게,그냥 진짜 누가 봐도 아 화목한 가정이다 이렇게 느끼는 게 가장 좋을 거 같애요 그게
진짜 제가 만약에 꼭 이뤄야 한다고 하면은 그거에 낙 하나의 목표일 거 같애요.,진짜 제가 만약에 꼭 이뤄야 한다고 하면은 그거에 낙 하나의 목표일 거 같애요.
