사투리,표준어
더 맛있었고 크기도 되게 크고 치즈도 막 와 이렇게 늘어나 가지고 진짜 맛있게 먹었던 기억이 있고,더 맛있었고 크기도 되게 크고 치즈도 막 와 이렇게 늘어나 가지고 진짜 맛있게 먹었던 기억이 있고
그때 그~ 낭만포차를 제가 갔었거든요  그래서,그때 그~ 낭만포차를 제가 갔었거든요  그래서
그~ 삼합인가 뭐~ 삼겹살이랑 뭐~ 뭐~ 전복인가 조개인가 뭐~ 그런 거랑 새우랑 이렇게,그~ 삼합인가 뭐~ 삼겹살이랑 뭐~ 뭐~ 전복인가 조개인가 뭐~ 그런 거랑 새우랑 이렇게
주시는데 그거 묵고 이제 술 한잔을 딱 먹으니까 어~ 기분이 되게 진짜,주시는데 그거 먹고 이제 술 한잔을 딱 먹으니까 어~ 기분이 되게 진짜
밤바다를 보면서 먹으니까 너무 기분이 좋았거든요.,밤바다를 보면서 먹으니까 너무 기분이 좋았거든요.
그래 가지고 친구 한 명은 인제 너무 기분이 좋은 나머지 막 계속 그~,그래 가지고 친구 한 명은 인제 너무 기분이 좋은 나머지 막 계속 그~
자기 헌팅을 해야 된다면서,자기 헌팅을 해야 된다면서
뭐~ 나가자 나가자 이러고 우리는 너무 피곤하니까 아우 그냥 안에서 놀자 인제 술도  먹을 만큼 먹었고 안에서 놀자 카면서 이러고 있었는데,뭐~ 나가자 나가자 이러고 우리는 너무 피곤하니까 아우 그냥 안에서 놀자 인제 술도  먹을 만큼 먹었고 안에서 놀자 하면서 이러고 있었는데
그 친구가 막 인제 우리가 그~ 숙소도 바로 밤바다 그~ 낭만포차 바로 뒤에 있는 숙소였거든요.,그 친구가 막 인제 우리가 그~ 숙소도 바로 밤바다 그~ 낭만포차 바로 뒤에 있는 숙소였거든요.
그래서 그~ 앞에서 있는데 친구가,그래서 그~ 앞에서 있는데 친구가
베란다를 보면서 아~ 나가야 돼 하면서 계속 그랬던 기억이 나고,베란다를 보면서 아~ 나가야 돼 하면서 계속 그랬던 기억이 나고
어~ 저도 약간 이상하긴 한데 강릉에서 먹었던,어~ 저도 약간 이상하긴 한데 강릉에서 먹었던
씨오야끼라는 돼지고깃집 있어요.,씨오야끼라는 돼지고깃집 있어요.
근데 진짜 너무 맛있어 가지고 그거 먹으러 다시 한번 가보고 싶은 진짜,근데 진짜 너무 맛있어 가지고 그거 먹으러 다시 한번 가보고 싶은 진짜
어~ 강릉에 그~ &company-name4&인가?,어~ 강릉에 그~ &company-name4&인가?
그게 되게 유명하거든요 꼬막 비빔밥으로 근데 그거보다 더 맛있었어요 그~ 고깃집이,그게 되게 유명하거든요 꼬막 비빔밥으로 근데 그거보다 더 맛있었어요 그~ 고깃집이
그래서  다시 한번 꼭 가봐야겠다 생각을 했죠.,그래서  다시 한번 꼭 가봐야겠다 생각을 했죠.
음~ 혹시 그러면은 그~ 여행지 중에,음~ 혹시 그러면은 그~ 여행지 중에
여기는 꼭 가보고 싶었는데 못 가봤는 곳 있는지 궁금해요.,여기는 꼭 가보고 싶었는데 못 가봤는 곳 있는지 궁금해요.
예전에 가려다가 너무 멀어서 못 간 데가 있는데,예전에 가려다가 너무 멀어서 못 간 데가 있는데
제가 남이섬에 엄청 가보고 싶어서 계획을 다 짰거든요.,제가 남이섬에 엄청 가보고 싶어서 계획을 다 짰거든요.
여기 들렸다가 여기 들렸다 이렇게 이렇게 하면 되겠다라고 했는데 하필 그때 이제,여기 들렸다가 여기 들렸다 이렇게 이렇게 하면 되겠다라고 했는데 하필 그때 이제
시간이 이제 교통편 문제가 안 맞아져 가지고,시간이 이제 교통편 문제가 안 맞아져 가지고
무산돼서 거기를 못 가고 저희는 이제 밑에 지방이잖아요 저희 사는 데가?,무산돼서 거기를 못 가고 저희는 이제 밑에 지방이잖아요 저희 사는 데가?
그러니까 계속 근처만 가게 되는 거예요 경북 가거나 아니면 경남 가거나,그러니까 계속 근처만 가게 되는 거예요 경북 가거나 아니면 경남 가거나
안 그래도 저도 이제 강릉도 가보고 싶고 이제 강원도 뭐~ 속초 이런 데도 좀 멀리멀리 가보고 싶은데,안 그래도 저도 이제 강릉도 가보고 싶고 이제 강원도 뭐~ 속초 이런 데도 좀 멀리멀리 가보고 싶은데
그때는 이제 친구들이랑 갈 때는 교통편이 쫌 특히 남이섬은 뭐~,그때는 이제 친구들이랑 갈 때는 교통편이 조금 특히 남이섬은 뭐~
가는데 시간이 서울보다 더 오래 걸리더라고요 여기서 그래서,가는데 시간이 서울보다 더 오래 걸리더라고요 여기서 그래서
못 가고 그냥 경남으로 여행을 갔거든요 그래서 그게 쫌 너무,못 가고 그냥 경남으로 여행을 갔거든요 그래서 그게 조금 너무
아쉽고 또 여행지는 아닌데 제주도에 갔을 때,아쉽고 또 여행지는 아닌데 제주도에 갔을 때
커피 콜라라고 친구가 콜라를 좋아하거든요.,커피 콜라라고 친구가 콜라를 좋아하거든요.
친구가 콜라를 좋아하는데 뭐~ 커피랑 콜라를 뭐~ 어떻게 한 카페가 있대요.,친구가 콜라를 좋아하는데 뭐~ 커피랑 콜라를 뭐~ 어떻게 한 카페가 있대요.
그래서 거기를 가자 해서 렌트를 해 가지고 거기를 굳이 굳이 갔는데,그래서 거기를 가자 해서 렌트를 해 가지고 거기를 굳이 굳이 갔는데
하필 그때가 리모델링한다고 또 이전한다고  닫아버린 거예요 거기를 그래서 거기 못 가서,하필 그때가 리모델링한다고 또 이전한다고  닫아버린 거예요 거기를 그래서 거기 못 가서
제주도도 그래서 친구가 거기 가고 싶다 해서 한 번 더 갔으면?,제주도도 그래서 친구가 거기 가고 싶다 해서 한 번 더 갔으면?
응~ 하는 마음이 있어요.,응~ 하는 마음이 있어요.
저는 이제 내년 초에,저는 이제 내년 초에
제가 취직을 해서 이제 일을 시작해야 되거든요 그래서 지금 이 시기가 노는 시기인데,제가 취직을 해서 이제 일을 시작해야 되거든요 그래서 지금 이 시기가 노는 시기인데
원래 코로나가 아니었으면 이 시기에,원래 코로나가 아니었으면 이 시기에
유럽 여행을 갈려고 원래 계획을 하고 있었어요.,유럽 여행을 갈려고 원래 계획을 하고 있었어요.
근데 코로나 때문에 지금 비행기도 안 되고 이~ 뭐~ 여 해외여행을 못 가잖아요.,근데 코로나 때문에 지금 비행기도 안 되고 이~ 뭐~ 여 해외여행을 못 가잖아요.
그래서 저는 원래는 유럽 이제 뭐~ 한 한 달 해 가지고 유럽 전역 이렇게 돌아다니는 걸 하고 싶었는데,그래서 저는 원래는 유럽 이제 뭐~ 한 한 달 해 가지고 유럽 전역 이렇게 돌아다니는 걸 하고 싶었는데
어~ 지금 코로나가 아니었다면,어~ 지금 코로나가 아니었다면
꼭 가보고 싶은 해외 여행지가 있으신지 궁금합니다.,꼭 가보고 싶은 해외 여행지가 있으신지 궁금합니다.
저는 그~ 터키의 그~,저는 그~ 터키의 그~
그~ 풍 열기구 떠돌아다니는 거기를 꼭 가보고 싶었어요.,그~ 풍 열기구 떠돌아다니는 거기를 꼭 가보고 싶었어요.
