사투리,표준어
저는 최근에 담양 전남 담양으로 여행을 갔다 왔는데,저는 최근에 담양 전남 담양으로 여행을 갔다 왔는데
혹시 가장 최근에 갔다 온 여행이 어딘지 궁금해요.,혹시 가장 최근에 갔다 온 여행이 어딘지 궁금해요.
저는 가장 최근에 경기도 평택에,저는 가장 최근에 경기도 평택에
놀러 갔다 왔는데,놀러 갔다 왔는데
딱히 여행을 하려고 간 건 아니고 그쪽에 학교 친한 선배가 살고 계셔서,딱히 여행을 하려고 간 건 아니고 그쪽에 학교 친한 선배가 살고 계셔서
놀러 간 김에 근처를 이케 돌아보긴 했는데,놀러 간 김에 근처를 이렇게 돌아보긴 했는데
되게 뭐가 없더라고요 평택은 진짜,되게 뭐가 없더라고요 평택은 진짜
허허벌판이고 아파트 이런 거만 많고,허허벌판이고 아파트 이런 거만 많고
그래서 그~ 다음날에 쪼끔 경기도 근교에 뭐~ 관광지를 보고 싶어서,그래서 그~ 다음날에 쪼끔 경기도 근교에 뭐~ 관광지를 보고 싶어서
수원에 놀러 갔었거든요.,수원에 놀러 갔었거든요.
수원 화성 가 가지고 이제 돌아다녀 봤는데 저는 그런 이제 화성이나,수원 화성 가 가지고 이제 돌아다녀 봤는데 저는 그런 이제 화성이나
한옥 같은 옛날 그런 건물들을 돌아보면서 사진 찍는 거를,한옥 같은 옛날 그런 건물들을 돌아보면서 사진 찍는 거를
굉장히 좋아하는데 혹시 좋아하셔서 뭐~ 가본 경험이 있는지 궁금해요.,굉장히 좋아하는데 혹시 좋아하셔서 뭐~ 가본 경험이 있는지 궁금해요.
저도 한옥 같은 거 되게 좋아하는데 옛날에 그~ 경복궁 가서 사진 찍고,저도 한옥 같은 거 되게 좋아하는데 옛날에 그~ 경복궁 가서 사진 찍고
인제 그런 경험이 있고 근데,인제 그런 경험이 있고 근데
한옥은 좋아하지만 인제 제 저 혼자 좋아한다고 갈 수 있는 게 아니잖아요 뭐~,한옥은 좋아하지만 인제 제 저 혼자 좋아한다고 갈 수 있는 게 아니잖아요 뭐~
궁이나 뭐~ 이런 것들은 인제 언 저는 언니가 있는데 언니들은,궁이나 뭐~ 이런 것들은 인제 언 저는 언니가 있는데 언니들은
그런 데를 되게 안 좋아하거든요.,그런 데를 되게 안 좋아하거든요.
뭔가 고리타분하고,뭔가 고리타분하고
그~ 우리 뭐~ 역사 체험 하러 온 것도 아닌데 왜 그런 데 꼭 가야 되나  이런,그~ 우리 뭐~ 역사 체험 하러 온 것도 아닌데 왜 그런 데 꼭 가야 되나  이런
이런 생각이 좀 있어서 이제 가족들이랑 여행 가거나 뭐~ 친구들도 솔직히 막 좋아하거나 이런 친구들이랑 간 적이 많이 없어요.,이런 생각이 좀 있어서 이제 가족들이랑 여행 가거나 뭐~ 친구들도 솔직히 막 좋아하거나 이런 친구들이랑 간 적이 많이 없어요.
그런 데를 그래서 그런 데는 많이 안 가본 거 같고,그런 데를 그래서 그런 데는 많이 안 가본 거 같고
음~ 저는 그렇습니다 그런 좋은 데를 많이 못 가봐서 좀 아쉽네요.,음~ 저는 그렇습니다 그런 좋은 데를 많이 못 가봐서 좀 아쉽네요.
혹시 제일 좋았던 여행지는 어딘지 궁금해요.,혹시 제일 좋았던 여행지는 어딘지 궁금해요.
국내는 아니구요.,국내는 아니구요.
제가 학생 때에,제가 학생 때에
한 달 동안 어학연수로 아일랜드를 갔다 온 적이 있는데,한 달 동안 어학연수로 아일랜드를 갔다 온 적이 있는데
이제 수업이 끝나고 나면 오후에는 이제 자유 시간이고 주말도 학교가 쉬기 때문에 자유 시간이라서,이제 수업이 끝나고 나면 오후에는 이제 자유 시간이고 주말도 학교가 쉬기 때문에 자유 시간이라서
그때를 여행 간 것처럼 같이 간 친구들이랑 돌아다니는데,그때를 여행 간 것처럼 같이 간 친구들이랑 돌아다니는데
제가 거기가 첫 해외여행이었거든요.,제가 거기가 첫 해외여행이었거든요.
따지면 여행은 아니지만 해외를 간 건 처음이었는데,따지면 여행은 아니지만 해외를 간 건 처음이었는데
굉장히 좋고,굉장히 좋고
뭔가 옛날부터 동경했던 유럽?,뭔가 옛날부터 동경했던 유럽?
이런 느낌이고 또,이런 느낌이고 또
아~ 물론 불편한 점도 있었는데 저는 여행이 아니라 거기에 이제 한 달 동안 살다가 왔기 때문에,아~ 물론 불편한 점도 있었는데 저는 여행이 아니라 거기에 이제 한 달 동안 살다가 왔기 때문에
그~ 나라는 되게,그~ 나라는 되게
쉬는 거를 중요하게 생각해서 일요일에는 가게도,쉬는 거를 중요하게 생각해서 일요일에는 가게도
안 열구요 슈퍼 이런 거 편의점 이런 것도 거의 없고,안 열구요 슈퍼 이런 거 편의점 이런 것도 거의 없고
제가 학교가 한 다섯 시쯤에 마쳤는데 여섯 시면은 모든 가게랑 식당이 문을 닫고 퇴근을 하는 거예요.,제가 학교가 한 다섯 시쯤에 마쳤는데 여섯 시면은 모든 가게랑 식당이 문을 닫고 퇴근을 하는 거예요.
그래서 여행지로 갔으 만약 갔다면은 쫌 아~ 불편하다 싶었을 거 같은데,그래서 여행지로 갔으 만약 갔다면은 조금 아~ 불편하다 싶었을 거 같은데
이 나라에서 내가 일을 하면서 살면 뭔가,이 나라에서 내가 일을 하면서 살면 뭔가
되게 좋을 거 같은 거 왜냐면 휴식이 딱 보장돼 있고 모든 사람들 마인드가,되게 좋을 거 같은 거 왜냐면 휴식이 딱 보장돼 있고 모든 사람들 마인드가
쫌 그르 휴식이 좀 보편화 돼 있어서 그런지 사람들도 굉장히 여유롭고 다 친절하고 풍경도 너무 예쁘고,조금 그르 휴식이 좀 보편화 돼 있어서 그런지 사람들도 굉장히 여유롭고 다 친절하고 풍경도 너무 예쁘고
이래서 거기가 갔던 여행지 중에서는 가장 좋았는데,이래서 거기가 갔던 여행지 중에서는 가장 좋았는데
혹시 해외여행 가보신 경험이  있나요?,혹시 해외여행 가보신 경험이  있나요?
있다면 어디가 가장 좋았는지 궁금해요.,있다면 어디가 가장 좋았는지 궁금해요.
저는 해외여행을 딱 한 번밖에 못 가봤는데,저는 해외여행을 딱 한 번밖에 못 가봤는데
어~ 대만 대만을 갔었거든요 근데 그때가 여름이었는데,어~ 대만 대만을 갔었거든요 근데 그때가 여름이었는데
대만 아시잖아요 그~ 여름에 엄청 덥고 습하고 막,대만 아시잖아요 그~ 여름에 엄청 덥고 습하고 막
땀 완전 뻘뻘 나고 근데 제가 여름을 진짜 싫어해요  근데,땀 완전 뻘뻘 나고 근데 제가 여름을 진짜 싫어해요  근데
여름에 대만을 간 거예요.,여름에 대만을 간 거예요.
그래서 아~ 카면서 근데 되게 좋아하는 친구랑 가서,그래서 아~ 하면서 근데 되게 좋아하는 친구랑 가서
뭐~ 걱정은 없겠지 이러고 갔는데 근데 생각보다 밤에 되면,뭐~ 걱정은 없겠지 이러고 갔는데 근데 생각보다 밤에 되면
약간 좀 시원한 바람도 불고 이래서 괜찮긴 되게 괜찮았는데,약간 좀 시원한 바람도 불고 이래서 괜찮긴 되게 괜찮았는데
어~ 대만이라고 해서 뭐~,어~ 대만이라고 해서 뭐~
이제 축축한 그~ 거리들만 생각했었는데 뭔가 샌과 치히로에 나오는 그런 거리들 근데,이제 축축한 그~ 거리들만 생각했었는데 뭔가 샌과 치히로에 나오는 그런 거리들 근데
실제로 가보니까 그런 거리도 물론 좋지만 뭐~,실제로 가보니까 그런 거리도 물론 좋지만 뭐~
거기 음~ 진짜 기억이 안 나서,거기 음~ 진짜 기억이 안 나서
뭔가 섬 같은 데가 있었는데 약간 야자수 있고 거기 갔는데 되게,뭔가 섬 같은 데가 있었는데 약간 야자수 있고 거기 갔는데 되게
다른 외국에 온 거 같고,다른 외국에 온 거 같고
되게 좋았어요 그리고 인제,되게 좋았어요 그리고 인제
해외여행 같은 데나 뭐~ 친구들이랑 여행을 가다 보면,해외여행 같은 데나 뭐~ 친구들이랑 여행을 가다 보면
친구들이랑 싸우는 일이 좀 있잖아요?,친구들이랑 싸우는 일이 좀 있잖아요?
특히 또 해외여행은 한 사박 오일 삼박 사일 이렇게 가니까,특히 또 해외여행은 한 사박 오일 삼박 사일 이렇게 가니까
그때도 친구랑 저랑 약간 다툼이 있었거든요 왜냐면 뭐~,그때도 친구랑 저랑 약간 다툼이 있었거든요 왜냐면 뭐~
인제 우리 둘 다 계획여 계획성이 없는 거예요 전혀 그래 가지고,인제 우리 둘 다 계획여 계획성이 없는 거예요 전혀 그래 가지고
인제 한 명이 계획을 해야 되는데 그럴려면 항상 남는 사람은 저예요.,인제 한 명이 계획을 해야 되는데 그럴려면 항상 남는 사람은 저예요.
제가 계획을 짜야 되거든요 근데,제가 계획을 짜야 되거든요 근데
어~ 계획을 다 짜고 인제 이렇게 보여주면,어~ 계획을 다 짜고 인제 이렇게 보여주면
그거에 따라야 되잖아요 친구는 근데 꼭 친구는,그거에 따라야 되잖아요 친구는 근데 꼭 친구는
아~ 쪼금만 더 쉬다가 가면 안 되겠냐 근데 나는,아~ 쪼금만 더 쉬다가 가면 안 되겠냐 근데 나는
인제 어딜 놀러 가면 무조건 많이 보고 많이 걷고 많이,인제 어딜 놀러 가면 무조건 많이 보고 많이 걷고 많이
둘러보고 오자 이런 위주인데 친구는 인제 쉬는 것도 중요하다 힐링하러 왔지 우리가 일하러 왔냐 약간 이런 것도 있어서,둘러보고 오자 이런 위주인데 친구는 인제 쉬는 것도 중요하다 힐링하러 왔지 우리가 일하러 왔냐 약간 이런 것도 있어서
그때 약간 부딪힌 게 있었고 뭐~ 그~ 이후로는 뭐~ 서로 그냥,그때 약간 부딪힌 게 있었고 뭐~ 그~ 이후로는 뭐~ 서로 그냥
실실 웃으면서 넘어갔고 그랬던 기억이 있습니다.,실실 웃으면서 넘어갔고 그랬던 기억이 있습니다.
혹시 음~,혹시 음~
저는 여행 계획 짜는 걸 별로 안 좋아하는데 이번에 여행 갔을 때도,저는 여행 계획 짜는 걸 별로 안 좋아하는데 이번에 여행 갔을 때도
가족들이 여행 계획을 아무도 안 짰기 때문에 제가 짰거든요?,가족들이 여행 계획을 아무도 안 짰기 때문에 제가 짰거든요?
혹시 여행 갈 때 계획을 하시는 편인지 아니면은 어~ 계획에 따르면 편인지 궁금해요.,혹시 여행 갈 때 계획을 하시는 편인지 아니면은 어~ 계획에 따르면 편인지 궁금해요.
저도 여행을 가면,저도 여행을 가면
좀 많이 둘러보고 많이 걷고 뭐~ 사진도 많이 남기고 이러는 걸 좋아하는 편이라서,좀 많이 둘러보고 많이 걷고 뭐~ 사진도 많이 남기고 이러는 걸 좋아하는 편이라서
보통 여행을 가게 되면 계획을 거의 제가 짜요.,보통 여행을 가게 되면 계획을 거의 제가 짜요.
왜냐하면 다 어~ 제 친구들은 쫌 계획을 제가 짜면은?,왜냐하면 다 어~ 제 친구들은 조금 계획을 제가 짜면은?
이제 따라와 주는 스타일이라서,이제 따라와 주는 스타일이라서
제가 이렇게 이렇게 여기 가고 싶고 여기서 사진 찍고 싶고 그런 데를,제가 이렇게 이렇게 여기 가고 싶고 여기서 사진 찍고 싶고 그런 데를
선별해서 이렇게 가는 게 어때라고 물어보면은 그냥 친구들은,선별해서 이렇게 가는 게 어때라고 물어보면은 그냥 친구들은
응응 그러자 이래 가지고,응응 그러자 이래 가지고
제 저는 보통 다 제가 짜는 편이긴 한데,제 저는 보통 다 제가 짜는 편이긴 한데
이게 근데 또 제가 좋아서 짜는 거랑,이게 근데 또 제가 좋아서 짜는 거랑
강제적으로 저만 짜야 돼서 이제 저만 짜니깐 계획을 짜야 되는 거랑 이게 또 다르잖아요.,강제적으로 저만 짜야 돼서 이제 저만 짜니깐 계획을 짜야 되는 거랑 이게 또 다르잖아요.
제가 그래서 예전에 학교 졸업 여행을 가는데,제가 그래서 예전에 학교 졸업 여행을 가는데
원래 제가 계획을 짜던 여행들은 뭐~ 많아도 다섯 명?,원래 제가 계획을 짜던 여행들은 뭐~ 많아도 다섯 명?
이런 소수 여행이었는데 그때 처음으로 열다섯 명이서 가는 여행 계획을,이런 소수 여행이었는데 그때 처음으로 열다섯 명이서 가는 여행 계획을
저 혼자 짜야 되는 거였던 거예요.,저 혼자 짜야 되는 거였던 거예요.
그래 가지고 그네 그때 원래 여행 가면은,그래 가지고 그네 그때 원래 여행 가면은
제가 계획을 짜고 잘 전 좀 다 맞춰주는 편이거든요?,제가 계획을 짜고 잘 전 좀 다 맞춰주는 편이거든요?
그래서 잘 안 싸우는데 그냥 제가 음~ 뭐~ 그럴 수 있지 이런 편인데,그래서 잘 안 싸우는데 그냥 제가 음~ 뭐~ 그럴 수 있지 이런 편인데
그때 저는 좀 안 싸우고 싶은데 사람이 많으니까 그~ 내부에서도 이제,그때 저는 좀 안 싸우고 싶은데 사람이 많으니까 그~ 내부에서도 이제
제 계획을 가지고,제 계획을 가지고
이렇게 얘가 짰는데 따라와 줘야지랑 그래도 이건 아니지 않나 이런 거,이렇게 얘가 짰는데 따라와 줘야지랑 그래도 이건 아니지 않나 이런 거
이런 파가 나뉘어 가지고 처음으로 여행 가서 싸우게 된 거예요.,이런 파가 나뉘어 가지고 처음으로 여행 가서 싸우게 된 거예요.
그래서 그때 쫌 마음이 쫌 불편하더라고요?,그래서 그때 조금 마음이 조금 불편하더라고요?
그래서 그때 이후로는 쫌 계획 짜는 걸 쫌 멀리하게 된?,그래서 그때 이후로는 조금 계획 짜는 걸 조금 멀리하게 된?
요즘은 또 코로나 때문에 어차피 여행도 못 가니까 그래서 계획을 안 짠지,요즘은 또 코로나 때문에 어차피 여행도 못 가니까 그래서 계획을 안 짠지
쫌 된 것 같아요.,조금 된 것 같아요.
음~ 아~ 그러면은,음~ 아~ 그러면은
아까 전에 해외 얘기를 했는데 국내에서 국내에 가봤던 관광 명소 중에,아까 전에 해외 얘기를 했는데 국내에서 국내에 가봤던 관광 명소 중에
어~ 여기서 사진 찍으니까 정말 예쁘더라 또는,어~ 여기서 사진 찍으니까 정말 예쁘더라 또는
어~ 여기 뭐~ 음식이 진짜 너무 맛있어서 좋았다,어~ 여기 뭐~ 음식이 진짜 너무 맛있어서 좋았다
하는 국내 여행지는 어디인지,하는 국내 여행지는 어디인지
저는 국내 여행지 중에 제주도를 제일 좋아하는데요?,저는 국내 여행지 중에 제주도를 제일 좋아하는데요?
뭐~ 다른 한국 사람들 모두가 제일 최고로 꼽는 관광 명소긴 한데,뭐~ 다른 한국 사람들 모두가 제일 최고로 꼽는 관광 명소긴 한데
인제 어~ 제주도도,인제 어~ 제주도도
뭐~ 서부 쪽으로 다니는 게 또 있고 뭐~ 동부 쪽으로 다니는 것도 있고 막 이런데 그때 우도?,뭐~ 서부 쪽으로 다니는 게 또 있고 뭐~ 동부 쪽으로 다니는 것도 있고 막 이런데 그때 우도?
우도를 갔었거든요?,우도를 갔었거든요?
근데 우도 갈 때 뭐~ 배도 타야 되고 이래 가지고 솔직히,근데 우도 갈 때 뭐~ 배도 타야 되고 이래 가지고 솔직히
어~ 뭐~ 그렇게까지 가야 돼 이렇게 싶었거든요 그때 또 언니랑 갔었는데,어~ 뭐~ 그렇게까지 가야 돼 이렇게 싶었거든요 그때 또 언니랑 갔었는데
그랬는데 진짜 거기에서 우도 서빈백사라고,그랬는데 진짜 거기에서 우도 서빈백사라고
그~ 모래가 하얀 그~ 바닷가가 있는데 진짜 너무 예쁜 거예요 진  그래서,그~ 모래가 하얀 그~ 바닷가가 있는데 진짜 너무 예쁜 거예요 진  그래서
아~ 진짜 예쁘구나 그때는 인제 뭐~ 대학교 다닐 때라서,아~ 진짜 예쁘구나 그때는 인제 뭐~ 대학교 다닐 때라서
뭐~ 약간 그런 욕심도 있었어요 뭔가 인생샷을 남기고 오자  그런 그런 게 쫌 심해 가지고,뭐~ 약간 그런 욕심도 있었어요 뭔가 인생샷을 남기고 오자  그런 그런 게 조금 심해 가지고
맨 계속 언니한테 여기서 사진 찍어달라고 막 그러고,맨 계속 언니한테 여기서 사진 찍어달라고 막 그러고
그래서 거기도 진짜 예뻤고 그리고 뭐 제주도는 진짜 어딜 가든 다 예쁜 거 같고,그래서 거기도 진짜 예뻤고 그리고 뭐 제주도는 진짜 어딜 가든 다 예쁜 거 같고
그리고 작년에 작년 맞나 작년에 강릉 갔었는데,그리고 작년에 작년 맞나 작년에 강릉 갔었는데
강릉도 진짜 바다가 예쁘더라고요.,강릉도 진짜 바다가 예쁘더라고요.
해변 색깔도 진짜 완전 제주도 색깔 못지않게?,해변 색깔도 진짜 완전 제주도 색깔 못지않게?
너무 예뻐 가지고 그때도 다시 한번,너무 예뻐 가지고 그때도 다시 한번
뭐~ 강원도도 너무 예쁘다고 생각했고?,뭐~ 강원도도 너무 예쁘다고 생각했고?
음~ 그리고 아~ 강릉에서,음~ 그리고 아~ 강릉에서
그~ &company-name1& 갔었는데 커피집 카페인데 거기도,그~ &company-name1& 갔었는데 커피집 카페인데 거기도
카페에서 뭐~ 라떼 맛있다고 해 가지고 갔었는데,카페에서 뭐~ 라떼 맛있다고 해 가지고 갔었는데
어~ 진짜 맛있구나 이러고 왔었던 기억도 있고,어~ 진짜 맛있구나 이러고 왔었던 기억도 있고
인제 제주도는 뭐~ 해변 보면서 먹는 라면이 되게 맛있었어요 그리고,인제 제주도는 뭐~ 해변 보면서 먹는 라면이 되게 맛있었어요 그리고
어~ 근데 진짜 어~ 어딜 가든지 간에,어~ 근데 진짜 어~ 어딜 가든지 간에
사람이 괜찮은 사람이랑 같이 가면 어딜 가도 다 예쁘고 다 좋아 보이고 뭘 먹어도 맛있었던 것 같애요.,사람이 괜찮은 사람이랑 같이 가면 어딜 가도 다 예쁘고 다 좋아 보이고 뭘 먹어도 맛있었던 것 같애요.
제가 가장 최근에 갔던 데는 담양이었는데,제가 가장 최근에 갔던 데는 담양이었는데
거기서는 뭐~ 국수 거리가 유명하다고 해서 국 처음에,거기서는 뭐~ 국수 거리가 유명하다고 해서 국 처음에
첫 출발 아~ 첫 도착지가 거기였는데 인제 뭐~ &company-name2& 라고 국숫집이 있어요.,첫 출발 아~ 첫 도착지가 거기였는데 인제 뭐~ &company-name2& 라고 국숫집이 있어요.
거기는 국수 거리랑은 쪼금 먼데,거기는 국수 거리랑은 쪼금 먼데
뭐~ 제일 맛있다고 해서 유명하다고 해서 제가 거기를 꼭 넣었는데 엄마랑,뭐~ 제일 맛있다고 해서 유명하다고 해서 제가 거기를 꼭 넣었는데 엄마랑
뭐~ 언니랑 형부들도 다 맛있다고,뭐~ 언니랑 형부들도 다 맛있다고
어~ 잘 찾았다고 뭐~ 역시 뭐~ 막내가 열일하네 하면서  그래 가지고 기분이 좀 좋아졌던 기억이 있네요  음~,어~ 잘 찾았다고 뭐~ 역시 뭐~ 막내가 열일하네 하면서  그래 가지고 기분이 좀 좋아졌던 기억이 있네요  음~
혹시 가봤던 여행지 중에 다시 한번 가보고 싶은 여행지가 있는지 궁금해요.,혹시 가봤던 여행지 중에 다시 한번 가보고 싶은 여행지가 있는지 궁금해요.
제가 장범준 노래를 많이 좋아하거든요 그래서 그~,제가 장범준 노래를 많이 좋아하거든요 그래서 그~
장범준 노래 중에 여수 밤바다라는 노래가 있잖아요.,장범준 노래 중에 여수 밤바다라는 노래가 있잖아요.
그~ 노래를 듣고 여수에를 너무 가고 싶어서,그~ 노래를 듣고 여수에를 너무 가고 싶어서
예전에 여수를 간 적이 있었는데,예전에 여수를 간 적이 있었는데
그때 여수 하루,그때 여수 하루
이박 삼일인지 삼박 사일 동안 여수만 보기에는 여수가 굉 작다고 해서 여수랑 순천을 이제 같이,이박 삼일인지 삼박 사일 동안 여수만 보기에는 여수가 굉 작다고 해서 여수랑 순천을 이제 같이
놀러를 갔어요.,놀러를 갔어요.
근데 첫날에 이제 여수 밤바다 노래를 들으면서 이제 바다 보고 거기서,근데 첫날에 이제 여수 밤바다 노래를 들으면서 이제 바다 보고 거기서
여수 그~ 바다 쪽에 가면 낭만포차라고 포차가 이렇게 쫙 있는데,여수 그~ 바다 쪽에 가면 낭만포차라고 포차가 이렇게 쫙 있는데
거기에서 이제 술 한잔하는 게 로망이었단 말이에요.,거기에서 이제 술 한잔하는 게 로망이었단 말이에요.
그런데 갔는데 그날 하필 강풍이 불어서 낭만포차가 문을 닫은 거예요.,그런데 갔는데 그날 하필 강풍이 불어서 낭만포차가 문을 닫은 거예요.
그래서 그니깐 계획이 틀어진?,그래서 그러니깐 계획이 틀어진?
그냥,그냥
이제 지 여기 대구 시내에서도 갈 수 있을 법한 그냥 술집에 들어갔거든요 이제 저녁을 먹어야 하니깐,이제 지 여기 대구 시내에서도 갈 수 있을 법한 그냥 술집에 들어갔거든요 이제 저녁을 먹어야 하니깐
계속 그게 너무 아쉬워서 여수에 쫌,계속 그게 너무 아쉬워서 여수에 조금
한 번 더 가보고 싶고 거기 꼭 포차를 갔다가 이제 밤바다 보는 거를 해보고 싶어서,한 번 더 가보고 싶고 거기 꼭 포차를 갔다가 이제 밤바다 보는 거를 해보고 싶어서
거기를 가보고 싶고 글고 그~ 최근에 수원 갔다 왔다고 했는데,거기를 가보고 싶고 그리고 그~ 최근에 수원 갔다 왔다고 했는데
그때 시간이 없어서 수원 화성을 다 못 봤어요.,그때 시간이 없어서 수원 화성을 다 못 봤어요.
화성이 되게 큰데 그~ 근처에,화성이 되게 큰데 그~ 근처에
연못이 있거든요 방화수류정이라고?,연못이 있거든요 방화수류정이라고?
거기랑 행궁 하나밖에 못 보고 그~ 행궁 그걸 못 봤는데 제가 몰랐는데,거기랑 행궁 하나밖에 못 보고 그~ 행궁 그걸 못 봤는데 제가 몰랐는데
사람들이 그 행궁 갈 때 코스로 막 세네 시간 이렇게 잡고 간다고 하더라고요?,사람들이 그 행궁 갈 때 코스로 막 세네 시간 이렇게 잡고 간다고 하더라고요?
저는  몰라 가지고,저는  몰라 가지고
사전 조사를 안 하고 갑작스럽게 간 거라 못 보고 와서 또 그것도 너무 아쉬워서 다음번에,사전 조사를 안 하고 갑작스럽게 간 거라 못 보고 와서 또 그것도 너무 아쉬워서 다음번에
또 이제 수원에 한 번 더 가자라고 친구랑 약속을 했어요.,또 이제 수원에 한 번 더 가자라고 친구랑 약속을 했어요.
여행지 가서 아까 그~ 국수?,여행지 가서 아까 그~ 국수?
맛있었다고 하셨잖아요.,맛있었다고 하셨잖아요.
말고 혹시 진짜 뭐~,말고 혹시 진짜 뭐~
갔던 여행지에서 먹었던 음식 중에 가장 제일 기억에 남는 거 한 가지만 꼽자면,갔던 여행지에서 먹었던 음식 중에 가장 제일 기억에 남는 거 한 가지만 꼽자면
뭘로  꼽으실 건지,뭘로  꼽으실 건지
저는 그~ 여수 여행에서,저는 그~ 여수 여행에서
쫌 그~ 바다 있는 도시에서 먹은 거 먹은 먹 안 어울리긴 하는데,조금 그~ 바다 있는 도시에서 먹은 거 먹은 먹 안 어울리긴 하는데
여수에서 제가 피자를 먹었거든요 근데,여수에서 제가 피자를 먹었거든요 근데
그~ 피자집 이름 &company-name3&인가 그래요 근데 그게 진짜 가게 이름처럼 제 인생 피자가 된 거예요.,그~ 피자집 이름 &company-name3&인가 그래요 근데 그게 진짜 가게 이름처럼 제 인생 피자가 된 거예요.
그래서 그~ 여수 아~ 여수를 한 번 더 가고 싶은 이유 중에 그~ 피자집도 있을 정도로,그래서 그~ 여수 아~ 여수를 한 번 더 가고 싶은 이유 중에 그~ 피자집도 있을 정도로
제가 다녔던 여행지 중에서  먹어봤던 음식 중에 그 피자가 제일 맛있었거든요.,제가 다녔던 여행지 중에서  먹어봤던 음식 중에 그 피자가 제일 맛있었거든요.
그래서 어떤 게 제일 기억에 남는지,그래서 어떤 게 제일 기억에 남는지
기억에 남는다기보다는 인제 여수 이야기를 하셔 가지고 기억이 저도 났거든요.,기억에 남는다기보다는 인제 여수 이야기를 하셔 가지고 기억이 저도 났거든요.
그~ 여수에 &company-name3& 저도 먹어봤는데 진짜 너무 맛있는 거예요.,그~ 여수에 &company-name3& 저도 먹어봤는데 진짜 너무 맛있는 거예요.
요그 대구에 거기는 여수는 피자 맛집인가 싶을 정도로 대구에 있는 피자보다,요거 대구에 거기는 여수는 피자 맛집인가 싶을 정도로 대구에 있는 피자보다
