사투리,표준어
그 가수에 대해서 다시 보이기도 하고,그 가수에 대해서 다시 보이기도 하고
콘서트인데도 라이브 안 하면 또 실망스럽고,콘서트인데도 라이브 안 하면 또 실망스럽고
어느 정도의 기본은 해줬으면 하는 그런 생각은 있어요.,어느 정도의 기본은 해줬으면 하는 그런 생각은 있어요.
님 같으면 공연을 하는 입장이니까,님 같으면 공연을 하는 입장이니까
공연을 하면서 쫌 인상 깊었던 관객,공연을 하면서 조금 인상 깊었던 관객
은 혹시 있나요?,은 혹시 있나요?
저도 아마추어다 보니까 관객들까지 신경을 못 쓰는 것 같아요.,저도 아마추어다 보니까 관객들까지 신경을 못 쓰는 것 같아요.
까 저가 치는 것도 바쁘고 박자 맞추는 것도 바쁘고,까 저가 치는 것도 바쁘고 박자 맞추는 것도 바쁘고
공연을 해도 해도 긴장은 계속되더라고요 그래서,공연을 해도 해도 긴장은 계속되더라고요 그래서
고개를 잘 못들고 갸 드럼만 쳐다보고,고개를 잘 못들고 갸 드럼만 쳐다보고
주로 공연을 하는 것 같고요.,주로 공연을 하는 것 같고요.
가끔씩 관객들을 보긴 보는데,가끔씩 관객들을 보긴 보는데
딱히 인상 깊었던 관객은 없었던 것 같아요.,딱히 인상 깊었던 관객은 없었던 것 같아요.
그래서 저는 그 공연할 때,그래서 저는 그 공연할 때
박자 맞추고 박자가 되게 많이 나가거든요.,박자 맞추고 박자가 되게 많이 나가거든요.
그래서 그거 맞추는데 신경 쓴다고,그래서 그거 맞추는데 신경 쓴다고
주변 환경에 대해서는 그렇게,주변 환경에 대해서는 그렇게
신경을 쓰지 못하는 것 같아요.,신경을 쓰지 못하는 것 같아요.
그리고 공연장 에피소드,그리고 공연장 에피소드
가 있는데 초등학교 때 광안리에 불꽃 축제인가 어떤 뭐~ 축제가 있었을 거예요 그래서,가 있는데 초등학교 때 광안리에 불꽃 축제인가 어떤 뭐~ 축제가 있었을 거예요 그래서
가긴 갔는데 길을 잃어버렸던 적이 있거든요.,가긴 갔는데 길을 잃어버렸던 적이 있거든요.
혹시  님은 그~ 공연장에서 길을 잃어버리거나 뭐~ 그런 적 없으세요?,혹시  님은 그~ 공연장에서 길을 잃어버리거나 뭐~ 그런 적 없으세요?
아~ 저는 제가 길을 잃어버린 건 아니고,아~ 저는 제가 길을 잃어버린 건 아니고
엄마 몰래 갔다가,엄마 몰래 갔다가
엄마가 찾으러 오신 적은 있으세요 혹시나 잃어버렸나 싶어가지고 막,엄마가 찾으러 오신 적은 있으세요 혹시나 잃어버렸나 싶어가지고 막
고모들이랑 같이  찾으러 온 적은 계세요 근데 이제,고모들이랑 같이  찾으러 온 적은 계세요 근데 이제
어린 마음에 이제 가면 혼내고 이렇게 하시니까 몰래 갔었는데,어린 마음에 이제 가면 혼내고 이렇게 하시니까 몰래 갔었는데
막상 요즘은 그랬던 적은 있었어요 어~,막상 요즘은 그랬던 적은 있었어요 어~
저는 이제 관객 입장으로 이제 항상 공연을 보다 보니까,저는 이제 관객 입장으로 이제 항상 공연을 보다 보니까
가수들이 실수하는 게 사실 잘 그것도 보 직접 보는 게 재미가 있었거든요.,가수들이 실수하는 게 사실 잘 그것도 보 직접 보는 게 재미가 있었거든요.
님도 약간 공연하실 때,님도 약간 공연하실 때
관객이랑 소통을 많이 하면 좋을 것 같은데,관객이랑 소통을 많이 하면 좋을 것 같은데
혹시 뭐~ 이제 관객과의 소통을,혹시 뭐~ 이제 관객과의 소통을
어떤 방법을 할지 쪼끔 생각해 놓으신 건 없으세요?,어떤 방법을 할지 쪼끔 생각해 놓으신 건 없으세요?
제가 악기 파트다 보니까 관객들이랑 소통은 보통 보컬이 많이 하고요 일단 저는 마이크가  없어서 어떻게 소통할 방법도 없고 소통을,제가 악기 파트다 보니까 관객들이랑 소통은 보통 보컬이 많이 하고요 일단 저는 마이크가  없어서 어떻게 소통할 방법도 없고 소통을
굳이 안 해도 된다고 생각해요.,굳이 안 해도 된다고 생각해요.
보컬이 알아서 잘 풀어가고 보컬 쪽은,보컬이 알아서 잘 풀어가고 보컬 쪽은
되게 멘트 같은 것도 준비하고 어떻게 악기를,되게 멘트 같은 것도 준비하고 어떻게 악기를
연주해야 되니까 그 푼도 바꿔야 되고 세션도 세션 멤버들도 갈아야 되고,연주해야 되니까 그 푼도 바꿔야 되고 세션도 세션 멤버들도 갈아야 되고
그런 경우가 있거든요 그래서 그거 다른 악기 파트는 자기 튜닝이나,그런 경우가 있거든요 그래서 그거 다른 악기 파트는 자기 튜닝이나
그런 걸 바꾼다고 바쁘고 보컬들은,그런 걸 바꾼다고 바쁘고 보컬들은
그렇게 막 관객들이랑 소통을 고민,그렇게 막 관객들이랑 소통을 고민
하는 것 같아요 그리고,하는 것 같아요 그리고
제가 십 센치 공연을 무료 공연을 한 번 보 본 적이 있거든요.,제가 십 센치 공연을 무료 공연을 한 번 보 본 적이 있거든요.
그때 되게 재밌다고 생각했었고,그때 되게 재밌다고 생각했었고
혹시 공연을 해보거나 하고 싶진 않으세요?,혹시 공연을 해보거나 하고 싶진 않으세요?
공연은 어릴 때 이제 피아노학원 다니면서,공연은 어릴 때 이제 피아노학원 다니면서
이제 약간 연주회처럼 달에 한 번 뭐~ 분기별로 한 번 이런 게 다인데 사실 너무 어릴 적이라서,이제 약간 연주회처럼 달에 한 번 뭐~ 분기별로 한 번 이런 게 다인데 사실 너무 어릴 적이라서
기억은 없고 사진만 보고 저런 걸 했었구나 정도구요 아~ 예 그~ 중학교 때 학예회 같은 거 이런 것만 해봤어요.,기억은 없고 사진만 보고 저런 걸 했었구나 정도구요 아~ 예 그~ 중학교 때 학예회 같은 거 이런 것만 해봤어요.
