사투리,표준어
네 드라마 주제는 사실 어제 했던 주제이긴 한데 너무,네 드라마 주제는 사실 어제 했던 주제이긴 한데 너무
나와서 너무 재밌게 했던 주제라서 한 번 더 해 보고 싶었거든요 그래서,나와서 너무 재밌게 했던 주제라서 한 번 더 해 보고 싶었거든요 그래서
어저께 되게 좋은 팁들을 많이 좋은 팁,어저께 되게 좋은 팁들을 많이 좋은 팁
좋은 프로그램들을 많이 소개받아가지구,좋은 프로그램들을 많이 소개받아가지구
같이 관리해 주시는 분이랑 세 명에서 쿵짝쿵짝하면서 완전 재밌게 놀았었는데 혹시,같이 관리해 주시는 분이랑 세 명에서 쿵짝쿵짝하면서 완전 재밌게 놀았었는데 혹시
좋아하는 드라마 장르라든지,좋아하는 드라마 장르라든지
뭐~ 지금 최근에 지금 보고 계신 드라마가 있으실까요?,뭐~ 지금 최근에 지금 보고 계신 드라마가 있으실까요?
어~ 보고 있는 거 지금도 보고 있는데 이거 중국 드라마구요.,어~ 보고 있는 거 지금도 보고 있는데 이거 중국 드라마구요.
넷플릭스에 올라오는 영화고 제목은 겨우 서른 라는 영화예요.,넷플릭스에 올라오는 영화고 제목은 겨우 서른 라는 영화예요.
배경은 상하이를 배경으로 해서,배경은 상하이를 배경으로 해서
어~ 상하이에서 하는 삼십 대 여성 세 명의 삶을,어~ 상하이에서 하는 삼십 대 여성 세 명의 삶을
어~ 보여 주고 그들의 어~ 처해 있는 상황 뭐~,어~ 보여 주고 그들의 어~ 처해 있는 상황 뭐~
앞으로 헤쳐나가야 할 그런 문제들을 중점으로 다루는 영화거든요.,앞으로 헤쳐나가야 할 그런 문제들을 중점으로 다루는 영화거든요.
그거를 되게 재밌게 보고 있는데,그거를 되게 재밌게 보고 있는데
보면은 어~ 아무래도 삼십 대 초반들의 이야기니까,보면은 어~ 아무래도 삼십 대 초반들의 이야기니까
중점적인 연애는 아 그 문제는,중점적인 연애는 아 그 문제는
결혼하고 연애,결혼하고 연애
그리고 앞으로 뭐~ 결혼해야 되나 아니면,그리고 앞으로 뭐~ 결혼해야 되나 아니면
기혼으로 남을 것인가에 대한 문제를 계속 끊임없이,기혼으로 남을 것인가에 대한 문제를 계속 끊임없이
어~ 보여 주고 있는 드라마거든요.,어~ 보여 주고 있는 드라마거든요.
그래서 저는 어~,그래서 저는 어~
제가 삼십 대기 때문에 되게 공감을 하면서 지금 보고 있고,제가 삼십 대기 때문에 되게 공감을 하면서 지금 보고 있고
보면 어~ 결혼을 해도,보면 어~ 결혼을 해도
항상 그게 끝이 아니고,항상 그게 끝이 아니고
또 다른 문제가 있고 더,또 다른 문제가 있고 더
어~ 힘든 부분이 있을 거다 라고 이렇게,어~ 힘든 부분이 있을 거다 라고 이렇게
드라마에서 보여지고 있거든요.,드라마에서 보여지고 있거든요.
어~ 남편의 문제도 있을 수도 있고 자식의 문제도 있고,어~ 남편의 문제도 있을 수도 있고 자식의 문제도 있고
그래서 그런 거 보면서 정말  현실적으로 앞으로 이제,그래서 그런 거 보면서 정말  현실적으로 앞으로 이제
제가 겪을 수 있는 그런 이야기다 싶어서,제가 겪을 수 있는 그런 이야기다 싶어서
되게 재밌게 보고 있거든요.,되게 재밌게 보고 있거든요.
그기 거기에 보시면은 약간 한국 문화하고 다른 부분이 나오는데,거기 거기에 보시면은 약간 한국 문화하고 다른 부분이 나오는데
한국은 어~ 지금은 많이 쫌 바뀌고 있지마는,한국은 어~ 지금은 많이 조금 바뀌고 있지마는
예전에 저희 뭐~ 아버지 어머니 할머니 할아버지 세대에서는,예전에 저희 뭐~ 아버지 어머니 할머니 할아버지 세대에서는
무조건 어~ 여자가 앞치마를 메고 밥을 해야 된다 이런,무조건 어~ 여자가 앞치마를 메고 밥을 해야 된다 이런
고정관념이 있잖아요 그리고 또,고정관념이 있잖아요 그리고 또
남성분들은 일을 안 하시고  일을,남성분들은 일을 안 하시고  일을
근데 한국 어~ 문화에서는 그런 부분이,근데 한국 어~ 문화에서는 그런 부분이
쫌 저희와는 많이  다르더라고요.,조금 저희와는 많이  다르더라고요.
어~ 퇴근 후에도 무조건 여성이 뭐~ 밥을 해야 되고 집안일을 해야 되는 게 아니라,어~ 퇴근 후에도 무조건 여성이 뭐~ 밥을 해야 되고 집안일을 해야 되는 게 아니라
오히려 뭐~ 음식은 남자 쪽에서,오히려 뭐~ 음식은 남자 쪽에서
더 많이 하는 경우가 있다고 드라마에서도 보여지고,더 많이 하는 경우가 있다고 드라마에서도 보여지고
제 주변 중국 친구들도,제 주변 중국 친구들도
그런 걸 이상하게 생각하지도 않고 오히려 자연스럽게,그런 걸 이상하게 생각하지도 않고 오히려 자연스럽게
또 생각하는 부분이 있어가지고 제가 영화 아이 드라마 보면서,또 생각하는 부분이 있어가지고 제가 영화 아이 드라마 보면서
쫌 많이 부러웠던 부분이구요.,조금 많이 부러웠던 부분이구요.
그리고 지금 이게 아직 제가 끝까지 본 건 아니라서,그리고 지금 이게 아직 제가 끝까지 본 건 아니라서
이게 사십오 편까지 있거든요.,이게 사십오 편까지 있거든요.
그래서 계속 이제 하루에 한두 편씩 보고 있어요.,그래서 계속 이제 하루에 한두 편씩 보고 있어요.
지금 또 코로나다 보니까 어~ 집에서,지금 또 코로나다 보니까 어~ 집에서
할 수 있는 일이 일을 찾았는데 집에서 여가생활을 많이 보내는데,할 수 있는 일이 일을 찾았는데 집에서 여가생활을 많이 보내는데
그중에서는 드라마 보는 게 요즘은 또 유일한 낙이라서,그중에서는 드라마 보는 게 요즘은 또 유일한 낙이라서
제가 오늘 주제도 드라마로 선택했구요.,제가 오늘 주제도 드라마로 선택했구요.
그러면은 어~  님은 요즘 최근에,그러면은 어~  님은 요즘 최근에
뭐~ 다 보신 드라마나 보고 계신 드라마 있으신가요?,뭐~ 다 보신 드라마나 보고 계신 드라마 있으신가요?
어~  드라마도 좋아하고 영화도 좋아했는데 쪼금 이제,어~  드라마도 좋아하고 영화도 좋아했는데 쪼금 이제
나이가 들 나이가 저도 얼마 들진 않았지만 한 서른 중반인데,나이가 들 나이가 저도 얼마 들진 않았지만 한 서른 중반인데
초중반인데 드라마가 사실 쪼금 더 영화보다 기간,초중반인데 드라마가 사실 쪼금 더 영화보다 기간
편 수는 많지만은,편 수는 많지만은
그래서 디테일하게 그 관계를 더 정확하게 쫌 해서,그래서 디테일하게 그 관계를 더 정확하게 조금 해서
논리적으로 약간 이해되는 부분들이 좋은 것 같고 영화 같은 경우에 사실은,논리적으로 약간 이해되는 부분들이 좋은 것 같고 영화 같은 경우에 사실은
어~ 여기에 대한 배경이 나오지 않았는데 여기서 약간 쫌 개연성이 떨어진다,어~ 여기에 대한 배경이 나오지 않았는데 여기서 약간 조금 개연성이 떨어진다
이런 부분들이 많아서 영화는  좋은 영화가 아니면 약간 기피하게 되는 부분들이 생겼던 것 같아요.,이런 부분들이 많아서 영화는  좋은 영화가 아니면 약간 기피하게 되는 부분들이 생겼던 것 같아요.
그래서 저도 올해 가장 뽑는다는 저는 부부의 세계를 너무 열심히 봤고,그래서 저도 올해 가장 뽑는다는 저는 부부의 세계를 너무 열심히 봤고
너무 몰입해서 봐서 진짜 폭풍 오열하면서 보고 막,너무 몰입해서 봐서 진짜 폭풍 오열하면서 보고 막
보면서도 막 또 그때 한 오월 오월이랑 겹쳤던 달이어가지고,보면서도 막 또 그때 한 오월 오월이랑 겹쳤던 달이어가지고
막 어버이날 편지 쓰면서도 막,막 어버이날 편지 쓰면서도 막
보고 막 그랬거든요 그래서 너무 몰입해서 봐서,보고 막 그랬거든요 그래서 너무 몰입해서 봐서
사실 부부의 세계 끝나고는 사실은,사실 부부의 세계 끝나고는 사실은
너무 기가 빨려가지고 한동안 드라마에 집중을 쫌 못할 정도,너무 기가 빨려가지고 한동안 드라마에 집중을 조금 못할 정도
그러다가 나의 아저씨는 봐야 된다 다들 그렇게 해서,그러다가 나의 아저씨는 봐야 된다 다들 그렇게 해서
몰아서 한 삼 회 연속으로 봤는데,몰아서 한 삼 회 연속으로 봤는데
같이 우울증까지 올 뻔  너무 우울한 영화였던 것 같애 그래서,같이 우울증까지 올 뻔  너무 우울한 영화였던 것 같애 그래서
마무리까지 못 하고 한 십사 편까지 보다가 너무 우울해서 근데,마무리까지 못 하고 한 십사 편까지 보다가 너무 우울해서 근데
그다음 편부터 왠지 밝아질 것 같긴 한데,그다음 편부터 왠지 밝아질 것 같긴 한데
우울할 때까지 봐가지고 밤에 막 술 먹게 되더라고요 술을 안 먹었었는데,우울할 때까지 봐가지고 밤에 막 술 먹게 되더라고요 술을 안 먹었었는데
그런 정도로 몰입감이 있던 근데 아무래도 정주행을 하면 몰입감이 쫌 더 사는 것 같고,그런 정도로 몰입감이 있던 근데 아무래도 정주행을 하면 몰입감이 조금 더 사는 것 같고
또 동백꽃도 재밌었던 것 같고,또 동백꽃도 재밌었던 것 같고
올해는 약간 그 세 개 정도 봤던 것 같고,올해는 약간 그 세 개 정도 봤던 것 같고
또 요즘에 또 펜트하우스라든지 뭐~ 경이로운 소문,또 요즘에 또 펜트하우스라든지 뭐~ 경이로운 소문
이런 거 사람들 추천하더라고요 혹시 그거는 보셨나요?,이런 거 사람들 추천하더라고요 혹시 그거는 보셨나요?
어~ 아니요 제가 그 두 가지는 못 봤고 요즘,어~ 아니요 제가 그 두 가지는 못 봤고 요즘
그 내용조차 저는 잘 모르고 있는데,그 내용조차 저는 잘 모르고 있는데
경이로운 소문은 약간 퇴마사 내용이 나오는 걸로 알고 있는데,경이로운 소문은 약간 퇴마사 내용이 나오는 걸로 알고 있는데
잘 모르겠구요 그리고 요즘 뭐~,잘 모르겠구요 그리고 요즘 뭐~
핫하게 넷플릭스 안에 뜨는 드라마가 있는데,핫하게 넷플릭스 안에 뜨는 드라마가 있는데
스위트홈 해가지고 이거 제가 정주행으로 다 봤었거든요.,스위트홈 해가지고 이거 제가 정주행으로 다 봤었거든요.
진짜 하루 이틀 만에 본다고 이거,진짜 하루 이틀 만에 본다고 이거
보는 내내 한 연달아서 보니까 정말 폐인이 될 정도로 봤는데,보는 내내 한 연달아서 보니까 정말 폐인이 될 정도로 봤는데
이 처음에는 정말 밑도 끝도 없이 내용이 시작해요 막 괴물 사람이 갑자기 괴물이 되기도 하고,이 처음에는 정말 밑도 끝도 없이 내용이 시작해요 막 괴물 사람이 갑자기 괴물이 되기도 하고
괴물이 되는데 사람을 공격하는 괴물이 있고,괴물이 되는데 사람을 공격하는 괴물이 있고
또 뭐~ 사람을 공격하지 않는 괴물이 있는데 왜 이렇게,또 뭐~ 사람을 공격하지 않는 괴물이 있는데 왜 이렇게
사람들이 자꾸 괴물이 되는지,사람들이 자꾸 괴물이 되는지
그거를 파헤쳐 가면서 여러 가지 사람들과의,그거를 파헤쳐 가면서 여러 가지 사람들과의
그 관계도 풀어져 있구요.,그 관계도 풀어져 있구요.
그런 내용을 다루는데 약간 이 드라마에서,그런 내용을 다루는데 약간 이 드라마에서
전달하려는 메시지가 있는 것 같은데요.,전달하려는 메시지가 있는 것 같은데요.
지금 코로나 사태를 약간 여기서,지금 코로나 사태를 약간 여기서
어~ 비슷한 유형의 그런 바이러스의 사람들이 감염이 됐다고 흘리는 것 같은데 받는 그런 느낌으로는,어~ 비슷한 유형의 그런 바이러스의 사람들이 감염이 됐다고 흘리는 것 같은데 받는 그런 느낌으로는
사람들이 이제 바이러스에 감염이 되고,사람들이 이제 바이러스에 감염이 되고
이게 치료가 되지 않은 상태에서 자꾸,이게 치료가 되지 않은 상태에서 자꾸
어~ 사람들이 이상한 증상이 보이고 그 증상이,어~ 사람들이 이상한 증상이 보이고 그 증상이
치료가 되지 않고 괴물로 이렇게 바뀌는데,치료가 되지 않고 괴물로 이렇게 바뀌는데
이게 만약에 정말 현실로 다가온다면 정말 이거는,이게 만약에 정말 현실로 다가온다면 정말 이거는
너무 어떻게 앞으로 살아가야 될지,너무 어떻게 앞으로 살아가야 될지
쫌 두려움이 생기는 드라마였어요 물론 이게,조금 두려움이 생기는 드라마였어요 물론 이게
드라마 속 소설이지만,드라마 속 소설이지만
충분히 또 다른 형태로 저희 현실에 맞닥뜨릴 수 있는 일이라고,충분히 또 다른 형태로 저희 현실에 맞닥뜨릴 수 있는 일이라고
생각이 들더라고요 스위트홈 이거 혹시 보셨는지,생각이 들더라고요 스위트홈 이거 혹시 보셨는지
되게 지금 되게 유명하거든요 여기 나오는 배우도,되게 지금 되게 유명하거든요 여기 나오는 배우도
신인인데 연기도 진짜 잘하고,신인인데 연기도 진짜 잘하고
그래서 저는 이 드라마를 봤고 따른 거 아까 말씀하신 그 두 가지는,그래서 저는 이 드라마를 봤고 다른 거 아까 말씀하신 그 두 가지는
아직 못 봤어요 제가 그래서 기회가 되면,아직 못 봤어요 제가 그래서 기회가 되면
뭐~ 지금 다른 드라마를 찾고 있는데 이번에 한번,뭐~ 지금 다른 드라마를 찾고 있는데 이번에 한번
그것도 봐야겠네요.,그것도 봐야겠네요.
그럼 아까 말씀하신 그 두 개 드라마는,그럼 아까 말씀하신 그 두 개 드라마는
내용이 어떻게 되는지 궁금하네요.,내용이 어떻게 되는지 궁금하네요.
예 보셨는가요 드라마 두 개를?,예 보셨는가요 드라마 두 개를?
아니요 못 봤습니다 그냥 추천만 받아서 사실 드라마 정주행할려면 약간,아니요 못 봤습니다 그냥 추천만 받아서 사실 드라마 정주행할려면 약간
마음 잡고 근데 또 저는 약간 그렇긴 하더라 코로나 시기 때 드라마 계속 보고 있는 게,마음 잡고 근데 또 저는 약간 그렇긴 하더라 코로나 시기 때 드라마 계속 보고 있는 게
약간 불안하기도 하고 뭐~ 정서적으로 약간 도움이 될 수도 있는데,약간 불안하기도 하고 뭐~ 정서적으로 약간 도움이 될 수도 있는데
뭔가 해야 될 거 해야 해야 되는 일이 있는데 계속 드라마에 약간,뭔가 해야 될 거 해야 해야 되는 일이 있는데 계속 드라마에 약간
빠져 있는 건 아닌가 뭔가 하는 일이라도 제대로 있으면 약간,빠져 있는 건 아닌가 뭔가 하는 일이라도 제대로 있으면 약간
드라마 봐도 약간 위안되면서 힐링하는데 드라마 내가 보고 있다가,드라마 봐도 약간 위안되면서 힐링하는데 드라마 내가 보고 있다가
시간만 킬링하고 있는 건 아닌가 또 발전할 수 있는 일이 있는데 그러면 어떡하지 이런 거 때문에,시간만 킬링하고 있는 건 아닌가 또 발전할 수 있는 일이 있는데 그러면 어떡하지 이런 거 때문에
사실 멀티로 하려고 되게 노력을 하는,사실 멀티로 하려고 되게 노력을 하는
멀티로 하는 버릇이 이어가지고,멀티로 하는 버릇이 이어가지고
웬만한 진짜 몰입력 좋은 드라마가 아니면 쫌,웬만한 진짜 몰입력 좋은 드라마가 아니면 조금
잘 못 보는 것 같아요 진짜 내가,잘 못 보는 것 같아요 진짜 내가
주말에 딴생각 안 하고 혹은 내가 그 일주일 열심히 살았다 싶으면 약간,주말에 딴생각 안 하고 혹은 내가 그 일주일 열심히 살았다 싶으면 약간
약간 보상처럼 금 토 일에 몰빵으로 보긴 하는데,약간 보상처럼 금 토 일에 몰빵으로 보긴 하는데
어~ 약간 요즘은 드라마나 영화를 봐도 약간 스스로 불안해서 못 보겠더라고요.,어~ 약간 요즘은 드라마나 영화를 봐도 약간 스스로 불안해서 못 보겠더라고요.
요즘에는 유튜브나 이런 짤로 많이 보다 보니까,요즘에는 유튜브나 이런 짤로 많이 보다 보니까
집중력도 한 길지 못 한 것 같고 쪼금만,집중력도 한 길지 못 한 것 같고 쪼금만
영상 길이가 길어도,영상 길이가 길어도
제가 몸이 막 찌뿌둥해져가지고 아 빨리 다른 정보가 들어와야 되는데,제가 몸이 막 찌뿌둥해져가지고 아 빨리 다른 정보가 들어와야 되는데
아 그것 때문에 약간 스트레스 쌓이긴 하는데,아 그것 때문에 약간 스트레스 쌓이긴 하는데
그래서 약간 다른 취미를 쫌 가질려고도 하는데,그래서 약간 다른 취미를 조금 가질려고도 하는데
드라마를 근데 보면서도 약간 쫌 더 유익할 수 있는 방법이 뭘까 하다가,드라마를 근데 보면서도 약간 조금 더 유익할 수 있는 방법이 뭘까 하다가
드라마를 기록할까 리뷰를 기록할까 저는 왠지 그냥 보고,드라마를 기록할까 리뷰를 기록할까 저는 왠지 그냥 보고
끝내는 게 아니라 약간 쫌 나누고 싶은 생각이 약간 들더라고요.,끝내는 게 아니라 약간 조금 나누고 싶은 생각이 약간 들더라고요.
원래 영화 보고 나서도 막 영화 어떻게 봤는지 옆에 사람이랑 나누고 싶고 이런데,원래 영화 보고 나서도 막 영화 어떻게 봤는지 옆에 사람이랑 나누고 싶고 이런데
넷플릭스는 그런 평점 기능도 없기도 하고,넷플릭스는 그런 평점 기능도 없기도 하고
어~ 그래서 쪼금 아쉽다고 생각이 약간 들고,어~ 그래서 쪼금 아쉽다고 생각이 약간 들고
저도 경이로운 소문이랑 펜트하우스 뭐~ 이런 거 추천만 받았지 아직,저도 경이로운 소문이랑 펜트하우스 뭐~ 이런 거 추천만 받았지 아직
왠지 펜트하우스도 기 엄청 빨릴 것 같고,왠지 펜트하우스도 기 엄청 빨릴 것 같고
경이로운 소문 같은 경우에는 주변에서 보라고 하긴 하던데,경이로운 소문 같은 경우에는 주변에서 보라고 하긴 하던데
약간 그냥 옆에 스쳐 가듯이 봤는데,약간 그냥 옆에 스쳐 가듯이 봤는데
그 세경인가 세정인가 그 친구 연기가 약간 저는 쫌,그 세경인가 세정인가 그 친구 연기가 약간 저는 조금
불편하더라고요 그래가지고 아직 안 봤는데,불편하더라고요 그래가지고 아직 안 봤는데
아직까지는 땡기진 않아서,아직까지는 땡기진 않아서
어~ 사실 도깨비도 일 화엔 안 땡겼었거든요 근데 이 화부터 재밌어서 봤던 드라마라서,어~ 사실 도깨비도 일 화엔 안 당겼었거든요 근데 이 화부터 재밌어서 봤던 드라마라서
아마 그 꽂히는 부분이 있어야지 약간 가능할 것 같아요.,아마 그 꽂히는 부분이 있어야지 약간 가능할 것 같아요.
그러면 아까 스위트홈 같은 경우에는 저도,그러면 아까 스위트홈 같은 경우에는 저도
어제도 추천받았던 건데 진짜 봐야겠단 생각이 들고,어제도 추천받았던 건데 진짜 봐야겠단 생각이 들고
아까 또 여기 또 추천해 주시는 거 안녕 나의 소울메이트라든지 겨우 서른 이거는 진짜 약간,아까 또 여기 또 추천해 주시는 거 안녕 나의 소울메이트라든지 겨우 서른 이거는 진짜 약간
실용적인 부분에서 이런 건 또 좋아해요 약간 쫌,실용적인 부분에서 이런 건 또 좋아해요 약간 조금
로맨틱하고 약간 로맨스,로맨틱하고 약간 로맨스
그리고 삼십 대 고민을 쫌 나눌 수 있는,그리고 삼십 대 고민을 조금 나눌 수 있는
근데 지금 저는 약간 비혼 생각하고 있는 중이긴 한데,근데 지금 저는 약간 비혼 생각하고 있는 중이긴 한데
주변 친구들 보면 너가 부럽다 뭐~ 이런 식으로 얘기 많이 하더라고요.,주변 친구들 보면 너가 부럽다 뭐~ 이런 식으로 얘기 많이 하더라고요.
내 생각도 내가 부럽긴 한데 남편 돈 벌 받고 아 근데 남편 돈도 받는데,내 생각도 내가 부럽긴 한데 남편 돈 벌 받고 아 근데 남편 돈도 받는데
지도 일을 하고 있더라고요 그래서,자기도 일을 하고 있더라고요 그래서
어~ 뭐지 그런 생각도 많이 하는데,어~ 뭐지 그런 생각도 많이 하는데
그런 얘기를 주변에 다 결혼을 해가지고 저를 완전히 공감해 줄 친구는 별로 없는 것 같고,그런 얘기를 주변에 다 결혼을 해가지고 저를 완전히 공감해 줄 친구는 별로 없는 것 같고
드라마를 보면서 약간 공감을 받아야 되겠다 이런 생각이 약간 드는 것 같아요.,드라마를 보면서 약간 공감을 받아야 되겠다 이런 생각이 약간 드는 것 같아요.
그러면 혹시 지금 보는 건 아니지만 뭐~,그러면 혹시 지금 보는 건 아니지만 뭐~
약간 삶의 영향을 줬다거나,약간 삶의 영향을 줬다거나
혹은 터닝 포인트가 됐다거나 아니면 인생 드라마 같은 게 있으실까요?,혹은 터닝 포인트가 됐다거나 아니면 인생 드라마 같은 게 있으실까요?
아 삶의 영향이랑 터닝 포인트랑은 쫌 거리가 먼데,아 삶의 영향이랑 터닝 포인트랑은 조금 거리가 먼데
제가 가장 감명 깊게 봤던 그런 드라마가 있거든요.,제가 가장 감명 깊게 봤던 그런 드라마가 있거든요.
이것도 아까 말씀드린 스위트홈이랑,이것도 아까 말씀드린 스위트홈이랑
또 말씀하신 도깨비를 감독한 감독 같은 감독님이에요.,또 말씀하신 도깨비를 감독한 감독 같은 감독님이에요.
그~ 미스터 선샤인 드라마구요.,그~ 미스터 선샤인 드라마구요.
이게 몇 년 전에 했던 드라마인데 저는,이게 몇 년 전에 했던 드라마인데 저는
그~ 드라마에 나오는 그~ 인물 모두 모두 다 연기를 너무 잘하셔가지고,그~ 드라마에 나오는 그~ 인물 모두 모두 다 연기를 너무 잘하셔가지고
진짜 감탄을 하면서 봤고 한,진짜 감탄을 하면서 봤고 한
세 번 정도를 볼 정도로,세 번 정도를 볼 정도로
정말 몰입해서 봤던 드라마인데,정말 몰입해서 봤던 드라마인데
이게 볼 때마다 제가 놓쳤던 그런 부분들을 다시,이게 볼 때마다 제가 놓쳤던 그런 부분들을 다시
볼 수 있어가지고 한 세 번 정도 봤었거든요 그리고 그때,볼 수 있어가지고 한 세 번 정도 봤었거든요 그리고 그때
어~ 천구백 년대부터 한 오 년 동안,어~ 천구백 년대부터 한 오 년 동안
개혁  시기에 의병들의 생활을,개혁  시기에 의병들의 생활을
의병들의 그런 모습을 담은 드라마라서,의병들의 그런 모습을 담은 드라마라서
어~ 정말 저희 나라에 그 나라를 빼앗기던 그런 설움을,어~ 정말 저희 나라에 그 나라를 빼앗기던 그런 설움을
생각하면서 드라마를 봤고,생각하면서 드라마를 봤고
음~ 거기에 나오는 또 김태리가,음~ 거기에 나오는 또 김태리가
양반의 그런 말 하자면 거기서 그런 대사가 있는데 복에 겨운 양반은 계집이지만,양반의 그런 말 하자면 거기서 그런 대사가 있는데 복에 겨운 양반은 계집이지만
그 신분의 그 신분 뒤에는 또 의병이라는,그 신분의 그 신분 뒤에는 또 의병이라는
또 자기 또 다른 모습이 있거든요.,또 자기 또 다른 모습이 있거든요.
근데 저는 그 김태리가 그 한 여인의 양반 여인이 아니라,근데 저는 그 김태리가 그 한 여인의 양반 여인이 아니라
어떻게 보면은 김태리 자체가,어떻게 보면은 김태리 자체가
지키고 싶은 조선이라고 저는 그런 생각을 하고 봤었거든요.,지키고 싶은 조선이라고 저는 그런 생각을 하고 봤었거든요.
그래서 김태리 주변에 모든 사람들이 그~,그래서 김태리 주변에 모든 사람들이 그~
김태리를 위해서 또 맞서 싸워주고 하는데,김태리를 위해서 또 맞서 싸워주고 하는데
보면은 결국 끝은 그게 해피엔딩이 아니고 새드엔딩으로  끝나지만은,보면은 결국 끝은 그게 해피엔딩이 아니고 새드엔딩으로  끝나지만은
결국은 어~,결국은 어~
어~ 저희 그니까 조상들이 나라를 지켜냈다 하는 그런 걸,어~ 저희 그러니까 조상들이 나라를 지켜냈다 하는 그런 걸
