사투리,표준어
님도 어~ 기회가 되면 보드 타시는 걸 한 번 추천,님도 어~ 기회가 되면 보드 타시는 걸 한 번 추천
추천하고 싶네 저도 다음에는 가게 되면은 인제 보드는 어느 정도 탈 줄 아니까,추천하고 싶네 저도 다음에는 가게 되면은 인제 보드는 어느 정도 탈 줄 아니까
스키를 한 번 도전해 볼까 싶거든요 친구들 보면 엄청,스키를 한 번 도전해 볼까 싶거든요 친구들 보면 엄청
보드는 인제 발이 묶여 있으니까 어~ 내 마음 몸을 자유자재로 몬 움직이는데,보드는 인제 발이 묶여 있으니까 어~ 내 마음 몸을 자유자재로 못 움직이는데
스키는 발을 자유자재로 쓸 수 있으니까 막 스피드도 내고 막 이러더라고요.,스키는 발을 자유자재로 쓸 수 있으니까 막 스피드도 내고 막 이러더라고요.
그래 가지고 저는 다음에는 아마 스키를 선택하지 않을까 혹시,그래 가지고 저는 다음에는 아마 스키를 선택하지 않을까 혹시
뭐~ 헬스 같은 거는 하시나요?,뭐~ 헬스 같은 거는 하시나요?
헬스 같은 거 하는데 저는,헬스 같은 거 하는데 저는
기구를 쓴다기보단 그냥 맨몸 운동 위주로 운동하는 스타일이라서,기구를 쓴다기보단 그냥 맨몸 운동 위주로 운동하는 스타일이라서
뭐~ 헬스장 가도,뭐~ 헬스장 가도
턱걸이만 하게 돼서 헬스장은 잘  안 가게 되더라고요 그래서 걍 집에,턱걸이만 하게 돼서 헬스장은 잘  안 가게 되더라고요 그래서 그냥 집에
그~ 문틀에 철봉 같은 거 설치해서 집에서 턱걸이 하고,그~ 문틀에 철봉 같은 거 설치해서 집에서 턱걸이 하고
플랭크하고 뭐~ 팔굽혀 펴기하고 이런 맨몸 운동 위주로만,플랭크하고 뭐~ 팔굽혀 펴기하고 이런 맨몸 운동 위주로만
운동해서 헬스,운동해서 헬스
그~ 운동하러 헬스장은 잘 안 가는 거 같애요.,그~ 운동하러 헬스장은 잘 안 가는 거 같애요.
혹시 헬스 헬스 하세요?,혹시 헬스 헬스 하세요?
저도 인제 헬스를,저도 인제 헬스를
고등학교 때 너무 말라 가지고 애들한테 막 멸치다 멸치다 이런 소리 들으니까 기분이 나쁘더라고요.,고등학교 때 너무 말라 가지고 애들한테 막 멸치다 멸치다 이런 소리 들으니까 기분이 나쁘더라고요.
그래서 고등학교에 내랑 같은 멸치 친구인 한 명 데리고 같이 맨날 집에서  했어요.,그래서 고등학교에 나랑 같은 멸치 친구인 한 명 데리고 같이 맨날 집에서  했어요.
그 친구도 자기 집에서 팔굽혀 펴기를 하고 애서,그 친구도 자기 집에서 팔굽혀 펴기를 하고 애서
어~ 누가 누가 몸이 더 빨리 좋아지나 뭐~ 그렇게서부터,어~ 누가 누가 몸이 더 빨리 좋아지나 뭐~ 그렇게서부터
어~ 인제 운동을 접하게 됐는데 인제 본격적으로 한 거는 저는 군대에서거든요.,어~ 인제 운동을 접하게 됐는데 인제 본격적으로 한 거는 저는 군대에서거든요.
군대 가니까 막 몸집도 막 엄청 좋고,군대 가니까 막 몸집도 막 엄청 좋고
트레이너 하다 오신 선임들도 있고 막 그런 분들이 많아 가지고,트레이너 하다 오신 선임들도 있고 막 그런 분들이 많아 가지고
아마 찾아가 가지고 운동 쫌 가르쳐 달라 해 가지고 진짜 배우고 막 진짜 토할 때까지 운동하고 그랬었거든,아마 찾아가 가지고 운동 조금 가르쳐 달라 해 가지고 진짜 배우고 막 진짜 토할 때까지 운동하고 그랬었거든
자비 없이 가르치시더라구요 그래 가지고,자비 없이 가르치시더라구요 그래 가지고
근데 전역하고 나서 그게 인제 맨날 하던 게 습관이 돼 가지고,근데 전역하고 나서 그게 인제 맨날 하던 게 습관이 돼 가지고
사회에 나와서도 헬스장 끊고 다니는데 요즘은,사회에 나와서도 헬스장 끊고 다니는데 요즘은
코로나 때문에 헬스장도 문을 닫고 이라 하니까,코로나 때문에 헬스장도 문을 닫고 이렇게 하니까
운동을 좀 쉰 지가 좀 됐어요 해서 지금 막 너무 하고 싶어 가지고,운동을 좀 쉰 지가 좀 됐어요 해서 지금 막 너무 하고 싶어 가지고
빨리 인제 코로나 일 점 오 단계가 좀 완화가 되면은,빨리 인제 코로나 일 점 오 단계가 좀 완화가 되면은
이제 헬스장을 찾아가서 운동을 할,이제 헬스장을 찾아가서 운동을 할
계획에 있습니다.,계획에 있습니다.
혹시 날에 뭐~ 야구장 이런 데 직관하러 가셨다 하셔는데,혹시 날에 뭐~ 야구장 이런 데 직관하러 가셨다 하셔는데
혹시 기억에 남는 장면이 있을까요?,혹시 기억에 남는 장면이 있을까요?
기억에 남는 장면은,기억에 남는 장면은
딱히 없었던 거 같애요 그냥 어~,딱히 없었던 거 같애요 그냥 어~
그때 워낙 안타 하나 치기고 뭐~ 힘들었던 경기였던 거 같아서,그때 워낙 안타 하나 치기고 뭐~ 힘들었던 경기였던 거 같아서
투수전으로 됐던 거 같아서,투수전으로 됐던 거 같아서
안 그래서 안타 하나 칠 때마다 관객 관중들도 다 환호하고 그랬던 거 같애요.,안 그래서 안타 하나 칠 때마다 관객 관중들도 다 환호하고 그랬던 거 같애요.
그리고 그 경기 결국에는 그 경기 이기고,그리고 그 경기 결국에는 그 경기 이기고
집에 갔던 기억이 있어요.,집에 갔던 기억이 있어요.
혹시 아까 그~ 육상 하셨다고 달리기하셨다고 했는데,혹시 아까 그~ 육상 하셨다고 달리기하셨다고 했는데
달리기 좀 더 빨리,달리기 좀 더 빨리
뛰는 팁 같은 거 있어요?,뛰는 팁 같은 거 있어요?
어~ 저는 단거리 선수가 아니고,어~ 저는 단거리 선수가 아니고
팔백 미터를 뛰는 중장거리 선수여 가지고,팔백 미터를 뛰는 중장거리 선수여 가지고
어~ 빨리 뛴다기보다는 그냥 오래 뛰는 방법을 알고 있습니다.,어~ 빨리 뛴다기보다는 그냥 오래 뛰는 방법을 알고 있습니다.
