사투리,표준어
잘 먹겠습니다가 뭐라고 하는지 아냐.,잘 먹겠습니다가 뭐라고 하는지 아냐.
그래서 내가 이타다끼마스라고 이케 알려줬었거든 내가 딱 기억이 나는 게 이타다끼마스인 거야.,그래서 내가 이타다끼마스라고 이렇게 알려줬었거든 내가 딱 기억이 나는 게 이타다끼마스인 거야.
그래서 그게 잘 먹겠습니다 이렇게 얘기 하고 먹어봐 이래가지고,그래서 그게 잘 먹겠습니다 이렇게 얘기 하고 먹어봐 이래가지고
애기들이 그러고 먹었거든.,애기들이 그러고 먹었거든.
근데 다 먹고 이제 딱 나오니까 딱 생각나는 게 이타다끼마스가 잘 먹 잘 먹었습니다인 거야.,근데 다 먹고 이제 딱 나오니까 딱 생각나는 게 이타다끼마스가 잘 먹 잘 먹었습니다인 거야.
그래서 그 사장님이 이제 왠지 웃더라고.,그래서 그 사장님이 이제 왠지 웃더라고.
내가 본 생각해 보니까 밥 먹기 전에 잘 먹겠습니다 하고 잘 먹었습니다 하고 밥을 먹은 거야.,내가 본 생각해 보니까 밥 먹기 전에 잘 먹겠습니다 하고 잘 먹었습니다 하고 밥을 먹은 거야.
그래서 그런 게 딱 생각이 나 생각이 나더라고 먹을 거 하니까,그래서 그런 게 딱 생각이 나 생각이 나더라고 먹을 거 하니까
먹을 거 일본이 진짜  맛있는 게 많은 거 같애.,먹을 거 일본이 진짜  맛있는 게 많은 거 같애.
한국도 한국은 전라도가 진짜 맛있는 게 많은 거 같고 전라도는 진짜,한국도 한국은 전라도가 진짜 맛있는 게 많은 거 같고 전라도는 진짜
막 진짜 십이 첩 방 반 십이 첨 십이 첩상 뭐 이렇게 해가지고 막,막 진짜 십이 첩 방 반 십이 첨 십이 첩상 뭐 이렇게 해가지고 막
책상 진짜 꽉 차게 막 반찬 나오는데 그런 게 너우 너무 좋았고,책상 진짜 꽉 차게 막 반찬 나오는데 그런 게 너우 너무 좋았고
서울에 갔을 때 또 그때 군대 이제 휴가 복귀 하는 날이었는데,서울에 갔을 때 또 그때 군대 이제 휴가 복귀 하는 날이었는데
누나가 서울에 와서 뭐 먹고 자기랑 놀다 가라 해가지고,누나가 서울에 와서 뭐 먹고 자기랑 놀다 가라 해가지고
근데 누나가 이제 아침에 나는 그~ 기차 타고 올라가고 있는데 누나 아침에,근데 누나가 이제 아침에 나는 그~ 기차 타고 올라가고 있는데 누나 아침에
가서 거기 줄을 서 있었었거든.,가서 거기 줄을 서 있었었거든.
거기 줄이 길어가지고 줄을 서서 먹었는데 뭘 먹었냐면,거기 줄이 길어가지고 줄을 서서 먹었는데 뭘 먹었냐면
핫케이크를 먹었거든.,핫케이크를 먹었거든.
핫케이크 먹었는데 핫케이크가 진짜 포동포동하게 진짜 맛있는 거야.,핫케이크 먹었는데 핫케이크가 진짜 포동포동하게 진짜 맛있는 거야.
핫케이크랑 이제 샐러드랑 먹었는데 샐러드도 완전 그~ 리코타 치즈 이케 올라간 샐러드인데,핫케이크랑 이제 샐러드랑 먹었는데 샐러드도 완전 그~ 리코타 치즈 이렇게 올라간 샐러드인데
나 그때 리코타 치즈를 처음 먹어봤거든.,나 그때 리코타 치즈를 처음 먹어봤거든.
너무 맛있는 거야.,너무 맛있는 거야.
그서 거기는 와 진짜 다음에 한번 더 가고 싶다 라고 생각이,그래서 거기는 와 진짜 다음에 한번 더 가고 싶다 라고 생각이
들었던 서울에서의 유일한 내가 느꼈던 맛집이었고,들었던 서울에서의 유일한 내가 느꼈던 맛집이었고
군대에서도 막 훈련하다가 뭐~ 라면에 별 희한한 거 다 어 다 넣어서 먹고 막 그랬거든.,군대에서도 막 훈련하다가 뭐~ 라면에 별 희한한 거 다 어 다 넣어서 먹고 막 그랬거든.
근데 사골 육수에다가 라면 끓여서 먹으니까 진짜 맛있더라고.,근데 사골 육수에다가 라면 끓여서 먹으니까 진짜 맛있더라고.
그것도 맛있었고 라면 그~ 어~ 그리고 군대에서는 대개 냉동식품,그것도 맛있었고 라면 그~ 어~ 그리고 군대에서는 대개 냉동식품
그런 거 많이 먹었고.,그런 거 많이 먹었고.
전투 식량도 생각보다 되게 맛있었어.,전투 식량도 생각보다 되게 맛있었어.
그리고 나는 스무 살 때 빕스에서 일했던 적이 있는데,그리고 나는 스무 살 때 빕스에서 일했던 적이 있는데
빕스에서 이제 뜨거운 파트를 내가 일을 했거든.,빕스에서 이제 뜨거운 파트를 내가 일을 했거든.
그래서 막 뽂음밥 뽂음면 뭐~ 치킨까지 해가지고,그래서 막 볶음밥 볶음면 뭐~ 치킨까지 해가지고
온갖 뜨거운 거를 내가 다 조리를 했었던 기억이 있는데 그런 거 하면서 먹었던 것도 맛있었어.,온갖 뜨거운 거를 내가 다 조리를 했었던 기억이 있는데 그런 거 하면서 먹었던 것도 맛있었어.
