사투리,표준어
그냥 혹 대화만 할 수 있는 그 영화에 영화 헐을 보면은 대화하는,그냥 혹 대화만 할 수 있는 그 영화에 영화 헐을 보면은 대화하는
그녀가 있잖아요 대화하는 그 혹은 그녀,그녀가 있잖아요 대화하는 그 혹은 그녀
그런 게 만약에 일 인당 한 명씩의 이어폰으로 지급돼서 심심하면 뭐 하,그런 게 만약에 일 인당 한 명씩의 이어폰으로 지급돼서 심심하면 뭐 하
우리 국민들 생활 짊을 생활 삶의 질을 높여 주기 위해서 한 대씩 보급합니다 이러면서 보급을 하시면,우리 국민들 생활 짊을 생활 삶의 질을 높여 주기 위해서 한 대씩 보급합니다 이러면서 보급을 하시면
이용을 하실 건가요.,이용을 하실 건가요.
그리고 만약에 이용하신다면 여자로 이용하실지,그리고 만약에 이용하신다면 여자로 이용하실지
여자로 이용해서 뭐~ 속내를 다 털어낸다던가 그렇게 이용하실지 아니면,여자로 이용해서 뭐~ 속내를 다 털어낸다던가 그렇게 이용하실지 아니면
남자로 이용해서 쫌,남자로 이용해서 조금
로맨틱한 분위기를 영화에 헐에 나온 것처럼 그런 걸을 즐기실지 약간 그런 걸 궁금합니다.,로맨틱한 분위기를 영화에 헐에 나온 것처럼 그런 걸을 즐기실지 약간 그런 걸 궁금합니다.
영화 그 영화 저도 봤는데,영화 그 영화 저도 봤는데
결국에는 끝이 쫌 이상해서,결국에는 끝이 조금 이상해서
저도 그렇게 될까봐,저도 그렇게 될까봐
여자가 낫지 않을까 라고 생각은 했는데,여자가 낫지 않을까 라고 생각은 했는데
아무래도 저는 이성에 목소리를 가진 에이아이가 나을 것 같네요 그래서,아무래도 저는 이성에 목소리를 가진 에이아이가 나을 것 같네요 그래서
쫌 여 같은 여자 목소리면은 아무래도,조금 여 같은 여자 목소리면은 아무래도
쫌 친근감 친구처럼 많이 얘기도 하고,조금 친근감 친구처럼 많이 얘기도 하고
그렇게 할 수 있을 것 같은데,그렇게 할 수 있을 것 같은데
혼자 있는 기분은 여전히 들 것 같애서,혼자 있는 기분은 여전히 들 것 같애서
남자 에이아이 목소리가 쫌 더 나을 것 같은 그런 생각이 들고,남자 에이아이 목소리가 조금 더 나을 것 같은 그런 생각이 들고
근데 사실 얘기만 하는 로봇이라면은,근데 사실 얘기만 하는 로봇이라면은
쫌 필요는 없을 것 같애요 차라리 청소해 주는 게 저한테 더 도움이 되니까,조금 필요는 없을 것 같애요 차라리 청소해 주는 게 저한테 더 도움이 되니까
얘기만 하는 거면 뭐~,얘기만 하는 거면 뭐~
청소하는 게 더 나을 것 같은 그런 생각을 들고,청소하는 게 더 나을 것 같은 그런 생각을 들고
근데 또 그 영화를 봤을 때,근데 또 그 영화를 봤을 때
혼자 있지만 혼자가 아닌 것 같은 기분이 들게,혼자 있지만 혼자가 아닌 것 같은 기분이 들게
해줬던 그런 걸 봐서,해줬던 그런 걸 봐서
굳이 굳이 뽑자면 여자보다는 남자 목소리가 나은 것 같은데,굳이 굳이 뽑자면 여자보다는 남자 목소리가 나은 것 같은데
질문자님은 여자 목 에이아이가 낫겠나요 남자 에이아이가 더 나을 것 같나요?,질문자님은 여자 목 에이아이가 낫겠나요 남자 에이아이가 더 나을 것 같나요?
저는 영화 헐을 봤을 때 그~,저는 영화 헐을 봤을 때 그~
스칼렛 요한슨 목소리인 그녀가,스칼렛 요한슨 목소리인 그녀가
집도 그~ 기분에 맞게 약간,집도 그~ 기분에 맞게 약간
무드 있게 조명을 낮춰주기도 하고,무드 있게 조명을 낮춰주기도 하고
그 기분에 맞게 약간 조절을 해주고,그 기분에 맞게 약간 조절을 해주고
정말 똑똑하고 사람같이 하는 모습에 그 남자가,정말 똑똑하고 사람같이 하는 모습에 그 남자가
인공지능임을 알지만 사랑에 빠졌잖아요.,인공지능임을 알지만 사랑에 빠졌잖아요.
그래서  그녀를 못 본다는 생각에,그래서  그녀를 못 본다는 생각에
되게 슬퍼하는 장면도 나왔었던 걸로 기억하는데,되게 슬퍼하는 장면도 나왔었던 걸로 기억하는데
저는 그거를 느낄 것 같애요 저는 특히 그,저는 그거를 느낄 것 같애요 저는 특히 그
공감력이라고 해야 되나 그런 게 쪼금 높은 편이라서,공감력이라고 해야 되나 그런 게 쪼금 높은 편이라서
정말 사람같이 해주고 나의 기분에 맞춰서 집을 이렇게 조정해주고,정말 사람같이 해주고 나의 기분에 맞춰서 집을 이렇게 조정해주고
필요한 게 있으면 대신 전화해주고 이렇게 하면은 너무 의지가 될 것 같아서,필요한 게 있으면 대신 전화해주고 이렇게 하면은 너무 의지가 될 것 같아서
저는 일단 최대한 미루고,저는 일단 최대한 미루고
사람들이 와 이거 진짜 좋다 이런 후기가 한 팔십 프로 정도 됐을 때 그때,사람들이 와 이거 진짜 좋다 이런 후기가 한 팔십 프로 정도 됐을 때 그때
뒤늦게 사용할 것 같애요.,뒤늦게 사용할 것 같애요.
그때 사용한다면 저는,그때 사용한다면 저는
저도 남자 목소리를 선택할 것 같애요.,저도 남자 목소리를 선택할 것 같애요.
특히 저는 남자를 볼 때 목소리를 정말 중요시 여기는,특히 저는 남자를 볼 때 목소리를 정말 중요시 여기는
그 목소리 하나만으로도 사랑에 빠진 적이 있을 정도로 목소리를 정말,그 목소리 하나만으로도 사랑에 빠진 적이 있을 정도로 목소리를 정말
목소리를 되게 중요시 여기는 편이에요.,목소리를 되게 중요시 여기는 편이에요.
그래서 가수들 보면 얼굴 없는 가수들 목소리 너무 좋아서 얼굴 찾아봤더니 충격 먹고 그런 적도 많거든요.,그래서 가수들 보면 얼굴 없는 가수들 목소리 너무 좋아서 얼굴 찾아봤더니 충격 먹고 그런 적도 많거든요.
전 그래서 정말 목소리가 좋은 에이아이가 나오면 너무 힘들 것 같애요 삶이,전 그래서 정말 목소리가 좋은 에이아이가 나오면 너무 힘들 것 같애요 삶이
특히 얼굴이 없잖아요 얼굴 없는 가수들은 얼굴 먹고 충격먹고 헤,특히 얼굴이 없잖아요 얼굴 없는 가수들은 얼굴 먹고 충격먹고 헤
얼굴 보고 충격 먹고 헤어나올 수라도 있지 에이아이는 얼굴도 없으니까,얼굴 보고 충격 먹고 헤어나올 수라도 있지 에이아이는 얼굴도 없으니까
먹을 충격도 없어서 더 헤어나오기 힘들 것 같애요.,먹을 충격도 없어서 더 헤어나오기 힘들 것 같애요.
그래서 남자 목소리를 사용할 것 같지만,그래서 남자 목소리를 사용할 것 같지만
너무 빠진다 싶으면 저는 그게 그 기회를 단호하게 사용하지 않겠습니다.,너무 빠진다 싶으면 저는 그게 그 기회를 단호하게 사용하지 않겠습니다.
그래서 근데 여자 목소리도 좋긴 할 것 같은데 너무 쫌,그래서 근데 여자 목소리도 좋긴 할 것 같은데 너무 조금
그냥 근데 여자 목소리로 하 여자 목소리로 사용하면 되게,그냥 근데 여자 목소리로 하 여자 목소리로 사용하면 되게
진짜 편하게 그 이 나의 나의 뭐라 해야 되지 반려 기계라고 해야 되나.,진짜 편하게 그 이 나의 나의 뭐라 해야 되지 반려 기계라고 해야 되나.
그렇게 사용할 수 있어서 좋을 것 같긴 한데 그래도 저는,그렇게 사용할 수 있어서 좋을 것 같긴 한데 그래도 저는
만약에 쓴다면 처음에는 남자 목소리를 사용해 볼 것 같아요.,만약에 쓴다면 처음에는 남자 목소리를 사용해 볼 것 같아요.
