사투리,표준어
왜 그~  콤플렉스다 스트레스다라고 하면 아까 말씀하신 것처럼,왜 그~  콤플렉스다 스트레스다라고 하면 아까 말씀하신 것처럼
내 생각에서 좀 많이 오잖아요 내가 생각을 하는 것에서 어떻게 보면,내 생각에서 좀 많이 오잖아요 내가 생각을 하는 것에서 어떻게 보면
쫌 들어온다고 해야 되나요 이제 그런 뭐~ 콤플렉스든 아니면은,조금 들어온다고 해야 되나요 이제 그런 뭐~ 콤플렉스든 아니면은
그~ 어떤 스트레스의 원인이 그러다 보니까 제가 한결같이,그~ 어떤 스트레스의 원인이 그러다 보니까 제가 한결같이
정말 길게 꾸준히 많이 생각을 하게 된 거 저는 뭐였냐면 아~ 이게,정말 길게 꾸준히 많이 생각을 하게 된 거 저는 뭐였냐면 아~ 이게
원인은 다른 데 있는 게 아니라 내 마음에 있었구나 어떻게 보면 저는 지금도,원인은 다른 데 있는 게 아니라 내 마음에 있었구나 어떻게 보면 저는 지금도
이제 회사도 다니면서 프리랜서로 일도 많이 하면서 애기도 보고 약간 이런 상황인데,이제 회사도 다니면서 프리랜서로 일도 많이 하면서 애기도 보고 약간 이런 상황인데
항상 어떤 생각을 하냐면 나하고 싸운다는 느낌 있잖아요.,항상 어떤 생각을 하냐면 나하고 싸운다는 느낌 있잖아요.
나 내가 나 자신하고 어떻게 보면 매일매일 싸우고,나 내가 나 자신하고 어떻게 보면 매일매일 싸우고
나 자신이 항상 어~ 어떤 상태에 있느냐 그게,나 자신이 항상 어~ 어떤 상태에 있느냐 그게
정말 그~ 하루의 컨디션,정말 그~ 하루의 컨디션
그~ 일에 대한 컨디션을 좌지우지하는 걸 정말 많이 느꼈었거든요 근데,그~ 일에 대한 컨디션을 좌지우지하는 걸 정말 많이 느꼈었거든요 근데
이제 저도 주제를 콤플렉스로 잡기는 잡았지만 사실 최근에는,이제 저도 주제를 콤플렉스로 잡기는 잡았지만 사실 최근에는
이제 외모 때문에,이제 외모 때문에
어떤 외적인 부분들 때문에 너무 콤플렉스가  하기도 하고,어떤 외적인 부분들 때문에 너무 콤플렉스가  하기도 하고
다시 생기기도 하고 이래서 저는 이 주제가 어떨까 사실 생각을 했었어요.,다시 생기기도 하고 이래서 저는 이 주제가 어떨까 사실 생각을 했었어요.
근데  님하고 이야기를 나누다 보니까 도리어,근데  님하고 이야기를 나누다 보니까 도리어
어~ 어떻게 하면 내가 이걸 이전에 이겨냈는지,어~ 어떻게 하면 내가 이걸 이전에 이겨냈는지
콤플렉스의 진짜 근본은 어디 있었는지를 생각을 하게 되는 거 같아서 참 좋은 거 같애요 저는,콤플렉스의 진짜 근본은 어디 있었는지를 생각을 하게 되는 거 같아서 참 좋은 거 같애요 저는
님은 어떠세요 약간 최근에 여러 가지 나에게 힘든 걸 줬던 것도 물론,님은 어떠세요 약간 최근에 여러 가지 나에게 힘든 걸 줬던 것도 물론
있지만 어떤 이런 콤플렉스 자체에 대해 생각을 했을 때,있지만 어떤 이런 콤플렉스 자체에 대해 생각을 했을 때
어떤 생각이 좀 많이 드셨어요?,어떤 생각이 좀 많이 드셨어요?
저 같은 경우에도 사실 저희 이렇게 얘기하면서,저 같은 경우에도 사실 저희 이렇게 얘기하면서
어~ 이게 듣는 것도 되게 진짜,어~ 이게 듣는 것도 되게 진짜
어~ 너무 괜찮은 말이다 그거 저도 들어서 너무 좋았구요 이게 또 내가,어~ 너무 괜찮은 말이다 그거 저도 들어서 너무 좋았구요 이게 또 내가
요런 데에 대해서 내 얘기를 또 하니까 약간,요런 데에 대해서 내 얘기를 또 하니까 약간
진짜 상담하는 느낌이 들어서 저,진짜 상담하는 느낌이 들어서 저
되게 지금 좋다라고 생각하고 있었거든요 이까 아까 저희,되게 지금 좋다라고 생각하고 있었거든요 이까 아까 저희
맨 처음에 시작할 때 인제 관리자분이 뭐~ 추임새를 넣거나 인제 하면,맨 처음에 시작할 때 인제 관리자분이 뭐~ 추임새를 넣거나 인제 하면
안 된다고 하셨잖아요 근데 속으로 계속 아~ 맞다 맞다 어~ 진짜다 진짜다 하면서,안 된다고 하셨잖아요 근데 속으로 계속 아~ 맞다 맞다 어~ 진짜다 진짜다 하면서
어~ 막 역시 역시 하면서 저는 계속 그렇게 하면서 인제  님 말 이케 듣고 있었거든요 그래서,어~ 막 역시 역시 하면서 저는 계속 그렇게 하면서 인제  님 말 이렇게 듣고 있었거든요 그래서
진짜  님 말씀하신 대로,진짜  님 말씀하신 대로
이게 내가 자꼬 끍어서 내 스트레스를 만드는 거 같아요.,이게 내가 자꾸 긁어서 내 스트레스를 만드는 거 같아요.
사실 내가 뭐~ 컴플렉스라고 생각하는 것도 남 어떤 사람이 봤었을 때는,사실 내가 뭐~ 컴플렉스라고 생각하는 것도 남 어떤 사람이 봤었을 때는
아~ 그거 진짜 아무것도 아니다라고 진짜 생각을 해서 말씀하시는 사람도 있었었고,아~ 그거 진짜 아무것도 아니다라고 진짜 생각을 해서 말씀하시는 사람도 있었었고
이게 진짜 내가 어떻게 생각하는지에 따라서,이게 진짜 내가 어떻게 생각하는지에 따라서
다른 거 같애요 이게 내가 여기에 진짜 좀 부정적으로 빠져들면은 이게,다른 거 같애요 이게 내가 여기에 진짜 좀 부정적으로 빠져들면은 이게
열등감으로 표출될 수도 있는 거고 좀 모난 성격으로 표출될 수도 있는 거고 근데,열등감으로 표출될 수도 있는 거고 좀 모난 성격으로 표출될 수도 있는 거고 근데
이거를 뭐~ 그래 인정을 하면서 내가 내한테 떳떳하고,이거를 뭐~ 그래 인정을 하면서 내가 나한테 떳떳하고
그냥 내가 그냥 하루하루 열심히 살면은 어쩌라고라는 마인드가 되면서,그냥 내가 그냥 하루하루 열심히 살면은 어쩌라고라는 마인드가 되면서
좀 더 나아갈 수 있는 힘을 쫌 주게,좀 더 나아갈 수 있는 힘을 조금 주게
만드는 거 같애요 뭐~ 어떤 콤플렉스나 스트레스들이 그래서 이거를 좀,만드는 거 같애요 뭐~ 어떤 콤플렉스나 스트레스들이 그래서 이거를 좀
되게 잘 처리한다라고 해야 되나 이게 잘 다루는 사람 보면은,되게 잘 처리한다라고 해야 되나 이게 잘 다루는 사람 보면은
아~ 되게 닮고 싶다라는 생각도 들고,아~ 되게 닮고 싶다라는 생각도 들고
그런 아까 말 저는 인제  님 말씀 들으면서,그런 아까 말 저는 인제  님 말씀 들으면서
그런 생각이 들었었거든요 근데 이게,그런 생각이 들었었거든요 근데 이게
예전에 뭐~ 사람들이 다 그러잖아요 뭐~ 스트레스가 뭐~ 만병의 근원이다 근데 인제,예전에 뭐~ 사람들이 다 그러잖아요 뭐~ 스트레스가 뭐~ 만병의 근원이다 근데 인제
저는 이거를 느꼈었던 게 또,저는 이거를 느꼈었던 게 또
예전 얘기로 가는데 취직 준비할 때 한창 스트레스받았을 때,예전 얘기로 가는데 취직 준비할 때 한창 스트레스받았을 때
몸에 막 염증이란 염증은 다 생겨 가지고 뭐~ 병원을 가면은,몸에 막 염증이란 염증은 다 생겨 가지고 뭐~ 병원을 가면은
병원 그때가 제가 한  세 군데 갔었거든요 그니까 다 다른 부위로 다 그냥,병원 그때가 제가 한  세 군데 갔었거든요 그러니까 다 다른 부위로 다 그냥
어~ 염증이라고 염증이라고 뭐~ 딱히 뭐~ 하시는 거 있냐 아~ 없다 하면은,어~ 염증이라고 염증이라고 뭐~ 딱히 뭐~ 하시는 거 있냐 아~ 없다 하면은
아~ 그러면은 그냥 스트레스성이라고 근데 이게,아~ 그러면은 그냥 스트레스성이라고 근데 이게
가는 데마다 다 스트레스성이라고 하니까,가는 데마다 다 스트레스성이라고 하니까
저는 그때 들었던 생각이 아~ 스트레스가 이렇게 진짜 무서운 거구나 그렇게 생각을 했었거든요?,저는 그때 들었던 생각이 아~ 스트레스가 이렇게 진짜 무서운 거구나 그렇게 생각을 했었거든요?
혹시  님 같은 경우는 이런 스트레스 때문에 약간 좀,혹시  님 같은 경우는 이런 스트레스 때문에 약간 좀
몸이 아프거나 그랬던 적이 있으신가요?,몸이 아프거나 그랬던 적이 있으신가요?
아까 추임새 넣을 뻔했다고 하셨잖아요.,아까 추임새 넣을 뻔했다고 하셨잖아요.
저 계속 추임새 넣을 뻔했어요 계속 근데,저 계속 추임새 넣을 뻔했어요 계속 근데
저 그래서 좀 이따 병원 갈려구요 그~ 몸에 이제 약간 스트레스가 나타나는 거,저 그래서 좀 이따 병원 갈려구요 그~ 몸에 이제 약간 스트레스가 나타나는 거
아~ 제가 요새 그거 많이 나타나거든요 마스크를 쓰잖아요 계속,아~ 제가 요새 그거 많이 나타나거든요 마스크를 쓰잖아요 계속
하루 종일 저 같은 경우에도 쓰고 있는데,하루 종일 저 같은 경우에도 쓰고 있는데
아~ 계속 피부에 뭐가 막 나요 이제,아~ 계속 피부에 뭐가 막 나요 이제
얘기를 하다 보니까 정말 시간 가는 줄 몰랐네요.,얘기를 하다 보니까 정말 시간 가는 줄 몰랐네요.
이제  오랜만에 이렇게 콤플렉스나 극복 방법이나 스트레스에 대해서 이야기를 나누니까 저는,이제  오랜만에 이렇게 콤플렉스나 극복 방법이나 스트레스에 대해서 이야기를 나누니까 저는
어~ 오랜만에 정말 유익했었던 거 같고 즐거운 시간이었어요.,어~ 오랜만에 정말 유익했었던 거 같고 즐거운 시간이었어요.
감사합니다.,감사합니다.
