사투리,표준어
그래서 일단은 에스엔에스를 탈퇴하든지,그래서 일단은 에스엔에스를 탈퇴하든지
일단 묶어도 두고,일단 묶어도 두고
안 보는 방향으로 한 다음에 자기 자신을 쫌,안 보는 방향으로 한 다음에 자기 자신을 조금
다독거려주는 시간이 필요할 것 같습니다 혹시  님 같은 경우는 그러면,다독거려주는 시간이 필요할 것 같습니다 혹시  님 같은 경우는 그러면
인스타그램이나 이런 걸 하면서 다른 사람이 부러웠던 경우나 뭐~ 그런,인스타그램이나 이런 걸 하면서 다른 사람이 부러웠던 경우나 뭐~ 그런
어~ 이런 게 있다니 조금 놀랍다라고 생각했던 경험이 있나요?,어~ 이런 게 있다니 조금 놀랍다라고 생각했던 경험이 있나요?
네 저도 어~ 친구들도 일상을 보면서 쪼끔 한 번씩,네 저도 어~ 친구들도 일상을 보면서 쪼끔 한 번씩
느꼈던 적이 있었던 것 같은데 그것은,느꼈던 적이 있었던 것 같은데 그것은
약간 뒤처진다 느꼈던 것 같아요 저와 같은 경우는,약간 뒤처진다 느꼈던 것 같아요 저와 같은 경우는
어~ 우울증까지 저는,어~ 우울증까지 저는
어~ 아니었던 것 같고 그냥 단지 쫌 어~ 저 친구,어~ 아니었던 것 같고 그냥 단지 조금 어~ 저 친구
예전에는 이랬는데 지금 되게 잘되고 있네.,예전에는 이랬는데 지금 되게 잘되고 있네.
또 벌써 어~ 벌써 결혼을 하네?,또 벌써 어~ 벌써 결혼을 하네?
이런 종류의 이런 느낌만 받았던 것 같고,이런 종류의 이런 느낌만 받았던 것 같고
저는 그런 부분에서 사실 쫌 이해가 안 됐던 부분은,저는 그런 부분에서 사실 조금 이해가 안 됐던 부분은
우울증이 남 인생이고 내 인생은 또 다른데 왜 걸릴까라는 사실 이해를 잘 못해서 한번 여쭤봤었고요.,우울증이 남 인생이고 내 인생은 또 다른데 왜 걸릴까라는 사실 이해를 잘 못해서 한번 여쭤봤었고요.
그리고 제가 겪었던 이야기 중에 쫌,그리고 제가 겪었던 이야기 중에 조금
어~ 인스타그램이나 또 이런 에스엔에스에서,어~ 인스타그램이나 또 이런 에스엔에스에서
디엠이라는 부분에서 쪼끔 안 좋은,디엠이라는 부분에서 쪼끔 안 좋은
상황 사례를 한번 들어본 적이 있습니다.,상황 사례를 한번 들어본 적이 있습니다.
어~ 지인 중에 여자분인데 어~,어~ 지인 중에 여자분인데 어~
자기 일상이랑 얼굴 사진 이런 거를 이제 올리다 보니까,자기 일상이랑 얼굴 사진 이런 거를 이제 올리다 보니까
어~ 디엠으로 이제 뭐~ 성적인,어~ 디엠으로 이제 뭐~ 성적인
대화를 요구하거나 뭐~ 만남을 요구하거나 쫌 그런 류의,대화를 요구하거나 뭐~ 만남을 요구하거나 조금 그런 류의
성희롱 같은 디엠들이 이제 많이 온다고 하더라고요.,성희롱 같은 디엠들이 이제 많이 온다고 하더라고요.
그런 부분이 되게 쫌 어~ 안 좋 안 좋다라고 생각이 쫌 들었고 또 누구나,그런 부분이 되게 조금 어~ 안 좋 안 좋다라고 생각이 조금 들었고 또 누구나
어~ 모르는 사람에게 이제 말을 걸 수 있는 부분에서 어~,어~ 모르는 사람에게 이제 말을 걸 수 있는 부분에서 어~
어떤 부분에선 쫌 참 불쾌할 수도 있겠다라는 생각이 좀 들어서,어떤 부분에선 조금 참 불쾌할 수도 있겠다라는 생각이 좀 들어서
어~ 그 부분이 쪼끔 아쉽긴 했습니다.,어~ 그 부분이 쪼끔 아쉽긴 했습니다.
그래도 뭐~ 차단이라는 기능이 또 있고 하다 보니까 뭐~ 모든 부분에서는 안 좋다고는 볼 수 없는데 그~,그래도 뭐~ 차단이라는 기능이 또 있고 하다 보니까 뭐~ 모든 부분에서는 안 좋다고는 볼 수 없는데 그~
그런 글들을 보내는 그런 사람들이 문제고,그런 글들을 보내는 그런 사람들이 문제고
또 그런 사람들이 걸러내기 힘들구나 어딜 가든,또 그런 사람들이 걸러내기 힘들구나 어딜 가든
그런 생각이 쪼끔 들었던 것 같습니다 어~ 혹시,그런 생각이 쪼끔 들었던 것 같습니다 어~ 혹시
블로그를,블로그를
이제 만드셨다고 했는데 우리 블로그를 만들 때 쪼끔,이제 만드셨다고 했는데 우리 블로그를 만들 때 쪼끔
도움이 될 만한 팁들이 혹시 있을까요?,도움이 될 만한 팁들이 혹시 있을까요?
어~ 먼저 아까 디엠 이야기하셨는데,어~ 먼저 아까 디엠 이야기하셨는데
그 부분에 대해서는 저도 좀 공감하는 바이고,그 부분에 대해서는 저도 좀 공감하는 바이고
그런 거를 막기 위해서는 일단,그런 거를 막기 위해서는 일단
그~ 디지털 성범죄 관련해가지고 법이라던가,그~ 디지털 성범죄 관련해가지고 법이라던가
정책이 빨리 마련돼가지고,정책이 빨리 마련돼가지고
좀 형량을 길게 하거나 엄벌을  방식으로 해가지고 그런,좀 형량을 길게 하거나 엄벌을  방식으로 해가지고 그런
일들이 일어나지 않게끔 이런,일들이 일어나지 않게끔 이런
짓을 했을 경우에 정말 자기가 크게 피해를 본다라는 어~ 인식을 가져가지고,짓을 했을 경우에 정말 자기가 크게 피해를 본다라는 어~ 인식을 가져가지고
어~ 조금 에스엔에스로 건강하게 돌아갔으면 좋겠고요.,어~ 조금 에스엔에스로 건강하게 돌아갔으면 좋겠고요.
블로그 운영할 어~ 만들 때의 팁이라 라고 하면 블로그를,블로그 운영할 어~ 만들 때의 팁이라 라고 하면 블로그를
개인적으로 뭐~,개인적으로 뭐~
그~ 코딩이라고 하나요 그런 걸 많이 이용해서 하실 경우에는 여러 가지,그~ 코딩이라고 하나요 그런 걸 많이 이용해서 하실 경우에는 여러 가지
기능이라던가 지식을 가지고 계셔야겠지만은,기능이라던가 지식을 가지고 계셔야겠지만은
네이버나 티스토리,네이버나 티스토리
이걸로 같은 걸 통해서 블로그를 만드신다면은,이걸로 같은 걸 통해서 블로그를 만드신다면은
솔직히,솔직히
거기서 개설하기만 하면 되니까 뭐 특별하게 기술이라던가 어려운 부분 없이 만들 수 있을 것 같습니다.,거기서 개설하기만 하면 되니까 뭐 특별하게 기술이라던가 어려운 부분 없이 만들 수 있을 것 같습니다.
페이스북이랑 인스타그램 뭐~ 이렇,페이스북이랑 인스타그램 뭐~ 이렇
이 정도를 운영하신다고 하셨는데,이 정도를 운영하신다고 하셨는데
혹시 다른 블로그 말고도 다른 에스엔에스를,혹시 다른 블로그 말고도 다른 에스엔에스를
이용해보실 생각을 가지고 계셨던 적이 있으신가요?,이용해보실 생각을 가지고 계셨던 적이 있으신가요?
어~ 트위트 트위터 계정을 한번,어~ 트위트 트위터 계정을 한번
만들어 본 적은 있었는데요.,만들어 본 적은 있었는데요.
근데 약간 다른 것보다는 쪼끔 사용하는 방법이 좀 어려웠던 것 같습니다.,근데 약간 다른 것보다는 쪼끔 사용하는 방법이 좀 어려웠던 것 같습니다.
그래서 사용하다가 쪼끔,그래서 사용하다가 쪼끔
너무 약간 방대하다 보니까 어~ 접게 되었고요.,너무 약간 방대하다 보니까 어~ 접게 되었고요.
그리고 나머지는 사실 유명한 에스엔에스를 아직,그리고 나머지는 사실 유명한 에스엔에스를 아직
몰라서 이용을 못하고 있는 것 같아요 그리고 페이스북도 최근에 뉴스에서 이제 쫌 안 좋은 사건이 있었던 것 같은데,몰라서 이용을 못하고 있는 것 같아요 그리고 페이스북도 최근에 뉴스에서 이제 조금 안 좋은 사건이 있었던 것 같은데
자세하게 지금 기억은 나지 않지만 그래서 지금,자세하게 지금 기억은 나지 않지만 그래서 지금
들어갔을 때 창이 그렇게 좋지는 않더라고요 그래서 페이스북도 거의 사용 안 한 지 몇 년 된 것 같고,들어갔을 때 창이 그렇게 좋지는 않더라고요 그래서 페이스북도 거의 사용 안 한 지 몇 년 된 것 같고
지금 사용할 할 수 있는 선이 아마 인스타그램밖에 지금 저한테는 없는 것 같아요.,지금 사용할 할 수 있는 선이 아마 인스타그램밖에 지금 저한테는 없는 것 같아요.
혹시 쪼끔 사용하기 쉽 추천해줄 만한 에스엔에스 혹시 있나요?,혹시 쪼끔 사용하기 쉽 추천해줄 만한 에스엔에스 혹시 있나요?
네 저 같은 경우는 인스타그램이,네 저 같은 경우는 인스타그램이
이케 직관적으로 볼 수 있고 짧게 짧게 글을 쓸 수 있으니까 제일 편한 것 같고요.,이렇게 직관적으로 볼 수 있고 짧게 짧게 글을 쓸 수 있으니까 제일 편한 것 같고요.
어~ 계속 이케 제가 쓰고 있는 게 네이버 블로그다 보니까 네이버 블로그 이야기를 드리는데,어~ 계속 이렇게 제가 쓰고 있는 게 네이버 블로그다 보니까 네이버 블로그 이야기를 드리는데
대부분이 약 어~ 지금 네이버가,대부분이 약 어~ 지금 네이버가
포탈 기능적으로 지금 가장 앞선 기업이다 보니까,포탈 기능적으로 지금 가장 앞선 기업이다 보니까
블로그를 하신다면 네이버를 통해서 개설을 한다면 쪼끔 접근성이 좋지 않을까라고 생각이 듭니다.,블로그를 하신다면 네이버를 통해서 개설을 한다면 쪼끔 접근성이 좋지 않을까라고 생각이 듭니다.
