사투리,표준어
어~ 거기 가면 거의 맨날 먹는 게 정해져 있어서 고기랑 탕수육이랑,어~ 거기 가면 거의 맨날 먹는 게 정해져 있어서 고기랑 탕수육이랑
미역국이 맛있어서 미역국이랑,미역국이 맛있어서 미역국이랑
단호박 튀김 뭐~ 이런 식으로 해서 그냥,단호박 튀김 뭐~ 이런 식으로 해서 그냥
간단하게 먹고 나오는 거 같애요 아무래도,간단하게 먹고 나오는 거 같애요 아무래도
끝나고 집에 오면 또 밥 차리기가 귀찮아서,끝나고 집에 오면 또 밥 차리기가 귀찮아서
먹을 수 있으니까 먹고 점심 약속 있을 때는,먹을 수 있으니까 먹고 점심 약속 있을 때는
그냥 안 먹고 약속 가구요.,그냥 안 먹고 약속 가구요.
아까 고소득 알바 얘기하셨는데 갑자기 생각난 게 멘토 멘티 하면은,아까 고소득 알바 얘기하셨는데 갑자기 생각난 게 멘토 멘티 하면은
학교 가서 한 시간 수업하고,학교 가서 한 시간 수업하고
사만 원인가 인제 애들이랑 얘기,사만 원인가 인제 애들이랑 얘기
얘기하면서 그냥 꿈이랑 진로 목표에 대해서 얘기 서로 얘기하고 들어주는,얘기하면서 그냥 꿈이랑 진로 목표에 대해서 얘기 서로 얘기하고 들어주는
알바했었는데 그때,알바했었는데 그때
거의 한 시간보다 쪼끔 덜 하고 사만 원 받았던 거 같애요.,거의 한 시간보다 쪼끔 덜 하고 사만 원 받았던 거 같애요.
혹시 방 탈출하면서 연예인 보신 적 있으세요?,혹시 방 탈출하면서 연예인 보신 적 있으세요?
어~  방 탈출하면서,어~  방 탈출하면서
연예인을 볼 경험은 거의 없죠?,연예인을 볼 경험은 거의 없죠?
서울에서 하면은 그~ 몇 명 몇 분은 좋아하셔서,서울에서 하면은 그~ 몇 명 몇 분은 좋아하셔서
가끔씩 온다고 하시는데 대구에는 제가 일할 때는,가끔씩 온다고 하시는데 대구에는 제가 일할 때는
한 번도 본 적이 없었던 거 같애요 솔직히,한 번도 본 적이 없었던 거 같애요 솔직히
그냥 인생을 따져서,그냥 인생을 따져서
연예인을 봤던 경험도 손에 꼽을 정도니까,연예인을 봤던 경험도 손에 꼽을 정도니까
거의 아~ 거의가 아니고 전혀 없었죠.,거의 아~ 거의가 아니고 전혀 없었죠.
그러면  씨께서는,그러면  씨께서는
이런 질문해주신 거 보니까 알바하면서 보신 적 있으신가요?,이런 질문해주신 거 보니까 알바하면서 보신 적 있으신가요?
네 예전에 대국에서 친구가,네 예전에 대국에서 친구가
만화방에 알바하는데 잠깐만 와 달라고,만화방에 알바하는데 잠깐만 와 달라고
그냥 하루만 쫌 도와달라고 해서 갔었는데 그때,그냥 하루만 조금 도와달라고 해서 갔었는데 그때
김종민 개그맨 김종민이 오셔서 팬 사인회 같은 거 하셨는데 그때 인제 쫌,김종민 개그맨 김종민이 오셔서 팬 사인회 같은 거 하셨는데 그때 인제 조금
옆에서 안내 쫌 해달라고 해서 갔었을 때 한 번 봤었거든요.,옆에서 안내 조금 해달라고 해서 갔었을 때 한 번 봤었거든요.
네 그거 말고는 저도 연예인은 본 적이 없는 거 같애요 아마,네 그거 말고는 저도 연예인은 본 적이 없는 거 같애요 아마
서울에서 일하는 애들은 뭐~ 길 가다가 볼 때도 있고 종종 보긴 보더라구요 아무래도 대구다 보니까,서울에서 일하는 애들은 뭐~ 길 가다가 볼 때도 있고 종종 보긴 보더라구요 아무래도 대구다 보니까
딱히 연예인을,딱히 연예인을
볼 기회는 없는 거 같애요.,볼 기회는 없는 거 같애요.
혹시 연예인 얘기가 나와서,혹시 연예인 얘기가 나와서
보고 싶은 연예인 있으세요?,보고 싶은 연예인 있으세요?
저는 실제로 박보영 한번 보고 싶은데,저는 실제로 박보영 한번 보고 싶은데
기회가 되면 봤으면 엄청 좋죠.,기회가 되면 봤으면 엄청 좋죠.
근데 그럴 일이 없을 거 같아서 아쉽긴한데,근데 그럴 일이 없을 거 같아서 아쉽긴한데
알바를 하시면서 막,알바를 하시면서 막
자기가 컨트롤 안 되거나 이럴 때,자기가 컨트롤 안 되거나 이럴 때
화가 나거나 아니면 쫌 힘들 때 그럴 때 어떻게 마음가짐을 하고 쫌 힐링을 하시나요?,화가 나거나 아니면 조금 힘들 때 그럴 때 어떻게 마음가짐을 하고 조금 힐링을 하시나요?
아무래도 했던 직업이 다 서비스 쪽이라서,아무래도 했던 직업이 다 서비스 쪽이라서
표정 관리도 중요하다고 생각해서 최대한 우선에,표정 관리도 중요하다고 생각해서 최대한 우선에
잘못 있으면  있든 없든 우선은 죄송하다 하는 편이구요.,잘못 있으면  있든 없든 우선은 죄송하다 하는 편이구요.
인제 끝나고 나서 좀 인제 화가 나면은,인제 끝나고 나서 좀 인제 화가 나면은
몸이 떨리고 우는 편이라서,몸이 떨리고 우는 편이라서
그 사람들 앞에서 말고 뒤에서 가끔씩 혼자 울 때도 있구요.,그 사람들 앞에서 말고 뒤에서 가끔씩 혼자 울 때도 있구요.
딱히 그런 일이 종종 있는 건 아니라서 그럴 때는,딱히 그런 일이 종종 있는 건 아니라서 그럴 때는
그냥 인제 매니저한테 얘기하면서 나 그냥 이럴 때 기분 나빴다라고 전달하는 편이에요.,그냥 인제 매니저한테 얘기하면서 나 그냥 이럴 때 기분 나빴다라고 전달하는 편이에요.
