사투리,표준어
님은 최근에 전자기기를 사신 적이 있으신가요?,님은 최근에 전자기기를 사신 적이 있으신가요?
예 저는 그~ 오월달에,예 저는 그~ 오월달에
휴대폰을 새로 바까 바꾸게  됐었는데요.,휴대폰을 새로 바까 바꾸게  됐었는데요.
에스이십 플러스로 이~ 바꾸게 됐어요 저는,에스이십 플러스로 이~ 바꾸게 됐어요 저는
원래 애플 휴대폰을 쓰다가 아이폰을 쓰다가 아이폰 세븐 플러스를 쓰고 있었는데,원래 애플 휴대폰을 쓰다가 아이폰을 쓰다가 아이폰 세븐 플러스를 쓰고 있었는데
뭘로 바꿀지 계속 고민을 하다가 어~ 갤럭시냐 애플이냐 둘 중에,뭘로 바꿀지 계속 고민을 하다가 어~ 갤럭시냐 애플이냐 둘 중에
많이 고민을 했었는데 저는 한번 갤럭시 에스이십 플러스를 들어보고,많이 고민을 했었는데 저는 한번 갤럭시 에스이십 플러스를 들어보고
그 무게가 너무 가벼워서 저는 에스이십 플러스를 선택하게 됐어요.,그 무게가 너무 가벼워서 저는 에스이십 플러스를 선택하게 됐어요.
혹시  님은 전자기기에 대해서 많이 가지시고 있나요?,혹시  님은 전자기기에 대해서 많이 가지시고 있나요?
어~ 저는 잘 아는 건 아니지만,어~ 저는 잘 아는 건 아니지만
저는 최근에 산 게 아이패드 프로 샀거든요.,저는 최근에 산 게 아이패드 프로 샀거든요.
이거는 원래 계속 사고 싶었는데 계속 미루다가 미루다가,이거는 원래 계속 사고 싶었는데 계속 미루다가 미루다가
그냥 우연한 기회로 그냥 갑자기 우연한 기회로 그냥 기회로 그냥 사게 됐어요 근데,그냥 우연한 기회로 그냥 갑자기 우연한 기회로 그냥 기회로 그냥 사게 됐어요 근데
아직 지금 산지 한 이 주 이 주밖에 안 돼서 잘,아직 지금 산지 한 이 주 이 주밖에 안 돼서 잘
엄청 사용하는 거는 아니지만 근데 앞으로 되게 유용하게 쓸 거 같애요 그~,엄청 사용하는 거는 아니지만 근데 앞으로 되게 유용하게 쓸 거 같애요 그~
되게 메모하는 거나 그런,되게 메모하는 거나 그런
뭐~ 다이어리나 그리고 특히 이제 그림 그리는 이런 것들,뭐~ 다이어리나 그리고 특히 이제 그림 그리는 이런 것들
제가 어~ 직업이 디자이너다 보니까,제가 어~ 직업이 디자이너다 보니까
이케 쫌 그림 그리는 거를 쪼금 어~ 아이패드로 그리면 어떨까 생각을 해가지고,이렇게 조금 그림 그리는 거를 쪼금 어~ 아이패드로 그리면 어떨까 생각을 해가지고
쫌 찾아보다가 이제 괜찮은 거 같애서,조금 찾아보다가 이제 괜찮은 거 같애서
쫌 제 취미생활도 충족되고 그리고 일적으로도 사용할 수 있어가지고,조금 제 취미생활도 충족되고 그리고 일적으로도 사용할 수 있어가지고
그런 이유가 이유로도 있지만 또,그런 이유가 이유로도 있지만 또
제가 늘 이제 주변에 친구들이,제가 늘 이제 주변에 친구들이
확실히 제가 디자이너다 보니까 주변에 그림 그리는 애들이나,확실히 제가 디자이너다 보니까 주변에 그림 그리는 애들이나
디자이너들이 많은데 다 그 아이패드를 들고 있었거든요 그래서,디자이너들이 많은데 다 그 아이패드를 들고 있었거든요 그래서
물어보니까 다 괜찮다고 다 막 쓸만 하다고,물어보니까 다 괜찮다고 다 막 쓸만 하다고
그래가지고 그런 친구들 추천도 있었고 저는 이제 쫌,그래가지고 그런 친구들 추천도 있었고 저는 이제 조금
기기를 살 때 뭐~ 확실한 기준을 두고 사는 건 아닌데,기기를 살 때 뭐~ 확실한 기준을 두고 사는 건 아닌데
그래도 어떤 그래도 제 니즈나 쫌 어떤 걸 충족시켜줬을 때,그래도 어떤 그래도 제 니즈나 조금 어떤 걸 충족시켜줬을 때
어~ 그럴 때 사면 좋은 거 같아서,어~ 그럴 때 사면 좋은 거 같아서
그 기기를 구매하게 됐어요.,그 기기를 구매하게 됐어요.
혹시  님은 기기 사실 때 어떤 뭐~ 이유라던가 뭐~,혹시  님은 기기 사실 때 어떤 뭐~ 이유라던가 뭐~
이거는 정말 뭐~ 사고 싶단 이유 뭐~ 이런 게 있으세요?,이거는 정말 뭐~ 사고 싶단 이유 뭐~ 이런 게 있으세요?
일단 말했다시피 저는 원래 아이폰을 사용하게 된 이유가,일단 말했다시피 저는 원래 아이폰을 사용하게 된 이유가
원래 그 카메라 성능이나 뭐~ 디자인 디자인 면에서,원래 그 카메라 성능이나 뭐~ 디자인 디자인 면에서
원래 삼성보다 애플이 훨씬 더 훨씬 더 좋다고 저는 생각을 했기 때문에,원래 삼성보다 애플이 훨씬 더 훨씬 더 좋다고 저는 생각을 했기 때문에
아이폰 한 육이나 칠 정도 나왔을 때,아이폰 한 육이나 칠 정도 나왔을 때
삼성폰 쪽에서는 그렇게 제가 마음에 드는 폰도 없었고,삼성폰 쪽에서는 그렇게 제가 마음에 드는 폰도 없었고
뭐~ 디자인도 확실히 애플이 더 이쁘다라고 생각하였기 때문에,뭐~ 디자인도 확실히 애플이 더 이쁘다라고 생각하였기 때문에
저는 아이폰을 그 때 엄청 관심을 두고 아이폰을 구매하게 됐는데,저는 아이폰을 그 때 엄청 관심을 두고 아이폰을 구매하게 됐는데
이번에는 삼성도 엄청나게 많은 발전을 한 거 같아서,이번에는 삼성도 엄청나게 많은 발전을 한 거 같아서
아이폰이랑 비교를 해 봤을 때 별로 별차이가 없는 거 같았고,아이폰이랑 비교를 해 봤을 때 별로 별차이가 없는 거 같았고
저 지금 제가 폰 산 폰을 보면은 카메라가,저 지금 제가 폰 산 폰을 보면은 카메라가
삼십 배까지 줌이 돼요.,삼십 배까지 줌이 돼요.
그~ 그 정도의 삼십 배까지 줌을 했는데도,그~ 그 정도의 삼십 배까지 줌을 했는데도
화질 면에서는 달리는 부분이 거의 없었고 그래서,화질 면에서는 달리는 부분이 거의 없었고 그래서
성능도 엄청나게 좋아졌 졌다고 생각을 했고,성능도 엄청나게 좋아졌 졌다고 생각을 했고
또한 가장 삼성폰으로 이제 바꾸게 된 이유가 가장 큰 게,또한 가장 삼성폰으로 이제 바꾸게 된 이유가 가장 큰 게
아이폰을 사용하다가 삼성폰을 한 번 들어보니까,아이폰을 사용하다가 삼성폰을 한 번 들어보니까
무게가 엄청나게 가벼운 거예요.,무게가 엄청나게 가벼운 거예요.
그래서 그게 가장 컸지 않나 싶고 또 삼성폰이 또 좋은 점이,그래서 그게 가장 컸지 않나 싶고 또 삼성폰이 또 좋은 점이
삼성페이가 되는 거라고 생각해요 저는,삼성페이가 되는 거라고 생각해요 저는
뭐~ 당연히 애플도 따른 뭐~ 장단점이 있을 건데,뭐~ 당연히 애플도 다른 뭐~ 장단점이 있을 건데
저는 그냥 딱 보고 색깔이나 뭐~ 디자인,저는 그냥 딱 보고 색깔이나 뭐~ 디자인
그런 것들 봤을 때 삼성이 쫌 마음에 들어가지구 삼성 바꾸게 된 거 같애요.,그런 것들 봤을 때 삼성이 조금 마음에 들어가지구 삼성 바꾸게 된 거 같애요.
저도 애플워치나 이제 뭐~ 아이패드 뭐~ 맥북 그런 걸 이제 사고 싶어가지구,저도 애플워치나 이제 뭐~ 아이패드 뭐~ 맥북 그런 걸 이제 사고 싶어가지구
많이 알아보고 있는데 요즘에,많이 알아보고 있는데 요즘에
엄청나게 많이 나오더라구요 아이폰 아이폰 같은 경우도 이제 십이도 벌써 나왔고,엄청나게 많이 나오더라구요 아이폰 아이폰 같은 경우도 이제 십이도 벌써 나왔고
아이패드 에어가 나왔다 나온 걸 보니까 되게 가볍고,아이패드 에어가 나왔다 나온 걸 보니까 되게 가볍고
그~ 엄청 사고 싶다고 느꼈어요 저는,그~ 엄청 사고 싶다고 느꼈어요 저는
그래서 나중에 또 다시 애플로 넘어갈 거 같은 그런 생각이 들기도 해요.,그래서 나중에 또 다시 애플로 넘어갈 거 같은 그런 생각이 들기도 해요.
전 그래서 스마트폰에 대해서 얘기를 해 보고 싶은데,전 그래서 스마트폰에 대해서 얘기를 해 보고 싶은데
스마트폰 저는 제일 처음 스마트폰 쓴 게 저는 제가 생각하기로는,스마트폰 저는 제일 처음 스마트폰 쓴 게 저는 제가 생각하기로는
애니콜을 제일 처음에 쓴 거 같은데,애니콜을 제일 처음에 쓴 거 같은데
그 때에 비해서 지금 내 스마트폰은 엄청나게 많은,그 때에 비해서 지금 내 스마트폰은 엄청나게 많은
발전과 변화가 있었다고 생각해요 왜냐하면 그 때,발전과 변화가 있었다고 생각해요 왜냐하면 그 때
가지고 있던 기능들보다 지금 엄청나게 많은 스마트폰 하나로 그냥,가지고 있던 기능들보다 지금 엄청나게 많은 스마트폰 하나로 그냥
어~ 완전히 없어서는 안 될 그런 존재가 돼버린 거 같고 지금 스마트폰이,어~ 완전히 없어서는 안 될 그런 존재가 돼버린 거 같고 지금 스마트폰이
엄청나게 많은 기능들이 있다고 생각해요.,엄청나게 많은 기능들이 있다고 생각해요.
혹시 뭐~ 옛날에 폰 써보신 적 있으세요 혹시 그러면,혹시 뭐~ 옛날에 폰 써보신 적 있으세요 혹시 그러면
그~ 그 때랑 지금이랑 뭐가 달라졌는지,그~ 그 때랑 지금이랑 뭐가 달라졌는지
한번 말씀해 주실 수 있을까요?,한번 말씀해 주실 수 있을까요?
네 그~ 저는 일단 진짜 제일,네 그~ 저는 일단 진짜 제일
다르다고 생각하는 건 인터넷인 거 같아요.,다르다고 생각하는 건 인터넷인 거 같아요.
어~ 진짜 옛날 저희 진짜,어~ 진짜 옛날 저희 진짜
우리 저희 밀레니엄 세대들은 다 전자기기를 다 느껴봤잖아요.,우리 저희 밀레니엄 세대들은 다 전자기기를 다 느껴봤잖아요.
음~ 통화 그~ 뭐지?,음~ 통화 그~ 뭐지?
애니콜에 그런 폴더폰에서부터 이제 스마트폰 그런 식으로,애니콜에 그런 폴더폰에서부터 이제 스마트폰 그런 식으로
스마트폰으로 이렇게 넘어오면서 그런 전자기기들이,스마트폰으로 이렇게 넘어오면서 그런 전자기기들이
뭔가 발전하는 모습을 다 봤는데 일단,뭔가 발전하는 모습을 다 봤는데 일단
옛날에는 그냥 통화에 통화만 하고,옛날에는 그냥 통화에 통화만 하고
뭐~ 진짜 발전돼서 카메라가 나왔는데,뭐~ 진짜 발전돼서 카메라가 나왔는데
카메라가 나와서 이제 그 카메라도 그냥,카메라가 나와서 이제 그 카메라도 그냥
그냥 셀카 찍고 그냥 그런 찍는 그런 용도 뭐~ 이런 식으로 됐다가,그냥 셀카 찍고 그냥 그런 찍는 그런 용도 뭐~ 이런 식으로 됐다가
요즘 이제 지금 스마트폰이 나오면서 인터넷이 되면서,요즘 이제 지금 스마트폰이 나오면서 인터넷이 되면서
인터넷이 되니까 너무 무한한 발전인 거죠 뭐~,인터넷이 되니까 너무 무한한 발전인 거죠 뭐~
길을 찾는다던가 맛집을 찾는다던가 뭐~,길을 찾는다던가 맛집을 찾는다던가 뭐~
어~ 뭐~ 내가 좋아하는 거를 검색을 할 수 있고,어~ 뭐~ 내가 좋아하는 거를 검색을 할 수 있고
어떤 뭐~ 그러면서 이제 정보도 많이 나오면서 그렇게,어떤 뭐~ 그러면서 이제 정보도 많이 나오면서 그렇게
어~ 스마트폰에 그런 게 많이 반영된 거같은데,어~ 스마트폰에 그런 게 많이 반영된 거같은데
어떤 어~ 어~ 제가 요즘에는 이제 또 폰이 이제,어떤 어~ 어~ 제가 요즘에는 이제 또 폰이 이제
하나의 기능으로만 이제 끝난 이제 전화랑,하나의 기능으로만 이제 끝난 이제 전화랑
뭐~ 그냥 전화 문자 이런 거로만 끝나는 게 아니라 이제 모든,뭐~ 그냥 전화 문자 이런 거로만 끝나는 게 아니라 이제 모든
어~ 영역에서 다 사용할 수 있는 분야가 돼버린 거 같아요.,어~ 영역에서 다 사용할 수 있는 분야가 돼버린 거 같아요.
뭐~ 진짜 제가 아까 말씀드린 것처럼 뭐~ 뭐~ 맛집이나,뭐~ 진짜 제가 아까 말씀드린 것처럼 뭐~ 뭐~ 맛집이나
뭐~ 내비게이션이나 뭐~ 어떤 내가 찾는 뭐~ 그런 정보들이나 이런 것들이,뭐~ 내비게이션이나 뭐~ 어떤 내가 찾는 뭐~ 그런 정보들이나 이런 것들이
다 모이면서 뭐~ 네 카메라 같은 경우에도,다 모이면서 뭐~ 네 카메라 같은 경우에도
지금 너무 많이 어~ 진짜 카메라 자체가 나온 것처럼 돼버린 거?,지금 너무 많이 어~ 진짜 카메라 자체가 나온 것처럼 돼버린 거?
요즘에 막 좋은 카메라들도 많지만 폰 하나가 좋은 폰 하나 가지고 있는 게,요즘에 막 좋은 카메라들도 많지만 폰 하나가 좋은 폰 하나 가지고 있는 게
더 더 생활력이나 그런 게 편의성이 엄청 강해져버렸잖아요.,더 더 생활력이나 그런 게 편의성이 엄청 강해져버렸잖아요.
뭐~ 요즘에는 뭐~ 유튜브도 많이 찍고 그러는데 유튜브 보면 뭐지?,뭐~ 요즘에는 뭐~ 유튜브도 많이 찍고 그러는데 유튜브 보면 뭐지?
뭐~ 카메라도 보면 그냥 폰으로 다 찍고 해도,뭐~ 카메라도 보면 그냥 폰으로 다 찍고 해도
이상하지 않고 화질이 막 너무 구려서 못 본다 막 이런 게 아니고,이상하지 않고 화질이 막 너무 구려서 못 본다 막 이런 게 아니고
다 그런 식으로 사용할 수 있으니까 그게 정말,다 그런 식으로 사용할 수 있으니까 그게 정말
많은 걸 이제 할 수 있는 요소로 이렇게 된 거 같아요.,많은 걸 이제 할 수 있는 요소로 이렇게 된 거 같아요.
만일  씨는 그러면 일단 저희가  스마트폰 이제 그냥,만일  씨는 그러면 일단 저희가  스마트폰 이제 그냥
투지에서 이제 지금 파이브지까지 오게 됐는데,투지에서 이제 지금 파이브지까지 오게 됐는데
뭐~ 그런 차이라던지 뭐~,뭐~ 그런 차이라던지 뭐~
어떠한 내가 생각했던 폰에 대한 생각했던 거라던지 이런 게 있을까요?,어떠한 내가 생각했던 폰에 대한 생각했던 거라던지 이런 게 있을까요?
네 저는 지금 폰을 파이브지를 쓰고 있긴 한데,네 저는 지금 폰을 파이브지를 쓰고 있긴 한데
저희가  제가 지금 사는 데는 약간 파이브지는 잘,저희가  제가 지금 사는 데는 약간 파이브지는 잘
통신이 잘 안 되는 그런 지역이 있는 거 같애요 그래서,통신이 잘 안 되는 그런 지역이 있는 거 같애요 그래서
파이브지보다는 포지나  엘티이를 많이 쓰고 있는데,파이브지보다는 포지나  엘티이를 많이 쓰고 있는데
뭐~ 쓰리지랑 비교를 한다면 진짜 저는,뭐~ 쓰리지랑 비교를 한다면 진짜 저는
지금 데이터가 어떤 식이냐면 포지 데이터를 다 쓰고,지금 데이터가 어떤 식이냐면 포지 데이터를 다 쓰고
어~ 어느 용량만큼 다 쓰고 그거를 다 쓰면,어~ 어느 용량만큼 다 쓰고 그거를 다 쓰면
이제 쓰리지 속도가 느려지면서 무제한이 되는 그런 방식으로 하 데이트를 사용하고 있는데,이제 쓰리지 속도가 느려지면서 무제한이 되는 그런 방식으로 하 데이트를 사용하고 있는데
저는 포지를 사용하다가 쓰리지로 사용하면 진짜 엄청,저는 포지를 사용하다가 쓰리지로 사용하면 진짜 엄청
엄청 속도가 느려져가지고 답답한 경험이 쫌 많이 있어요.,엄청 속도가 느려져가지고 답답한 경험이 조금 많이 있어요.
그래서 일단 쓰리지에서 포지로 넘어오는 게 진짜 되게 잘한 되게 존 좋은 점인 거 같고,그래서 일단 쓰리지에서 포지로 넘어오는 게 진짜 되게 잘한 되게 존 좋은 점인 거 같고
제가 쓰리지였을 때는 어떻게 폰을 썼는지,제가 쓰리지였을 때는 어떻게 폰을 썼는지
쫌 신기할 정도로 지금 생각해 보면 쫌 그랬던 거 같애요 흠,조금 신기할 정도로 지금 생각해 보면 조금 그랬던 거 같애요 흠
제가 학교가 마이스터 고등학교인데요.,제가 학교가 마이스터 고등학교인데요.
마이스터 고등학교는 그~ 기숙사 학교면서 약간 실습을 위주로 하는 학교입니다.,마이스터 고등학교는 그~ 기숙사 학교면서 약간 실습을 위주로 하는 학교입니다.
실습을 위주로 하다 보니까 저희는 전자기기를 많이 다루게 되는 그런,실습을 위주로 하다 보니까 저희는 전자기기를 많이 다루게 되는 그런
전기시스템 제어과라고 전자기기를 쫌 많이 다루는 과에 속해 있는데요.,전기시스템 제어과라고 전자기기를 조금 많이 다루는 과에 속해 있는데요.
저는 그래서 컴퓨터를 사용해서 되게 많은 프로그램을 짜고,저는 그래서 컴퓨터를 사용해서 되게 많은 프로그램을 짜고
작품을 만들어 내고 뭐~ 물건을 옮기고 뭐~ 모든 것들을 다 컴퓨터로,작품을 만들어 내고 뭐~ 물건을 옮기고 뭐~ 모든 것들을 다 컴퓨터로
자동화시키는 그런 실습을 많이 해요.,자동화시키는 그런 실습을 많이 해요.
그럴 때만 보면은 딱 제가 실습을 할 때는 그냥 아무렇지도 않게,그럴 때만 보면은 딱 제가 실습을 할 때는 그냥 아무렇지도 않게
다 이거 누르면 이렇게 된다 이렇게 다 알고 있는데,다 이거 누르면 이렇게 된다 이렇게 다 알고 있는데
그것도 지금 다시 생각해 본다면 되게 신기한 거 같애요 왜냐면,그것도 지금 다시 생각해 본다면 되게 신기한 거 같애요 왜냐면
그 프로그램을 만든 아~ 만든 사람도 그렇지만,그 프로그램을 만든 아~ 만든 사람도 그렇지만
일단 그런 기기가 있 그런 프로그램을 짤 수 있고,일단 그런 기기가 있 그런 프로그램을 짤 수 있고
동작시킬 수 있는 그런 컴퓨터나 전자기기들이,동작시킬 수 있는 그런 컴퓨터나 전자기기들이
있었기 때문에 이런 걸 다 할 수 있었으니까,있었기 때문에 이런 걸 다 할 수 있었으니까
저는 그것 때문에 신기하다 생각해요 또,저는 그것 때문에 신기하다 생각해요 또
주변에 보면은 전자기기가 되게 많잖아요 뭐~,주변에 보면은 전자기기가 되게 많잖아요 뭐~
대부분 일단 거의 없어서는 안 될 정도로,대부분 일단 거의 없어서는 안 될 정도로
많은 영향을 우리한테 주고 있는 거 같고,많은 영향을 우리한테 주고 있는 거 같고
제가 이번에 면접 아~ 회사에 면접을 준비해서 면접을 보는 회사가 있는데 그 회사도,제가 이번에 면접 아~ 회사에 면접을 준비해서 면접을 보는 회사가 있는데 그 회사도
전자제품 전자기기에 관한 그런 회사라서,전자제품 전자기기에 관한 그런 회사라서
그거에 대해서 공부를 되게 많이 했어요.,그거에 대해서 공부를 되게 많이 했어요.
그러다 보니까 되게 전자기기를 되게 신기해 하고,그러다 보니까 되게 전자기기를 되게 신기해 하고
관심있 관심있는 분야가 된 거 같애요.,관심있 관심있는 분야가 된 거 같애요.
저는 이제 그~ 무선 이어폰에 대해서 얘기를 해 보고 싶은데,저는 이제 그~ 무선 이어폰에 대해서 얘기를 해 보고 싶은데
저는 애플 삼성  버즈 버즈나 에어팟,저는 애플 삼성  버즈 버즈나 에어팟
에어팟 프로 그런 것들을 다 사용을 해 봤는데요.,에어팟 프로 그런 것들을 다 사용을 해 봤는데요.
이번에 버즈라이브는 안 써봤는데,이번에 버즈라이브는 안 써봤는데
어떤 무선 이어폰이 되게 저는 신기하다고 느낀 게,어떤 무선 이어폰이 되게 저는 신기하다고 느낀 게
원래 그냥 제일 처음에 나오기 전에는 이런 블루투스라는 그런 게 있었는데,원래 그냥 제일 처음에 나오기 전에는 이런 블루투스라는 그런 게 있었는데
그런 걸 끼고 다니는 사람들을 보면 약간 쫌,그런 걸 끼고 다니는 사람들을 보면 약간 조금
아~ 저 사람 저거 귀에 왜 꽂고 다니지 쫌 이상한데 약간 그런 생각이 들었었는데,아~ 저 사람 저거 귀에 왜 꽂고 다니지 조금 이상한데 약간 그런 생각이 들었었는데
어느 순간부터 사람들이 에어팟 일 세대를 다 끼고 다니면서 이제,어느 순간부터 사람들이 에어팟 일 세대를 다 끼고 다니면서 이제
저~ 대부분의 어린 사람들 거의 십 대,저~ 대부분의 어린 사람들 거의 십 대
이 십 대 이십 대는 무조건 거의 다 사용하고 있는 그런 제품이 된 거 같애요.,이 십 대 이십 대는 무조건 거의 다 사용하고 있는 그런 제품이 된 거 같애요.
그랬을 때 저는 되게 신기하고 좀 놀랐고,그랬을 때 저는 되게 신기하고 좀 놀랐고
또 이제 그거를 그 제품을 따라해서 따른 회사나 뭐~,또 이제 그거를 그 제품을 따라해서 다른 회사나 뭐~
약간 가짜로 만들어진 뭐~ 비슷하게 만든,약간 가짜로 만들어진 뭐~ 비슷하게 만든
그런 제품들이 많이 나오고 있다는 거에 되게 신기하다고 느꼈어요.,그런 제품들이 많이 나오고 있다는 거에 되게 신기하다고 느꼈어요.
혹시  님은 무선 이어폰을 사용해 본 적 있나요?,혹시  님은 무선 이어폰을 사용해 본 적 있나요?
만약 해 봤으면은 어떤 걸 사용해 봤고 쫌 그거를 사용하면서,만약 해 봤으면은 어떤 걸 사용해 봤고 조금 그거를 사용하면서
쫌 신기하거나 그랬던 경험이 있나요?,조금 신기하거나 그랬던 경험이 있나요?
저는 네 저도,저는 네 저도
아이폰 무선 아이 뭐~ 무선 이어 에어팟 에어팟이 나왔을 때,아이폰 무선 아이 뭐~ 무선 이어 에어팟 에어팟이 나왔을 때
에어팟이 나왔을 때 관심이 없었거든요.,에어팟이 나왔을 때 관심이 없었거든요.
왜 돈을 그게 되게 비쌌잖아요 처음에 나왔을 때 한,왜 돈을 그게 되게 비쌌잖아요 처음에 나왔을 때 한
근데 이어폰이라는 건 우리 그냥 그 때 당시 나왔을 때는,근데 이어폰이라는 건 우리 그냥 그 때 당시 나왔을 때는
저희 한 일이만 원이면 살 수 있는 그런 건데,저희 한 일이만 원이면 살 수 있는 그런 건데
이게 나오면서 그게 몇십만 원이라고 막 해가지구 그거에 되게 놀랬고,이게 나오면서 그게 몇십만 원이라고 막 해가지구 그거에 되게 놀랬고
그래서 그거를 그게 근데 줄이 없어졌다고,그래서 그거를 그게 근데 줄이 없어졌다고
그게 그렇게 편해질까 이 생각을 했었단 말이에요.,그게 그렇게 편해질까 이 생각을 했었단 말이에요.
그래서 저는 관심을 안 가지다가 제가 서울에서 출퇴근을 하다 보니까,그래서 저는 관심을 안 가지다가 제가 서울에서 출퇴근을 하다 보니까
줄 그~ 아침에 지하철을 타야 되는데 그~ 서울은 진짜,줄 그~ 아침에 지하철을 타야 되는데 그~ 서울은 진짜
지옥철이라고도 하잖아요.,지옥철이라고도 하잖아요.
진짜 사람이 너무 많아서 진짜 그냥 끼어있는 수준인데,진짜 사람이 너무 많아서 진짜 그냥 끼어있는 수준인데
근데 제가 한 번은 이제 이어폰을 끼고 이제,근데 제가 한 번은 이제 이어폰을 끼고 이제
노래를 듣고 있는데 그게 어떤 앞사람의 가방 끈에 걸려가지고 그게,노래를 듣고 있는데 그게 어떤 앞사람의 가방 끈에 걸려가지고 그게
제 이어폰이 빠지면서 그 줄이 끊어져 버린 거예요.,제 이어폰이 빠지면서 그 줄이 끊어져 버린 거예요.
제가 그거에 너무 충격 먹고,제가 그거에 너무 충격 먹고
그리고 그~ 원래 근데 한 번씩은 이렇게 걸린 적은 있었거든요 그냥 그~ 걸려도 그냥 한 번 빼고 막 이렇게 했었는데,그리고 그~ 원래 근데 한 번씩은 이렇게 걸린 적은 있었거든요 그냥 그~ 걸려도 그냥 한 번 빼고 막 이렇게 했었는데
제가 그걸 딱 보면서 아~ 이게 무 이래서 무선 이어폰을,제가 그걸 딱 보면서 아~ 이게 무 이래서 무선 이어폰을
쓰나 생각해서 제가 그 때 막 에어팟 투가 나온 시점이었었거든요 그래서 그 때 딱,쓰나 생각해서 제가 그 때 막 에어팟 투가 나온 시점이었었거든요 그래서 그 때 딱
샀어요 저는 바로,샀어요 저는 바로
진짜 그~ 그런 경험을 한 번 겪고 나니까,진짜 그~ 그런 경험을 한 번 겪고 나니까
근데 제가 앞서 말한 것처럼 저는 왜,근데 제가 앞서 말한 것처럼 저는 왜
