사투리,표준어
원래 이런 남자다 보니까 그런 일상 공유하는 이런 부분들이 좀 별로 어색하다 보니까,원래 이런 남자다 보니까 그런 일상 공유하는 이런 부분들이 좀 별로 어색하다 보니까
거의 에스엔에스는 주로 안 하는 편이었는데 올해,거의 에스엔에스는 주로 안 하는 편이었는데 올해
어~ 친구들도 많이 하고 또 요즘에 핫하다고 해서 시작하게 되었는데요.,어~ 친구들도 많이 하고 또 요즘에 핫하다고 해서 시작하게 되었는데요.
나름 이제 친구들 일상도 알 수 있고 또,나름 이제 친구들 일상도 알 수 있고 또
거기서 광고 같은 것들이 어~ 요즘에는,거기서 광고 같은 것들이 어~ 요즘에는
컴퓨터 알고리즘이 참 잘돼 있어서 그런지 필요한 그런,컴퓨터 알고리즘이 참 잘돼 있어서 그런지 필요한 그런
물품이나 아니면 또 정보들 되게 공유가 많이 돼서 유용하게 쓰고 있는 상태입니다.,물품이나 아니면 또 정보들 되게 공유가 많이 돼서 유용하게 쓰고 있는 상태입니다.
그리고 한 번씩 종종 또 좋은 글귀나 또,그리고 한 번씩 종종 또 좋은 글귀나 또
그런 책 같은 부분들도 좋아하는데 그런 거 팔로우  해놨다 보니까,그런 책 같은 부분들도 좋아하는데 그런 거 팔로우  해놨다 보니까
한 번씩 한 번씩 그~ 좋은 글이,한 번씩 한 번씩 그~ 좋은 글이
그~ 작가님이 올려주실 때마다 이제 볼 수 있어서 그런 점이 되게 유용하고 좋다고 생각이 들어서,그~ 작가님이 올려주실 때마다 이제 볼 수 있어서 그런 점이 되게 유용하고 좋다고 생각이 들어서
최근에는 좀 활발하게 어~ 쓰고 있습니다.,최근에는 좀 활발하게 어~ 쓰고 있습니다.
혹시 그러면  님은 어~ 주로 이~ 에스엔에스 시작하게 된 계기가 어떻게 되시나요?,혹시 그러면  님은 어~ 주로 이~ 에스엔에스 시작하게 된 계기가 어떻게 되시나요?
저 같은 경우는 음~ 싸이월드랑 페이스북도 이용을 했지만은 싸이월드 같은 경우에는 저희,저 같은 경우는 음~ 싸이월드랑 페이스북도 이용을 했지만은 싸이월드 같은 경우에는 저희
제가 고등학교 때 많이 유행을 했었거든요.,제가 고등학교 때 많이 유행을 했었거든요.
그래서 그때는 스마트폰이 많이 사용하지 않던 시기라서,그래서 그때는 스마트폰이 많이 사용하지 않던 시기라서
거의 메시지를 디엠 보내듯이 그냥 문자 보내듯이 싸이월드로 많이 주고받았었어요.,거의 메시지를 디엠 보내듯이 그냥 문자 보내듯이 싸이월드로 많이 주고받았었어요.
그래서 저희 집에 가고 나면 또 컴퓨터를 켜가지고 싸이월드를 하고 했었고,그래서 저희 집에 가고 나면 또 컴퓨터를 켜가지고 싸이월드를 하고 했었고
페이스북 같은 경우는,페이스북 같은 경우는
국내 이용자도 많은지는 모르겠지만 제가 체감할 때는,국내 이용자도 많은지는 모르겠지만 제가 체감할 때는
국내보다 해외에서 사용하는 분들이 많더라고요 제가 어학연수로 필리핀에 갔을 때,국내보다 해외에서 사용하는 분들이 많더라고요 제가 어학연수로 필리핀에 갔을 때
그~ 친구들이 거의 다 페이스북을 쓰고 있어가지고,그~ 친구들이 거의 다 페이스북을 쓰고 있어가지고
친구들이랑 교류하기 위해서 페이스북을 시작을 했었고요.,친구들이랑 교류하기 위해서 페이스북을 시작을 했었고요.
블로그 같은 경우에는 제가 이제 대학생이 되면서,블로그 같은 경우에는 제가 이제 대학생이 되면서
이런저런 글을 쓰고 싶을 때가 많았는데,이런저런 글을 쓰고 싶을 때가 많았는데
예 다이어리나 일기로 쓰다 보니까 쪼끔 어~,예 다이어리나 일기로 쓰다 보니까 쪼끔 어~
그게 언제 어디서나 쓸 수 있는,그게 언제 어디서나 쓸 수 있는
이~ 것도 있지만은 그렇게 할려면 책을 또 다니고 다녀야 되잖아요 그래가지고 그렇게 하기 싫어가지고,이~ 것도 있지만은 그렇게 할려면 책을 또 다니고 다녀야 되잖아요 그래가지고 그렇게 하기 싫어가지고
이제 전자상에,이제 전자상에
인터넷상에 기록을 하기 시작하면서 블로그를 했어요.,인터넷상에 기록을 하기 시작하면서 블로그를 했어요.
트위터 같은 경우는 저는 이제 좋아하는 가수가 있어가지고 그런 가수들의 정보라던가,트위터 같은 경우는 저는 이제 좋아하는 가수가 있어가지고 그런 가수들의 정보라던가
어~ 사진이라던가 움짤 이런 거는 트위터가 되게 빨리 뜨더라고요 제가 대학생 때는 또,어~ 사진이라던가 움짤 이런 거는 트위터가 되게 빨리 뜨더라고요 제가 대학생 때는 또
개인 홈페이지를 이용해서 그런 걸 다 봤었는데,개인 홈페이지를 이용해서 그런 걸 다 봤었는데
이제 그 흐름이 개인 홈페이지가 없어지고 그 모든 사람들이 트위터로 몰리는,이제 그 흐름이 개인 홈페이지가 없어지고 그 모든 사람들이 트위터로 몰리는
추세가 되어가지고 저도 트위터를 가입해서 이용하고 있습니다 인스타그램 같은 경우는 저도,추세가 되어가지고 저도 트위터를 가입해서 이용하고 있습니다 인스타그램 같은 경우는 저도
그냥 제가 여행 갔을 때 아니면 어~ 음식 사진,그냥 제가 여행 갔을 때 아니면 어~ 음식 사진
뭐 이런 거를 주로 올리고 있는데 그냥 인스타는 제가 사진 올리고 뭐~ 다른 사람들 걸 잘 보지는 않아요.,뭐 이런 거를 주로 올리고 있는데 그냥 인스타는 제가 사진 올리고 뭐~ 다른 사람들 걸 잘 보지는 않아요.
그런데 제가 전시회를 관람을 하러 간 적이 있었는데,그런데 제가 전시회를 관람을 하러 간 적이 있었는데
저는 이제 정가를 다 이케 홈페이지를 미리 보고,저는 이제 정가를 다 이렇게 홈페이지를 미리 보고
정보를 할인 할인할 수 있는 정보 뭐~ 오픈하는 정보 이런 걸 다 보고 갔음에도,정보를 할인 할인할 수 있는 정보 뭐~ 오픈하는 정보 이런 걸 다 보고 갔음에도
정보가 없어서 정가를 주로 봤는데 그 할인 정보를 인스타그램에만 그~ 전시회 사이트에서 올렸더라고요.,정보가 없어서 정가를 주로 봤는데 그 할인 정보를 인스타그램에만 그~ 전시회 사이트에서 올렸더라고요.
그래서 그 인스타를 보고 간 사람들은 그때 천 원 이천 원으로 그~,그래서 그 인스타를 보고 간 사람들은 그때 천 원 이천 원으로 그~
전시를 봤었는데 저는 거의 이만 원을 투자를 해서 봤거든요 그런 이후로,전시를 봤었는데 저는 거의 이만 원을 투자를 해서 봤거든요 그런 이후로
각종 약간 핫하다고 예 여겨지는 가게라던가,각종 약간 핫하다고 예 여겨지는 가게라던가
전시회 같은 경우에 정보가 인스타그램에서만 이케 공유되는 것들을 보고 인스타도,전시회 같은 경우에 정보가 인스타그램에서만 이렇게 공유되는 것들을 보고 인스타도
그~ 하고 있고 제가 어디 공연을 가거나,그~ 하고 있고 제가 어디 공연을 가거나
전시를 보게 될 일이 있으면 한 번씩 꼭 검색을 해서,전시를 보게 될 일이 있으면 한 번씩 꼭 검색을 해서
찾아보고 가고 있습니다.,찾아보고 가고 있습니다.
혹시  님은 인스타그램에서 일상 공유나  보는 거 말고,혹시  님은 인스타그램에서 일상 공유나  보는 거 말고
뭐 다른 어~ 정보를 얻기 위해서 하는 것들이 혹시 활동이 있나요?,뭐 다른 어~ 정보를 얻기 위해서 하는 것들이 혹시 활동이 있나요?
네 저도 제 거를 올릴 때는 거의 저는 일상보다는,네 저도 제 거를 올릴 때는 거의 저는 일상보다는
제가 최근에 이제 진로를,제가 최근에 이제 진로를
어~ 직장을 다니다가 바꾸게 되어서 이제 목수 쪽으로 제가,어~ 직장을 다니다가 바꾸게 되어서 이제 목수 쪽으로 제가
하고 싶었던 길로 전향을 했거든요.,하고 싶었던 길로 전향을 했거든요.
그래서 지금 배우고 있는 그~ 가구 만드는,그래서 지금 배우고 있는 그~ 가구 만드는
이런 부분들 하나씩 하나씩 찍어서 올리고 있고,이런 부분들 하나씩 하나씩 찍어서 올리고 있고
또 나중에 이제 선생님이나 이렇게 물어보니까,또 나중에 이제 선생님이나 이렇게 물어보니까
홍보나 또 이렇게 지인들에게 알릴 때 인스타그램이 되게 유용하다고 쫌 많이 들어서,홍보나 또 이렇게 지인들에게 알릴 때 인스타그램이 되게 유용하다고 조금 많이 들어서
어~ 이 부분을 활용해서 저도 지금은 배우는 단계라서,어~ 이 부분을 활용해서 저도 지금은 배우는 단계라서
이런 부분들 홍 그냥 보여주고 나중에는,이런 부분들 홍 그냥 보여주고 나중에는
어~ 제가 작품 만든 거나 이런 전시회 만약에 열게 되면,어~ 제가 작품 만든 거나 이런 전시회 만약에 열게 되면
이걸 통해서 쫌 홍보를 많이 해볼까라는 생각으로,이걸 통해서 조금 홍보를 많이 해볼까라는 생각으로
지금 계속하고 있습니다.,지금 계속하고 있습니다.
그래서 지금 올리는 부분들이 대부분 이제 가구 만들었던 거,그래서 지금 올리는 부분들이 대부분 이제 가구 만들었던 거
그리고 만드는 과정 이런 부분들 많이 공유하고 있습니다.,그리고 만드는 과정 이런 부분들 많이 공유하고 있습니다.
그리고 추후에 그~ 나중에 뭐~,그리고 추후에 그~ 나중에 뭐~
블로그나 홈페이지 이런 것들을 해보고 싶은데,블로그나 홈페이지 이런 것들을 해보고 싶은데
아직 그런 쪽으로는 문외한이라서,아직 그런 쪽으로는 문외한이라서
잘 몰라서 어~ 혹시 블로그나 이런 홈페이지 같은 데에 홈쇼핑이나 뭐~ 옷 파는,잘 몰라서 어~ 혹시 블로그나 이런 홈페이지 같은 데에 홈쇼핑이나 뭐~ 옷 파는
쇼핑몰 이런 걸 하게 됐 되면,쇼핑몰 이런 걸 하게 됐 되면
혹시 수익이 창출되면 이 블로그 같은 것도 혹시 요금이나 이런 걸,혹시 수익이 창출되면 이 블로그 같은 것도 혹시 요금이나 이런 걸
내야 되는지 궁금한데 혹시 아시나요?,내야 되는지 궁금한데 혹시 아시나요?
어~ 저는 블로그를 개인 기록용으로 쓰고 있어서 사업자 관련된 거는 잘 모르긴 하는데 사업자 블로그를 따로 만들 수 있는 기능이,어~ 저는 블로그를 개인 기록용으로 쓰고 있어서 사업자 관련된 거는 잘 모르긴 하는데 사업자 블로그를 따로 만들 수 있는 기능이
네이버에 있다고 알고 있고요.,네이버에 있다고 알고 있고요.
블로그 자체에서 물건을 팔 수 있는 링크를 건다거나 약간,블로그 자체에서 물건을 팔 수 있는 링크를 건다거나 약간
온라인 마켓처럼 활용할 수 있도록 지금 기능을 개발하고 있다고,온라인 마켓처럼 활용할 수 있도록 지금 기능을 개발하고 있다고
얼마 전이 네이버에서 알림이 와서 봤던 기억이 있습니다.,얼마 전이 네이버에서 알림이 와서 봤던 기억이 있습니다.
아무래도 에스엔에스를 통해서 광고를 하는 게,아무래도 에스엔에스를 통해서 광고를 하는 게
확실히 효과가 있을 것 같은 게,확실히 효과가 있을 것 같은 게
제가 아는 분도 인테리어를 하면서,제가 아는 분도 인테리어를 하면서
그~ 인스타그램에 광고를 올리고 안 올리고 전단지를 돌리고 안 돌리고에 따라서,그~ 인스타그램에 광고를 올리고 안 올리고 전단지를 돌리고 안 돌리고에 따라서
매출이라던가,매출이라던가
그런 전화 문의 오는 게 좀 숫자가 확연하게 차이가 난다고 하더라고요.,그런 전화 문의 오는 게 좀 숫자가 확연하게 차이가 난다고 하더라고요.
그래서 블로그를 통해서 또는 에스엔에스 뭐~,그래서 블로그를 통해서 또는 에스엔에스 뭐~
인스타 같은 걸 통해서 체험단을 모집하는 것도 많이 봤었는데  님은 이런 에스엔에스,인스타 같은 걸 통해서 체험단을 모집하는 것도 많이 봤었는데  님은 이런 에스엔에스
체험단 같은 거를 해본 적이 있으신가요?,체험단 같은 거를 해본 적이 있으신가요?
어~ 아직까지는,어~ 아직까지는
체험단 같은 건 해보지 못한 것 같아요.,체험단 같은 건 해보지 못한 것 같아요.
왜냐하면 시작한 지 얼마 안 됐다 보니까 뭐~ 기능이나 이런 부분들을,왜냐하면 시작한 지 얼마 안 됐다 보니까 뭐~ 기능이나 이런 부분들을
아직 알아가고 있는데 또 팔로우 수나 또 이런 부분들이,아직 알아가고 있는데 또 팔로우 수나 또 이런 부분들이
그렇게 넓지 않다 보니까,그렇게 넓지 않다 보니까
친 지인들 가까운 지인이나 제가 좋아하는 그런 부분들만 이제 팔로우 했다 보니까 그런 체험단이나 이런 거를 정보를 아직,친 지인들 가까운 지인이나 제가 좋아하는 그런 부분들만 이제 팔로우 했다 보니까 그런 체험단이나 이런 거를 정보를 아직
본 적이 없어서 아직 못해본 것 같아요.,본 적이 없어서 아직 못해본 것 같아요.
혹시라도 이제 기회가 생기면 한번 해볼 해볼 것 같은데,혹시라도 이제 기회가 생기면 한번 해볼 해볼 것 같은데
어~ 그런 팔로우 같은 부분에서,어~ 그런 팔로우 같은 부분에서
혹시 이제 홍보나 이런 것들을 넓힐려면,혹시 이제 홍보나 이런 것들을 넓힐려면
혹시 어떤 방법으로 넓히면 좋은지랑 또 제가 지인 사실 이게,혹시 어떤 방법으로 넓히면 좋은지랑 또 제가 지인 사실 이게
일상 공유다 보니까,일상 공유다 보니까
어~ 지인들만,어~ 지인들만
사실 저도 했는데,사실 저도 했는데
어~ 모르는 사람들도 팔로우하거나 이런 부분들을 하기가 좀 조심스럽긴 하더라고요 개인 정보 이런 것들도 있다 보니까,어~ 모르는 사람들도 팔로우하거나 이런 부분들을 하기가 좀 조심스럽긴 하더라고요 개인 정보 이런 것들도 있다 보니까
혹시 이런 부분에서는,혹시 이런 부분에서는
쫌 잘 아시는 부분이 있으면 어떻게 쫌 홍보를,조금 잘 아시는 부분이 있으면 어떻게 조금 홍보를
늘리고 또 정보도 보호할 수 있는 그런 방법이 있는지,늘리고 또 정보도 보호할 수 있는 그런 방법이 있는지
한번 아시면 알려주실 수 있을까요?,한번 아시면 알려주실 수 있을까요?
어~ 지금,어~ 지금
물어보신 게 팔로잉을 늘리는 방법이랑,물어보신 게 팔로잉을 늘리는 방법이랑
그~ 사생활 보호하는 방법인데 어~ 만약에 홍보를 하고 싶으시다면,그~ 사생활 보호하는 방법인데 어~ 만약에 홍보를 하고 싶으시다면
홍보용이랑 개인 일상을 하는 거를 분리해서 운영을 하시는 게 좋을 것 같애요 네이버 같은 걸 기준으로 보면 네이버,홍보용이랑 개인 일상을 하는 거를 분리해서 운영을 하시는 게 좋을 것 같애요 네이버 같은 걸 기준으로 보면 네이버
한 사람당 아이디를 세 개까지 만들 수 있고 그 각 아이디마다 블로그를 하나씩 운영할 수 있으니까,한 사람당 아이디를 세 개까지 만들 수 있고 그 각 아이디마다 블로그를 하나씩 운영할 수 있으니까
내가 개인적으로 사용하는 블로그라든가,내가 개인적으로 사용하는 블로그라든가
그~ 제가 홍보용으로 사용하는 블로그 이렇게 두 개로 나눠서 쓰는 게 사생활을,그~ 제가 홍보용으로 사용하는 블로그 이렇게 두 개로 나눠서 쓰는 게 사생활을
쫌 보호할 수 있는 방법인 것 같고요.,조금 보호할 수 있는 방법인 것 같고요.
팔로잉을 늘리는 거는,팔로잉을 늘리는 거는
뭐~ 특별한 기술이 있는 사람도 있겠지만 제가 생각했을 때는 그냥,뭐~ 특별한 기술이 있는 사람도 있겠지만 제가 생각했을 때는 그냥
본인이 관심 있는 거를 꾸준히 올리다 보면,본인이 관심 있는 거를 꾸준히 올리다 보면
그거에 똑같이 관심을 가진 다른 사람들이 와서 보는 거라고 생각하거든요.,그거에 똑같이 관심을 가진 다른 사람들이 와서 보는 거라고 생각하거든요.
그런 게 또 에스엔에스의 순기능이라고도 볼 수 있고요.,그런 게 또 에스엔에스의 순기능이라고도 볼 수 있고요.
그래서 저가 만약에 지금 하시는 일이,그래서 저가 만약에 지금 하시는 일이
이제 그~ 목수 일이라고 하셨는데 그거를,이제 그~ 목수 일이라고 하셨는데 그거를
만드면서 뭐~ 걸리는 시간이라던가 이렇게 만들었다던가 하는 정보를 계속 올리다 보면,만드면서 뭐~ 걸리는 시간이라던가 이렇게 만들었다던가 하는 정보를 계속 올리다 보면
그거에 관심 돼서 관심 있는 분들이 계속 찾아주실 거라고 보고요.,그거에 관심 돼서 관심 있는 분들이 계속 찾아주실 거라고 보고요.
저 같은 경우는 이제 블로그를 하면서,저 같은 경우는 이제 블로그를 하면서
쫌 공연이나 이런 거를 좋아해가지고,조금 공연이나 이런 거를 좋아해가지고
영화나 공연 책 같은 걸 읽고 리뷰를 많이,영화나 공연 책 같은 걸 읽고 리뷰를 많이
쓰는 편이에요.,쓰는 편이에요.
혹시 일상이라고 하셨는데 일상에서도 뭐~,혹시 일상이라고 하셨는데 일상에서도 뭐~
매일마다 식단을 찍어서 올리시는 분들이 있고  나눠지잖아요.,매일마다 식단을 찍어서 올리시는 분들이 있고  나눠지잖아요.
혹시 어떤 부분에 대한 포스팅을 많이 하시는 편이세요?,혹시 어떤 부분에 대한 포스팅을 많이 하시는 편이세요?
저는 어~ 친구들이랑 이제 한 번씩 놀러 갔을 때?,저는 어~ 친구들이랑 이제 한 번씩 놀러 갔을 때?
그런 풍경 사진이나 친구들이랑 같이 찍은 사진들 공유하고,그런 풍경 사진이나 친구들이랑 같이 찍은 사진들 공유하고
또 맛있는 맛집 갔을 때 보통 이제 음식 같은 거,또 맛있는 맛집 갔을 때 보통 이제 음식 같은 거
또 그 장소?,또 그 장소?
이런 부분들 공유하고 그 외에는 거의 잘 안 하는 것 같아요 그래서,이런 부분들 공유하고 그 외에는 거의 잘 안 하는 것 같아요 그래서
실제로도,실제로도
많이 올라와 있는 사진도 그렇게 많진 않아서 좀,많이 올라와 있는 사진도 그렇게 많진 않아서 좀
아직까진 어색한 것 같습니다.,아직까진 어색한 것 같습니다.
그래서 앞으로도 쪼끔 익숙해지고 아까 말씀해주신 것처럼,그래서 앞으로도 쪼끔 익숙해지고 아까 말씀해주신 것처럼
어~ 뭐~ 목수에 대한 그런 부분들?,어~ 뭐~ 목수에 대한 그런 부분들?
하게 됐을 때 꾸준히 올리는 그런 부분들을,하게 됐을 때 꾸준히 올리는 그런 부분들을
쪼끔 연습을 해봐야겠다라는 생각이 좀 들긴 하네요.,쪼끔 연습을 해봐야겠다라는 생각이 좀 들긴 하네요.
어~ 지금 요즘에 또,어~ 지금 요즘에 또
인스타나 또 에스엔에스 트위터 이런 부분들이 되게,인스타나 또 에스엔에스 트위터 이런 부분들이 되게
핫하면서도 문제들이 또 많이 일어나는 편인데 혹시 그~ 인스타에 중독되거나,핫하면서도 문제들이 또 많이 일어나는 편인데 혹시 그~ 인스타에 중독되거나
또 자기의 일상들을 계속 공유하 하면서,또 자기의 일상들을 계속 공유하 하면서
어떻게 보면 쫌 우울증 걸린 사람들도 있는데 이런 부분에 대해서,어떻게 보면 조금 우울증 걸린 사람들도 있는데 이런 부분에 대해서
어떻게 생각하시는지 궁금하네요.,어떻게 생각하시는지 궁금하네요.
에스엔에스를 통해서 우울증을 걸렸다는 게,에스엔에스를 통해서 우울증을 걸렸다는 게
본인의 삶을 많이 전시를 해서 지금 우울증을 걸린 경우를 이야기하시는 건지,본인의 삶을 많이 전시를 해서 지금 우울증을 걸린 경우를 이야기하시는 건지
아니면 그렇게 전시하는 모습을 통해서 상대적으로 비교가 돼서,아니면 그렇게 전시하는 모습을 통해서 상대적으로 비교가 돼서
지금 우울증에 걸린 경우를 이야기하는지 잘 모르겠는데 만약에 다른 사람들의 삶을 보고,지금 우울증에 걸린 경우를 이야기하는지 잘 모르겠는데 만약에 다른 사람들의 삶을 보고
지금 비교가 돼서 우울함을 느끼는 경우 같은 경우는,지금 비교가 돼서 우울함을 느끼는 경우 같은 경우는
음 제 생각에는 이게 일단은 다른 사람들이랑 비교를 한다는 거는 제가,음 제 생각에는 이게 일단은 다른 사람들이랑 비교를 한다는 거는 제가
어디가 부족하다고 생각해서,어디가 부족하다고 생각해서
우울증에 걸리는 거라고 생각하거든요.,우울증에 걸리는 거라고 생각하거든요.
근데 그 부러운 지점이 어떤 건지를 먼저 파악을 해야 될 것 같애요.,근데 그 부러운 지점이 어떤 건지를 먼저 파악을 해야 될 것 같애요.
내가 그 사람이 갖고 있는 뭐~ 물질적인 것이 부러운 건지 그 사람이 알고 있는,내가 그 사람이 갖고 있는 뭐~ 물질적인 것이 부러운 건지 그 사람이 알고 있는
뭐~ 지적인 부분 그런 교양이라던가 지식이라던가 뭐~,뭐~ 지적인 부분 그런 교양이라던가 지식이라던가 뭐~
할 수 있는 그런 거에 대해서 뭐~,할 수 있는 그런 거에 대해서 뭐~
부러움을 느끼고 있는지 아니면 그 사람이 가진 몸매라던가 이런 거 외모적으로,부러움을 느끼고 있는지 아니면 그 사람이 가진 몸매라던가 이런 거 외모적으로
어~ 부러움을 느끼는 건지를 보고,어~ 부러움을 느끼는 건지를 보고
일단 내가 만족을 하는 지점이 어딘지도 정확하게 파악을 해야 될 것 같애요 왜냐면은,일단 내가 만족을 하는 지점이 어딘지도 정확하게 파악을 해야 될 것 같애요 왜냐하면은
아 요새 같은 경우는 되게 마른 사람들도,아 요새 같은 경우는 되게 마른 사람들도
진짜 완전,진짜 완전
뭐~ 사사 사이즈를 한다거나 거식증에 걸릴 때까지 다이어트를 한다거나 하는 경우도 많은데,뭐~ 사사 사이즈를 한다거나 거식증에 걸릴 때까지 다이어트를 한다거나 하는 경우도 많은데
그런 거는 일단 일단은 건강상에도 안 좋은 거잖아요.,그런 거는 일단 일단은 건강상에도 안 좋은 거잖아요.
그래서 내가 원하는 모습이 그 사람이 되고 싶은 건지 아니면 내가,그래서 내가 원하는 모습이 그 사람이 되고 싶은 건지 아니면 내가
부족하다고 생각하는 부분이 있는 건지를 파악해야 되고,부족하다고 생각하는 부분이 있는 건지를 파악해야 되고
내가 부족한 부분이 있다고 판단을 하는 거면,내가 부족한 부분이 있다고 판단을 하는 거면
그게 진짜 내가 부족한 건지 아니면 사회적인 기준에서 부족한 건지를 먼저 파악해야 될 것 같애요.,그게 진짜 내가 부족한 건지 아니면 사회적인 기준에서 부족한 건지를 먼저 파악해야 될 것 같애요.
그래서 일단은 자기에 대해서 자신감을 가지고,그래서 일단은 자기에 대해서 자신감을 가지고
이게 좀 삶을 사는 게 필요할 것 같고,이게 좀 삶을 사는 게 필요할 것 같고
내 혼자 마음먹는다고 그게 되는 게 아니면은,나 혼자 마음먹는다고 그게 되는 게 아니면은
다른 사람들의 어~ 에스엔에스를 좀 덜 보는 방식으로,다른 사람들의 어~ 에스엔에스를 좀 덜 보는 방식으로
조절을 해야지 이게 조정이 될 것 같거든요.,조절을 해야지 이게 조정이 될 것 같거든요.
솔직히 내 마음속으로  괜찮아 이렇게 생각을 해도,솔직히 내 마음속으로  괜찮아 이렇게 생각을 해도
주변 사람들이 전부 그거를 나한테 들이밀면,주변 사람들이 전부 그거를 나한테 들이밀면
그게 막 콤플렉스가 되든지,그게 막 콤플렉스가 되든지
위축이 되는 방식으로 작용을 할 것 같거든요.,위축이 되는 방식으로 작용을 할 것 같거든요.
