사투리,표준어
하고 있으니까 또 다른 거를 쫌 하기 힘들 수도 있을 거 같애서,하고 있으니까 또 다른 거를 조금 하기 힘들 수도 있을 거 같애서
니가 생각이 있으면 같이 그렇게 공부를 해봐도 될 거 같다는 생각이 들어.,너가 생각이 있으면 같이 그렇게 공부를 해봐도 될 거 같다는 생각이 들어.
너는 어떻게,너는 어떻게
아~ 시원스쿨이 영어만 하는 줄 알았는데,아~ 시원스쿨이 영어만 하는 줄 알았는데
다른 언어도 하는구나.,다른 언어도 하는구나.
그거 다른 자격증 특히 언어는 같이 하면 좋기는 한데 아~,그거 다른 자격증 특히 언어는 같이 하면 좋기는 한데 아~
내가 속기사 자격증 강의를 처음 무료 강의를 들어갔는데,내가 속기사 자격증 강의를 처음 무료 강의를 들어갔는데
그때 무료 강의니까 이~ 수업 들을 수 있는 반이 자리가 별로 없었어 그래서,그때 무료 강의니까 이~ 수업 들을 수 있는 반이 자리가 별로 없었어 그래서
남는 자리가 있길래 어~ 이래서 바로 그거를 신청했거든.,남는 자리가 있길래 어~ 이래서 바로 그거를 신청했거든.
그게 어떤 방식으로 이루어지는지를 모르고 일단 자리가 있으니까 선택을 했어 왜냐하면,그게 어떤 방식으로 이루어지는지를 모르고 일단 자리가 있으니까 선택을 했어 왜냐하면
그 전 주랑 그 전 전 주도,그 전 주랑 그 전 전 주도
듣고 싶어도 들어갔을 때 이미,듣고 싶어도 들어갔을 때 이미
당일 오후 되면 자리가 없는 거야 왜냐면 무료 강의니까 유료보다 이제 선택권이 적어서,당일 오후 되면 자리가 없는 거야 왜냐면 무료 강의니까 유료보다 이제 선택권이 적어서
그랬는데 자리가 있어서 선택을 했는데,그랬는데 자리가 있어서 선택을 했는데
갑자기 언제 바로 시작을 한다는 거야 언제 시작하는지는 제대로 안 본 거지.,갑자기 언제 바로 시작을 한다는 거야 언제 시작하는지는 제대로 안 본 거지.
그래서 막상 딱 그 시작할 첫 강의쯤 되니까,그래서 막상 딱 그 시작할 첫 강의쯤 되니까
문자가 선생님이 오셨어 어~ 어디 어디까지 연습해오세요 했는데,문자가 선생님이 오셨어 어~ 어디 어디까지 연습해오세요 했는데
그 주에 너무 바빴어.,그 주에 너무 바빴어.
그니까 내가 지금 하고 있는 일은,그러니까 내가 지금 하고 있는 일은
아르바이트도 하고 그 자막 일을 하고 있으니까,아르바이트도 하고 그 자막 일을 하고 있으니까
일이 많을 때는 너무 많은데 올해 코로나 때문에,일이 많을 때는 너무 많은데 올해 코로나 때문에
그 일이 갑자기 너무 많아진 거야 그래서,그 일이 갑자기 너무 많아진 거야 그래서
그 일을 하면서,그 일을 하면서
할 수 있을 거라 생각했는데 이게 일정 궤도에 오르면 괜찮은데,할 수 있을 거라 생각했는데 이게 일정 궤도에 오르면 괜찮은데
초반이니까,초반이니까
이게 그 속 이~ 원래 일하는 속도를 못 따라가서 그걸로 안 되는 거지.,이게 그 속 이~ 원래 일하는 속도를 못 따라가서 그걸로 안 되는 거지.
그래서 제대로 연습 못 하고 딱 한 번 들어가서,그래서 제대로 연습 못 하고 딱 한 번 들어가서
선생님이 약간 어~ 다음에는 해보세 해오세요라고 하고 끝났는데,선생님이 약간 어~ 다음에는 해보세 해오세요라고 하고 끝났는데
두 번째 들어갔는데 또 못 했어 두 번째가 이틀 뒤였거든.,두 번째 들어갔는데 또 못 했어 두 번째가 이틀 뒤였거든.
이틀 만에 갑자기 이렇게 확 연습량이 늘지 않았으니까,이틀 만에 갑자기 이렇게 확 연습량이 늘지 않았으니까
그래서 선생님이 조용히 물어봤어 혹시,그래서 선생님이 조용히 물어봤어 혹시
그~ 하루에 몇 시간 연습 가능하냐고 해서,그~ 하루에 몇 시간 연습 가능하냐고 해서
내가 아~ 다음 주 이번 주는 쫌 바쁘고,내가 아~ 다음 주 이번 주는 조금 바쁘고
다음 주는 모르겠는데 일단 주말에는 확실히 두 시간 이상 할 수 있을 거 같아요라고 했어.,다음 주는 모르겠는데 일단 주말에는 확실히 두 시간 이상 할 수 있을 거 같아요라고 했어.
근데 나는 그 전에 자격증들은 이제,근데 나는 그 전에 자격증들은 이제
공부를 짬짬이 하거나 이렇게 지식이나 이해 이런 거를 하면,공부를 짬짬이 하거나 이렇게 지식이나 이해 이런 거를 하면
내가 속도가 확 나기도 하고 아니면 원래 지식이 쫌 깔려있으면 쫌 더,내가 속도가 확 나기도 하고 아니면 원래 지식이 조금 깔려있으면 조금 더
빨리 진행이 되는 거였는데 이거는,빨리 진행이 되는 거였는데 이거는
연습을 하고 손에 익어야 되는 거라서,연습을 하고 손에 익어야 되는 거라서
이런 걸 해본 적이 없어서 쫌 쉽게 생각했나 봐.,이런 걸 해본 적이 없어서 조금 쉽게 생각했나 봐.
그래서 두 시간을 나는 이 정도면이라고 생각했는데 강사님이,그래서 두 시간을 나는 이 정도면이라고 생각했는데 강사님이
혹시 자격증 준비 기간 얼마나 생각하세요 그래서,혹시 자격증 준비 기간 얼마나 생각하세요 그래서
아~ 일 년 잡고 있어요 하니까 선생님이 바로,아~ 일 년 잡고 있어요 하니까 선생님이 바로
선생님도 딸 때 일 년을 잡았는데,선생님도 딸 때 일 년을 잡았는데
하루에 열 시간을 공부했대.,하루에 열 시간을 공부했대.
그래서 아~ 갑자기 너무 마음이 무거워졌어.,그래서 아~ 갑자기 너무 마음이 무거워졌어.
