사투리,표준어
지긋이 오래를 못해 봤고 대학 가서도 마찬가지고 모든 게,지긋이 오래를 못해 봤고 대학 가서도 마찬가지고 모든 게
이래 막 쫌 이래 벼락치기를 많이 한 거 같애.,이렇게 막 조금 이렇게 벼락치기를 많이 한 거 같애.
책을 제가 쫌 이래 책 보는 걸 참 좋아하다 보니까 그 제가 뭐~ 속독법을 배운 적은 없어요.,책을 제가 조금 이렇게 책 보는 걸 참 좋아하다 보니까 그 제가 뭐~ 속독법을 배운 적은 없어요.
근데 속독법도 이르케 나도 모르게 이거 알게 되고,근데 속독법도 이렇게 나도 모르게 이거 알게 되고
이래 막 그러고 직장 생활할 때도 그랬습니다.,이렇게 막 그리고 직장 생활할 때도 그랬습니다.
이거를 그~ 자격증을 그렇게 제가 이르케 되게 인정하지 않는 게,이거를 그~ 자격증을 그렇게 제가 이렇게 되게 인정하지 않는 게
저 주위에 봐도 그렇고 실업계를 나와가지고,저 주위에 봐도 그렇고 실업계를 나와가지고
이 회계 업무를 다루는 거 보믄 가르킨 한 일이 년 정도 이래 가리키믄,이 회계 업무를 다루는 거 보면 가르친 한 일이 년 정도 이렇게 가르치면
거진 준 선수급이 됩니다.,거의 준 선수급이 됩니다.
자격증이 없어도 쉽게 얘기해서 자격증이 있어도 그렇고,자격증이 없어도 쉽게 얘기해서 자격증이 있어도 그렇고
근데 대학을 나와가지구 뭐~ 기타 뭐~ 이런 거 자격증을 갖차가지고 이래가지고,근데 대학을 나와가지구 뭐~ 기타 뭐~ 이런 거 자격증을 갖추어가지고 이래가지고
오믄 쫌 그렇더라구예.,오면 조금 그렇더라구요.
근데 이 기본 원리적 논리 이런 거 대학을 졸업하게 되면 상경계를 오믄,근데 이 기본 원리적 논리 이런 거 대학을 졸업하게 되면 상경계를 오면
자격증은 어뜨케 실업계 나온 사람들을 비해서 자격증이 없습니다.,자격증은 어뜨케 실업계 나온 사람들을 비해서 자격증이 없습니다.
지금 같은 경우는 막 그냥 따드라구요 뭐~ 전산 세무 회계라든가 뭐~,지금 같은 경우는 막 그냥 따드라구요 뭐~ 전산 세무 회계라든가 뭐~
더 존 뭐~ 이래가지고 뭐~ 이래가지고 뭐~ 따더라구예.,더 존 뭐~ 이래가지고 뭐~ 이래가지고 뭐~ 따더라구요.
따는데 실제로 그~ 와서 회사 업무에서 컴퓨터에서 그런 게 있을 때,따는데 실제로 그~ 와서 회사 업무에서 컴퓨터에서 그런 게 있을 때
적용할 수 있는 그런 범위가 전혀 안 됩니다.,적용할 수 있는 그런 범위가 전혀 안 됩니다.
오히려 더 힘듭니다.,오히려 더 힘듭니다.
고정관념 속에 있다 보니까 그게 힘들더라구요.,고정관념 속에 있다 보니까 그게 힘들더라구요.
그게 보믄 어찌보믄 저는 모든 자격증을 독학을 해서 다 딴 거 같습니다.,그게 보면 어찌 보면 저는 모든 자격증을 독학을 해서 다 딴 거 같습니다.
운전도 학원을 안 가고 사실 제가 그~,운전도 학원을 안 가고 사실 제가 그~
팔십사 년도 팔십육 년도 때 자격증을 그~ 운전면허증을 땄는데,팔십사 년도 팔십육 년도 때 자격증을 그~ 운전면허증을 땄는데
그것도 그렇고 그냥 집에 차가 있어가지구 잠깐잠깐 이래 하면서 이래,그것도 그렇고 그냥 집에 차가 있어가지구 잠깐잠깐 이렇게 하면서 이렇게
사이드로 이래 보고 하고 뭐~ 이르케 하다 보니까 뭐~,사이드로 이렇게 보고 하고 뭐~ 이렇게 하다 보니까 뭐~
실제로 코 그~ 뭐고 그~,실제로 코 그~ 뭐고 그~
시험 면허장 가가지고 크랭크부터 해가지고 티 뭐~ 엘 이런 코스를 알았어요.,시험 면허장 가가지고 크랭크부터 해가지고 티 뭐~ 엘 이런 코스를 알았어요.
그~ 저는 일종을 땄는데 그~ 처음에 가가지고,그~ 저는 일종을 땄는데 그~ 처음에 가가지고
에스 코스를 들어가가지고 일 톤 차 뭐~ 옛날 그때는,에스 코스를 들어가가지고 일 톤 차 뭐~ 옛날 그때는
저는 덕천에서 땄습니다 그~,저는 덕천에서 땄습니다 그~
북구 그~ 시험 면허장에 갔는데 빠꾸를 몬해 나왔어요.,북구 그~ 시험 면허장에 갔는데 빠꾸를 못해 나왔어요.
그 우짭니까?,그 어쩝니까?
뭐~ 드가기는 쌩 들어가는데 나올 줄은 모른다꼬,뭐~ 들어가기는 쌩 들어가는데 나올 줄은 모른다고
몬 몬 나오겠드라구요 그 라인을 몰라가지고 떨어지고,못 못 나오겠드라구요 그 라인을 몰라가지고 떨어지고
그다음에 일주일 뒤에 두 번째 갔을 때,그다음에 일주일 뒤에 두 번째 갔을 때
합격을 했는데 그래서 제가 생각한 게 드갈때는 최대한으로 빨리 드가고 그래 막,합격을 했는데 그래서 제가 생각한 게 들어갈 때는 최대한으로 빨리 들어가고 그래 막
막 드갔다가 나올 때는 드갔다 왔다 드갔다 왔다 겨우 나왔드라꼬예.,막 들어갔다가 나올 때는 들어갔다 왔다 들어갔다 왔다 겨우 나왔더라고요.
그다음에 뭐~ 주행도 그렇고 쉽게 합격을 했는데,그다음에 뭐~ 주행도 그렇고 쉽게 합격을 했는데
그게 쫌 이래,그게 조금 이렇게
면허증을 따고 이랄때 보니까 저가 뭐~ 그~ 학원 안 다니고 막 저 혼자 막 편법적으로 따다 보니까,면허증을 따고 이럴 때 보니까 제가 뭐~ 그~ 학원 안 다니고 막 저 혼자 막 편법적으로 따다 보니까
그럼 쉽게 생각되드라구예.,그럼 쉽게 생각되더라구요.
그러믄 안 되는데  님은,그러면 안 되는데  님은
아까 자격증을 참 진짜 세 개 정도 따가지고 참 실용적으로 했다는데,아까 자격증을 참 진짜 세 개 정도 따가지고 참 실용적으로 했다는데
그중에서도 가장 애착 가는 자격증이 있으신가요?,그중에서도 가장 애착 가는 자격증이 있으신가요?
어~ 저는 가장 애착,어~ 저는 가장 애착
되는 자격증은 당연히 중국어 능력 시험이죠.,되는 자격증은 당연히 중국어 능력 시험이죠.
이게 왜냐면 준비 기간이,이게 왜냐면 준비 기간이
어~ 많이 길었던 거 제일 길었던 거 같아서,어~ 많이 길었던 거 제일 길었던 거 같아서
이게 제일 애착이 되고 지금 제가 이때까지 해왔던 일,이게 제일 애착이 되고 지금 제가 이때까지 해왔던 일
내 학교에서 학원하고 학교에서,내 학교에서 학원하고 학교에서
이~ 계속 중국 현지에 있는 데서 근무를 하면서,이~ 계속 중국 현지에 있는 데서 근무를 하면서
어~ 네 많이 인제 실용적으로 많이 쓰였습니다.,어~ 네 많이 인제 실용적으로 많이 쓰였습니다.
네 중국 현지에서는 진짜 많이 실용적으로 쓰이고,네 중국 현지에서는 진짜 많이 실용적으로 쓰이고
어~ 그리고 뭐~ 이거 때문에 뭐~ 인정도 받고,어~ 그리고 뭐~ 이거 때문에 뭐~ 인정도 받고
그리구 취직도 당연히 쪼금 더 쉽게 되고,그리고 취직도 당연히 쪼금 더 쉽게 되고
근데 회화가 더 우선이긴 했던 거 같습니다.,근데 회화가 더 우선이긴 했던 거 같습니다.
준비 기간이 이게 제가 대학교 때,준비 기간이 이게 제가 대학교 때
대학은 한국에서 중어 중문과를 나왔습니다.,대학은 한국에서 중어 중문과를 나왔습니다.
중어 중문과를 나왔지만은 아까 제가,중어 중문과를 나왔지만은 아까 제가
중국 어학연수를 갔다고 말씀은 드렸는데,중국 어학연수를 갔다고 말씀은 드렸는데
한국에서는 진짜 어~ 중국에 인제 교환 교수님이 오셔가지고,한국에서는 진짜 어~ 중국에 인제 교환 교수님이 오셔가지고
저한테 인제 뭐~ 너 집에서 얼마나 머냐 얼마나 걸리냐 이렇게 막 말씀하시는데,저한테 인제 뭐~ 너 집에서 얼마나 머냐 얼마나 걸리냐 이렇게 막 말씀하시는데
저는 그 말이 참 귀에 들어오지 않더라구요 그래서 나중에 생각을 해보니까,저는 그 말이 참 귀에 들어오지 않더라구요 그래서 나중에 생각을 해보니까
한발 놓치고 나서 생각을 해보니까 아~ 그게 그 뜻이었구나.,한발 놓치고 나서 생각을 해보니까 아~ 그게 그 뜻이었구나.
이게 중어 중문과 학생이라면서 그런 간단한 말도 제대로 못 알아듣는 게,이게 중어 중문과 학생이라면서 그런 간단한 말도 제대로 못 알아듣는 게
너무 부끄러웠습니다.,너무 부끄러웠습니다.
그래서 제가 어학연수를 결정을 하게 된 거구요.,그래서 제가 어학연수를 결정을 하게 된 거구요.
그만큼 음~ 그리고 어학연수도 한 일 년 반 정도,그만큼 음~ 그리고 어학연수도 한 일 년 반 정도
심양하고 북경에서 진행을 했던 걸로 알고 있습니다.,심양하고 북경에서 진행을 했던 걸로 알고 있습니다.
그래서 유학생들을 인제 저와 같은,그래서 유학생들을 인제 저와 같은
상황을 가지고 있는 유학생들을 많이 보게 됐는데요.,상황을 가지고 있는 유학생들을 많이 보게 됐는데요.
아무래도 인제 고삐 풀린 망아지처럼,아무래도 인제 고삐 풀린 망아지처럼
아~ 이십 대 초반이죠.,아~ 이십 대 초반이죠.
에~ 이십 대 초반 중반 뭐 삼십 대 뭐~ 사십 대까지,에~ 이십 대 초반 중반 뭐 삼십 대 뭐~ 사십 대까지
직장 쉬면서까지 인제 와서 유학을 하시는 분들이,직장 쉬면서까지 인제 와서 유학을 하시는 분들이
상당히 많았습니다 네.,상당히 많았습니다 네.
예 중국어가 제일 그래도 예 능력 시험 때,예 중국어가 제일 그래도 예 능력 시험 때
네 가장 애착을 가지고 준비 기간이 길었기 때문에,네 가장 애착을 가지고 준비 기간이 길었기 때문에
제가 가장 네 애착이 되는 그런 자격증입니다.,제가 가장 네 애착이 되는 그런 자격증입니다.
