사투리,표준어
요즘 날씨가 어~ 얼마 전에 되게 추웠다가,요즘 날씨가 어~ 얼마 전에 되게 추웠다가
갑자기 또 응~,갑자기 또 응~
어제부터서 날씨가 기온이 상당히 많이 내려가서 건강이 항상 걱정이 되는데,어제부터서 날씨가 기온이 상당히 많이 내려가서 건강이 항상 걱정이 되는데
어~ 나는 인자 나이가 어느 정도로 육십 대가 넘어가다 보니까,어~ 나는 인제 나이가 어느 정도로 육십 대가 넘어가다 보니까
내 신체적인 건강이 제일 그 한데 엄마가 한 번,내 신체적인 건강이 제일 그거 한데 엄마가 한 번
뇌경색으로 넘어 저 쓰러진 적 있잖아 그지 그래갖 그래 우리가,뇌경색으로 넘어 저 쓰러진 적 있잖아 그지 그래갖 그래 우리가
몇 년 한 일 년 반정 전에 엄마 때문에 서로가 다 굉장히 힘들었는데,몇 년 한 일 년 반정 전에 엄마 때문에 서로가 다 굉장히 힘들었는데
어~ 나는 나도 혹시나 형제간이다 보니까,어~ 나는 나도 혹시나 형제간이다 보니까
그~ 뇌에 대해서 혹시 뇌경색이 오까 싶어서 걱정을 많이 하거던,그~ 뇌에 대해서 혹시 뇌경색이 오까 싶어서 걱정을 많이 하거던
너는 어떻게 생각을 하노?,너는 어떻게 생각을 하니?
일단 나이가 들면은 어쩔 시 안,일단 나이가 들면은 어쩔 시 안
안고 가야 되는 지라고 생각하고 얼마 전에,안고 가야 되는 지라고 생각하고 얼마 전에
응급실 간 적 있는데 그때도,응급실 간 적 있는데 그때도
이~ 어지럼증 있으니까,이~ 어지럼증 있으니까
뇌경색이 혹시 아닌가 싶어 가지고 그걸 검사를 먼저 하드라 걔 엠알아이 찍었는데 아무 이상이 없었어.,뇌경색이 혹시 아닌가 싶어 가지고 그걸 검사를 먼저 하더라 걔 엠알아이 찍었는데 아무 이상이 없었어.
근데 계속 어지럽고,근데 계속 어지럽고
어~ 거기서 처치는 해줬지마는 집에 와서 또 어지럽더라고,어~ 거기서 처치는 해줬지마는 집에 와서 또 어지럽더라고
게 왜 이런가 싶어가지고 뒷날 병원에 가니까,게 왜 이런가 싶어가지고 뒷날 병원에 가니까
뭐~ 이유가 없대,뭐~ 이유가 없대
내가 봤을 때는 그 이유가 면역력,내가 봤을 때는 그 이유가 면역력
저하 아닌가 그런 생각이 드는데,저하 아닌가 그런 생각이 드는데
아무래도 면역력을 쫌 높이면은 우리가,아무래도 면역력을 조금 높이면은 우리가
모든 어~ 질병에서 이겨내지 않을까 그런 생각이 드는데,모든 어~ 질병에서 이겨내지 않을까 그런 생각이 드는데
뭐~ 약도 좋지마는 운동을 해야 되지 않을까?,뭐~ 약도 좋지마는 운동을 해야 되지 않을까?
그런 생각,그런 생각
그래 나도 니 생각에 일조를 하는 게 면역력 강화를 하는 게,그래 나도 네 생각에 일조를 하는 게 면역력 강화를 하는 게
근데 실제로 우리가 운동도 중요하지마는,근데 실제로 우리가 운동도 중요하지마는
또 인자 나이가 들다 보니까,또 인제 나이가 들다 보니까
뭐거를 해야 되냐면은 면역 강화제를 먹어줘야 되겠드라고,뭐거를 해야 되냐면은 면역 강화제를 먹어줘야 되겠더라고
근데 우리나라 사람들이 실제로 먹는 기라 하면은 굉장히 꺼려하거든?,근데 우리나라 사람들이 실제로 먹는 거라 하면은 굉장히 꺼려하거든?
꺼려하는데 쪼끔 뭐라 해야 되노 나이가 들 수,꺼려하는데 쪼끔 뭐라 해야 되지 나이가 들 수
젊었을 때 부터서 내 생각에는 젊었을 때부터서 어~,젊었을 때 부터서 내 생각에는 젊었을 때부터서 어~
저기 식품 같은 걸로 쪼꼼 면역 강화시키 식품을 좀 먹어주는 게 좋지 않을까 싶어서 나는,저기 식품 같은 걸로 쪼꼼 면역 강화시키 식품을 좀 먹어주는 게 좋지 않을까 싶어서 나는
뭘 먹느냐 하면은,뭘 먹느냐 하면은
어~  회모임을 한 이 년을 계속 지속적으로 먹다 보니까 감기도,어~  회모임을 한 이 년을 계속 지속적으로 먹다 보니까 감기도
덜 하고 쪼꼼 피로감도,덜 하고 쪼꼼 피로감도
줄어들고 그런 기 쫌 있는데 너도 그걸 한번,줄어들고 그런 게 조금 있는데 너도 그걸 한번
먹어봤으면 좋을 것 겉애서 추천을 하고 싶은데,먹어봤으면 좋을 것 같애서 추천을 하고 싶은데
그세 나는 아직 약을 먹어가지고 회복한다기보다는 일단 운동을 먼저,그세 나는 아직 약을 먹어가지고 회복한다기보다는 일단 운동을 먼저
하는 게 한 시 하루에 한 시간이라도 꾸준한 운동을 하다 보면은,하는 게 한 시 하루에 한 시간이라도 꾸준한 운동을 하다 보면은
어~ 체력도 좋아지고 면역력도 생기지 않을까 그런 생각을 하는데,어~ 체력도 좋아지고 면역력도 생기지 않을까 그런 생각을 하는데
일단은 우리가 전문가가 아니기 때문에 정확한 해답은,일단은 우리가 전문가가 아니기 때문에 정확한 해답은
없을 것 같애요.,없을 것 같애요.
지 근데 나는 어~ 이상하이,지 근데 나는 어~ 이상하게
나이 퇴직하고 난 뒤에부터서는,나이 퇴직하고 난 뒤에부터서는
으 티비 프로그램 보면 건강 프로그램을 참 많이 보는 편이라,으 티비 프로그램 보면 건강 프로그램을 참 많이 보는 편이라
근데 요즘 너무 많은 것을 먹으라 해서 그걸 다 먹을 수는 없는데,근데 요즘 너무 많은 것을 먹으라 해서 그걸 다 먹을 수는 없는데
걷는 게 상당히 운동 중에서는 걷는 운동 우리가 인자 내가 들다 보니까 심하게 뭐~ 근력운동이라든지 이런 거는 못 하겠고,걷는 게 상당히 운동 중에서는 걷는 운동 우리가 인제 내가 들다 보니까 심하게 뭐~ 근력운동이라든지 이런 거는 못 하겠고
그래서 인자 걷기 운동,그래서 인제 걷기 운동
그~ 유산소운동이지 걷기 운동 프러스 알파에다가 식품도 같,그~ 유산소운동이지 걷기 운동 프러스 알파에다가 식품도 같
이 곁들여서 먹어줬으면은 좋을 것 같애서,이 곁들여서 먹어줬으면은 좋을 것 같애서
그러고 뭐~ 그~ 제일 중요한 거는 운동인데,그러고 뭐~ 그~ 제일 중요한 거는 운동인데
우리가 아무래도 인자 엄마,우리가 아무래도 인제 엄마
가 그런 뇌경색으로 인해가지고 한 번 큰 고통을 우리가 어~ 치렀기 때문에,가 그런 뇌경색으로 인해가지고 한 번 큰 고통을 우리가 어~ 치렀기 때문에
엄마의 형제간이고 또 자녀,엄마의 형제간이고 또 자녀
고 이러기 때문에,고 이러기 때문에
이제 그런 유전적인 걸로 많이 받을 수 있지 않을까 싶어서 난 항상,이제 그런 유전적인 걸로 많이 받을 수 있지 않을까 싶어서 난 항상
저녁에 잘 때도,저녁에 잘 때도
머리를 좀 따뜻하게 해줄려고 하고 그런 게 있으니까,머리를 좀 따뜻하게 해줄려고 하고 그런 게 있으니까
또 우리가 서로 쫌 조심을 해야 되지 않을까 싶고,또 우리가 서로 조금 조심을 해야 되지 않을까 싶고
또 우리가 거기 앞으로도 우리가 서로,또 우리가 거기 앞으로도 우리가 서로
생각을 하면서 지내야 될 것 같애서 그래서 얘기를 한번 해봤어.,생각을 하면서 지내야 될 것 같애서 그래서 얘기를 한번 해봤어.
아무래도 이~ 나이가 들면은,아무래도 이~ 나이가 들면은
이~ 가지고 있는 우리 체질이라고 할 수 있는 그쪽으로,이~ 가지고 있는 우리 체질이라고 할 수 있는 그쪽으로
오는 병들은 어쩔 수 없이 안고 가야 된다고 생각하는데,오는 병들은 어쩔 수 없이 안고 가야 된다고 생각하는데
그세 엄마가 뇌경색을 앓고 보니까,그세 엄마가 뇌경색을 앓고 보니까
나도 혹시 그렇게 되지 않을까 하는 불안감은 있는데,나도 혹시 그렇게 되지 않을까 하는 불안감은 있는데
아직까지 약을 못 먹어봤는데 한번,아직까지 약을 못 먹어봤는데 한번
약을 먹어보는 것도 괜찮을 것 같고 지금,약을 먹어보는 것도 괜찮을 것 같고 지금
약 먹는 거는 홍삼을 먹고 있는데,약 먹는 거는 홍삼을 먹고 있는데
한 몇 개월 먹어 보 어떻는가를 잘 모르겠는데 지금까지는 기계도 그렇지 않아요 한,한 몇 개월 먹어 보 어떻는가를 잘 모르겠는데 지금까지는 기계도 그렇지 않아요 한
오십 년을 썼다고 생각하면은 기계도 고장 나는데 사람이 고장 안 나는 그~,오십 년을 썼다고 생각하면은 기계도 고장 나는데 사람이 고장 안 나는 그~
사람은 진짜 대단한 거라고 나는 생각하거든요?,사람은 진짜 대단한 거라고 나는 생각하거든요?
응~ 그래서,응~ 그래서
안고 살아야지 그 생각 하는데 아프니까 진짜 힘들드라고요.,안고 살아야지 그 생각 하는데 아프니까 진짜 힘들더라고요.
어~ 안 아픈 게 제일 좋은데 응~,어~ 안 아픈 게 제일 좋은데 응~
이모도 안 아팠으면 좋겠어요.,이모도 안 아팠으면 좋겠어요.
그~ 혹시 그거는 함 생각을 해봤어?,그~ 혹시 그거는 한 번 생각을 해봤어?
나는 인자 엄마가 그리 되고 난 뒤에는,나는 인제 엄마가 그렇게 되고 난 뒤에는
우리가 그 병원비랑 이런 거에 상당히 많은 큰 금액을,우리가 그 병원비랑 이런 거에 상당히 많은 큰 금액을
지불을 했잖아 그지 그런데 그라고 난 뒤에는 인자 뭘 생각을 했냐면은,지불을 했잖아 그지 그런데 그러고 난 뒤에는 인제 뭘 생각을 했냐면은
내가 가지고 있는 보험을 한번 내가 생각을 해봤어.,내가 가지고 있는 보험을 한번 내가 생각을 해봤어.
보험을 함 생각해봤는데 내,보험을 한 번 생각해봤는데 내
이모도 상당히 보험료를 많이 낸다고 생각했는데,이모도 상당히 보험료를 많이 낸다고 생각했는데
함 싹 설계를 전체적으로 해보니까 뇌경색에 관한 뇌에 관한 보험이,한 번 싹 설계를 전체적으로 해보니까 뇌경색에 관한 뇌에 관한 보험이
미약하드라고 돈 천만 나오는 거 요즘 천만 원 돈이 아니잖아 그지?,미약하더라고 돈 천만 나오는 거 요즘 천만 원 돈이 아니잖아 그지?
그래서 나는 다시 내가 인자 그래 한번 보험에 대한 설계를 한번 내가 다시,그래서 나는 다시 내가 인제 그래 한번 보험에 대한 설계를 한번 내가 다시
재 어~ 한 번 해봤는데,재 어~ 한 번 해봤는데
그~ 엄마가 그렇게 되고 난 뒤에 보험료를 쫌 지불을 하는 게 뇌 쪽으로,그~ 엄마가 그렇게 되고 난 뒤에 보험료를 조금 지불을 하는 게 뇌 쪽으로
자 뇌혈관 쪽으로,자 뇌혈관 쪽으로
그래갖고 보험료를 지금 지출하는 게 한 사만 원내서 오만 원 정도,그래갖고 보험료를 지금 지출하는 게 한 사만 원내서 오만 원 정도
금액이 나가는데 우리가 실제로 엄마가 그리 아팠을 때 엄마가 보험이 없다 보니까 쪼꼼,금액이 나가는데 우리가 실제로 엄마가 그렇게 아팠을 때 엄마가 보험이 없다 보니까 쪼꼼
아마래 암만해도 엄마가 시골에서 계셨기 때문에 그런 보험,아마래 암만해도 엄마가 시골에서 계셨기 때문에 그런 보험
에 대한 지식이 쪼꼼 부족하다 보니까,에 대한 지식이 쪼꼼 부족하다 보니까
그런 거 우리가 몬 챙겨준 게 쫌 아쉽드라고 그래 너도 지금,그런 거 우리가 모 챙겨준 게 조금 아쉽더라고 그래 너도 지금
아직 늦지 않았으니까 한번 그런 기 혹시나 그그 되면 전체적인 거 보험,아직 늦지 않았으니까 한번 그런 게 혹시나 그거 되면 전체적인 거 보험
증권을 내놓고 한번 싹 설계를 다시 해봤으면 좋을 것 겉애서,증권을 내놓고 한번 싹 설계를 다시 해봤으면 좋을 것 같애서
그래 한번 츠,그래 한번 츠
점검을 한 번 해봤으면 좋을 것 같애.,점검을 한 번 해봤으면 좋을 것 같애.
실질적으로 보험을 넣는 건,실질적으로 보험을 넣는 건
참 좋은 일인데 계속,참 좋은 일인데 계속
세월이 흐를수록 보험도 발전하니까,세월이 흐를수록 보험도 발전하니까
엔날에 넣은 보험이 좋다고 하지만 항상 부족할 것 같애요 그래서,옛날에 넣은 보험이 좋다고 하지만 항상 부족할 것 같애요 그래서
보험은 적당하게 부족 어~ 쪼금 부족한 듯이 넣어야지 실제적으로 내한테는 이익이지 그걸 풍부할 정도로 넣는 거는,보험은 적당하게 부족 어~ 쪼금 부족한 듯이 넣어야지 실제적으로 나한테는 이익이지 그걸 풍부할 정도로 넣는 거는
현실적으로 생활에 이~,현실적으로 생활에 이~
궁핍함을 주면서 미래를 행복하다는 거는,궁핍함을 주면서 미래를 행복하다는 거는
그거는 아닌 것 같다는 생각이 들어서 일단,그거는 아닌 것 같다는 생각이 들어서 일단
이번에도 뭐~ 보험금,이번에도 뭐~ 보험금
청구를 했는데,청구를 했는데
반 정도 나왔드라고 게 쪼금 섭섭한 감은 있지마는,반 정도 나왔더라고 게 쪼금 섭섭한 감은 있지마는
그렇다고 그거를 다 받기 위해서 그므 그보다 더 프라스 되게 받기 위해서,그렇다고 그거를 다 받기 위해서 그므 그보다 더 프라스 되게 받기 위해서
보험을 많이 넣는 거는 아니라고 봐요.,보험을 많이 넣는 거는 아니라고 봐요.
그냥 적당하게,그냥 적당하게
근데 왜 이번에 병원비가,근데 왜 이번에 병원비가
왠 실손을 넣었는데 병원비가 왜 반밖에 안 났등 아?,왠 실손을 넣었는데 병원비가 왜 반밖에 안 났등 아?
어~ 실손을 넣드라도 통근을 하다 보니까 십만 원까지 한도인데,어~ 실손을 넣더라도 통근을 하다 보니까 십만 원까지 한도인데
어~ 응급실 가니까 한 이십몇만 원 나오고 그 뒷날 음~ 따른 검사 좀 하니까 또 이십몇만 원 나오고 이러다 보니까 통금이나 무,어~ 응급실 가니까 한 이십몇만 원 나오고 그 뒷날 음~ 다른 검사 좀 하니까 또 이십몇만 원 나오고 이러다 보니까 통금이나 무
통금 어~ 어~,통금 어~ 어~
어로비는 십만 원까지니까 만약에 의사의 말에 의하면은,어로비는 십만 원까지니까 만약에 의사의 말에 의하면은
입원을 해가지고 치료를 하면 좋다고 했는데 지금 코로나 시점에 입원하는 게 더 무서운 생각이 들어서 손해를 보더라도,입원을 해가지고 치료를 하면 좋다고 했는데 지금 코로나 시점에 입원하는 게 더 무서운 생각이 들어서 손해를 보더라도
어~ 통근으로 했죠 그래서,어~ 통근으로 했죠 그래서
어~ 한 반 정도 밖에 안 나왔다고 봐야죠.,어~ 한 반 정도 밖에 안 나왔다고 봐야죠.
그래 하루 통원 치료비가 십만 원이다 보니까 적었구나 그래 그런 데다가 통을 하면서 상당히 큰 금액이 나오다 보니까 반밖에 안 나왔는데,그래 하루 통원 치료비가 십만 원이다 보니까 적었구나 그래 그런 데다가 통을 하면서 상당히 큰 금액이 나오다 보니까 반밖에 안 나왔는데
그래 엔날에 실손 넣은 보험들이 보면은 하루,그래 옛날에 실손 넣은 보험들이 보면은 하루
통근 통원비가 십만 원이 최고치고 요즘에는 이십 만 원 삼십 만 원 그리 나가드라 이모도 십만 원밖에 안 나오니까,통근 통원비가 십만 원이 최고치고 요즘에는 이십 만 원 삼십 만 원 그렇게 나가더라 이모도 십만 원밖에 안 나오니까
그래서 이모는 적절하게 잘 그거 활용을 해갖고,그래서 이모는 적절하게 잘 그거 활용을 해갖고
어~ 병원에서도 여섯 시간만 지나면 입원으로 해줘.,어~ 병원에서도 여섯 시간만 지나면 입원으로 해줘.
그는 우리가 일본상 일반상식으로 쫌 알고 갔으면 좋겠드라고,그거는 우리가 일본상 일반상식으로 조금 알고 갔으면 좋겠더라고
닝걸 맞으면 우리 보통 보면은 두서너 시간 가잖아.,닝걸 맞으면 우리 보통 보면은 두서너 시간 가잖아.
그기서 쪼꼼 더 내가 병원에 있으면 그기 여섯 시간을,거기서 쪼꼼 더 내가 병원에 있으면 거기 여섯 시간을
기본으로 해갖고 입원으로 해주니까 그런 거 그런 지식은 쪼꼼 알고 있으면은,기본으로 해갖고 입원으로 해주니까 그런 거 그런 지식은 쪼꼼 알고 있으면은
우리가 보험 넣어가지고 혜택 보기 위해서 보험 넣었잖아 다 안 나오니까 서운치,우리가 보험 넣어가지고 혜택 보기 위해서 보험 넣었잖아 다 안 나오니까 서운치
이모는 적절하게 잘 그걸 밀당을 잘해가지고,이모는 적절하게 잘 그걸 밀당을 잘해가지고
가급지면 내가 넣은 걸 혜택을 많이 볼려고 하는 그기인데,가급지면 내가 넣은 걸 혜택을 많이 볼려고 하는 그거인데
그~ 쫌 또 내가 그~ 엄마로 통해가지고 거를 넣어놓면 마음이 든든해.,그~ 조금 또 내가 그~ 엄마로 통해가지고 거를 넣어놓면 마음이 든든해.
그래 엄마는 물론 보험이 없어가지고 입원하면서 돈은 좀 많이 들었지마는,그래 엄마는 물론 보험이 없어가지고 입원하면서 돈은 좀 많이 들었지마는
다행스럽게도 또 동생이 회사에서 삼십 프로가 노오드라고 보니까,다행스럽게도 또 동생이 회사에서 삼십 프로가 나오더라고 보니까
쓴 금액에 그래서 음~,쓴 금액에 그래서 음~
형제들끼리 잘 의논해가지고,형제들끼리 잘 의논해가지고
어~ 병원비는 해결했는데 지금은,어~ 병원비는 해결했는데 지금은
이제 병이 있다 보니까 보험은 아예,이제 병이 있다 보니까 보험은 아예
못 넣는다고 봐야죠.,못 넣는다고 봐야죠.
에~ 미리미리 넣는 게 참 좋지마는,에~ 미리미리 넣는 게 참 좋지마는
어~ 자식 키우고 어~,어~ 자식 키우고 어~
부모 용돈 드리고 이렇게 하면서,부모 용돈 드리고 이렇게 하면서
우리 스스로 보험을 넣는다는 건 참 버거운 일이드라고요.,우리 스스로 보험을 넣는다는 건 참 버거운 일이더라고요.
게서 항상 부족하게 넣을 수밖에 없는 게 현실이라고 생각,게서 항상 부족하게 넣을 수밖에 없는 게 현실이라고 생각
그~ 내가 인자 그~ 보니까 보험은 장기성이잖아 그지?,그~ 내가 인제 그~ 보니까 보험은 장기성이잖아 그지?
그랑께 니가 쪼금 전에 얘기한 것처럼,그러니까 니가 쪼금 전에 얘기한 것처럼
어~ 적절하게 넣는 거기 참 좋은데,어~ 적절하게 넣는 거기 참 좋은데
이모는 지끔에 어~ 현재 보면은 끝난 게 한 서너 개 정도 돼.,이모는 지금에 어~ 현재 보면은 끝난 게 한 서너 개 정도 돼.
그래데 옛날에 넣다 보니까 참 금액들이 소금액이라서 그래서 지끔 그기,그래데 옛날에 넣다 보니까 참 금액들이 소금액이라서 그래서 지금 그게
양에 안 차더라고 보니까 내가 그~ 보험 상품을 좋아해서 그런지 몰라도 그래서,양에 안 차더라고 보니까 내가 그~ 보험 상품을 좋아해서 그런지 몰라도 그래서
상당히 쫌 힘 음~ 길드라도 난중에 가면 쪼꼼 힘들지,상당히 조금 힘 음~ 길더라도 난중에 가면 쪼꼼 힘들지
있지마는 힘들겠지마는,있지마는 힘들겠지마는
다시 내가 시작한 기 한 서너 개 돼 엄마로 인해가지고 뇌경색,다시 내가 시작한 게 한 서너 개 돼 엄마로 인해가지고 뇌경색
암보험 요즘 뭐~ 세 명 중에 한 사람이 암이라니까,암보험 요즘 뭐~ 세 명 중에 한 사람이 암이라니까
그런 걸 넣어놓고 보니까 쪼꼼 마음이 든든하고 쫌 뭐라 해야 돼 자식들한테 폐를 덜 끼치지 않을까 싶어서 그렇더라고 그래 인생사는 거 뭐~,그런 걸 넣어놓고 보니까 쪼꼼 마음이 든든하고 조금 뭐라 해야 돼 자식들한테 폐를 덜 끼치지 않을까 싶어서 그렇더라고 그래 인생사는 거 뭐~
별것 아닌데 길지 길다면 길고 짧다면 짧은데,별것 아닌데 길지 길다면 길고 짧다면 짧은데
혹시 또 나로 인해 우리 나는 이모는 아들만 둘이잖아.,혹시 또 나로 인해 우리 나는 이모는 아들만 둘이잖아.
그러다 보니까 뭐~ 어딘가 모르게 내가 아파도,그러다 보니까 뭐~ 어딘가 모르게 내가 아파도
남자들은 신경을 쫌 들 쓰기 때문에 내 나름대로 내가 쫌 무언가,남자들은 신경을 조금 덜 쓰기 때문에 내 나름대로 내가 조금 무언가
채워놔야 되겠다는 생각으로 그래 했는데 그래 뭐~ 쫌,채워놔야 되겠다는 생각으로 그렇게 했는데 그래 뭐~ 조금
장기간 들어가야 되니까 걱정은 돼 왜 나이가 인자 지끔 있고,장기간 들어가야 되니까 걱정은 돼 왜 나이가 인제 지금 있고
현재 직업을 가지고 있지마는 언제까지 갈련 지는 모르겠고,현재 직업을 가지고 있지마는 언제까지 갈련 지는 모르겠고
또 내가 만약에 돈을 안 벌일 때는 이걸 과연 차고 나올까 싶은 그런 것도 생각은 들어 그~ 지끔,또 내가 만약에 돈을 안 벌일 때는 이걸 과연 차고 나올까 싶은 그런 것도 생각은 들어 그~ 지금
현재 어~ 어~,현재 어~ 어~
상당히 여유로운데도 부족하 어~,상당히 여유로운데도 부족하 어~
난중에 들어갈 기 걱정스럽다는데 지끔 나도,난중에 들어갈 게 걱정스럽다는데 지금 나도
어~ 한 지끔 애들 거까지 다 차고 나오는 기 보험료가 한 사오십만 원 들어가.,어~ 한 지금 애들 거까지 다 차고 나오는 게 보험료가 한 사오십만 원 들어가.
긍게 상당히 걱정은 돼.,긍게 상당히 걱정은 돼.
난중에 연금 나오면은 진짜 보험료 내고 나면은,난중에 연금 나오면은 진짜 보험료 내고 나면은
지끔 현재도 연금을 받지마는 연금 그글 가지고 보험료 다 내고 나면은,지금 현재도 연금을 받지마는 연금 그걸 가지고 보험료 다 내고 나면은
과연 생활비는 한 음~ 사십 만 원 정도밖에 안 남는데,과연 생활비는 한 음~ 사십 만 원 정도밖에 안 남는데
그기 내가,그게 내가
잘한 짓인지는 모르겠지만 난중에는 난중 일이고,잘한 짓인지는 모르겠지만 난중에는 난중 일이고
그래서 나도 생각을 해긴 했는데 보험상품 길기 때문에,그래서 나도 생각을 해긴 했는데 보험상품 길기 때문에
쪼끔 신중히 하기는 해야 되겠다 싶은 생각이 들어.,쪼끔 신중히 하기는 해야 되겠다 싶은 생각이 들어.
그런 어~ 항상 우리가 건강관리는 잘해가면서,그런 어~ 항상 우리가 건강관리는 잘해가면서
그래 어~ 지내도록 한번 해보자,그래 어~ 지내도록 한번 해보자
그래도 어~ 아들이 인자 고이 때 쫌,그래도 어~ 아들이 인제 고이 때 조금
아파가지고 지금,아파가지고 지금
그~ 고일 때 보험을 넣어가지 성인보험을  다행스럽게 넣어가지구,그~ 고일 때 보험을 넣어가지 성인보험을  다행스럽게 넣어가지구
다행이다는 생각은 하는데,다행이다는 생각은 하는데
그렇다고 그~ 보험금으로 탈 수 있는 게 있고 없는 게 있더라고,그렇다고 그~ 보험금으로 탈 수 있는 게 있고 없는 게 있더라고
그래서 보험은 적당한 선에서 넣는 게 좋고,그래서 보험은 적당한 선에서 넣는 게 좋고
그리고 신랑 같은 경우에도 요즘에,그리고 신랑 같은 경우에도 요즘에
나이가 들다 보니까 혈압이 오고,나이가 들다 보니까 혈압이 오고
그~ 몇 달 전부터 요 혈압약을 먹더라고 그~ 보,그~ 몇 달 전부터 요 혈압약을 먹더라고 그~ 보
혈압약 먹으면서 계속 혈압을 아침마다 재니까 난 그 보니까 좀 불안하더라고,혈압약 먹으면서 계속 혈압을 아침마다 재니까 난 그 보니까 좀 불안하더라고
아~ 저 약이 지금 안 듣는 거 아닌가?,아~ 저 약이 지금 안 듣는 거 아닌가?
아~ 자기한테 맞나 이런 생각도 들고 에~,아~ 자기한테 맞나 이런 생각도 들고 에~
약을,약을
약하게 지어서 지금 잡는 중이라는 말을 하드라 세게 하면은 금방 잡지만은,약하게 지어서 지금 잡는 중이라는 말을 하더라 세게 하면은 금방 잡지만은
요즘에 백세 시대에 세게 짓는 거보다 약하게 해가지고 천천히 이거,요즘에 백세 시대에 세게 짓는 거보다 약하게 해가지고 천천히 이거
