사투리,표준어
제가 다이어트하는 거는 아무것도 아니구나 이런 생각을 했었었고?,제가 다이어트하는 거는 아무것도 아니구나 이런 생각을 했었었고?
어~ 그리고 최근에 나 혼자 산다 보니까,어~ 그리고 최근에 나 혼자 산다 보니까
그~ 패션쇼도 많이 코로나 때문에 없어져 가지고,그~ 패션쇼도 많이 코로나 때문에 없어져 가지고
모델 한혜진이 자기가 백 벌 입기 도전했더라고요.,모델 한혜진이 자기가 백 벌 입기 도전했더라고요.
그래서 한국에,그래서 한국에
그~ 별로 유명하지 않은 디자이너들이 만든 옷을,그~ 별로 유명하지 않은 디자이너들이 만든 옷을
한 디자이너당 옷을 한두 벌에서 어 세 벌까지 받아가지고?,한 디자이너당 옷을 한두 벌에서 어 세 벌까지 받아가지고?
총 한 사십에서 오십 개 브랜드를,총 한 사십에서 오십 개 브랜드를
그~ 자기 지인들이랑 함께 무료로 그니까 무료 노동해서 찍어서?,그~ 자기 지인들이랑 함께 무료로 그러니까 무료 노동해서 찍어서?
그~ 나 혼자 산다 유튜브 계정에 올렸더라고요.,그~ 나 혼자 산다 유튜브 계정에 올렸더라고요.
그래서 그게 한 오 분인가?,그래서 그게 한 오 분인가?
별로 길지 않았는데 되게 재밌게 본 기억이 있어요.,별로 길지 않았는데 되게 재밌게 본 기억이 있어요.
어~ 혹시 공연에 대해서 더 해주실 얘기가 있으신가요?,어~ 혹시 공연에 대해서 더 해주실 얘기가 있으신가요?
제가 공연을 좋아하는 이유는,제가 공연을 좋아하는 이유는
그 무대 위에서 열심히 하는 사람들을 볼 수 있기 때문인데요.,그 무대 위에서 열심히 하는 사람들을 볼 수 있기 때문인데요.
그 사람들이 그 공연을 위해서,그 사람들이 그 공연을 위해서
얼마나 많이 연습을 하고 노력을 했을까라는 그 느낌이 저한테까지 와닿아요.,얼마나 많이 연습을 하고 노력을 했을까라는 그 느낌이 저한테까지 와닿아요.
그래서 저도 굉장히 좀 힘든 시기가 있었고 뭐~ 자리를 잡기가 뭐~ 어렵다 이런 생각이 들었을 때,그래서 저도 굉장히 좀 힘든 시기가 있었고 뭐~ 자리를 잡기가 뭐~ 어렵다 이런 생각이 들었을 때
공연을 보면 그분들이 내뿜는 그런 에너지 덕분에 저도 같이 에너지를 받고?,공연을 보면 그분들이 내뿜는 그런 에너지 덕분에 저도 같이 에너지를 받고?
그리고 정말 하 이 곡 하나를 연주하기 위해서 아니면 이 극을 소화하기 위해서?,그리고 정말 하 이 곡 하나를 연주하기 위해서 아니면 이 극을 소화하기 위해서?
얼마나 진짜 노력을 하고 연습을 했을까,얼마나 진짜 노력을 하고 연습을 했을까
그 뒤로 그 사람들에 열정이라던가 노력 이런 게 보여서,그 뒤로 그 사람들에 열정이라던가 노력 이런 게 보여서
저도 동시에 감동을 받 더 같 더 받는 거 같습니다.,저도 동시에 감동을 받 더 같 더 받는 거 같습니다.
그래서 저도 그런 공연을 보는 이유가,그래서 저도 그런 공연을 보는 이유가
물론 뭐~ 음악을 좋아하고 뭐~ 몰입을 할 수 있어서 좋기는 좋은 것도 있지만,물론 뭐~ 음악을 좋아하고 뭐~ 몰입을 할 수 있어서 좋기는 좋은 것도 있지만
그 사람들의 에너지를 제가 되려 받아 가는 느낌이고요.,그 사람들의 에너지를 제가 되려 받아 가는 느낌이고요.
오히려 그~ 연극하시거나 그~ 연주를 하시는 분들은?,오히려 그~ 연극하시거나 그~ 연주를 하시는 분들은?
관객들의 환호 덕분에 더 힘이 난다고 하더라고요.,관객들의 환호 덕분에 더 힘이 난다고 하더라고요.
그래서 서로가 굉장히 좀  윈윈하는 그런 관계인 거 같아서 제가 공연을 좋아하는 이유이기도 합니다.,그래서 서로가 굉장히 좀  윈윈하는 그런 관계인 거 같아서 제가 공연을 좋아하는 이유이기도 합니다.
그래서 혹시 공연을 보고 감동을 받으신 적 있으신가요?,그래서 혹시 공연을 보고 감동을 받으신 적 있으신가요?
아~ 네 저는 그~ 친구가 의상학과일 때,아~ 네 저는 그~ 친구가 의상학과일 때
자기가 패션쇼를 그 학과 사람들이랑 한 적이 있어요.,자기가 패션쇼를 그 학과 사람들이랑 한 적이 있어요.
그때 맨날 밤 새서 학교에서 옷을 만들어가지고 교수님이 맨날 이건 아니라고 한대요.,그때 맨날 밤 새서 학교에서 옷을 만들어가지고 교수님이 맨날 이건 아니라고 한대요.
그래서 재료비도 많이 들고 시간도 많이 들고 거의 다 만든 옷을,그래서 재료비도 많이 들고 시간도 많이 들고 거의 다 만든 옷을
다시 새로 만들어야 하기도 하고?,다시 새로 만들어야 하기도 하고?
그게 굉장히 힘들다고 했었는데,그게 굉장히 힘들다고 했었는데
그~ 패션쇼를 보고 마지막에 그~ 같은 과 사람들이 한 이삼십 명 되는 거 같은데?,그~ 패션쇼를 보고 마지막에 그~ 같은 과 사람들이 한 이삼십 명 되는 거 같은데?
워킹을 이렇게 한 번씩 하거든요?,워킹을 이렇게 한 번씩 하거든요?
어~ 그때 몇 명은 너무 힘들어서 울기도 하고 막,어~ 그때 몇 명은 너무 힘들어서 울기도 하고 막
그거를 보고 좀,그거를 보고 좀
아~ 패션쇼가 진짜 자기 힘든 힘들게 막 며칠 몇 달이 걸려서 만든 옷인데?,아~ 패션쇼가 진짜 자기 힘든 힘들게 막 며칠 몇 달이 걸려서 만든 옷인데?
이렇게 몇 초만 보여주는 게 되게 아쉽다.,이렇게 몇 초만 보여주는 게 되게 아쉽다.
어~ 그리고 되게 친구가 힘들게 만든 옷인데 좀 멋있게,어~ 그리고 되게 친구가 힘들게 만든 옷인데 좀 멋있게
모델들이 입고 나와주니까,모델들이 입고 나와주니까
그게 좀 감동적이었던 거 같애요.,그게 좀 감동적이었던 거 같애요.
그리고 그 뒤로 저도 옷을 볼 때 약간 그~ 디자이너가 누군지?,그리고 그 뒤로 저도 옷을 볼 때 약간 그~ 디자이너가 누군지?
그리고 다른 옷이랑 다르게 어떤 디테일이 있는지,그리고 다른 옷이랑 다르게 어떤 디테일이 있는지
그런 거에 더 관심을 갖게 된 거 같애요.,그런 거에 더 관심을 갖게 된 거 같애요.
그리고 디자이너 브랜드 같은 건 옷이 솔직히,그리고 디자이너 브랜드 같은 건 옷이 솔직히
대량생산하는 옷에 비해서 너무 비싸잖아요.,대량생산하는 옷에 비해서 너무 비싸잖아요.
그래서 그것도 좀 이해가 갔었고?,그래서 그것도 좀 이해가 갔었고?
앞으로는 저도 그~ 개인의 브랜드를 더 알아갈려고 노력하는 중이에요.,앞으로는 저도 그~ 개인의 브랜드를 더 알아갈려고 노력하는 중이에요.
아~ 그리고 제가 최근에 또 유튜브로?,아~ 그리고 제가 최근에 또 유튜브로?
본 공연 중에 기억에 남는 게,본 공연 중에 기억에 남는 게
제 친척 언니가 유튜브를 하거든요 거기서 자기 아들이 유치원생이에요.,제 친척 언니가 유튜브를 하거든요 거기서 자기 아들이 유치원생이에요.
집에서 항상 걔가 공연을 하거든요 노래하는 걸 좋아해가지고,집에서 항상 걔가 공연을 하거든요 노래하는 걸 좋아해가지고
그래서 팔로우는 한 이삼십 명밖에 없지만,그래서 팔로우는 한 이삼십 명밖에 없지만
어~ 그거를 되게 흥미롭게 보고 있는 편이에요.,어~ 그거를 되게 흥미롭게 보고 있는 편이에요.
