사투리,표준어
나 예전에,나 예전에
알바로 많이 할 수밖에 없었는데 왜냐면은 나는 어렸을 때부터 용돈이,알바로 많이 할 수밖에 없었는데 왜냐면은 나는 어렸을 때부터 용돈이
쪼금 부족해가지고 엄마가 용돈도 안 주기도 하고 그래서 그랬는데,쪼금 부족해가지고 엄마가 용돈도 안 주기도 하고 그래서 그랬는데
엄마가 이제 용돈을 안 주다 보니까 내가 알바를 찾아서 할 수밖에 없었어.,엄마가 이제 용돈을 안 주다 보니까 내가 알바를 찾아서 할 수밖에 없었어.
그래서 알바를 찾다 보니까 첫알바가 이제,그래서 알바를 찾다 보니까 첫알바가 이제
저기 우리 동네에 에서,저기 우리 동네에 에서
닭 튀기면서 막 엄청,닭 튀기면서 막 엄청
첫알바치고는 되게 괜찮았지 솔직히,첫알바치고는 되게 괜찮았지 솔직히
처음 알바는 아닌데 젤 처음이라고 생각하면은,처음 알바는 아닌데 젤 처음이라고 생각하면은
그게 쫌 정상적인 알바 같고,그게 조금 정상적인 알바 같고
원래 했던 알바보단 일인데 일은 이제 상하차를 먼저 했지.,원래 했던 알바보단 일인데 일은 이제 상하차를 먼저 했지.
원래 택배 상하차도 하다가,원래 택배 상하차도 하다가
거기 컨테이너 상하차로 넘어갔는데 컨테이너 상하차하다 보니까,거기 컨테이너 상하차로 넘어갔는데 컨테이너 상하차하다 보니까
거기 사람들도 너무 좋고 일도 힘들긴 한데,거기 사람들도 너무 좋고 일도 힘들긴 한데
적당히 할 만해서  가서 일했는데 게 처음에,적당히 할 만해서  가서 일했는데 게 처음에
하단에서 그~ 버스 타고 갈 때는 진짜 내 어디 팔려 가는 기분 이대?,하단에서 그~ 버스 타고 갈 때는 진짜 나 어디 팔려 가는 기분 이대?
으 완전 뭐냐 저,으 완전 뭐냐 저
염전 염전 노예 된 줄 알았그든 그래서 가가지고,염전 염전 노예 된 줄 알았거든 그래서 가가지고
거기서 이제 컨테이너 상하차로 가서 거기다 이제,거기서 이제 컨테이너 상하차로 가서 거기다 이제
어떻게 하면은 박스를 잘 쌓는지 잘 배웠고,어떻게 하면은 박스를 잘 쌓는지 잘 배웠고
거기서 이제 제일 내가 막내였어가지고 스무 살 때 갔으니까 막내여서 거기서,거기서 이제 제일 내가 막내였어가지고 스무 살 때 갔으니까 막내여서 거기서
모든 사람들이 날 이~ 뭐지 좋게 봤지 그래서,모든 사람들이 날 이~ 뭐지 좋게 봤지 그래서
그분들 덕분에 내가 쫌 재밌게 일할 수 있었고 거기 밥이 또 맛있었던 기억이 나네.,그분들 덕분에 내가 조금 재밌게 일할 수 있었고 거기 밥이 또 맛있었던 기억이 나네.
그래서 맨날 식당 아주머니가 맨날 우리들 아껴주시고 그랬었는데 우리가,그래서 맨날 식당 아주머니가 맨날 우리들 아껴주시고 그랬었는데 우리가
아~ 내가 되게 싹싹하게 맛있다 그래가지고,아~ 내가 되게 싹싹하게 맛있다 그래가지고
아주머니 계속 나한테  하나 더 주실려고 그랬었어.,아주머니 계속 나한테  하나 더 주실려고 그랬었어.
그다음에 이제 또 내 친구들 불러가지고 친구랑 같이 갔는데 친구도 밥 맛있다 하고,그다음에 이제 또 내 친구들 불러가지고 친구랑 같이 갔는데 친구도 밥 맛있다 하고
거기 패턴도 괜찮아가지고,거기 패턴도 괜찮아가지고
거기서 일하고 돈을 그때 쫌 많이 벌어서 왔었지 그때 그러고 열심히 놀았지.,거기서 일하고 돈을 그때 조금 많이 벌어서 왔었지 그때 그러고 열심히 놀았지.
스무 살 였으니까 이제 고삐 풀린 놈처럼 이제 열심히 놀고 미친 듯이 술 먹고,스무 살 였으니까 이제 고삐 풀린 놈처럼 이제 열심히 놀고 미친 듯이 술 먹고
이케 놀았던 기억이 있네 니는 젤 처음 알바가 뭐였는데 한 적 있나?,이렇게 놀았던 기억이 있네 너는 젤 처음 알바가 뭐였는데 한 적 있니?
나도 옛날에 그~ 처음했었을 때가  &company-name1& 알바를 해봤는데,나도 옛날에 그~ 처음했었을 때가  &company-name1& 알바를 해봤는데
아~ 그때 딱 들어가서 나는 뭐~ 이게 뭐~ 어떻게 진행되고 막 그런 거는 잘 모르니까,아~ 그때 딱 들어가서 나는 뭐~ 이게 뭐~ 어떻게 진행되고 막 그런 거는 잘 모르니까
게서 뭐~ 그냥 뭐~ 소개해준 사람한테,게서 뭐~ 그냥 뭐~ 소개해준 사람한테
이제 물어봤지 뭘 어떻게 해야 되냐 그래서 잘 알려주시더라고,이제 물어봤지 뭘 어떻게 해야 되냐 그래서 잘 알려주시더라고
같이 일했던 사람이 위에 형 세 명,같이 일했던 사람이 위에 형 세 명
아~ 원래 일하던 사람이 두 명이고,아~ 원래 일하던 사람이 두 명이고
또 다른 한 명의 또 사람이 있었는데 그 사람이 쪼끔,또 다른 한 명의 또 사람이 있었는데 그 사람이 쪼끔
쪼끔 쫌 어리벙벙해.,쪼끔 조금 어리벙벙해.
그래가지고 딱 들어가서 나는 배워야 되는데,그래가지고 딱 들어가서 나는 배워야 되는데
아~ 이건 이렇게 마 해야 되고 이렇게 해야 되고 이렇게 하면 됩니다.,아~ 이건 이렇게 마 해야 되고 이렇게 해야 되고 이렇게 하면 됩니다.
자 다른 메뉴 이렇게 하고 이래이래이래됩니다 막 이라는데,자 다른 메뉴 이렇게 하고 이래이래이래됩니다 막 이라는데
모르지 나는 당연히 안 해봤으니까,모르지 나는 당연히 안 해봤으니까
게 나는 최대한 그냥 막 이제 들으면서 숙지하고 할려고 했지.,게 나는 최대한 그냥 막 이제 들으면서 숙지하고 할려고 했지.
자 그러는데 주방 내가 그때 있었던 데가 주방이었었거든?,자 그러는데 주방 내가 그때 있었던 데가 주방이었었거든?
주방에서 하는데 네 명까지가 필요 있는지는 모르겠어.,주방에서 하는데 네 명까지가 필요 있는지는 모르겠어.
그래서 동선이 자꾸 겹치고 하는 거야 그래서 그러지,그래서 동선이 자꾸 겹치고 하는 거야 그래서 그러지
뭐~ 그 어리벙벙한 그 사람은 사장님한테 이~ 또 짤리고,뭐~ 그 어리벙벙한 그 사람은 사장님한테 이~ 또 잘리고
그~ 나는 뭐~ 며칠 계속하다가 이제 그~ 이제 세 명이서 했다?,그~ 나는 뭐~ 며칠 계속하다가 이제 그~ 이제 세 명이서 했다?
그라고 또 소개해준 친구한테도 도움을 쪼금 받고 해가지고 했다.,그리고 또 소개해준 친구한테도 도움을 쪼금 받고 해가지고 했다.
그래 딱 하는데 거기서 이제 손님이 없을 때,그래 딱 하는데 거기서 이제 손님이 없을 때
감자튀김을 이케 만들어 가지고 남는 거를 이~ 먹을 수 있다는 거야.,감자튀김을 이렇게 만들어 가지고 남는 거를 이~ 먹을 수 있다는 거야.
그래서 나는 그때 철이 없고 나는 아직 뭐~,그래서 나는 그때 철이 없고 나는 아직 뭐~
생각도 성인이 아직 안 됐으니까 이건 뭐~ 변명이지만,생각도 성인이 아직 안 됐으니까 이건 뭐~ 변명이지만
뭐~ 그래서 쪼금 짧은 생각에,뭐~ 그래서 쪼금 짧은 생각에
어~ 감자튀김을 먹을 수 있대 어~ 그래 좋아했다 이~ 친구하고 만들어 먹었다?,어~ 감자튀김을 먹을 수 있대 어~ 그래 좋아했다 이~ 친구하고 만들어 먹었다?
그래갖고 이제 뭐~ 있으면 고냥 뭐~ 내 것 마냥 이렇게 쪼끔씩 먹고 했지.,그래갖고 이제 뭐~ 있으면 고냥 뭐~ 내 것 마냥 이렇게 쪼끔씩 먹고 했지.
이제 그렇게 하다가 이제 또 친구들 오면,이제 그렇게 하다가 이제 또 친구들 오면
또 하나씩 그냥 줘도 된대.,또 하나씩 그냥 줘도 된대.
아~ 뭐~ 싸이버거 세트 이런 거 걍 줘도 된대.,아~ 뭐~ 싸이버거 세트 이런 거 그냥 줘도 된대.
주고 퇴근할 때마다 항상 그~ 남는 그 치킨 같은 거,주고 퇴근할 때마다 항상 그~ 남는 그 치킨 같은 거
치킨이나 버거 같은 거를 항상  가지고 가라는 거야.,치킨이나 버거 같은 거를 항상  가지고 가라는 거야.
그래서 와 나는  태어나면서 이렇게,그래서 와 나는  태어나면서 이렇게
패스트푸드를 많이 먹 본 적이 없는데,패스트푸드를 많이 먹 본 적이 없는데
아~ 그 짧은 기간 내에 몸에 안 좋은 거를 억수로 먹는 거야.,아~ 그 짧은 기간 내에 몸에 안 좋은 거를 엄청 먹는 거야.
그래서 맨날 집에 치킨 사가고 막 이러는 거야.,그래서 맨날 집에 치킨 사가고 막 이러는 거야.
그래서 와 그~ 남한테 말하면 이게,그래서 와 그~ 남한테 말하면 이게
남들은 엄청 부러워해.,남들은 엄청 부러워해.
쫌 부러워하고 근데 나는 내 같아도 솔직히 부러워했을 것 같애 근데,조금 부러워하고 근데 나는 나 같아도 솔직히 부러워했을 것 같애 근데
보니까 와 이게 부대끼드라고 속이,보니까 와 이게 부대끼더라고 속이
아무튼 뭐~ 첫알바는 뭐~ &company-name1& 그렇게 했지.,아무튼 뭐~ 첫알바는 뭐~ &company-name1& 그렇게 했지.
하고 뭐~ 니 같은 경우는 뭐~ 다른 거 알바한 적 있나?,하고 뭐~ 네 같은 경우는 뭐~ 다른 거 알바한 적 있니?
내 같은 경우에는 알바 많이 다녔는데,나 같은 경우에는 알바 많이 다녔는데
니도 알다시피 내 용돈 많이 안 받으니까 알바 많이 한 거 안다 아이가 그래서,너도 알다시피 나 용돈 많이 안 받으니까 알바 많이 한 거 알지 않니 그래서
&company-name1&도 했었고 그다음에 이제 군입대하고 난 다음에 갔다 와서,&company-name1&도 했었고 그다음에 이제 군입대하고 난 다음에 갔다 와서
시작한 게 뭐냐.,시작한 게 뭐냐.
스키 강사해가 했거든,스키 강사해가 했거든
거기가 제일 추억이 많은 것 같다.,거기가 제일 추억이 많은 것 같다.
스키강사를 왜 들었갔냐면은,스키강사를 왜 들었갔냐면은
처음에 군대 전역하고 나와서 알바를 구할라고 했는데 알바 구할 때가 없는 거라.,처음에 군대 전역하고 나와서 알바를 구할려고 했는데 알바 구할 때가 없는 거라.
뽑아주는 데가 없어가지고 그 시기가 그래서,뽑아주는 데가 없어가지고 그 시기가 그래서
알바를 못 구하겠어서 찾아본 게 스키장이었는데 스키장 쪽에 강사 구한다고 돼 있대?,알바를 못 구하겠어서 찾아본 게 스키장이었는데 스키장 쪽에 강사 구한다고 돼 있대?
근데 그런 경험이 없어도 괜찮다 그래가지고 가봤드만,근데 그런 경험이 없어도 괜찮다 그래가지고 가봤더니만
거기에서 이제 숙식 다 해결되고,거기에서 이제 숙식 다 해결되고
돈도 괜찮게 주길래 막상 갔드만,돈도 괜찮게 주길래 막상 갔더니만
돈은 실상은 그렇지 않고 그다음에,돈은 실상은 그렇지 않고 그다음에
거기 안에 있는 사람들도 쫌 최악이었고,거기 안에 있는 사람들도 조금 최악이었고
하지만 진짜,하지만 진짜
군대 갔다 왔으니까 내가 이거 하나 못 버티겠나 하는 생각이 들어가지고 버텼는데,군대 갔다 왔으니까 내가 이거 하나 못 버티겠나 하는 생각이 들어가지고 버텼는데
그때 알바했을 때 맨날 강습을 한 번 뛰고 오면은,그때 알바했을 때 맨날 강습을 한 번 뛰고 오면은
돈을 얼마 주지도 않았으면서?,돈을 얼마 주지도 않았으면서?
그날 강습을 많이 한 애가 이제 그날 술을 사야 됐었거든,그날 강습을 많이 한 애가 이제 그날 술을 사야 됐었거든
그래서 매일매일 술을 먹어야 됐고 나는 먹기 싫고 그냥 자고 싶은데도,그래서 매일매일 술을 먹어야 됐고 나는 먹기 싫고 그냥 자고 싶은데도
그렇게 맨날 그렇게 돼서 어쩔 수 없이,그렇게 맨날 그렇게 돼서 어쩔 수 없이
일을 하다가 거기서 또,일을 하다가 거기서 또
강습을 나가면은 거기 강습하러 올라가는데 오르막길인데,강습을 나가면은 거기 강습하러 올라가는데 오르막길인데
차를 이제 또 수동인데 스키부츠 신고 타고 올라가고,차를 이제 또 수동인데 스키부츠 신고 타고 올라가고
그다음에 오토바이 타고 올라가서 눈 덮힌 거기 도로를,그다음에 오토바이 타고 올라가서 눈 덮힌 거기 도로를
오토바이 타고 어깨에다가,오토바이 타고 어깨에다가
오토바 뭐지 그~ 스키만 메고 올라가가지고 참,오토바 뭐지 그~ 스키만 메고 올라가가지고 참
그때 강습하는 데도 데 뭐 하는 짓인지 모르겠단 싶은 생각이었다.,그때 강습하는 데도 데 뭐 하는 짓인지 모르겠단 싶은 생각이었다.
아무튼 강습하면서 이제 좋았던 거는 이제 사람들이,아무튼 강습하면서 이제 좋았던 거는 이제 사람들이
스키를 아예 못 탔었는데 내가 가르쳐 줘서 스키를 쫌 타니까,스키를 아예 못 탔었는데 내가 가르쳐 줘서 스키를 조금 타니까
그 점에 있어서 난 좀 되게 감동스럽드라고?,그 점에 있어서 난 좀 되게 감동스럽더라고?
되게 뭐~ 보람이 차다 해야 되나 보람이 찼고,되게 뭐~ 보람이 차다 해야 되나 보람이 찼고
그다음에 마음 맞은 사람들을 가르치면은 쪼끔 더 효 성 능률이 좋고,그다음에 마음 맞은 사람들을 가르치면은 쪼끔 더 효 성 능률이 좋고
잘 배우니까 같이 즐겁드라고,잘 배우니까 같이 즐겁더라고
그래서 쫌,그래서 조금
더 해보고 싶은 생각이 더 들었고,더 해보고 싶은 생각이 더 들었고
이제 보드도 강습을 하다 보니까 내가 이제 타 보드 타는 게 너무 즐거워져가지고,이제 보드도 강습을 하다 보니까 내가 이제 타 보드 타는 게 너무 즐거워져가지고
보드를 하루종일 타고 내려오 싶다 생각도 했고,보드를 하루종일 타고 내려오 싶다 생각도 했고
그렇게 해서 타고 이제 어머니들도 알려드리고 했는데 어머니들은,그렇게 해서 타고 이제 어머니들도 알려드리고 했는데 어머니들은
뭐지 내가 제일 젊은 남자 강사니까 좋아하시더라고?,뭐지 내가 제일 젊은 남자 강사니까 좋아하시더라고?
그래서 도와드리고,그래서 도와드리고
팁도 처음으로 받아보고 그러면서,팁도 처음으로 받아보고 그러면서
어~ 맛있는 것도 한 번씩 얻어먹고,어~ 맛있는 것도 한 번씩 얻어먹고
그리고 나서는 이제 어~ 이제,그리고 나서는 이제 어~ 이제
스키 강습을 하다 보면 외국인 손님도 있는데 외국인 손님이 이제,스키 강습을 하다 보면 외국인 손님도 있는데 외국인 손님이 이제
홍콩에서 온 사람이었는데 영어가 영어로만 대화가 가능해서,홍콩에서 온 사람이었는데 영어가 영어로만 대화가 가능해서
하여튼 다른 가게에서 나를 필요로 해가지고 가가지고 영어로 강습을 했지.,하여튼 다른 가게에서 나를 필요로 해가지고 가가지고 영어로 강습을 했지.
그 사람이 그래서 강습 끝나고 난 다음에 다음에 홍콩 오면 연락하라고 이케 전화번호 남기고 갔었지.,그 사람이 그래서 강습 끝나고 난 다음에 다음에 홍콩 오면 연락하라고 이렇게 전화번호 남기고 갔었지.
그이 또 엄청 추억이었고,그이 또 엄청 추억이었고
데 돈은 생각보다 많이 못 벌어서 쫌 아쉬웠지.,데 돈은 생각보다 많이 못 벌어서 조금 아쉬웠지.
재미는 있었는데 내가 그만큼 재미를 돈으로 더 쓰고 온 느낌이랄까?,재미는 있었는데 내가 그만큼 재미를 돈으로 더 쓰고 온 느낌이랄까?
갔다 왔을 땐 별로 돈을 못 벌고 왔다는 생각이 들 정도였다.,갔다 왔을 땐 별로 돈을 못 벌고 왔다는 생각이 들 정도였다.
왜냐면은 그~ 중간중간에 상이 많았어 가지고 우리 할아버지 돌아가시고,왜냐면은 그~ 중간중간에 상이 많았어 가지고 우리 할아버지 돌아가시고
내 친구도 한 명 그 사고로 죽어가지고,내 친구도 한 명 그 사고로 죽어가지고
그래서 일하다가도 주 두 번 내려오고 했었는데,그래서 일하다가도 주 두 번 내려오고 했었는데
그거 때문에 더 그런지 모르겠지만 돈을 쫌 많이 못 벌었다는 생각이 들지.,그거 때문에 더 그런지 모르겠지만 돈을 조금 많이 못 벌었다는 생각이 들지.
그때만 생각하면은,그때만 생각하면은
왜 그래도 즐거웠지만 쫌 돈 때문에 아쉬웠던 기억인 것 같네.,왜 그래도 즐거웠지만 조금 돈 때문에 아쉬웠던 기억인 것 같네.
니는 뭐~ 또 딴 데 알바한 데 있나?,너는 뭐~ 또 딴 데 알바한 데 있니?
나는 그거 말고 한 몇 개 더 있는 것 같은데,나는 그거 말고 한 몇 개 더 있는 것 같은데
니는 어디 또 알바해 봤노?,너는 어디 또 알바해 봤니?
그때도 내가 쫌,그때도 내가 조금
성인 됐나?,성인 됐나?
그때 되기 전이었나 아무튼 딱 그 시점에 그때,그때 되기 전이었나 아무튼 딱 그 시점에 그때
그~ &company-name1& 그만하고 또 한참 뒤에,그~ &company-name1& 그만하고 또 한참 뒤에
저기 또 치킨집에 또 소개를 받아서 갔어.,저기 또 치킨집에 또 소개를 받아서 갔어.
그~ 어릴 때 이제 한 번 알바 한번 해고 싶어 가지고 해서 해서,그~ 어릴 때 이제 한 번 알바 한번 해고 싶어 가지고 해서 해서
가서 이제 치킨집 그때 오븐에 구워가지고 하는 거기서 했거든,가서 이제 치킨집 그때 오븐에 구워가지고 하는 거기서 했거든
그~ 저녁에 가가지고 저녁 마무리하고,그~ 저녁에 가가지고 저녁 마무리하고
이제 뭐~ 그렇게 하는 거였는데,이제 뭐~ 그렇게 하는 거였는데
가서 또 일을 처음부터  다 배웠어.,가서 또 일을 처음부터  다 배웠어.
어~ 근데 나는 치킨을 만들어 파는,어~ 근데 나는 치킨을 만들어 파는
뭐~ 그런 이름있는 곳이 어~ 생각보다,뭐~ 그런 이름있는 곳이 어~ 생각보다
쫌 위생이 생각보다 내가 생각했던 것보다 쫌,조금 위생이 생각보다 내가 생각했던 것보다 조금
안 좋드라고,안 좋더라고
근데 이거는 솔직히 어디서 일을 하든,근데 이거는 솔직히 어디서 일을 하든
다 일을 해본 사람이면 알 거야.,다 일을 해본 사람이면 알 거야.
이~ 식당에서는 아주 아~ 생각보다 위생이 많이 뭐~ 좋은 곳이 없구나 이거 이런 거를,이~ 식당에서는 아주 아~ 생각보다 위생이 많이 뭐~ 좋은 곳이 없구나 이거 이런 거를
아무튼 거기서 해가지고 이제 처음부터 다 봉지 뜯어가지고,아무튼 거기서 해가지고 이제 처음부터 다 봉지 뜯어가지고
밀가루인가 뭐~ 파우더 묻히가지고 딱딱딱 어디 정리해가지고,밀가루인가 뭐~ 파우더 묻혀가지고 딱딱딱 어디 정리해가지고
그릴에 얹어가지고 오븐에다가 이렇게 집어넣었거든,그릴에 얹어가지고 오븐에다가 이렇게 집어넣었거든
그라고 뭐~ 타이머 맞차가지고 툭 구워가지고 냈어.,그라고 뭐~ 타이머 맞춰가지고 툭 구워가지고 냈어.
그라고 이제 뭐~ 양념을 무셔야 묻혀야 묻혀주고,그라고 이제 뭐~ 양념을 무셔야 묻혀야 묻혀주고
찬찬 그렇게 하면 되는 건데 한 번은 주문이 엄청 들어온 날 있었어.,찬찬 그렇게 하면 되는 건데 한 번은 주문이 엄청 들어온 날 있었어.
해서 주방에는 내랑 둘이 둘이 하고 매니저 한 명이랑,해서 주방에는 나랑 둘이 둘이 하고 매니저 한 명이랑
그때는 그~ 사장님까지,그때는 그~ 사장님까지
사장님까지 들어와가지고 넷이서 같이 했거든,사장님까지 들어와가지고 넷이서 같이 했거든
근데 왔다 갔다 왔다 갔다 이~ 바쁘게 하다 보면 동선이 굉장히 많이 겹친단 말이야.,근데 왔다 갔다 왔다 갔다 이~ 바쁘게 하다 보면 동선이 굉장히 많이 겹친단 말이야.
게서 막 그러는 와중에 내가,게서 막 그러는 와중에 내가
어디서 어디까지 가는 시점에 그 오븐 앞이였거든,어디서 어디까지 가는 시점에 그 오븐 앞이였거든
거기서 그 사장님이 오븐을 이렇게 꺼내다가,거기서 그 사장님이 오븐을 이렇게 꺼내다가
그대로 내를 못 보고 꺼낸 거야.,그대로 나를 못 보고 꺼낸 거야.
그래서 오븐에 그냥 숙  내 팔에다가 그대로 지져버린 거야.,그래서 오븐에 그냥 숙  내 팔에다가 그대로 지져버린 거야.
그 억수 뜨겁대 게서,그 억수 뜨겁대 게서
뭐~ 아야 하고 그~ 보니까 이제 화상을 입은 거지.,뭐~ 아야 하고 그~ 보니까 이제 화상을 입은 거지.
그래서 그~ 어~ 되게 아~ 이런 일 하면서,그래서 그~ 어~ 되게 아~ 이런 일 하면서
에 조 사고가 날 수 있겠구나 그런 거를 쪼끔 느꼈거든,에 조 사고가 날 수 있겠구나 그런 거를 쪼끔 느꼈거든
어~ 나는 그래서 뭐~ 치킨집 알바하면서  뭐~ 다른 것도,어~ 나는 그래서 뭐~ 치킨집 알바하면서  뭐~ 다른 것도
니 같은 경우는 뭐~ 다른데 어디 알바 해보 적 있나?,네 같은 경우는 뭐~ 다른데 어디 알바 해보 적 있니?
난 진짜 오만 오만 특별한 알바 다 해본 것 같은데,난 진짜 오만 오만 특별한 알바 다 해본 것 같은데
뭐~ 일반적인 알바인 내가 그~ 스키장 끝나고 나와서 학교 댕길 때,뭐~ 일반적인 알바인 내가 그~ 스키장 끝나고 나와서 학교 다닐 때
저기 고깃집에서 직접 구워주는 고깃집에서 내 일한 적 있그든,저기 고깃집에서 직접 구워주는 고깃집에서 내가 일한 적 있거든
거기서 한 삼 개월 일했는데 거기에 일하다가 갑자기,거기서 한 삼 개월 일했는데 거기에 일하다가 갑자기
여름에 딴 데 갈 기회가 생겨가지고 딴 데로 넘어갔는데,여름에 딴 데 갈 기회가 생겨가지고 딴 데로 넘어갔는데
고깃집에서는 진짜 너무 힘들었어.,고깃집에서는 진짜 너무 힘들었어.
몸이 힘들기도 했지만 재미도 있었는데 너무 진상들이 많아 가지고,몸이 힘들기도 했지만 재미도 있었는데 너무 진상들이 많아 가지고
그것 때문에 쫌 힘들었고  손님 대하는 이 쉬운 일이 아이데?,그것 때문에 조금 힘들었고  손님 대하는 이 쉬운 일이 아니데?
그래서 고깃집을 그만두고 넘어간 데는 이제,그래서 고깃집을 그만두고 넘어간 데는 이제
부산에 아쿠아리움 있다 아이가.,부산에 아쿠아리움 있지 않니.
아쿠아리움 가서 했는데,아쿠아리움 가서 했는데
아쿠아리움에서 아는 형이 소개시켜줘서 갔드만,아쿠아리움에서 아는 형이 소개시켜줘서 갔더니만
그 형이 되게 나한테 잘 알려주드라고?,그 형이 되게 나한테 잘 알려주더라고?
그래서 알려줘서 알바를 했는데 뭐 했냐면은 저기,그래서 알려줘서 알바를 했는데 뭐 했냐면은 저기
부산 아쿠아리움 가면은 거기에 배모는 게 있거든 배 타는 거,부산 아쿠아리움 가면은 거기에 배모는 게 있거든 배 타는 거
바닥이 유명한 투명한 투명한 유리로 돼 있는 거 있는데 거기 가가지고,바닥이 유명한 투명한 투명한 유리로 돼 있는 거 있는데 거기 가가지고
거위에서 설명하는 강사 역할을 내가 했어야 돼가지고 열심히 배워가지고 했드만,거위에서 설명하는 강사 역할을 내가 했어야 돼가지고 열심히 배워가지고 했더니만
거기에 외국인 손님들도 막 오고 그다음에 사람들 진짜 많아 가지고,거기에 외국인 손님들도 막 오고 그다음에 사람들 진짜 많아 가지고
배 시간 정해놓고 우리가 배 몰고 그랬었거든,배 시간 정해놓고 우리가 배 몰고 그랬었거든
그~ 아직도 말했던 멘트가 기억이 난다.,그~ 아직도 말했던 멘트가 기억이 난다.
들어오면은 손님들한테 이제 안전벨 아~ 뭐지  안전사항 얘기해주고 막 이러 설명하는데,들어오면은 손님들한테 이제 안전벨 아~ 뭐지  안전사항 얘기해주고 막 이러 설명하는데
그 수조 수조 안에 상어가 열두 마리 있거든,그 수조 수조 안에 상어가 열두 마리 있거든
엄청 큰 거 백상아리 친척인데 그게 되게,엄청 큰 거 백상아리 친척인데 그게 되게
엄청커가지고 인상 깊었고 걔네가 이제 수영할 때 가끔씩,엄청커가지고 인상 깊었고 걔네가 이제 수영할 때 가끔씩
