사투리,표준어
너무 막 이게 재밌어서 눈도 못 떼겠고 이건 아니지만,너무 막 이게 재밌어서 눈도 못 떼겠고 이건 아니지만
평화로운 그냥 잔잔하지만 심심하지 않지만 뭐~,평화로운 그냥 잔잔하지만 심심하지 않지만 뭐~
그런 느낌 비지엠처럼 깔아놓고 그거 틀어놓고 그냥,그런 느낌 비지엠처럼 깔아놓고 그거 틀어놓고 그냥
뭐~ 공부하기도 하고 뭐~ 그런 거 같아요 뭐~ 타이핑 치고,뭐~ 공부하기도 하고 뭐~ 그런 거 같아요 뭐~ 타이핑 치고
그러다가 뭐~ 단 거 땡기면은 그거 보면서 뭐~ 먹고 이러는 거 같아요.,그러다가 뭐~ 단 거 당기면은 그거 보면서 뭐~ 먹고 이러는 거 같아요.
음~ 에스엔에스 하면서 가짜뉴스 본 적 있으신가요?,음~ 에스엔에스 하면서 가짜뉴스 본 적 있으신가요?
아~ 요즘 코로나 때문에 가짜뉴스 막 판치고 다녔잖아요?,아~ 요즘 코로나 때문에 가짜뉴스 막 판치고 다녔잖아요?
막 어디에서 확진 걸렸는데 동선지가 거기다 그래서,막 어디에서 확진 걸렸는데 동선지가 거기다 그래서
대구시에서 이런 가짜뉴스 믿지 말라고 했던 거 많이 본 것 같애요.,대구시에서 이런 가짜뉴스 믿지 말라고 했던 거 많이 본 것 같애요.
님은 에스엔에스에 혹시 중독됐다고 생각하시나요?,님은 에스엔에스에 혹시 중독됐다고 생각하시나요?
지금은 아닌데 중학생 때는 쫌 중독이었다고 한 중독이었다고 해도 됐을 거 같애요.,지금은 아닌데 중학생 때는 조금 중독이었다고 한 중독이었다고 해도 됐을 거 같애요.
중독이었던 거 같애요 중학생 때는 지금은 그냥,중독이었던 거 같애요 중학생 때는 지금은 그냥
에스엔에스 보다가도,에스엔에스 보다가도
쫌 재미없고 하면은 재미없다고 생각하기 보 일단 기본적으로 에스엔에스가 너무 재밌어서 한다기보다는,조금 재미없고 하면은 재미없다고 생각하기 보 일단 기본적으로 에스엔에스가 너무 재밌어서 한다기보다는
안 하면 도태되는 기분 그런 게 있어서 하게 되는 거 같고,안 하면 도태되는 기분 그런 게 있어서 하게 되는 거 같고
뭔가 반쯤 의무적인 밥 한번 먹자의 개념이 에스엔에스 같고,뭔가 반쯤 의무적인 밥 한번 먹자의 개념이 에스엔에스 같고
그래서 중독이라기보다는 그냥 말 그대로 시간 때우기 용으로 쭉 보면서,그래서 중독이라기보다는 그냥 말 그대로 시간 때우기 용으로 쭉 보면서
뭐~ 놀기도 하고 그냥 심심풀이로 생각해서 그렇게,뭐~ 놀기도 하고 그냥 심심풀이로 생각해서 그렇게
중독이라고 할 만큼 열정적으로 에스엔에스를 하진 않습니다.,중독이라고 할 만큼 열정적으로 에스엔에스를 하진 않습니다.
근데 옛날에는 에스엔에스 안에 내가 좋아하는 게 너무 많으면 중독이 되는 거 같긴 해요.,근데 옛날에는 에스엔에스 안에 내가 좋아하는 게 너무 많으면 중독이 되는 거 같긴 해요.
거기에 계속 집착을 하면 막 연예인을 좋아한다거나,거기에 계속 집착을 하면 막 연예인을 좋아한다거나
뭐~ 유튜버를 좋아한다거나 그런 애들은 되게,뭐~ 유튜버를 좋아한다거나 그런 애들은 되게
에스엔에스 없으면 못 살더라구요 그래서 아~ 이거는 비정상이다 이러면서 자기 혼자 막,에스엔에스 없으면 못 살더라구요 그래서 아~ 이거는 비정상이다 이러면서 자기 혼자 막
에스엔에스를 끊는 금주 금연처럼,에스엔에스를 끊는 금주 금연처럼
에스엔에스를 끊는 기간을 막 설정하기도 하고 그러더라구요.,에스엔에스를 끊는 기간을 막 설정하기도 하고 그러더라구요.
근데 전 그 정도는 아닌 거 같아요.,근데 전 그 정도는 아닌 거 같아요.
