사투리,표준어
그~ 내가 여기 오기 전에 이제 알게 돼서 연락을 하고,그~ 내가 여기 오기 전에 이제 알게 돼서 연락을 하고
걔가 이제 부산에 놀러 와서 어~,걔가 이제 부산에 놀러 와서 어~
몇 번 만나다가 이제 사귀게 된 거란 말이야.,몇 번 만나다가 이제 사귀게 된 거란 말이야.
그래 가지고 나도 장거리가 처음이긴 한데 내가 부산에서 할 일이 있으니까는,그래 가지고 나도 장거리가 처음이긴 한데 내가 부산에서 할 일이 있으니까는
그런 거 때문에도 나는 지금 되게 장거리가 솔직히 엄청 만족스럽단 말이야 보고 싶지만,그런 거 때문에도 나는 지금 되게 장거리가 솔직히 엄청 만족스럽단 말이야 보고 싶지만
내가 해야 할 일 있으니까는 못 보잖아.,내가 해야 할 일 있으니까는 못 보잖아.
그래서 오히려 장거리인 게 뭔가 다행인 거 같고,그래서 오히려 장거리인 게 뭔가 다행인 거 같고
연락 성향도 아까 뭐~ 삼십 분에 한 번씩 이렇게라고 했잖아.,연락 성향도 아까 뭐~ 삼십 분에 한 번씩 이렇게라고 했잖아.
근데 이제 우리는 되게,근데 이제 우리는 되게
하루에 몇 번 톡을 잘 안 해.,하루에 몇 번 톡을 잘 안 해.
그리고 밤에 그냥 전화 한두 시간 한단 말이야.,그리고 밤에 그냥 전화 한두 시간 한단 말이야.
그래 가지고 아직까지는 뭐~ 남들은 장거리 뭔가 힘들다고 하는데,그래 가지고 아직까지는 뭐~ 남들은 장거리 뭔가 힘들다고 하는데
성향이 비슷해서 그런지 아직까지는 괜찮은 거 같애.,성향이 비슷해서 그런지 아직까지는 괜찮은 거 같애.
혹시 장거리 해 봤을 때 한  얼마나 멀었어?,혹시 장거리 해 봤을 때 한  얼마나 멀었어?
나는 대학교 오기 전에 고등학교가 대전이었으니까 대전에서 만났던 남자 친구는 대전에 계속 있고,나는 대학교 오기 전에 고등학교가 대전이었으니까 대전에서 만났던 남자 친구는 대전에 계속 있고
부산으로 왔으니까 대전에서 부산까지 장거리였는데,부산으로 왔으니까 대전에서 부산까지 장거리였는데
근데 이게 군대를 기다리면 어느 정도 기간이 있잖아 근데 나는 대학교를 사 년을,근데 이게 군대를 기다리면 어느 정도 기간이 있잖아 근데 나는 대학교를 사 년을
다녀야 되고 그리고 또 그 이후에도 대전으로 돌아온다는 그런,다녀야 되고 그리고 또 그 이후에도 대전으로 돌아온다는 그런
장담할만한 게 없으니까 그 사람이,장담할만한 게 없으니까 그 사람이
생각했을 때 쪼금 힘들 거라고 판단을 해서 그냥 빨리 결정을 내린 거 같애 그 사람이 먼저,생각했을 때 쪼금 힘들 거라고 판단을 해서 그냥 빨리 결정을 내린 거 같애 그 사람이 먼저
그래서 장거리 하게 되면 원래 쪼금,그래서 장거리 하게 되면 원래 쪼금
그런 거에 대해서 쪼금 연락을 안 해도 서로 괜찮고 이러면 괜찮게 연애를 할 거 같은데,그런 거에 대해서 쪼금 연락을 안 해도 서로 괜찮고 이러면 괜찮게 연애를 할 거 같은데
나처럼 연락을 쪼금 자주 해 주고,나처럼 연락을 쪼금 자주 해 주고
계속 보고 싶고 그런 게 쪼금 더,계속 보고 싶고 그런 게 쪼금 더
쎄거나 그런 사람끼리 만나게 되면은 장거리는 근데 사람마다 다를 거 같애 자기 성향마다,세거나 그런 사람끼리 만나게 되면은 장거리는 근데 사람마다 다를 거 같애 자기 성향마다
그럼 혹시 뭐~ 헤어질 때나 이럴 때 성격이 단호한 편이야 아니면은,그럼 혹시 뭐~ 헤어질 때나 이럴 때 성격이 단호한 편이야 아니면은
안 단호한 편이야?,안 단호한 편이야?
어떻게 헤어졌느냐에 따라 다르겠지만,어떻게 헤어졌느냐에 따라 다르겠지만
지금까지 헤어졌을 때는 거의 다 단호했던 거 같애 성격 관련돼서 그런 거일 수도 있는데,지금까지 헤어졌을 때는 거의 다 단호했던 거 같애 성격 관련돼서 그런 거일 수도 있는데
한번 이제 정이 떨어지거나 쫌 잘못된 행동을 하게 되면,한번 이제 정이 떨어지거나 조금 잘못된 행동을 하게 되면
신뢰가 없어지고 계속 만나게 되면 그거에 대해서,신뢰가 없어지고 계속 만나게 되면 그거에 대해서
계속 붙잡게 되고 다음에 잘하고 나중에,계속 붙잡게 되고 다음에 잘하고 나중에
어떤 행동을 했을 때 계속 의심을 할 수 있을 거 같아서,어떤 행동을 했을 때 계속 의심을 할 수 있을 거 같아서
그런 거를 이제 경험으로 직접 부딪혀 보니까,그런 거를 이제 경험으로 직접 부딪혀 보니까
아~ 쫌 단호해져도 되겠다 따른 사람들도 많은데 왜 굳이 그 사람한테,아~ 조금 단호해져도 되겠다 다른 사람들도 많은데 왜 굳이 그 사람한테
그럴 필요는 없겠다 싶어서 쪼금 단호한 편인 거 같아.,그럴 필요는 없겠다 싶어서 쪼금 단호한 편인 거 같아.
그러면 헤어지고 나서 단호한 편이야 안 단호한 편이야?,그러면 헤어지고 나서 단호한 편이야 안 단호한 편이야?
나도 정 털리면은 살짝 단호하긴 한데,나도 정 털리면은 살짝 단호하긴 한데
이제 무슨 큰 잘못을 해도 내가 아직까지 좋아하면은,이제 무슨 큰 잘못을 해도 내가 아직까지 좋아하면은
그런 것도 쫌 감수를 쫌 하는 편인 거 같애.,그런 것도 조금 감수를 조금 하는 편인 거 같애.
그리고 차여도 내가 아직 좋아하면은 살짝 질척이는 스타일인 거 같애.,그리고 차여도 내가 아직 좋아하면은 살짝 질척이는 스타일인 거 같애.
혹시 친구 관계에서도 그렇게 단호하게 하는 편이야?,혹시 친구 관계에서도 그렇게 단호하게 하는 편이야?
