사투리,표준어
님이 다녀온 국내 여행지 중에 혹시 추천하고 싶은,님이 다녀온 국내 여행지 중에 혹시 추천하고 싶은
여행지가 있으신가요?,여행지가 있으신가요?
네 저는 국내 여행으로는 어~ 오월에 단양 다녀왔는데,네 저는 국내 여행으로는 어~ 오월에 단양 다녀왔는데
단양 진짜 생각보다 너무 예쁘더라고요.,단양 진짜 생각보다 너무 예쁘더라고요.
단양에서 패러글라이딩 할 수 있는데,단양에서 패러글라이딩 할 수 있는데
제가 고소공포증이 되게 심한데도,제가 고소공포증이 되게 심한데도
가서 사람들 하는 거 보니깐 진짜 재밌어 보여가지고,가서 사람들 하는 거 보니깐 진짜 재밌어 보여가지고
친구랑 했는데 진짜 후회 없을 정도로 좋았어요.,친구랑 했는데 진짜 후회 없을 정도로 좋았어요.
저 약간 국내 여행은 많이 안 다녀봤는데,저 약간 국내 여행은 많이 안 다녀봤는데
단양 가서 약간 국내 여행의 편견을 쫌 버린 거 같애요.,단양 가서 약간 국내 여행의 편견을 조금 버린 거 같애요.
진짜 외국처럼 풍경이 너무 예쁘고,진짜 외국처럼 풍경이 너무 예쁘고
가을에 가도 정말 예쁘다더라고요.,가을에 가도 정말 예쁘다더라고요.
그래서 시월이나 십일월에 제일 그~ 예쁘다고 패러글라이딩할 때도 좋다고,그래서 시월이나 십일월에 제일 그~ 예쁘다고 패러글라이딩할 때도 좋다고
한 번  님도 가보시면 좋을 거 같아요.,한 번  님도 가보시면 좋을 거 같아요.
님은 혹시 국내 여행이나 해외 여행지 중에 기억에 남는 곳 있으신가요?,님은 혹시 국내 여행이나 해외 여행지 중에 기억에 남는 곳 있으신가요?
저는 국내 여행지는 어~,저는 국내 여행지는 어~
여수나 전라도 쪽도 좋았지만 아무래도,여수나 전라도 쪽도 좋았지만 아무래도
제주도가 그~ 그~ 평소에 자주 갈 수 없으니깐 되게 좋았었던 거 같거든요.,제주도가 그~ 그~ 평소에 자주 갈 수 없으니깐 되게 좋았었던 거 같거든요.
제주도 보통 한 이 박 삼 일 정도 가니깐,제주도 보통 한 이 박 삼 일 정도 가니깐
그~ 국 공항 근처로 해가지고 시계 방향으로 이렇게 돌면은,그~ 국 공항 근처로 해가지고 시계 방향으로 이렇게 돌면은
되게 보기 좋은 거 같더라고요.,되게 보기 좋은 거 같더라고요.
그~ 봄에 가도 좋고 여름에 가도 좋고,그~ 봄에 가도 좋고 여름에 가도 좋고
가을 겨울에 가도  계절별로 가기 되게 좋은 거 같았어요.,가을 겨울에 가도  계절별로 가기 되게 좋은 거 같았어요.
안 그래도 저도 그~ 담양에 패러글라이딩 되게 하러 가보고 싶어가지고,안 그래도 저도 그~ 담양에 패러글라이딩 되게 하러 가보고 싶어가지고
되게 관심 있게,되게 관심 있게
생각하고 있었거든요 에스엔에스에도 되게 자주 보이고 해서 최근에 경주에도 생겼더라고요.,생각하고 있었거든요 에스엔에스에도 되게 자주 보이고 해서 최근에 경주에도 생겼더라고요.
그래서  님이 담양 가가지고 패러글라이딩 탔던 거 머 금액적인 부분이나,그래서  님이 담양 가가지고 패러글라이딩 탔던 거 뭐 금액적인 부분이나
아니면은 팁 같은 거 있으시면 쫌 말씀해주셨으면 좋겠어요.,아니면은 팁 같은 거 있으시면 조금 말씀해주셨으면 좋겠어요.
어~ 담양 여행 저도 갑자기 가게 된 거긴 했는데,어~ 담양 여행 저도 갑자기 가게 된 거긴 했는데
그냥 네이버에 검색하니까 패러글라이딩이 제일 먼저 떠서 예약했는데,그냥 네이버에 검색하니까 패러글라이딩이 제일 먼저 떠서 예약했는데
저 오월에 갔을 때 사실 그때 완전 그~ 코로나 땜에 난리 났을 때여가지고,저 오월에 갔을 때 사실 그때 완전 그~ 코로나 땜에 난리 났을 때여가지고
저는 일부러 평일에 갔거든요 그래서 평일에 가서 사람은 없었는데,저는 일부러 평일에 갔거든요 그래서 평일에 가서 사람은 없었는데
코로나 땜에 관광객이 없으니까 할인을 되게 많이 해서,코로나 땜에 관광객이 없으니까 할인을 되게 많이 해서
원래 패러가 인당 십만 원 정도 하더라고요.,원래 패러가 인당 십만 원 정도 하더라고요.
근데 싸게 인터넷으로 사면 칠 팔 만 원에도 하나 봐요.,근데 싸게 인터넷으로 사면 칠 팔 만 원에도 하나 봐요.
근데 저는 그때 저랑 친구랑 둘이 합쳐서 십만 원인가 주고 했어요.,근데 저는 그때 저랑 친구랑 둘이 합쳐서 십만 원인가 주고 했어요.
그래서 되게 일단 인터넷으로 한 번 검색해보시고 가시면 쫌 미리 저렴하게 표 같은 거는 구할 수 있을 거 같애요.,그래서 되게 일단 인터넷으로 한 번 검색해보시고 가시면 조금 미리 저렴하게 표 같은 거는 구할 수 있을 거 같애요.
그리고 또 다른 팁은 담양이 어~ 생각보다 쫌 커요.,그리고 또 다른 팁은 담양이 어~ 생각보다 조금 커요.
저는 짝을 줄 알았는데 시내는 작은데 돌아다니는 데는 꽤 커서,저는 짝을 줄 알았는데 시내는 작은데 돌아다니는 데는 꽤 커서
자차 있으면 되게 편리하실 거 같고,자차 있으면 되게 편리하실 거 같고
어~ 은근히 오월인데도 추웠어요.,어~ 은근히 오월인데도 추웠어요.
지금 가실 거 같으면 더 추울 꺼 같애서 쫌 따뜻하게 입으셔야 될 거 같고,지금 가실 거 같으면 더 추울 꺼 같애서 조금 따뜻하게 입으셔야 될 거 같고
그~ 담양이 마늘이 유명한데,그~ 담양이 마늘이 유명한데
마늘 떡갈비 먹으러 갔는데,마늘 떡갈비 먹으러 갔는데
진짜 맛있어요.,진짜 맛있어요.
그 마늘 떡갈비 정식 검색하면 몇 군데 뜨실 텐데,그 마늘 떡갈비 정식 검색하면 몇 군데 뜨실 텐데
저 한 세 군덴가 다 가봤는데,저 한 세 군덴가 다 가봤는데
다 맛은 비슷비슷해서 어~ 그냥 삘 오는데 가시면 좋을 거 같애요.,다 맛은 비슷비슷해서 어~ 그냥 삘 오는데 가시면 좋을 거 같애요.
어~  님은 혹시 해외 여행은 가보신 곳 있으신가요?,어~  님은 혹시 해외 여행은 가보신 곳 있으신가요?
저는 올해에 해외여행 가볼까 이렇게 생각하고 계획을 해볼려고 했는데,저는 올해에 해외여행 가볼까 이렇게 생각하고 계획을 해볼려고 했는데
올 초에 이월쯤에 이제 코로나 심각해지면서,올 초에 이월쯤에 이제 코로나 심각해지면서
약간 흐지부지된 거 같아가지고 아직 해외여행 다녀온 적은 없고,약간 흐지부지된 거 같아가지고 아직 해외여행 다녀온 적은 없고
어~ 친한 친구나 아니면 남자친구나 가족이랑 해외여행을 가보고 싶다는 생각은 계속 가지고 있어요.,어~ 친한 친구나 아니면 남자친구나 가족이랑 해외여행을 가보고 싶다는 생각은 계속 가지고 있어요.
님이 사시는 지역에 대해서,님이 사시는 지역에 대해서
쫌 소개해주셨으면 좋겠어요 먹거리나 아니면,조금 소개해주셨으면 좋겠어요 먹거리나 아니면
볼거리 이런 거에 대해서 음~ 설명해주셨으면 좋겠어요.,볼거리 이런 거에 대해서 음~ 설명해주셨으면 좋겠어요.
궁금합니다.,궁금합니다.
어~ 저는 대구에서 나고 자라서 회사가 평택에 있어서 평택에 지금 근 이거 살고 있는데,어~ 저는 대구에서 나고 자라서 회사가 평택에 있어서 평택에 지금 근 이거 살고 있는데
평택에 미군 부대가 제일 크게 있어요.,평택에 미군 부대가 제일 크게 있어요.
그래서 평택에 그~ 송탄 쪽 가면은 국제시장이라고 해서,그래서 평택에 그~ 송탄 쪽 가면은 국제시장이라고 해서
되게 해외 음식 엄청 많이 파는데,되게 해외 음식 엄청 많이 파는데
쫌 약간 어~ 제 이의 이태원 같은 느낌이에요.,조금 약간 어~ 제 이의 이태원 같은 느낌이에요.
근데 어~ 한 이십 년 전 이태원 느낌이라서 기대는 하고 가면 안 되지만,근데 어~ 한 이십 년 전 이태원 느낌이라서 기대는 하고 가면 안 되지만
평택 왔으면 그래도 가볼 만한 데가 거기 송파네 부대 앞에인데,평택 왔으면 그래도 가볼 만한 데가 거기 송파네 부대 앞에인데
막 요즘 그~ 티비에 뭐~ 백종원도 왔다 가고 그러더라고요.,막 요즘 그~ 티비에 뭐~ 백종원도 왔다 가고 그러더라고요.
거기 가면 햄버거도 완전 미국식 수제로 팔고,거기 가면 햄버거도 완전 미국식 수제로 팔고
뭐 부대찌개도 진짜 유명해요.,뭐 부대찌개도 진짜 유명해요.
부대찌개도 다 맛있고 어~ 뭐~ 인도 요리나 뭐~ 멕시칸 요리 진짜 종류별로 나라별 요리 다 있는데,부대찌개도 다 맛있고 어~ 뭐~ 인도 요리나 뭐~ 멕시칸 요리 진짜 종류별로 나라별 요리 다 있는데
거기는 우리가 가면,거기는 우리가 가면
약간 내가 외국에 왔나 싶을 정도로,약간 내가 외국에 왔나 싶을 정도로
한국인은 거의 없고 거의 다 미군들이어가지고,한국인은 거의 없고 거의 다 미군들이어가지고
외국인들 진짜 많아서 쫌 이국적인 느낌이 있어요 그래서 만약에 평택 오시게 되면,외국인들 진짜 많아서 조금 이국적인 느낌이 있어요 그래서 만약에 평택 오시게 되면
여기 한 번 가보시는 걸 추천하고요.,여기 한 번 가보시는 걸 추천하고요.
그리고 또 평택에 그~ 평택함이라고 서쪽에 있는 서해에 있는 데가 있는데 거기는,그리고 또 평택에 그~ 평택함이라고 서쪽에 있는 서해에 있는 데가 있는데 거기는
뭐~ 바다를 보러 간다기보다는 항이어 가지고 예쁜 바다는 아닌데,뭐~ 바다를 보러 간다기보다는 항이어 가지고 예쁜 바다는 아닌데
밤에 드라이브하면 별 진짜 많이 보이고,밤에 드라이브하면 별 진짜 많이 보이고
예뻐요 저는 근데 처음에는 뭣도 모르고 낮에 갔다가 갔는데,예뻐요 저는 근데 처음에는 뭣도 모르고 낮에 갔다가 갔는데
막 내가 생각한 예쁜 바다가 아니라 막 컨테이너 다 막 있고 이래서 쫌 충격 먹긴 했는데 밤에 가면,막 내가 생각한 예쁜 바다가 아니라 막 컨테이너 다 막 있고 이래서 조금 충격 먹긴 했는데 밤에 가면
별이 진짜 잘 보이고 예뻐요.,별이 진짜 잘 보이고 예뻐요.
혹시  님은 어~  살고 계신대 추천해 주실 만한 장소나 핫플이 있을까요?,혹시  님은 어~  살고 계신대 추천해 주실 만한 장소나 핫플이 있을까요?
제가 사는 지역은 부산이어 가지고 아무래도 보 아마 보통 사람들이,제가 사는 지역은 부산이어 가지고 아무래도 보 아마 보통 사람들이
어디가 유명한지 머가 맛있는지 대부분 다 아실 꺼 같아가지고 제가 딱히 설명드리고자 하면은,어디가 유명한지 뭐가 맛있는지 대부분 다 아실 꺼 같아가지고 제가 딱히 설명드리고자 하면은
제가 좋았던 곳은 일단 그~ 다대포 쪽에 생계탐방로라고,제가 좋았던 곳은 일단 그~ 다대포 쪽에 생계탐방로라고
거기 되게 야경이 예쁘거든요.,거기 되게 야경이 예쁘거든요.
거기랑 저희 집 근처에 보자면,거기랑 저희 집 근처에 보자면
황령산이라고 황령산도 야경이 되게 예뻐요.,황령산이라고 황령산도 야경이 되게 예뻐요.
밤에 드라이브하기 좋고,밤에 드라이브하기 좋고
광안대교가  한눈에 일케 들어오기 때문에,광안대교가  한눈에 이렇게 들어오기 때문에
부산을 한꺼번에 이렇게 한 번에 보고 싶다 싶으면은 황령산 가셔 가지고,부산을 한꺼번에 이렇게 한 번에 보고 싶다 싶으면은 황령산 가셔 가지고
드라이브하면 되게 좋을 꺼 같고,드라이브하면 되게 좋을 꺼 같고
먹거리는,먹거리는
부산 로컬푸드라고 하면은 저는,부산 로컬푸드라고 하면은 저는
초량 불백 정도 생각나는 거 같아서,초량 불백 정도 생각나는 거 같아서
타지에서 오시는 분들이라면 아마 부산역으로 케이티엑스 타고 많이 오실 꺼니까,타지에서 오시는 분들이라면 아마 부산역으로 케이티엑스 타고 많이 오실 꺼니까
초량이 부산역 근처거든요?,초량이 부산역 근처거든요?
그래서 아마 초량역 들려서 불백 드셔보시면 되게 좋을 거 같아요.,그래서 아마 초량역 들려서 불백 드셔보시면 되게 좋을 거 같아요.
음~ 혹시 부산 놀러오신 적 있으시다면은 되게 기억에 남으셨던,음~ 혹시 부산 놀러오신 적 있으시다면은 되게 기억에 남으셨던
그~ 장소가 있으신가요?,그~ 장소가 있으신가요?
어~ 저는 외가댁이 부산이어서 부산 어렸을 때부터 진짜 많이 갔고,어~ 저는 외가댁이 부산이어서 부산 어렸을 때부터 진짜 많이 갔고
또 완전 애기 때는 부산에서 한 삼 년 사 년 살기도 했는데,또 완전 애기 때는 부산에서 한 삼 년 사 년 살기도 했는데
그래서 그런지 오히려 관광지는 많이 안 가본 거 같애요.,그래서 그런지 오히려 관광지는 많이 안 가본 거 같애요.
그냥 잠깐 스쳐 지나가듯이 가고,그냥 잠깐 스쳐 지나가듯이 가고
저가 제일 기억에 남는 장소는,저가 제일 기억에 남는 장소는
저희 외할아버지 동네가 아~ 갑자기 생각이 안 나는데 그~,저희 외할아버지 동네가 아~ 갑자기 생각이 안 나는데 그~
부산역에서 근처긴 한데 쫌 약간 달동네처럼,부산역에서 근처긴 한데 조금 약간 달동네처럼
산 높이에 막 비탈진데 있단 말이에요?,산 높이에 막 비탈진데 있단 말이에요?
그래서 거기 올라가는 게 진짜 무섭고 위험한데 막 버스 다니는 거 보면 진짜 신기하고 막 버스 넘어질 꺼 같고,그래서 거기 올라가는 게 진짜 무섭고 위험한데 막 버스 다니는 거 보면 진짜 신기하고 막 버스 넘어질 꺼 같고
근데 밤에 그~ 딱 그~ 외할아버지 집에서 나와서 딱 그~ 내려다보이는 풍경이,근데 밤에 그~ 딱 그~ 외할아버지 집에서 나와서 딱 그~ 내려다보이는 풍경이
그~ 부산이 전부 다 보여요.,그~ 부산이 전부 다 보여요.
그래서 그거 보고 약간 저 원래 눈물이 없는 편인데 약간 울컥한다 해야 되나?,그래서 그거 보고 약간 저 원래 눈물이 없는 편인데 약간 울컥한다 해야 되나?
밤에 그 장면 딱 보는데 뭔가 진짜 예쁜 거예요.,밤에 그 장면 딱 보는데 뭔가 진짜 예쁜 거예요.
그래서 저는 친구들이 막 부산 이제 저가 자주 가봤으니깐,그래서 저는 친구들이 막 부산 이제 저가 자주 가봤으니깐
부산 여행지나 뭐~ 이런 데 추천해달라 하면,부산 여행지나 뭐~ 이런 데 추천해달라 하면
항상 그 동네 그~ 좀 높은 곳 올라가서 밤에 한 번 구경해보라 하거든요.,항상 그 동네 그~ 좀 높은 곳 올라가서 밤에 한 번 구경해보라 하거든요.
거기가 진짜 예뻤어요.,거기가 진짜 예뻤어요.
어~ 그리고 어~ 쫌 유명한데 중에서는 그~ 광안리 아무래도,어~ 그리고 어~ 조금 유명한데 중에서는 그~ 광안리 아무래도
광안대교가 밤에 진짜 예쁘더라고요.,광안대교가 밤에 진짜 예쁘더라고요.
근데 그것도 쫌 사람이 없을 때 가야 더 예쁘게 보이는 거 같애요.,근데 그것도 조금 사람이 없을 때 가야 더 예쁘게 보이는 거 같애요.
어~  님은 여행 가실 때 주로 게스트 하우스 이용하시나요 아니면 호텔 이용하시나요?,어~  님은 여행 가실 때 주로 게스트 하우스 이용하시나요 아니면 호텔 이용하시나요?
저는 여행을 막 자주 다니고 하는 편은 아니어가지구,저는 여행을 막 자주 다니고 하는 편은 아니어가지구
보통 친구들이 있는 지역으로 많이 가는 거 같고 그러면은,보통 친구들이 있는 지역으로 많이 가는 거 같고 그러면은
친구 집에 머물거나,친구 집에 머물거나
아니면 같이 간 사람들이 많다면은 같이,아니면 같이 간 사람들이 많다면은 같이
에어비앤비 잡아가지고 숙소를 잡아서 보통 지내는 편이고,에어비앤비 잡아가지고 숙소를 잡아서 보통 지내는 편이고
여수 갔을 때 한 번 호텔에 숙박했었던 거 같애요.,여수 갔을 때 한 번 호텔에 숙박했었던 거 같애요.
여수는 그~ 바다 보이는 데서,여수는 그~ 바다 보이는 데서
인피니티풀 있는 호텔이었는데 되게 가성비가 좋아가지고,인피니티풀 있는 호텔이었는데 되게 가성비가 좋아가지고
앞 한 번 더 갈 의향도 있습니다.,앞 한 번 더 갈 의향도 있습니다.
제가 여행을 다니면서 게스트 하우스 다니는 사람을 많이 봐서,제가 여행을 다니면서 게스트 하우스 다니는 사람을 많이 봐서
나도 게스트 하우스 가서 모르는 사람들이랑 약간 친해지는 시간도 가지고,나도 게스트 하우스 가서 모르는 사람들이랑 약간 친해지는 시간도 가지고
혼자 여행을 떠나보고 싶다라고 생각은 해봤었거든요.,혼자 여행을 떠나보고 싶다라고 생각은 해봤었거든요.
혹시  님이 게스트 하우스에 숙박하면서 여행 간 적이 있으시면은,혹시  님이 게스트 하우스에 숙박하면서 여행 간 적이 있으시면은
게스트 하우스에 머물면서 좋았던 점이나 장점 단점 같은 거 얘기해 주셨으면 좋겠어요.,게스트 하우스에 머물면서 좋았던 점이나 장점 단점 같은 거 얘기해 주셨으면 좋겠어요.
어~ 저는 그~ 유럽 여행 갔을 때,어~ 저는 그~ 유럽 여행 갔을 때
주로 게스트 하우스 많이 이용했어요 거기서는 호스텔이라고 하는데,주로 게스트 하우스 많이 이용했어요 거기서는 호스텔이라고 하는데
호스텔 일부러 호스텔을 잡았던 게,호스텔 일부러 호스텔을 잡았던 게
쫌 유럽 여행하면 사실 그 나라 사람이나 뭐~ 외국인들이랑 직접 말할 일은 별로 없잖아요 간단히 뭐,조금 유럽 여행하면 사실 그 나라 사람이나 뭐~ 외국인들이랑 직접 말할 일은 별로 없잖아요 간단히 뭐
주문하는 거나 길 물어보는 정도지.,주문하는 거나 길 물어보는 정도지.
근데 호스텔 가면은 온갖 나라에서 다 온 사람들이 이제 모이니깐,근데 호스텔 가면은 온갖 나라에서 다 온 사람들이 이제 모이니깐
아무래도 쫌 같이 이야기할 수 있는 기회가 있지 않을까 해서,아무래도 조금 같이 이야기할 수 있는 기회가 있지 않을까 해서
호스텔을 많이 이용했는데,호스텔을 많이 이용했는데
어~ 저는 진짜 좋았어요.,어~ 저는 진짜 좋았어요.
제가 쫌 약간 외향적인 성격이어서 그런 거 같은데,제가 조금 약간 외향적인 성격이어서 그런 거 같은데
저랑 같이 동행했던 언니는 되게 싫다 하더라고요 자기는 이제 간섭받는 것도 싫고,저랑 같이 동행했던 언니는 되게 싫다 하더라고요 자기는 이제 간섭받는 것도 싫고
이~ 뭐~ 이 인 일 실 사 사 인 일 실 뭐 이런 식으로 여러 명 쓰기도 하니까,이~ 뭐~ 이 인 일 실 사 사 인 일 실 뭐 이런 식으로 여러 명 쓰기도 하니까
방해받는 게 싫다 하더라고요.,방해받는 게 싫다 하더라고요.
근데 저는 오히려 막 말 붙이면서 막 솔직히 영어 외국인이랑 할 기회도 별로 없는데 안 되는 영어 그냥 해가면서,근데 저는 오히려 막 말 붙이면서 막 솔직히 영어 외국인이랑 할 기회도 별로 없는데 안 되는 영어 그냥 해가면서
대화하니까 진짜 재밌고,대화하니까 진짜 재밌고
어~ 쫌 그 나라 얘기도 직접 그 사람한테 들을 수 있으니까 좋았어요.,어~ 조금 그 나라 얘기도 직접 그 사람한테 들을 수 있으니까 좋았어요.
근데 저도 단점이라 느낀 거는,근데 저도 단점이라 느낀 거는
쫌 걔 외국 애들은 쫌 한국인들에 비해서 쫌 지저분한 사람이 많은 거 같애요.,조금 걔 외국 애들은 조금 한국인들에 비해서 조금 지저분한 사람이 많은 거 같애요.
그래서 막 그냥 약간 상상 초월이었던 게 그냥 게스트 하우스 침대에 막  신발 신고 올라오고,그래서 막 그냥 약간 상상 초월이었던 게 그냥 게스트 하우스 침대에 막  신발 신고 올라오고
막 옷 같은 거 바닥 진짜 더러운데 그냥 다 널브려 놓고,막 옷 같은 거 바닥 진짜 더러운데 그냥 다 널브려 놓고
그런 게 많아서 쫌 충격적이긴 했는데,그런 게 많아서 조금 충격적이긴 했는데
결과적으로는 저는 좋았어요.,결과적으로는 저는 좋았어요.
그래서 다음에 코로나 끝나면 또 여행 가면 게스트 하우스 호스텔 또 이용해 보고 싶어요.,그래서 다음에 코로나 끝나면 또 여행 가면 게스트 하우스 호스텔 또 이용해 보고 싶어요.
어~  님은 여행할 때 보통 기념품 같은 거 어떤 거 사 오시는 편이세요?,어~  님은 여행할 때 보통 기념품 같은 거 어떤 거 사 오시는 편이세요?
저는 기념품 사온 게 수학여행 제주도 가가지고 초콜렛 사 온 기억밖에 없어 가지고,저는 기념품 사온 게 수학여행 제주도 가가지고 초콜렛 사 온 기억밖에 없어 가지고
아마 해외여행을 다녀온다면 면세점이나 뭐~ 그~ 로컬,아마 해외여행을 다녀온다면 면세점이나 뭐~ 그~ 로컬
그쪽 가게들을 활용해서 면세 뭐~ 뭐~ 음~ 기념품을 많이 사올 거 같은데,그쪽 가게들을 활용해서 면세 뭐~ 뭐~ 음~ 기념품을 많이 사올 거 같은데
아직 그런 적은 없어가지고,아직 그런 적은 없어가지고
기억에 남는 기념품은 초콜렛 정도밖에 없는 거 같아요.,기억에 남는 기념품은 초콜렛 정도밖에 없는 거 같아요.
유럽 여행 다녀오셨을 때 어떤 기념품 사 오셨나요?,유럽 여행 다녀오셨을 때 어떤 기념품 사 오셨나요?
어~ 저는 사실 짐 캐리어 끌고 다니는 것도 싫고,어~ 저는 사실 짐 캐리어 끌고 다니는 것도 싫고
짐 무거워지는 게 너무 싫어서,짐 무거워지는 게 너무 싫어서
기념품을 최소한으로 하고 싶어서,기념품을 최소한으로 하고 싶어서
그냥 먹는 게 기념품이다 생각하고 그냥 많이 먹었어요.,그냥 먹는 게 기념품이다 생각하고 그냥 많이 먹었어요.
여러 가지 먹고 그냥 배에 넣어온다 생각하고 많이 먹고,여러 가지 먹고 그냥 배에 넣어온다 생각하고 많이 먹고
굳이 꼽자면 어~ 스페인 갔을 때 제가 축구 좋아해가지고,굳이 꼽자면 어~ 스페인 갔을 때 제가 축구 좋아해가지고
그~ 제가 좋아하는 팀 유니폼이랑,그~ 제가 좋아하는 팀 유니폼이랑
어~ 텀블러랑 또 뭐 샀지 그 열쇠고리랑 막 그 팀에 관한 기념품만 사 오고,어~ 텀블러랑 또 뭐 샀지 그 열쇠고리랑 막 그 팀에 관한 기념품만 사 오고
그거 말고는 주변 친구들 선물용으로만,그거 말고는 주변 친구들 선물용으로만
뭐~ 간단하게 마그넷이나 뭐~ 초 캔들 같은 것  작은 거 예쁜 거,뭐~ 간단하게 마그넷이나 뭐~ 초 캔들 같은 것  작은 거 예쁜 거
사고 따로 사 온 거 같지는 않아요.,사고 따로 사 온 거 같지는 않아요.
어~  님 혹시 어~ 제주도 갔을 때 일출이나 일몰 보셨나요?,어~  님 혹시 어~ 제주도 갔을 때 일출이나 일몰 보셨나요?
제가 아침잠이 많은 편이라서,제가 아침잠이 많은 편이라서
저는 새해에도 일출을 못 보는 편이거든요.,저는 새해에도 일출을 못 보는 편이거든요.
그래서 제주도 가서 일출을 본 기억은 없는데,그래서 제주도 가서 일출을 본 기억은 없는데
일몰은 약간 본의 아니게 본 거 같은 적은 되게 많아요.,일몰은 약간 본의 아니게 본 거 같은 적은 되게 많아요.
아무래도 저녁에 저녁까지 알차게 놀다 보니까,아무래도 저녁에 저녁까지 알차게 놀다 보니까
배고플 때쯤 이제 저녁 뭐 먹지 생각할 때쯤 해가 지잖아요?,배고플 때쯤 이제 저녁 뭐 먹지 생각할 때쯤 해가 지잖아요?
그~ 그때 그~ 제주도에 땅부분이라고 해야 되나?,그~ 그때 그~ 제주도에 땅부분이라고 해야 되나?
땅이랑 바다랑 하늘이랑 이렇게 한꺼번에 이게 뷰가 들어오면서,땅이랑 바다랑 하늘이랑 이렇게 한꺼번에 이게 뷰가 들어오면서
