사투리,표준어
비티에스가 막 빌보드 차트를 일 등을 했다고 막 이케 기사도 나오고 하더라고요.,비티에스가 막 빌보드 차트를 일 등을 했다고 막 이렇게 기사도 나오고 하더라고요.
그래서,그래서
어~ 해외에 있는 팬들이 어~ 비티에스에 무대를 보거나 뮤비를 보고,어~ 해외에 있는 팬들이 어~ 비티에스에 무대를 보거나 뮤비를 보고
막 이렇게 리액션하는 그런 영상이 많이 올라오더라고요 그래서 봤는데,막 이렇게 리액션하는 그런 영상이 많이 올라오더라고요 그래서 봤는데
비티에스가 진짜 춤도 잘 추고 어~ 애들이 잘생기기도 했고,비티에스가 진짜 춤도 잘 추고 어~ 애들이 잘생기기도 했고
어~ 외국 사람들 뭐 서양 사람들은 동양 가수들을 막 그렇게,어~ 외국 사람들 뭐 서양 사람들은 동양 가수들을 막 그렇게
빌보드 차트에 막 일 등 이 등 이런 게 거의 없고 거의 처음이라고 하더라고요.,빌보드 차트에 막 일 등 이 등 이런 게 거의 없고 거의 처음이라고 하더라고요.
그래가지고 그런 사람들에 리액션을 보는 게 되게 재밌더라고요 그러고 보니까 이제 비티에스에 대해서,그래가지고 그런 사람들에 리액션을 보는 게 되게 재밌더라고요 그러고 보니까 이제 비티에스에 대해서
쪼끔 괜찮게 생각하고 그까,쪼끔 괜찮게 생각하고 그러니까
팬 아닌 팬 약간 멀리서 응원하는 느낌,팬 아닌 팬 약간 멀리서 응원하는 느낌
어~ 지금은 아직 그런 상태인 거 같애요.,어~ 지금은 아직 그런 상태인 거 같애요.
어~ 뭐~ 셔누나 뭐 이런 보아나 이런 가수들  씨가 많이 어~ 팬이라고 하셨는데,어~ 뭐~ 셔누나 뭐 이런 보아나 이런 가수들  씨가 많이 어~ 팬이라고 하셨는데
혹시 그런 가수들이 공연을,혹시 그런 가수들이 공연을
아 그  씨 주변에서 가까운 곳에서 해요.,아 그  씨 주변에서 가까운 곳에서 해요.
그래서 티켓팅을 성공했 티켓팅을 해서 뭐~,그래서 티켓팅을 성공했 티켓팅을 해서 뭐~
가서 직관하실 의향이 있으신지 아니면 전에 한 번 뭐 그런 공연에 가보신 적 있으신지 어~ 여쭤보고 싶어요.,가서 직관하실 의향이 있으신지 아니면 전에 한 번 뭐 그런 공연에 가보신 적 있으신지 어~ 여쭤보고 싶어요.
한 일 년 전에 저였으면은,한 일 년 전에 저였으면은
그런 공연을 별로 관심이 없었을 거 같애요 실제로도,그런 공연을 별로 관심이 없었을 거 같애요 실제로도
제가 그 두 분을 좋아하고 난 후에,제가 그 두 분을 좋아하고 난 후에
직접 뵐 수 있는 기회라던지 공연이라던지 이벤트가 엄청 많았거든요.,직접 뵐 수 있는 기회라던지 공연이라던지 이벤트가 엄청 많았거든요.
근데 저는 일단 집이 지방이기도 하고,근데 저는 일단 집이 지방이기도 하고
그 중심지와의 거리가 엄청 멀기도 하고 그런데 그분들이 행사 같은 거 있을 때 지방으로 오시기도 하잖아요.,그 중심지와의 거리가 엄청 멀기도 하고 그런데 그분들이 행사 같은 거 있을 때 지방으로 오시기도 하잖아요.
그런 기회가 있었는데 저는 이 코로나와,그런 기회가 있었는데 저는 이 코로나와
뭐 군대라던지 그분들에 이슈가 생길 거를 상상도 못하고,뭐 군대라던지 그분들에 이슈가 생길 거를 상상도 못하고
언제든 내가 준비되면 보겠지라는 안일한 생각을 했던 거 같애요.,언제든 내가 준비되면 보겠지라는 안일한 생각을 했던 거 같애요.
그리고 그 앞서 말씀하신 방탄소년단이나 약간 세계적인 아티스트 같은 경우들은,그리고 그 앞서 말씀하신 방탄소년단이나 약간 세계적인 아티스트 같은 경우들은
일 년에 월드투어를 하잖아요.,일 년에 월드투어를 하잖아요.
근데 제가 좋아하는 그 아티스트들 팬들 문화가 좋아하는,근데 제가 좋아하는 그 아티스트들 팬들 문화가 좋아하는
아티스트에 최애가 막 같거나 아니면 그룹이 같으면,아티스트에 최애가 막 같거나 아니면 그룹이 같으면
뭐 트위터라던지 실제 친구라던지 그 아티스트가 해외에 어느 여러 국가를 다니잖아요 그 마음에 드는 국가를 선택해서,뭐 트위터라던지 실제 친구라던지 그 아티스트가 해외에 어느 여러 국가를 다니잖아요 그 마음에 드는 국가를 선택해서
그분의 월드투어도 감상을 하고,그분의 월드투어도 감상을 하고
그 주변에 관광지도 돌아다니는 일석이조에 그런,그 주변에 관광지도 돌아다니는 일석이조에 그런
투어를 많이 다니 투어랑 여행을 많이 다니시더라고요.,투어를 많이 다니 투어랑 여행을 많이 다니시더라고요.
근데 처음에 저는 아 저러다가 싸우면 어떡할라고 그러지 저기까지 갔는데 뭐~ 아티스트가 별로 거나,근데 처음에 저는 아 저러다가 싸우면 어떡할라고 그러지 저기까지 갔는데 뭐~ 아티스트가 별로 거나
아티스트의 태도가 별로면 어떡하지 이런 생각을 했던 거 같애요.,아티스트의 태도가 별로면 어떡하지 이런 생각을 했던 거 같애요.
근데 막상 코로나가 터지고,근데 막상 코로나가 터지고
정말 볼 수 없는 기회들 아 볼 수 있는 기회들이 줄어들고,정말 볼 수 없는 기회들 아 볼 수 있는 기회들이 줄어들고
막상 진짜 앞으로 어떻게 될지 모르겠다 이런 생각이 드니까,막상 진짜 앞으로 어떻게 될지 모르겠다 이런 생각이 드니까
그런 게 너무 아쉬웠던 거 같애요.,그런 게 너무 아쉬웠던 거 같애요.
근데 또 실제로는 다른 가수들의 공연이나,근데 또 실제로는 다른 가수들의 공연이나
만날 수 있는 기회에 제가 다 나가지 않은 건 또 아니거든요.,만날 수 있는 기회에 제가 다 나가지 않은 건 또 아니거든요.
오히려 한때 제가 힙합을 좋아했었는데,오히려 한때 제가 힙합을 좋아했었는데
힙합 가수들 같은 경우에는 그 공연을 따라다니거나 콘서트에 참석하고,힙합 가수들 같은 경우에는 그 공연을 따라다니거나 콘서트에 참석하고
무슨 페스티벌 가서 막 열몇 시간 동안 뛰어서 놀고 이런 경험도 있는데,무슨 페스티벌 가서 막 열몇 시간 동안 뛰어서 놀고 이런 경험도 있는데
왜 그분들 공연에는 가지 않았는지 정말 후회가 돼요 그리고,왜 그분들 공연에는 가지 않았는지 정말 후회가 돼요 그리고
만약에 코로나가 나아진다면,만약에 코로나가 나아진다면
꼭 월드투어를 가서 공연도 보고,꼭 월드투어를 가서 공연도 보고
그 나라도 즐기는 그런 걸 꼭 해보고 싶어요.,그 나라도 즐기는 그런 걸 꼭 해보고 싶어요.
혹시  님 같은 경우에는 뭐 레드벨벳이나,혹시  님 같은 경우에는 뭐 레드벨벳이나
아이즈원이나 뭐~ 기타 다른 여러 가수들을 본 경험이 있거나 뭐~ 공연을 본 경험이 있는지 궁금하고,아이즈원이나 뭐~ 기타 다른 여러 가수들을 본 경험이 있거나 뭐~ 공연을 본 경험이 있는지 궁금하고
만약에 코로나가 나아진다면 그런 곳에 갈 의향이 있는지 궁금하고,만약에 코로나가 나아진다면 그런 곳에 갈 의향이 있는지 궁금하고
성덕에 기준이 어떻게 생각하시는지 궁금해요.,성덕에 기준이 어떻게 생각하시는지 궁금해요.
네 저는 인제 말씀드렸다시피 막 옛날에는 막 연예인들 찾아서 보진 않고,네 저는 인제 말씀드렸다시피 막 옛날에는 막 연예인들 찾아서 보진 않고
그냥 뭐 우연치 않게 군대에 있을 때 그런 문화가 있어서 이렇게 해서 인제 빠지게 된 계기가 있었는데,그냥 뭐 우연치 않게 군대에 있을 때 그런 문화가 있어서 이렇게 해서 인제 빠지게 된 계기가 있었는데
저가 인제 군대 생활을 의경을 나왔는데 어~,저가 인제 군대 생활을 의경을 나왔는데 어~
이 년 전인가 부산에 저기 시민공원 쪽에,이 년 전인가 부산에 저기 시민공원 쪽에
그~ 막 페스티벌을 한 적이 있어요 뭐~ 부산 무슨 월드 머시기 뭐 정확하게 기억 안 나는데 페스티벌 한 적이 있는데,그~ 막 페스티벌을 한 적이 있어요 뭐~ 부산 무슨 월드 머시기 뭐 정확하게 기억 안 나는데 페스티벌 한 적이 있는데
그렇게 사람이 많이 많이 모이는 곳에는 이케 안전사고가 발생할 수 있기 때문에,그렇게 사람이 많이 많이 모이는 곳에는 이렇게 안전사고가 발생할 수 있기 때문에
어 안전요원들이나 저희 같은 의경이 가서 펜스를 치거나 뒤에 뒷무대 관리를 해요.,어 안전요원들이나 저희 같은 의경이 가서 펜스를 치거나 뒤에 뒷무대 관리를 해요.
근데 지나가면서 저희가,근데 지나가면서 저희가
제가 그때 금 담당했던 근무지는 그~ 무대 뒤쪽었는데,제가 그때 금 담당했던 근무지는 그~ 무대 뒤쪽었는데
그쪽에 인제 연예인들이 막 올라왔다 내려가면서 인제 무대 끝나면 내려가고 올 무대 시작이면 올라가고 그때 막,그쪽에 인제 연예인들이 막 올라왔다 내려가면서 인제 무대 끝나면 내려가고 올 무대 시작이면 올라가고 그때 막
팬들이 막 갑자기 뒤에서 뛰쳐들오는 경우 이런 경우가 있을까 봐 저희는 그거를,팬들이 막 갑자기 뒤에서 뛰쳐들오는 경우 이런 경우가 있을까 봐 저희는 그거를
막아주는 역할을 하는데,막아주는 역할을 하는데
그쪽에서 많은 연예인들을 봤거든요 뭐~ 레드벨벳도 실제로 봤고,그쪽에서 많은 연예인들을 봤거든요 뭐~ 레드벨벳도 실제로 봤고
어~ 김종국도 봤고 뭐~ 백지영도 봤고,어~ 김종국도 봤고 뭐~ 백지영도 봤고
어~ 그다음에 그때 볼빤간 사춘기도 봤고 에일리도 봤고 뭐~ 되게 많이 본 거 같은데 진짜,어~ 그다음에 그때 볼빤간 사춘기도 봤고 에일리도 봤고 뭐~ 되게 많이 본 거 같은데 진짜
너무 연애인 분들이 그때가 밤이었는데 너무 키도 짝고 엄청 마르셔가지고,너무 연애인 분들이 그때가 밤이었는데 너무 키도 작고 엄청 마르셔가지고
처음에는 지나간 지도 몰랐는데,처음에는 지나간 지도 몰랐는데
저희 가까이 지나가면서 얼굴 보니까 우와 진짜 일반 사람들하고 너무 다른 거예요 진짜 따른 나라에서 온 거처럼 너무 이쁘시고 잘생기고,저희 가까이 지나가면서 얼굴 보니까 우와 진짜 일반 사람들하고 너무 다른 거예요 진짜 다른 나라에서 온 거처럼 너무 이쁘시고 잘생기고
그런 분들도 많았고 저는 김종국을 보고 놀랐던 게,그런 분들도 많았고 저는 김종국을 보고 놀랐던 게
방송 이미지에서 보면은,방송 이미지에서 보면은
엄청 덩치 클 거 같고 근육이 엄청 막,엄청 덩치 클 거 같고 근육이 엄청 막
우락부락할 거 같은데 생각보다,우락부락할 거 같은데 생각보다
이렇게 덩치가 크지 않고 비율도 되게 좋고,이렇게 덩치가 크지 않고 비율도 되게 좋고
어~ 그렇게 생각보다 덩치가 크진 않더라고요 거기서 쫌 놀랐고 네 뭐~ 다른 데는 뭐 바다 가서 아이유를 보고 그런 적 있습니다.,어~ 그렇게 생각보다 덩치가 크진 않더라고요 거기서 조금 놀랐고 네 뭐~ 다른 데는 뭐 바다 가서 아이유를 보고 그런 적 있습니다.
