사투리,표준어
일기도 쓰기는 써요 자주 까먹어서 자주는 안 쓰지만,일기도 쓰기는 써요 자주 까먹어서 자주는 안 쓰지만
씨도 혹시 가끔 과거를 생각하는,씨도 혹시 가끔 과거를 생각하는
그런 취미생활이 있으신가 여쭤봅니다.,그런 취미생활이 있으신가 여쭤봅니다.
네 일기를 말씀을 하셨는데,네 일기를 말씀을 하셨는데
제가 지금은 거의 안 쓴 지가 사 개월인 것 같은데 일기를,제가 지금은 거의 안 쓴 지가 사 개월인 것 같은데 일기를
다시 쓰긴 쓸 거예요 진짜 언제가 될지를 모르겠지만,다시 쓰긴 쓸 거예요 진짜 언제가 될지를 모르겠지만
또 오늘 이게 하루하루 미루다 보니까 되게 귀찮아지더라구요.,또 오늘 이게 하루하루 미루다 보니까 되게 귀찮아지더라구요.
그래도 뭐~ 다시 쓰긴 쓸 건데 지금,그래도 뭐~ 다시 쓰긴 쓸 건데 지금
거의 연말이 다 와가는 시점에 내년 일월 일 일부터 다시 쓸까를 또 생각을 또 하고 있고 왜냐면 제가,거의 연말이 다 와가는 시점에 내년 일월 일 일부터 다시 쓸까를 또 생각을 또 하고 있고 왜냐면 제가
올해 쫌 개인적인 사정으로 인해서 올해 자체가 조끔 거의 날려보낸 한 해가 됐어요 제가,올해 조금 개인적인 사정으로 인해서 올해 자체가 조끔 거의 날려보낸 한 해가 됐어요 제가
올해 자체가 코로나도 있지만,올해 자체가 코로나도 있지만
개인적인 작년에 좀 겪은 안 좋은 일로 인해서 그냥 거의 올해는 진짜,개인적인 작년에 좀 겪은 안 좋은 일로 인해서 그냥 거의 올해는 진짜
집에 있는 시간이 엄청 많았고 일도 제대로 안 했고 뭐~ 특별히 한 게 없거든요.,집에 있는 시간이 엄청 많았고 일도 제대로 안 했고 뭐~ 특별히 한 게 없거든요.
제가 일기를 쓰게 된 게 뭔가 나중에 읽게 되면 되게 재밌겠다.,제가 일기를 쓰게 된 게 뭔가 나중에 읽게 되면 되게 재밌겠다.
또 뭔가 저의 기록을 남겨두고 싶어서?,또 뭔가 저의 기록을 남겨두고 싶어서?
제가 이 일기라는 걸 정말 옛날부터 생각은 했었지만 쓰게 된 거는,제가 이 일기라는 걸 정말 옛날부터 생각은 했었지만 쓰게 된 거는
제가 작년 일월 일 일부터 계속 써 오고 있었어요.,제가 작년 일월 일 일부터 계속 써 오고 있었어요.
그러다 보니까 좋은 게 확실히 나중에 읽으면 되게 재미도 있고,그러다 보니까 좋은 게 확실히 나중에 읽으면 되게 재미도 있고
남들이랑 시간적인 부분에서,남들이랑 시간적인 부분에서
뭔가 의견 차이가 날 때가 있어요.,뭔가 의견 차이가 날 때가 있어요.
니가 언제 이랬다 내가 언제 이랬다 우리 언제 이거 만나서 뭐 먹었다 했을 때,니가 언제 이랬다 내가 언제 이랬다 우리 언제 이거 만나서 뭐 먹었다 했을 때
잠깐만 내 일기 볼게 이때인데 아~ 그랬나 이렇게,잠깐만 내 일기 볼게 이때인데 아~ 그랬나 이렇게
되게 깔끔하게 정리가 될 때도 있고 제가,되게 깔끔하게 정리가 될 때도 있고 제가
일기를 어떤 걸로 쓰시는 지 제가 잘 모르겠지만,일기를 어떤 걸로 쓰시는 지 제가 잘 모르겠지만
저 같은 경우에는 데일리노트라고 하는 한 어플을 통해서 계속 쓰고 있어?,저 같은 경우에는 데일리노트라고 하는 한 어플을 통해서 계속 쓰고 있어?
이 어플이 제일 좋은지도 모르겠어요 왜냐면 제가 처음부터 이 어플을,이 어플이 제일 좋은지도 모르겠어요 왜냐면 제가 처음부터 이 어플을
사용을 했기 때문에 근데 저는 이 어플이 아무래도 타자 치기도 편하고,사용을 했기 때문에 근데 저는 이 어플이 아무래도 타자 치기도 편하고
일기를 지어 손으로 쓰는 것도 정말 의미가 있겠지만,일기를 지어 손으로 쓰는 것도 정말 의미가 있겠지만
어플을 이용해서 쓰면 제가 긴 내용이라도 실제로,어플을 이용해서 쓰면 제가 긴 내용이라도 실제로
정말 길 때는 정말 에이포 한 장 분량이 나올 때도 있거든요 일기가,정말 길 때는 정말 에이포 한 장 분량이 나올 때도 있거든요 일기가
그렇게 해서 저는 이렇게 일기를 쓰게 되는 거 같습니다.,그렇게 해서 저는 이렇게 일기를 쓰게 되는 거 같습니다.
