사투리,표준어
약을 먹었을 때 부작용이라던가 아니면 독감 주사를 맞았을 때,약을 먹었을 때 부작용이라던가 아니면 독감 주사를 맞았을 때
좀 아팠다던 막 열이 났다던가 그렇 그랬던 적 있어?,좀 아팠다던 막 열이 났다던가 그렇 그랬던 적 있어?
독감 주사를 맡고 부작용이 일어나거나 뭐~ 약을 먹고 부작용 일어난 적은 없는데,독감 주사를 맡고 부작용이 일어나거나 뭐~ 약을 먹고 부작용 일어난 적은 없는데
어릴 때 운동을 많이 하다 보니까 발목 쪽이나,어릴 때 운동을 많이 하다 보니까 발목 쪽이나
다리 팔목에 염증이 많이 생기고 그랬었단 말이야.,다리 팔목에 염증이 많이 생기고 그랬었단 말이야.
그래서 이제 병원에 가면,그래서 이제 병원에 가면
주사가 야 항생제 약이 아이라 항생제 주사 같은 게 있어 그거를 이제 뼈나 이런,주사가 야 항생제 약이 아니라 항생제 주사 같은 게 있어 그거를 이제 뼈나 이런
그~ 뭐라고 해야 되지.,그~ 뭐라고 해야 되지.
근육 그쪽에까지 바늘을 꽂아서 주사를 놓는 건데 그걸 하도 많이 맞으니까,근육 그쪽에까지 바늘을 꽂아서 주사를 놓는 건데 그걸 하도 많이 맞으니까
어쩔 한 어쩔 때 한 번이었거든.,어쩔 한 어쩔 때 한 번이었거든.
딱 맞았는데 집에 오니까 온몸에 두드러기가 막 나는 거야.,딱 맞았는데 집에 오니까 온몸에 두드러기가 막 나는 거야.
그래가지고,그래가지고
다시 병원에 갔는데 왜 부작용이라고 하더라구 그때 깜짝 놀랐던 게 살면서 그렇게 몸에 두드러기 올라온 적이 없는데,다시 병원에 갔는데 왜 부작용이라고 하더라구 그때 깜짝 놀랐던 게 살면서 그렇게 몸에 두드러기 올라온 적이 없는데
되게 놀래 가지고 나도,되게 놀래 가지고 나도
그땐 어렸으니까 되게 쫌 병원 가면서 막 카 차,그땐 어렸으니까 되게 조금 병원 가면서 막 카 차
병원 가는 차 안에서 막 울고,병원 가는 차 안에서 막 울고
그랬었던 기억이,그랬었던 기억이
너는 그~ 뭐~ 사람들마다 다르잖아 이런 사람 뭐~,너는 그~ 뭐~ 사람들마다 다르잖아 이런 사람 뭐~
몸이 아프면 참는 사람이 있고 병원에 잘 안 가고 참는 사람이 있고 있는 반면에,몸이 아프면 참는 사람이 있고 병원에 잘 안 가고 참는 사람이 있고 있는 반면에
몸이 쪼끔이라도 아프면 병원이 큰 병원이나 어느 병원이나 가서 검사해보고 약 먹고 그런 사람들 있잖아.,몸이 쪼끔이라도 아프면 병원이 큰 병원이나 어느 병원이나 가서 검사해보고 약 먹고 그런 사람들 있잖아.
너는 어떤 유형이며 뭐~,너는 어떤 유형이며 뭐~
앞으로는 만약에 너가 뭐~ 병을 참는 성향이라면,앞으로는 만약에 너가 뭐~ 병을 참는 성향이라면
바뀌게 될 거 같은지 아니면 생각을 다르게 할 거 같은지,바뀌게 될 거 같은지 아니면 생각을 다르게 할 거 같은지
말해줄 수 말해 줄 수 있어?,말해줄 수 말해 줄 수 있어?
일단 아프면 병원 잘 안 가거든.,일단 아프면 병원 잘 안 가거든.
그런데 막 쪼끔만 아파도 큰 병원을 안 가는 이유가,그런데 막 쪼끔만 아파도 큰 병원을 안 가는 이유가
일단 한 일 년에 한 번씩 건강 검진 하니까 어~ 내가 문 몸에 이상이 있나 이런 생각이 안 드는 거지 이미 다 검진을 했고,일단 한 일 년에 한 번씩 건강 검진 하니까 어~ 내가 문 몸에 이상이 있나 이런 생각이 안 드는 거지 이미 다 검진을 했고
보통 병이 발생하더라두,보통 병이 발생하더라두
일 년은 적어도 걸릴 텐데 막 갑자 한 달 만에 갑자기 없던 암이 생기고,일 년은 적어도 걸릴 텐데 막 갑자 한 달 만에 갑자기 없던 암이 생기고
이러지 않잖아 보통 조직이 다 보이고 하니까,이러지 않잖아 보통 조직이 다 보이고 하니까
그래서,그래서
갑자기 아파도 딱히 놀라 놀라지 않고 걍,갑자기 아파도 딱히 놀라 놀라지 않고 그냥
그래서 큰 병원도 딱히 안 가는 거 같애 어차피 검사하니까,그래서 큰 병원도 딱히 안 가는 거 같애 어차피 검사하니까
그~ 이상이 없었으니까,그~ 이상이 없었으니까
그런 거고 병원을 가더라도,그런 거고 병원을 가더라도
감기를 걸려서 병원을 가더라도,감기를 걸려서 병원을 가더라도
걍 보통 약 받으러 가거나 그런 느낌이잖아.,그냥 보통 약 받으러 가거나 그런 느낌이잖아.
그래서 잘 안 가는 거 같애 병원은 그리고,그래서 잘 안 가는 거 같애 병원은 그리고
항생제 먹는 것도 되게 힘들 힘들고,항생제 먹는 것도 되게 힘들 힘들고
진짜 당장 뭐~ 말이 안 나올 만큼 목이 아프고,진짜 당장 뭐~ 말이 안 나올 만큼 목이 아프고
밥을 못 먹을 만큼 위가 너무 아프고 이럴 때는 꼭 가지 근데 그런 경우가 아닌데,밥을 못 먹을 만큼 위가 너무 아프고 이럴 때는 꼭 가지 근데 그런 경우가 아닌데
병원을 막 가는 편 아닌 거 같구,병원을 막 가는 편 아닌 거 같구
사실 이런 거에서도 엄마 아빠도 쫌 잘 맞는데 엄마 아빠가 막,사실 이런 거에서도 엄마 아빠도 조금 잘 맞는데 엄마 아빠가 막
어릴 때부터 아프다고 해도 막 하 어떻게 막 이런 스타일이 아니야 되게 그냥 괜찮다 그거 자고 나면 괜찮아진다 약간 이런 스타일이거든 그래서,어릴 때부터 아프다고 해도 막 하 어떻게 막 이런 스타일이 아니야 되게 그냥 괜찮다 그거 자고 나면 괜찮아진다 약간 이런 스타일이거든 그래서
그래서 당장 뭐~ 요기가 퉁퉁 붓거나 이래도 그냥,그래서 당장 뭐~ 요기가 퉁퉁 붓거나 이래도 그냥
그거 세 시간 있으면 까라앉는다 이랬는데 진짜 별로 크게 그 문제 된 적이 없어가지구,그거 세 시간 있으면 가라앉는다 이랬는데 진짜 별로 크게 그 문제 된 적이 없어가지구
더 그러는 거 같애.,더 그러는 거 같애.
그리구 옛날에 나,그리구 옛날에 나
