사투리,표준어
그렇게 하니까 좋아했었던 것 같아요 그거랑 또,그렇게 하니까 좋아했었던 것 같아요 그거랑 또
방향제 곰돌이 모양 그려져 있는 방향제 샀었는데 그런 거 나눠 줬을 때 좋아했던 것 같아요.,방향제 곰돌이 모양 그려져 있는 방향제 샀었는데 그런 거 나누어 줬을 때 좋아했던 것 같아요.
대만에서는 어떤 숙소에서 묵으셨어요?,대만에서는 어떤 숙소에서 묵으셨어요?
대만엔 친구랑 가서 리조트?,대만엔 친구랑 가서 리조트?
호텔 같은 곳에 묵었는데,호텔 같은 곳에 묵었는데
대만도 생각보다 좀 싼 가격에?,대만도 생각보다 좀 싼 가격에?
일 박에 한 칠만 원 팔만 원 정도였나 그랬는데 되게 시설 좋고 예쁘고 이래서 만족했던 것 같아요.,일 박에 한 칠만 원 팔만 원 정도였나 그랬는데 되게 시설 좋고 예쁘고 이래서 만족했던 것 같아요.
그러면 대만 가셨을 때 제일 맛있게 먹었던 음식은 어떤 거 있으세요?,그러면 대만 가셨을 때 제일 맛있게 먹었던 음식은 어떤 거 있으세요?
사실 대만 음식을 많이 먹어봤어야 됐는데,사실 대만 음식을 많이 먹어봤어야 됐는데
친구가 향신료에 너무 약해서,친구가 향신료에 너무 약해서
그냥 거기 가보니까 생각보다 일본풍이 되게 많더라고요.,그냥 거기 가보니까 생각보다 일본풍이 되게 많더라고요.
스시 초밥 같은 거 자주 사오고,스시 초밥 같은 거 자주 사오고
제가 먹었던 것 중에는 그나마 훠궈?,제가 먹었던 것 중에는 그나마 훠궈?
가 제일 맛있어서 거기서 유명한 훠궈 뷔페가 있었거든요 에그타르트도 있고 그래서,가 제일 맛있어서 거기서 유명한 훠궈 뷔페가 있었거든요 에그타르트도 있고 그래서
거기서 먹었던 훠궈가 제일 기억에 남는 것 같아요.,거기서 먹었던 훠궈가 제일 기억에 남는 것 같아요.
저는 그때 일월 이월에 가서 좀 추운 날씨였는데 혹시 어떤 계절에 가셨어요?,저는 그때 일월 이월에 가서 좀 추운 날씨였는데 혹시 어떤 계절에 가셨어요?
저는 가을에 갔었는데 저도 약간 가을이랑 겨울 끝자락 쯤에,저는 가을에 갔었는데 저도 약간 가을이랑 겨울 끝자락 쯤에
갔다 와서 제가 준비한 건 완전 가을 옷이었는데 친구가,갔다 와서 제가 준비한 건 완전 가을 옷이었는데 친구가
가을 가을보다 좀 추울 거라고 말을 했는데 제가 그냥,가을 가을보다 좀 추울 거라고 말을 했는데 제가 그냥
얇은 니트 정도만 준비해가지고,얇은 니트 정도만 준비해가지고
되게 추워했던 기억이 있어요 얇은 니트에 가디건도 껴입고 그렇게 다녔었는데,되게 추워했던 기억이 있어요 얇은 니트에 가디건도 껴입고 그렇게 다녔었는데
어쨌든 되게 재밌고 즐거웠던 기억인 것 같아요.,어쨌든 되게 재밌고 즐거웠던 기억인 것 같아요.
그러면 그  배낭여행을 되게 쭉 갔다오셨다고 했잖아요 그 다녀오신,그러면 그  배낭여행을 되게 쭉 갔다오셨다고 했잖아요 그 다녀오신
나라 중에 제일 좋았던 나라 어떤 데였어요?,나라 중에 제일 좋았던 나라 어떤 데였어요?
저는 터키가 제일 좋았던 거 같아요 터키에 한 달 정도 있었는데,저는 터키가 제일 좋았던 거 같아요 터키에 한 달 정도 있었는데
터키는 가는 지역마다 정말 다 처음 가보는 듯한 이국적인 모습이라서,터키는 가는 지역마다 정말 다 처음 가보는 듯한 이국적인 모습이라서
정말 좋았고 먹는 것도 다,정말 좋았고 먹는 것도 다
약간 한국적으로 먹을 수 있는 음식도 있었고 또 약간 터키를 형제의 나라라고 부르다보니,약간 한국적으로 먹을 수 있는 음식도 있었고 또 약간 터키를 형제의 나라라고 부르다보니
이제 거기 계신 분들도 한국에서 왔다고 하면 더 친절하게 해주고,이제 거기 계신 분들도 한국에서 왔다고 하면 더 친절하게 해주고
또 거기서 현지인이랑 친해졌어가지고 집에도 직접 놀러가 볼 수 있어서,또 거기서 현지인이랑 친해졌어가지고 집에도 직접 놀러가 볼 수 있어서
되게 좋았던 것 같아요.,되게 좋았던 것 같아요.
그때 제가 패러글라이딩을 했었는데 되게 재밌었거든요 혹시 한국에서라도,그때 제가 패러글라이딩을 했었는데 되게 재밌었거든요 혹시 한국에서라도
뭐 패러글라이딩 해 본 적 있으세요?,뭐 패러글라이딩 해 본 적 있으세요?
사실 작년 여름 휴가 때,사실 작년 여름 휴가 때
가족들이랑 패러글라이딩를 하자 이런 말이 나왔었는데,가족들이랑 패러글라이딩를 하자 이런 말이 나왔었는데
저희 오빠가 되게 겁이 많아가지고 패러글라이딩 하다가 하반신 불구된다고 다 못하게 해가지고,저희 오빠가 되게 겁이 많아가지고 패러글라이딩 하다가 하반신 불구된다고 다 못하게 해가지고
그거는 아직 못 해봤어요 근데 제 버킷리스트에 있는 것 중 하나예요.,그거는 아직 못 해봤어요 근데 제 버킷리스트에 있는 것 중 하나예요.
여행에서 이런  이그사이팅?,여행에서 이런  이그사이팅?
이라고 많이 하잖아요 어떤 거 해보셨어요?,이라고 많이 하잖아요 어떤 거 해보셨어요?
저는 원래 해외여행 갔을 때 스카이다이빙도 해보고 싶었는데,저는 원래 해외여행 갔을 때 스카이다이빙도 해보고 싶었는데
갑자기 또 할려고 하니 무서워서 못 해봤었고,갑자기 또 할려고 하니 무서워서 못 해봤었고
패러글라이딩이랑 스노우쿨링은 제가,패러글라이딩이랑 스노우쿨링은 제가
세부 갔을 때?,세부 갔을 때?
한 번 해봤었는데 되게 엄청 좋았던 것 같아요 혹시 스노우쿨링은 해 보셨어요?,한 번 해봤었는데 되게 엄청 좋았던 것 같아요 혹시 스노우쿨링은 해 보셨어요?
저는 해외에서는 아니고 제주도에서 짧게 해봤는데,저는 해외에서는 아니고 제주도에서 짧게 해봤는데
사실 제가 그때 배를 처음 타 봤는데  거기 하러 가는,사실 제가 그때 배를 처음 타 봤는데  거기 하러 가는
스노우쿨링을 하러 가는?,스노우쿨링을 하러 가는?
그 도중에 배가 되게 흔들려가지고,그 도중에 배가 되게 흔들려가지고
너무 뱃멀미가 심해서 그 스노우쿨링을 즐기기가 힘들었던 것 같아요.,너무 뱃멀미가 심해서 그 스노우쿨링을 즐기기가 힘들었던 것 같아요.
