사투리,표준어
그~ 케이팝 스타 출신인데 노래 엄청 잘하는 목소리도 좋고,그~ 케이팝 스타 출신인데 노래 엄청 잘하는 목소리도 좋고
저 약간,저 약간
잔잔하게 부르는 그런 사람들 좋아하거든요 적재나,잔잔하게 부르는 그런 사람들 좋아하거든요 적재나
뭐 권진아 정승환,뭐 권진아 정승환
김동률 약간 이런 사람들 이소라까지도,김동률 약간 이런 사람들 이소라까지도
콘서트 같은 것도,콘서트 같은 것도
뭐 예전에 코로나 전에 하면은 취미로,뭐 예전에 코로나 전에 하면은 취미로
많이 다녀보셨나요?,많이 다녀보셨나요?
콘서트는 자주 안 가봤어요 한번?,콘서트는 자주 안 가봤어요 한번?
옛날에,옛날에
쫌 막 다양한 가수 나오는 드림 콘서트라고 거기 한번 가본 적 있고,조금 막 다양한 가수 나오는 드림 콘서트라고 거기 한번 가본 적 있고
대부분 그냥 유튜브나,대부분 그냥 유튜브나
그런 걸로 듣기만 하구요.,그런 걸로 듣기만 하구요.
어~ 저도 권진아 좋아해요 권진아에 그녀가 말했다랑 끝 이런 거,어~ 저도 권진아 좋아해요 권진아에 그녀가 말했다랑 끝 이런 거
이런 노래 되게 자주 들어요.,이런 노래 되게 자주 들어요.
콘서트는 누구 콘서트 가보셨어요?,콘서트는 누구 콘서트 가보셨어요?
근데 콘서트도 좋았는데 그니까 제가 콘서트를 다닐 때는,근데 콘서트도 좋았는데 그니까 제가 콘서트를 다닐 때는
좋아하는 가수 약간 어릴 때부터 좋아했던 가수,좋아하는 가수 약간 어릴 때부터 좋아했던 가수
약간 아이돌을 어릴 때 좋아하고 그래서 아이돌로 사진 모으고,약간 아이돌을 어릴 때 좋아하고 그래서 아이돌로 사진 모으고
아이돌들 무대 영상 찾아보고 이런 게 그때는 완전히 제 취미생활에 전부였거든요.,아이돌들 무대 영상 찾아보고 이런 게 그때는 완전히 제 취미생활에 전부였거든요.
그때 제가 좋아했던,그때 제가 좋아했던
아이돌 콘서트 많이 갔었거든요.,아이돌 콘서트 많이 갔었거든요.
근데 그 이후에는 거의,근데 그 이후에는 거의
뭐 돈 쓸 일도 많아지고 하다 보니까 못 가고,뭐 돈 쓸 일도 많아지고 하다 보니까 못 가고
이제 좀 가볼까 하니까는,이제 좀 가볼까 하니까는
코로나가 이렇게 돼 가지구 공연도 잘 안 하고,코로나가 이렇게 돼 가지구 공연도 잘 안 하고
공연을 해도 제가 쫌 가기가 뭔가 쫌,공연을 해도 제가 조금 가기가 뭔가 조금
찝찝하더라구요.,찝찝하더라구요.
그래서,그래서
못 가고 있어요.,못 가고 있어요.
혹시 뭐,혹시 뭐
노래를 들으실 때는,노래를 들으실 때는
어떤 그~ 플랫폼 이용하세요 저는 플로라는 어플로 듣고 있거든요.,어떤 그~ 플랫폼 이용하세요 저는 플로라는 어플로 듣고 있거든요.
근데 노래가 가끔씩 없는 것도 많아가주구,근데 노래가 가끔씩 없는 것도 많아가주구
너무 대중적이지 않은 노래를 들을려고 하면은,너무 대중적이지 않은 노래를 들을려고 하면은
검색하면은 지원하지 않는다고 안 나오더라구요.,검색하면은 지원하지 않는다고 안 나오더라구요.
혹시 어떤 걸로 노래 들으시나요?,혹시 어떤 걸로 노래 들으시나요?
저도 통신사가 에스케이라서 플로로 들었었는데,저도 통신사가 에스케이라서 플로로 들었었는데
요즘 집에만 있어서 요금제를 바꾸니까,요즘 집에만 있어서 요금제를 바꾸니까
그~ 기본으로 들을 수 있는 걸 못 듣게 하더라구요.,그~ 기본으로 들을 수 있는 걸 못 듣게 하더라구요.
그래서 그걸로 지금 못 듣게 돼서,그래서 그걸로 지금 못 듣게 돼서
이~ 유튜브를 제일 많이 이용하는 거 같아요.,이~ 유튜브를 제일 많이 이용하는 거 같아요.
유튜브에도,유튜브에도
유튜브에는 치면 그냥 거의 다 나오는 거 같더라구요.,유튜브에는 치면 그냥 거의 다 나오는 거 같더라구요.
별로 안 유명한 인디 음악이라도?,별로 안 유명한 인디 음악이라도?
그래서 그냥 유튜브로 쪼끔,그래서 그냥 유튜브로 쪼끔
광고 있는 것도 귀찮지만 그래도 유튜브로 자주 듣는 거 같아요.,광고 있는 것도 귀찮지만 그래도 유튜브로 자주 듣는 거 같아요.
그림 그리는 거는 좋아하세요?,그림 그리는 거는 좋아하세요?
아니요 저는 그림을 잘못 그려가지고,아니요 저는 그림을 잘못 그려가지고
솔직 게으르기도 하고 할 줄 아는 게 많이 없어가지고 취미가 쫌 별로 없는,솔직히 게으르기도 하고 할 줄 아는 게 많이 없어가지고 취미가 조금 별로 없는
편이거든요 저는,편이거든요 저는
근데 그림 잘 그려가주고,근데 그림 잘 그려가주고
어떤 여행지에 가서,어떤 여행지에 가서
막 그~,막 그~
장면을 그~ 자기가 좋아하는 장면을 그림으로,장면을 그~ 자기가 좋아하는 장면을 그림으로
남는 남기는 사람들 보면 되게,남는 남기는 사람들 보면 되게
멋있더라구요 그래서,멋있더라구요 그래서
저도 그림을 쫌 잘 그리고 싶다는 생각을 많이 해봤어요.,저도 그림을 조금 잘 그리고 싶다는 생각을 많이 해봤어요.
