사투리,표준어
이런 거를 통해서 제가 쫌 믿었던 구매평에 대한 신뢰도가 좀 떨어졌던 경험이 있어요.,이런 거를 통해서 제가 조금 믿었던 구매평에 대한 신뢰도가 좀 떨어졌던 경험이 있어요.
혹시 뭐~ 지금 기간으로 들어오면서 알바 자리가 들어왔지만 쫌 하기 싫었던 하기 싫었던 그런 알바도 있었을까요?,혹시 뭐~ 지금 기간으로 들어오면서 알바 자리가 들어왔지만 조금 하기 싫었던 하기 싫었던 그런 알바도 있었을까요?
최근에는 사실 알바 자리 자체가 없더라고요 그래서,최근에는 사실 알바 자리 자체가 없더라고요 그래서
그냥 예전에는 사실 전단지도 한 번 몇 번 돌리러 몇 번 가 봤었는데,그냥 예전에는 사실 전단지도 한 번 몇 번 돌리러 몇 번 가 봤었는데
요즘은 또 다들 전단지 자체를 기피하잖아요 괜히 또 막 접촉 있고 이러면은 그것도 싫으니까,요즘은 또 다들 전단지 자체를 기피하잖아요 괜히 또 막 접촉 있고 이러면은 그것도 싫으니까
그거라도 춥지만은 나갈려고 했는데 인제 하도 뭐~ 아르 이거 코로나 땜에,그거라도 춥지만은 나갈려고 했는데 인제 하도 뭐~ 아르 이거 코로나 땜에
다들 경제도 위축되고 하니까 아~ 그런 잡일 자리도 없더라고요 그래서 그런 쪽으로는,다들 경제도 위축되고 하니까 아~ 그런 잡일 자리도 없더라고요 그래서 그런 쪽으로는
안 하고 있고 저도 인제 학원 같은 데서 인제 재택으로 할 수 있는 그런 거는 쫌 많이 주더라고요 그냥 인제,안 하고 있고 저도 인제 학원 같은 데서 인제 재택으로 할 수 있는 그런 거는 조금 많이 주더라고요 그냥 인제
어~ 우리 뭐~ 수험서나 뭐~ 인제 애들 뭐 하는 거를 미리 쫌 검토한다고 해야 되나?,어~ 우리 뭐~ 수험서나 뭐~ 인제 애들 뭐 하는 거를 미리 조금 검토한다고 해야 되나?
그~ 미리 보고 뭐~ 생각 같은 거 달아주고 그런 인제 쫌,그~ 미리 보고 뭐~ 생각 같은 거 달아주고 그런 인제 조금
쫌 정신적으로 그런 고통스러운 알바들을 요즘 쫌 많이 하고 있는데,조금 정신적으로 그런 고통스러운 알바들을 요즘 조금 많이 하고 있는데
이게 그냥 또 이제 책을 읽는 거하고 돈을 받고 읽는 거하고는,이게 그냥 또 이제 책을 읽는 거하고 돈을 받고 읽는 거하고는
사실 똑같이 하면 안 되잖아요 구매평 같은 것도 사실 우리가 뭐~ 그냥 인제 그냥 내가 쓴 거를 내가 달면은,사실 똑같이 하면 안 되잖아요 구매평 같은 것도 사실 우리가 뭐~ 그냥 인제 그냥 내가 쓴 거를 내가 달면은
솔직하게 쓸 수 있지만 그렇게 하면 인제 쫌 사용 인제 댓가를 받고 우리가,솔직하게 쓸 수 있지만 그렇게 하면 인제 조금 사용 인제 댓가를 받고 우리가
구매평을 쓰면은 사실 솔직해지기가 힘들잖아요 그래서 약간 그런 측면에서는 쫌 힘들고,구매평을 쓰면은 사실 솔직해지기가 힘들잖아요 그래서 약간 그런 측면에서는 조금 힘들고
아까 말씀하신 구매평 같은 경우는 그게 단가가 생각보다 너무 짜네요.,아까 말씀하신 구매평 같은 경우는 그게 단가가 생각보다 너무 짜네요.
사실 아르바이트 그래도 아무리 아르바이트라지만 사실 돈이 인제 쫌 제일 중요하잖아요 뭐~,사실 아르바이트 그래도 아무리 아르바이트라지만 사실 돈이 인제 조금 제일 중요하잖아요 뭐~
뭐~ 일 강도 이런 것도 중요하지만  저 같은 경우는,뭐~ 일 강도 이런 것도 중요하지만  저 같은 경우는
어~ 돈이 사실 제일 중요하다고 생각하는데 예전에 한 번 인제 경기장에 알바를 하러 갔었는데,어~ 돈이 사실 제일 중요하다고 생각하는데 예전에 한 번 인제 경기장에 알바를 하러 갔었는데
뭐~ 일은 안 힘들었고 적당히 아침에 한 두 시간 세 시간 하고 끝나는데,뭐~ 일은 안 힘들었고 적당히 아침에 한 두 시간 세 시간 하고 끝나는데
인제 거기서 인제 말은 한 뭐~ 이번 주 금요일 뭐~ 내에 들어간다 뭐~ 며칠 안에 들어간다 하고 했는데,인제 거기서 인제 말은 한 뭐~ 이번 주 금요일 뭐~ 내에 들어간다 뭐~ 며칠 안에 들어간다 하고 했는데
돈이 안 들어오더라고요 그래서 한 일주일 더 기다렸는데 또 안 들어오길래,돈이 안 들어오더라고요 그래서 한 일주일 더 기다렸는데 또 안 들어오길래
다시 연락을 해서 인제 연락을 했죠 연락을 했는데 뭐~ 전화도 안 되고,다시 연락을 해서 인제 연락을 했죠 연락을 했는데 뭐~ 전화도 안 되고
문자도 안 받고 그래도 혹시 모르니까 또 기다렸는데 한 한 달 두 달이 되더라도,문자도 안 받고 그래도 혹시 모르니까 또 기다렸는데 한 한 달 두 달이 되더라도
되도 인제 지나도 뭐~ 인제 아무런 연락이 없더라고요 그래서 제가,되도 인제 지나도 뭐~ 인제 아무런 연락이 없더라고요 그래서 제가
노동청에 한 번 신고는 했었던 경험은 있거든요 그러니까,노동청에 한 번 신고는 했었던 경험은 있거든요 그러니까
그~ 노동부에서 한 일주일 안에 인제 금방 처리를 해서,그~ 노동부에서 한 일주일 안에 인제 금방 처리를 해서
인제 거기서 처리 완료가 되기 전에 미리 연락이 와서 인제 돈이 들어오더라고요.,인제 거기서 처리 완료가 되기 전에 미리 연락이 와서 인제 돈이 들어오더라고요.
아~ 그런 거 보면은 그래도 뭐~ 행정 공무원들이 일을 안 하진 않는구나 약간 그런 생각도 들었고,아~ 그런 거 보면은 그래도 뭐~ 행정 공무원들이 일을 안 하진 않는구나 약간 그런 생각도 들었고
또 뭐~ 사실 몇만 원 푼돈이지만 또 못 받으면 기분이 나쁘잖아요.,또 뭐~ 사실 몇만 원 푼돈이지만 또 못 받으면 기분이 나쁘잖아요.
그게 인제 아르바이트하면서 제일 중요한 건데 어~ 혹시 뭐~ 아르바이트하면서 돈 관련 문제가 있으셨던 적은 없으셨나요?,그게 인제 아르바이트하면서 제일 중요한 건데 어~ 혹시 뭐~ 아르바이트하면서 돈 관련 문제가 있으셨던 적은 없으셨나요?
네 돈 관련 해서는 한 번도 그런던 적이 없어요.,네 돈 관련 해서는 한 번도 그런던 적이 없어요.
제가 일했던 곳이 다 이~ 돈을 좀 잘 벌어가지고 돈 관련 해서 문제 된 적은,제가 일했던 곳이 다 이~ 돈을 좀 잘 벌어가지고 돈 관련 해서 문제 된 적은
없었었고 음~ 사실 막 힘들고 어려웠던 것도,없었었고 음~ 사실 막 힘들고 어려웠던 것도
없었어요 왜냐면 아까 말했듯이 제가 했던 일들이 막 남 되게 평범한 것들이,없었어요 왜냐면 아까 말했듯이 제가 했던 일들이 막 남 되게 평범한 것들이
쫌 없었어가지고  평범하지 않으니까 그분들이 돈을 좀 잘 벌더라고요 사장들이나 관리하는 분들이,조금 없었어가지고  평범하지 않으니까 그분들이 돈을 좀 잘 벌더라고요 사장들이나 관리하는 분들이
그래서 은근 일하면 일한대로 따박따박 다 나왔던 거 같애요.,그래서 은근 일하면 일한대로 따박따박 다 나왔던 거 같애요.
근데 처음에 인제 일했던 것들 보면 막 그~ 컨벤션 센터에 뭐~ 부스 짓는 거,근데 처음에 인제 일했던 것들 보면 막 그~ 컨벤션 센터에 뭐~ 부스 짓는 거
이거 인제 일을 배워야 되니까 그거 하면서 쫌 한두 시간 일 배운다고 좀 힘들었고,이거 인제 일을 배워야 되니까 그거 하면서 조금 한두 시간 일 배운다고 좀 힘들었고
처음에 상담사로 일할 때도 그~ 상담 내용들을 원래 기본적으로 알고 있었지만,처음에 상담사로 일할 때도 그~ 상담 내용들을 원래 기본적으로 알고 있었지만
그거 아는 것과 커플들에 대해서 풀어주는 건 또 좀 다르더라고요 그래서 그런 부분들을 좀,그거 아는 것과 커플들에 대해서 풀어주는 건 또 좀 다르더라고요 그래서 그런 부분들을 좀
모두 변화하는 데 쪼끔 힘들었던 거 같애요 어~ 아까 막 이런,모두 변화하는 데 쪼끔 힘들었던 거 같애요 어~ 아까 막 이런
구매평 이런 건 사실 알바라기보단 부업 같은 느낌이었는데 그거는,구매평 이런 건 사실 알바라기보단 부업 같은 느낌이었는데 그거는
아까 우리 말한 거처럼 쫌 보수가,아까 우리 말한 거처럼 조금 보수가
삼천 원이라도 뭐~ 하루에 몇 개 하면 되겠지라고 했는데 뭐~ 일주일에 한 개 들어올까 말까 이 정도 왜냐면 하는 사람이 너무 많대요.,삼천 원이라도 뭐~ 하루에 몇 개 하면 되겠지라고 했는데 뭐~ 일주일에 한 개 들어올까 말까 이 정도 왜냐면 하는 사람이 너무 많대요.
아~ 임산 에이 아이를 놓으신 분들 있잖아요 그런 분들끼리는 완전 막 안에,아~ 임산 에이 아이를 놓으신 분들 있잖아요 그런 분들끼리는 완전 막 안에
커뮤니티에서 다 퍼져 있어가지고 하는 사람이 많다고 하더라 그래서 은근 뭐~ 그냥 까자 버는 용이었던 거 같고,커뮤니티에서 다 퍼져 있어가지고 하는 사람이 많다고 하더라 그래서 은근 뭐~ 그냥 과자 버는 용이었던 거 같고
보통은 제가 다 월급으로 막 받다 보니까 금액이 또 크기도 해서,보통은 제가 다 월급으로 막 받다 보니까 금액이 또 크기도 해서
뭐~ 늦게 나오거나 이거 때문에 뭐~ 컴플레인이 있거나 뭔가 다른,뭐~ 늦게 나오거나 이거 때문에 뭐~ 컴플레인이 있거나 뭔가 다른
어~ 얼굴이 좀 붉혀지는 일은 전혀 없었던 거 같애요 사실 알바를 통해서도,어~ 얼굴이 좀 붉혀지는 일은 전혀 없었던 거 같애요 사실 알바를 통해서도
정직원으로 되는 일도 많잖아요 그래서 만약에 여러 가지 일들을 해나갈 때에,정직원으로 되는 일도 많잖아요 그래서 만약에 여러 가지 일들을 해나갈 때에
이 업무에서 쪼끔 잘해가지고 여러 가지 언제 기회가 열릴지 모르니까깐,이 업무에서 쪼끔 잘해가지고 여러 가지 언제 기회가 열릴지 모르니까깐
해서 그걸을 통해서 쫌 인생을 개척해 나갈 수도 있고 언제 행운이란 게 올지 모르니까,해서 그걸을 통해서 조금 인생을 개척해 나갈 수도 있고 언제 행운이란 게 올지 모르니까
좀 열심히 해보자라는 생각으로 일 배워 보자라는 생각으로 갔었던 것도 많아가지고 사실,좀 열심히 해보자라는 생각으로 일 배워 보자라는 생각으로 갔었던 것도 많아가지고 사실
알바를 하는 부분에 있어서는 저는 쫌 배우고 익힌 게 많은 거 같애요 왜냐 그~ 다른 다 다른,알바를 하는 부분에 있어서는 저는 조금 배우고 익힌 게 많은 거 같애요 왜냐 그~ 다른 다 다른
어~ 분야의 일들을 하다 보니까 그래서 쫌 좋은 경험들이 많은 것 같습니다.,어~ 분야의 일들을 하다 보니까 그래서 조금 좋은 경험들이 많은 것 같습니다.
