사투리,표준어
말고 겨울 겨울에서는 특이하다기보다는,말고 겨울 겨울에서는 특이하다기보다는
저는 겨울에 그~ 쌀국수 먹는 걸 쌀국수 사실 별로 안 좋아하거든요 쌀국수 별로 안 좋아하는데,저는 겨울에 그~ 쌀국수 먹는 걸 쌀국수 사실 별로 안 좋아하거든요 쌀국수 별로 안 좋아하는데
이상하게 겨울만 되면 약간 좀 따뜻한 국물이 땡겨서 그런지,이상하게 겨울만 되면 약간 좀 따뜻한 국물이 땡겨서 그런지
쌀국수도 먹고 또 국밥도 먹으러 다니고,쌀국수도 먹고 또 국밥도 먹으러 다니고
그렇 그러 약간 국밥 많이 먹는 거 같애 겨울에는 특이하진 않지만,그렇 그러 약간 국밥 많이 먹는 거 같애 겨울에는 특이하진 않지만
약간 부산 사람들이면 다 먹는 거긴 하지만 그래도 국밥은 겨울에 빠질 수 없고,약간 부산 사람들이면 다 먹는 거긴 하지만 그래도 국밥은 겨울에 빠질 수 없고
네 그래서 국밥 많이 먹으러 다녔던 거 같애요.,네 그래서 국밥 많이 먹으러 다녔던 거 같애요.
그러고 가을 가을에는 대하?,그러고 가을 가을에는 대하?
대하가 가을이니까,대하가 가을이니까
대하 사 새우 먹는 거 또 좋아해 가지고 새우 많이 먹었던 거 같아요.,대하 사 새우 먹는 거 또 좋아해 가지고 새우 많이 먹었던 거 같아요.
