사투리,표준어
저는,저는
먼저 최근에 드렸던,먼저 최근에 드렸던
님이 다른 사람에게 최근에,님이 다른 사람에게 최근에
드렸던 선물이 무엇인지 여쭙고 싶은데,드렸던 선물이 무엇인지 여쭙고 싶은데
제 경험을 먼저 말씀드리자면,제 경험을 먼저 말씀드리자면
저는 오늘 그 선물을 전달을 했거든요?,저는 오늘 그 선물을 전달을 했거든요?
어~ 같이 일하시는 어~ 분이 계신데,어~ 같이 일하시는 어~ 분이 계신데
그분이 항상 집 갈 때 저를 차를 태워주세요.,그분이 항상 집 갈 때 저를 차를 태워주세요.
요즘에는 코로나 때문에 버스 타고 다니기도 약간 걱정스럽다고 하셔가지고,요즘에는 코로나 때문에 버스 타고 다니기도 약간 걱정스럽다고 하셔가지고
어~ 항상 차를 태워주시는데 가시는 길에,어~ 항상 차를 태워주시는데 가시는 길에
저를 내려주는 게 아니라 제 집이 쪼끔 더 돌아가야 되는 곳이라서,저를 내려주는 게 아니라 제 집이 쪼끔 더 돌아가야 되는 곳이라서
그게 너무 감사한데 죄송하더라고요.,그게 너무 감사한데 죄송하더라고요.
그래서 그거 겸 크리스마스 선물 겸,그래서 그거 겸 크리스마스 선물 겸
해서 따뜻한 털목도리를,해서 따뜻한 털목도리를
며칠 전에 백화점에서 사가지고,며칠 전에 백화점에서 사가지고
오늘 드려봤는데,오늘 드려봤는데
개봉하시는 건 못 봐가지구,개봉하시는 건 못 봐가지구
내일 착용하고 오시면은 어떨지 제가 너무 지금 쫌 기대되는 중이에요.,내일 착용하고 오시면은 어떨지 제가 너무 지금 조금 기대되는 중이에요.
그래서  님은 최근에 어떤 분께 어떤 선물 해드렸는지 궁금합니다.,그래서  님은 최근에 어떤 분께 어떤 선물 해드렸는지 궁금합니다.
사실 요새 최근에 선물을 한 적이 없는 거 같아요.,사실 요새 최근에 선물을 한 적이 없는 거 같아요.
어~ 대신,어~ 대신
오늘 뭘 받기는 했는데 제가 지금,오늘 뭘 받기는 했는데 제가 지금
저는 지금 대학생이거든요.,저는 지금 대학생이거든요.
학교 기말 시험이,학교 기말 시험이
이번 주 지난주 이번 주 다음 주 이렇게,이번 주 지난주 이번 주 다음 주 이렇게
십이월 내내 거의 내내 이제 기말시험이 이뤄지고 있는데,십이월 내내 거의 내내 이제 기말시험이 이뤄지고 있는데
기말 때문에 제가 기말 때문에도 그렇고,기말 때문에 제가 기말 때문에도 그렇고
코로나 때문에도 그렇고 여기는 지금 부산이거든요 그래서 너무 코로나가 기승이어서,코로나 때문에도 그렇고 여기는 지금 부산이거든요 그래서 너무 코로나가 기승이어서
집 밖을 못 나가겠는 거예요 정말 필요할 때 시험 치러 갈 때 빼고는,집 밖을 못 나가겠는 거예요 정말 필요할 때 시험 치러 갈 때 빼고는
그래서 어머니랑 전화를 하다가 그런 얘기가 나와서,그래서 어머니랑 전화를 하다가 그런 얘기가 나와서
걱정스럽다면서 이제 집으로 어~,걱정스럽다면서 이제 집으로 어~
버섯이랑 고구마랑 귤이랑 이런 것들을 선물해주셨더라구요 그래서,버섯이랑 고구마랑 귤이랑 이런 것들을 선물해주셨더라구요 그래서
음~ 되게 고맙구 감사하구 그런 생각이 들더라고요 사실,음~ 되게 고맙구 감사하구 그런 생각이 들더라고요 사실
인터넷으로 사는 거,인터넷으로 사는 거
내가 너 뭐~ 그냥 그거 인터넷으로 사면 되지 왜 그러냐 이런 식으로 하고 말았어도 되는데,내가 너 뭐~ 그냥 그거 인터넷으로 사면 되지 왜 그러냐 이런 식으로 하고 말았어도 되는데
그냥 그래서 그냥 선물이라고 생각하고 있습니다.,그냥 그래서 그냥 선물이라고 생각하고 있습니다.
어~ 뭐~ 어머니께서 주셨어도 그냥 뭐~,어~ 뭐~ 어머니께서 주셨어도 그냥 뭐~
대충 선물이구나 하면서,대충 선물이구나 하면서
좋게 생각하고 있습니다.,좋게 생각하고 있습니다.
최근에 누구한테 준 선물은 딱히 없는 거 같구요 예전에,최근에 누구한테 준 선물은 딱히 없는 거 같구요 예전에
중학생 때 친구한테 뭐 써주고,중학생 때 친구한테 뭐 써주고
얘기하고 그런 선물을,얘기하고 그런 선물을
얘기하고가 선물일 수 있나?,얘기하고가 선물일 수 있나?
제가 뭔가 물질적으로 어떤 선물을 주는 것보다는 그냥,제가 뭔가 물질적으로 어떤 선물을 주는 것보다는 그냥
저는 사실 항 같이 보내는 시간을 선물이라고 생각한 경우가 많아서,저는 사실 항 같이 보내는 시간을 선물이라고 생각한 경우가 많아서
그냥 불러내서 얘기하고 같이,그냥 불러내서 얘기하고 같이
고민얘 기하고 그런 거,고민얘 기하고 그런 거
생각해보고 그런 걸 선물처럼,생각해보고 그런 걸 선물처럼
선물 같은 시간을 보내는 걸 좋아합니다.,선물 같은 시간을 보내는 걸 좋아합니다.
음~,음~
저는 사실 약간 그런 걸 하고 싶거든요 선물 교환식 같은 거,저는 사실 약간 그런 걸 하고 싶거든요 선물 교환식 같은 거
근데 제 주변에 선물을 주고받는 걸,근데 제 주변에 선물을 주고받는 걸
즐겨하는 친구가 딱히 없어요.,즐겨하는 친구가 딱히 없어요.
선물을 주는 걸 약간 판촉물처럼,선물을 주는 걸 약간 판촉물처럼
정말 예를 갖춰야 하는 상대나,정말 예를 갖춰야 하는 상대나
정말,정말
꼭 필요할 때 약간 친구보다는 지인한테 주는 걸 선물이라고 생각을 하더라고요.,꼭 필요할 때 약간 친구보다는 지인한테 주는 걸 선물이라고 생각을 하더라고요.
친구랑은 뭔가 전화 통화라던지 서로 얘기를 나눈다던지 공감을 한다던지,친구랑은 뭔가 전화 통화라던지 서로 얘기를 나눈다던지 공감을 한다던지
하는 게 선물의 역할이라고 생각하더라고요.,하는 게 선물의 역할이라고 생각하더라고요.
그래서 선물 교환식 같은 걸 하고 싶다고 늘 생각은 하는데 올해는 코로나도 그렇고 딱히 제 주변에 그런 걸,그래서 선물 교환식 같은 걸 하고 싶다고 늘 생각은 하는데 올해는 코로나도 그렇고 딱히 제 주변에 그런 걸
좋아하는 친구가 없어서 쫌 아쉬워요.,좋아하는 친구가 없어서 조금 아쉬워요.
혹시 선물 교환식 해보신 적 있으신가요?,혹시 선물 교환식 해보신 적 있으신가요?
저는 선물 교환식이라는 그런 이름 하에,저는 선물 교환식이라는 그런 이름 하에
누군가와 선물을 교환한 적은 없어요 그러니까 우리 선물 사 와서 이렇게 교환해볼래?,누군가와 선물을 교환한 적은 없어요 그러니까 우리 선물 사 와서 이렇게 교환해볼래?
이렇게 제안을 하거나 제안을 받아서 그렇게 선물을 해본 적은 없고,이렇게 제안을 하거나 제안을 받아서 그렇게 선물을 해본 적은 없고
일반적으로 다들 기념일이나 생일이나 시험 끝났을 때,일반적으로 다들 기념일이나 생일이나 시험 끝났을 때
쫌 중요한 날에 선물을 하잖아요?,조금 중요한 날에 선물을 하잖아요?
그래서 저도 그래 선물을 해봤고 그때 선물을 받아봤는데,그래서 저도 그래 선물을 해봤고 그때 선물을 받아봤는데
어~ 제가 받았던 거 중에 쫌 인상적이었던 선물이 어떤 거였는지 말씀드리면,어~ 제가 받았던 거 중에 조금 인상적이었던 선물이 어떤 거였는지 말씀드리면
몇 가지가 있는데 제 친구 중에,몇 가지가 있는데 제 친구 중에
선물을 꼭  서프라이즈로 주는 걸 좋아하는 친구가 있어요.,선물을 꼭  서프라이즈로 주는 걸 좋아하는 친구가 있어요.
제가 대학교 일 학년 때,제가 대학교 일 학년 때
그때는 대학교 일 학년이니까 백화점에서 화장품 사는 게 되게 비쌌거든요?,그때는 대학교 일 학년이니까 백화점에서 화장품 사는 게 되게 비쌌거든요?
근데 그 친구가,근데 그 친구가
이제 저를 백화점에 같이 데리고 가서,이제 저를 백화점에 같이 데리고 가서
그때 선물 준다 이런 말 없었어요.,그때 선물 준다 이런 말 없었어요.
그냥 어떤 백화점 매장에서,그냥 어떤 백화점 매장에서
저한테 나 누구누구한테,저한테 나 누구누구한테
그 이거 선물해줄 건데 색깔 좀 같이 골라줘 이렇게 얘기를 하는 거예요.,그 이거 선물해줄 건데 색깔 좀 같이 골라줘 이렇게 얘기를 하는 거예요.
그래서 제가 열심히 골라줬죠 어~ 이게 괜찮을 거 같은데 이게 무난할 거 같은데 하면서,그래서 제가 열심히 골라줬죠 어~ 이게 괜찮을 거 같은데 이게 무난할 거 같은데 하면서
그래 내가 그 친구가 엄청 자연스럽게,그래 내가 그 친구가 엄청 자연스럽게
아~ 그럼 니가 발라보는 거 보고 쫌 괜찮은 거 골라야겠다 이렇게 얘기를 하더라고요?,아~ 그럼 네가 발라보는 거 보고 조금 괜찮은 거 골라야겠다 이렇게 얘기를 하더라고요?
그래서 제가 어~ 이거 발라보고 이 색깔 난 괜찮다 난 이거 마음에 든다 이렇게 얘기를 하니까 그 친구가,그래서 제가 어~ 이거 발라보고 이 색깔 난 괜찮다 난 이거 마음에 든다 이렇게 얘기를 하니까 그 친구가
결제를 하고 딱 저한테 주더라고요 야 이거 선물이야 하면서,결제를 하고 딱 저한테 주더라고요 야 이거 선물이야 하면서
그래서 그 제품이 고마운 것도 있지만 사실은,그래서 그 제품이 고마운 것도 있지만 사실은
그 친구가 뭔가 저한테 그런 이벤트성으로 선물을 해준 기억이,그 친구가 뭔가 저한테 그런 이벤트성으로 선물을 해준 기억이
아직도 되게 인상 깊게 기억에 남고,아직도 되게 인상 깊게 기억에 남고
뭔가 내가 예상하지 못했을 때,뭔가 내가 예상하지 못했을 때
그런 식으로 선물을 받으면  그게 되게 고마운,그런 식으로 선물을 받으면  그게 되게 고마운
즐거운 기억으로 남는 거 같애요.,즐거운 기억으로 남는 거 같애요.
또 하나는,또 하나는
그 같은 친구인데,그 같은 친구인데
이거는 서프라이즈라서 기억에 남는 건 아니고,이거는 서프라이즈라서 기억에 남는 건 아니고
어~ 무드등을 그 친구가 선물로 줬고 또,어~ 무드등을 그 친구가 선물로 줬고 또
디퓨저를 선물로 줬는데 이 두 개가 항상 제 침대 머리맡에 있거든요.,디퓨저를 선물로 줬는데 이 두 개가 항상 제 침대 머리맡에 있거든요.
그래서,그래서
뭔가 이렇게 항상 생활 초 밀착형으로 쓸 수 있는 선물을 주면,뭔가 이렇게 항상 생활 초 밀착형으로 쓸 수 있는 선물을 주면
그사람이 되게 잘 생각이 나겠다하는 생각이 들어서,그사람이 되게 잘 생각이 나겠다하는 생각이 들어서
그런 선물을 다음에 나도 줘봐야지,그런 선물을 다음에 나도 줘봐야지
하는 생각을 했던 그런 기억이 있어요.,하는 생각을 했던 그런 기억이 있어요.
그래서 혹시  아니  님,그래서 혹시  아니  님
혹시 어떤 선물 받았을 때 제일 기분이 좋았는지 기억에 남는 경험 있으신가요?,혹시 어떤 선물 받았을 때 제일 기분이 좋았는지 기억에 남는 경험 있으신가요?
저는 사실,저는 사실
기억에 남을 만한 선물을,기억에 남을 만한 선물을
나 그냥 이거 선물로 사줘 이때 나 뭐 해줄 거지 이때 그냥 이거 사줘라는 식으로 주로 얘기를 하는 편이에요 서로,나 그냥 이거 선물로 사줘 이때 나 뭐 해줄 거지 이때 그냥 이거 사줘라는 식으로 주로 얘기를 하는 편이에요 서로
그냥 친구들이랑은 어떤 친구들이랑은 그냥 생일선물은 서로,그냥 친구들이랑은 어떤 친구들이랑은 그냥 생일선물은 서로
날짜 챙기 일일이 챙기기 힘드니까 그냥,날짜 챙기 일일이 챙기기 힘드니까 그냥
서로 안 주고 안 받기도 하고 그냥 필요할 때,서로 안 주고 안 받기도 하고 그냥 필요할 때
서로 그냥 얘기하고 싶을 때,서로 그냥 얘기하고 싶을 때
각자 시간 널널할 때 전화해서,각자 시간 널널할 때 전화해서
어떻게 사는지 얘기하고 그냥,어떻게 사는지 얘기하고 그냥
응 그런 식이구요.,응 그런 식이구요.
선물을,선물을
가장 기억에 남는 거는,가장 기억에 남는 거는
제가 가장 기역에 쪼끔 어이가 없어서 가장 기억에 남는 건데,제가 가장 기역에 쪼끔 어이가 없어서 가장 기억에 남는 건데
저희 큰엄마가,저희 큰엄마가
제가 어른 딱 스무 살 되고 나서,제가 어른 딱 스무 살 되고 나서
이제 대학 합격하고 막 그러고 있을 때,이제 대학 합격하고 막 그러고 있을 때
뭐~ 선물이라면서 뭐~ 선물이라면서 주시진 않았고,뭐~ 선물이라면서 뭐~ 선물이라면서 주시진 않았고
뭐~ 저 방에 방 안에 가방 하나 있는데 그거 니 가져라 뭐~ 이런 식으로 하시는 거예요.,뭐~ 저 방에 방 안에 가방 하나 있는데 그거 너 가져라 뭐~ 이런 식으로 하시는 거예요.
근데 그게 되게 어~,근데 그게 되게 어~
아마 나중에 그거를 이제 어머니께서 말씀하시기는,아마 나중에 그거를 이제 어머니께서 말씀하시기는
싼 맛에 샀는데 자기가 들기에는 너무 싼 티 나서 너무 애 같아서,싼 맛에 샀는데 자기가 들기에는 너무 싼 티 나서 너무 애 같아서
그냥 니 줬나보다 뭐~ 그냥 이런 식으로 얘기하셨거든요 근데,그냥 너 줬나보다 뭐~ 그냥 이런 식으로 얘기하셨거든요 근데
뭐~ 제가 선물이에요 와 이러면서 큰엄마한테 되게,뭐~ 제가 선물이에요 와 이러면서 큰엄마한테 되게
치댔었는데 큰엄마는,치댔었는데 큰엄마는
아~ 그게 선물이라기엔 쫌 그렇게 뭐~ 이러셨었는데 그런 비하인드 스토리가 있었더라구요.,아~ 그게 선물이라기엔 조금 그렇게 뭐~ 이러셨었는데 그런 비하인드 스토리가 있었더라구요.
그리고 까보니까,그리고 까보니까
실제로 제가 들고 다니기에도 쫌 애매한 가방이었어요.,실제로 제가 들고 다니기에도 조금 애매한 가방이었어요.
그리고 기본적으로 저는,그리고 기본적으로 저는
갖고 다니는 게 많아서,갖고 다니는 게 많아서
크로스백을 쓰지 않는데,크로스백을 쓰지 않는데
그게 아주 손바닥만한 크로스백이었거든요.,그게 아주 손바닥만한 크로스백이었거든요.
핸드폰이랑 지갑 들어가면 끝나는,핸드폰이랑 지갑 들어가면 끝나는
그런 크로스백이었고 제가 메기에도 너무 유치한 색감이라서,그런 크로스백이었고 제가 메기에도 너무 유치한 색감이라서
쫌,조금
아~ 주신 건 감사한데 왜 사셨지 이런 생각이 드는,아~ 주신 건 감사한데 왜 사셨지 이런 생각이 드는
그래서 인상 깊은 선물이긴 합니다.,그래서 인상 깊은 선물이긴 합니다.
받았는데 정말 어이없었던 선물 있으신가요 쪼끔 실망했다거나,받았는데 정말 어이없었던 선물 있으신가요 쪼끔 실망했다거나
선물 받은 거 중에,선물 받은 거 중에
어이없다거나,어이없다거나
실망스러웠던 선물은,실망스러웠던 선물은
이걸 막 저도 말씀하신 것처럼 야 이거 선물이야 하면서 주신 건 아니고,이걸 막 저도 말씀하신 것처럼 야 이거 선물이야 하면서 주신 건 아니고
뭔가 이것도 제가 어른한테 받은 선물인데,뭔가 이것도 제가 어른한테 받은 선물인데
어~ 아버지 아는 분께서,어~ 아버지 아는 분께서
저를 다른 지역에서 우연히 만났는데,저를 다른 지역에서 우연히 만났는데
옷가게에 가서 옷을 사주셨거든요?,옷가게에 가서 옷을 사주셨거든요?
그분이 엄청 좋은 마음으로 하신 일이긴 한데,그분이 엄청 좋은 마음으로 하신 일이긴 한데
그리고 그것도 저한테는 선물이긴 하죠?,그리고 그것도 저한테는 선물이긴 하죠?
근데,근데
어~ 그렇게 제 마음에 쏙 들지 않는 옷이었는데,어~ 그렇게 제 마음에 쏙 들지 않는 옷이었는데
입어보라 해서 일단 어거지로 입어보고,입어보라 해서 일단 어거지로 입어보고
이모가 혼자 막 박수를 치시면서 너무 잘 어울린다고 그러시는 거예요.,이모가 혼자 막 박수를 치시면서 너무 잘 어울린다고 그러시는 거예요.
그 제가 머쓱하게 아~ 네 그래요 하면서 이래 요러고 있었어요.,그 제가 머쓱하게 아~ 네 그래요 하면서 이래 요러고 있었어요.
그러니까 이모가 갑자기,그러니까 이모가 갑자기
그 옷만 선물해주시는 게 아니라,그 옷만 선물해주시는 게 아니라
그 옷과 똑같은 색깔인데 다른 디자인 아~ 아니지,그 옷과 똑같은 색깔인데 다른 디자인 아~ 아니지
똑같은 디자인인데 다른 색깔의 옷 그러니까 총 같은 옷 두 벌을 저한테,똑같은 디자인인데 다른 색깔의 옷 그러니까 총 같은 옷 두 벌을 저한테
결제해서 선물로 바로 주셨거든요.,결제해서 선물로 바로 주셨거든요.
근데 그게 물론 엄청 감사한 일이긴 하지만,근데 그게 물론 엄청 감사한 일이긴 하지만
약간,약간
내 돈 쓴 것도 아닌데 강매한 기분이 약간 들었고,내 돈 쓴 것도 아닌데 강매한 기분이 약간 들었고
사실 그 옷을 받고 나서 한 번도 못 입고 그냥 지금 옷장에 뒀거든요.,사실 그 옷을 받고 나서 한 번도 못 입고 그냥 지금 옷장에 뒀거든요.
그래서 아무리 좋은 마음에 해도 내가 쓰지 못하고 쫌 마음에 안 드는 선물은 받아도,그래서 아무리 좋은 마음에 해도 내가 쓰지 못하고 조금 마음에 안 드는 선물은 받아도
짐스럽다는 생각을 쫌 하게 됐었어요.,짐스럽다는 생각을 조금 하게 됐었어요.
그래서 선물을 줄 때도 쫌 더 조심하게 되는 것도 있는 거 같구요.,그래서 선물을 줄 때도 조금 더 조심하게 되는 것도 있는 거 같구요.
그러면 혹시  님은,그러면 혹시  님은
선물을 주실 때,선물을 주실 때
아~ 선물을 만약에  님이 받는다고 하시면,아~ 선물을 만약에  님이 받는다고 하시면
어~ 요즘에는 쫌,어~ 요즘에는 조금
쓸데없는 선물 이런 거 많이 주잖아요 요즘에 이게 유행하는 거 중에 약간,쓸데없는 선물 이런 거 많이 주잖아요 요즘에 이게 유행하는 거 중에 약간
돈 줘도 안 줄 돈 주고도 안 살 거 같은 그런 선물을 주는 유행 그런 게 있잖아요.,돈 줘도 안 줄 돈 주고도 안 살 거 같은 그런 선물을 주는 유행 그런 게 있잖아요.
그래서 그거 생각나서 하는 질문인데,그래서 그거 생각나서 하는 질문인데
내가 받았을 때 정말 유용한 게 있고,내가 받았을 때 정말 유용한 게 있고
아니면 내가 예쁜데,아니면 내가 예쁜데
굳이 내 돈 주고 사고 싶진 않은 그런 것들이 있잖아요?,굳이 내 돈 주고 사고 싶진 않은 그런 것들이 있잖아요?
완전 실용적인 제품과 예쁜데 약간,완전 실용적인 제품과 예쁜데 약간
쫌 그렇게 실용적이진 않은 제품,조금 그렇게 실용적이진 않은 제품
둘 중에 만약에 선물로 받는다면 어떤 게 쫌 더 좋으신가요?,둘 중에 만약에 선물로 받는다면 어떤 게 조금 더 좋으신가요?
저는 사실 예쁜 걸 별로 신경 쓰지 않습니다.,저는 사실 예쁜 걸 별로 신경 쓰지 않습니다.
그래서 무조건 실용적인 게 좋아요.,그래서 무조건 실용적인 게 좋아요.
제가 기본적으로 디자인적인 감각이 별로 없어서,제가 기본적으로 디자인적인 감각이 별로 없어서
뭐~ 진행하거나 할 때도,뭐~ 진행하거나 할 때도
무조건 디자인팀이 따로 있어야 하거든요.,무조건 디자인팀이 따로 있어야 하거든요.
그래서 저는 줄 때도 그렇고 받을 때도 그렇고,그래서 저는 줄 때도 그렇고 받을 때도 그렇고
완전 생활 밀착형인 물건들만 주고받는 거 같아요.,완전 생활 밀착형인 물건들만 주고받는 거 같아요.
딱히 예쁜 쓰레기라고 하죠.,딱히 예쁜 쓰레기라고 하죠.
예 뭔가 예쁜데 실제로 뭔가 실용성은 없는,예 뭔가 예쁜데 실제로 뭔가 실용성은 없는
근데 보고 있으면 기분 좋은 뭔가 귀엽고 예쁘고 그런 것들을,근데 보고 있으면 기분 좋은 뭔가 귀엽고 예쁘고 그런 것들을
제가 딱히 거기에 강하게 끌리지 않는 거 같아요.,제가 딱히 거기에 강하게 끌리지 않는 거 같아요.
그래서 주로 실용적인 것들만 주고받습니다.,그래서 주로 실용적인 것들만 주고받습니다.
응 무조건 실용적인 게 저는,응 무조건 실용적인 게 저는
제가 그런 걸 많이 주기도 하 제가 준다면 주로 실용적인 것들이고 받는 것도,제가 그런 걸 많이 주기도 하 제가 준다면 주로 실용적인 것들이고 받는 것도
받는 거는 약간 케바케인 거 같애요 주는 사람이 예쁜 걸 좋아하는 사람이면은 예쁜 걸 주기도 하더라고요 근데,받는 거는 약간 케바케인 거 같애요 주는 사람이 예쁜 걸 좋아하는 사람이면은 예쁜 걸 주기도 하더라고요 근데
어~ 약간 자리 차지만 해서,어~ 약간 자리 차지만 해서
주변에 그냥 약간 제가,주변에 그냥 약간 제가
저희 집에 티비가 있긴 한데 저는 티비를 안 보거든요 그래서 약간 티비 같은 존재가 되는 거 같아요.,저희 집에 티비가 있긴 한데 저는 티비를 안 보거든요 그래서 약간 티비 같은 존재가 되는 거 같아요.
그냥 티비 옆에 이렇게,그냥 티비 옆에 이렇게
놓아두는,놓아두는
그렇습니다 제가,그렇습니다 제가
저희 자취방에 에어프라이기가 있는데,저희 자취방에 에어프라이기가 있는데
뭐 해 먹을 때마다 설거지하기가 너무 귀찮더라구요 그래서,뭐 해 먹을 때마다 설거지하기가 너무 귀찮더라구요 그래서
제가 사실 요즘에 선물 받고 싶은 거는 에어 프라이기 안에 까는,제가 사실 요즘에 선물 받고 싶은 거는 에어 프라이기 안에 까는
뭐라고 해야 되지 유산지?,뭐라고 해야 되지 유산지?
그런 종이 호일 같은 걸 너무,그런 종이 호일 같은 걸 너무
선물 받고 싶거든요 왜냐면 제가,선물 받고 싶거든요 왜냐면 제가
근데 그걸 요새 나가서 사기는 쫌 애매하고,근데 그걸 요새 나가서 사기는 조금 애매하고
그렇다고 해서 그거 하나 사자고 배송비까지 다 부담하기에는 쫌 돈이 아까운 거예요.,그렇다고 해서 그거 하나 사자고 배송비까지 다 부담하기에는 조금 돈이 아까운 거예요.
그래서 아~ 이런 거 누가 선물로 주면 딱 좋겠다라는 생각을 요새 하고 있는데,그래서 아~ 이런 거 누가 선물로 주면 딱 좋겠다라는 생각을 요새 하고 있는데
혹시 요새 선물 받는다면 받고 싶은 선물 있으신가요?,혹시 요새 선물 받는다면 받고 싶은 선물 있으신가요?
제가 선물로 받는다면,제가 선물로 받는다면
전 일단 요즘 너무 건조함을 많이 느껴서 지금 가습기를,전 일단 요즘 너무 건조함을 많이 느껴서 지금 가습기를
구매를 해야 되나 고민 중이거든요 그래서 누가 저한테,구매를 해야 되나 고민 중이거든요 그래서 누가 저한테
실용적이고 고가의 좋은 가습기를 선물해준다면 너무 행복할 거 같구요.,실용적이고 고가의 좋은 가습기를 선물해준다면 너무 행복할 거 같구요.
또 제가,또 제가
요즘에 쫌 겨울옷을 많이 사고 있는데,요즘에 조금 겨울옷을 많이 사고 있는데
아무래도 겨울옷이 돈 주고 사기에 돈이 쫌 많이 들어가는 제품들이잖아요.,아무래도 겨울옷이 돈 주고 사기에 돈이 조금 많이 들어가는 제품들이잖아요.
그래 이것도,그래 이것도
누가 정말 통 크게 몇십만 원씩,누가 정말 통 크게 몇십만 원씩
써서 겨울옷 사준다면 정말 너무 좋을 거 같애요.,써서 겨울옷 사준다면 정말 너무 좋을 거 같애요.
네 이건 정말 이루어지지 않을 저의 그냥 바람이구요.,네 이건 정말 이루어지지 않을 저의 그냥 바람이구요.
어~ 종이 호일 선물 받고 싶다고 하셨는데,어~ 종이 호일 선물 받고 싶다고 하셨는데
